index,url,valid,domain,title,description,image,published,archive,content,quote,language,keyword
https://www.n-tv.de/sport/Koenig-Fussball-drueckt-Skispringer-auf-gruene-Matten-article23690847.html,https://www.n-tv.de/sport/Koenig-Fussball-drueckt-Skispringer-auf-gruene-Matten-article23690847.html,0,www.n-tv.de,Saisonauftakt im Klimawandel: König Fußball drückt Skispringer auf grüne Matten,Erstmals auf Matten statt Schnee beginnt am Wochenende die Skisprung-Saison. Angesichts von Klimawandel und Energiekrise ist das Ambiente auch ein Fingerzeig. Es könnte dem Sport ganz neue Möglichkeiten eröffnen.  Wie wäre es denn mit einem Springen in Katar?,https://bilder3.n-tv.de/img/incoming/crop23690774/7051323952-cImg_16_9-w1200/imago1013347940h.jpg,2022-11-02T18:16:30Z,,Erstmals auf Matten statt Schnee beginnt am Wochenende die Skisprung-Saison. Angesichts von Klimawandel und Energiekrise ist das Ambiente auch ein Fingerzeig. Es könnte dem Sport ganz neue Möglichkei… [+2866 chars],,de,'Schnee'
https://www.spiegel.de/sport/fussball/toni-kroos-will-bei-real-madrid-bleiben-ich-werde-meine-karriere-hier-beenden-ich-weiss-nur-noch-nicht-wann-a-a8082cac-e1f6-41df-8c1f-19aba364d4fa,https://www.spiegel.de/sport/fussball/toni-kroos-will-bei-real-madrid-bleiben-ich-werde-meine-karriere-hier-beenden-ich-weiss-nur-noch-nicht-wann-a-a8082cac-e1f6-41df-8c1f-19aba364d4fa,0,www.spiegel.de,"Toni Kroos will bei Real Madrid bleiben: »Ich werde meine Karriere hier beenden, ich weiß nur noch nicht, wann«","Seit 2014 spielt Ex-Nationalspieler Toni Kroos im Mittelfeld von Real Madrid, sein Vertrag läuft nur noch bis zum Saisonende. Einen Wechsel schloss Kroos nun aus – ein Karriereende aber nicht.",https://cdn.prod.www.spiegel.de/images/9f0b09c7-5db9-4969-9bb6-60718728a6f3_w1280_r1.77_fpx30_fpy50.98.jpg,2022-11-01T18:47:22Z,,"Weltmeister und fünffacher Champions-League-Sieger
Die wichtigsten Titel im Profifußball hat Kroos bereits gewonnen zum Teil mehrfach. Mit dem FC Bayern München (Saison 2012/13) und viermal mit Real… [+582 chars]",,de,'Sommer'
https://www.spiegel.de/politik/deutschland/gaspreisbremse-jens-spahn-und-andreas-jung-kritisieren-plaene-der-ampel-a-16b0ce38-c6ef-44ac-8fe6-7ada3d34a31b,https://www.spiegel.de/politik/deutschland/gaspreisbremse-jens-spahn-und-andreas-jung-kritisieren-plaene-der-ampel-a-16b0ce38-c6ef-44ac-8fe6-7ada3d34a31b,0,www.spiegel.de,Gaspreisbremse: Jens Spahn und Andreas Jung kritisieren Pläne der Ampel,"Zu spät, zu kompliziert, zu wenig: Die Union übt massive Kritik an den Regierungsplänen für die Gaspreisbremse. Fraktionsvize Spahn und CDU-Parteivize Jung werfen der Ampel vor, etliche Menschen vergessen zu haben.",https://cdn.prod.www.spiegel.de/images/5638aff2-b486-4cf3-9da4-ed9ccb412a10_w1280_r1.77_fpx43.23_fpy44.98.jpg,2022-11-02T12:10:05Z,,"Auch Unionsparteivize Andreas Jung übt Kritik: »Weil wegen Bummeln der Ampel im Sommer die Gaspreisbremse erst im März kommt, wird für den Winter hektisch eine doppelte Notlösung präsentiert.« Es wer… [+699 chars]",,de,'Sommer'
https://www.focus.de/auto/hohes-bussgeld-droht-mildes-wetter-bei-20-grad-darum-sollten-sie-jetzt-ihre-winterreifen-wechseln_id_175410629.html,https://www.focus.de/auto/hohes-bussgeld-droht-mildes-wetter-bei-20-grad-darum-sollten-sie-jetzt-ihre-winterreifen-wechseln_id_175410629.html,0,www.focus.de,Hohes Bußgeld droht - Mildes Wetter bei 20 Grad - darum sollten Sie jetzt Ihre Winterreifen wechseln,Wärmerekord bei 20 Grad und das Anfang November? Bei den milden Temperaturen denken wenige Autofahrende an die bekannte Faustregel „O bis O“ beim Reifenwechsel. Stattdessen fahren sie mit den Sommerreifen weiter. Doch ist das überhaupt erlaubt? FOCUS online k…,https://p6.focus.de/img/finanzen/news/id_144662703/winterreifen-werden-deutlich-teurer..jpg?im=Crop%3D%280%2C191%2C2048%2C1024%29%3BResize%3D%281200%2C627%29&impolicy=perceptual&quality=medium&hash=b2e27371729d2f224c789d3b008e80f1f884da2790304c6e5cf30134c505d07c,2022-11-02T11:14:43Z,,Wärmerekord bei 20 Grad und das Anfang November? Bei den milden Temperaturen denken wenige Autofahrende an die bekannte Faustregel O bis O beim Reifenwechsel. Stattdessen fahren sie mit den Sommerrei… [+5543 chars],,de,'Glatteis'
https://www.brigitte.de/aktuell/ann-kathrin-goetze--das-sind-ihre-fashion-trends-fuer-den-herbst-13418978.html,https://www.brigitte.de/aktuell/ann-kathrin-goetze--das-sind-ihre-fashion-trends-fuer-den-herbst-13418978.html,0,www.brigitte.de,Ann-Kathrin Götze: Das sind ihre Fashion-Trends für den Herbst,Als Fashion-Influencerin kennt sich Ann-Kathrin Götze in Sachen Mode bestens aus. Das sind ihre aktuellen Fashion-Trends.,https://image.brigitte.de/13418980/t/5A/v1/w1440/r1.7778/-/04--das-sind-ihre-fashion-trends-fuer-den-herbst---1-1---spoton-article-1032279.jpg,2022-11-04T08:11:00Z,,"Als Fashion-Influencerin kennt sich Ann-Kathrin Götze in Sachen Mode bestens aus. Das sind ihre aktuellen Fashion-Trends.
Ann-Kathrin Götze (32) liebt es, modisch zu experimentieren und neue Stilric… [+4145 chars]",,de,'Herbst'
https://www.stern.de/lifestyle/leute/ann-kathrin-goetze--auf-diese-fashion-trends-setzt-sie-im-herbst-32878884.html,https://www.stern.de/lifestyle/leute/ann-kathrin-goetze--auf-diese-fashion-trends-setzt-sie-im-herbst-32878884.html,0,www.stern.de,Ann-Kathrin Götze: Auf diese Fashion-Trends setzt sie im Herbst,Als Fashion-Influencerin kennt sich Ann-Kathrin Götze in Sachen Mode bestens aus. Das sind ihre aktuellen Fashion-Trends.,https://image.stern.de/32878888/t/7R/v1/w1440/r1.7778/-/04--auf-diese-fashion-trends-setzt-sie-im-herbst---16-9---spoton-article-1032279.jpg,2022-11-04T08:09:00Z,,"Als Fashion-Influencerin kennt sich Ann-Kathrin Götze in Sachen Mode bestens aus. Das sind ihre aktuellen Fashion-Trends.
Ann-Kathrin Götze (32) liebt es, modisch zu experimentieren und neue Stilric… [+4145 chars]",,de,'Herbst'
https://www.brigitte.de/leben/deals-des-tages--magic-finish-foundation-von-m--asam-23--guenstiger-13339346.html,https://www.brigitte.de/leben/deals-des-tages--magic-finish-foundation-von-m--asam-23--guenstiger-13339346.html,0,www.brigitte.de,Deals des Tages: Magic Finish Foundation von M. Asam im Set jetzt 23% günstiger,"Die Schnäppchenjagd kann ermüdend sein. Nicht mit uns! Mit unseren Deals des Tages geben wir euch eine einfache und schnelle Übersicht, welche Angebote heute wirklich einen dicken Rabatt bringen.",https://image.brigitte.de/13418956/t/kG/v1/w1440/r1.7778/-/foundation.jpg,2022-11-04T07:47:00Z,,"Die Schnäppchenjagd kann ermüdend sein. Nicht mit uns! Mit unseren Deals des Tages geben wir euch eine einfache und schnelle Übersicht, welche Angebote heute wirklich einen dicken Rabatt bringen. 
I… [+6759 chars]",,de,'Herbst'
https://www.nzz.ch/sport/sport-der-fc-basel-schafft-es-in-die-ko-phase-der-conference-league-die-zsc-lions-siegen-im-jura-ld.1566300,https://www.nzz.ch/sport/sport-der-fc-basel-schafft-es-in-die-ko-phase-der-conference-league-die-zsc-lions-siegen-im-jura-ld.1566300,0,www.nzz.ch,KURZMELDUNGEN - Sport: Der FC Basel schafft es in die K.o.-Phase der Conference League +++ Die ZSC Lions siegen im Jura,Bernhard Aregger hört als Geschäftsführer von Swiss Ski auf. Deutschland an der Fussball-WM ohne Timo Werner. Die wichtigsten Sportmeldungen im Überblick.,"https://img.nzz.ch/2022/11/03/60f542d8-f2e4-4f7c-8f52-c9290c272d83.jpeg?width=1200&height=675&fit=bound&quality=75&auto=webp&crop=2124,1195,x265,y0&wmark=nzz",2022-11-04T07:40:02Z,,"Fussball: Der FC Basel schafft es in die K.o.-Phase der Conference League 
Der FCB-Coach Alex Frei feiert mit seinem Team den Sieg gegen Erewan in Armenien. 
(sda) Der FC Basel hat den Vorstoss in … [+11907 chars]",,de,'Herbst'
https://www.nzz.ch/sport/sport-der-fc-basel-schafft-es-in-die-ko-phase-der-conference-league-gerard-pique-tritt-zurueck-ld.1566300,https://www.nzz.ch/sport/sport-der-fc-basel-schafft-es-in-die-ko-phase-der-conference-league-gerard-pique-tritt-zurueck-ld.1566300,0,www.nzz.ch,KURZMELDUNGEN - Sport: Der FC Basel schafft es in die K.o.-Phase der Conference League +++ Gerard Piqué tritt zurück,Die wichtigsten Sportmeldungen im Überblick.,"https://img.nzz.ch/2022/11/03/60f542d8-f2e4-4f7c-8f52-c9290c272d83.jpeg?width=1200&height=675&fit=bound&quality=75&auto=webp&crop=2124,1195,x265,y0&wmark=nzz",2022-11-04T07:31:42Z,,"Fussball: Der FC Basel schafft es in die K.o.-Phase der Conference League 
Der FCB-Coach Alex Frei feiert mit seinem Team den Sieg gegen Erewan in Armenien. 
(sda) Der FC Basel hat den Vorstoss in … [+13146 chars]",,de,'Herbst'
https://taz.de/SPD-Debattenkonvent-am-Wochenende/!5892777/,https://taz.de/SPD-Debattenkonvent-am-Wochenende/!5892777/,0,taz.de,SPD-Debattenkonvent am Wochenende: Reizthemen China und Steuern,Die SPD will mit einem Debattenkonvent in Berlin die Basis beteiligen. Im Mittelpunkt sollen die Energiewende und der digitale Wandel stehen.,https://taz.de/picture/5890218/948/SPD-Debattenkonvent-1.jpeg,2022-11-04T07:29:00Z,,"Die SPD will mit einem Debattenkonvent in Berlin die Basis beteiligen. Im Mittelpunkt sollen die Energiewende und der digitale Wandel stehen.
Am Samstag treffen sich rund 700 GenossInnen in Berlin-N… [+3583 chars]",,de,'Herbst'
https://www.mobiflip.de/shortnews/n26-diese-neuerungen-gab-es-in-der-letzten-zeit/,https://www.mobiflip.de/shortnews/n26-diese-neuerungen-gab-es-in-der-letzten-zeit/,0,www.mobiflip.de,N26: Diese Neuerungen gab es in der letzten Zeit,"Die Bank N26 hat aktuell in einer Zusammenfassung verkündet, welche neuen Funktionen zuletzt implementiert wurden. Da N26 Neuerungen oftmals schrittweise oder nur für einen begrenzten […]",https://i0.wp.com/www.mobiflip.de/wp-content/uploads/2020/12/n26.jpg?fit=1200%2C750&ssl=1,2022-11-04T06:33:45Z,,"Die Bank N26 hat aktuell in einer Zusammenfassung verkündet, welche neuen Funktionen zuletzt implementiert wurden.
Da N26 Neuerungen oftmals schrittweise oder nur für einen begrenzten Nutzerkreis ei… [+850 chars]",,de,'Herbst'
https://www.horizont.net/medien/nachrichten/faw-chef-thaesler-im-interview-ohne-partner-hat-google-in-der-aussenwerbung-keine-chance-203904?utm_source=rss&utm_medium=referral&utm_campaign=news,https://www.horizont.net/medien/nachrichten/faw-chef-thaesler-im-interview-ohne-partner-hat-google-in-der-aussenwerbung-keine-chance-203904?utm_source=rss&utm_medium=referral&utm_campaign=news,0,www.horizont.net,"FAW-Chef Thäsler im Interview: ""Ohne Partner hat Google in der Außenwerbung keine Chance""","© Mara Monetti für HORIZONT
 Die einzige Gattung, die die Folgen des Krieges in der Ukraine bislang ganz konkret zu spüren bekommt, ist die Außenwerbung. Um Energie zu sparen, bleibt das Licht der Werbeträger laut Gesetz von 22 bis 6 Uhr aus. Dass es nicht s…",https://www.horizont.net/news/media/40/FAW_Kai-Marcus-Thsler-390013.jpeg,2022-11-04T06:00:00Z,,"Herr Thäsler, erst die Pandemie, jetzt der Krieg in der Ukraine und die beginnende Wirtschaftskrise: Wie geht es der Außenwerbung im Herbst 2022? Wir müssen abwarten, wie sich das sinkende Konsumklim… [+24 chars]",,de,'Herbst'
https://www.focus.de/gesundheit/news/news-zur-corona-pandemie-rki-registriert-56-635-corona-neuinfektionen-inzidenz-bei-290-1_id_120465127.html,https://www.focus.de/gesundheit/news/news-zur-corona-pandemie-rki-registriert-56-635-corona-neuinfektionen-inzidenz-bei-290-1_id_120465127.html,0,www.focus.de,"News zur Corona-Pandemie - RKI registriert 56.635 Corona-Neuinfektionen - Inzidenz bei 290,1","RKI registriert 56.635 Corona-Neuinfektionen - Inzidenz bei 290,1, doch das RKI warnt vor Leichtsinn. Der Rückgang der Corona-Zahlen seien womöglich nur vorübergehend. Alle aktuellen News finden Sie im Corona-Ticker auf FOCUS online.",https://p6.focus.de/img/fotos/id_175469253/kita.jpg?im=Crop%3D%280%2C16%2C512%2C256%29%3BResize%3D%281200%2C627%29&impolicy=perceptual&quality=medium&hash=7a1931ae53908899e2946e433b2a0d09c787a07a21141ff960d7b90dff6bdbde,2022-11-04T05:45:30Z,,"News zu Corona vom 4. November 2022
RKI registriert 56.635 Corona-Neuinfektionen - Inzidenz bei 290,1
05:19 Uhr: Das Robert Koch-Institut (RKI) hat die bundesweite Sieben-Tage-Inzidenz am Freitagmo… [+13368 chars]",,de,'Herbst'
https://orf.at/stories/3290165/,https://orf.at/stories/3290165/,0,orf.at,Wegweiser aus dem Zahlenlabyrinth,"Das Budget, so heißt es, sei die in Zahlen gegossene Politik. Die Höhe der Mittel, die einem bestimmten Bereich zugewiesen wird, entscheidet darüber, ob und wie politische Projekte umgesetzt werden können. Den Beschluss für das Budget 2023 trifft der National…",https://ibs.orf.at/news?image=https%3A%2F%2Fassets.orf.at%2Fmims%2F2022%2F43%2F84%2Fcrops%2Fw%3D1200%2Ch%3D630%2Cq%3D75%2F1542269_master_562784_budgetdienst_berger048_v2_luk_kopie.jpg%3Fs%3Dbd012e32c6dabd83b80f2ac7770d9a1a6277f583,2022-11-04T05:09:24Z,,Für den Budgetdienst gehört der Herbst zu den eher stressigen Zeiten. Zwischen Budgetrede des Finanzministers und endgültigem Beschluss im Nationalrat vergehen nur vier Wochen. In der Zwischenzeit wi… [+9640 chars],,de,'Herbst'
https://www.morgenpost.de/bezirke/pankow/article236823223/Duerre-im-Sommer-und-Herbst-Pankower-See-verschwindet.html,https://www.morgenpost.de/bezirke/pankow/article236823223/Duerre-im-Sommer-und-Herbst-Pankower-See-verschwindet.html,0,www.morgenpost.de,Folgen der Trockenheit: Dürre im Sommer und Herbst: Pankower See verschwindet,Nicht nur der Pegel des Weißen Sees schwindet bedrohlich – im Bezirk Pankow könnte ein Biotop sogar komplett austrocknen.,https://img.morgenpost.de/img/pankow/crop236823221/9307544308-w820-cv16_9-q85-fnov-fpi231768577-fpotl/a0b61e36-5ba5-11ed-8f9c-d69a415052b6.jpg,2022-11-04T04:45:00Z,,=tqbo dmbttµ#bsujdmf``mpdbujpo#?Cfsmjo/'octq´=0tqbo?Xfs tjdi vn efo Xbttfstdixvoe jn Xfjàfo Tff tpshu- nvtt xjttfo- ebtt ft jn Cf{jsl Qbolpx opdi fjofo esbnbujtdifsfo Gbmm hjcu/ Hmfjdi jo efs Obdicbs… [+6338 chars],,de,'Herbst'
https://www.nzz.ch/sport/benfica-lissabon-verbluefft-in-der-champions-league-fussballeuropa-ld.1710570,https://www.nzz.ch/sport/benfica-lissabon-verbluefft-in-der-champions-league-fussballeuropa-ld.1710570,0,www.nzz.ch,Benfica Lissabon verblüfft Fussball-Europa – mit «Schmidtball»,"Portugals grösster Klub ist die Entdeckung der Champions-League-Vorrunde, die unterhaltsamer und überraschender war als sonst – aber eine Ausnahme bleiben wird.","https://img.nzz.ch/2022/11/03/8b58a1ef-2ea0-4e7a-b66d-86b29dcd68c8.jpeg?width=1200&height=674&fit=bound&quality=75&auto=webp&crop=2239,1258,x0,y143&wmark=nzz",2022-11-04T04:00:00Z,,"Alejandro Grimaldo (Zweiter von links) wird für sein Tor beim 6:1 gegen Maccabi Haifa gefeiert. Er ist einer von sechs verschiedenen Torschützen.
João Mário schaute zur Bank, mit dem Glück des Torsc… [+7773 chars]",,de,'Herbst'
https://www.freitag.de/autoren/florian-schmid/ringe-der-macht-und-house-of-the-dragon-fantasy-als-gegenwartsbeschreibung,https://www.freitag.de/autoren/florian-schmid/ringe-der-macht-und-house-of-the-dragon-fantasy-als-gegenwartsbeschreibung,0,www.freitag.de,Streaming | „Ringe der Macht“ und „House of the Dragon“: Fantasy als Gegenwartsbeschreibung,"In Serien wie „Die Ringe der Macht“ und „House of the Dragon“ zeigt sich, dass die Katastrophen unserer Gegenwart am besten im Fantasy-Genre beschrieben werden Fantasy spielt diesen Herbst im Streamingbereich eine große Rolle. Mit Die Ringe der Macht, dem Pre…",https://www.freitag.de/autoren/florian-schmid/ringe-der-macht-und-house-of-the-dragon-fantasy-als-gegenwartsbeschreibung/@@images/social_image,2022-11-04T03:00:00Z,,"Fantasy spielt diesen Herbst im Streamingbereich eine große Rolle. Mit Die Ringe der Macht, dem Prequel zu Der Herr der Ringe, wartete Amazon mit der ersten Staffel der bislang teuersten Fernsehserie… [+562 chars]",,de,'Herbst'
https://www.heise.de/select/ct/2022/24/2218810135208739859?wt_mc=rss.red.ct.themen.atom.beitrag.beitrag,https://www.heise.de/select/ct/2022/24/2218810135208739859?wt_mc=rss.red.ct.themen.atom.beitrag.beitrag,0,www.heise.de,Intel-Prozessoren Core i9-13900K und i5-13600K mit noch mehr Kernen,Bei der dreizehnten Generation der Core-i-Prozessoren Raptor Lake treibt Intel die Hybridarchitektur weiter voran und verdoppelt die Zahl der Effizienzkerne. Im Duell mit dem AMD Ryzen 7000 sollen zudem höherer Takt und größere Caches helfen. Wir haben getest…,https://www.heise.de/select/ct/2022/24/2218810135208739859/wod.a_121185_vintelraptor_digital.jpg,2022-11-03T23:15:00Z,,Bei der dreizehnten Generation der Core-i-Prozessoren Raptor Lake treibt Intel die Hybridarchitektur weiter voran und verdoppelt die Zahl der Effizienzkerne. Im Duell mit dem AMD Ryzen 7000 sollen zu… [+1152 chars],,de,'Herbst'
https://www.heise.de/select/ct/2022/24/2227209284720057373?wt_mc=rss.red.ct.themen.atom.beitrag.beitrag,https://www.heise.de/select/ct/2022/24/2227209284720057373?wt_mc=rss.red.ct.themen.atom.beitrag.beitrag,0,www.heise.de,Microsoft sperrt Kunden unangekündigt für immer aus,"Es ist so bequem: Anbieter wie Google oder Microsoft vereinen unter einem Dach E-Mail-Postfächer, Cloudspeicher und noch viel mehr. Dass sie automatisiert nach strafbaren Inhalten suchen, weiß längst nicht jeder. Gerät man fälschlich in ihr Visier, sind mit e…",https://www.heise.de/select/ct/2022/24/2227209284720057373/wod.a_122093_vkontensperrung_digi.jpg,2022-11-03T23:15:00Z,,"Es ist so bequem: Anbieter wie Google oder Microsoft vereinen unter einem Dach E-Mail-Postfächer, Cloudspeicher und noch viel mehr. Dass sie automatisiert nach strafbaren Inhalten suchen, weiß längst… [+15911 chars]",,de,'Herbst'
https://versicherungswirtschaft-heute.de/unternehmen-und-management/2022-11-04/tops-und-flops-der-woche-erfolgreiches-sozialpartnermodell-einsichtige-streithaehne-und-ueberschaetzte-insurtechs/,https://versicherungswirtschaft-heute.de/unternehmen-und-management/2022-11-04/tops-und-flops-der-woche-erfolgreiches-sozialpartnermodell-einsichtige-streithaehne-und-ueberschaetzte-insurtechs/,0,versicherungswirtschaft-heute.de,"Tops und Flops der Woche: Erfolgreiches Sozialpartnermodell, einsichtige Streithähne und überschätzte Insurtechs",Nach einer kurzen Woche kommt nun der Herbst in vollen Zügen daher. Pünktlich zum Monatsbeginn hat die Bafin das erste Sozialpartnermodell für die Chemiebranche genehmigt. Gleichzeitig scheinen Insurtechs an Attraktivität zu verlieren. In einer exklusiven Ein…,https://versicherungswirtschaft-heute.de/wp-60d20-content/uploads/2022/11/combo-topflop.jpg,2022-11-03T23:00:00Z,,Nach einer kurzen Woche kommt nun der Herbst in vollen Zügen daher. Pünktlich zum Monatsbeginn hat die Bafin das erste Sozialpartnermodell für die Chemiebranche genehmigt. Gleichzeitig scheinen Insur… [+299 chars],,de,'Herbst'
https://www.tagesspiegel.de/politik/russische-spionage-in-norwegen-kleine-u-boote-konnten-eine-pipeline-unbemerkt-sprengen-8831167.html,https://www.tagesspiegel.de/politik/russische-spionage-in-norwegen-kleine-u-boote-konnten-eine-pipeline-unbemerkt-sprengen-8831167.html,0,www.tagesspiegel.de,Russische Spionage in Norwegen: „Kleine U-Boote könnten eine Pipeline unbemerkt sprengen“,Norwegen ist der wichtigste Erdgaslieferant für die EU geworden. Das macht das Land zum Ziel russischer Spione und womöglich sogar Angriffe. Ein norwegischer Oberst ordnet die Lage ein.,https://www.tagesspiegel.de/images/norway-energy-conflict/alternates/BASE_16_9_W1400/norway-energy-conflict.jpeg,2022-11-03T22:34:36Z,,"Herr Halvorson, am Montag hat Norwegen seine Armee in erhöhte Alarmbereitschaft versetzt. Spielen die vielen Verdachtsfälle russischer Spionage aus den vergangenen Wochen eine Rolle bei der Entscheid… [+297 chars]",,de,'Herbst'
https://www.sueddeutsche.de/muenchen/ebersberg/grafinger-maler-schrottgalerie-literarischer-herbst-1.5686383,https://www.sueddeutsche.de/muenchen/ebersberg/grafinger-maler-schrottgalerie-literarischer-herbst-1.5686383,0,www.sueddeutsche.de,Kultur in Ebersberg: Impressionen allüberall,"Im Landkreis kann man demnächst allerhand Bilder bestaunen, gemalte, musikalische, fotografierte und sprachliche. Und sogar eine Einladung, selbst kreativ zu werden, steht auf dem Programm.",https://www.sueddeutsche.de/image/sz.1.5686384/1200x675?v=1667478981,2022-11-03T20:37:37Z,,"Im Landkreis kann man demnächst allerhand Bilder bestaunen, gemalte, musikalische, fotografierte und sprachliche. Und sogar eine Einladung, selbst kreativ zu werden, steht auf dem Programm.Den Club d… [+3904 chars]",,de,'Herbst'
https://web.de/magazine/ratgeber/finanzen-verbraucher/lange-berg-warnung-euphorie-voller-gasspeicher-37440774,https://web.de/magazine/ratgeber/finanzen-verbraucher/lange-berg-warnung-euphorie-voller-gasspeicher-37440774,0,web.de,"""Noch lange nicht über den Berg"": Warnung vor Euphorie wegen voller Gasspeicher - WEB.DE News","<ol><li>""Noch lange nicht über den Berg"": Warnung vor Euphorie wegen voller Gasspeicher  WEB.DE News
</li><li>Volle Gasspeicher: Branchenverband warnt vor Sorglosigkeit  WELT
</li><li>Energiekrise: Gasspeicher zu 99,19 Prozent gefüllt  ZDFheute
</li><li>Ga…","https://i0.web.de/image/820/37440820,pd=1,f=opengraph.jpg",2022-11-03T20:25:54Z,,"<ul><li>Die Gasspeicher sind gefüllt, jetzt kann geheizt werden?</li><li>Nein, heißt es von den Speicherbetreiber und die Bundesnetzagentur.</li><li>Kräftiges Sparen sei weiter angesagt, um durch den… [+3401 chars]",,de,'Herbst'
https://www.brigitte.de/mode/herbstmode-2022--3-trends--die-voellig-ueberbewertet-sind-13413324.html,https://www.brigitte.de/mode/herbstmode-2022--3-trends--die-voellig-ueberbewertet-sind-13413324.html,0,www.brigitte.de,"Herbstmode auf dem Prüfstand: 3 Fashion-Trends, die überbewertet sind","In machen Jahren kann man die nächste Saison kaum abwarten, da viele neue und spannende Fashion-Trends auf einen warten. Diesen Herbst und Winter ist das nicht unbedingt der Fall. Besonders bei drei Fashion-Hypes bleibt die große Freude aus.",https://image.brigitte.de/13413328/t/fH/v4/w1440/r1.7778/-/herbsttrends-bella-hadid.jpg,2022-11-03T20:00:00Z,,"Was habe ich es geliebt, nach den großen Modewochen in Paris, New York oder Mailand die Fashion-Magazine zu wälzen und mich in der Designwelt der nächsten Saison zu verlieren. Da ich meine Leidenscha… [+2111 chars]",,de,'Herbst'
https://www.jungewelt.de/artikel/438096.breitensport-gefährlicher-als-corona.html,https://www.jungewelt.de/artikel/438096.breitensport-gefährlicher-als-corona.html,0,www.jungewelt.de,Breitensport: »Gefährlicher als Corona«,"Über aktuelle Bedrohungen für die sportliche Basis. Ein Gespräch mit Christoph Niessen, Vorstandsvorsitzender des Landessportbundes Nordrhein-Westfalen.",https://www.jungewelt.de/img/1100/173358.jpg,2022-11-03T18:41:15Z,,"Klaus Müller, der Chef der Bundesnetzagentur, hat neulich klargemacht, was der Sport in der Energiekrise bezüglich der Zuteilung von Strom und Gas zu erwarten hat. Der Sport sei nicht systemrelevant … [+5214 chars]",,de,'Herbst'
https://www.jungewelt.de/artikel/438072.maritime-wirtschaft-aufgesetzter-streit.html,https://www.jungewelt.de/artikel/438072.maritime-wirtschaft-aufgesetzter-streit.html,0,www.jungewelt.de,Maritime Wirtschaft: Aufgesetzter Streit,Zusage von Cosco für Minderheitenlösung am Hamburger Hafen steht noch aus. Angesichts von Umschlagszahlen wirkt Disput unverhältnismäßig • Foto: IMAGO/JOKER,https://www.jungewelt.de/img/1100/173362.jpg,2022-11-03T18:41:15Z,,Bundeskanzler Olaf Scholz (SPD) wird an diesem Freitag seine China-Reise antreten verbunden mit großen Erwartungen auch der maritimen Wirtschaft. Denn ein zentrales Thema dürfte der von Scholz durchg… [+3579 chars],,de,'Herbst'
https://www.jungewelt.de/artikel/438080.kino-mediokre-metamasche.html,https://www.jungewelt.de/artikel/438080.kino-mediokre-metamasche.html,0,www.jungewelt.de,Kino: Mediokre Metamasche,Seit einer Woche kann man »See How They Run« im Kino schauen – oder einen Krimi in der Badewanne lesen • Foto: Parisa Taghizadeh/ Walt Disney Company/dpa,https://www.jungewelt.de/img/1100/173365.jpg,2022-11-03T18:41:15Z,,"Eine Gruppe seltsamer Figuren in einem abgelegenen Landhaus, die unsympathischste unter ihnen wird ermordet, ein Ermittler von Format erscheint, die am wenigsten verdächtige Person wird überführt: »H… [+5005 chars]",,de,'Herbst'
https://www.n-tv.de/sport/Der-letzte-Gold-Adler-fliegt-dem-Drama-davon-article23696459.html,https://www.n-tv.de/sport/Der-letzte-Gold-Adler-fliegt-dem-Drama-davon-article23696459.html,0,www.n-tv.de,Skispringer nicht ohne Wellinger: Der letzte Gold-Adler fliegt dem Drama davon,Andreas Wellinger ist der letzte verbliebene Springer des Olympiasieger-Teams von 2014. Viele Verletzungen werfen den Weltklasse-Skispringer immer wieder heftig zurück. Mit 27 Jahren ist er nun topfit. Soweit es sein kaputtes Knie eben zulässt.,https://bilder3.n-tv.de/img/incoming/crop23696478/7751325339-cImg_16_9-w1200/imago1015090620h.jpg,2022-11-04T18:53:27Z,,Andreas Wellinger ist der letzte verbliebene Springer des Olympiasieger-Teams von 2014. Viele Verletzungen werfen den Weltklasse-Skispringer immer wieder heftig zurück. Mit 27 Jahren ist er nun topfi… [+2374 chars],,de,'Blüte'
