index,url,valid,domain,title,description,image,published,archive,content,quote,language,keyword
https://www.faz.net/aktuell/gesellschaft/menschen/jedes-zweite-kind-in-deutschland-zu-viel-zeit-vor-bildschirmen-18648540.html,https://www.faz.net/aktuell/gesellschaft/menschen/jedes-zweite-kind-in-deutschland-zu-viel-zeit-vor-bildschirmen-18648540.html,0,www.faz.net,Jedes zweite Kind in Deutschland verbringt zu viel Zeit vor Bildschirmen,Kindern sollten täglich nicht länger als 30 Minuten vor Bildschirmen verbringen. Dennoch sitzt mehr als die Hälfte der Kinder in Deutschland unter der Woche zu lange vor digitalen Geräten.,https://media1.faz.net/ppmedia/aktuell/gesellschaft/3542106693/1.8648571/facebook_teaser/zwei-maedchen-schauen-sich.jpg,2023-02-02T12:45:31Z,https://web.archive.org/web/20230202142036/https://www.faz.net/aktuell/gesellschaft/menschen/jedes-zweite-kind-in-deutschland-zu-viel-zeit-vor-bildschirmen-18648540.html,"Gut die Hälfte der Kinder zwischen vier und sechs Jahren (52 Prozent) verbringt einer Studie zufolge unter der Woche mehr als eine halbe Stunde täglich vor dem Fernseher, einem Laptop oder anderen di… [+1661 chars]",,de,'Kinder'
https://www.zeit.de/news/2023-02/02/gezielte-hilfe-fuer-kinder-von-straftaetern,https://www.zeit.de/news/2023-02/02/gezielte-hilfe-fuer-kinder-von-straftaetern,0,www.zeit.de,Koordinierungsstelle: Gezielte Hilfe für Kinder von Straftätern,,,2023-02-02T13:35:57Z,https://web.archive.org/web/20230203052300/https://www.zeit.de/news/2023-02/02/gezielte-hilfe-fuer-kinder-von-straftaetern,"When browsing with ads:
We collect personal data and also transmit it to third-party providers
 that help us improve and finance our digital content. Some of the information stored on your device, … [+732 chars]",,de,'Kinder'
https://www.tagesschau.de/inland/gesellschaft/luetzerath-kohle-doerfer-101.html,https://www.tagesschau.de/inland/gesellschaft/luetzerath-kohle-doerfer-101.html,0,www.tagesschau.de,"Dörfer am Tagebau Garzweiler: Was ist mit denen, die bleiben?","Lützerath muss dem Kohleabbau weichen. Doch fünf Dörfer, die eigentlich ebenfalls abgebaggert werden sollten, haben plötzlich wieder eine Zukunft. Aber welche? V<em>on Andreas Palik.</em>",https://www.tagesschau.de/multimedia/bilder/kuckum-101~_v-original.jpg,2023-02-02T14:25:57Z,http://archive.md/20230202201935/https://www.tagesschau.de/inland/gesellschaft/luetzerath-kohle-doerfer-101.html,Lützerath muss dem Kohleabbau weichen - trotz heftiger Proteste. Andere bereits abgeschriebene Dörfer am Tagebau haben wieder eine Zukunft. Nur wie soll diese aussehen? Das sollen auch die Bewohner e… [+4496 chars],,de,'Kohle'
https://www.braunschweiger-zeitung.de/wolfenbuettel/article237532115/Wolfenbuetteler-Arzt-erklaert-So-schuetzen-Sie-sich-vor-Grippe.html,https://www.braunschweiger-zeitung.de/wolfenbuettel/article237532115/Wolfenbuetteler-Arzt-erklaert-So-schuetzen-Sie-sich-vor-Grippe.html,0,www.braunschweiger-zeitung.de,Wolfenbütteler Arzt erklärt: So schützen Sie sich vor Grippe - Braunschweiger Zeitung,Ein Allgemeinmediziner aus Salzdahlum klärt auf: Warum eine Grippeschutzimpfung auch jetzt noch Sinn macht und wie man das Immunsystem stärkt.,https://img.braunschweiger-zeitung.de/img/wolfenbuettel/crop237532113/7571749856-w820-cv16_9-q85-fnov-fpi228094355-fpobr/e1fb5e9a-a2d3-11ed-94f9-5403e75de0c9.jpg,2023-02-02T15:09:00Z,https://web.archive.org/web/20230202152202/https://www.braunschweiger-zeitung.de/wolfenbuettel/article237532115/Wolfenbuetteler-Arzt-erklaert-So-schuetzen-Sie-sich-vor-Grippe.html,=vm?=mj?Nfotdifonbttfo nfjefo voe GGQ3.Nbtlfo ifmgfo- tjdi wps Jogflufo {v tdiýu{fo/=0mj?=mj?Hsjqqftdivu{jnqgvohfo tjoe {xjtdifo Plupcfs voe Bqsjm tjoowpmm/=0mj?=mj?Ibvtnjuufm xjf Åqgfm- Johxfs voe c… [+7980 chars],,de,'Grippe'
https://www.tagesspiegel.de/politik/energiekrise-abgewendet-deutschland-hat-ziel-fur-gasspeicher-ubererfullt-9284370.html,https://www.tagesspiegel.de/politik/energiekrise-abgewendet-deutschland-hat-ziel-fur-gasspeicher-ubererfullt-9284370.html,0,www.tagesspiegel.de,Energiekrise abgewendet?: Deutschland hat Ziel für Gasspeicher übererfüllt,"Bis zum 1. Februar sollten alle EU-Staaten die Gasspeicher zu mindestens 40 Prozent gefüllt haben. Deutschland hat das Ziel mit 78,6 Prozent weit übertroffen.",https://www.tagesspiegel.de/images/erdgasspeicher/alternates/BASE_16_9_W1400/erdgasspeicher.jpeg,2023-02-02T15:39:33Z,https://web.archive.org/web/20230202160740/https://www.tagesspiegel.de/politik/energiekrise-abgewendet-deutschland-hat-ziel-fur-gasspeicher-ubererfullt-9284370.html,"Schon seit Wochen hatte es sich abgezeichnet, jetzt ist es amtlich: Die Gasspeicher in Deutschland haben das Füllstandsziel von 40 Prozent zum 1. Februar mehr als erreicht. Mit 78,6 Prozent waren sie… [+3869 chars]",,de,'Gasspeicher'
https://www.focus.de/gesundheit/coronavirus/kolumne-von-top-virologe-kekule-lange-schulschliessungen-waren-fehler-kekule-kritisiert-lauterbach-aussage_id_184718659.html,https://www.focus.de/gesundheit/coronavirus/kolumne-von-top-virologe-kekule-lange-schulschliessungen-waren-fehler-kekule-kritisiert-lauterbach-aussage_id_184718659.html,0,www.focus.de,Ich widerspreche Lauterbach beim Thema Schulschließungen - „Politiker sollten sich für ihre Fehler entschuldigen!“,Die Schließungen von Kitas und Schulen wären durch eine breitere wissenschaftliche Beratung und rechtzeitiges Handeln vermeidbar gewesen. Die verantwortlichen Politiker sollten sich bei den Kindern und ihren Eltern entschuldigen.Von Focus Magazin-Alexander Ke…,https://p6.focus.de/img/fotos/id_184740471/lauterbach-76717641.png?im=Crop%3D%28171%2C0%2C1928%2C964%29%3BResize%3D%281200%2C627%29&impolicy=perceptual&quality=medium&hash=5a6d639faee90bc5a897021bbf2b2ae254361d3843e6d47a5ada17bb9082c080,2023-02-02T17:03:05Z,https://web.archive.org/web/20230202171152/https://www.focus.de/gesundheit/coronavirus/kolumne-von-top-virologe-kekule-lange-schulschliessungen-waren-fehler-kekule-kritisiert-lauterbach-aussage_id_184718659.html,Die Schließungen von Kitas und Schulen wären durch eine breitere wissenschaftliche Beratung und rechtzeitiges Handeln vermeidbar gewesen. Die verantwortlichen Politiker sollten sich bei den Kindern u… [+12866 chars],,de,'Kinder'
https://www.zeit.de/news/2023-02/02/ministerium-gueterzug-erfasst-zwei-kinder-ein-kind-tot,https://www.zeit.de/news/2023-02/02/ministerium-gueterzug-erfasst-zwei-kinder-ein-kind-tot,0,www.zeit.de,Zugunglück: Ministerium: Güterzug erfasst zwei Kinder: Ein Kind tot,,,2023-02-02T22:05:31Z,https://web.archive.org/web/20230202223519/https://www.zeit.de/news/2023-02/02/ministerium-gueterzug-erfasst-zwei-kinder-ein-kind-tot,"When browsing with ads:
We collect personal data and also transmit it to third-party providers
 that help us improve and finance our digital content. Some of the information stored on your device, … [+732 chars]",,de,'Kinder'
https://www.dwdl.de/zahlenzentrale/91610/sat1_blackout_stuerzt_in_der_zweiten_woche_deutlich_ab/,https://www.dwdl.de/zahlenzentrale/91610/sat1_blackout_stuerzt_in_der_zweiten_woche_deutlich_ab/,0,www.dwdl.de,"Sat.1: ""Blackout"" stürzt in der zweiten Woche deutlich ab","Die Sat.1-Miniserie ""Blackout"" konnte die guten Auftaktquoten in der zweiten Woche nicht halten. Bei RTL endete die Bushido-Doku auf gewohntem Niveau. ProSieben fuhr mit minimalem Aufwand ziemlich gut.",https://www.dwdl.de/images/1600271397_blackout.jpg,2023-02-03T07:51:00Z,https://web.archive.org/web/20230203124806/https://www.dwdl.de/zahlenzentrale/91610/sat1_blackout_stuerzt_in_der_zweiten_woche_deutlich_ab/,"Ernüchterung bei Sat.1: Nachdem ""Blackout"" in der vergangenen Woche mit 10,8 Prozent Marktanteil in der klassischen Zielgruppe (vorläufig gewichtet) noch einen ziemlich guten Einstand hingelegt hatte… [+2675 chars]",,de,'Blackout'
https://www.n-tv.de/panorama/Suedafrika-geht-das-Licht-aus-article23891239.html,https://www.n-tv.de/panorama/Suedafrika-geht-das-Licht-aus-article23891239.html,0,www.n-tv.de,Angst vor dem Blackout: Südafrika geht das Licht aus,"Loadshedding?! Wer schonmal in Südafrika war, weiß: Wenn in drei Stunden für eine Weile kein Strom mehr fließt, dann geht in ganzen Regionen nichts mehr. In Südafrika gehören stundenlange Stromausfälle zum Alltag. Sie verursachen erhebliche Schäden. In Deutsc…",https://bilder2.n-tv.de/img/incoming/crop23891261/496132562-cImg_16_9-w1200/d9a6f7f211d94b58621ce479598957d5.jpg,2023-02-03T13:07:45Z,https://web.archive.org/web/20230203145310/https://www.n-tv.de/panorama/Suedafrika-geht-das-Licht-aus-article23891239.html,"Loadshedding?! Wer schon mal in Südafrika war, weiß: Wenn für eine Weile kein Strom mehr fließt, dann geht in ganzen Regionen nichts mehr. In Südafrika gehören stundenlange Stromausfälle zum Alltag. … [+5705 chars]",,de,'Blackout'
https://www.focus.de/reisen/urlaubs-check/badeziele-im-februar-das-sind-die-schoensten-strandziele-mitten-im-winter_id_183911972.html,https://www.focus.de/reisen/urlaubs-check/badeziele-im-februar-das-sind-die-schoensten-strandziele-mitten-im-winter_id_183911972.html,0,www.focus.de,"Baden im Februar - Die fünf besten Reiseziele, um dem Winter zu entfliehen","Keine Lust mehr auf Schnee, Eis und Kälte? Dann ganz schnell ab in wärmere Gefilde! Wir stellen fünf Urlaubsziele vor, an denen das Thermometer mindestens 30 Grad anzeigt und Sie Sonne, Strand und Meer in vollen Zügen genießen können.Von FOCUS-online-Autorin …",https://p6.focus.de/img/fotos/id_183913289/gettyimages-83629122.jpg?im=Crop%3D%280%2C0%2C2148%2C1073%29%3BResize%3D%281200%2C627%29&impolicy=perceptual&quality=medium&hash=2c0321c47261e4e41b9686cc034d178ada5179f1b893de086cb4519eba7ad96f,2023-02-03T15:52:07Z,https://web.archive.org/web/20230203165434/https://www.focus.de/reisen/urlaubs-check/badeziele-im-februar-das-sind-die-schoensten-strandziele-mitten-im-winter_id_183911972.html,"Keine Lust mehr auf Schnee, Eis und Kälte? Dann ganz schnell ab in wärmere Gefilde! Wir stellen fünf Urlaubsziele vor, an denen das Thermometer mindestens 30 Grad anzeigt und Sie Sonne, Strand und Me… [+6745 chars]",,de,'Kälte'
https://www.zeit.de/news/2023-02/03/kreativ-szene-soll-gasteig-bis-zu-sanierung-nutzen,https://www.zeit.de/news/2023-02/03/kreativ-szene-soll-gasteig-bis-zu-sanierung-nutzen,0,www.zeit.de,Münchner Philharmoniker: Kreativ-Szene soll Gasteig bis zu Sanierung nutzen,,,2023-02-03T16:36:07Z,https://web.archive.org/web/20230203165323/https://www.zeit.de/news/2023-02/03/kreativ-szene-soll-gasteig-bis-zu-sanierung-nutzen,"When browsing with ads:
We collect personal data and also transmit it to third-party providers
 that help us improve and finance our digital content. Some of the information stored on your device, … [+732 chars]",,de,'Gas'
https://www.focus.de/panorama/welt/eine-grosse-angst-der-deutschen-ist-in-suedafrika-laengst-alltag_id_184842630.html,https://www.focus.de/panorama/welt/eine-grosse-angst-der-deutschen-ist-in-suedafrika-laengst-alltag_id_184842630.html,0,www.focus.de,Sorge vor dem Blackout - Eine große Angst der Deutschen ist in Südafrika längst Realität,In Deutschland ist sie noch neu: die Angst vor einem Blackout. In Südafrika gehören tägliche Stromausfälle schon seit Jahren zum Alltag. Sie verursachen erhebliche Schäden.,https://p6.focus.de/img/fotos/id_184842629/5fac8600e5f2f6cc.jpg?im=Crop%3D%280%2C0%2C3461%2C1733%29%3BResize%3D%281200%2C627%29&impolicy=perceptual&quality=medium&hash=9dae861b717d6dc7a0686d7f6f8b67dd16f11870183ac7f458b238492fffbd3c,2023-02-03T18:37:02Z,https://web.archive.org/web/20230203191836/https://www.focus.de/panorama/welt/eine-grosse-angst-der-deutschen-ist-in-suedafrika-laengst-alltag_id_184842630.html,"In Deutschland ist sie noch neu: die Angst vor einem Blackout. In Südafrika gehören tägliche Stromausfälle schon seit Jahren zum Alltag. Sie verursachen erhebliche Schäden.
Mehrere Stunden am Tag ke… [+5606 chars]",,de,'Blackout'
https://www.sueddeutsche.de/muenchen/fuerstenfeldbruck/puchheim-haushalt-schwimmbad-1.5744643,https://www.sueddeutsche.de/muenchen/fuerstenfeldbruck/puchheim-haushalt-schwimmbad-1.5744643,0,www.sueddeutsche.de,Haushalt in Puchheim: Knapp bei Kasse,"Die Stadt muss ans Sparschwein gehen, um in Schulen, Kindergarten und Schwimmbad zu investieren.",https://www.sueddeutsche.de/image/sz.1.4653768/1200x675?v=1675427815,2023-02-03T20:44:44Z,,"Die Stadt muss ans Sparschwein gehen, um in Schulen, Kindergarten und Schwimmbad zu investieren.Die Stadt Puchheim wird in diesem Jahr etwa 16 Millionen Euro investieren. Die größten Posten sind die … [+1078 chars]",,de,'Kinder'
https://www.stern.de/gesellschaft/regional/sachsen/basketball--chemnitz-verliert-knapp-mit-74-77-in-wuerzburg-33165628.html,https://www.stern.de/gesellschaft/regional/sachsen/basketball--chemnitz-verliert-knapp-mit-74-77-in-wuerzburg-33165628.html,0,www.stern.de,Basketball: Chemnitz verliert knapp mit 74:77 in Würzburg,Die Basketballer der Niners Chemnitz müssen der hohen Belastung in Meisterschaft und Europapokal Tribut zollen. Die Sachsen verloren am Freitag ihr Gastspiel bei den Würzburg Baskets mit 74:77 (39:48) und kassierten damit in der Bundesliga die zweite Niederla…,https://image.stern.de/6681672/t/31/v5/w1440/r1.7778/-/video-fallback-image.jpg,2023-02-03T22:32:36Z,https://web.archive.org/web/20230203225524/https://www.stern.de/gesellschaft/regional/sachsen/basketball--chemnitz-verliert-knapp-mit-74-77-in-wuerzburg-33165628.html,Die Basketballer der Niners Chemnitz müssen der hohen Belastung in Meisterschaft und Europapokal Tribut zollen. Die Sachsen verloren am Freitag ihr Gastspiel bei den Würzburg Baskets mit 74:77 (39:48… [+1868 chars],,de,'Gas'
https://www.focus.de/digital/falls-ein-blackout-kommt-diese-intelligente-app-informiert-ueber-den-status-des-stromnetzes_id_180439809.html,https://www.focus.de/digital/falls-ein-blackout-kommt-diese-intelligente-app-informiert-ueber-den-status-des-stromnetzes_id_180439809.html,0,www.focus.de,Falls ein Blackout kommt - Diese intelligente App informiert über den Status des Stromnetzes,"Mit der kostenlosen App „StromGedacht“ haben Nutzer Einblick in den Status des Stromnetzes. Sollte die Last zu hoch werden, erscheint eine Warnmeldung – dann können alle dazu beitragen, eine Überlastung zu verhindern. Doch die Sache hat momentan einen Haken.",https://p6.focus.de/img/digital/id_180439808/bevor-der-blackout-kommt-app-informiert-ueber-status-des-stromnetzes.jpg?im=Crop%3D%280%2C0%2C2000%2C999%29%3BResize%3D%281200%2C627%29&impolicy=perceptual&quality=medium&hash=2f0a5b5997647ca25b6f2c21fb415812ed2d8551f8dfdf81f16980634ea0b901,2023-02-04T05:28:42Z,https://web.archive.org/web/20230204155836/https://www.focus.de/digital/falls-ein-blackout-kommt-diese-intelligente-app-informiert-ueber-den-status-des-stromnetzes_id_180439809.html,"Mit der kostenlosen App StromGedacht haben Nutzer Einblick in den Status des Stromnetzes. Sollte die Last zu hoch werden, erscheint eine Warnmeldung dann können alle dazu beitragen, eine Überlastung … [+2508 chars]",,de,'Blackout'
https://www.zeit.de/news/2023-02/04/a661-vier-erwachsene-und-zwei-kinder-schwer-verletzt,https://www.zeit.de/news/2023-02/04/a661-vier-erwachsene-und-zwei-kinder-schwer-verletzt,0,www.zeit.de,Hochtaunuskreis: A661: Vier Erwachsene und zwei Kinder schwer verletzt,,,2023-02-04T08:02:06Z,https://web.archive.org/web/20230206230932/https://www.zeit.de/news/2023-02/04/a661-vier-erwachsene-und-zwei-kinder-schwer-verletzt,"When browsing with ads:
We collect personal data and also transmit it to third-party providers
 that help us improve and finance our digital content. Some of the information stored on your device, … [+732 chars]",,de,'Kinder'
https://www.bild.de/lgbt/2023/lgbt/neues-finnen-gesetz-erwachsene-duerfen-geschlechtseintrag-selbst-aendern-82780174.bild.html,https://www.bild.de/lgbt/2023/lgbt/neues-finnen-gesetz-erwachsene-duerfen-geschlechtseintrag-selbst-aendern-82780174.bild.html,0,www.bild.de,Neues Finnen-Gesetz - Erwachsene dürfen Geschlechtseintrag selbst ändern,In Finnland gilt jetzt das Selbstbestimmungsgesetz. Demnach dürfen Erwachsene ihren Geschlechtseintrag eigenständig ändern – ohne weitere Unterlagen!,"https://images.bild.de/63dd1f0ae6d87359aca357d3/cdf286870bf64da4ace8e18fa99a3973,3467852b?w=1280",2023-02-04T11:01:39Z,https://web.archive.org/web/20230204150254/https://www.bild.de/lgbt/2023/lgbt/neues-finnen-gesetz-erwachsene-duerfen-geschlechtseintrag-selbst-aendern-82780174.bild.html,"In Finnland wurde am Mittwoch ein neues Gesetz verabschiedet, das die Änderung des Geschlechtseintrags für trans Personen deutlich erleichtert. Das neue Selbstbestimmungsgesetz wurde vom Parlament mi… [+2716 chars]",,de,'Geschlecht'
https://www.zeit.de/2023/06/gerd-schulte-koerne-depressionen-kinder-jugendliche,https://www.zeit.de/2023/06/gerd-schulte-koerne-depressionen-kinder-jugendliche,0,www.zeit.de,"Gerd Schulte-Körne über Depressionen: ""Manche Erkrankung könnten wir verhindern""",Auch Kinder und Jugendliche leiden unter Depressionen. Wie Eltern und Lehrer Alarmsignale erkennen – und warum man von früher Vorbeugung noch als Erwachsener profitiert.,,2023-02-04T12:09:10Z,https://web.archive.org/web/20230203203747/https://www.zeit.de/2023/06/gerd-schulte-koerne-depressionen-kinder-jugendliche,"When browsing with ads:
We collect personal data and also transmit it to third-party providers
 that help us improve and finance our digital content. Some of the information stored on your device, … [+732 chars]",,de,'Kinder'
https://www.n-tv.de/politik/Ganz-Odessa-ist-seit-dem-Morgen-ohne-Strom-article23893281.html,https://www.n-tv.de/politik/Ganz-Odessa-ist-seit-dem-Morgen-ohne-Strom-article23893281.html,0,www.n-tv.de,Netz-Havarie nach Angriffen: Ganz Odessa ist seit dem Morgen ohne Strom,"Die russischen Angriffe auf die Energieinfrastruktur setzen Odessa zu. Versorger Ukrenerho arbeitet an einer Wiederherstellung der Anlagen. Doch am Morgen fällt erneut ein Transformator aus, der Blackout betrifft die komplette Hafenstadt am Schwarzen Meer.",https://bilder1.n-tv.de/img/incoming/crop23893284/6401327987-cImg_16_9-w1200/393151265.jpg,2023-02-04T13:26:36Z,,"Die russischen Angriffe auf die Energieinfrastruktur setzen Odessa zu. Versorger Ukrenerho arbeitet an einer Wiederherstellung der Anlagen. Doch am Morgen fällt erneut ein Transformator aus, der Blac… [+1653 chars]",,de,'Blackout'
https://www.faz.net/aktuell/stil/leib-seele/achtsamkeit-10-uebungen-fuer-kinder-18648200.html,https://www.faz.net/aktuell/stil/leib-seele/achtsamkeit-10-uebungen-fuer-kinder-18648200.html,0,www.faz.net,Wie Kinder Achtsamkeit üben können,Sich entspannen und den Stress im Alltag mindern: Schon Kinder können Elemente der Achtsamkeit üben. Zehn superleichte Übungen für den Alltag.,https://media0.faz.net/ppmedia/aktuell/3236817074/1.8654524/facebook_teaser/atmen-wie-ein-elefant-auch.jpg,2023-02-05T07:25:53Z,https://web.archive.org/web/20230204234619/https://www.faz.net/aktuell/stil/leib-seele/achtsamkeit-10-uebungen-fuer-kinder-18648200.html,"Das bewusste Wahrnehmen von Dingen, Gefühlen oder dem eigenen Körper kann Kindern helfen, sich zu entspannen und ihren Stress im Alltag zu mindern. Eltern können die Übungen gemeinsam mit den Kindern… [+3380 chars]",,de,'Kinder'
https://www.stern.de/gesellschaft/regional/mecklenburg-vorpommern/wetter--glaette-in-mecklenburg-vorpommern-erwartet-33168006.html,https://www.stern.de/gesellschaft/regional/mecklenburg-vorpommern/wetter--glaette-in-mecklenburg-vorpommern-erwartet-33168006.html,0,www.stern.de,Wetter: Glätte in Mecklenburg-Vorpommern erwartet,Am Sonntag sollten sich die Menschen in Mecklenburg-Vorpommern auf Kälte und Glätte einstellen. Vor allem am Vormittag kommt es laut Prognosen des Deutschen Wetterdienstes (DWD) bei Temperaturen zwischen minus fünf und minus ein Grad zu Frost und Glätte durch…,https://image.stern.de/33168008/t/nl/v1/w1440/r1.7778/-/05--urnnewsmldpacom2009010123020599480035v3w800h600l609t84r1889b934jpeg---9c348874e2720b12.jpg,2023-02-05T08:02:12Z,https://web.archive.org/web/20230205083706/https://www.stern.de/gesellschaft/regional/mecklenburg-vorpommern/wetter--glaette-in-mecklenburg-vorpommern-erwartet-33168006.html,Am Sonntag sollten sich die Menschen in Mecklenburg-Vorpommern auf Kälte und Glätte einstellen. Vor allem am Vormittag kommt es laut Prognosen des Deutschen Wetterdienstes (DWD) bei Temperaturen zwis… [+925 chars],,de,'Kälte'
https://www.n-tv.de/panorama/Wintersturm-fegt-ueber-die-USA-und-Kanada-article23894043.html,https://www.n-tv.de/panorama/Wintersturm-fegt-ueber-die-USA-und-Kanada-article23894043.html,0,www.n-tv.de,Extreme Kälte und Frostbeben: Wintersturm fegt über die USA und Kanada,"Kälte wie diese komme ""nur einmal in einer Generation vor"", warnte die US-Wetterbehörde NWS vor wenigen Tagen. Kurz darauf werden Teile der USA und Kanada von einem eisigen Sturm heimgesucht. Auf dem Mount Washington sinken die Temperaturen auf minus 43 Grad,…",https://bilder3.n-tv.de/img/incoming/crop23894054/235132221-cImg_16_9-w1200/394002947.jpg,2023-02-05T09:22:42Z,https://web.archive.org/web/20230205113914/https://www.n-tv.de/panorama/Wintersturm-fegt-ueber-die-USA-und-Kanada-article23894043.html,"Kälte wie diese komme ""nur einmal in einer Generation vor"", warnte die US-Wetterbehörde NWS vor wenigen Tagen. Kurz darauf werden Teile der USA und Kanada von einem eisigen Sturm heimgesucht. Auf dem… [+2799 chars]",,de,'Kälte'
https://www.n-tv.de/panorama/Wintersturm-erschuettert-die-USA-und-Kanada-article23894043.html,https://www.n-tv.de/panorama/Wintersturm-erschuettert-die-USA-und-Kanada-article23894043.html,0,www.n-tv.de,Rekordkälte und Frostbeben: Wintersturm erschüttert die USA und Kanada,"Kälte wie diese komme ""nur einmal in einer Generation vor"", warnte die US-Wetterbehörde NWS vor wenigen Tagen. Kurz darauf werden Teile der USA und Kanada von eisigen Temperaturen heimgesucht. Auf dem Mount Washington sinkt die gefühlte Temperatur auf den Rek…",https://bilder3.n-tv.de/img/incoming/crop23894054/235132221-cImg_16_9-w1200/394002947.jpg,2023-02-05T09:22:42Z,,"Kälte wie diese komme ""nur einmal in einer Generation vor"", warnte die US-Wetterbehörde NWS vor wenigen Tagen. Kurz darauf werden Teile der USA und Kanada von eisigen Temperaturen heimgesucht. Auf de… [+2795 chars]",,de,'Kälte'
https://www.bild.de/news/wetter/wetter/orkan-bringt-rekord-temperaturen-extrem-kaelte-in-den-usa-gefuehlte-minus-78-gra-82792996.bild.html,https://www.bild.de/news/wetter/wetter/orkan-bringt-rekord-temperaturen-extrem-kaelte-in-den-usa-gefuehlte-minus-78-gra-82792996.bild.html,0,www.bild.de,Orkan bringt Rekord-Temperaturen - Extrem-Kälte in den USA – gefühlte minus 78 Grad!,Extrem-Kälte in Nordamerika. Dazu ein heftiger Orkan. Die gefühlte Temperatur auf dem Mount Washington in New Hampshire lag jetzt bei minus 78 Grad! Laut...,"https://images.bild.de/63df6994c9c97e44f7f7174f/5fbd4c8f3ae845adf0a60dd66ae74ee6,2f5b1050?w=1280",2023-02-05T09:41:47Z,https://web.archive.org/web/20230205120854/https://www.bild.de/news/wetter/wetter/orkan-bringt-rekord-temperaturen-extrem-kaelte-in-den-usa-gefuehlte-minus-78-gra-82792996.bild.html,Extrem-Kälte in Nordamerika. Dazu ein heftiger Orkan. Die gefühlte Temperatur auf dem Mount Washington in New Hampshire lag jetzt bei minus 78 Grad! Laut US-Wetterbehörde NWS der niedrigste in den US… [+2947 chars],,de,'Kälte'
https://www.diepresse.com/6247451/rekordkaelte-in-usa-und-kanada-durch-polarluft,https://www.diepresse.com/6247451/rekordkaelte-in-usa-und-kanada-durch-polarluft,0,www.diepresse.com,Rekordkälte in USA und Kanada durch Polarluft,"Windchill-Temperaturen von bis zu minus 78 Grad, Frostbeben und Wetterwarnungen an der Antlantikküste: Teile der USA und Kanadas bekommen gerade arktische Kälte zu spüren, wie sie nur einmal in einer Generation vorkommt.",https://media.diepresse.com/social_diepresse_nachrichten/images/uploads_1200/4/1/b/6247451/5215EEF3-EB8C-4FDC-A8D6-4EE4A333D795_v0_l.jpg,2023-02-05T10:49:00Z,https://web.archive.org/web/20230205182346/https://www.diepresse.com/6247451/rekordkaelte-in-usa-und-kanada-durch-polarluft,"Windchill-Temperaturen von bis zu minus 78 Grad, Frostbeben und Wetterwarnungen an der Antlantikküste: Teile der USA und Kanadas bekommen gerade arktische Kälte zu spüren, wie sie nur einmal in einer… [+2411 chars]",,de,'Kälte'
https://www.stern.de/panorama/usa-und-kanada--polarluft-sorgt-fuer-rekordkaelte-und-frostbeben-33168290.html,https://www.stern.de/panorama/usa-und-kanada--polarluft-sorgt-fuer-rekordkaelte-und-frostbeben-33168290.html,0,www.stern.de,"arktische temperaturen: ""Nur einmal in einer Generation"": Polarluft sorgt in USA und Kanada für Rekordkälte und Frostbeben","Im Osten der USA und Kanadas haben polare Luftströme mit starken Windböen für extreme Kälte und Frostbeben gesorgt. Die Temperaturen fielen auf Rekord-Tiefstwerte. Die Rede war vorab von arktischer Kälte, wie sie ""nur einmal in einer Generation"" vorkomme.",https://image.stern.de/33168358/t/5l/v4/w1440/r1.7778/-/usa-kanada-kaelte-winter-frost.jpg,2023-02-05T11:02:00Z,https://web.archive.org/web/20230205124930/https://www.stern.de/panorama/usa-und-kanada--polarluft-sorgt-fuer-rekordkaelte-und-frostbeben-33168290.html,Im Osten der USA und Kanadas haben polare Luftströme mit starken Windböen für extreme Kälte und Frostbeben gesorgt. Die Temperaturen fielen auf Rekord-Tiefstwerte. Die Rede war vorab von arktischer K… [+2495 chars],,de,'Kälte'
