index,url,valid,domain,title,description,image,published,archive,content,quote,language,keyword
https://orf.at/stories/3290979/,https://orf.at/stories/3290979/,0,orf.at,Weltrettung am Sand,"Von 6. bis 18. November findet die 27. Weltklimakonferenz (COP27) statt, diesmal im ägyptischen Touristenresort Scharm al-Scheich. Das führte dazu, dass neben den fast schon obligatorischen Greenwashing- nun auch „Whitewashing“-Vorwürfe laut wurden. Ägypten w…",https://ibs.orf.at/news?image=https%3A%2F%2Fassets.orf.at%2Fmims%2F2022%2F44%2F35%2Fcrops%2Fw%3D1200%2Ch%3D630%2Cq%3D75%2F1547717_master_565035_klima_cop27_vorschau_im.jpg%3Fs%3D722061e20688e53ac20c527200cd1d6ec33d18d3,2022-10-31T05:00:44Z,https://web.archive.org/web/20221031051642/https://orf.at/stories/3290979/,"Super lustig, einen Klimagipfel in einem Polizeistaat zu haben, gesponsert von Coca-Cola, fasste die Aktivistin und Autorin Naomi Klein die Vorwürfe aus der Klimabewegung kürzlich zusammen. In einem … [+6206 chars]",,de,'Dürre'
https://orf.at/stories/3290292/,https://orf.at/stories/3290292/,0,orf.at,„Neue Gentechnik“ als trojanisches Pferd,"Unterliegt die „neue Gentechnik“ den gleichen Regeln wie die klassische Gentechnik? Geht es nach der EU, lautet die Antwort ja. Doch das könnte sich kommendes Jahr ändern. Ein aktueller Bericht verschiedener Umweltorganisationen warnt eindrücklich vor den Fol…",https://ibs.orf.at/news?image=https%3A%2F%2Fassets.orf.at%2Fmims%2F2022%2F43%2F16%2Fcrops%2Fw%3D1200%2Ch%3D630%2Cq%3D75%2F1540217_master_561916_eu_neue_gentechnik_report_patente_gy.jpg%3Fs%3D47d86f45750a63acda62ee768f63205883bf48d1,2022-10-20T04:06:49Z,http://archive.md/20221020102947/https://orf.at/stories/3290292/,"Aufgedeckt: Wie zwei Biotech-Giganten Patente und neue Gentechnik nutzen, um unsere zukünftige Ernährung zu kontrollieren. So lautet der, nicht wenig reißerische, Titel des am Donnerstag erschienen R… [+6217 chars]",,de,'Dürre'
https://www.bunte.de/stars/star-news/cathy-hummels-sophia-thiel-sie-wehren-sich-gegen-bodyshaming.html,https://www.bunte.de/stars/star-news/cathy-hummels-sophia-thiel-sie-wehren-sich-gegen-bodyshaming.html,0,www.bunte.de,Cathy Hummels & Sophia Thiel: Sie wehren sich gegen Bodyshaming - BUNTE.de,"<ol><li>Cathy Hummels & Sophia Thiel: Sie wehren sich gegen Bodyshaming  BUNTE.de
</li><li>Sophia Thiel und Cathy Hummels: ""Die Fette"" und ""Die Dürre"" senden klare Botschaft  TAG24
</li><li>""Mehr zum Thema"" ansehen in Google News</li></ol>",https://images.bstatic.de/XVm4nSlw13yPZAw_Eqla0jUxjaU=/1200x630/filters:focal(420x177:440x197)/images/291ba557/484b/4336/b6c2/1beec51a8a06.jpg,2022-10-11T10:52:45Z,https://web.archive.org/web/20221011110658/https://www.bunte.de/stars/star-news/cathy-hummels-sophia-thiel-sie-wehren-sich-gegen-bodyshaming.html,Sie haben ein für alle Mal genug: Cathy Hummels (34) und Sophia Thiel (27) wurden in der Vergangenheit auf Instagram &amp; Co. immer wieder mit fiesen Kommentaren und Beleidigungen zu ihrer Figur übe… [+1748 chars],,de,'Dürre'
https://www.teltarif.de/netzausbau-wochenueberblick/news/89644.html,https://www.teltarif.de/netzausbau-wochenueberblick/news/89644.html,0,www.teltarif.de,Netzausbau: Alles baut weiter - 1&1 schweigt,"Die Wochenstatistik festigt den Trend: Die Telekom meldet einige neue Funkmasten, Vodafone stopft LTE-Löcher und o2 baut fleißig bei 5G weiter.",https://www.teltarif.de/img/arch/2022/kw41/netzausbau-wochenueberblick-2og.jpg,2022-10-14T16:30:17Z,https://web.archive.org/web/20221014163732/https://www.teltarif.de/netzausbau-wochenueberblick/news/89644.html,"Wir hatten bereits über den Netz­ausbau der Telekom im August berichtet, hier kommt der Wochen­über­blick - nach Angaben der Netz­betreiber, genauer von Telekom, Voda­fone und Telefónica, ferner mit … [+10332 chars]",,de,'Dürre'
https://www.diepresse.com/6198409/frauke-thies-erneuerbare-sind-schon-die-guenstigste-loesung,https://www.diepresse.com/6198409/frauke-thies-erneuerbare-sind-schon-die-guenstigste-loesung,0,www.diepresse.com,"Frauke Thies: ""Erneuerbare sind schon die günstigste Lösung"" [premium]","Bei genügend politischem Willen sei es möglich, bereits 2035 ein komplett erneuerbares Energiesystem zu haben, sagt Frauke Thies vom Thinktank Agora Energiewende. Dies sei auch wirtschaftlicher, als weiter auf Fossile zu setzen.",https://media.diepresse.com/social_diepresse_magazin_paid/images/uploads_1200/4/8/9/6198409/B6CF19B5-9C48-445F-98EC-83FCE3A3E4F4_v0_h.jpg,2022-10-05T05:17:00Z,https://web.archive.org/web/20221005053427/https://www.diepresse.com/6198409/frauke-thies-erneuerbare-sind-schon-die-guenstigste-loesung,"Bei genügend politischem Willen sei es möglich, bereits 2035 ein komplett erneuerbares Energiesystem zu haben, sagt Frauke Thies vom Thinktank Agora Energiewende. Dies sei auch wirtschaftlicher, als … [+781 chars]",,de,'Dürre'
https://www.tagesspiegel.de/berlin/warme-temperaturen-in-berlin-bis-zu-24-grad-celsius-ende-oktober--das-ist-doch-nicht-normal-8809987.html,https://www.tagesspiegel.de/berlin/warme-temperaturen-in-berlin-bis-zu-24-grad-celsius-ende-oktober--das-ist-doch-nicht-normal-8809987.html,0,www.tagesspiegel.de,Warmer Herbst in Berlin: Bis zu 24 Grad Celsius Ende Oktober – das ist doch nicht normal?,Die Temperaturen in Berlin sind dieser Tage außergewöhnlich hoch. Ein Tiefdruck über dem Atlantik bringt die warme Luft.,https://www.tagesspiegel.de/images/herbstliche-blatter1/alternates/BASE_16_9_W1400/herbstliche-blaetter.jpeg,2022-10-30T09:23:58Z,https://web.archive.org/web/20221030094012/https://www.tagesspiegel.de/berlin/warme-temperaturen-in-berlin-bis-zu-24-grad-celsius-ende-oktober--das-ist-doch-nicht-normal-8809987.html,Es ist 16 Uhr und die Sonne verschwindet so langsam hinter den Hochhäusern. Viele Bäume haben ihre Blätter schon zum Großteil verloren. Aus Reflex greift man beim Rausgehen nach dem Schal. In dem Fal… [+2022 chars],,de,'Dürre'
https://www.tagesspiegel.de/berlin/schiff-ahoi-neues-schiffshebewerk-in-brandenburg-nimmt-betrieb-auf-8706070.html,https://www.tagesspiegel.de/berlin/schiff-ahoi-neues-schiffshebewerk-in-brandenburg-nimmt-betrieb-auf-8706070.html,0,www.tagesspiegel.de,Schiff ahoi! : Neues Schiffshebewerk in Brandenburg nimmt Betrieb auf,Das neue Schiffshebewerk in Niederfinow nimmt seinen Betrieb auf. Bundesverkehrsminister Volker Wissing will das Bauwerk am Dienstag für den Verkehr freigeben.,https://www.tagesspiegel.de/images/schiffshebewerk-niederfinow-aussenpng/alternates/BASE_16_9_W1400/schiffshebewerk-niederfinow-aussenpng.png,2022-10-01T16:55:14Z,https://web.archive.org/web/20221001165759/https://www.tagesspiegel.de/berlin/schiff-ahoi-neues-schiffshebewerk-in-brandenburg-nimmt-betrieb-auf-8706070.html,"Jahre lang war es eine gewaltige Baustelle. Jetzt geht das neue Schiffshebewerk in Niederfinow in Betrieb. Güterschiffe, aber auch Paddelboote können dann einen modernen Fahrstuhl auf dem Wasser nutz… [+2946 chars]",,de,'Dürre'
https://www.tagesspiegel.de/berlin/dramatischer-zustand-der-hauptstadtgeholze-berlins-baume-sterben-immer-haufiger-ab-8783725.html,https://www.tagesspiegel.de/berlin/dramatischer-zustand-der-hauptstadtgeholze-berlins-baume-sterben-immer-haufiger-ab-8783725.html,0,www.tagesspiegel.de,Dramatischer Zustand der Hauptstadtgehölze: Berlins Bäume sterben immer häufiger ab,"Seit Jahren sinkt der Berliner Baumbestand. Vor allem Birken leiden unter der Trockenheit, ähnlich geht es der Linde. Arten aus Nordamerika kommen besser klar.",https://www.tagesspiegel.de/images/baume2jpg/alternates/BASE_16_9_W1400/baume2jpg.jpeg,2022-10-21T17:50:33Z,https://web.archive.org/web/20221021180952/https://www.tagesspiegel.de/berlin/dramatischer-zustand-der-hauptstadtgeholze-berlins-baume-sterben-immer-haufiger-ab-8783725.html,Rote und gelbe Blätter fallen in diesen Herbsttagen großflächig von Berlins Bäumen. Viele Äste waren jedoch schon in den Sommermonaten nicht mit Laub bedeckt. Stattdessen standen die Stadtbäume kahl … [+8056 chars],,de,'Dürre'
https://www.faz.net/aktuell/technik-motor/schlusslicht-oelindustrie-plant-24-000-kilometer-neue-pipelines-18352827.html,https://www.faz.net/aktuell/technik-motor/schlusslicht-oelindustrie-plant-24-000-kilometer-neue-pipelines-18352827.html,0,www.faz.net,Das Schlusslicht der Woche: Lebe lieber lipophil,"Ein guter Tag, um über die Weltrettung zu sprechen: Dank Dart brauchen wir uns um Asteroiden auf Erdkurs nicht mehr zu sorgen. Die Ölbohrteams können sich also ganz dem Befüllen der 24.000 geplanten Kilometer neuer Pipelines widmen.",https://media1.faz.net/ppmedia/aktuell/2675867297/1.8354641/facebook_teaser/der-grosse-profiteur-der.jpg,2022-10-02T06:20:00Z,https://web.archive.org/web/20221002062121/http://www.faz.net/aktuell/technik-motor/schlusslicht-oelindustrie-plant-24-000-kilometer-neue-pipelines-18352827.html,"Das Verwunderlichste an den zerstörten Gasröhren der Nord Stream AG ist, dass Twitter den offensichtlichen Täter noch immer nicht preisgegeben hat. Er, der Öllobbyist, hat demnach, bis jetzt, nichts … [+1791 chars]",,de,'Dürre'
https://www.sueddeutsche.de/politik/afrika-millionen-auf-flucht-vor-dem-wasser-1.5683639,https://www.sueddeutsche.de/politik/afrika-millionen-auf-flucht-vor-dem-wasser-1.5683639,0,www.sueddeutsche.de,Afrika: Millionen auf Flucht vor dem Wasser,"Überschwemmungen in weiten Teilen West- und Zentralafrikas haben laut UN mehr als 3,4 Millionen Menschen vertrieben. Nigeria erlebe die schwerste...",https://www.sueddeutsche.de/assets/png/sz-ecb090256670a577bd629a9718686332.png,2022-10-28T16:45:27Z,https://web.archive.org/web/20221028193917/https://www.sueddeutsche.de/politik/afrika-millionen-auf-flucht-vor-dem-wasser-1.5683639,"Überschwemmungen in weiten Teilen West- und Zentralafrikas haben laut UN mehr als 3,4 Millionen Menschen vertrieben. Nigeria erlebe die schwerste Flutkatastrophe seit einem Jahrzehnt, so eine Spreche… [+502 chars]",,de,'Dürre'
https://www.sueddeutsche.de/politik/steinmeier-mahnt-so-viele-hungernde-wie-nie-1.5675917,https://www.sueddeutsche.de/politik/steinmeier-mahnt-so-viele-hungernde-wie-nie-1.5675917,0,www.sueddeutsche.de,Steinmeier mahnt: So viele Hungernde wie nie,"Bundespräsident Frank-Walter Steinmeier hat dazu aufgerufen, angesichts der Krisen hierzulande den Kampf gegen den wachsenden Hunger in der Welt nicht zu...",https://www.sueddeutsche.de/assets/png/sz-ecb090256670a577bd629a9718686332.png,2022-10-16T16:51:33Z,https://web.archive.org/web/20221016203638/https://www.sueddeutsche.de/politik/steinmeier-mahnt-so-viele-hungernde-wie-nie-1.5675917,"Bundespräsident Frank-Walter Steinmeier hat dazu aufgerufen, angesichts der Krisen hierzulande den Kampf gegen den wachsenden Hunger in der Welt nicht zu vernachlässigen. ""Noch nie mussten mehr Mensc… [+448 chars]",,de,'Dürre'
https://www.sueddeutsche.de/politik/migranten-in-libyen-systematische-verbrechen-1.5672827,https://www.sueddeutsche.de/politik/migranten-in-libyen-systematische-verbrechen-1.5672827,0,www.sueddeutsche.de,"Migranten in Libyen: ""Systematische Verbrechen""",Das UN-Hochkommissariat für Menschenrechte hat weit verbreitete und systematische Verbrechen gegen Migrantinnen und Migranten in Libyen angeprangert. Viele...,https://www.sueddeutsche.de/assets/png/sz-ecb090256670a577bd629a9718686332.png,2022-10-11T16:42:02Z,https://web.archive.org/web/20221011181033/https://www.sueddeutsche.de/politik/migranten-in-libyen-systematische-verbrechen-1.5672827,Das UN-Hochkommissariat für Menschenrechte hat weit verbreitete und systematische Verbrechen gegen Migrantinnen und Migranten in Libyen angeprangert. Viele Migranten seien Opfer von willkürlichen Inh… [+1109 chars],,de,'Dürre'
https://www.sueddeutsche.de/politik/atomkraft-frankreich-ursachen-1.5679462,https://www.sueddeutsche.de/politik/atomkraft-frankreich-ursachen-1.5679462,0,www.sueddeutsche.de,Energiekrise: Risse in Frankreichs Atomstrategie,"Fast die Hälfte der 56 Reaktoren steht immer noch still, das Land importiert enorme Mengen Strom von den Nachbarn. Die Ursachen sind vielfältig.",https://www.sueddeutsche.de/image/sz.1.5231168/1200x675?v=1666363412,2022-10-21T17:00:39Z,https://web.archive.org/web/20221021200842/https://www.sueddeutsche.de/politik/atomkraft-frankreich-ursachen-1.5679462,"Fast die Hälfte der 56 Reaktoren steht immer noch still, das Land importiert enorme Mengen Strom von den Nachbarn. Die Ursachen sind vielfältig.Vor knapp einem Jahr hat das Unternehmen Électricité de… [+6193 chars]",,de,'Dürre'
https://www.welt.de/wissenschaft/article241463269/Klimawandel-Studie-In-Europa-duerfte-nun-alle-20-Jahre-extreme-Duerre-herrschen.html,https://www.welt.de/wissenschaft/article241463269/Klimawandel-Studie-In-Europa-duerfte-nun-alle-20-Jahre-extreme-Duerre-herrschen.html,0,www.welt.de,Forscher erwarten für Europa alle 20 Jahre extreme Dürre,"24.000 Hitzetote und Ernteausfälle: Extreme Wetterbedingungen haben in diesem Sommer zu vielen Problemen geführt. Forscher kommen nun zu dem Schluss, dass solche Zustände künftig weit häufiger auftreten werden.",https://img.welt.de/img/wissenschaft/mobile241463327/2971356887-ci16x9-w1200/Niedrigwasser-am-Rhein.jpg,2022-10-07T06:09:33Z,https://web.archive.org/web/20221007061654/http://www.welt.de/wissenschaft/article241463269/Klimawandel-Studie-In-Europa-duerfte-nun-alle-20-Jahre-extreme-Duerre-herrschen.html,Als Folge des Klimawandels müssen West- und Mitteleuropa alle 20 Jahre mit extremen Dürren wie in diesem Sommer rechnen selbst wenn sich die Erde nicht weiter erwärmen würde. Zu diesem Schluss kommt … [+3146 chars],,de,'Dürre'
https://www.sueddeutsche.de/wissen/klimawandel-extremwetter-duerre-hitzewelle-europa-attributionsforschung-1.5669564,https://www.sueddeutsche.de/wissen/klimawandel-extremwetter-duerre-hitzewelle-europa-attributionsforschung-1.5669564,0,www.sueddeutsche.de,Trockenheit: Wie es zur Sommerdürre kam,Nie zuvor wurde eine Dürre auf einer so großen Fläche in Europa beobachtet. Der Klimawandel hat sie viel wahrscheinlicher gemacht. Künftig könnten solche Ereignisse alle zehn Jahre auftreten.,https://www.sueddeutsche.de/image/sz.1.5669565/1200x675?v=1664988261,2022-10-06T09:00:01Z,https://web.archive.org/web/20221006095114/https://www.sueddeutsche.de/wissen/klimawandel-extremwetter-duerre-hitzewelle-europa-attributionsforschung-1.5669564,Nie zuvor wurde eine Dürre auf einer so großen Fläche in Europa beobachtet. Der Klimawandel hat sie viel wahrscheinlicher gemacht. Künftig könnten solche Ereignisse alle zehn Jahre auftreten. Dass di… [+459 chars],,de,'Dürre'
https://www.morgenpost.de/politik/ausland/article236777771/13-Millionen-Menschen-in-Aethiopien-brauchen-humanitaere-Hilfe.html,https://www.morgenpost.de/politik/ausland/article236777771/13-Millionen-Menschen-in-Aethiopien-brauchen-humanitaere-Hilfe.html,0,www.morgenpost.de,Katastrophen: 13 Millionen Menschen in Äthiopien brauchen humanitäre Hilfe,"Das Land ist nach der Dürre ausgetrocknet, es fehlt an Lebensmitteln, Krankheiten grassieren. Besonders Frauen und Kinder brauchen dringend Hilfe. Die Weltgesundheitsorganisation WHO schlägt Alarm.",https://img.morgenpost.de/img/ausland/crop236777769/1972606008-w820-cv16_9-q85/AEthiopien.jpg,2022-10-28T10:53:22Z,https://web.archive.org/web/20221028134036/https://www.morgenpost.de/politik/ausland/article236777771/13-Millionen-Menschen-in-Aethiopien-brauchen-humanitaere-Hilfe.html,Genf/Addis Abeba. Die Weltgesundheitsorganisation (WHO) warnt vor einer weitreichenden humanitären Krise in Äthiopien. Mittlerweile seien mehr als 13 Millionen Menschen im Norden des Landes am Horn v… [+1397 chars],,de,'Dürre'
https://www.morgenpost.de/web-wissen/article236603649/Deutsche-Buchen-leiden-seit-Jahren-unter-Hitze-und-Duerre.html,https://www.morgenpost.de/web-wissen/article236603649/Deutsche-Buchen-leiden-seit-Jahren-unter-Hitze-und-Duerre.html,0,www.morgenpost.de,Klimawandel: Deutsche Buchen leiden seit Jahren unter Hitze und Dürre,"Für gewöhnlich verfärbt sich das Laub von Bäumen im Herbst: Es wird braun, rot oder gelb. Zuletzt verloren vor allem Buchen aber bereits im Sommer ihre grünen Blätter. Was bedeutet das für die Bäume?",https://img.morgenpost.de/img/web-wissen/crop236603645/0112605443-w820-cv16_9-q85/Buchen.jpg,2022-10-06T04:32:13Z,https://web.archive.org/web/20221006053429/https://www.morgenpost.de/web-wissen/article236603649/Deutsche-Buchen-leiden-seit-Jahren-unter-Hitze-und-Duerre.html,"Göttingen. Das Laub vieler Buchen hat sich in diesem Jahr zu früh verfärbt und ist von den Bäumen gefallen. Für einen Teil der Bäume ist das ein Todesurteil, sagen Experten. Die Gründe für den frühen… [+2540 chars]",,de,'Dürre'
https://www.morgenpost.de/vermischtes/article236612027/Studie-Extreme-Duerre-in-Europa-alle-20-Jahre-zu-erwarten.html,https://www.morgenpost.de/vermischtes/article236612027/Studie-Extreme-Duerre-in-Europa-alle-20-Jahre-zu-erwarten.html,0,www.morgenpost.de,Klimawandel: Studie: Extreme Dürre in Europa alle 20 Jahre zu erwarten,Teile Europas haben einen beispiellosen Dürresommer erlebt. Schon mit dem heutigen Stand des Klimawandels muss der Kontinent damit nun alle 20 Jahre rechnen. Doch die Erde heizt sich weiter auf.,https://img.morgenpost.de/img/vermischtes/crop236612025/9142604079-w820-cv16_9-q85/Niedrigwasser-am-Rhein.jpg,2022-10-07T02:06:24Z,https://web.archive.org/web/20221007023655/https://www.morgenpost.de/vermischtes/article236612027/Studie-Extreme-Duerre-in-Europa-alle-20-Jahre-zu-erwarten.html,London. Als Folge des Klimawandels müssen West- und Mitteleuropa alle 20 Jahre mit extremen Dürren wie in diesem Sommer rechnen - selbst wenn sich die Erde nicht weiter erwärmen würde. Zu diesem Schl… [+3480 chars],,de,'Dürre'
https://www.tagesschau.de/herbst-wetter-oktober-faq-101.html,https://www.tagesschau.de/herbst-wetter-oktober-faq-101.html,0,www.tagesschau.de,Bis zu 27 Grad: Was steckt hinter dem sommerlichen Herbst?,Am Wochenende sind ungewöhnlich hohe Temperaturen für diese Jahreszeit vorausgesagt. Wie und wo es warm wird und welche Wetterkonstellation dahintersteckt - die wichtigsten Antworten.,https://www.tagesschau.de/inland/herbst-oktober-103~_v-original.jpg,2022-10-28T10:49:56Z,https://web.archive.org/web/20221028105317/http://www.tagesschau.de/herbst-wetter-oktober-faq-101.html,"Am Wochenende sind ungewöhnlich hohe Temperaturen für diese Jahreszeit vorausgesagt. Wie und wo es warm wird und welche Wetterkonstellation dahintersteckt - die wichtigsten Antworten.
Das letzte Okt… [+2729 chars]",,de,'Herbst'
https://www.zeit.de/campus/2022-10/quiet-quitting-mentalitaet-arbeitstrend-buero,https://www.zeit.de/campus/2022-10/quiet-quitting-mentalitaet-arbeitstrend-buero,0,www.zeit.de,"Quiet Quitting: Lieber tot arbeiten, als sich tot zu arbeiten","Es ist das Beste, was der Herbst zu bieten hat: Quiet Quitting. Nur noch so viel arbeiten, wie auch im Vertrag steht. Verrückte Idee? Eine Anleitung in fünf Schritten",,2022-10-18T13:21:05Z,https://web.archive.org/web/20221018133800/https://www.zeit.de/campus/2022-10/quiet-quitting-mentalitaet-arbeitstrend-buero,"When browsing with ads:
We collect personal data and also transmit it to third-party providers
 that help us improve and finance our digital content. Some of the information stored on your device, … [+732 chars]",,de,'Herbst'
https://www.spiegel.de/wirtschaft/unternehmen/ryanair-fliegt-bald-weniger-nach-berlin-und-frankfurt-a-d893c528-2334-4078-9111-18c17fc311a7,https://www.spiegel.de/wirtschaft/unternehmen/ryanair-fliegt-bald-weniger-nach-berlin-und-frankfurt-a-d893c528-2334-4078-9111-18c17fc311a7,0,www.spiegel.de,Ryanair fliegt bald weniger nach Berlin und Frankfurt,Die Billigfluglinie Ryanair reduziert ihr Angebot in Berlin und Frankfurt um 40 Prozent im Vergleich zum letzten Winterflugplan. Die Begründung: Zu hohe Flughafenkosten. Der Schritt kommt nicht überraschend.,https://cdn.prod.www.spiegel.de/images/4cccbb09-84f8-4165-b5ee-9012fa2596b0_w1280_r1.77_fpx68.31_fpy45.jpg,2022-10-13T14:45:55Z,https://web.archive.org/web/20221013144809/https://www.spiegel.de/wirtschaft/unternehmen/ryanair-fliegt-bald-weniger-nach-berlin-und-frankfurt-a-d893c528-2334-4078-9111-18c17fc311a7,"Auch Easyjet reduziert Angebot am BER
Der am BER deutlich größere Billigflieger Easyjet hatte bereits im Frühling angekündigt, Flotte und Personal in Schönefeld ab dem Winter deutlich zu reduzieren.… [+556 chars]",,de,'Herbst'
https://www.zeit.de/politik/ausland/2022-10/streik-frankreich-benzinmangel-raffinerie,https://www.zeit.de/politik/ausland/2022-10/streik-frankreich-benzinmangel-raffinerie,0,www.zeit.de,Streiks in Frankreich: In Frankreich hat der heiße Herbst längst begonnen,"Wegen Streiks wird das Benzin in Frankreich knapp, Stromausfälle drohen. Die Regierung kündigt harte Maßnahmen an – und könnte so den Protest befeuern.",,2022-10-12T12:14:02Z,https://web.archive.org/web/20221012123549/https://www.zeit.de/politik/ausland/2022-10/streik-frankreich-benzinmangel-raffinerie,"When browsing with ads:
We collect personal data and also transmit it to third-party providers
 that help us improve and finance our digital content. Some of the information stored on your device, … [+732 chars]",,de,'Herbst'
https://www.zeit.de/gesundheit/2022-10/corona-herbst-omikron-immunitaet-impfung,https://www.zeit.de/gesundheit/2022-10/corona-herbst-omikron-immunitaet-impfung,0,www.zeit.de,"Corona im Herbst: Diese fünf Faktoren bestimmen, wie hart uns die Herbstwelle trifft","Kliniken warnen vor Überlastung, neue Corona-Varianten kommen. Doch es gibt auch Grund zur Hoffnung. Noch ist nicht ausgemacht, wie Pandemieherbst Nummer drei verläuft.",,2022-10-15T09:55:18Z,https://web.archive.org/web/20221015100752/https://www.zeit.de/gesundheit/2022-10/corona-herbst-omikron-immunitaet-impfung,"When browsing with ads:
We collect personal data and also transmit it to third-party providers
 that help us improve and finance our digital content. Some of the information stored on your device, … [+732 chars]",,de,'Herbst'
https://www.spiegel.de/panorama/fat-bear-wahl-in-alaska-betrugsvorwuerfe-nach-9000-verdaechtigen-stimmen-fuer-holly-a-493e7bc6-f3af-4fba-97ec-c04237b76105,https://www.spiegel.de/panorama/fat-bear-wahl-in-alaska-betrugsvorwuerfe-nach-9000-verdaechtigen-stimmen-fuer-holly-a-493e7bc6-f3af-4fba-97ec-c04237b76105,0,www.spiegel.de,"»Fat Bear« -Wahl in Alaska: Betrugsvorwürfe nach 9000 verdächtigen Stimmen für ""Holly""","Welcher Bär hat sich in der Lachs-Saison am meisten Speck angefuttert? Jedes Jahr steigt in Alaska der »Fat Bear«-Wettbewerb, Teilnehmer wählen ihren Favoriten. Diesmal gab es einen schlimmen Verdacht.",https://cdn.prod.www.spiegel.de/images/8cd39e04-7a18-486c-a4c6-83fa6c7f506f_w1280_r1.77_fpx49.34_fpy50.jpg,2022-10-12T05:25:21Z,https://web.archive.org/web/20221012053011/https://www.spiegel.de/panorama/fat-bear-wahl-in-alaska-betrugsvorwuerfe-nach-9000-verdaechtigen-stimmen-fuer-holly-a-493e7bc6-f3af-4fba-97ec-c04237b76105,"Im Frühjahr sind die Bären noch mager, bis zum Herbst haben sie sich beim Lachsfang Fettreserven für die Winterruhe angefressen. Der Wettbewerb soll über das Ökosystem und den Lebensraum der über 200… [+361 chars]",,de,'Herbst'
https://www.zeit.de/news/2022-10/06/herbst-bringt-bis-zu-20-grad-aber-nicht-durchgaengig-sonne,https://www.zeit.de/news/2022-10/06/herbst-bringt-bis-zu-20-grad-aber-nicht-durchgaengig-sonne,0,www.zeit.de,"Wetter: Herbst bringt bis zu 20 Grad, aber nicht durchgängig Sonne",,,2022-10-06T10:52:19Z,https://web.archive.org/web/20221007212157/https://www.zeit.de/news/2022-10/06/herbst-bringt-bis-zu-20-grad-aber-nicht-durchgaengig-sonne,"When browsing with ads:
We collect personal data and also transmit it to third-party providers
 that help us improve and finance our digital content. Some of the information stored on your device, … [+732 chars]",,de,'Herbst'
https://www.zeit.de/news/2022-10/26/der-goldene-herbst-in-berlin-und-brandenburg-setzt-sich-fort,https://www.zeit.de/news/2022-10/26/der-goldene-herbst-in-berlin-und-brandenburg-setzt-sich-fort,0,www.zeit.de,Wetter: Der goldene Herbst in Berlin und Brandenburg setzt sich fort,,,2022-10-26T05:11:31Z,https://web.archive.org/web/20221027090801/https://www.zeit.de/news/2022-10/26/der-goldene-herbst-in-berlin-und-brandenburg-setzt-sich-fort,"When browsing with ads:
We collect personal data and also transmit it to third-party providers
 that help us improve and finance our digital content. Some of the information stored on your device, … [+732 chars]",,de,'Herbst'
https://www.zeit.de/news/2022-10/28/sonniger-herbst-bis-zu-24-grad-in-berlin-und-brandenburg,https://www.zeit.de/news/2022-10/28/sonniger-herbst-bis-zu-24-grad-in-berlin-und-brandenburg,0,www.zeit.de,Wetter: Sonniger Herbst: Bis zu 24 Grad in Berlin und Brandenburg,,,2022-10-28T05:24:25Z,https://web.archive.org/web/20221028184905/https://www.zeit.de/news/2022-10/28/sonniger-herbst-bis-zu-24-grad-in-berlin-und-brandenburg,"When browsing with ads:
We collect personal data and also transmit it to third-party providers
 that help us improve and finance our digital content. Some of the information stored on your device, … [+732 chars]",,de,'Herbst'
