index,url,valid,domain,title,description,image,published,archive,content,quote,language,keyword
https://www.tagesspiegel.de/berlin/obdachlosigkeit-kaltebusse-rollen-wieder--hilfe-fur-berlins-obdachlose-14720765.html,https://www.tagesspiegel.de/berlin/obdachlosigkeit-kaltebusse-rollen-wieder--hilfe-fur-berlins-obdachlose-14720765.html,0,www.tagesspiegel.de,Obdachlosigkeit: Kältebusse rollen wieder – Hilfe für Berlins Obdachlose,"Warme Getränke, Schlafsäcke und eine Fahrt ins Trockene: Die Teams der Kältebusse machen Berliner Nächte für Menschen ohne Zuhause ein Stück sicherer.",https://www.tagesspiegel.de/images/14720762/alternates/BASE_16_9_W1400/1761969705000/unterwegs-mit-dem-kaltebus.jpeg,2025-11-01T04:01:45Z,,"In Berlin sind wieder mehrere Kältebusse im Einsatz, um obdachlosen Menschen in der kalten Jahreszeit zu helfen. Sie fahren durch die Stadt und bieten Unterstützung in Form von warmen Getränken, Klei… [+1474 chars]",,de,'Obdachlosigkeit'
https://www.zeit.de/news/2025-11/01/grippe-und-covid-erhoehen-herzinfarkt-und-schlaganfallrisiko,https://www.zeit.de/news/2025-11/01/grippe-und-covid-erhoehen-herzinfarkt-und-schlaganfallrisiko,0,www.zeit.de,Krankheiten: Grippe und Covid erhöhen Herzinfarkt- und Schlaganfallrisiko,Hier finden Sie Informationen zu dem Thema „Krankheiten“. Lesen Sie jetzt „Grippe und Covid erhöhen Herzinfarkt- und Schlaganfallrisiko“.,https://img.zeit.de/news/2025-11/01/grippe-und-covid-erhoehen-herzinfarkt-und-schlaganfallrisiko-image-group/wide__1300x731,2025-11-01T05:00:16Z,,Grippeviren und Coronaviren erhöhen Forschern zufolge kurz nach der Infektion deutlich das Risiko für akute Herz-Kreislauf-Erkrankungen. So steigt das Risiko eines Herzinfarkts oder eines Schlaganfal… [+3809 chars],,de,'Grippe'
https://www.faz.net/aktuell/gesellschaft/menschen/interview-carolin-kebekus-ueber-mutterschaft-und-geburt-accg-110757872.html,https://www.faz.net/aktuell/gesellschaft/menschen/interview-carolin-kebekus-ueber-mutterschaft-und-geburt-accg-110757872.html,0,www.faz.net,"Interview mit Carolin Kebekus: „Nach der Geburt ging es mir so beschissen, das kann man sich gar nicht vorstellen“","Das Wochenbett war die Hölle, dafür hat schon ihr Baby Humor: Comedienne Carolin Kebekus über den Irrsinn des Mutterseins, den besten Witz im Kreißsaal und Hass gegen Schwangere.",https://media1.faz.net/ppmedia/w1200/aktuell/304915148/1.10757855/facebook_teaser/die-geburt-hat-mich-total-aus.jpg.webp,2025-11-01T09:21:33Z,,"Frau Kebekus, wann haben Sie zuletzt über Ihr Kind gelacht?
Heute Nacht. Eigentlich weint das Kind nachts nur kurz, weil es ein Fläschchen will. Heute war es wach und hat geredet: Mama. Hahaha. Viel… [+11957 chars]",,de,'Schwangere'
https://www.morgenpost.de/politik/article410355590/jetzt-hilft-nur-noch-beten-wie-russland-fuer-mehr-kinder-sorgen-will.html,https://www.morgenpost.de/politik/article410355590/jetzt-hilft-nur-noch-beten-wie-russland-fuer-mehr-kinder-sorgen-will.html,0,www.morgenpost.de,Jetzt hilft nur noch beten: Wie Russland für mehr Kinder sorgen will,Russland fehlt der Nachwuchs für die Front und für den Arbeitsmarkt. Das Land sucht Wege aus der Geburtenkrise und greift zu ungewöhnlichen Mitteln.,https://img.sparknews.funkemedien.de/410355600/410355600_1761993755_v16_9_1600.jpeg,2025-11-01T10:47:59Z,,"Zu wenig Gebärfreudigkeit in Russland? Vielleicht hilft ja beten: Ab 1. Dezember soll es in russisch-orthodoxen Kirchen ein neues Gebet geben, zur Ermahnung von Frauen, die beabsichtigen, ein ungebor… [+5210 chars]",,de,'Kinder'
https://www.focus.de/panorama/welt/risiken-fuer-ungeborenes-kind-warum-muetter-waehrend-der-schwangerschaft-marihuana-konsumierten_25c5fc97-f68e-4697-8fcd-86b10f235391.html,https://www.focus.de/panorama/welt/risiken-fuer-ungeborenes-kind-warum-muetter-waehrend-der-schwangerschaft-marihuana-konsumierten_25c5fc97-f68e-4697-8fcd-86b10f235391.html,0,www.focus.de,Risiken für ungeborenes Kind: Warum Mütter während der Schwangerschaft Marihuana konsumierten,Trotz Warnungen seitens der Forschung konsumieren einige Schwangere Cannabis. In den sozialen Medien berichten sie von der positiven Wirkung der Pflanze und fordern eine Entstigmatisierung.,https://quadro.burda-forward.de/ctf/d2e9eeac-4467-4a0e-9c7d-ad23044a9f7b.cf5b3cf0-f303-4aad-b7e4-ee0bb3bbbd3b.png?im=RegionOfInterestCrop%3D%281200%2C630%29%2CregionOfInterest%3D%28750%2C531%29&hash=def06c5633b3f40880f91d5e6a64ac425df7b5dbd97c8cc2f7131d68cb0b81e1,2025-11-01T14:19:11Z,,"Als Tatiana Sanchez vor fünf Jahren schwanger wurde, litt sie unter extremer Übelkeit und Erbrechen. Keine Behandlung habe geholfen. Schließlich griff die 30-Jährige zu einem Mittel, das viele ablehn… [+2758 chars]",,de,'Schwangere'
https://www.focus.de/panorama/welt/risiken-fuer-ungeborenes-kind-warum-muetter-waehrend-der-schwangerschaft-cannabis-konsumierten_25c5fc97-f68e-4697-8fcd-86b10f235391.html,https://www.focus.de/panorama/welt/risiken-fuer-ungeborenes-kind-warum-muetter-waehrend-der-schwangerschaft-cannabis-konsumierten_25c5fc97-f68e-4697-8fcd-86b10f235391.html,0,www.focus.de,Risiken für ungeborenes Kind: Warum Mütter während der Schwangerschaft Cannabis konsumierten,Trotz Warnungen seitens der Forschung konsumieren einige Schwangere Cannabis. In den sozialen Medien berichten sie von der positiven Wirkung der Pflanze und fordern eine Entstigmatisierung.,https://quadro.burda-forward.de/ctf/d2e9eeac-4467-4a0e-9c7d-ad23044a9f7b.cf5b3cf0-f303-4aad-b7e4-ee0bb3bbbd3b.png?im=RegionOfInterestCrop%3D%281200%2C630%29%2CregionOfInterest%3D%28750%2C531%29&hash=def06c5633b3f40880f91d5e6a64ac425df7b5dbd97c8cc2f7131d68cb0b81e1,2025-11-01T14:19:11Z,,"Als Tatiana Sanchez vor fünf Jahren schwanger wurde, litt sie unter extremer Übelkeit und Erbrechen. Keine Behandlung habe geholfen. Schließlich griff die 30-Jährige zu einem Mittel, das viele ablehn… [+2758 chars]",,de,'Schwangere'
https://www.faz.net/aktuell/rhein-main/wirtschaft/sammelklage-gegen-gas-de-verbraucherzentrale-hessen-bittet-um-spenden-accg-110754619.html,https://www.faz.net/aktuell/rhein-main/wirtschaft/sammelklage-gegen-gas-de-verbraucherzentrale-hessen-bittet-um-spenden-accg-110754619.html,0,www.faz.net,Spenden für Prozess nötig: Verbraucherzentrale bereitet Klage gegen Gas.de vor,Fristlose Kündigungen von Gas- und Stromverträgen Ende 2021 beschäftigen Verbraucherschützer weiterhin. Die Verbraucherzentrale Hessen bereitet eine Klage gegen Gas.de vor.,https://media1.faz.net/ppmedia/w1200/aktuell/wirtschaft/3557558283/1.10754625/facebook_teaser/stromio-und-gas-de-kunden-sind.jpg.webp,2025-11-02T10:17:31Z,,Im Streit mit Energiediscountern über die fristlose Kündigung von Strom- und Gasversorgungsverträgen im Dezember 2021 geht die Verbraucherzentrale Hessen jetzt einen ungewöhnlichen Weg. Um die Prozes… [+3570 chars],,de,'Gas'
https://www.zeit.de/news/2025-11/02/kinder-bieten-seniorin-hilfe-an-und-klauen-dann-portemonnaie,https://www.zeit.de/news/2025-11/02/kinder-bieten-seniorin-hilfe-an-und-klauen-dann-portemonnaie,0,www.zeit.de,Kriminalität: Kinder bieten Seniorin Hilfe an und klauen dann Portemonnaie,Hier finden Sie Informationen zu dem Thema „Kriminalität“. Lesen Sie jetzt „Kinder bieten Seniorin Hilfe an und klauen dann Portemonnaie“.,https://img.zeit.de/news/2025-11/02/kinder-bieten-seniorin-hilfe-an-und-klauen-dann-portemonnaie-image-group/wide__1300x731,2025-11-02T13:10:13Z,,"Drei Jungen haben einer Seniorin in Halle erst Hilfe angeboten und dann ihre Geldbörse geklaut. Die Kinder gaben gegenüber der Frau an, beim Hochtragen der Einkaufstasche behilflich sein zu wollen un… [+238 chars]",,de,'Kinder'
https://www.golem.de/sonstiges/zustimmung/auswahl.html?from=https://www.golem.de/news/anzeige-zu-weihnachten-chancen-schenken-statt-pralinen-2511-201756.html&referer=https://t.co/1fa618a001,https://www.golem.de/sonstiges/zustimmung/auswahl.html?from=https://www.golem.de/news/anzeige-zu-weihnachten-chancen-schenken-statt-pralinen-2511-201756.html&referer=https://t.co/1fa618a001,0,www.golem.de,Anzeige: Zu Weihnachten Chancen schenken statt Pralinen,"Die Initiative ""Spenden statt Schenken"" von SOS-Kinderdorf verwandelt Weihnachtsgeschenke in konkrete Unterstützung für Kinder und Familien. So können Unternehmen soziale Verantwortung leben. (Wirtschaft)",,2025-11-03T08:00:01Z,,"Besuchen Sie Golem.de wie gewohnt mit Werbung und Tracking,
 indem Sie der Nutzung aller Cookies zustimmen.
 Details zum Tracking finden Sie im Privacy Center.
Skript wurde nicht geladen. Informat… [+607 chars]",,de,'Kinder'
https://www.zeit.de/news/2025-11/03/kinder-auf-halloween-tour-angegriffen-zwei-leicht-verletzt,https://www.zeit.de/news/2025-11/03/kinder-auf-halloween-tour-angegriffen-zwei-leicht-verletzt,0,www.zeit.de,Polizei ermittelt: Kinder auf Halloween-Tour angegriffen - zwei leicht verletzt,Hier finden Sie Informationen zu dem Thema „Polizei ermittelt“. Lesen Sie jetzt „Kinder auf Halloween-Tour angegriffen - zwei leicht verletzt“.,https://img.zeit.de/news/2025-11/03/kinder-auf-halloween-tour-angegriffen-zwei-leicht-verletzt-image-group/wide__1300x731,2025-11-03T10:39:16Z,,"In Gräfenthal sind Kinder auf ihrer Halloween-Tour angegriffen und beleidigt worden. Sie waren von Tür zu Tür gezogen, um Süßigkeiten zu bekommen. Eine Mutter meldete den Übergriff auf ihres und weit… [+333 chars]",,de,'Kinder'
https://www.stern.de/familie/luftfeuchtigkeit-senken--diese-tipps-helfen-am-besten-33946060.html,https://www.stern.de/familie/luftfeuchtigkeit-senken--diese-tipps-helfen-am-besten-33946060.html,0,www.stern.de,Gegen Schimmel: Mit diesen Tipps können Sie zu Hause die Luftfeuchtigkeit senken,"Wenn Sie zuhause beschlagene Fensterscheiben sehen, kann es sein, dass die Luftfeuchtigkeit zu hoch ist. Wie Sie sie senken können und was Sie noch beachten sollten.",https://image.stern.de/33946062/t/Fu/v4/w1440/r1.7778/-/luftfeuchtigkeit-senken.jpg,2025-11-03T11:27:00Z,,"Kopiere den aktuellen Link
Zur Merkliste hinzufügen
Wenn Sie zuhause beschlagene Fensterscheiben sehen, kann es sein, dass die Luftfeuchtigkeit zu hoch ist. Wie Sie sie senken können und was Sie no… [+6284 chars]",,de,'Kälte'
https://www.zeit.de/news/2025-11/03/christina-block-darf-zwei-ihrer-kinder-weiterhin-nicht-sehen,https://www.zeit.de/news/2025-11/03/christina-block-darf-zwei-ihrer-kinder-weiterhin-nicht-sehen,0,www.zeit.de,Dänemark: Christina Block darf zwei ihrer Kinder weiterhin nicht sehen,Hier finden Sie Informationen zu dem Thema „Dänemark“. Lesen Sie jetzt „Christina Block darf zwei ihrer Kinder weiterhin nicht sehen“.,https://img.zeit.de/news/2025-11/03/christina-block-darf-zwei-ihrer-kinder-weiterhin-nicht-sehen-image-group/wide__1300x731,2025-11-03T12:23:01Z,,Der Hamburger Unternehmerin Christina Block wird von der dänischen Justiz weiterhin der Kontakt zu ihren beiden minderjährigen Kindern untersagt. Ein Berufungsgericht in Viborg bestätigte nach Angabe… [+2345 chars],,de,'Kinder'
https://www.tagesspiegel.de/internationales/so-erleben-ukrainer-die-massiven-stromausfalle-am-schwersten-ist-diese-stille--wenn-kein-licht-brennt-und-kein-laut-zu-horen-ist-14736323.html,https://www.tagesspiegel.de/internationales/so-erleben-ukrainer-die-massiven-stromausfalle-am-schwersten-ist-diese-stille--wenn-kein-licht-brennt-und-kein-laut-zu-horen-ist-14736323.html,0,www.tagesspiegel.de,So erleben Ukrainer die massiven Stromausfälle: „Am schwersten ist diese Stille – wenn kein Licht brennt und kein Laut zu hören ist“,"Den ganzen Oktober über haben russische Angriffe das ukrainische Energiesystem zermürbt. Jetzt steht die eigentliche Kälte erst bevor – und die Frage stellt sich, wie lange die Menschen noch durchhalten.",https://www.tagesspiegel.de/images/14736179/alternates/BASE_16_9_W1400/1762178256000/ukraine-russia-conflict-war.jpeg,2025-11-03T14:12:20Z,,"Den ganzen Oktober über haben russische Angriffe das ukrainische Energiesystem zermürbt. Jetzt steht die eigentliche Kälte erst bevor und die Frage stellt sich, wie lange die Menschen noch durchhalte… [+1 chars]",,de,'Kälte'
https://www.tagesspiegel.de/internationales/am-schwersten-ist-diese-stille-so-erleben-ukrainer-die-massiven-stromausfalle-14736323.html,https://www.tagesspiegel.de/internationales/am-schwersten-ist-diese-stille-so-erleben-ukrainer-die-massiven-stromausfalle-14736323.html,0,www.tagesspiegel.de,„Am schwersten ist diese Stille“: So erleben Ukrainer die massiven Stromausfälle,"Den ganzen Oktober über haben russische Angriffe das ukrainische Energiesystem zermürbt. Jetzt steht die eigentliche Kälte erst bevor – und die Frage stellt sich, wie lange die Menschen noch durchhalten.",https://www.tagesspiegel.de/images/14747882/alternates/BASE_16_9_W1400/1762251980000/topshot-ukraine-russia-conflict-war.jpeg,2025-11-03T14:12:20Z,,Im Zentrum Kyjiws betrachtet eine Familie mit fünf Kindern eine schwarze Shahed-Drohne ein neues Exponat der Ausstellung erbeuteter russischer Militärtechnik. Das Exponat wird erst seit ein paar Tage… [+7685 chars],,de,'Kälte'
https://www.freitag.de/autoren/the-guardian/state-of-climate-action-globaler-kohleverbrauch-stieg-2024-auf-rekordhoch,https://www.freitag.de/autoren/the-guardian/state-of-climate-action-globaler-kohleverbrauch-stieg-2024-auf-rekordhoch,0,www.freitag.de,Globaler Kohleverbrauch stieg 2024 auf Rekordhoch,"Vor der Weltklimakonferenz COP 30 kommt eine Untersuchung zu dem Ergebnis, dass die Treibhausemissionen 2024 einen Höchststand erreicht haben – trotz „exponentiellen“ Wachstums der erneuerbaren Energien Trotz der weltweiten Bemühungen um eine Umstellung auf s…",https://www.freitag.de/autoren/the-guardian/state-of-climate-action-globaler-kohleverbrauch-stieg-2024-auf-rekordhoch/@@images/image/great,2025-11-03T15:14:27Z,,Trotz der weltweiten Bemühungen um eine Umstellung auf saubere Energie erreichte der globale Kohleverbrauch im vergangenen Jahr einen Rekordwert. Demnach ging der Anteil der Kohle an der Stromgewinnu… [+5617 chars],,de,'Kohle'
https://www.diepresse.com/20265066/coronawelle-ebbt-ab-grippewelle-vor-ausbruch,https://www.diepresse.com/20265066/coronawelle-ebbt-ab-grippewelle-vor-ausbruch,0,www.diepresse.com,"Coronawelle ebbt ab, Grippewelle vor Ausbruch",Die Zahl der Krankenstände wegen Atemwegserkrankungen war zuletzt rückläufig. Die Coronawelle dürfte ihren Höhepunkt erreicht haben – und demnächst von der Grippewelle abgelöst werden.,https://img.diepresse.com/public/incoming/e9xn58-imago-images-0245309785/alternates/DPR_SOCIAL_NACHRICHTEN/imago%20images%200245309785,2025-11-03T15:15:43Z,,"Die Zahl der Krankenstände wegen Atemwegserkrankungen war zuletzt rückläufig. Die Coronawelle dürfte ihren Höhepunkt erreicht haben und demnächst von der Grippewelle abgelöst werden.
61.849 Personen… [+5208 chars]",,de,'Grippe'
https://www.zeit.de/news/2025-11/03/hans-zimmer-sagt-zwei-konzerte-wegen-grippeerkrankung-ab,https://www.zeit.de/news/2025-11/03/hans-zimmer-sagt-zwei-konzerte-wegen-grippeerkrankung-ab,0,www.zeit.de,Frankfurt und Mannheim: Hans Zimmer sagt zwei Konzerte wegen Grippeerkrankung ab,Hier finden Sie Informationen zu dem Thema „Frankfurt und Mannheim“. Lesen Sie jetzt „Hans Zimmer sagt zwei Konzerte wegen Grippeerkrankung ab“.,https://img.zeit.de/news/2025-11/03/hans-zimmer-sagt-zwei-konzerte-wegen-grippeerkrankung-ab-image-group/wide__1300x731,2025-11-03T15:26:08Z,,"Große Enttäuschung für die Fans von Hans Zimmer. Der deutsche Hollywood-Komponist («The Dark Knight», «Fluch der Karibik») muss krankheitsbedingt zwei seiner Deutschland-Konzerte verschieben. Der 68-… [+1469 chars]",,de,'Grippe'
https://www.stern.de/lifestyle/frankfurt-und-mannheim--hans-zimmer-sagt-zwei-konzerte-wegen-grippeerkrankung-ab-36185128.html,https://www.stern.de/lifestyle/frankfurt-und-mannheim--hans-zimmer-sagt-zwei-konzerte-wegen-grippeerkrankung-ab-36185128.html,0,www.stern.de,Frankfurt und Mannheim: Hans Zimmer sagt zwei Konzerte wegen Grippeerkrankung ab,"Weil Hollywood-Komponist Hans Zimmer erkrankt ist, finden seine Konzerte in Frankfurt und Mannheim nicht statt. Doch die Tournee soll in Kürze fortgesetzt und die Auftritte sollen nachgeholt werden.",https://image.stern.de/36185130/t/py/v1/w1440/r1.7778/-/03--t3ufojv4lpv9axs2048jpeg---eb09e4c743744154.jpg,2025-11-03T15:26:08Z,,"Kopiere den aktuellen Link
Zur Merkliste hinzufügen
Weil Hollywood-Komponist Hans Zimmer erkrankt ist, finden seine Konzerte in Frankfurt und Mannheim nicht statt. Doch die Tournee soll in Kürze fo… [+1584 chars]",,de,'Grippe'
https://orf.at/stories/3410461/,https://orf.at/stories/3410461/,0,orf.at,"Weniger Strom-, mehr Gasverbrauch im Sommerhalbjahr",,https://orf.at/mojo/1_4_1/storyserver//news/common/images/og-fallback-news.png,2025-11-04T05:59:53Z,,"In Österreich ist im Sommerhalbjahr von April bis September um 0,8 Prozent weniger Strom verbraucht worden als im gleichen Zeitraum 2024. Die Erzeugung von Strom fiel zugleich um 9,1 Prozent auf 37,6… [+704 chars]",,de,'Gasspeicher'
https://www.zeit.de/news/2025-11/05/unfall-zwischen-schulbus-und-transporter,https://www.zeit.de/news/2025-11/05/unfall-zwischen-schulbus-und-transporter,0,www.zeit.de,Kinder an Bord: Unfall zwischen Schulbus und Transporter,Hier finden Sie Informationen zu dem Thema „Kinder an Bord“. Lesen Sie jetzt „Unfall zwischen Schulbus und Transporter“.,https://img.zeit.de/news/2025-11/05/unfall-zwischen-schulbus-und-transporter-image-group/wide__1300x731,2025-11-05T10:43:32Z,,Bei einer Kollision zwischen einem Schulbus und einem Transporter ist ein Fahrer leicht verletzt worden. Nach Angaben der Polizei soll der Bus am Morgen mit Kindern an Bord in Stralendorf (Landkreis … [+352 chars],,de,'Kinder'
https://www.zeit.de/news/2025-11/05/behoerde-gibt-gruenes-licht-fuer-sanierung-kaufhaus-goerlitz,https://www.zeit.de/news/2025-11/05/behoerde-gibt-gruenes-licht-fuer-sanierung-kaufhaus-goerlitz,0,www.zeit.de,Denkmalschutz: Behörde gibt grünes Licht für Sanierung Kaufhaus Görlitz,Hier finden Sie Informationen zu dem Thema „Denkmalschutz“. Lesen Sie jetzt „Behörde gibt grünes Licht für Sanierung Kaufhaus Görlitz“.,https://img.zeit.de/news/2025-11/05/behoerde-gibt-gruenes-licht-fuer-sanierung-kaufhaus-goerlitz-image-group/wide__1300x731,2025-11-05T10:51:54Z,,Bei der geplanten Sanierung des Görlitzer Kaufhauses ist eine weitere Hürde genommen. Die Landesdirektion Sachsen gab jetzt als oberste Denkmalschutzbehörde des Freistaates grünes Licht für den künft… [+2994 chars],,de,'Sanierung'
https://www.stern.de/gesellschaft/regional/sachsen/denkmalschutz--behoerde-gibt-gruenes-licht-fuer-sanierung-kaufhaus-goerlitz-36190716.html,https://www.stern.de/gesellschaft/regional/sachsen/denkmalschutz--behoerde-gibt-gruenes-licht-fuer-sanierung-kaufhaus-goerlitz-36190716.html,0,www.stern.de,Denkmalschutz: Behörde gibt grünes Licht für Sanierung Kaufhaus Görlitz,Das Görlitzer Jugendstil-Kaufhaus soll aus dem Dornröschenschlaf erwachen. Strittige Punkte zum Denkmalschutz sind nun beigelegt. Die Planungen können weitergehen.,https://image.stern.de/36190718/t/Hz/v1/w1440/r1.7778/-/05--icho2lerc2v7axs2048jpeg---9905fdaf0e6a2825.jpg,2025-11-05T10:51:54Z,,"Kopiere den aktuellen Link
Zur Merkliste hinzufügen
Das Görlitzer Jugendstil-Kaufhaus soll aus dem Dornröschenschlaf erwachen. Strittige Punkte zum Denkmalschutz sind nun beigelegt. Die Planungen k… [+3434 chars]",,de,'öffentliche Gebäude'
https://www.zeit.de/news/2025-11/05/who-startet-impfaktion-fuer-44-000-kinder-im-gazastreifen,https://www.zeit.de/news/2025-11/05/who-startet-impfaktion-fuer-44-000-kinder-im-gazastreifen,0,www.zeit.de,Gesundheit: WHO startet Impfaktion für 44.000 Kinder im Gazastreifen,Hier finden Sie Informationen zu dem Thema „Gesundheit“. Lesen Sie jetzt „WHO startet Impfaktion für 44.000 Kinder im Gazastreifen“.,https://img.zeit.de/news/2025-11/05/who-startet-impfaktion-fuer-44-000-kinder-im-gazastreifen-image-group/wide__1300x731,2025-11-05T15:23:53Z,,"Die Weltgesundheitsorganisation (WHO) will am Sonntag eine umfangreiche Impfkampagne im Gazastreifen starten. 44.000 Kinder, die in den zwei Jahren des israelischen Krieges gegen die Terrororganisati… [+927 chars]",,de,'Kinder'
https://www.zeit.de/news/2025-11/06/schwangere-bei-autounfall-lebensgefaehrlich-verletzt,https://www.zeit.de/news/2025-11/06/schwangere-bei-autounfall-lebensgefaehrlich-verletzt,0,www.zeit.de,In Dorsten: Schwangere bei Autounfall lebensgefährlich verletzt,Hier finden Sie Informationen zu dem Thema „In Dorsten“. Lesen Sie jetzt „Schwangere bei Autounfall lebensgefährlich verletzt“.,https://img.zeit.de/news/2025-11/06/schwangere-bei-autounfall-lebensgefaehrlich-verletzt-image-group/wide__1300x731,2025-11-06T21:21:35Z,,"In Dorsten sind bei einem Unfall acht Menschen verletzt worden, darunter eine schwangere Frau lebensgefährlich. Sie sei mit einem Rettungshubschrauber in eine Klinik gebracht worden, sagte eine Poliz… [+309 chars]",,de,'Schwangere'
https://www.zeit.de/news/2025-11/07/mangel-an-therapieplaetzen-fuer-minderjaehrige-systemsprenger,https://www.zeit.de/news/2025-11/07/mangel-an-therapieplaetzen-fuer-minderjaehrige-systemsprenger,0,www.zeit.de,"Kinder- und Jugendhilfe: Mangel an Therapieplätzen für minderjährige ""Systemsprenger""","Hier finden Sie Informationen zu dem Thema „Kinder- und Jugendhilfe“. Lesen Sie jetzt „Mangel an Therapieplätzen für minderjährige ""Systemsprenger""“.",https://img.zeit.de/news/2025-11/07/mangel-an-therapieplaetzen-fuer-minderjaehrige-systemsprenger-image-group/wide__1300x731,2025-11-07T06:34:36Z,,Sogenannte Systemsprenger - also Kinder und Jugendliche mit besonders herausforderndem Verhalten - finden kaum geeignete Therapieplätze. Das Unterangebot an geschlossenen Unterbringungsplätzen in Ein… [+2285 chars],,de,'Kinder'
https://www.zeit.de/news/2025-11/07/schwangere-nach-autounfall-in-dorsten-ausser-lebensgefahr,https://www.zeit.de/news/2025-11/07/schwangere-nach-autounfall-in-dorsten-ausser-lebensgefahr,0,www.zeit.de,Acht Verletzte: Schwangere nach Autounfall in Dorsten außer Lebensgefahr,Hier finden Sie Informationen zu dem Thema „Acht Verletzte“. Lesen Sie jetzt „Schwangere nach Autounfall in Dorsten außer Lebensgefahr“.,https://img.zeit.de/news/2025-11/07/schwangere-nach-autounfall-in-dorsten-ausser-lebensgefahr-image-group/wide__1300x731,2025-11-07T09:50:34Z,,Nach einem schweren Autounfall in Dorsten (Kreis Recklinghausen) mit acht Verletzten ist eine 21-jährige schwangere Unfallbeteiligte außer Lebensgefahr. Das sagte eine Polizeisprecherin. Die Frau war… [+703 chars],,de,'Schwangere'
https://www.bild.de/news/wetter/wetterexperte-temperaturen-fallen-am-wochenende-um-bis-zu-15-grad-6902163e8ef09a6aa251cc59,https://www.bild.de/news/wetter/wetterexperte-temperaturen-fallen-am-wochenende-um-bis-zu-15-grad-6902163e8ef09a6aa251cc59,0,www.bild.de,Regen und Kälte am Wochenende - Och Nööö-vember!,"Winterjacke statt Übergangsmantel, Schal statt Sonnenbrille – Deutschland droht der Kälteschock! Davor warnt ein Meteorologe.","https://images.bild.de/6902163e8ef09a6aa251cc59/f3bf0c09809b1f81951297f74d868e3c,6b0527fe?w=1280",2025-11-07T09:56:14Z,,Schal und Winterjacke rausholen Deutschland droht der Kälteschock! Die Temperaturen sollen am Wochenende um bis zu 15 Grad abrauschen. Ein abruptes Ende des herbstlichen Wohlfühlwetters der vergangen… [+2172 chars],,de,'Kälte'
https://www.zeit.de/familie/2025-11/gewalt-erziehung-25-jahre-gesetz,https://www.zeit.de/familie/2025-11/gewalt-erziehung-25-jahre-gesetz,0,www.zeit.de,"Gewalt gegen Kinder: ""Du bist halt zu blöd""",Seit 25 Jahren haben Kinder das Recht auf gewaltfreie Erziehung. Doch vor allem emotionale Gewalt lässt sich nur schwer aus Familien vertreiben – und aus der Schule.,https://img.zeit.de/familie/2025-11/gewalt-erziehung-25-jahre/wide__1300x731,2025-11-08T12:10:19Z,,"Schließen
Artikelzusammenfassung
Gewalt in der Schule war früher normal, doch heute hat sich viel verändert: Prügelstrafen sind verboten, Eltern schlagen seltener. Trotzdem ist Gewalt gegen Kinder … [+508 chars]",,de,'Kinder'
https://www.stern.de/gesellschaft/regional/niedersachsen-bremen/landesparteitag--fruehling-des-protests--gruene-warnen-vor-sozialer-kaelte-36243706.html,https://www.stern.de/gesellschaft/regional/niedersachsen-bremen/landesparteitag--fruehling-des-protests--gruene-warnen-vor-sozialer-kaelte-36243706.html,0,www.stern.de,Landesparteitag: Frühling des Protests? Grüne warnen vor sozialer Kälte,Ex-Parteichefin Ricarda Lang attackiert Kanzler Merz und dessen Pläne für Einschnitte im Sozialsystem. Unterstützung bekommt sie von Niedersachsens Vize-Regierungschefin.,https://image.stern.de/36243708/t/BK/v1/w1440/r1.7778/-/08--325ppevjpfv5axs2048jpeg---b55d48760ec26e7f.jpg,2025-11-08T15:26:25Z,,"Kopiere den aktuellen Link
Zur Merkliste hinzufügen
Ex-Parteichefin Ricarda Lang attackiert Kanzler Merz und dessen Pläne für Einschnitte im Sozialsystem. Unterstützung bekommt sie von Niedersachse… [+1656 chars]",,de,'Kälte'
https://www.zeit.de/news/2025-11/08/fruehling-des-protests-gruene-warnen-vor-sozialer-kaelte,https://www.zeit.de/news/2025-11/08/fruehling-des-protests-gruene-warnen-vor-sozialer-kaelte,0,www.zeit.de,Landesparteitag: Frühling des Protests? Grüne warnen vor sozialer Kälte,Hier finden Sie Informationen zu dem Thema „Landesparteitag“. Lesen Sie jetzt „Frühling des Protests? Grüne warnen vor sozialer Kälte“.,https://img.zeit.de/news/2025-11/08/fruehling-des-protests-gruene-warnen-vor-sozialer-kaelte-image-group/wide__1300x731,2025-11-08T15:26:25Z,,"Die Grünen warnen vor Kürzungen im Sozialsystem durch die Bundesregierung. «Wenn auf den angekündigten Herbst der Reformen, der jetzt zum Herbst der Kommissionen wird, tatsächlich ein Winter der sozi… [+1470 chars]",,de,'Kälte'
