index,url,valid,domain,title,description,image,published,archive,content,quote,language,keyword
https://www.wa.de/verbraucher/kindergeld-buergergeld-krankenkasse-umtausch-neuerungen-aenderungen-2023-fuehrerschein-steuern-rente-91995522.html,https://www.wa.de/verbraucher/kindergeld-buergergeld-krankenkasse-umtausch-neuerungen-aenderungen-2023-fuehrerschein-steuern-rente-91995522.html,0,www.wa.de,"Änderungen für 2023: Netflix, Rente, Führerschein und AU - das ist neu - wa.de","<ol><li>Änderungen für 2023: Netflix, Rente, Führerschein und AU - das ist neu  wa.de
</li><li>Änderungen ab Januar: Rente, Energiepauschale, Kindergeld  fr.de
</li><li>Änderungen 2023: Was neu ist und welche Gesetze und Regelungen sich ändern  Merkur.de
<…",https://www.wa.de/bilder/2022/12/23/91995522/27668679-kennzahlen-zur-inflation-im-euroraum-3Nfe.jpg,2023-01-03T14:12:00Z,,"<ol><li>wa.de</li><li>Verbraucher</li></ol>Erstellt: 03.01.2023, 15:12 Uhr
Von: Simon Stock
KommentareTeilen
Bei Netflix, Steuern, Rente, Krankenkassen, Kindergeld sowie rund ums Auto und AU müsse… [+5343 chars]",,de,'Kinder'
https://www.morgenpost.de/ratgeber/article237278119/heizkosten-heizoel-heizung-gas-austauschpflicht-verbraucher.html,https://www.morgenpost.de/ratgeber/article237278119/heizkosten-heizoel-heizung-gas-austauschpflicht-verbraucher.html,0,www.morgenpost.de,Tausch bald verpflichtend: Frist läuft 2023 aus: Heizung tauschen – wer reagieren muss,"Eigentümer einer Öl- oder Gasheizung müssen diese 2023 womöglich verpflichtend tauschen. Lesen Sie hier, welche Verbraucher schnell reagieren sollten.",https://img.morgenpost.de/img/incoming/crop237234943/4112602310-w820-cv16_9-q85/4616faa0-85d9-11ed-b82a-5d2e927d4a9d.jpg,2023-01-03T14:59:08Z,https://web.archive.org/web/20230103172343/https://www.morgenpost.de/ratgeber/article237278119/heizkosten-heizoel-heizung-gas-austauschpflicht-verbraucher.html,Berlin. Die primär vom Ukraine-Krieg verursachte Energie- und Preiskrise spüren die Verbraucher in Deutschland gerade im Winter mit Blick auf die Heizkosten. Gas und Strom waren im Herbst 2022 teurer… [+5349 chars],,de,'Gas'
https://www.sueddeutsche.de/muenchen/energiekosten-nebenkostenabrechnung-energiearmut-heizkosten-1.5726407,https://www.sueddeutsche.de/muenchen/energiekosten-nebenkostenabrechnung-energiearmut-heizkosten-1.5726407,0,www.sueddeutsche.de,Wärmefonds der Stadtwerke: Wer mit Zuschüssen zu den Heizkosten rechnen darf,Berechtigte können von Mitte Januar an Geld aus dem Wärmefonds der Stadtwerke beantragen. Denn die Kosten könnten sich trotz der Preisbremsen des Bundes verdoppeln. So hoch fallen die Zahlungen aus.,https://www.sueddeutsche.de/image/sz.1.5680052/1200x675?v=1672762265,2023-01-03T16:11:14Z,https://web.archive.org/web/20230103162827/https://www.sueddeutsche.de/muenchen/energiekosten-nebenkostenabrechnung-energiearmut-heizkosten-1.5726407,Berechtigte können von Mitte Januar an Geld aus dem Wärmefonds der Stadtwerke beantragen. Denn die Kosten könnten sich trotz der Preisbremsen des Bundes verdoppeln. So hoch fallen die Zahlungen aus.D… [+3921 chars],,de,'Heizkosten'
https://www.zeit.de/news/2023-01/03/vorbereitungen-fuer-behelfsbruecke-in-luebeck-laufen,https://www.zeit.de/news/2023-01/03/vorbereitungen-fuer-behelfsbruecke-in-luebeck-laufen,0,www.zeit.de,Sanierung: Vorbereitungen für Behelfsbrücke in Lübeck laufen,,,2023-01-03T16:46:38Z,https://web.archive.org/web/20230103170803/https://www.zeit.de/news/2023-01/03/vorbereitungen-fuer-behelfsbruecke-in-luebeck-laufen,"When browsing with ads:
We collect personal data and also transmit it to third-party providers
 that help us improve and finance our digital content. Some of the information stored on your device, … [+732 chars]",,de,'Sanierung'
https://www.handelsblatt.com/audio/today/handelsblatt-today-anti-kohle-proteste-in-luetzerath-ist-der-braunkohletagebau-alternativlos/28901640.html,https://www.handelsblatt.com/audio/today/handelsblatt-today-anti-kohle-proteste-in-luetzerath-ist-der-braunkohletagebau-alternativlos/28901640.html,0,www.handelsblatt.com,Handelsblatt Today: Anti-Kohle-Proteste in Lützerath – Ist der Braunkohletagebau alternativlos?,Aktivisten wehren sich gegen die geplante Räumung des Dorfs Lützerath. Handelsblatt-Expertin Catiana Krapp geht der Frage möglicher Alternativen zur Braunkohle nach.,https://www.handelsblatt.com/images/-/26096338/11-format2003.png,2023-01-03T17:02:57Z,https://web.archive.org/web/20230103181744/https://www.handelsblatt.com/audio/today/handelsblatt-today-anti-kohle-proteste-in-luetzerath-ist-der-braunkohletagebau-alternativlos/28901640.html,"Die Bundesregierung will bis 2038 aus der Kohleverstromung aussteigen, um die Klimaziele zu erreichen. Kohlekraftwerke sollten durch Gaskraftwerke ersetzt werden, bis Deutschland genügend erneuerbare… [+2336 chars]",,de,'Atomkraft'
https://www.focus.de/finanzen/staat-bietet-energie-hilfe-millionen-deutsche-koennten-heizkosten-ersetzt-bekommen-aber-kaum-einer-weiss-es_id_167439585.html,https://www.focus.de/finanzen/staat-bietet-energie-hilfe-millionen-deutsche-koennten-heizkosten-ersetzt-bekommen-aber-kaum-einer-weiss-es_id_167439585.html,0,www.focus.de,Staat bietet Energie-Hilfe - Millionen Deutsche könnten Heizkosten ersetzt bekommen - aber kaum einer weiß es,Die gestiegenen Heizkosten sorgen für finanzielle Belastungen bei vielen Bürgern. Es gibt jedoch Unterstützungsmöglichkeiten durch den Staat für Personen - selbst für diejenigen mit festem Einkommen oder Ersparnissen. Die Verbraucherzentrale hat dazu eine nüt…,https://p6.focus.de/img/digital/id_167439583/unterstuetzung-bei-heizkosten-antrag-holt-ihnen-schnell-finanzielle-hilfe.jpg?im=Crop%3D%280%2C62%2C2000%2C1000%29%3BResize%3D%281200%2C627%29&impolicy=perceptual&quality=medium&hash=670cf734f1ee0fef21790aa5c52ba83c83f5db86c825b4e1d6e64d108817c3d3,2023-01-03T18:34:34Z,https://web.archive.org/web/20230103192506/https://www.focus.de/finanzen/staat-bietet-energie-hilfe-millionen-deutsche-koennten-heizkosten-ersetzt-bekommen-aber-kaum-einer-weiss-es_id_167439585.html,Die gestiegenen Heizkosten sorgen für finanzielle Belastungen bei vielen Bürgern. Es gibt jedoch Unterstützungsmöglichkeiten durch den Staat für Personen - selbst für diejenigen mit festem Einkommen … [+2434 chars],,de,'Heizkosten'
https://www.faz.net/aktuell/politik/inland/klimaschutz-laufzeitverlaengerung-tempolimit-viel-heisse-luft-18576376.html,https://www.faz.net/aktuell/politik/inland/klimaschutz-laufzeitverlaengerung-tempolimit-viel-heisse-luft-18576376.html,0,www.faz.net,Kommentar zum Klimaschutz: Viel heiße Luft,"Wer für Atomkraft ist, ist gegen Tempolimit – und umgekehrt. Schlichte Wahrheiten in allen Ehren, aber altdeutsches Revierverhalten und Zeitenwende vertragen sich schlecht.",https://media1.faz.net/ppmedia/aktuell/1370046079/1.8576409/facebook_teaser/wird-noch-lange-laufen.jpg,2023-01-03T20:32:15Z,https://web.archive.org/web/20230103203426/http://www.faz.net/aktuell/politik/inland/klimaschutz-laufzeitverlaengerung-tempolimit-viel-heisse-luft-18576376.html,"Ob die drei in Deutschland verbliebenen Atomkraftwerke in wenigen Monaten endgültig abgeschaltet werden oder nicht, ist für die Anstrengungen zur Eindämmung des Klimawandels genau so irrelevant wie d… [+1124 chars]",,de,'Atomkraft'
https://www.sueddeutsche.de/muenchen/dachau/blackout-bergkirchen-silvester-1.5726095,https://www.sueddeutsche.de/muenchen/dachau/blackout-bergkirchen-silvester-1.5726095,0,www.sueddeutsche.de,Mitten in Bergkirchen: Probe für den Blackout,Vor einem längerfristigen Stromausfall warnte das Landratsamt in den vergangenen Monaten immer wieder. Am Silvesterabend in Bergkirchen scheint das Worst-Case-Szenario auf einmal ganz nah.,https://www.sueddeutsche.de/image/sz.1.5679666/1200x675?v=1672762644,2023-01-03T21:02:27Z,https://web.archive.org/web/20230103212826/https://www.sueddeutsche.de/muenchen/dachau/blackout-bergkirchen-silvester-1.5726095,Vor einem längerfristigen Stromausfall warnte das Landratsamt in den vergangenen Monaten immer wieder. Am Silvesterabend in Bergkirchen scheint das Worst-Case-Szenario auf einmal ganz nah.Seit Monate… [+2473 chars],,de,'Blackout'
https://www.zeit.de/news/2023-01/04/alkohol-weniger-brandenburger-kinder-im-krankenhaus,https://www.zeit.de/news/2023-01/04/alkohol-weniger-brandenburger-kinder-im-krankenhaus,0,www.zeit.de,Gesundheit: Alkohol: Weniger Brandenburger Kinder im Krankenhaus,,,2023-01-04T05:08:49Z,https://web.archive.org/web/20230104095708/https://www.zeit.de/news/2023-01/04/alkohol-weniger-brandenburger-kinder-im-krankenhaus,"When browsing with ads:
We collect personal data and also transmit it to third-party providers
 that help us improve and finance our digital content. Some of the information stored on your device, … [+732 chars]",,de,'Kinder'
https://www.tagesschau.de/newsticker/liveblog-ukraine-mittwoch-203.html,https://www.tagesschau.de/newsticker/liveblog-ukraine-mittwoch-203.html,0,www.tagesschau.de,"Liveblog: ++ Caritas erwartet weitere ""Flüchtlingswelle"" ++","Die Caritas rechnet damit, dass im Zuge von zerstörter Infrastruktur und Kälte viele weitere Menschen aus der Ukraine fliehen werden - vor allem Frauen. Präsident Selenskyj bittet erneut um Hilfe bei der Verteidigung. Alle Entwicklungen im Liveblog.",https://www.tagesschau.de/multimedia/bilder/ukraine-gefluechtete-121~_v-original.jpg,2023-01-04T06:19:59Z,https://web.archive.org/web/20230104062045/http://www.tagesschau.de/newsticker/liveblog-ukraine-mittwoch-203.html,"Die Caritas rechnet damit, dass im Zuge von zerstörter Infrastruktur und Kälte viele weitere Menschen aus der Ukraine fliehen werden - vor allem Frauen. Präsident Selenskyj bittet erneut um Hilfe bei… [+2077 chars]",,de,'Kälte'
https://www.faz.net/aktuell/wirtschaft/unternehmen/kirsten-fust-soll-hamburgs-energieversorgung-retten-18576492.html,https://www.faz.net/aktuell/wirtschaft/unternehmen/kirsten-fust-soll-hamburgs-energieversorgung-retten-18576492.html,0,www.faz.net,Kirsten Fust soll Hamburgs Energieversorgung retten,"Als die Chefin der Hamburger Energiewerke jung war, rebellierten Öko-Bewegte noch gegen Atomkraft. Heute hat die Elektro-Ingenieurin Verantwortung für den Klimaschutz.",https://media1.faz.net/ppmedia/aktuell/2757356472/1.8576489/facebook_teaser_fplus/kirsten-fust-chefin-der.jpg,2023-01-04T06:23:39Z,https://web.archive.org/web/20230104062531/http://www.faz.net/aktuell/wirtschaft/unternehmen/kirsten-fust-soll-hamburgs-energieversorgung-retten-18576492.html,"Zum Pressetermin hat Kirsten Fust einen Schwamm mitgebracht, groß wie ein Brotlaib. Die technische Geschäftsführerin der Hamburger Energiewerke nutzt gern den Vergleich mit Alltagsgegenständen, wenn … [+636 chars]",,de,'Atomkraft'
https://www.wiwo.de/unternehmen/energie/energiewende-viele-fragen-beim-wasserstoffnetz-fuer-deutschland-noch-offen/28903522.html,https://www.wiwo.de/unternehmen/energie/energiewende-viele-fragen-beim-wasserstoffnetz-fuer-deutschland-noch-offen/28903522.html,0,www.wiwo.de,Energiewende: Viele Fragen beim Wasserstoffnetz für Deutschland noch offen,"In Stahlwerken soll Wasserstoff die Kohle ersetzen, in Gaskraftwerken das Erdgas. Doch wie kommt es dahin? Längst hat die Energiewirtschaft Pläne für Wasserstoffnetze. Bundesregierung und EU aber auch.",https://www.wiwo.de/images/wasserstoff/28903520/2-format11240.jpg,2023-01-04T06:23:40Z,https://web.archive.org/web/20230104064618/http://www.wiwo.de/unternehmen/energie/energiewende-viele-fragen-beim-wasserstoffnetz-fuer-deutschland-noch-offen/28903522.html,"Auf dem Weg zur Klimaneutralität 2045 soll Wasserstoff eine wichtige Rolle spielen. Doch wie kommt das vorzugsweise mit Grünstrom hergestellte Gas dorthin, wo es gebraucht wird? Vor allem über ein de… [+7570 chars]",,de,'Kohle'
https://www.sueddeutsche.de/muenchen/muenchen-waermefonds-heizkosten-infos-zuschuesse-1.5726407,https://www.sueddeutsche.de/muenchen/muenchen-waermefonds-heizkosten-infos-zuschuesse-1.5726407,0,www.sueddeutsche.de,Wärmefonds der Stadtwerke: Wer mit Zuschüssen zu den Heizkosten rechnen darf,Tausende Berechtigte können von Mitte Januar an Geld aus dem Wärmefonds der Stadtwerke beantragen. Denn die Heizkosten könnten sich trotz der Preisbremsen des Bundes verdoppeln.,https://www.sueddeutsche.de/image/sz.1.5680052/1200x675?v=1672826500,2023-01-04T10:01:41Z,https://web.archive.org/web/20230104100512/https://www.sueddeutsche.de/muenchen/muenchen-waermefonds-heizkosten-infos-zuschuesse-1.5726407,Tausende Berechtigte können von Mitte Januar an Geld aus dem Wärmefonds der Stadtwerke beantragen. Denn die Heizkosten könnten sich trotz der Preisbremsen des Bundes verdoppeln.Draußen ist es zwar fü… [+3900 chars],,de,'Heizkosten'
https://www.n-tv.de/politik/Habeck-sieht-Verkehr-als-groesstes-Klima-Problem-article23821854.html,https://www.n-tv.de/politik/Habeck-sieht-Verkehr-als-groesstes-Klima-Problem-article23821854.html,0,www.n-tv.de,CO₂-Einsparung 2022 zu niedrig: Habeck sieht Verkehr als größtes Klima-Problem,"Der verstärkte Einsatz von Kohlekraftwerken als Gas-Ersatz und der Verkehrssektor bescheren Deutschland in 2022 eine schlechte CO₂-Bilanz. Während Wirtschaftsminister Habeck sich den Verkehr vorknöpft, fühlt sich die FDP in ihrer Haltung zur Atomkraft bestäti…",https://bilder2.n-tv.de/img/incoming/crop23821901/7121324368-cImg_16_9-w1200/389275820.jpg,2023-01-04T14:31:20Z,https://web.archive.org/web/20230104145739/https://www.n-tv.de/politik/Habeck-sieht-Verkehr-als-groesstes-Klima-Problem-article23821854.html,Der verstärkte Einsatz von Kohlekraftwerken als Gas-Ersatz und der Verkehrssektor bescheren Deutschland in 2022 eine schlechte CO-Bilanz. Während Wirtschaftsminister Habeck sich den Verkehr vorknöpft… [+2445 chars],,de,'Gas'
https://www.freitag.de/autoren/pep/buergergeld-atomkraft-inflation-welche-themen-2023-wichtig-werden,https://www.freitag.de/autoren/pep/buergergeld-atomkraft-inflation-welche-themen-2023-wichtig-werden,0,www.freitag.de,"Ausblick | Bürgergeld, Atomkraft, Inflation: Welche Themen 2023 wichtig werden",Viele haben sich über die Feiertage eine politische Auszeit gegönnt. Wie steht es also gerade um die innenpolitischen Debatten? Eine Wiedereinstiegshilfe in fünf Schritten Viele Menschen haben über die Feiertage – mehr oder weniger bewusst – abgeschaltet: sic…,https://www.freitag.de/autoren/pep/buergergeld-atomkraft-inflation-welche-themen-2023-wichtig-werden/@@images/social_image,2023-01-04T15:45:00Z,https://web.archive.org/web/20230104160120/https://www.freitag.de/autoren/pep/buergergeld-atomkraft-inflation-welche-themen-2023-wichtig-werden,"Viele Menschen haben über die Feiertage mehr oder weniger bewusst abgeschaltet: sich dem täglichen Nachrichtenbombardement entzogen, um durchzuatmen. Sie (und ich) haben sich für kurze Zeit den Luxus… [+539 chars]",,de,'Atomkraft'
https://www.n-tv.de/politik/Randale-Verdaechtige-ueberwiegend-unter-25-Jahren-article23822534.html,https://www.n-tv.de/politik/Randale-Verdaechtige-ueberwiegend-unter-25-Jahren-article23822534.html,0,www.n-tv.de,Krawalle an Berliner Silvester: Randale-Verdächtige überwiegend unter 25 Jahren,"Ein Großteil der in der Berliner Silvesternacht Festgenommenen sind männlich und unter 25 Jahren, teilt die Berliner Polizei mit. Mehr als zwei Dutzend sind sogar noch minderjährig. Die Antirassismus-Beauftragte des Bundes mahnt nun, eher Alter und Geschlecht…",https://bilder4.n-tv.de/img/incoming/crop23822599/115132824-cImg_16_9-w1200/389940533.jpg,2023-01-04T17:14:48Z,https://web.archive.org/web/20230104172326/https://www.n-tv.de/politik/Randale-Verdaechtige-ueberwiegend-unter-25-Jahren-article23822534.html,"Ein Großteil der in der Berliner Silvesternacht Festgenommenen sind männlich und unter 25 Jahren, teilt die Berliner Polizei mit. Mehr als zwei Dutzend sind sogar noch minderjährig. Die Antirassismus… [+2591 chars]",,de,'Geschlecht'
https://www.focus.de/politik/deutschland/klarer-widerspruch-zu-den-klimazielen-denkfabrik-agora-energiewende-deutsche-emissionsziele-2022-erneut-verfehlt_id_182147858.html,https://www.focus.de/politik/deutschland/klarer-widerspruch-zu-den-klimazielen-denkfabrik-agora-energiewende-deutsche-emissionsziele-2022-erneut-verfehlt_id_182147858.html,0,www.focus.de,Emissionsziele laut Bericht erneut verfehlt - Deutscher CO2-Ausstoß steht im „klaren Widerspruch zu den Klimazielen“,Das Thinktank Agora Energiewende veröffentlichte am Mittwoch eine Auswertung der deutschen Treibhausgasemissionen im Jahr 2022. Demnach wurden die Ziele zur Senkung erneut verfehlt. Grund dafür sei unter anderem die gestiegene Kohleverstromung. Auch in den Be…,https://p6.focus.de/img/regional/bayern/id_181952046/pkw-und-reisebusse-stehen-auf-der-a8-richtung-norden-im-stau..jpg?im=Crop%3D%280%2C222%2C2048%2C1024%29%3BResize%3D%281200%2C627%29&hash=b76f64b412128e3f73d11ef8068090bf1c743c9bd10628439b710872f2eb12b2,2023-01-04T17:25:13Z,https://web.archive.org/web/20230104180433/https://www.focus.de/politik/deutschland/klarer-widerspruch-zu-den-klimazielen-denkfabrik-agora-energiewende-deutsche-emissionsziele-2022-erneut-verfehlt_id_182147858.html,Trotz eines gesunkenen Energieverbrauchs und eines hohen Anteils der Erneuerbaren Energien hat Deutschland 2022 die Ziele zur Senkung der Treibhausgasemissionen erneut verfehlt. Grund dafür ist maßge… [+4072 chars],,de,'Kohle'
https://www.teltarif.de/cb-funk-pmr446-freenet-jedermannfunk/news/90486.html?page=all,https://www.teltarif.de/cb-funk-pmr446-freenet-jedermannfunk/news/90486.html?page=all,0,www.teltarif.de,"CB-Funk, PMR446 & Co. Handy-Alternativen beim Blackout","Bevor das Handy in Mode kam und erschwinglich wurde, haben viele interessierte Menschen mit CB-Funk von unterwegs kommuniziert. Das geht auch heute noch.",https://www.teltarif.de/img/arch/2023/kw01/cb-funk-pmr446-freenet-jedermannfunk-4og.jpg,2023-01-04T23:00:00Z,https://web.archive.org/web/20230105074929/https://www.teltarif.de/cb-funk-pmr446-freenet-jedermannfunk/news/90486.html?page=all,"Mobile Tele­fone sind heute aus unserem Alltag nicht wegzu­denken. Mobile Tele­fone brau­chen Strom für den Akku und für den Kontakt zu einer Sende­sta­tionen, die eben­falls Strom braucht. Gibt es k… [+4173 chars]",,de,'Blackout'
https://www.autobild.de/artikel/ford-f-150-lightning-stromausfall-blackout-notstrom-22382581.html,https://www.autobild.de/artikel/ford-f-150-lightning-stromausfall-blackout-notstrom-22382581.html,0,www.autobild.de,"Ford F-150 Lightning: Stromausfall, Blackout, Notstrom Ein Kanadier nutzte seinen Ford F-150 Lightning als Notstrom-Akku","Ein elektrischer Ford F-150 Lightning half in Kanada, einen Stromausfall zu überbrücken. 44 Stunden lang spendete der Akku des E-Pick-ups einem von der Stromversorgung abgeschnittenen Haushalt Strom!",https://i.auto-bild.de/ir_img/3/1/8/5/8/9/1/22_SQ-e8e40ea11f6fa497.jpg?impolicy=og_images,2023-01-05T05:00:00Z,https://web.archive.org/web/20230105095236/https://www.autobild.de/artikel/ford-f-150-lightning-stromausfall-blackout-notstrom-22382581.html,"Mit der Wallbox bequem zu Hause laden
Wählen Sie Ihre Wunsch-Wallbox aus über 25 Modellen verschiedener Marken.",,de,'Blackout'
https://www.dwdl.de/nachrichten/91227/sat1_knipst_am_donnerstag_bald_das_licht_aus/,https://www.dwdl.de/nachrichten/91227/sat1_knipst_am_donnerstag_bald_das_licht_aus/,0,www.dwdl.de,Sat.1 knipst am Donnerstag bald das Licht aus,"Die schon bei JoynPlus+ verfügbare deutsche Thriller-Serie ""Blackout"" kommt sehr zeitnah ins Sat.1-Programm. Am Startabend wird sie von einem Talk begleitet. Matthias Killing moderiert diesen.",https://www.dwdl.de/images/1600271397_blackout.jpg,2023-01-05T07:02:00Z,https://web.archive.org/web/20230105081408/https://www.dwdl.de/nachrichten/91227/sat1_knipst_am_donnerstag_bald_das_licht_aus/,"Seit Oktober zurückliegenden Jahres ist die deutsche Serie ""Blackout"" bereits bei JoynPlus+ verfügbar – nun steht auch fest, wann Sat.1 mit der Ausstrahlung nachzieht: Im Rahmen des neuen und in dies… [+1848 chars]",,de,'Blackout'
https://www.freitag.de/autoren/cabee/das-logbuch-geht-weiter-das-leben-in-den-zeiten-der-corona-ac-3.42,https://www.freitag.de/autoren/cabee/das-logbuch-geht-weiter-das-leben-in-den-zeiten-der-corona-ac-3.42,0,www.freitag.de,Das Logbuch geht weiter: | Das Leben in den Zeiten der Corona; AC 3.42,"„Yesterday And Today“ – and tomorrow? Was kann in nur zwölf Sekunden alles passieren? Jetzt, um Neujahr herum, bevölkern viele Hundebesitzer mit ihren Liebsten den Strand von Scharbeutz. Erwachsene wie Kinder tragen mittlerweile zwar fast alle Plastikschuhe, …",https://www.freitag.de/++theme++freitag.theme/freitag/fallbacks/fallback-community-3-2.png,2023-01-05T08:03:03Z,,"Was kann in nur zwölf Sekunden alles passieren? Jetzt, um Neujahr herum, bevölkern viele Hundebesitzer mit ihren Liebsten den Strand von Scharbeutz. Erwachsene wie Kinder tragen mittlerweile zwar fas… [+5372 chars]",,de,'Blackout'
https://taz.de/Kriegspropaganda-bei-Kindern/!5906866/,https://taz.de/Kriegspropaganda-bei-Kindern/!5906866/,0,taz.de,Kriegspropaganda bei Kindern: Russlands kleine Schulsoldaten,Der Kreml schwört den Bildungssektor auf antiwestliche Ideologie ein. Bei Kritik bekommen es selbst Grund­schü­le­r*in­nen mit Behörden zu tun.,https://taz.de/picture/6012851/948/31876159-1.jpeg,2023-01-05T09:26:00Z,,"Der Kreml schwört den Bildungssektor auf antiwestliche Ideologie ein. Bei Kritik bekommen es selbst Grund­schü­le­r*in­nen mit Behörden zu tun.
Der Beginn eines neuen Schuljahres im September 2022 i… [+5828 chars]",,de,'Ältere'
https://www.bild.de/regional/berlin/berlin-aktuell/diese-berliner-familie-hat-seit-sieben-wochen-keinen-strom-82449456.bild.html,https://www.bild.de/regional/berlin/berlin-aktuell/diese-berliner-familie-hat-seit-sieben-wochen-keinen-strom-82449456.bild.html,0,www.bild.de,Alleinerziehende Mutter verzweifelt - Berliner Familie hat seit 7 Wochen keinen Strom,"Sabine Tharau (37), alleinerziehende Mutter von zwei Kindern, wartet seit sieben Wochen darauf, dass ihr Strom wieder angestellt wird.","https://images.bild.de/63b6860a510ebb07596d37e3/c59452130ed6981e7345df543f90f8f9,b7a76ac1?w=1280",2023-01-05T10:46:56Z,https://web.archive.org/web/20230105105338/https://www.bild.de/regional/berlin/berlin-aktuell/diese-berliner-familie-hat-seit-sieben-wochen-keinen-strom-82449456.bild.html,"Berlin Keine Lampe, kein Herd, kein Kühlschrank: Sabine Tharau (37), alleinerziehende Mutter von zwei Kindern, wartet seit sieben Wochen darauf, dass ihr Strom wieder angestellt wird.
Sie konnte dre… [+2374 chars]",,de,'Kinder'
https://www.kino.de/serie/blackout/news/blackout-serie-startet-im-free-tv-termine-und-infos/,https://www.kino.de/serie/blackout/news/blackout-serie-startet-im-free-tv-termine-und-infos/,0,www.kino.de,„Blackout“: Serie startet endlich im Free-TV – Termine und Infos,"Seid froh, dass ihr Strom im Hause habt, so könnt ihr euch bequem vom Sofa aus ansehen, wie die Welt im Chaos versinkt. Wann ihr die deutsche Serie im TV seht, verraten wir euch hier.",https://crops.giga.de/cc/cb/59/e75d717a69b56d4128149b0364_YyAyMDk4eDExODArMTYrNzkCcmUgMTkyMCAxMDgwA2NiZWQ3OTYxMWI2.jpg,2023-01-05T11:06:08Z,,"Seid froh, dass ihr Strom im Hause habt, so könnt ihr euch bequem vom Sofa aus ansehen, wie die Welt im Chaos versinkt. Wann ihr die deutsche Serie im TV seht, verraten wir euch hier.
Wenn der Strom… [+5748 chars]",,de,'Blackout'
https://www.n-tv.de/wirtschaft/Die-falsche-Panik-vor-dem-Klimamuell-article23821778.html,https://www.n-tv.de/wirtschaft/Die-falsche-Panik-vor-dem-Klimamuell-article23821778.html,0,www.n-tv.de,"Bemerkenswerter Strategieschwenk: Die falsche Panik vor dem ""Klimamüll""","Hinter dem Kürzel CCS steckt ein Verfahren, klimaschädliches Kohlendioxid abzuschneiden und unterirdisch zu speichern. Während andere Länder diese Technologie bereits nutzen, hat sich hierzulande wenig bewegt. Das möchte der Wirtschaftsminister ändern. Dabei …",https://bilder2.n-tv.de/img/incoming/crop23821917/761132605-cImg_16_9-w1200/260454034.jpg,2023-01-05T11:09:08Z,https://web.archive.org/web/20230105111307/https://www.n-tv.de/wirtschaft/Die-falsche-Panik-vor-dem-Klimamuell-article23821778.html,"Hinter dem Kürzel CCS steckt ein Verfahren, klimaschädliches Kohlendioxid abzuschneiden und unterirdisch zu speichern. Während andere Länder diese Technologie bereits nutzen, hat sich hierzulande wen… [+6421 chars]",,de,'Kohle'
https://www.morgenpost.de/bezirke/steglitz-zehlendorf/article237296433/Wie-am-Stammtisch-Probleme-mit-dem-Handy-geloest-werden.html,https://www.morgenpost.de/bezirke/steglitz-zehlendorf/article237296433/Wie-am-Stammtisch-Probleme-mit-dem-Handy-geloest-werden.html,0,www.morgenpost.de,Hilfe : Wie am Stammtisch Probleme mit dem Handy gelöst werden,"Im Laden der Nachbarschaftshilfe Steglitz-Zehlendorf finden ältere Menschen Hilfe bei Fragen zum Laptop, Tablet oder Smartphone.",https://img.morgenpost.de/img/steglitz-zehlendorf/crop237296431/9682607046-w820-cv16_9-q85/e4656be4-8cee-11ed-85fd-08a41dc42aab.jpg,2023-01-05T13:55:22Z,,"Berlin.  Alle Tische sind besetzt. Keiner hebt den Kopf, als sich die Tür öffnet. Die Blicke sind auf die Handys gerichtet, ein leises Gemurmel durchzieht den Raum. Monika, 61, sitzt hier, weil sie w… [+4496 chars]",,de,'Ältere'
