index,url,valid,domain,title,description,image,published,archive,content,quote,language,keyword
https://www.zeit.de/news/2025-05/19/warum-grundschulkinder-im-suedwesten-immer-dicker-werden,https://www.zeit.de/news/2025-05/19/warum-grundschulkinder-im-suedwesten-immer-dicker-werden,0,www.zeit.de,Gesundheit bei Kindern: Warum Grundschulkinder im Südwesten immer dicker werden,Hier finden Sie Informationen zu dem Thema „Gesundheit bei Kindern“. Lesen Sie jetzt „Warum Grundschulkinder im Südwesten immer dicker werden“.,https://img.zeit.de/news/2025-05/19/warum-grundschulkinder-im-suedwesten-immer-dicker-werden-image-group/wide__1300x731,2025-05-19T09:51:55Z,,"Immer mehr Kinder in Baden-Württemberg sind übergewichtig das zeigen neue Daten des Fitnessbarometers 2025. Was steckt dahinter? Was muss sich ändern? Die wichtigsten Fragen dazu:
Warum sind Kinder … [+4729 chars]",,de,'Kinder'
https://www.sueddeutsche.de/muenchen/urban-knitting-muenchen-strickkunst-gasteig-hp8-li.3247400,https://www.sueddeutsche.de/muenchen/urban-knitting-muenchen-strickkunst-gasteig-hp8-li.3247400,0,www.sueddeutsche.de,Kurs zum Stricken im öffentlichen Raum: Mit Urban Knitting gegen das Grau der Stadt,"Vom Stricken zur Street Art: Im Freien vorm Gasteig HP8 treffen sich Anfänger und Könner mit Andrea Unterstraßer. Sie lernen von der Künstlerin, wie Wolle verbindet und mehr Freude in die Asphaltwüste bringt.",https://www.sueddeutsche.de/2025/05/19/6e9d4cbf-7e37-4e67-b9ac-d6426951378b.jpeg?q=60&fm=webp&width=1200&rect=0%2C21%2C4000%2C2250,2025-05-19T10:30:22Z,,In der Brudermühlstraße erfüllen Autos und Busse die Atmosphäre mit einem durchgängigen Brummen. Es herrscht Feierabendverkehr auf der Kreuzung vor dem Gasteig HP8 in Sendling. Neugierig schauen viel… [+3817 chars],,de,'Gas'
https://www.zeit.de/news/2025-05/19/niederlande-suche-nach-zwei-kindern-vermutlich-entfuehrt,https://www.zeit.de/news/2025-05/19/niederlande-suche-nach-zwei-kindern-vermutlich-entfuehrt,0,www.zeit.de,Polizei: Niederlande: Suche nach zwei Kindern - vermutlich entführt,Hier finden Sie Informationen zu dem Thema „Polizei“. Lesen Sie jetzt „Niederlande: Suche nach zwei Kindern - vermutlich entführt“.,https://img.zeit.de/news/2025-05/19/niederlande-suche-nach-zwei-kindern-vermutlich-entfuehrt-image-group/wide__1300x731,2025-05-19T10:41:30Z,,Mit großem Aufgebot sucht die niederländische Polizei im Norden des Landes im Grenzgebiet zu Deutschland nach zwei vermissten Kindern. Die Polizei schließt eine Entführung durch den Vater der Kinder … [+900 chars],,de,'Kinder'
https://www.zeit.de/news/2025-05/19/gasaustritt-in-vorgarten-polizei-evakuiert-drei-haeuser,https://www.zeit.de/news/2025-05/19/gasaustritt-in-vorgarten-polizei-evakuiert-drei-haeuser,0,www.zeit.de,Leck in Gastank: Gasaustritt in Vorgarten - Polizei evakuiert drei Häuser,Hier finden Sie Informationen zu dem Thema „Leck in Gastank“. Lesen Sie jetzt „Gasaustritt in Vorgarten - Polizei evakuiert drei Häuser“.,https://img.zeit.de/news/2025-05/19/gasaustritt-in-vorgarten-polizei-evakuiert-drei-haeuser-image-group/wide__1300x731,2025-05-19T11:14:08Z,,"Wegen eines Gasaustritts in einem Vorgarten haben Rettungskräfte in Hof drei Häuser evakuiert. Ursache war ein Leck in einem Flüssiggastank, wie die Polizei mitteilte. Eine Nachbarin bemerkte den Ger… [+461 chars]",,de,'Gas'
https://www.tagesspiegel.de/wirtschaft/vier-neue-erkenntnisse-diese-rolle-spielte-die-energiewende-beim-blackout-in-spanien-13716610.html,https://www.tagesspiegel.de/wirtschaft/vier-neue-erkenntnisse-diese-rolle-spielte-die-energiewende-beim-blackout-in-spanien-13716610.html,0,www.tagesspiegel.de,Vier neue Erkenntnisse: Diese Rolle spielte die Energiewende beim Blackout in Spanien,Experten haben neue Erkenntnisse zum Blackout. Sie kritisieren eine Erklärung der spanischen Regierung – und verweisen auf einen Faktor im Zusammenhang mit erneuerbaren Energien.,https://www.tagesspiegel.de/images/13716898/alternates/BASE_16_9_W1400/1747654914000/file-photo-power-outage-in-ronda.jpeg,2025-05-19T11:53:06Z,http://archive.md/20250519121058/https://www.tagesspiegel.de/wirtschaft/vier-neue-erkenntnisse-diese-rolle-spielte-die-energiewende-beim-blackout-in-spanien-13716610.html,Die Aufklärung des historischen Stromausfalls in Spanien und Portugal am 28. April schreitet voran. Eine Gruppe von Experten aus zehn europäischen Ländern untersucht den Fall im Detail darunter auch … [+50 chars],,de,'Blackout'
https://www.zeit.de/news/2025-05/19/kinder-inspirieren-fotos-fuer-ausstellung-am-ostseestrand,https://www.zeit.de/news/2025-05/19/kinder-inspirieren-fotos-fuer-ausstellung-am-ostseestrand,0,www.zeit.de,Fotografie-Ausstellung: Kinder inspirieren Fotos für Ausstellung am Ostseestrand,Hier finden Sie Informationen zu dem Thema „Fotografie-Ausstellung“. Lesen Sie jetzt „Kinder inspirieren Fotos für Ausstellung am Ostseestrand“.,https://img.zeit.de/news/2025-05/19/kinder-inspirieren-fotos-fuer-ausstellung-am-ostseestrand-image-group/wide__1300x731,2025-05-19T13:12:06Z,,"Die von Kindern inspirierten Bilder für die Umweltfotoausstellung am Ostseestrand in Zingst sind aufgestellt. Insgesamt 22 Motive gibt es bei der Ausstellung am Strand zu sehen, sagte die Sprecherin … [+873 chars]",,de,'Kinder'
https://www.jungewelt.de/artikel/500297.atomkraft-in-belgien-ausstieg-aus-dem-atomausstieg.html,https://www.jungewelt.de/artikel/500297.atomkraft-in-belgien-ausstieg-aus-dem-atomausstieg.html,0,www.jungewelt.de,Atomkraft in Belgien: Ausstieg aus dem Atomausstieg [Online-Abo],Rollback der Kernenergie in Belgien. Alte Reaktoren sollen mit neu gebauten ans Netz.,https://www.jungewelt.de/img/1100/208923.jpg,2025-05-19T17:36:54Z,,"Uneingeschränkter Zugriff auf alle Inhalte: Erleben Sie die Tageszeitung junge Welt in gedruckter oder digitaler Form oder beides kombiniert.
Nachrichtenauswahl und -aufbereitung erfordern finanziel… [+458 chars]",,de,'Atomkraft'
https://www.faz.net/aktuell/wirtschaft/unternehmen/wie-enpal-und-1komma5grad-die-deutschen-haeuser-elektrifizieren-wollen-110486410.html,https://www.faz.net/aktuell/wirtschaft/unternehmen/wie-enpal-und-1komma5grad-die-deutschen-haeuser-elektrifizieren-wollen-110486410.html,0,www.faz.net,Enpal und 1Komma5Grad: Wie lassen sich die Häuser der Deutschen elektrifizieren?,"Enpal und 1Komma5 Grad wollen die Häuser der Deutschen elektrifizieren. Hier sprechen ihre Chefs Mario Kohle und Philipp Schröder über die Kosten der Erneuerbaren, fehlende Flexibilität und das Ende der Einspeisevergütung für Solarstrom.",https://media1.faz.net/ppmedia/aktuell/4246964388/1.10486433/facebook_teaser_fplus/strahlemaenner-mario-kohle.jpg,2025-05-19T19:12:42Z,http://archive.md/20250520130810/https://www.faz.net/aktuell/wirtschaft/unternehmen/wie-enpal-und-1komma5grad-die-deutschen-haeuser-elektrifizieren-wollen-110486410.html,"Zugang zu allen FAZ+ Beiträgen12,80 
 jetzt nur 0,99 
Zugang zu allen FAZ+ Beiträgen12,80 
 jetzt nur 0,99 
<ul><li>Mit einem Klick online kündbar</li></ul>",,de,'Kohle'
https://www.faz.net/aktuell/wirtschaft/unternehmen/enpal-und-1komma5grad-wie-lassen-sich-die-haeuser-der-deutschen-elektrifizieren-110486410.html,https://www.faz.net/aktuell/wirtschaft/unternehmen/enpal-und-1komma5grad-wie-lassen-sich-die-haeuser-der-deutschen-elektrifizieren-110486410.html,0,www.faz.net,"„Wer heute sein Haus umstellt, kann in den nächsten 25 Jahren mehr als 100.000 Euro sparen“","Enpal und 1Komma5 Grad wollen die Häuser der Deutschen elektrifizieren. Hier sprechen ihre Chefs Mario Kohle und Philipp Schröder über die Kosten der Erneuerbaren, fehlende Flexibilität, das Ende der Einspeisevergütung für Solarstrom und darüber, dass alte St…",https://media1.faz.net/ppmedia/aktuell/4246964388/1.10486433/facebook_teaser/strahlemaenner-mario-kohle.jpg,2025-05-19T19:12:42Z,https://web.archive.org/web/20250519192504/http://www.faz.net/aktuell/wirtschaft/unternehmen/enpal-und-1komma5grad-wie-lassen-sich-die-haeuser-der-deutschen-elektrifizieren-110486410.html,"Herr Kohle, Herr Schröder, Enpal und 1Komma5° sprechen häufig übereinander, heute beziehen Sie gemeinsam Position. Sind Sie so stark unter Druck, dass Sie zusammen die Flucht nach vorne ergreifen müs… [+9110 chars]",,de,'Kohle'
https://www.diepresse.com/19704902/usa-entdecken-verdaechtige-funkmodule-in-wechselrichtern-aus-china,https://www.diepresse.com/19704902/usa-entdecken-verdaechtige-funkmodule-in-wechselrichtern-aus-china,0,www.diepresse.com,USA entdecken verdächtige Funkmodule in Wechselrichtern aus China,"Im schlimmsten Fall könnten die Komponenten für Photovoltaik-Anlagen dazu genutzt werden, ein Blackout zu verursachen.",https://img.diepresse.com/public/incoming/zce9zl-imago-images-0765177612/alternates/DPR_SOCIAL_NACHRICHTEN/imago%20images%200765177612,2025-05-20T03:37:17Z,,"Im schlimmsten Fall könnten die Komponenten für Photovoltaik-Anlagen dazu genutzt werden, ein Blackout zu verursachen.
In den USA sind in chinesischen Wechselrichtern für Photovoltaik-Anlagen verdäc… [+4189 chars]",,de,'Blackout'
https://www.telepolis.de/features/Atomkraft-Europas-strahlende-Zukunft-10389178.html,https://www.telepolis.de/features/Atomkraft-Europas-strahlende-Zukunft-10389178.html,0,www.telepolis.de,Atomkraft: Europas strahlende Zukunft?,Nukleare Rolle rückwärts – Ausstieg vom Ausstieg: Belgien und Italien kehren zur Kernkraft zurück. Andere Länder folgen. Was macht Deutschland? (Leserdebatte),https://heise.cloudimg.io/bound/1200x1200/q85.png-lossy-85.webp-lossy-85.foil1/_www-heise-de_/imgs/18/4/8/5/6/9/0/2/Master_Atomkraft-db0fd948a834403e.jpeg,2025-05-20T06:00:00Z,http://archive.md/20250521161619/https://www.telepolis.de/features/Atomkraft-Europas-strahlende-Zukunft-10389178.html,"Grüne Landschaft und Kernkraftwerk. Bild: Shutterstock.com
Nukleare Rolle rückwärts Ausstieg vom Ausstieg: Belgien und Italien kehren zur Kernkraft zurück. Andere Länder folgen. Was macht Deutschlan… [+9077 chars]",,de,'Atomkraft'
https://www.zeit.de/news/2025-05/20/mehr-kinder-und-jugendliche-in-obhut-genommen,https://www.zeit.de/news/2025-05/20/mehr-kinder-und-jugendliche-in-obhut-genommen,0,www.zeit.de,Jugendämter: Mehr Kinder und Jugendliche in Obhut genommen,Hier finden Sie Informationen zu dem Thema „Jugendämter“. Lesen Sie jetzt „Mehr Kinder und Jugendliche in Obhut genommen“.,https://img.zeit.de/news/2025-05/20/mehr-kinder-und-jugendliche-in-obhut-genommen-image-group/wide__1300x731,2025-05-20T06:35:31Z,,"In Sachsen ist die Zahl der Kinder leicht gestiegen, die die Behörden in Obhut genommen haben. Wie das Statistische Landesamt mitteilte, wurden im Jahr 2023 für 3.032 Kinder und Jugendliche vorläufig… [+554 chars]",,de,'Kinder'
https://www.zeit.de/gesellschaft/2025-05/jahresstatistik-rechte-gewalt-rassismus-queerfeindlichkeit-antisemitismus,https://www.zeit.de/gesellschaft/2025-05/jahresstatistik-rechte-gewalt-rassismus-queerfeindlichkeit-antisemitismus,0,www.zeit.de,Jahresstatistik 2024: Opferverbände melden Anstieg von rechter Gewalt um 24 Prozent,Rechte Gewalttaten haben im Jahr 2024 erneut zugenommen. Opferverbände registrierten 2024 fast 3.500 Fälle. Auch immer mehr Kinder und Jugendliche sind betroffen.,https://img.zeit.de/gesellschaft/zeitgeschehen/2025-05/jahresstatistik-rechte-gewalt-rassismus-queerfeindlichkeit-antisemitismus-bild/wide__1300x731,2025-05-20T07:27:45Z,http://archive.md/20250520075039/https://www.zeit.de/gesellschaft/2025-05/jahresstatistik-rechte-gewalt-rassismus-queerfeindlichkeit-antisemitismus,"In Deutschland kommt es zu immer häufiger zu rechten, rassistischen, antisemitischen und queerfeindlichen Gewalttaten. Zu diesem Ergebnis kommen Anlaufstellen für Opfer rechter Gewalt, die ihre Stati… [+470 chars]",,de,'Kinder'
https://www.bild.de/lifestyle/grillen/grill-saison-startet-das-brauchen-sie-zum-angrillen-660422d0d88c9719353ffe92,https://www.bild.de/lifestyle/grillen/grill-saison-startet-das-brauchen-sie-zum-angrillen-660422d0d88c9719353ffe92,0,www.bild.de,"Zange, Kohle, Pizzastein? - Was braucht man unbedingt beim Grillen?","Damit die ersten draußen gegrillten Steaks, Würstchen und Gemüse-Spießchen auch wirklich köstlich werden, braucht man die richtigen Werkzeuge.","https://images.bild.de/660422d0d88c9719353ffe92/f2e4700fe3fa64e7ee3cbde7d664a272,d8bf997?w=1280",2025-05-20T09:06:06Z,,"Um den TTS Player darzustellen, brauchen wir deine Zustimmung. 
 externen Inhalt aktivieren Um eingebettete Inhalte anzuzeigen, ist Ihre jederzeit widerrufliche Einwilligung (über den Schalter oder … [+3819 chars]",,de,'Kohle'
https://www.golem.de/sonstiges/zustimmung/auswahl.html?from=https://www.golem.de/news/blackout-wie-gefaehrlich-sind-chinesische-wechselrichter-2505-196331.html&referer=https://t.co/32d9567b2b,https://www.golem.de/sonstiges/zustimmung/auswahl.html?from=https://www.golem.de/news/blackout-wie-gefaehrlich-sind-chinesische-wechselrichter-2505-196331.html&referer=https://t.co/32d9567b2b,0,www.golem.de,Blackout: Wie gefährlich sind chinesische Wechselrichter?,"US-Behörden haben angeblich versteckte Kommunikationsmodule in Wechselrichtern aus China entdeckt. Die europäische Solarwirtschaft und das BSI zeigen sich ebenfalls besorgt. Eine Analyse von Friedhelm Greis (Solarenergie, BSI)",,2025-05-20T10:00:02Z,,"Besuchen Sie Golem.de wie gewohnt mit Werbung und Tracking,
 indem Sie der Nutzung aller Cookies zustimmen.
 Details zum Tracking finden Sie im Privacy Center.
Skript wurde nicht geladen. Informat… [+607 chars]",,de,'Blackout'
https://www.bild.de/sport/mehr-sport/er-kann-es-selbst-kaum-fassen-spektakulaerer-blackout-von-handball-weltmeister-682c6d6f5e67892b356c9d9e,https://www.bild.de/sport/mehr-sport/er-kann-es-selbst-kaum-fassen-spektakulaerer-blackout-von-handball-weltmeister-682c6d6f5e67892b356c9d9e,0,www.bild.de,Er kann es selbst kaum fassen - Spektakulärer Blackout von Handball-Weltmeister,Sowas sieht man von Lasse Andersson so gut wie nie.,"https://images.bild.de/682c6d6f5e67892b356c9d9e/9f15fd2dac6cff746689106291fdab8e,e0c6a091?w=1280",2025-05-20T12:54:24Z,,"Mehr zum Video anzeigen 
Sowas sieht man von Lasse Andersson so gut wie nie.
Quelle: BILD/Dyn20.05.2025 - 14:54 Uhr",,de,'Blackout'
https://www.tagesspiegel.de/berlin/berliner-wirtschaft/wassermangel-in-der-hauptstadtregion-wirtschaftsforscher-empfehlen-hohere-entgelte-fur-spreewassernutzung-13723534.html,https://www.tagesspiegel.de/berlin/berliner-wirtschaft/wassermangel-in-der-hauptstadtregion-wirtschaftsforscher-empfehlen-hohere-entgelte-fur-spreewassernutzung-13723534.html,0,www.tagesspiegel.de,Wassermangel in der Hauptstadtregion: Wirtschaftsforscher empfehlen höhere Entgelte für Spreewassernutzung,"Spätestens wenn in der Lausitz keine Kohle mehr gebaggert wird, wird das Wasser in der Spree knapp. Um Verteilungskonflikten vorzubeugen, hat das Deutsche Institut für Wirtschaftsforschung einen Plan für Berlin, Brandenburg und Sachsen entwickelt.",https://www.tagesspiegel.de/images/9968895/alternates/BASE_16_9_W1400/1686571642000/spree-in-berlin.jpeg,2025-05-20T14:26:10Z,http://archive.md/20250520194359/https://www.tagesspiegel.de/berlin/berliner-wirtschaft/wassermangel-in-der-hauptstadtregion-wirtschaftsforscher-empfehlen-hohere-entgelte-fur-spreewassernutzung-13723534.html,"Die drohende Wasserknappheit durch den Kohleausstieg in der Lausitz erfordert von den Ländern Berlin, Brandenburg und Sachsen ein gemeinsames und frühzeitiges Vorgehen, um möglichen Verteilungskonfli… [+237 chars]",,de,'Kohle'
https://www.tagesspiegel.de/berlin/berliner-wirtschaft/plan-fur-berlin-brandenburg-und-sachsen-wirtschaftsforscher-fordern-hohere-preise-fur-spreewasser-13723534.html,https://www.tagesspiegel.de/berlin/berliner-wirtschaft/plan-fur-berlin-brandenburg-und-sachsen-wirtschaftsforscher-fordern-hohere-preise-fur-spreewasser-13723534.html,0,www.tagesspiegel.de,"Plan für Berlin, Brandenburg und Sachsen: Wirtschaftsforscher fordern höhere Preise für Spreewasser","Spätestens wenn in der Lausitz keine Kohle mehr gebaggert wird, wird das Spreewasser knapp. Um Verteilungskonflikten vorzubeugen, haben Forscher einen Plan für Berlin, Brandenburg und Sachsen entwickelt.",https://www.tagesspiegel.de/images/9968895/alternates/BASE_16_9_W1400/1686571642000/spree-in-berlin.jpeg,2025-05-20T14:26:10Z,http://archive.md/20250520202246/https://www.tagesspiegel.de/berlin/berliner-wirtschaft/plan-fur-berlin-brandenburg-und-sachsen-wirtschaftsforscher-fordern-hohere-preise-fur-spreewasser-13723534.html,"Die drohende Wasserknappheit durch den Kohleausstieg in der Lausitz erfordert von den Ländern Berlin, Brandenburg und Sachsen ein gemeinsames und frühzeitiges Vorgehen, um möglichen Verteilungskonfli… [+237 chars]",,de,'Kohle'
https://www.zeit.de/news/2025-05/20/deutlich-mehr-erfasste-sexualdelikte-gegen-kinder-im-netz,https://www.zeit.de/news/2025-05/20/deutlich-mehr-erfasste-sexualdelikte-gegen-kinder-im-netz,0,www.zeit.de,Daten für 2024: Deutlich mehr erfasste Sexualdelikte gegen Kinder im Netz,Hier finden Sie Informationen zu dem Thema „Daten für 2024“. Lesen Sie jetzt „Deutlich mehr erfasste Sexualdelikte gegen Kinder im Netz“.,https://img.zeit.de/news/2025-05/20/deutlich-mehr-erfasste-sexualdelikte-gegen-kinder-im-netz-image-group/wide__1300x731,2025-05-20T14:44:32Z,,"Es ist ein Anstieg, der nicht nur Experten aufhorchen lässt: Fast 15.700 Fälle von sexualisierter Gewalt gegen Kinder und Jugendliche im Internet hat die Plattform Jugendschutz.net im Jahr 2024 erfas… [+5286 chars]",,de,'Kinder'
https://www.bild.de/sport/er-kann-es-kaum-fassen-spektakulaerer-blackout-von-handball-weltmeister-682c7d3aedb69e10df6960e9,https://www.bild.de/sport/er-kann-es-kaum-fassen-spektakulaerer-blackout-von-handball-weltmeister-682c7d3aedb69e10df6960e9,0,www.bild.de,Er kann es selbst kaum fassen - Spektakulärer Blackout von Handball-Weltmeister,"Lasse Andersson muss nur noch ins leere Tor treffen, aber der Däne trifft spektakulärerweise nicht.","https://images.bild.de/682c7d3aedb69e10df6960e9/0d990d8ea5b880f145b4310f2575c91d-landscape,f7e6880?w=1280",2025-05-20T22:01:55Z,https://web.archive.org/web/20250520234841/https://www.bild.de/sport/er-kann-es-kaum-fassen-spektakulaerer-blackout-von-handball-weltmeister-682c7d3aedb69e10df6960e9,"Mehr zum Video anzeigen 
Lasse Andersson muss nur noch ins leere Tor treffen, aber der Däne trifft spektakulärerweise nicht. 
Quelle: BILD21.05.2025 - 00:01 Uhr",,de,'Blackout'
https://www.zeit.de/news/2025-05/21/niederlande-vermisste-kinder-und-vater-tot-gefunden,https://www.zeit.de/news/2025-05/21/niederlande-vermisste-kinder-und-vater-tot-gefunden,0,www.zeit.de,Kriminalität: Niederlande: Vermisste Kinder und Vater tot gefunden,Hier finden Sie Informationen zu dem Thema „Leichen identifiziert“. Lesen Sie jetzt „Niederlande: Vermisste Kinder und Vater tot gefunden“.,https://img.zeit.de/news/2025-05/21/niederlande-vermisste-kinder-und-vater-tot-gefunden-image-group/wide__1300x731,2025-05-21T09:11:21Z,https://web.archive.org/web/20250522054658/https://www.zeit.de/news/2025-05/21/niederlande-vermisste-kinder-und-vater-tot-gefunden,"Die beiden im Nordosten der Niederlande vermissten Kinder sind tot. Die in einem Auto gefundenen Leichen wurden identifiziert, es handelt sich um die Kinder Jeffrey (10) und Emma (8) sowie den Vater,… [+1428 chars]",,de,'Kinder'
https://www.golem.de/sonstiges/zustimmung/auswahl.html?from=https://www.golem.de/news/rotierende-massen-warum-es-fuer-die-energiewende-keine-neuen-kraftwerke-braucht-2505-196377.html&referer=https://t.co/ef632d2fcc,https://www.golem.de/sonstiges/zustimmung/auswahl.html?from=https://www.golem.de/news/rotierende-massen-warum-es-fuer-die-energiewende-keine-neuen-kraftwerke-braucht-2505-196377.html&referer=https://t.co/ef632d2fcc,0,www.golem.de,Rotierende Massen: Warum es für die Energiewende keine neuen Kraftwerke braucht,"Kraftwerksturbinen besitzen Trägheit, die Frequenzschwankungen im Stromnetz abfängt und es dabei stabilisiert. Das ist elegant, aber nicht alternativlos. Von Mario Petzold (Blackout, Energiewende)",,2025-05-21T12:15:02Z,,"Besuchen Sie Golem.de wie gewohnt mit Werbung und Tracking,
 indem Sie der Nutzung aller Cookies zustimmen.
 Details zum Tracking finden Sie im Privacy Center.
Skript wurde nicht geladen. Informat… [+607 chars]",,de,'Blackout'
https://www.diepresse.com/19708158/osteuropas-demografischer-moment-der-wahrheit,https://www.diepresse.com/19708158/osteuropas-demografischer-moment-der-wahrheit,0,www.diepresse.com,Osteuropas demografischer Moment der Wahrheit,"Keine Region leidet derart unter Bevölkerungsschwund wie der Osten und Südosten. Die EU hat hier wenig Handhabe. Denn die bewährten Gegenrezepte – mehr Einwanderung, mehr öffentliche Kinderbetreuung – sind oft unpopulär.",https://img.diepresse.com/public/incoming/ovq2ms-05.22-s15-Migration-Bevo%CC%88lkerungprognose-2050-GK.gif/alternates/DPR_SOCIAL_MAGAZIN/05.22-s15-Migration-Bevo%CC%88lkerungprognose-2050-GK.gif,2025-05-21T12:29:23Z,https://web.archive.org/web/20250523081708/https://www.diepresse.com/19708158/osteuropas-demografischer-moment-der-wahrheit,"Keine Region leidet derart unter Bevölkerungsschwund wie der Osten und Südosten. Die EU hat hier wenig Handhabe. Denn die bewährten Gegenrezepte mehr Einwanderung, mehr öffentliche Kinderbetreuung si… [+7242 chars]",,de,'Kinder'
https://www.bild.de/leben-wissen/auto/bei-blackout-elektroauto-am-notstrom-aggregat-laden-geht-das-682ae5e60936db78629a616f,https://www.bild.de/leben-wissen/auto/bei-blackout-elektroauto-am-notstrom-aggregat-laden-geht-das-682ae5e60936db78629a616f,0,www.bild.de,Wenn bei Blackout das Stromnetz ausfällt - E-Auto am Notstrom-Aggregat aufladen – geht das?,Bei einem Blackout wie kürzlich in Spanien fällt auch das öffentliche Ladenetz aus. Wie kann man dann ein E-Auto laden? Geht das per Notstromaggregat?,"https://images.bild.de/682ae5e60936db78629a616f/f40b379a1899df2247ba59d248ac3ce3,2330cc2a?w=1280",2025-05-21T19:59:01Z,https://web.archive.org/web/20250521203120/http://www.bild.de/leben-wissen/auto/bei-blackout-elektroauto-am-notstrom-aggregat-laden-geht-das-682ae5e60936db78629a616f,"Um den TTS Player darzustellen, brauchen wir deine Zustimmung. 
 externen Inhalt aktivieren Um eingebettete Inhalte anzuzeigen, ist Ihre jederzeit widerrufliche Einwilligung (über den Schalter oder … [+3707 chars]",,de,'Blackout'
https://www.zeit.de/news/2025-05/22/erste-200-gaslaternen-in-duesseldorf-auf-led-umgestellt,https://www.zeit.de/news/2025-05/22/erste-200-gaslaternen-in-duesseldorf-auf-led-umgestellt,0,www.zeit.de,Strom statt Gas: Erste 200 Gaslaternen in Düsseldorf auf LED umgestellt,Hier finden Sie Informationen zu dem Thema „Strom statt Gas“. Lesen Sie jetzt „Erste 200 Gaslaternen in Düsseldorf auf LED umgestellt“.,https://img.zeit.de/news/2025-05/22/erste-200-gaslaternen-in-duesseldorf-auf-led-umgestellt-image-group/wide__1300x731,2025-05-22T01:41:36Z,,In Düsseldorf sind die ersten rund 200 historischen Gaslaternen auf strombetriebene LED-Technik umgerüstet worden. Diese Zahl nannte die Stadt anlässlich einer Präsentation der Arbeiten. Die Umrüstun… [+1048 chars],,de,'Gas'
https://gentleman-blog.de/10-tipps-kindersicherheit-im-strassenverkehr/,https://gentleman-blog.de/10-tipps-kindersicherheit-im-strassenverkehr/,0,gentleman-blog.de,Baby on Board: 10 Tipps für Kindersicherheit im Straßenverkehr,"Du hast Schlafmangel, trägst das dritte Mal in Folge ein T-Shirt mit Milchflecken und dein Auto riecht neuerdings nach Feuchttüchern und Babycreme? Willkommen im Club der frischgebackenen Väter. Zwischen Wickeltasche und Windelwechsel steht jetzt auch die Sic…",https://gentleman-blog.de/wp-content/uploads/father-putting-daughter-car-seat-1.jpg,2025-05-22T06:20:07Z,,"Du hast Schlafmangel, trägst das dritte Mal in Folge ein T-Shirt mit Milchflecken und dein Auto riecht neuerdings nach Feuchttüchern und Babycreme? Willkommen im Club der frischgebackenen Väter. Zwis… [+6020 chars]",,de,'Kälte'
https://www.tagesspiegel.de/berlin/bezirke/spandau/orientalische-und-deutsche-kuche-wir-sind-die-neuen-gastronomen-im-kulturhaus-spandau-13728082.html,https://www.tagesspiegel.de/berlin/bezirke/spandau/orientalische-und-deutsche-kuche-wir-sind-die-neuen-gastronomen-im-kulturhaus-spandau-13728082.html,0,www.tagesspiegel.de,Orientalische und deutsche Küche: „Wir sind die neuen Gastronomen im Kulturhaus Spandau“,"Zwei Jahre stand eine bekannte Gastro-Immobilie in der Altstadt leer. Jetzt hat eine Familie das Bistro wiederbelebt. Ein Gespräch über Senfeier, Senioren und das SPD-Parteibuch - und über die Türkei und Libanon.",https://www.tagesspiegel.de/images/13734442/alternates/BASE_16_9_W1400/1747898189000/bistro-im-kulturhaus-berlin-spandau-unvernunft-deluxe.jpeg,2025-05-22T07:27:51Z,https://web.archive.org/web/20250523032308/https://www.tagesspiegel.de/berlin/bezirke/spandau/orientalische-und-deutsche-kuche-wir-sind-die-neuen-gastronomen-im-kulturhaus-spandau-13728082.html,Im Kulturhaus in der Altstadt von Berlin-Spandau brennt wieder Licht. Diese Woche wurde das neue Bistro im Kulturhaus Spandau nach zwei Jahren Leerstand wiedereröffnet. Hier im Tagesspiegel-Newslette… [+5473 chars],,de,'ältere Mensch'
