index,url,valid,domain,title,description,image,published,archive,content,quote,language,keyword
https://www.morgenpost.de/vermischtes/article237554029/usa-minus-78-grad-windchill-temperatur-rekord.html,https://www.morgenpost.de/vermischtes/article237554029/usa-minus-78-grad-windchill-temperatur-rekord.html,0,www.morgenpost.de,Kältewelle: Minus 78 Grad: Arktische Rekordkälte sucht die USA heim,Kalt wie nie: Im Osten Nordamerikas sorgen polare Luftströme mit starken Windböen für extremen Frost. Sogar die Erde bebt vor Kälte.,https://img.morgenpost.de/img/vermischtes/crop237554025/7612603161-w820-cv16_9-q85/98fb1432-a545-11ed-b2c3-3e6148bd5b8b.jpg,2023-02-05T11:56:30Z,https://web.archive.org/web/20230205123720/https://www.morgenpost.de/vermischtes/article237554029/usa-minus-78-grad-windchill-temperatur-rekord.html,"Washington.  Die Verantwortlichen der US-Wetterbehörde ahnten, was auf das Land zukommen würde. Arktische Kälte werde sich ausbreiten, die Temperaturen auf einen so niedrigen Stand sinken, wie es nur… [+3215 chars]",,de,'Kälte'
https://www.tagesschau.de/wissen/technologie/waerme-abwasser-101.html,https://www.tagesschau.de/wissen/technologie/waerme-abwasser-101.html,0,www.tagesschau.de,Heizen mit Wärme aus der Kloake,Gas und Öl sind teuer geworden und schlecht fürs Klima. Holz will die EU nur noch eingeschränkt als nachhaltigen Brennstoff einstufen. Eine Alternative mit großem Potenzial: Wärme aus Abwasser. <em>Von S. Plentinger und B. Fuß.</em>,https://www.tagesschau.de/multimedia/bilder/abwasser-103~_v-original.jpg,2023-02-05T14:33:55Z,https://web.archive.org/web/20230205162200/https://www.tagesschau.de/wissen/technologie/waerme-abwasser-101.html,"Gas und Öl sind teuer geworden und schlecht fürs Klima. Holz will die EU nur noch eingeschränkt als nachhaltigen Brennstoff einstufen. Eine Alternative mit großem Potenzial: Wärme aus Abwasser. 
Ein… [+3370 chars]",,de,'Gas'
https://www.sueddeutsche.de/muenchen/erding/spenden-ukraine-dorfen-1.5745383,https://www.sueddeutsche.de/muenchen/erding/spenden-ukraine-dorfen-1.5745383,0,www.sueddeutsche.de,Für die Menschen im Kriegsgebiet: Ukrainehilfe Dorfen sammelt Spenden,Zweiter Hilfstransport der Privatinitiative startet am 11. Februar ins Krisengebiet. Die Empfänger sind Frauen und Kinder in Dörfern rund um die Städte Kherson und Mikolaijev.,https://www.sueddeutsche.de/image/sz.1.5625688/1200x675?v=1675612339,2023-02-05T15:52:28Z,https://web.archive.org/web/20230205213438/https://www.sueddeutsche.de/muenchen/erding/spenden-ukraine-dorfen-1.5745383,Zweiter Hilfstransport der Privatinitiative startet am 11. Februar ins Krisengebiet. Die Empfänger sind Frauen und Kinder in Dörfern rund um die Städte Kherson und Mikolaijev.Die Ukrainehilfe Dorfen … [+2772 chars],,de,'Kälte'
https://www.diepresse.com/6247599/geschlechtswechsel-durch-blosse-selbsterklaerung,https://www.diepresse.com/6247599/geschlechtswechsel-durch-blosse-selbsterklaerung,0,www.diepresse.com,Geschlechtswechsel durch bloße Selbsterklärung?,"Rollenklischees. Wann ist ein Mann ein Mann, eine Frau eine Frau? Gedanken zu neuen Debatten um ein „gefühltes“ Geschlecht.",https://www.diepresse.com/assets_v2/images/diepresse_meinung.png,2023-02-05T16:42:00Z,http://archive.md/20230206092305/https://www.diepresse.com/6247599/geschlechtswechsel-durch-blosse-selbsterklaerung,"Rollenklischees. Wann ist ein Mann ein Mann, eine Frau eine Frau? Gedanken zu neuen Debatten um ein gefühltes Geschlecht.
Das Konzept von sozialem Geschlecht, Geschlechtsidentität und Geschlechtsaus… [+5344 chars]",,de,'Geschlecht'
https://www.handelsblatt.com/meinung/gastbeitraege/gastkommentar-wir-muessen-der-ukraine-den-sieg-ermoeglichen/28963228.html,https://www.handelsblatt.com/meinung/gastbeitraege/gastkommentar-wir-muessen-der-ukraine-den-sieg-ermoeglichen/28963228.html,0,www.handelsblatt.com,Gastkommentar: Wir müssen der Ukraine den Sieg ermöglichen,"Putin hat gezeigt, dass er nicht verhandeln will. Der Krieg wird nur enden, wenn die Ukraine den Angreifer vertreiben kann – dafür braucht sie auch Panzer, ist Josep Borrell überzeugt.",https://www.handelsblatt.com/images/josep-borrell/28964780/2-format2003.jpg,2023-02-06T03:00:00Z,https://web.archive.org/web/20230206023656/https://www.handelsblatt.com/meinung/gastbeitraege/gastkommentar-wir-muessen-der-ukraine-den-sieg-ermoeglichen/28963228.html,Fast ein Jahr nach der Invasion Russlands in die Ukraine tritt der Krieg in eine neue Phase. Nach dem gescheiterten Angriff auf Kiew im vergangenen Frühjahr und der starken ukrainischen Gegenoffensiv… [+6934 chars],,de,'Gas'
https://www.zeit.de/gesellschaft/2023-01/stadtflucht-stadtleben-landleben-berlin-familie,https://www.zeit.de/gesellschaft/2023-01/stadtflucht-stadtleben-landleben-berlin-familie,0,www.zeit.de,Stadtflucht: Was wollt ihr alle auf dem Land?,"Seit Corona zieht es mehr Familien aufs Land. Eltern glauben, für Kinder sei es das Beste. Dabei kann S-Bahn-Rauschen mindestens so beflügeln wie ein Wildbach.",,2023-02-06T07:41:28Z,http://archive.md/20230206080407/https://www.zeit.de/gesellschaft/2023-01/stadtflucht-stadtleben-landleben-berlin-familie,"When browsing with ads:
We collect personal data and also transmit it to third-party providers
 that help us improve and finance our digital content. Some of the information stored on your device, … [+732 chars]",,de,'Kinder'
https://www.focus.de/finanzen/news/heizkosten-heizoel-pellets-oder-brennholz-ueberblick-ueber-die-aktuellen-preise_id_184829527.html,https://www.focus.de/finanzen/news/heizkosten-heizoel-pellets-oder-brennholz-ueberblick-ueber-die-aktuellen-preise_id_184829527.html,0,www.focus.de,"Heizkosten - Soll ich jetzt schon Heizöl, Pellets oder Brennholz kaufen?","Der Winter ist noch nicht vorbei und die Temperaturen bleiben weiterhin niedrig. Viele Haushalte überlegen jetzt, wann sie Heizöl oder Brennholz bestellen sollen. Entweder um für den Rest des Winters gerüstet zu sein oder um für den nächsten Winter vorzusorge…",https://p6.focus.de/img/fotos/id_98030979/heizoel-72682473.jpg?im=Crop%3D%280%2C204%2C3489%2C1746%29%3BResize%3D%281200%2C627%29&impolicy=perceptual&quality=medium&hash=accd477c4a9af5b9ee56194b8a9cb57b2331cbc512496c4c2744edaf3d5c6fd1,2023-02-06T07:51:17Z,https://web.archive.org/web/20230206161859/https://www.focus.de/finanzen/news/heizkosten-heizoel-pellets-oder-brennholz-ueberblick-ueber-die-aktuellen-preise_id_184829527.html,"Der Winter ist noch nicht vorbei und die Temperaturen bleiben weiterhin niedrig. Viele Haushalte überlegen jetzt, wann sie Heizöl oder Brennholz bestellen sollen. Entweder um für den Rest des Winters… [+5873 chars]",,de,'Heizkosten'
https://www.nzz.ch/wirtschaft/die-bundesverwaltung-ueberzahlt-ihre-mitarbeiter-im-schnitt-um-12-prozent-ld.1724735,https://www.nzz.ch/wirtschaft/die-bundesverwaltung-ueberzahlt-ihre-mitarbeiter-im-schnitt-um-12-prozent-ld.1724735,0,www.nzz.ch,Die Bundesverwaltung überzahlt ihre Mitarbeiter im Schnitt um 12 Prozent,Eine neue Lohnstudie zeigt: auch die Kantone und Gemeinden bezahlen ihre Angestellten bei vergleichbarer Qualifikation in der Regel besser als die Privatwirtschaft. Besonders ausgeprägt ist die Lohnprämie beim Bund für weniger gut Qualifizierte und für Ältere.,"https://img.nzz.ch/2023/01/20/11463baf-ed20-4c43-962a-f999012b8114.jpeg?width=1200&height=675&fit=bound&quality=75&auto=webp&crop=4853,2730,x0,y505&wmark=nzz",2023-02-06T10:56:08Z,https://web.archive.org/web/20230206123804/https://www.nzz.ch/wirtschaft/die-bundesverwaltung-ueberzahlt-ihre-mitarbeiter-im-schnitt-um-12-prozent-ld.1724735,"Verwaltungsangestellte haben im Bund einen sehr grosszügigen und sozialen Arbeitgeber.
Eine sichere Stelle in der öffentlichen Verwaltung, dafür weniger herausfordernd und etwas schlechter bezahlt a… [+6028 chars]",,de,'Ältere'
https://www.wiwo.de/unternehmen/energie/neue-sanktionen-gegen-russland-beim-diesel-wird-es-keine-preisexplosionen-geben/28965188.html,https://www.wiwo.de/unternehmen/energie/neue-sanktionen-gegen-russland-beim-diesel-wird-es-keine-preisexplosionen-geben/28965188.html,0,www.wiwo.de,Neue Sanktionen gegen Russland: „Beim Diesel wird es keine Preisexplosionen geben“,"Die EU will ab jetzt kein Diesel mehr aus Russland importieren. Was heißt das für Verbraucher? Duraid El Obeid, Verbandschef der Freien Tankstellen über die Versorgung im Osten, die Schwedter Raffinerie – und Atomkraft.",https://www.wiwo.de/images/neue-oel-sanktionen-gegen-russland-treten-in-kraft/28965282/2-format11240.jpg,2023-02-06T12:29:21Z,,"Seit dem vergangenen Sonntag greifen neue Sanktionen der Europäischen Union gegenüber Moskau. Die Europäer wollen jetzt keine Raffinerieprodukte wie Diesel, Benzin oder Schmierstoffe aus Russland meh… [+4874 chars]",,de,'Atomkraft'
https://taz.de/RWE-Kraftwerke-schaden/!5910646/,https://taz.de/RWE-Kraftwerke-schaden/!5910646/,0,taz.de,"RWE-Kraftwerke schaden: 1,5 Millionen verlorene Jahre","NewClimate Institute berechnet, wie viele Tote der Weiterbetrieb der RWE-Kohlekraftwerke bis 2030 noch kosten wird.",https://taz.de/picture/6076192/948/2870946-1.jpeg,2023-02-06T12:33:00Z,,"NewClimate Institute berechnet, wie viele Tote der Weiterbetrieb der RWE-Kohlekraftwerke bis 2030 noch kosten wird.
Gesundheitsschädlicher Rauch steigt aus den Schornsteinen des RWE-Braunkohlekraftw… [+2366 chars]",,de,'Kohle'
https://www.tagesspiegel.de/wissen/kohleausstieg-geht-nur-konsequent-forschende-sehen-nur-wenig-chancen-fur-globalen-ausstieg-9299267.html,https://www.tagesspiegel.de/wissen/kohleausstieg-geht-nur-konsequent-forschende-sehen-nur-wenig-chancen-fur-globalen-ausstieg-9299267.html,0,www.tagesspiegel.de,Kohleausstieg geht nur konsequent: Forschende sehen wenig Chancen für globalen Ausstieg,"In einer Untersuchung wurde betrachtet, wie realistisch die Pläne der Nationen zum Kohleausstieg sind. Die Ergebnisse sind ernüchternd, es werden aber auch Handlungsoptionen aufgezeigt.",https://www.tagesspiegel.de/images/klimaschutz-index-deutschland-schneidet-etwas-besser-ab/alternates/BASE_16_9_W1400/klimaschutz-indexdeutschland-schneidet-etwas-besser-ab.jpeg,2023-02-06T16:54:05Z,,"Die aktuelle Klimapolitik der Weltgemeinschaft wird nicht zu einem globalen Kohleausstieg führen, auch nicht durch die Bemühungen der Powering Past Coal Alliance, die auf dem Weltklimagipfel COP23 20… [+3940 chars]",,de,'Kohle'
https://www.zeit.de/news/2023-02/06/studie-zu-vaetern-mehr-zeit-fuer-kinder-nicht-nur-ernaehrer,https://www.zeit.de/news/2023-02/06/studie-zu-vaetern-mehr-zeit-fuer-kinder-nicht-nur-ernaehrer,0,www.zeit.de,Gesellschaft: Studie zu Vätern: Mehr Zeit für Kinder - Nicht nur Ernährer,,,2023-02-06T16:58:23Z,https://web.archive.org/web/20230206172638/https://www.zeit.de/news/2023-02/06/studie-zu-vaetern-mehr-zeit-fuer-kinder-nicht-nur-ernaehrer,"When browsing with ads:
We collect personal data and also transmit it to third-party providers
 that help us improve and finance our digital content. Some of the information stored on your device, … [+732 chars]",,de,'Kinder'
https://www.sueddeutsche.de/muenchen/dachau/karlsfeld-hallenbad-schliessung-sanierung-gemeinderat-1.5745928,https://www.sueddeutsche.de/muenchen/dachau/karlsfeld-hallenbad-schliessung-sanierung-gemeinderat-1.5745928,0,www.sueddeutsche.de,Karlsfeld: Wer rettet das Hallenbad?,"Viel Zeit bleibt nicht mehr, bis der Gemeinderat über die endgültige Schließung der Schwimmhalle entscheidet. Während der Bund bereits einen Zuschuss für die Sanierung zugesichert hat, hält sich der Freistaat bislang zurück.",https://www.sueddeutsche.de/image/sz.1.4646714/1200x675?v=1675688115,2023-02-06T17:07:44Z,,"Viel Zeit bleibt nicht mehr, bis der Gemeinderat über die endgültige Schließung der Schwimmhalle entscheidet. Während der Bund bereits einen Zuschuss für die Sanierung zugesichert hat, hält sich der … [+4433 chars]",,de,'Sanierung'
https://www.n-tv.de/politik/Binnenschiffer-Wasserstrassen-droht-Kollaps-article23896948.html,https://www.n-tv.de/politik/Binnenschiffer-Wasserstrassen-droht-Kollaps-article23896948.html,0,www.n-tv.de,"""Werden auf Verschleiß gefahren"": Binnenschiffer: Wasserstraßen droht Kollaps","Viele Wasserstraßen mit Bauwerken wie Schleusen und Brücken sind marode. Verdi und der Binnenschifffahrtsverband fordern die Regierung nun auf, die Sanierung nicht weiter hinauszuzögern. Sonst würden ökologische und ökonomische Konsequenzen drohen.",https://bilder1.n-tv.de/img/incoming/crop23897224/1971321654-cImg_16_9-w1200/391953944.jpg,2023-02-06T17:20:29Z,https://web.archive.org/web/20230206202020/https://www.n-tv.de/politik/Binnenschiffer-Wasserstrassen-droht-Kollaps-article23896948.html,"Viele Wasserstraßen mit Bauwerken wie Schleusen und Brücken sind marode. Verdi und der Binnenschifffahrtsverband fordern die Regierung nun auf, die Sanierung nicht weiter hinauszuzögern. Sonst würden… [+1210 chars]",,de,'Sanierung'
https://www.welt.de/vermischtes/katastrophen/video243630587/Erdbeben-in-Tuerkei-und-Syrien-Ex-THW-Praesident-sagt-warum-die-Rettung-oft-schwierig-ist.html,https://www.welt.de/vermischtes/katastrophen/video243630587/Erdbeben-in-Tuerkei-und-Syrien-Ex-THW-Praesident-sagt-warum-die-Rettung-oft-schwierig-ist.html,0,www.welt.de,"„Die Bergung muss so lange weiterlaufen, bis man alle Gebiete systematisch abgesucht hat“","Rettungskräfte versuchen, Verschüttete rechtzeitig aus Trümmern zu befreien. Menschen halten sich in der Kälte im Freien auf - aus Angst, dass weitere Gebäude einstürzen könnten. Albrecht Broemme, ehemaliger THW-Präsident, erklärt bei WELT die Schwierigkeiten…",https://img.welt.de/img/videos/mobile243633675/4441358467-ci16x9-w1200/THW-Broemme-jpg.jpg,2023-02-06T17:38:44Z,https://web.archive.org/web/20230206204632/https://www.welt.de/vermischtes/katastrophen/video243630587/Erdbeben-in-Tuerkei-und-Syrien-Ex-THW-Praesident-sagt-warum-die-Rettung-oft-schwierig-ist.html,"Die WELT als ePaper: Die vollständige Ausgabe steht Ihnen bereits am Vorabend zur Verfügung so sind Sie immer hochaktuell informiert. Weitere Informationen: http://epaper.welt.de 
 Der Kurz-Link die… [+49 chars]",,de,'Kälte'
https://www.welt.de/wirtschaft/article243630093/Staatliche-Zuschuesse-Der-Maerz-wird-zum-grossen-Auszahlmonat-fuer-Energiehilfen.html,https://www.welt.de/wirtschaft/article243630093/Staatliche-Zuschuesse-Der-Maerz-wird-zum-grossen-Auszahlmonat-fuer-Energiehilfen.html,0,www.welt.de,"Strom, Gas, Studenten-Pauschale – Wann Sie mit welcher Hilfe rechnen können","Längst nicht alle versprochenen Zuschüsse sind bereits angekommen. Nicht nur Studenten warten weiter auf ihre 200 Euro. Auch Gas-, Strom- und viele Heizölkunden müssen sich noch etwas auf die Unterstützung gedulden. Doch der große Auszahlungsmonat ist bereits…",https://img.welt.de/img/wirtschaft/mobile243633435/5561351147-ci16x9-w1200/GettyImages-1369185818.jpg,2023-02-06T17:53:45Z,,"Den unrühmlichen Rekord für die Energiepreishilfe mit der längsten Wartezeit hat Bildungsministerin Bettina Stark-Watzinger sicher. Fünf Monate sind mittlerweile vergangen, seit allen Studenten und F… [+6966 chars]",,de,'Kohle'
https://www.bild.de/sport/fussball/1-fc-nuernberg/kein-witz-der-fcn-hatte-eine-derby-praemie-82812242.bild.html,https://www.bild.de/sport/fussball/1-fc-nuernberg/kein-witz-der-fcn-hatte-eine-derby-praemie-82812242.bild.html,0,www.bild.de,Kein Witz! - Der Club hatte eine Derby-Prämie,Im Franken-Derby bei Greuther Fürth (0:1) zeigte der 1. FC Nürnberg erneut eine ganz schwache Partie. Daran änderte auch ein Kohle-Trick nichts.,"https://images.bild.de/63e140b95f59113adad675d0/91a0d45e3c0c14b13ad493999ae3ca35,10f677af?w=1280",2023-02-06T18:17:00Z,,"Davon war nicht wirklich etwas zu merken!
Zuletzt im Derby bei Greuther Fürth (0:1) zeigte der Club erneut eine ganz schwache Vorstellung. Dabei ließen die FCN-Bosse nichts unversucht, um fürs Frank… [+819 chars]",,de,'Kohle'
https://www.n-tv.de/panorama/Helfer-fuerchten-Schneesturm-in-Erdbebengebiet-article23897638.html,https://www.n-tv.de/panorama/Helfer-fuerchten-Schneesturm-in-Erdbebengebiet-article23897638.html,0,www.n-tv.de,Wetterumschwung droht: Helfer fürchten Schneesturm in Erdbebengebiet,Nach dem verheerenden Erdbeben in Syrien und der Türkei steigt die Zahl der Todesopfer auf mehr als 4200. Unterdessen warnt eine Hilfsorganisation vor einem drohenden Schneesturm. Schon jetzt herrscht eisige Kälte in der Region.,https://bilder3.n-tv.de/img/incoming/crop23897642/9761328805-cImg_16_9-w1200/394217816.jpg,2023-02-07T03:26:50Z,https://web.archive.org/web/20230207073435/https://www.n-tv.de/panorama/Helfer-fuerchten-Schneesturm-in-Erdbebengebiet-article23897638.html,Nach dem verheerenden Erdbeben in Syrien und der Türkei steigt die Zahl der Todesopfer auf mehr als 4200. Unterdessen warnt eine Hilfsorganisation vor einem drohenden Schneesturm. Schon jetzt herrsch… [+3126 chars],,de,'Kälte'
https://orf.at/stories/3304245/,https://orf.at/stories/3304245/,0,orf.at,Tausende neue Helfer in Bebengebiet,Einen Tag nach den beiden verheerenden Beben in der Türkei und Syrien sind bereits mehr als 4.200 Opfer tot geborgen worden. Unterdessen suchten Rettungskräfte bei eisiger Kälte die ganze Nacht hindurch nach weiteren Überlebenden. Sie erhalten Unterstützung v…,https://ibs.orf.at/news?image=https%3A%2F%2Fassets.orf.at%2Fmims%2F2023%2F06%2F72%2Fcrops%2Fw%3D1200%2Ch%3D630%2Cq%3D75%2F1667864_master_613972_tuerkei_syrien_beben_liveticker_body13_r.jpg%3Fs%3D911f7d7eed8638004cb834709dcd305ca20673b3,2023-02-07T05:38:34Z,https://web.archive.org/web/20230207060505/https://orf.at/stories/3304245/,"Nach Angaben des türkischen Gouverneurs von Istanbul, Ali Yerlikaya, haben sich zahlreiche Helfer vom städtischen Flughafen aus auf den Weg in die von Erdbeben verheerend getroffene Südtürkei gemacht… [+6866 chars]",,de,'Kälte'
https://steiermark.orf.at/stories/3193645/,https://steiermark.orf.at/stories/3193645/,0,steiermark.orf.at,Kälte: Notschlafstellen sind fast ausgelastet,Bei nächtlichen Temperaturen von teils unter minus zehn Grad ist ein Übernachten im Freien für obdachlose Menschen lebensgefährlich. Die Notschlafstellen in Graz sind nahezu voll und sie brauchen mehr ehrenamtliche Helfer.,https://ibs.orf.at/stm?image=https%3A%2F%2Foekastatic.orf.at%2Fmims%2F2022%2F51%2F08%2Fcrops%2Fw%3D1200%2Ch%3D627%2Cq%3D75%2F1605825_master_588608_notschlaf1.jpg%3Fs%3D5899aeb9913323e5c64318d5b36156ab76e03aa9,2023-02-07T06:22:28Z,https://web.archive.org/web/20230207072225/https://steiermark.orf.at/stories/3193645/,"240 Betten bieten die Vinziwerke in Graz an. Hier können Menschen schlafen, die sonst kein zu Hause haben. Und dieses Angebot werde derzeit auch dringend benötigt, sagt Amrita Böker: Wir haben immer … [+1770 chars]",,de,'Kälte'
https://orf.at/stories/3304256/,https://orf.at/stories/3304256/,0,orf.at,Grazer Notschlafstellen wegen Kälte praktisch voll,,https://orf.at/mojo/1_4_1/storyserver//news/common/images/og-fallback-news.png,2023-02-07T07:20:46Z,https://web.archive.org/web/20230207092206/https://orf.at/stories/3304256/,Bei nächtlichen Temperaturen von teils unter minus zehn Grad ist ein Übernachten im Freien für obdachlose Menschen lebensgefährlich. Die Notschlafstellen in Graz sind nahezu voll. Sie brauchen mehr e… [+67 chars],,de,'Kälte'
https://www.welt.de/vermischtes/katastrophen/video243636041/Erdbeben-in-Tuerkei-und-Syrien-Was-die-Hilfsarbeiten-so-erschwert.html,https://www.welt.de/vermischtes/katastrophen/video243636041/Erdbeben-in-Tuerkei-und-Syrien-Was-die-Hilfsarbeiten-so-erschwert.html,0,www.welt.de,„Nachbeben und die Kälte erschweren die Hilfsarbeit“,"„Die Lage im Schadensgebiet ist sehr angespannt“, sagt Oliver Hochedez, von den Maltesern. Die außergewöhnliche Kältewelle in der Türkei sei eine große Herausforderung für die Rettungskräfte. Die Lage in Syrien sei noch sehr unübersichtlich.",https://img.welt.de/img/vermischtes/katastrophen/mobile243636801/0271351617-ci16x9-w1200/hochedez-jpg.jpg,2023-02-07T07:56:01Z,,"Die WELT als ePaper: Die vollständige Ausgabe steht Ihnen bereits am Vorabend zur Verfügung so sind Sie immer hochaktuell informiert. Weitere Informationen: http://epaper.welt.de 
 Der Kurz-Link die… [+49 chars]",,de,'Kälte'
https://www.tagesschau.de/wirtschaft/russland-gold-devisen-verkauf-defizit-101.html,https://www.tagesschau.de/wirtschaft/russland-gold-devisen-verkauf-defizit-101.html,0,www.tagesschau.de,"Russland verkauft Goldreserven, um Etat defizit auszugleichen","Um sein hohes Haushaltsdefizit auszugleichen, hat Russland einen Teil seiner Goldreserven verkauft. Auch Devisen wurden veräußert, denn Einnahmen aus dem Verkauf von Öl und Gas gehen weiter zurück.",https://www.tagesschau.de/multimedia/bilder/gold-russland-105~_v-original.jpg,2023-02-07T07:56:17Z,https://web.archive.org/web/20230207082508/https://www.tagesschau.de/wirtschaft/russland-gold-devisen-verkauf-defizit-101.html,"Um sein hohes Haushaltsdefizit auszugleichen, hat Russland einen Teil seiner Goldreserven verkauft. Auch Devisen wurden veräußert. Die Einnahmen aus dem Verkauf von Öl und Gas gehen gleichzeitig weit… [+2579 chars]",,de,'Gas'
https://www.focus.de/finanzen/news/auch-fuer-pellets-und-fluessiggas-haben-sie-2022-heizoel-bestellt-dann-winken-ihnen-bis-zu-2000-euro-hilfe_id_184726229.html,https://www.focus.de/finanzen/news/auch-fuer-pellets-und-fluessiggas-haben-sie-2022-heizoel-bestellt-dann-winken-ihnen-bis-zu-2000-euro-hilfe_id_184726229.html,0,www.focus.de,Auch für Pellets und Flüssiggas - Haben Sie 2022 Heizöl bestellt? Dann winken Ihnen bis zu 2000 Euro Hilfe,"Gaspreisbremse, Strompreisbremse und Erstattung für Fernwärme. Doch was ist mit Haushalten, die mit Heizöl heizen? Im Kleingedruckten hat die Bundesregierung eine Entlastung geplant. Doch nur wenige können davon profitieren. FOCUS online sagt, was genau gilt.",https://p6.focus.de/img/fotos/id_160188255/heizoel-lieferung-51920714.jpg?im=Crop%3D%280%2C248%2C3533%2C1766%29%3BResize%3D%281200%2C627%29&impolicy=perceptual&quality=medium&hash=c362821a40fc41e398678fce90cf69cd5cdcdc1aa2c5b6225e37d66030ecb725,2023-02-07T07:59:16Z,,"Gaspreisbremse, Strompreisbremse und Erstattung für Fernwärme. Doch was ist mit Haushalten, die mit Heizöl heizen? Im Kleingedruckten hat die Bundesregierung eine Entlastung geplant. Doch nur wenige … [+3781 chars]",,de,'Gas'
https://www.tagesschau.de/wirtschaft/verbraucher/energie-sanierung-klimaziele-klimaneutral-mieten-energiesparen-wohnungen-haeuser-101.html,https://www.tagesschau.de/wirtschaft/verbraucher/energie-sanierung-klimaziele-klimaneutral-mieten-energiesparen-wohnungen-haeuser-101.html,0,www.tagesschau.de,Deutschland hinkt bei energetischen Sanierungen hinterher,Bislang werden in Deutschland viel zu wenig Häuser und Wohnungen energieeffizient modernisiert. Deshalb sind Experten zufolge die Klimaziele in Gefahr. Zu hohe Materialkosten bremsen.,https://www.tagesschau.de/multimedia/bilder/sanierung-101~_v-original.jpg,2023-02-07T08:03:29Z,https://web.archive.org/web/20230207082502/https://www.tagesschau.de/wirtschaft/verbraucher/energie-sanierung-klimaziele-klimaneutral-mieten-energiesparen-wohnungen-haeuser-101.html,"Bislang werden in Deutschland viel zu wenig Häuser und Wohnungen energieeffizient modernisiert. Deshalb sind Experten zufolge die Klimaziele in Gefahr. Zu hohe Materialkosten bremsen.    
In Deutsch… [+2898 chars]",,de,'Sanierung'
https://www.n-tv.de/panorama/Erdbeben-Retter-kaempfen-mit-Kaelte-und-gegen-die-Zeit-article23898106.html,https://www.n-tv.de/panorama/Erdbeben-Retter-kaempfen-mit-Kaelte-und-gegen-die-Zeit-article23898106.html,0,www.n-tv.de,Zahl der Toten übersteigt 5000: Erdbeben-Retter kämpfen mit Kälte und gegen die Zeit,"Zehntausende Menschen verbringen nach den schweren Beben im türkisch-syrischen Grenzgebiet die Nacht unter freiem Himmel. Trotz widrigster Bedingungen versuchen die Retter weiter, Überlebende aus den Trümmern zu bergen.",https://bilder4.n-tv.de/img/incoming/crop23898455/6591321722-cImg_16_9-w1200/177e4577fcafec08d68d528f9a0a1c56.jpg,2023-02-07T08:15:32Z,https://web.archive.org/web/20230207123818/https://www.n-tv.de/panorama/Erdbeben-Retter-kaempfen-mit-Kaelte-und-gegen-die-Zeit-article23898106.html,"Zehntausende Menschen verbringen nach den schweren Beben im türkisch-syrischen Grenzgebiet die Nacht unter freiem Himmel. Trotz widrigster Bedingungen versuchen die Retter weiter, Überlebende aus den… [+4061 chars]",,de,'Kälte'
https://www.bild.de/ratgeber/2022/ratgeber/minusgrade-in-deutschland-was-muss-ich-bei-dieser-kaelte-beachten-82205184.bild.html,https://www.bild.de/ratgeber/2022/ratgeber/minusgrade-in-deutschland-was-muss-ich-bei-dieser-kaelte-beachten-82205184.bild.html,0,www.bild.de,Bibber-Temperaturen in Deutschland - Was muss ich bei dieser Kälte beachten?,"Wer jetzt vor die Tür geht, sollte sich gut gegen die Kälte wappnen. BILD beantwortet die wichtigsten Fragen: Was anziehen, essen und darf man Sport machen?","https://images.bild.de/6393449491afc3382d4eae1c/1bfa42931570a33e153c1a7df95ed862,75236bd0?w=1280",2023-02-07T08:38:54Z,https://web.archive.org/web/20230207150146/https://www.bild.de/ratgeber/2022/ratgeber/minusgrade-in-deutschland-was-muss-ich-bei-dieser-kaelte-beachten-82205184.bild.html,"Der 
Winter kehrt in Deutschland ein und es werden Minusgrade erwartet. 
Wer jetzt vor die Tür geht, sollte sich gut gegen die Kälte wappnen. BILD beantwortet die wichtigsten Fragen. 
Unser Körper… [+2476 chars]",,de,'Kälte'
