index,url,valid,domain,title,description,image,published,archive,content,quote,language,keyword
https://www.dw.com/de/weltraum-neue-deutsche-raumkapsel-startet-f%C3%BCr-die-forschung/a-72521498,https://www.dw.com/de/weltraum-neue-deutsche-raumkapsel-startet-f%C3%BCr-die-forschung/a-72521498,0,www.dw.com,Weltraum: Neue deutsche Raumkapsel startet für die Forschung,"Sie heißt Nxy, wie die griechische Göttin der Nacht. Der erste Auftrag für Deutschlands erstes Raumschiff: wissenschaftliche Experimente in der Schwerelosigkeit, vor allem mit Schimmelsporen. ""Mission possible"" (Mission möglich) - diesen hoffnungsvollen Namen…",https://static.dw.com/image/72522099_6.jpg,2025-05-13T12:56:00Z,https://web.archive.org/web/20250514054555/https://www.dw.com/de/weltraum-neue-deutsche-raumkapsel-startet-f%25C3%25BCr-die-forschung/a-72521498,"""Mission possible"" (Mission möglich)  - diesen hoffnungsvollen Namen hat die deutsche Entwicklerfirma, The Exploration Company (TEC), dem Jungfernflug ihres Raumschiffs gegeben. Voraussichtlich Anfan… [+3971 chars]",,de,'Schimmel'
https://taz.de/Nach-unaufgeklaertem-Blackout/!6084594/,https://taz.de/Nach-unaufgeklaertem-Blackout/!6084594/,0,taz.de,Nach unaufgeklärtem Blackout: Spanische Atomlobby sieht ihre große Chance,"Nach dem Mega-Stromausfall setzt die spanische Opposition alles daran, die Energiewende dafür verantwortlich zu machen. Ihre Alternative: Atomstrom.",https://taz.de/picture/7694916/1200/38376192-1.jpeg,2025-05-13T13:04:00Z,http://archive.md/20250513143513/https://taz.de/Nach-unaufgeklaertem-Blackout/!6084594/,"Nach dem Mega-Stromausfall setzt die spanische Opposition alles daran, die Energiewende dafür verantwortlich zu machen. Ihre Alternative: Atomstrom. mehr...",,de,'Blackout'
https://stadt-bremerhaven.de/gemini-wird-zum-universellen-assistenten-fuer-alle-android-geraete/,https://stadt-bremerhaven.de/gemini-wird-zum-universellen-assistenten-fuer-alle-android-geraete/,0,stadt-bremerhaven.de,Gemini wird zum universellen Assistenten für alle Android-Geräte,"Google gibt Gas und rollt seinen KI-Assistenten Gemini auf weitere Android-Plattformen aus. Nach dem erfolgreichen Start auf Smartphones wird die künstliche Intelligenz nun bald auch auf Smartwatches mit Wear OS, Android Auto, Google TV und sogar auf AR/VR-He…",https://stadt-bremerhaven.de/wp-content/uploads/2025/05/TAS_Gemini_Across_Devices_Blog_H.width-2200.format-webp.jpg,2025-05-13T17:19:56Z,https://web.archive.org/web/20250514154318/https://stadt-bremerhaven.de/gemini-wird-zum-universellen-assistenten-fuer-alle-android-geraete/,Google gibt Gas und rollt seinen KI-Assistenten Gemini auf weitere Android-Plattformen aus. Nach dem erfolgreichen Start auf Smartphones wird die künstliche Intelligenz nun bald auch auf Smartwatches… [+2129 chars],,de,'Gas'
https://www.tagesschau.de/inland/gesellschaft/unicef-kinder-wohlbefinden-deutschland-100.html,https://www.tagesschau.de/inland/gesellschaft/unicef-kinder-wohlbefinden-deutschland-100.html,0,www.tagesschau.de,Wohlbefinden von Kindern in Deutschland geht laut UNICEF zurück,"Laut UNICEF haben sich die Lebensbedingungen für Kinder in Deutschland verschlechtert, mit Rückgängen bei Schulkompetenzen und Lebenszufriedenheit. Das Kinderhilfswerk fordert unter anderem mehr Bildungsinvestitionen.",https://images.tagesschau.de/image/35d92fff-ad66-4a5c-afb0-7a620e81ef42/AAABlsyHazU/AAABkZLhkrw/16x9-1280/kind-baukloetze-100.jpg,2025-05-14T02:16:38Z,https://web.archive.org/web/20250514032601/https://www.tagesschau.de/inland/gesellschaft/unicef-kinder-wohlbefinden-deutschland-100.html,"Stand: 14.05.2025 04:16 Uhr
Laut UNICEF haben sich die Lebensbedingungen für Kinder in Deutschland verschlechtert, mit Rückgängen bei Schulkompetenzen und Lebenszufriedenheit. Das Kinderhilfswerk fo… [+2574 chars]",,de,'Kinder'
https://www.brigitte.de/leben/sprueche-aus-den-wechseljahren--erkennst-du-dich-wieder--13981652.html,https://www.brigitte.de/leben/sprueche-aus-den-wechseljahren--erkennst-du-dich-wieder--13981652.html,0,www.brigitte.de,"Hitzig und ehrlich: ""Ich habe keine Hitzewallungen, ich mache mich unabhängig von Heizkosten""","Willkommen in den Wechseljahren! Hitzewallung, Heulkrampf, Hormonchaos – und das alles vor dem ersten Kaffee. Wetten du erkennst dich wieder?",https://image.brigitte.de/13982470/t/Pj/v2/w1440/r1.7778/-/momente-wechseljahre-teaser.jpg,2025-05-14T08:17:00Z,https://web.archive.org/web/20250514094122/https://www.brigitte.de/leben/sprueche-aus-den-wechseljahren--erkennst-du-dich-wieder--13981652.html,"Willkommen in den Wechseljahren! Wenn der Körper neue Wege geht, sind Überraschungen vorprogrammiert. Diese Strecke sammelt ehrliche, alltägliche Szenen aus einer Zeit des hormonellen Wandels mal zum… [+1709 chars]",,de,'Heizkosten'
https://www.faz.net/aktuell/stil/eltern-familie/schwierige-kindheit-woran-erkennt-man-toxische-eltern-110449802.html,https://www.faz.net/aktuell/stil/eltern-familie/schwierige-kindheit-woran-erkennt-man-toxische-eltern-110449802.html,0,www.faz.net,Woran erkennt man toxische Eltern?,Toxische Eltern wirken nach außen oft ganz normal. Auch Kinder hinterfragen das Verhalten oft nicht. Es gibt aber eindeutige Hinweise.,https://media1.faz.net/ppmedia/aktuell/85534826/1.10449799/facebook_teaser_fplus/toxische-eltern-machen-ihre.jpg,2025-05-14T09:52:38Z,,"Vor drei Jahren erzählte Wolfgang Scheck seiner Mutter am Rande einer Familienfeier stolz, dass er von Beruf Uhrmacher bei einem Frankfurter Juwelier eine in seiner Freizeit selbst entworfene und geb… [+426 chars]",,de,'Kinder'
https://www.zeit.de/arbeit/2025-05/diskussion-erbschaft-konflikt-geschwister-zusammenhalt,https://www.zeit.de/arbeit/2025-05/diskussion-erbschaft-konflikt-geschwister-zusammenhalt,0,www.zeit.de,"Erbschaft: ""Die Kinder müssen jetzt meine Kindheit nachspielen""",Fünf Geschwister bekommen nach dem Tod der Mutter ein altes Bauernhaus. Und diskutieren über jedes Detail. Wie vererbt man Zusammenhalt?,https://img.zeit.de/arbeit/2025-05/diskussion-erbschaft-konflikt-geschwister-zusammenhalt-2/wide__1300x731,2025-05-14T11:13:45Z,http://archive.md/20250514112430/https://www.zeit.de/arbeit/2025-05/diskussion-erbschaft-konflikt-geschwister-zusammenhalt,"Wie fühlt es sich an, plötzlich
Erbe
zu sein? Hört man auf zu arbeiten, oder hat man noch mehr Arbeit damit, das
Geld zu investieren? Macht das unerwartete Vermögen glücklich, oder streitet
man s… [+546 chars]",,de,'Kinder'
https://www.sueddeutsche.de/muenchen/spaltung-atomkraft-dokumentarfilm-dok-fest-muenchen-li.3245902,https://www.sueddeutsche.de/muenchen/spaltung-atomkraft-dokumentarfilm-dok-fest-muenchen-li.3245902,0,www.sueddeutsche.de,Dok-Fest-Filmtipp: Unser gespaltenes Verhältnis zur Atomkraft,"Atomkraft? Nein Danke! Längst nicht alle Menschen sind dieser Meinung. Ein neuer Dokumentarfilm lässt Gegner und Befürworter zu Wort kommen. Einer von ihnen sagt: „Ich weiß nicht mehr, wo der Wind herkommt, seitdem das Ding nicht mehr dampft.“",https://www.sueddeutsche.de/2025/05/14/401744ba-8697-4753-bfde-07a22e8964df.jpeg?q=60&fm=webp&width=1200&rect=0%2C0%2C2273%2C1278,2025-05-14T12:19:17Z,https://web.archive.org/web/20250514123715/https://www.sueddeutsche.de/muenchen/spaltung-atomkraft-dokumentarfilm-dok-fest-muenchen-li.3245902,"Was aber, wenn der Trigger spoilert? Wenn also die Warnhinweise zu viel vom Inhalt verraten? Dann sieht man João Pedro Prados und Anton Yaremchuks Dokumentarfilm Spaltung, darin heißt es gleich zu Be… [+2602 chars]",,de,'Atomkraft'
https://www.faz.net/aktuell/wirtschaft/stromausfall-im-umspannwerk-wohl-ursache-fuer-blackout-in-spanien-und-portugal-110476280.html,https://www.faz.net/aktuell/wirtschaft/stromausfall-im-umspannwerk-wohl-ursache-fuer-blackout-in-spanien-und-portugal-110476280.html,0,www.faz.net,Stromausfall im Umspannwerk wohl Ursache für Blackout in Spanien und Portugal,Ein plötzlicher Ausfall der Stromerzeugung in einem Umspannwerk in Granada hat der spanischen Regierung zufolge den landesweiten Blackout Ende April ausgelöst. Damit ging der Stromausfall wohl nicht auf einen Cyberangriff zurück.,https://media0.faz.net/ppmedia/aktuell/gesellschaft/304072315/1.10469468/facebook_teaser/man-behilft-sich-mit.jpg,2025-05-14T13:32:19Z,http://archive.md/20250514135318/https://www.faz.net/aktuell/wirtschaft/stromausfall-im-umspannwerk-wohl-ursache-fuer-blackout-in-spanien-und-portugal-110476280.html,"Der große Stromausfall vor eineinhalb Wochen geht nach Einschätzung der spanischen Regierung auf keinen Cyberangriff zurück. Der Netzbetreiber Red Eléctrica REE sei nicht attackiert worden, das ist e… [+1755 chars]",,de,'Blackout'
https://www.tagesspiegel.de/gesellschaft/panorama/kette-von-vorfallen-stromausfall-in-umspannwerk-wohl-ursache-fur-blackout-in-spanien-13693069.html,https://www.tagesspiegel.de/gesellschaft/panorama/kette-von-vorfallen-stromausfall-in-umspannwerk-wohl-ursache-fur-blackout-in-spanien-13693069.html,0,www.tagesspiegel.de,Kette von Vorfällen: Stromausfall in Umspannwerk wohl Ursache für Blackout in Spanien,"Zeitweise waren fast ganz Spanien und auch Teile des benachbarten Portugal ohne Strom, und das für viele Stunden. Jetzt gibt es Fortschritte bei der Ermittlung der Ursache.",https://www.tagesspiegel.de/images/13693141/alternates/BASE_16_9_W1400/1747233086000/el-gobierno-defiende-su-gestia-n-del-apaga-n-durante-la-rueda-de-prensa-tras-el-consejo-de-ministros.jpeg,2025-05-14T14:37:00Z,https://web.archive.org/web/20250514152005/https://www.tagesspiegel.de/gesellschaft/panorama/kette-von-vorfallen-stromausfall-in-umspannwerk-wohl-ursache-fur-blackout-in-spanien-13693069.html,Ein plötzlicher Ausfall der Stromerzeugung in einem Umspannwerk in Granada hat der spanischen Regierung zufolge den landesweiten Blackout am 28. April ausgelöst. Dies habe Sekunden später weitere Aus… [+3170 chars],,de,'Blackout'
https://www.n-tv.de/politik/Spanien-vermutet-Panne-in-Umspannwerk-als-Grund-fuer-Blackout-article25768005.html,https://www.n-tv.de/politik/Spanien-vermutet-Panne-in-Umspannwerk-als-Grund-fuer-Blackout-article25768005.html,0,www.n-tv.de,Ursprung in Granada: Spanien vermutet Panne in Umspannwerk als Grund für Blackout,"Ausgehend von einem einzelnen Umspannwerk setzt sich wohl eine verhängnisvolle Kettenreaktion in Gang, an deren Ende in Spanien über Stunden der Strom ausfällt. Zu diesem Ergebnis kommt die Regierung bei der Analyse des Blackouts. Seitdem ist auch die Energie…",https://www.n-tv.de/img/incoming/crop25768000/1801321370-cImg_16_9-w1200/522056174.jpg,2025-05-14T15:37:12Z,https://web.archive.org/web/20250514161853/https://www.n-tv.de/politik/Spanien-vermutet-Panne-in-Umspannwerk-als-Grund-fuer-Blackout-article25768005.html,"Ausgehend von einem einzelnen Umspannwerk setzt sich wohl eine verhängnisvolle Kettenreaktion in Gang, an deren Ende in Spanien über Stunden der Strom ausfällt. Zu diesem Ergebnis kommt die Regierung… [+2343 chars]",,de,'Blackout'
https://orf.at/stories/3393543/,https://orf.at/stories/3393543/,0,orf.at,Spanien: Stromausfall im Umspannwerk wohl Blackout-Ursache,,https://orf.at/mojo/1_4_1/storyserver//news/common/images/og-fallback-news.png,2025-05-14T15:42:43Z,https://web.archive.org/web/20250514221139/https://orf.at/stories/3393543/,Ein plötzlicher Ausfall der Stromerzeugung in einem Umspannwerk in Granada hat der spanischen Regierung zufolge den landesweiten Blackout am 28. April ausgelöst. Dies habe Sekunden später weitere Aus… [+871 chars],,de,'Blackout'
https://www.tagesschau.de/ausland/europa/spanien-stromausfall-102.html,https://www.tagesschau.de/ausland/europa/spanien-stromausfall-102.html,0,www.tagesschau.de,Störung in Umspannwerk wohl Ursache für Stromausfall in Spanien,Nach dem großflächigen Stromausfall in Spanien und Portugal vor zwei Wochen gibt es erste Erkenntnisse zur Ursache. Eine Störung in einem Umspannwerk im südspanischen Granada soll den Blackout ausgelöst haben.,https://images.tagesschau.de/image/153d3a62-f530-4cc6-8454-349b89c83c23/AAABls8yEMU/AAABkZLhkrw/16x9-1280/supermarkt-ohne-strom-100.jpg,2025-05-14T16:13:19Z,https://web.archive.org/web/20250514164311/https://www.tagesschau.de/ausland/europa/spanien-stromausfall-102.html,"Stand: 14.05.2025 18:13 Uhr
Nach dem großflächigen Stromausfall in Spanien und Portugal vor zwei Wochen gibt es erste Erkenntnisse zur Ursache. Eine Störung in einem Umspannwerk im südspanischen Gra… [+1524 chars]",,de,'Blackout'
https://www.morgenpost.de/bezirke/reinickendorf/article409016743/tiny-house-wie-dieser-taenzer-der-obdachlosigkeit-entflieht.html,https://www.morgenpost.de/bezirke/reinickendorf/article409016743/tiny-house-wie-dieser-taenzer-der-obdachlosigkeit-entflieht.html,0,www.morgenpost.de,Tiny House: Wie dieser Tänzer der Obdachlosigkeit entflieht,Früher trat der Berliner Breakdancer Burhan Eresen mit der Kreuzerger Tanz-Compagnie Flying Steps auf Bühnen in aller Welt auf. Dann brachten ihn private Krisen auf die Straße. Nun schöpft er neue Hoffnung.,https://img.sparknews.funkemedien.de/409015480/409015480_1747244172_v16_9_1600.jpeg,2025-05-14T17:36:13Z,https://web.archive.org/web/20250522065829/https://www.morgenpost.de/bezirke/reinickendorf/article409016743/tiny-house-wie-dieser-taenzer-der-obdachlosigkeit-entflieht.html,Berlin. Früher tanzte Burhan Eresen mit den Flying Steps auf Bühnen in aller Welt. Private Krisen katapultierten ihn in ein Leben auf der Straße.,,de,'Obdachlosigkeit'
https://www.bild.de/politik/inland/nach-heizkosten-schock-wie-gas-kunden-jetzt-mehr-als-500-euro-sparen-68231941578c1a3797759666,https://www.bild.de/politik/inland/nach-heizkosten-schock-wie-gas-kunden-jetzt-mehr-als-500-euro-sparen-68231941578c1a3797759666,0,www.bild.de,Nach Heizkosten-Schock - Wie Gas-Kunden jetzt mehr als 500 Euro sparen,"Die Heizkosten sind für Millionen Mieter deutlich raufgeschossen! Doch einige können sich wehren. Auch, wer ein eigenes Haus hat, sollte aktiv werden.","https://images.bild.de/68231941578c1a3797759666/1e9af64739a0e45b3abcd116a1d91da5,8e1ba63d?w=1280",2025-05-14T17:57:47Z,http://archive.md/20250514175946/https://www.bild.de/politik/inland/nach-heizkosten-schock-wie-gas-kunden-jetzt-mehr-als-500-euro-sparen-68231941578c1a3797759666,"Kostenschock für Millionen Mieter auf der Nebenkosten-Abrechnung. Die Heizkosten sind deutlich raufgeschossen! 
Bei Gas und Fernwärme wird dieser Trend voraussichtlich weiter anhalten, sagt Thorsten… [+299 chars]",,de,'Heizkosten'
https://www.stern.de/gesellschaft/regional/nordrhein-westfalen/angst-vor-dem-blackout--stromversorgung-in-nrw-zuverlaessig--aber-krisenplaene-noetig-35724862.html,https://www.stern.de/gesellschaft/regional/nordrhein-westfalen/angst-vor-dem-blackout--stromversorgung-in-nrw-zuverlaessig--aber-krisenplaene-noetig-35724862.html,0,www.stern.de,"Angst vor dem Blackout: Stromversorgung in NRW zuverlässig, aber Krisenpläne nötig",Massive Stromausfälle in Spanien und Portugal sowie Angst vor russischer Sabotage nähren Sorgen vor einem Blackout auch in NRW. Der Innenminister berichtet über Vorsorge und offene Handlungsfelder.,https://image.stern.de/35724864/t/xc/v1/w1440/r1.7778/-/15--c26zmwjrpxv10axs2048jpeg---ef156f002ecbdc00.jpg,2025-05-15T03:30:41Z,https://web.archive.org/web/20250515052207/https://www.stern.de/gesellschaft/regional/nordrhein-westfalen/angst-vor-dem-blackout--stromversorgung-in-nrw-zuverlaessig--aber-krisenplaene-noetig-35724862.html,"Kopiere den aktuellen Link
Zur Merkliste hinzufügen
Massive Stromausfälle in Spanien und Portugal sowie Angst vor russischer Sabotage nähren Sorgen vor einem Blackout auch in NRW. Der Innenminister… [+5339 chars]",,de,'Blackout'
https://www.welt.de/geschichte/article256107766/Energieversorgung-Sicherheit-und-Preise-sprachen-angeblich-fuer-russisches-Gas.html,https://www.welt.de/geschichte/article256107766/Energieversorgung-Sicherheit-und-Preise-sprachen-angeblich-fuer-russisches-Gas.html,0,www.welt.de,„Versorgungssicherheit und bezahlbare Preise“ sprachen angeblich für russisches Gas,"Systematisch nutzt Moskau seit Jahrzehnten das sibirische Erdgas, um politisch Einfluss auf Europa auszuüben. Der Historiker Martin Lutz untersucht die Gemengelage rund um dieses wenig bekannte Kapitel des Kalten Krieges.",https://img.welt.de/img/geschichte/mobile256109828/5157937277-ci16x9-w1200/UdSSR-DDR-Erdgastrasse.jpg,2025-05-15T05:36:16Z,http://archive.md/20250515080403/https://www.welt.de/geschichte/article256107766/Energieversorgung-Sicherheit-und-Preise-sprachen-angeblich-fuer-russisches-Gas.html,"Systematisch nutzt Moskau seit Jahrzehnten das sibirische Erdgas, um politisch Einfluss auf Europa auszuüben. Der Historiker Martin Lutz untersucht die Gemengelage rund um dieses wenig bekannte Kapit… [+7661 chars]",,de,'Gas'
https://www.diepresse.com/19686202/spanien-ohne-strom-regierung-nennt-moegliche-ursache-fuer-blackout,https://www.diepresse.com/19686202/spanien-ohne-strom-regierung-nennt-moegliche-ursache-fuer-blackout,0,www.diepresse.com,Spanien ohne Strom: Regierung nennt mögliche Ursache für Blackout,"Ein Ausfall in einem Umspannwerk wird als mögliche Ursache für den Blackout in Spanien Ende April gehandelt. Was genau dahintersteckt, ist noch nicht geklärt.",https://img.diepresse.com/public/incoming/xd1693-SPAIN-ENERGYOUTAGE/alternates/DPR_SOCIAL_NACHRICHTEN/SPAIN-ENERGYOUTAGE,2025-05-15T08:23:54Z,https://web.archive.org/web/20250515112704/https://www.diepresse.com/19686202/spanien-ohne-strom-regierung-nennt-moegliche-ursache-fuer-blackout,"Ein Ausfall in einem Umspannwerk wird als mögliche Ursache für den Blackout in Spanien Ende April gehandelt. Was genau dahintersteckt, ist noch nicht geklärt.
Ein plötzlicher Ausfall der Stromerzeug… [+2222 chars]",,de,'Blackout'
https://www.golem.de/sonstiges/zustimmung/auswahl.html?from=https://www.golem.de/news/blackout-epizentrum-fuer-stromausfall-in-spanien-gefunden-2505-196229.html&referer=https://t.co/cbc02fa59f,https://www.golem.de/sonstiges/zustimmung/auswahl.html?from=https://www.golem.de/news/blackout-epizentrum-fuer-stromausfall-in-spanien-gefunden-2505-196229.html&referer=https://t.co/cbc02fa59f,0,www.golem.de,Blackout: Epizentrum für Stromausfall in Spanien gefunden,"Die Untersuchungen zeigen, dass eine entscheidende Infrastruktur in Granada die Kettenreaktion auslöste. Einige Theorien konnten widerlegt werden. (Blackout, Wirtschaft)",,2025-05-15T08:55:10Z,,"Besuchen Sie Golem.de wie gewohnt mit Werbung und Tracking,
 indem Sie der Nutzung aller Cookies zustimmen.
 Details zum Tracking finden Sie im Privacy Center.
Skript wurde nicht geladen. Informat… [+607 chars]",,de,'Blackout'
https://www.golem.de/sonstiges/zustimmung/auswahl.html?from=https://www.golem.de/news/hitzeschild-raumfahrzeuge-sollen-beim-wiedereintritt-schwitzen-2505-196225.html&referer=https://t.co/7ff491982e,https://www.golem.de/sonstiges/zustimmung/auswahl.html?from=https://www.golem.de/news/hitzeschild-raumfahrzeuge-sollen-beim-wiedereintritt-schwitzen-2505-196225.html&referer=https://t.co/7ff491982e,0,www.golem.de,Hitzeschild: Raumfahrzeuge sollen beim Wiedereintritt schwitzen,"Eine Forschungsgruppe testet gerade ein neues Material, das für Hitzeschilde in der Raumfahrt zum Einsatz kommen und ein Gas zur Kühlung freisetzen soll. (Raumfahrt, Wissenschaft)",,2025-05-15T10:30:02Z,,"Besuchen Sie Golem.de wie gewohnt mit Werbung und Tracking,
 indem Sie der Nutzung aller Cookies zustimmen.
 Details zum Tracking finden Sie im Privacy Center.
Skript wurde nicht geladen. Informat… [+607 chars]",,de,'Gas'
https://www.faz.net/aktuell/gesellschaft/menschen/christina-block-scheitert-mit-verfassungsbeschwerde-in-sorgerechtsstreit-110478124.html,https://www.faz.net/aktuell/gesellschaft/menschen/christina-block-scheitert-mit-verfassungsbeschwerde-in-sorgerechtsstreit-110478124.html,0,www.faz.net,Christina Block scheitert mit Verfassungsbeschwerde in Sorgerechtsstreit,Die Unternehmerin streitet seit Jahren mit ihrem Ex-Mann über das Sorgerecht für zwei ihrer Kinder. Zuletzt wandte sie sich an das höchste deutsche Gericht. Die Verfassungsbeschwerde wurde abgewiesen.,https://media1.faz.net/ppmedia/aktuell/gesellschaft/1528982895/1.10478157/facebook_teaser/christina-block.jpg,2025-05-15T11:01:40Z,,Im Sorgerechtsstreit um zwei Kinder von Christina Block hat das Bundesverfassungsgericht eine Beschwerde der Hamburger Unternehmerin abgewiesen. Die Verfassungsbeschwerde sei nicht zur Entscheidung a… [+2838 chars],,de,'Kinder'
https://www.stern.de/gesellschaft/regional/baden-wuerttemberg/neue-pipeline-in-schwaben--gasleitung--augusta--verbessert-versorgung-in-sueddeutschland-35726844.html,https://www.stern.de/gesellschaft/regional/baden-wuerttemberg/neue-pipeline-in-schwaben--gasleitung--augusta--verbessert-versorgung-in-sueddeutschland-35726844.html,0,www.stern.de,"Neue Pipeline in Schwaben: Gasleitung ""Augusta"" verbessert Versorgung in Süddeutschland","Trotz der Bemühungen, auf fossile Energie zu verzichten, ist Gas noch sehr wichtig für die Versorgung Deutschlands. Eine neue Leitung in Schwaben wird trotzdem nicht nur für Erdgas gebaut.",https://image.stern.de/35726846/t/46/v1/w1440/r1.7778/-/15--walkg5ooudv3axs2048jpeg---774969aa6ccaa298.jpg,2025-05-15T12:10:06Z,https://web.archive.org/web/20250516192413/https://www.stern.de/gesellschaft/regional/baden-wuerttemberg/neue-pipeline-in-schwaben--gasleitung--augusta--verbessert-versorgung-in-sueddeutschland-35726844.html,"Kopiere den aktuellen Link
Zur Merkliste hinzufügen
Trotz der Bemühungen, auf fossile Energie zu verzichten, ist Gas noch sehr wichtig für die Versorgung Deutschlands. Eine neue Leitung in Schwaben… [+1854 chars]",,de,'Gas'
https://www.zeit.de/news/2025-05/15/gasleitung-augusta-verbessert-versorgung-in-sueddeutschland,https://www.zeit.de/news/2025-05/15/gasleitung-augusta-verbessert-versorgung-in-sueddeutschland,0,www.zeit.de,"Neue Pipeline in Schwaben: Gasleitung ""Augusta"" verbessert Versorgung in Süddeutschland","Hier finden Sie Informationen zu dem Thema „Neue Pipeline in Schwaben“. Lesen Sie jetzt „Gasleitung ""Augusta"" verbessert Versorgung in Süddeutschland“.",https://img.zeit.de/news/2025-05/15/gasleitung-augusta-verbessert-versorgung-in-sueddeutschland-image-group/wide__1300x731,2025-05-15T12:10:06Z,,"Eine neue knapp 41 Kilometer lange Gaspipeline in Schwaben soll künftig die Erdgasversorgung in Bayern und Baden-Württemberg sicherstellen. Wie der Betreiber, die Bayernets GmbH, zum offiziellen Baub… [+1650 chars]",,de,'Gas'
https://www.stern.de/genuss/brot-richtig-lagern--die-wichtigsten-dos-und-don-ts--35721822.html,https://www.stern.de/genuss/brot-richtig-lagern--die-wichtigsten-dos-und-don-ts--35721822.html,0,www.stern.de,Länger haltbar: Brot richtig lagern: So vermeiden Sie Schimmel und erhalten die Frische,"Ob selbstgemacht oder vom Bäcker, mit Körnern oder ohne: Brot zählt zu den beliebtesten Backwaren der Deutschen. Damit es möglichst lange frisch bleibt, gibt es verschiedene Tricks.",https://image.stern.de/35721828/t/80/v2/w1440/r1.7778/-/brot-richtig-lagern.jpg,2025-05-15T13:58:00Z,https://web.archive.org/web/20250515182218/https://www.stern.de/genuss/brot-richtig-lagern--die-wichtigsten-dos-und-don-ts--35721822.html,"Kopiere den aktuellen Link
Zur Merkliste hinzufügen
Ob selbstgemacht oder vom Bäcker, mit Körnern oder ohne: Brot zählt zu den beliebtesten Backwaren der Deutschen. Damit es möglichst lange frisch … [+3747 chars]",,de,'Schimmel'
https://www.focus.de/immobilien/gastbeitrag-von-timo-leukefeld-10-000-wohnungen-wie-der-kapitalmarkt-zum-gamechanger-wird_8d74dece-dd67-43d1-bf4f-63fedf81cae8.html,https://www.focus.de/immobilien/gastbeitrag-von-timo-leukefeld-10-000-wohnungen-wie-der-kapitalmarkt-zum-gamechanger-wird_8d74dece-dd67-43d1-bf4f-63fedf81cae8.html,0,www.focus.de,Gastbeitrag von Timo Leukefeld: 10.000 Wohnungen: Wie der Kapitalmarkt zum Gamechanger wird,"Der Wohnungsbau in Deutschland steht vor einer neuen Ära: Energieexperte Timo Leukefeld erklärt, wie der Kapitalmarkt ohne staatliche Förderung bezahlbaren Wohnraum schaffen kann – und warum Eigentümer jetzt Teil der Lösung werden sollten.",https://quadro.burda-forward.de/ctf/bd2879e4-66b0-4c1d-b6ff-4e4a49b20280.76790101-38f9-4552-bc3f-427afb9d6410.jpg?im=RegionOfInterestCrop%3D%281200%2C630%29%2CregionOfInterest%3D%281713%2C984%29&hash=088db37d866662b5aa42a63e257d357bd90f6ff54b21a14161cffee5b24a23b1,2025-05-15T14:42:18Z,https://web.archive.org/web/20250515175100/https://www.focus.de/immobilien/gastbeitrag-von-timo-leukefeld-10-000-wohnungen-wie-der-kapitalmarkt-zum-gamechanger-wird_8d74dece-dd67-43d1-bf4f-63fedf81cae8.html,"Kein Staat. Kein Keller. Kein Problem.
In Deutschland fehlen über eine Million Wohnungen und noch immer drehen sich die Diskussionen vor allem um Förderprogramme, Förderrichtlinien, Förderengpässe u… [+6164 chars]",,de,'öffentliche Gebäude'
