index,url,valid,domain,title,description,image,published,archive,content,quote,language,keyword
https://www.tagesspiegel.de/potsdam/potsdam-kultur/retrospektive-zu-peter-rohn-wo-hell-und-dunkel-sich-die-hand-geben-8829031.html,https://www.tagesspiegel.de/potsdam/potsdam-kultur/retrospektive-zu-peter-rohn-wo-hell-und-dunkel-sich-die-hand-geben-8829031.html,0,www.tagesspiegel.de,Retrospektive zu Peter Rohn: Wo Hell und Dunkel sich die Hand geben,"Gemälde, Grafiken, Fotos: Peter Rohn ist seit 60 Jahren unkorrumpierbarer Chronist Potsdams. Das feiert das städtische Museum mit einer Sonderausstellung.",,2022-11-04T15:12:07Z,,Bei Peter Rohn ist der Frühling eine Müllhalde und das Bornstedter Feld ein matschiges Schießgelände. Ein großformatiges Gemälde von 1977 beweist es: Zu sehen ist eine zugerümpelte Landschaft. Links … [+6475 chars],,de,'Blüte'
https://www.sueddeutsche.de/wirtschaft/galeria-karstadt-kaufhof-rene-benko-innenstaedte-1.5685901,https://www.sueddeutsche.de/wirtschaft/galeria-karstadt-kaufhof-rene-benko-innenstaedte-1.5685901,0,www.sueddeutsche.de,Galeria Karstadt Kaufhof: Viele Filialen sind eher eine Last für die Innenstädte,Sorgen um die Verödung der City-Zentren sind nach der neuerlichen Insolvenz von Galeria Karstadt Kaufhof meist unberechtigt. Die Schließungen sind hart. Aber eigentlich kann es nur besser werden.,https://www.sueddeutsche.de/image/sz.1.5685902/1200x675?v=1667399629,2022-11-02T14:47:25Z,,Sorgen um die Verödung der City-Zentren sind nach der neuerlichen Insolvenz von Galeria Karstadt Kaufhof meist unberechtigt. Die Schließungen sind hart. Aber eigentlich kann es nur besser werden.Die … [+4164 chars],,de,'Blüte'
https://www.businessinsider.de/gruenderszene/health/cannabis-startup-cantourage-boerse/,https://www.businessinsider.de/gruenderszene/health/cannabis-startup-cantourage-boerse/,0,www.businessinsider.de,"Wieso das Cannabis-Startup Cantourage lieber an die Börse geht, statt VC-Geld aufzunehmen","Der Cannabis Markt entwickle sich sprunghaft, sagt der Cantourage-CEO. Kommt die Legalisierung, brauche er schnell viel Geld.",https://cdn.businessinsider.de/wp-content/uploads/2022/11/Cantourage-1.jpg?ver=1667301217,2022-11-01T12:30:00Z,,"Wieso das Cannabis-Startup Cantourage lieber an die Börse geht, statt VC-Geld aufzunehmen
Der Cannabismarkt entwickle sich sprunghaft, sagt der Cantourage-CEO. Kommt die Legalisierung, brauche er sc… [+4603 chars]",,de,'Blüte'
https://www.rezeptwelt.de/saucendipsbrotaufstriche-rezepte/lebkuchen-sauerkirsch-marmelade/qt9cbpt9-c6a24-320971-cfcd2-06sdhq0a,https://www.rezeptwelt.de/saucendipsbrotaufstriche-rezepte/lebkuchen-sauerkirsch-marmelade/qt9cbpt9-c6a24-320971-cfcd2-06sdhq0a,0,www.rezeptwelt.de,Lebkuchen Sauerkirsch Marmelade,"Sauerkirschen etwas antauen lassen, in den [locked]geben und 10 sec./ Stufe 4 zerkleinern. Gelierzucker zugeben, 5 sec./Stufe 4 verrühren. Lebkuchengewürz und Sternanis Blüte zugeben, 20 Min./ 100 °C / [counterclock]/ Stufe 2, wenn es zusehr kocht, auf Stufe …",https://de.rc-cdn.community.thermomix.com/recipeimage/qt9cbpt9-c6a24-320971-cfcd2-06sdhq0a/e45ea476-c0dc-418f-a4ed-d5c73bacceea/large/lebkuchen-sauerkirsch-marmelade.jpg,2022-11-01T00:00:00Z,,"Sauerkirschen etwas antauen lassen, in den ""Mixtopf geschlossen"" geben und 10 sec./ Stufe 4 zerkleinern. Gelierzucker zugeben, 5 sec./Stufe 4 verrühren. Lebkuchengewürz und Sternanis Blüte zugeben, 2… [+330 chars]",,de,'Blüte'
https://www.tagesschau.de/wirtschaft/verbraucher/gaspreise-gasspeicher-energiekrise-lng-terminals-bundesnetzagentur-energiesparen-gasmarkt-101.html,https://www.tagesschau.de/wirtschaft/verbraucher/gaspreise-gasspeicher-energiekrise-lng-terminals-bundesnetzagentur-energiesparen-gasmarkt-101.html,0,www.tagesschau.de,Gasspeicher voll: Wie geht es jetzt weiter?,"Die deutschen Gasspeicher sind mittlerweile fast vollständig befüllt. Was hat das für Folgen für den Gaspreis, wie lange hält das Gas und wie wahrscheinlich ist derzeit eine nationale Gasmangellage?",https://www.tagesschau.de/multimedia/bilder/gasspeicher-173~_v-original.jpg,2022-11-04T13:36:19Z,,"Die deutschen Gasspeicher sind mittlerweile fast vollständig befüllt. Was hat das für Folgen für den Gaspreis, wie lange hält das Gas und wie wahrscheinlich ist derzeit eine nationale Gasmangellage?… [+8205 chars]",,de,'Frühling'
https://www.sueddeutsche.de/sport/roger-schmidt-benfica-champions-league-1.5686672,https://www.sueddeutsche.de/sport/roger-schmidt-benfica-champions-league-1.5686672,0,www.sueddeutsche.de,Roger Schmidt bei Benfica Lissabon: Über Umwege zum Erfolgscoach,"Seit fünf Monaten unbesiegt, besser als Paris Saint-Germain in der Champions League: Der frühere Bundesligatrainer Roger Schmidt hat bei Benfica spektakulären Erfolg. Angeblich haben nun europäische Großklubs Interesse.",https://www.sueddeutsche.de/image/sz.1.5686719/1200x675?v=1667492023,2022-11-03T16:13:56Z,,"Seit fünf Monaten unbesiegt, besser als Paris Saint-Germain in der Champions League: Der frühere Bundesligatrainer Roger Schmidt hat bei Benfica spektakulären Erfolg. Angeblich haben nun europäische … [+4456 chars]",,de,'Frühling'
https://www.heise.de/news/Predator-Griechische-Regierung-soll-jeden-Zweifel-an-Spyware-Einsatz-beseitigen-7331097.html,https://www.heise.de/news/Predator-Griechische-Regierung-soll-jeden-Zweifel-an-Spyware-Einsatz-beseitigen-7331097.html,0,www.heise.de,Predator: Griechische Regierung soll jeden Zweifel an Spyware-Einsatz beseitigen,"Mitglieder des Pegasus-Untersuchungsausschusses sehen viele Spuren, wonach die griechische Regierung in den dortigen Spionageskandal verstrickt sein könnte.",https://heise.cloudimg.io/bound/1200x1200/q85.png-lossy-85.webp-lossy-85.foil1/_www-heise-de_/imgs/18/3/6/3/8/3/9/4/shutterstock_1475631128-1c6f0f827ec27b35.jpg,2022-11-04T16:29:00Z,,"Inhaltsverzeichnis
Nach einem viertägigen Aufenthalt von zehn Mitgliedern des Untersuchungsausschusses des EU-Parlaments über den Einsatz von Pegasus und vergleichbarer Spionagesoftware in Zypern un… [+6518 chars]",,de,'Sommer'
https://www.spiegel.de/ausland/finnland-sanna-marin-hat-dienstpflicht-bei-partys-nicht-vernachlaessigt-a-3dbe799b-ce39-4ad7-8c73-8b87421413dc,https://www.spiegel.de/ausland/finnland-sanna-marin-hat-dienstpflicht-bei-partys-nicht-vernachlaessigt-a-3dbe799b-ce39-4ad7-8c73-8b87421413dc,0,www.spiegel.de,Finnland: Sanna Marin hat Dienstpflicht bei Partys nicht vernachlässigt,Wegen Partyvideos geriet Sanna Marin im Sommer in die Schlagzeilen. Nach einer juristischen Prüfung steht nun fest: Die Politikerin hat nicht gegen ihre Pflichten als Ministerpräsidentin verstoßen.,https://cdn.prod.www.spiegel.de/images/1f1867de-973d-475b-8e94-13e8909b925b_w1280_r1.77_fpx49_fpy45.jpg,2022-11-04T13:07:08Z,,"Dass zu sehen ist, wie eine Regierungschefin feiert, ist eher selten und ungewöhnlich. Umso größer war das Aufsehen, als im August Aufnahmen auftauchten, die Finnlands Ministerpräsidentin Sanna Marin… [+196 chars]",,de,'Sommer'
https://www.spiegel.de/familie/die-bravo-dr-sommer-meine-kinder-und-ich-bitte-klaer-du-sie-auf-aber-nicht-so-a-a2fab903-5660-419d-897d-dfbf12bf410e,https://www.spiegel.de/familie/die-bravo-dr-sommer-meine-kinder-und-ich-bitte-klaer-du-sie-auf-aber-nicht-so-a-a2fab903-5660-419d-897d-dfbf12bf410e,0,www.spiegel.de,"Die Bravo, Dr. Sommer, meine Kinder und ich: Bitte klär du sie auf – aber nicht so!",Generationen ahnungsloser Teenies entdeckten Sexualität mithilfe der »Bravo«. Ich auch. Heute bekommen Minderjährige dort Blowjob-Anleitungen. Muss das sein?,https://cdn.prod.www.spiegel.de/images/2ece7814-42aa-40e9-999d-cee8f128c923_w1280_r1.77_fpx35.86_fpy49.86.jpg,2022-11-03T23:50:08Z,,"Mehr Perspektiven, mehr verstehen.
Freier Zugang zu allen Artikeln, Videos, Audioinhalten und Podcasts
<ul><li>
Alle Artikel auf SPIEGEL.de frei zugänglich
</li><li>
DER SPIEGEL als E-Paper und … [+743 chars]",,de,'Sommer'
https://www.spiegel.de/familie/die-bravo-dr-sommer-meine-kinder-und-ich-bitte-klaer-du-sie-auf-a-a2fab903-5660-419d-897d-dfbf12bf410e,https://www.spiegel.de/familie/die-bravo-dr-sommer-meine-kinder-und-ich-bitte-klaer-du-sie-auf-a-a2fab903-5660-419d-897d-dfbf12bf410e,0,www.spiegel.de,"Die Bravo, Dr. Sommer, meine Kinder und ich: Bitte klär du sie auf!",Generationen ahnungsloser Teenies entdeckten Sexualität mithilfe der »Bravo«. Ich auch. Heute bekommen Minderjährige dort Blowjob-Anleitungen. Muss das sein?,https://cdn.prod.www.spiegel.de/images/2ece7814-42aa-40e9-999d-cee8f128c923_w1280_r1.77_fpx35.86_fpy49.86.jpg,2022-11-03T23:50:08Z,,"Mehr Perspektiven, mehr verstehen.
Freier Zugang zu allen Artikeln, Videos, Audioinhalten und Podcasts
<ul><li>
Alle Artikel auf SPIEGEL.de frei zugänglich
</li><li>
DER SPIEGEL als E-Paper und … [+743 chars]",,de,'Sommer'
https://www.spiegel.de/wissenschaft/natur/klimawandel-winzer-in-spanien-fuerchten-um-ihren-wein-a-47be1ef3-196c-41df-82e7-9c9de0c14db8,https://www.spiegel.de/wissenschaft/natur/klimawandel-winzer-in-spanien-fuerchten-um-ihren-wein-a-47be1ef3-196c-41df-82e7-9c9de0c14db8,0,www.spiegel.de,Klimawandel: Winzer in Spanien fürchten um ihren Wein,Der vergangene Sommer in Spanien war viel zu heiß – auch für die Winzer der Region La Rioja. Sie fürchten um die Qualität ihres Weines und hoffen auf Hilfe der Wissenschaft.,https://cdn.prod.www.spiegel.de/images/7a515c2c-6183-44e6-ae0b-d169dff543a5_w1280_r1.77_fpx49_fpy49.jpg,2022-11-04T19:05:04Z,,"Es war zu heiß und zu trocken im spanischen La Rioja in diesem Sommer: Mit 2,2 Grad Celsius über dem Durchschnitt war es der wärmste in Spanien seit Beginn der Wetteraufzeichnungen.
Das macht den We… [+2644 chars]",,de,'Sommer'
https://www.nzz.ch/gesellschaft/der-tag-an-dem-vladimir-putin-in-den-palettenmarkt-eingriff-ld.1710500,https://www.nzz.ch/gesellschaft/der-tag-an-dem-vladimir-putin-in-den-palettenmarkt-eingriff-ld.1710500,0,www.nzz.ch,"Der Tag, an dem Wladimir Putin in den Palettenmarkt eingriff","Solange die Regale voll sind, interessiert niemanden, was die Welt im Innersten am Laufen hält. Erst wenn Rillennägel und Industrie-Russ knapp werden, zeigt sich, welche erstaunlichen Abhängigkeiten und seltsamen Stoffe unseren Alltag bestimmen.","https://img.nzz.ch/2022/11/04/a92077c5-d9ce-4e61-9cfd-06d4a94299e6.jpeg?width=1200&height=674&fit=bound&quality=75&auto=webp&crop=2744,1542,x1208,y2103&wmark=nzz",2022-11-05T04:30:00Z,,"Wer sich über das Weltgeschehen informieren will, kann die Zeitung lesen oder die Preise von Holzpaletten der Holliger Paletten Logistik AG studieren. Für eine vierseitig unterfahrbare Europalette be… [+26794 chars]",,de,'Glatteis'
https://www.stern.de/gesellschaft/regional/hessen/wiesbaden--falsche-kripobeamte--polizei-warnt-erneut-vor-dem-trick-32884402.html,https://www.stern.de/gesellschaft/regional/hessen/wiesbaden--falsche-kripobeamte--polizei-warnt-erneut-vor-dem-trick-32884402.html,0,www.stern.de,Wiesbaden: Falsche Kripobeamte: Polizei warnt erneut vor dem Trick,"Betrüger haben in Wiesbaden als falsche Polizisten versucht, Bargeld und Wertgegenstände zu ergaunern. Bei mehreren Anrufen am Samstag im Stadtgebiet habe sich ein angeblicher Kriminalbeamter gemeldet und über vermeintliche Einbrüche in der Nachbarschaft und …",https://image.stern.de/32884404/t/Fx/v1/w1440/r1.7778/-/06--urnnewsmldpacom2009010122110699405494v1w800h600l160t138r2695b1977jpeg---21f12d8f0b5f435a.jpg,2022-11-06T10:58:13Z,,"Betrüger haben in Wiesbaden als falsche Polizisten versucht, Bargeld und Wertgegenstände zu ergaunern. Bei mehreren Anrufen am Samstag im Stadtgebiet habe sich ein angeblicher Kriminalbeamter gemelde… [+1324 chars]",,de,'Glatteis'
