index,url,valid,domain,title,description,image,published,archive,content,quote,language,keyword
https://www.zeit.de/news/2022-10/04/liebermanns-rosen-in-villa-am-wannsee-vor-neuer-bluete,https://www.zeit.de/news/2022-10/04/liebermanns-rosen-in-villa-am-wannsee-vor-neuer-bluete,0,www.zeit.de,Rosengarten: Liebermanns Rosen in Villa am Wannsee vor neuer Blüte,,,2022-10-04T14:15:49Z,,"When browsing with ads:
We collect personal data and also transmit it to third-party providers
 that help us improve and finance our digital content. Some of the information stored on your device, … [+732 chars]",,de,'Blüte'
https://www.faz.net/aktuell/politik/inland/wahl-in-niedersachsen-es-kuendigt-sich-das-ende-der-ampel-an-18377137.html,https://www.faz.net/aktuell/politik/inland/wahl-in-niedersachsen-es-kuendigt-sich-das-ende-der-ampel-an-18377137.html,0,www.faz.net,Nach der Landtagswahl: Der Anfang vom Ende der Ampel,"Im rot-grünen Erfolg kündigt sich nicht die Blüte der Ampel an, sondern ihr Ende. Da CDU und FDP nichts entgegenzusetzen haben, kann Olaf Scholz damit aber gut leben.",https://media0.faz.net/ppmedia/aktuell/politik/2350334807/1.8377136/facebook_teaser/bundeskanzler-olaf-scholz.jpg,2022-10-11T07:19:51Z,,"Wie unbefriedigend die Parteien derzeit auf mehrfache Herausforderungen reagieren, zeigt eine bittere Erkenntnis aus der Wahl in Niedersachsen: Die AfD käme offenbar auch dann auf mehr als zehn Proze… [+4657 chars]",,de,'Blüte'
https://www.faz.net/aktuell/feuilleton/kunst-und-architektur/helden-vor-troja-roemisches-mosaik-in-syrien-ausgegraben-18384632.html,https://www.faz.net/aktuell/feuilleton/kunst-und-architektur/helden-vor-troja-roemisches-mosaik-in-syrien-ausgegraben-18384632.html,0,www.faz.net,Antikenfund in Syrien: Ein Mosaik des Trojanischen Krieges,"In Nordsyrien wurde ein Riesenmosaik ausgegraben, das Achill, Herakles, Neptun und die Kämpfer der Griechen vor Troja zeigt. Das Assad-Regime kann sich die Rettung auf seine Fahnen schreiben.",https://media1.faz.net/ppmedia/aktuell/feuilleton/1023270976/1.8384631/facebook_teaser_fplus/tragische-paare-herakles-und.jpg,2022-10-14T05:13:41Z,,"Tragische Paare: Herakles und Achill mit Hippolyte und Penthesilea auf dem Fußbodenmosaik, das im nordsyrischen Rastan gefunden wurde Bild: dpa
In Nordsyrien wurde ein Riesenmosaik ausgegraben, das … [+1295 chars]",,de,'Blüte'
https://www.faz.net/aktuell/politik/inland/deutsche-einheit-die-zeitenwende-trifft-den-osten-haerter-18360246.html,https://www.faz.net/aktuell/politik/inland/deutsche-einheit-die-zeitenwende-trifft-den-osten-haerter-18360246.html,0,www.faz.net,Kommentar zur deutschen Einheit: Der Trugschluss über den Osten,Die „Zeitenwende“ nach Putins Angriffskrieg trifft die östlichen Bundesländer ungleich härter. Den dortigen Protest muss man als Teil der gesamtdeutschen Wirklichkeit verstehen.,https://media1.faz.net/ppmedia/aktuell/politik/2049804312/1.8360229/facebook_teaser/demonstration-in-frankfurt-an.jpg,2022-10-03T19:00:55Z,,"Seit 32 Jahren ist Deutschland vereint, doch Ostdeutschland gilt vielfach noch immer als Abweichung, während der Westen die Norm verkörpert. Der Ostbeauftragte der Bundesregierung, Carsten Schneider,… [+4618 chars]",,de,'Blüte'
https://www.tagesschau.de/ausland/europa/fratelli-ditalia-suedtirol-101.html,https://www.tagesschau.de/ausland/europa/fratelli-ditalia-suedtirol-101.html,0,www.tagesschau.de,Nach Wahl in Italien: Südtirols Argwohn gegenüber Meloni,"In Rom bereitet sich Wahlsiegerin Meloni auf die Amtsübernahme als Ministerpräsidentin vor. Viele Südtiroler sehen das mit Sorge: Sie fürchten, Meloni könnte versuchen, ihr Autonomierecht einzuschränken. <em>Von A. Miller und J. Seisselberg.</em>",https://www.tagesschau.de/multimedia/bilder/meloni-wahlplakat-bozen-101~_v-original.jpg,2022-10-11T13:33:33Z,,"In Rom bereitet sich Wahlsiegerin Meloni auf die Amtsübernahme als Ministerpräsidentin vor. Viele Südtiroler sehen das mit Sorge: Sie fürchten, Meloni könnte versuchen, ihr Autonomierecht einzuschrän… [+4463 chars]",,de,'Blüte'
https://www.tagesschau.de/inland/innenpolitik/stephan-weil-127.html,https://www.tagesschau.de/inland/innenpolitik/stephan-weil-127.html,0,www.tagesschau.de,Stephan Weil: Kümmerer oder Zauderer?,"Manche kritisieren ihn als bräsig, andere mögen seine bodenständige Art: Stephan Weil hat für die SPD auch Wahlen gewonnen, wenn nichts danach aussah. Nun will er zum dritten Mal Niedersachsens Ministerpräsident werden. <em>Von Mandy Sarti.</em>",https://www.tagesschau.de/multimedia/bilder/weil-165~_v-original.jpg,2022-10-05T08:58:57Z,,"Manche kritisieren ihn als bräsig, andere mögen seine bodenständige Art: Stephan Weil hat für die SPD auch Wahlen gewonnen, wenn nichts danach aussah. Nun will er zum dritten Mal Ministerpräsident vo… [+5882 chars]",,de,'Blüte'
https://www.sueddeutsche.de/muenchen/muenchen-altstadt-cafes-fruehstuecken-tipps-1.5672602,https://www.sueddeutsche.de/muenchen/muenchen-altstadt-cafes-fruehstuecken-tipps-1.5672602,0,www.sueddeutsche.de,Frühstücken und Kaffeetrinken: Diese Cafés in der Innenstadt sollten Sie kennen,"In der Münchner Innenstadt gibt es einige Orte, die sich zum Frühstücken und für eine Pause eignen. Café-Tipps der Redaktion.",https://www.sueddeutsche.de/assets/png/sz-ecb090256670a577bd629a9718686332.png,2022-10-11T07:51:57Z,,"In der Münchner Altstadt gibt es einige Orte, die sich für eine Pause eignen.Café Glockenspiel
Während unten auf dem Marienplatz mit Tüten beladene Menschen von einem Geschäft zum nächsten hetzen, g… [+6961 chars]",,de,'Blüte'
https://taz.de/Reisen-im-Zentrum-von-Spanien/!5885039/,https://taz.de/Reisen-im-Zentrum-von-Spanien/!5885039/,0,taz.de,Reisen im Zentrum von Spanien: Auf verlassenen Pfaden,Ehemalige Zugstrecken werden im Westen Spaniens zu Radwegen. Sie führen durch eine wenig bekannt Kulturlandschaft.,https://taz.de/picture/5822611/948/59538509-1.jpg,2022-10-09T07:56:00Z,,"Ehemalige Zugstrecken werden im Westen Spaniens zu Radwegen. Sie führen durch eine wenig bekannt Kulturlandschaft.
In Hervas, dem Höhepunt der Tour, gibt es eines der besterhaltenen jüdischen Vierte… [+7064 chars]",,de,'Blüte'
https://www.heise.de/tp/features/Eine-Alge-als-Politikum-7282079.html,https://www.heise.de/tp/features/Eine-Alge-als-Politikum-7282079.html,0,www.heise.de,Eine Alge als Politikum,Nach dem Fischsterben wird klar: Politisch verbindet der Grenzfluss Deutschland derzeit nicht mit Polen. Der Nachbar verfolgt weiterhin gigantische Flussbaupläne.,https://heise.cloudimg.io/bound/1200x1200/q85.png-lossy-85.webp-lossy-85.foil1/_www-heise-de_/imgs/18/3/6/1/8/2/2/5/oder3-41c330100d4ac531.jpeg,2022-10-01T11:00:00Z,,"Auf der Suche nach lebenden Muscheln: Michael Tautenhahn, stellvertretender Leiter des Nationalparks Unteres Odertal findet nur tote. Bild: Nick Reimer
Nach dem Fischsterben wird klar: Politisch ver… [+3658 chars]",,de,'Blüte'
https://www.nzz.ch/wissenschaft/schlangen-riechen-mit-der-zunge-voegel-sehen-tausendfach-mehr-farben-als-wir-wie-tiere-die-welt-wahrnehmen-ld.1705964,https://www.nzz.ch/wissenschaft/schlangen-riechen-mit-der-zunge-voegel-sehen-tausendfach-mehr-farben-als-wir-wie-tiere-die-welt-wahrnehmen-ld.1705964,0,www.nzz.ch,"Schlangen riechen mit der Zunge, Vögel sehen tausendfach mehr Farben als wir: Wie Tiere die Welt wahrnehmen","Der Wissenschaftsjournalist Ed Yong hat ein faszinierendes Buch über die Welten geschrieben, die um uns herum sind und die wir doch nicht wahrnehmen.","https://img.nzz.ch/2022/10/14/527950d5-12a9-44f5-b521-bdd8e5740fdf.jpeg?width=1200&height=674&fit=bound&quality=75&auto=webp&crop=6543,3675,x0,y343&wmark=nzz",2022-10-18T03:30:00Z,,"Mit ihrer gespaltenen Zunge erspüren Schlangen wie diese Boa constrictor die Gerüche ihrer Umgebung in 3-D. 
Sonnenblumen haben in der Mitte ihrer Blüte einen Kreis. Wir sehen ihn nicht, dafür aber … [+8099 chars]",,de,'Blüte'
https://www.nzz.ch/reisen/belgien-und-bier-eine-velotour-auf-den-spuren-der-trappisten-ld.1703591,https://www.nzz.ch/reisen/belgien-und-bier-eine-velotour-auf-den-spuren-der-trappisten-ld.1703591,0,www.nzz.ch,Bierselig durch Belgien – eine Velotour auf den Spuren der Trappistenmönche,"In zwei Sachen ist Belgien weit oben in der Weltrangliste: beim Bier und beim Velofahren. In dem Land gibt es 380 Brauereien, davon 7 in Klöstern, sogenannte «Trappistenbrauereien». Eine Rundreise auf zwei Rädern.","https://img.nzz.ch/2022/10/17/b24f05bc-48a5-411e-bb65-787a109a0c56.jpeg?width=1200&height=674&fit=bound&quality=75&auto=webp&crop=3000,1685,x0,y531&wmark=nzz",2022-10-22T03:30:00Z,,"Radfahrerglück: Parallel zu den meisten Hauptstrassen verlaufen in Belgien asphaltierte Radpisten.
Etwa um die Mittagszeit überquert der Eisenbahnzug langsam die Grenze von Luxemburg nach Belgien, h… [+11551 chars]",,de,'Blüte'
https://www.nzz.ch/reisen/portugal-weinlese-im-ribatejo-ld.1705118,https://www.nzz.ch/reisen/portugal-weinlese-im-ribatejo-ld.1705118,0,www.nzz.ch,So geht das Traubenlesen im Ribatejo,"Bei der Weinernte in Portugal sind die Tage lang, die Nächte kurz, und die Arbeit ist monoton. Man arbeitet und isst und trinkt, aber danach weiss man, was es heisst, eine Flasche Wein herzustellen. Manch einer schwört sich, nie wieder zu trinken.","https://img.nzz.ch/2022/10/05/6c1b1b4a-3c02-49d0-b93d-c74f2013ba24.jpeg?width=1200&height=674&fit=bound&quality=75&auto=webp&crop=2468,1387,x0,y133&wmark=nzz",2022-10-07T03:30:00Z,,"Es würde mir nie in den Sinn kommen, eine Mahlzeit mit den Menschen meines Lebens einzunehmen, ohne Wein dazu zu trinken. Wein ist für mich mehr als eine Routine nach Feierabend, er ist etwas Ewiges,… [+13134 chars]",,de,'Blüte'
https://www.stern.de/gesellschaft/regional/hessen/agrar--fruehlingshafter-herbst-hilft-natur-und-landwirtschaft-32832508.html,https://www.stern.de/gesellschaft/regional/hessen/agrar--fruehlingshafter-herbst-hilft-natur-und-landwirtschaft-32832508.html,0,www.stern.de,Agrar: Frühlingshafter Herbst hilft Natur und Landwirtschaft,"Viele Wochen mussten die Pflanzen und Tiere in diesem Sommer in Hessen auf Regen warten. Die Niederschläge seit September haben nicht nur der Natur gut getan, sondern arbeiten auch den Bauern in die Hände.",https://image.stern.de/32832510/t/b2/v1/w1440/r1.7778/-/20--urnnewsmldpacom2009010122102099190918v3w800h600l640t425r1920b1278jpeg---3efeada8020ad126.jpg,2022-10-20T03:38:55Z,,"Viele Wochen mussten die Pflanzen und Tiere in diesem Sommer in Hessen auf Regen warten. Die Niederschläge seit September haben nicht nur der Natur gut getan, sondern arbeiten auch den Bauern in die … [+4802 chars]",,de,'Blüte'
https://www.kicker.de/immer-dieses-uebergewicht-iscos-zeitreise-in-sevilla-919194/artikel,https://www.kicker.de/immer-dieses-uebergewicht-iscos-zeitreise-in-sevilla-919194/artikel,0,www.kicker.de,Immer dieses Übergewicht: Iscos Zeitreise in Sevilla,"Als er mit Real Madrid seine fünfte Champions League gewann, hat Isco (30) dabei längst keine Rolle mehr gespielt. Wo ist der Mann, der jetzt in Sevilla kickt, falsch abgebogen?","https://derivates.kicker.de/image/upload/c_crop,x_0,y_64,w_3552,h_1998/w_1200,q_auto/v1/2022/09/28/00f32e1b-e11d-416d-ada0-b4e36d352d5a.jpeg",2022-10-05T10:22:00Z,,"Als er mit Real Madrid seine fünfte Champions League gewann, hat Isco (30) dabei längst keine Rolle mehr gespielt. Wo ist der Mann, der jetzt in Sevilla kickt, falsch abgebogen? 
 Wenn Marco Verratt… [+9118 chars]",,de,'Blüte'
https://www.faz.net/aktuell/feuilleton/die-gartenmalerei-der-kaisergattin-livia-im-palazzo-massimo-18384786.html,https://www.faz.net/aktuell/feuilleton/die-gartenmalerei-der-kaisergattin-livia-im-palazzo-massimo-18384786.html,0,www.faz.net,Bäume in ewiger Blüte: Die Gartenmalerei im Palazzo Massimo,"Auch nach 2000 Jahren kann man sich nicht sattsehen an der üppigen Gartenmalerei, die einst den Speisesaal einer römischen Villa schmückte: Zu Besuch im Palazzo Massimo",https://media1.faz.net/ppmedia/aktuell/706859754/1.8384837/facebook_teaser/ein-fest-fuers-auge-und-den.jpg,2022-10-14T11:01:19Z,,"Wer das Privileg hat, den Sonntagvormittag in Rom zu verbringen, sollte pünktlich um elf Uhr am Eingang des Palazzo Massimo in unmittelbarer Nähe des Bahnhofs Termini sein, um gleich nach Öffnung der… [+4698 chars]",,de,'Blüte'
https://www.n-tv.de/leben/Der-Weinberg-wandert-Richtung-Norden-article23647953.html,https://www.n-tv.de/leben/Der-Weinberg-wandert-Richtung-Norden-article23647953.html,0,www.n-tv.de,"Zwischen Tradition & Klimawandel: ""Der Weinberg wandert Richtung Norden""","Ein trockener Sommer, ein verregneter Herbst - alles andere als Idealbedingungen für Weinbauern. Wie wetterfühlig müssen sie sein, wie auf den Klimawandel reagieren? Und was wird mit den Preisen? Ein Weinbauer aus einem Familienbetrieb spricht mit ntv.de darü…",https://bilder3.n-tv.de/img/incoming/crop23647890/452132474-cImg_16_9-w1200/IMG-5343.jpg,2022-10-16T15:17:15Z,,"Ein trockener Sommer, ein verregneter Herbst - alles andere als Idealbedingungen für Weinbauern. Wie wetterfühlig müssen sie sein, wie auf den Klimawandel reagieren? Und was wird mit den Preisen? Ein… [+7730 chars]",,de,'Blüte'
https://www.focus.de/politik/gastbeitrag-von-gabor-steingart-annalena-baerbock-ist-die-heimliche-gewinnerin-des-kanzler-machtworts_id_166942175.html,https://www.focus.de/politik/gastbeitrag-von-gabor-steingart-annalena-baerbock-ist-die-heimliche-gewinnerin-des-kanzler-machtworts_id_166942175.html,0,www.focus.de,Gastbeitrag von Gabor Steingart - Annalena Baerbock ist die heimliche Gewinnerin des Kanzler-Machtworts,Per Richtlinienkompetenz hat Kanzler Scholz den Streit seiner Co-Koalitionäre über die Laufzeit der deutschen AKWs entschieden. Erstaunlicherweise fühlen sich nun alle irgendwie als Sieger. Doch es gibt tatsächlich auch einen politischen Verlierer - und eine …,https://p6.focus.de/img/fotos/id_166933655/baerbock1.jpg?im=Crop%3D%280%2C25%2C585%2C292%29%3BResize%3D%281200%2C627%29&hash=8b2571f929bcf5957970bb857175b41de30a9afaf9c67a91840859b96e016218,2022-10-19T06:22:18Z,,Per Richtlinienkompetenz hat Kanzler Scholz den Streit seiner Co-Koalitionäre über die Laufzeit der deutschen AKWs entschieden. Erstaunlicherweise fühlen sich nun alle irgendwie als Sieger. Doch es g… [+6717 chars],,de,'Blüte'
https://www.freitag.de/autoren/der-freitag/lexikon-des-luxussparens-von-epikur-ueber-biosamen-bis-dandy,https://www.freitag.de/autoren/der-freitag/lexikon-des-luxussparens-von-epikur-ueber-biosamen-bis-dandy,0,www.freitag.de,A-Z | Lexikon des Luxussparens: Von Epikur über Biosamen bis Dandy,"Klar müssen wir uns einschränken. Aber auf alles, was Spaß macht, verzichten? Oder den Alltag nur etwas anders angehen: im Wollanzug durch die Wohnung laufen und weniger heizen und guten Kaffee kaufen, aber nicht so viel ... Unser Lexikon AAtaraxie Der Philos…",https://www.freitag.de/autoren/der-freitag/lexikon-des-luxussparens-von-epikur-ueber-biosamen-bis-dandy/@@images/social_image,2022-10-15T02:00:00Z,,"A
Ataraxie Der Philosoph Lothar Kühne kritisierte einmal einen post-kantianischen Ästhetikansatz mit den Worten: Ästhetisch wertig (Wohlstandsdandy) ist so das Brot nicht mehr für den Hungrigen, der… [+10268 chars]",,de,'Blüte'
https://www.wissenschaft.de/technik-digitales/erste-hydroaktive-gebaeudefassade-entwickelt/,https://www.wissenschaft.de/technik-digitales/erste-hydroaktive-gebaeudefassade-entwickelt/,0,www.wissenschaft.de,Erste hydroaktive Gebäudefassade entwickelt,In heißen Sommern können Städte aufgrund der versiegelten Bauweise besonders stark überhitzen. Doch auch Hochwasser durch Starkregen verursachen gerade in Stadtgebieten jährlich Schäden in Milliardenhöhe. Als Lösung für beide Probleme stellen Forschende nun e…,https://www.wissenschaft.de/wp-content/uploads/2/2/22-10-fassade.jpg,2022-10-12T09:51:56Z,,In heißen Sommern können Städte aufgrund der versiegelten Bauweise besonders stark überhitzen. Doch auch Hochwasser durch Starkregen verursachen gerade in Stadtgebieten jährlich Schäden in Milliarden… [+4358 chars],,de,'Hochwasser'
"https://www.ndr.de/nachrichten/info/Kuestenschutz-in-St-Peter-Ording-Wie-stabil-ist-die-Duene,duene124.html","https://www.ndr.de/nachrichten/info/Kuestenschutz-in-St-Peter-Ording-Wie-stabil-ist-die-Duene,duene124.html",0,www.ndr.de,Küstenschutz: Mit stärkere Dünen gegen Sturmfluten?,"Der Meeresspiegel steigt - und damit auch die Gefahr von Sturmfluten in Norddeutschland. Forscher testen deshalb, wie sich mit Dünen der Küstenschutz verbessern lässt. Dafür haben sie die Düne ""Maleens Knoll"" im Labor nachgebaut. Von Thomas Somboll.",https://www.ndr.de/nachrichten/info/duene128_v-contentxl.jpg,2022-10-07T14:06:57Z,"https://web.archive.org/web/20221007063736/https://www.ndr.de/nachrichten/info/Kuestenschutz-in-St-Peter-Ording-Wie-stabil-ist-die-Duene,duene124.html","Stand: 07.10.2022 13:29 Uhr
Dünen spielen eine große Rolle für den Küstenschutz - dort, wo es keine Deiche gibt, die Sturmfluten aufhalten oder wo steigende Wasserstände gefährlich werden können. Ab… [+9903 chars]",,de,'Hochwasser'
https://orf.at/stories/3287960/,https://orf.at/stories/3287960/,0,orf.at,Vorarlberg: Vermisster Lenker tot aufgefunden,,https://orf.at/mojo/1_4_1/storyserver//news/common/images/og-fallback-news.png,2022-10-03T15:12:49Z,,"Heute wurde in Hard nahe der Fahrradbrücke über die Bregenzerach (Vorarlberg) eine Leiche gefunden. Dabei handelt es sich laut Polizei um den vermissten Lenker, dessen Auto gestern in der Bregenzerac… [+158 chars]",,de,'Hochwasser'
https://orf.at/stories/3287886/,https://orf.at/stories/3287886/,0,orf.at,Mit Auto in Mellenbach gestürzt: Lenker abgängig,,https://orf.at/mojo/1_4_1/storyserver//news/common/images/og-fallback-news.png,2022-10-03T07:28:07Z,https://web.archive.org/web/20221003075131/https://orf.at/stories/3287886/,Im Bregenzerwald in Vorarlberg läuft derzeit eine große Suchaktion nach einem abgängigen Mann. Der 42-Jährige dürfte laut Angaben der Polizei gestern mit seinem Auto in den Mellenbach gestürzt sein. … [+101 chars],,de,'Hochwasser'
https://www.morgenpost.de/vermischtes/article236690981/Immer-mehr-Tote-nach-Ueberschwemmungen-in-Afrika.html,https://www.morgenpost.de/vermischtes/article236690981/Immer-mehr-Tote-nach-Ueberschwemmungen-in-Afrika.html,0,www.morgenpost.de,Hochwasser: Immer mehr Tote nach Überschwemmungen in Afrika,"Der Klimawandel macht Afrika massiv zu schaffen. Während Teile des Kontinents auf Wasser warten, starben zuletzt Hunderte Menschen nach massiven Überschwemmungen. Die Fluten betreffen Millionen.",https://img.morgenpost.de/img/vermischtes/crop236690979/4612606824-w820-cv16_9-q85/UEberschwemmungen.jpg,2022-10-17T11:41:47Z,https://web.archive.org/web/20221017121129/https://www.morgenpost.de/vermischtes/article236690981/Immer-mehr-Tote-nach-Ueberschwemmungen-in-Afrika.html,"Nairobi. Die Zahl der Toten und Verletzten durch Überschwemmungen in Afrika steigt weiter dramatisch an. Am Sonntagabend sagte die nigerianische Ministerin für humanitäre Angelegenheiten, die Zahl de… [+2550 chars]",,de,'Hochwasser'
https://www.morgenpost.de/vermischtes/article236721545/Neue-Unwetter-in-Australiens-Hochwasser-Gebieten-erwartet.html,https://www.morgenpost.de/vermischtes/article236721545/Neue-Unwetter-in-Australiens-Hochwasser-Gebieten-erwartet.html,0,www.morgenpost.de,Wetterkatastrophe: Neue Unwetter in Australiens Hochwasser-Gebieten erwartet,Die Ostküste Australiens ist in diesem Jahr bereits mehrmals von außergewöhnlich starkem Regen und verheerenden Überschwemmungen betroffen. Nun drohen neue Sturzfluten.,https://img.morgenpost.de/img/vermischtes/crop236721543/2762607745-w820-cv16_9-q85/Helfer.jpg,2022-10-21T05:29:27Z,https://web.archive.org/web/20221021061921/https://www.morgenpost.de/vermischtes/article236721545/Neue-Unwetter-in-Australiens-Hochwasser-Gebieten-erwartet.html,Melbourne  -. In den Hochwasser-Regionen an der Ostküste Australiens warnen Meteorologen vor neuen Unwettern mit heftigen Regenfällen. Das Sturmgebiet erstreckte sich über eine Länge von 3500 Kilomet… [+1590 chars],,de,'Hochwasser'
https://www.sueddeutsche.de/politik/flutkatastrophe-ahrtal-polizeivideos-lewentz-1.5670062,https://www.sueddeutsche.de/politik/flutkatastrophe-ahrtal-polizeivideos-lewentz-1.5670062,0,www.sueddeutsche.de,Flutkatastrophe in Rheinland-Pfalz: Kritik an Innenminister Lewentz nimmt zu,Seit Bekanntgabe von Polizeivideos aus der Flutnacht im Ahrtal wächst der Druck auf den verantwortlichen SPD-Minister. Die AfD will ein Misstrauensvotum stellen. Aber Malu Dreyer hält zu ihm. Warum?,https://www.sueddeutsche.de/image/sz.1.5670063/1200x675?v=1665070028,2022-10-06T15:27:52Z,https://web.archive.org/web/20221006164653/https://www.sueddeutsche.de/politik/flutkatastrophe-ahrtal-polizeivideos-lewentz-1.5670062,Seit Bekanntgabe von Polizeivideos aus der Flutnacht im Ahrtal wächst der Druck auf den verantwortlichen SPD-Minister. Die AfD will ein Misstrauensvotum stellen. Aber Malu Dreyer hält zu ihm. Warum?B… [+4694 chars],,de,'Hochwasser'
https://www.sueddeutsche.de/muenchen/erding/blackout-stromausfall-katastrophenschutz-landratsamt-therme-flughafen-erding-1.5670910,https://www.sueddeutsche.de/muenchen/erding/blackout-stromausfall-katastrophenschutz-landratsamt-therme-flughafen-erding-1.5670910,0,www.sueddeutsche.de,Energiekrise: Blackout - wenn nichts geht mehr,"Für den Fall eines großflächigen und tagelangen Stromausfalls gibt es im Landkreis Erding Notfallpläne. Die Koordination übernimmt dann die Führungsgruppe Katastrophenschutz. Der nahe Münchner Flughafen ist zu einem großen Teil autark, bei der Erdinger Therme…",https://www.sueddeutsche.de/image/sz.1.1015178/1200x675?v=1665152184,2022-10-07T14:16:34Z,https://web.archive.org/web/20221007143645/https://www.sueddeutsche.de/muenchen/erding/blackout-stromausfall-katastrophenschutz-landratsamt-therme-flughafen-erding-1.5670910,Für den Fall eines großflächigen und tagelangen Stromausfalls gibt es im Landkreis Erding Notfallpläne. Die Koordination übernimmt dann die Führungsgruppe Katastrophenschutz. Der nahe Münchner Flugha… [+6993 chars],,de,'Hochwasser'
https://www.morgenpost.de/vermischtes/article236684411/Im-Suedosten-Australiens-herrscht-weiter-Land-unter.html,https://www.morgenpost.de/vermischtes/article236684411/Im-Suedosten-Australiens-herrscht-weiter-Land-unter.html,0,www.morgenpost.de,Hochwasser: Im Südosten Australiens herrscht weiter Land unter,"Wo sonst Autos Vorfahrt haben, fahren auf einmal Kajaks: Im Südosten Australiens stehen vielerorts Gebiete tief unter Wasser. Premier Albanese macht sich vor Ort ein Bild und verspricht Hilfe. Doch das nächste Regengebiet nähert sich schon.",https://img.morgenpost.de/img/vermischtes/crop236684399/471260566-w820-cv16_9-q85/Hochwasser-in-Australien.jpg,2022-10-16T14:24:17Z,https://web.archive.org/web/20221016151328/https://www.morgenpost.de/vermischtes/article236684411/Im-Suedosten-Australiens-herrscht-weiter-Land-unter.html,Melbourne. Die Lage in den Überschwemmungsgebieten im Südosten Australiens hat sich auch am Wochenende nicht entspannt. Premierminister Anthony Albanese zeigte sich am Sonntag bei einem Flug über den… [+3696 chars],,de,'Hochwasser'
https://www.welt.de/politik/ausland/article241740503/Ukraine-News-Russischer-Kampfjet-stuerzt-in-Gebaeude-im-sibirischen-Irkutsk.html,https://www.welt.de/politik/ausland/article241740503/Ukraine-News-Russischer-Kampfjet-stuerzt-in-Gebaeude-im-sibirischen-Irkutsk.html,0,www.welt.de,Russischer Kampfjet stürzt in Gebäude im sibirischen Irkutsk,In der sibirischen Stadt Irkutsk ist es zu einem Unglück gekommen: Ein russisches Kampfflugzeug stürzte in ein Gebäude. Erst Anfang der Woche war ein russischer Kampfjet im Süden Russlands in ein Wohnhaus gefallen. Mehr im Liveticker.,https://img.welt.de/img/politik/ausland/mobile241745151/8991359177-ci16x9-w1200/XV-International-Aviation-and-Space-Salon-MAKS-2021.jpg,2022-10-23T11:29:00Z,https://web.archive.org/web/20221023114649/https://www.welt.de/politik/ausland/article241740503/Ukraine-News-Russischer-Kampfjet-stuerzt-in-Gebaeude-im-sibirischen-Irkutsk.html,"Ein russisches Kampfflugzeug ist am Sonntag in der sibirischen Stadt Irkutsk in ein Gebäude gestürzt. Der Regionalgouverneur Igor Kobsew teilte im Online-Dienst Telegram mit, die Maschine sei in ein … [+9540 chars]",,de,'Hochwasser'
https://www.stern.de/gesellschaft/regional/bayern/ehrenmedaille---feuerwehr-zeichnet-schauspielerin-christine-eixenberger-aus-32804750.html,https://www.stern.de/gesellschaft/regional/bayern/ehrenmedaille---feuerwehr-zeichnet-schauspielerin-christine-eixenberger-aus-32804750.html,0,www.stern.de,Ehrenmedaille : Feuerwehr zeichnet Schauspielerin Christine Eixenberger aus,"Christine Eixenberger ist für ihre Titelrolle in der erfolgreichen ZDF-Reihe ""Marie fängt Feuer"" mit der Deutschen Feuerwehr-Ehrenmedaille ausgezeichnet worden. Eixenberger spiele ""eine Feuerwehrfrau wie wir sie uns auch im Alltag wünschen: zupackend, natürli…",https://image.stern.de/32804752/t/TG/v1/w1440/r1.7778/-/11--urnnewsmldpacom200901012210119987308v3w800h600l773t161r1743b1331jpeg---2e386a11f7de92d8.jpg,2022-10-11T11:48:57Z,https://web.archive.org/web/20221011120038/https://www.stern.de/gesellschaft/regional/bayern/ehrenmedaille---feuerwehr-zeichnet-schauspielerin-christine-eixenberger-aus-32804750.html,"Christine Eixenberger ist für ihre Titelrolle in der erfolgreichen ZDF-Reihe ""Marie fängt Feuer"" mit der Deutschen Feuerwehr-Ehrenmedaille ausgezeichnet worden. Eixenberger spiele ""eine Feuerwehrfrau… [+2786 chars]",,de,'Hochwasser'
