index,url,valid,domain,title,description,image,published,archive,content,quote,language,keyword
https://kaernten.orf.at/stories/3332177/,https://kaernten.orf.at/stories/3332177/,0,kaernten.orf.at,Sanierung der Deponie Auenpark beginnt 2026,"Die Deponie Auenpark bei Villach, eine Altlast aus den 1960er und 70er Jahren, wird ab Anfang 2026 saniert. Die Kosten teilen sich Infineon, Bund, Land und Stadt Villach. Infineon plant den Kauf des sanierten Grundstücks, was die finanzielle Last für Villach …",https://ibs.orf.at/ktn?image=https%3A%2F%2Foekastatic.orf.at%2Fmims%2F2019%2F28%2F57%2Fcrops%2Fw%3D1200%2Ch%3D627%2Cq%3D75%2F2851958_master_60557_on-2019-07-08-18h25m44s972.jpg%3Fs%3Dc3595d38c187682d65f98887b00867bc27a97ef4,2025-12-01T04:49:27Z,,"In den 60er Jahren, lange vor der Ansiedelung von Infineon und der Begradigung des Flusses, wurden nahe der Gail in Villach Mulden mit Hausmüll, Gewerbeabfällen und Bauschutt aufgefüllt. Insgesamt wu… [+1485 chars]",,de,'Sanierung'
https://kaernten.orf.at/stories/3332231/,https://kaernten.orf.at/stories/3332231/,0,kaernten.orf.at,Sanierung Katschbergtunnel auf A10,"Im Herbst 2027 beginnt auf der A10 die nächste Baustelle, diesmal werden auch der Tauern- und der Katschbergtunnel saniert. Insgesamt werden die gesamten geplanten Bauarbeiten sechs Jahre dauern, so die ASFINAG.",https://ibs.orf.at/ktn?image=https%3A%2F%2Foekastatic.orf.at%2Fmims%2F2025%2F13%2F16%2Fcrops%2Fw%3D1200%2Ch%3D627%2Cq%3D75%2F2566231_master_984216_stmichael6.jpg%3Fs%3D8d50afe08034181bf90dd39fb366b370384683a6,2025-12-01T05:27:36Z,,"Mehrere Gesprächsrunden mit den Bürgermeistern in Pongau, im Lungau und in Kärnten gab es schon. Nach der Sanierung der Tunnelkette Zwischenwerfen und Golling mit teils stundenlangen Staus zwischen K… [+700 chars]",,de,'Sanierung'
https://www.stern.de/gesellschaft/regional/hamburg-schleswig-holstein/statistik--909-grippe-kranke-2024-in-hamburger-krankenhaeusern-behandelt-36914590.html,https://www.stern.de/gesellschaft/regional/hamburg-schleswig-holstein/statistik--909-grippe-kranke-2024-in-hamburger-krankenhaeusern-behandelt-36914590.html,0,www.stern.de,Statistik: 909 Grippe-Kranke 2024 in Hamburger Krankenhäusern behandelt,"Wenn man sich eine Grippe einfängt, kann die einen umhauen. Gerade ältere Menschen und Kinder können deshalb sogar im Krankenhaus landen. 2024 waren es in Hamburg mehr als doppelt so viele wie 2023.",https://image.stern.de/36914592/t/CJ/v1/w1440/r1.7778/-/01--rhxg2hylkjv4axs2048jpeg---4c07aeb9f23d1eb5.jpg,2025-12-01T07:56:43Z,,"Kopiere den aktuellen Link
Zur Merkliste hinzufügen
Wenn man sich eine Grippe einfängt, kann die einen umhauen. Gerade ältere Menschen und Kinder können deshalb sogar im Krankenhaus landen. 2024 wa… [+771 chars]",,de,'Grippe'
https://www.stern.de/gesellschaft/regional/hamburg-schleswig-holstein/statistik--mehr-grippe-kranke-2024-in-kliniken-im-norden-behandelt-36914674.html,https://www.stern.de/gesellschaft/regional/hamburg-schleswig-holstein/statistik--mehr-grippe-kranke-2024-in-kliniken-im-norden-behandelt-36914674.html,0,www.stern.de,Statistik: Mehr Grippe-Kranke 2024 in Kliniken im Norden behandelt,Gerade für ältere und jüngere Menschen kann eine Grippe sehr anstrengend sein. Teilweise müssen sie sogar ins Krankenhaus. Im Norden haben sich die Zahlen im Vergleich zu 2023 deutlich geändert.,https://image.stern.de/36914676/t/1X/v1/w1440/r1.7778/-/01--dpkn2dmauxv8axs2048jpeg---67ba37d7eaa4280b.jpg,2025-12-01T08:24:40Z,,"Kopiere den aktuellen Link
Zur Merkliste hinzufügen
Gerade für ältere und jüngere Menschen kann eine Grippe sehr anstrengend sein. Teilweise müssen sie sogar ins Krankenhaus. Im Norden haben sich d… [+830 chars]",,de,'Grippe'
https://www.zeit.de/news/2025-12/01/mehr-grippe-kranke-2024-in-kliniken-im-norden-behandelt,https://www.zeit.de/news/2025-12/01/mehr-grippe-kranke-2024-in-kliniken-im-norden-behandelt,0,www.zeit.de,Statistik: Mehr Grippe-Kranke 2024 in Kliniken im Norden behandelt,Hier finden Sie Informationen zu dem Thema „Statistik“. Lesen Sie jetzt „Mehr Grippe-Kranke 2024 in Kliniken im Norden behandelt“.,https://img.zeit.de/news/2025-12/01/mehr-grippe-kranke-2024-in-kliniken-im-norden-behandelt-image-group/wide__1300x731,2025-12-01T08:24:40Z,,Im vergangenen Jahr sind deutlich mehr Menschen als 2023 wegen einer Grippe in Krankenhäusern in Schleswig-Holstein behandelt worden. Insgesamt seien 1.393 Menschen wegen der Viruserkrankung vollstat… [+620 chars],,de,'Grippe'
https://www.sueddeutsche.de/wirtschaft/thyssenkrupp-steel-sanierung-duisburg-li.3347665,https://www.sueddeutsche.de/wirtschaft/thyssenkrupp-steel-sanierung-duisburg-li.3347665,0,www.sueddeutsche.de,Duisburg: Thyssenkrupp-Stahlsparte kann mit großem Stellenabbau beginnen,Deutschlands größter Stahlkonzern leidet unter Überkapazitäten und asiatischer Billigkonkurrenz. Nun hat sich die Firma mit der IG Metall über die Details für die härteste Sanierung der Firmengeschichte verständigt.,https://www.sueddeutsche.de/2025/12/01/7fb8b3eb-2161-429e-9880-f832f19be9b3.jpg?q=60&fm=webp&width=1200&rect=0%2C209%2C4000%2C2250,2025-12-01T16:36:52Z,,"Thyssenkrupp Steel Europe (TKSE), wie die Tochterfirma des Industriekonzerns Thyssenkrupp heißt, leidet unter Überkapazitäten und niedrigen Preisen am Weltmarkt, asiatische Billigkonkurrenz setzt die… [+2051 chars]",,de,'Sanierung'
https://www.diepresse.com/20367505/us-sondergesandter-trifft-putin-deutschland-die-neue-ki-hochburg-grippe,https://www.diepresse.com/20367505/us-sondergesandter-trifft-putin-deutschland-die-neue-ki-hochburg-grippe,0,www.diepresse.com,"US-Sondergesandter trifft Putin • Deutschland, die neue KI-Hochburg? • Grippe-Subvariante breitet sich aus","Guten Morgen! Heute ist Dienstag, der 2. Dezember 2025. Das sollten Sie heute zum Start in den Tag wissen.",https://www.diepresse.com/assets_v2/images/diepresse_nachrichten.png,2025-12-02T04:42:13Z,,"Guten Morgen! Heute ist Dienstag, der 2. Dezember 2025. Das sollten Sie heute zum Start in den Tag wissen.
Heute rücken einmal mehr die Bemühungen um einen Waffenstillstand in der Ukraine in den Fok… [+3600 chars]",,de,'Grippe'
https://www.diepresse.com/20363995/frueher-staerker-und-mit-neuer-variante-grippewelle-vor-ausbruch,https://www.diepresse.com/20363995/frueher-staerker-und-mit-neuer-variante-grippewelle-vor-ausbruch,0,www.diepresse.com,"Früher, stärker und mit neuer Variante: Grippewelle vor Ausbruch [premium]","Die Zahl der bestätigten Fälle des Influenzavirus nimmt zu. Eine neue Subvariante umgeht den Impfschutz etwas effizienter, empfohlen wird die Impfung aber dennoch. Es ist auch noch nicht zu spät dafür.",https://img.diepresse.com/public/incoming/awgvra-imago-images-0797704909/alternates/DPR_SOCIAL_NACHRICHTEN/imago%20images%200797704909,2025-12-02T04:42:58Z,,"Ausgebrochen im Sinne einer epidemischen Aktivität ist sie noch nicht, die diesjährige Grippewelle nimmt aber langsam Fahrt auf und das rund vier Wochen früher als üblich. Das geht sowohl aus den akt… [+4760 chars]",,de,'Grippe'
https://tirol.orf.at/stories/3332516/,https://tirol.orf.at/stories/3332516/,0,tirol.orf.at,Sanierung der A12 großteils abgeschlossen,"Die Sanierungsarbeiten auf der A12 Inntalautobahn zwischen Hall-West und Innsbruck-Ost sind größtenteils abgeschlossen. Auf der Hauptfahrbahn wurde die Baustellen-Verkehrsführung bereits zurückgebaut, für Autofahrer gibt es hier keine Behinderungen mehr.",https://ibs.orf.at/tir?image=https%3A%2F%2Foekastatic.orf.at%2Fmojo%2F1_4_1%2Fstoryserver%2Foeka%2Fcommon%2Fimages%2Fog-fallback-tir.png%3Fs%3D3061f8472e32c1cd7d82f69f7bcb03aa89dcb859,2025-12-02T14:49:28Z,,In den heutigen Nachtstunden werden die letzten Umlegungen im Bereich der Rampen bei der Anschlussstelle Innsbruck-Ost durchgeführt. Ab morgen sollen auch hier keine Behinderungen mehr auftreten. Der… [+508 chars],,de,'Sanierung'
https://www.sueddeutsche.de/muenchen/muenchen-verkehr-hackerbruecke-sanierung-li.3347530,https://www.sueddeutsche.de/muenchen/muenchen-verkehr-hackerbruecke-sanierung-li.3347530,0,www.sueddeutsche.de,Wichtige Nord-Süd-Verbindung: Die Hackerbrücke wird drei Jahre lang saniert,"Die Hackerbrücke in München benötigt dringend eine Sanierung, die bis zu 50 Millionen Euro kosten wird. Schäden wie Risse und Korrosion sind festgestellt worden. Während der Bauarbeiten bleibt die Querung für Fußgänger und Radfahrer geöffnet.",https://www.sueddeutsche.de/2025/12/02/d6cfd85d-2e24-4191-877e-1b815ad0d685.jpg?q=60&fm=webp&width=1200&rect=0%2C210%2C4000%2C2250,2025-12-02T15:48:13Z,,"Für Alexander Reissl war die Brücke schon immer ein besonderes Bauwerk, etwas Sichtbares in der Stadt und Teil seines Wegs zur Schule, wie sich der CSU-Stadtrat erinnert. Und als solches sichtbares M… [+4506 chars]",,de,'Sanierung'
https://tirol.orf.at/stories/3332548/,https://tirol.orf.at/stories/3332548/,0,tirol.orf.at,Eiskanal Igls: Konkrete Lösung bis Jänner,"In einer zweistündigen Krisensitzung wurde am Dienstag über die Sanierung des millionenschwer umgebauten Igler Eiskanals beraten, jedoch noch ohne konkretes Ergebnis. Bis Jänner soll der Planer ein Konzept vorlegen. Er weist die Schuld am missglückten Umbau z…",https://ibs.orf.at/tir?image=https%3A%2F%2Foekastatic.orf.at%2Fmims%2F2025%2F46%2F82%2Fcrops%2Fw%3D1200%2Ch%3D627%2Cq%3D75%2F2831347_master_1093082_694c2218-40f0-4061-8d1c-e506151f353e.jpg%3Fs%3D6c88e5c5a29a31e7656af4f5225d0925086de63a,2025-12-02T20:02:04Z,,"Eine Lösung wird nur in Form eines größeren Eingriffs möglich sein, der mit hohen Kosten verbunden ist. Das ist das Ergebnis einer zweistündigen Krisensitzung in der Olympiaworld. Hinter verschlossen… [+1469 chars]",,de,'Sanierung'
https://www.zeit.de/news/2025-12/03/eu-einig-ueber-komplettverzicht-auf-gas-aus-russland,https://www.zeit.de/news/2025-12/03/eu-einig-ueber-komplettverzicht-auf-gas-aus-russland,0,www.zeit.de,Energie: EU einig über Komplettverzicht auf Gas aus Russland,Hier finden Sie Informationen zu dem Thema „Energie“. Lesen Sie jetzt „EU einig über Komplettverzicht auf Gas aus Russland“.,https://img.zeit.de/administratives/sharing/fallback-image-die-zeit/wide__1300x731,2025-12-03T01:07:39Z,,Die EU will bis spätestens Ende 2027 vollkommen unabhängig von Erdgas aus Russland sein und jegliche Importe stoppen. Das sieht eine in Brüssel erzielte Einigung zwischen Vertretern der Regierungen d… [+86 chars],,de,'Gas'
https://www.zeit.de/news/2025-12/03/heizen-ist-teurer-geworden-mal-wieder,https://www.zeit.de/news/2025-12/03/heizen-ist-teurer-geworden-mal-wieder,0,www.zeit.de,"Öl, Gas und Fernwärme: Heizen ist teurer geworden - mal wieder","Hier finden Sie Informationen zu dem Thema „Öl, Gas und Fernwärme“. Lesen Sie jetzt „Heizen ist teurer geworden - mal wieder“.",https://img.zeit.de/news/2025-12/03/heizen-ist-teurer-geworden-mal-wieder-image-group/wide__1300x731,2025-12-03T04:15:06Z,,"Die Heizkosten sind in Deutschland einer Studie zufolge zwar gestiegen, es geht aber längst nicht mehr so steil nach oben wie früher. Wie aus dem Wärmemonitor des Deutschen Instituts für Wirtschaftsf… [+4268 chars]",,de,'Gas'
https://www.stern.de/news/zeitplan-fuer-eu-ausstieg-aus-russischem-gas-steht-36922248.html,https://www.stern.de/news/zeitplan-fuer-eu-ausstieg-aus-russischem-gas-steht-36922248.html,0,www.stern.de,Zeitplan für EU-Ausstieg aus russischem Gas steht,"Der Zeitplan für einen Ausstieg der EU aus russischen Gaslieferungen steht. Vertreter aus dem Europaparlament und dem Rat der 27 EU-Länder einigten sich in der Nacht zum Mittwoch darauf, spätestens zum 1. November 2027 kein Gas mehr aus Russland zu importiere…",https://image.stern.de/36922250/t/bH/v1/w1440/r1.7778/-/03--fluessiggasterminal---8c224072c3ae0360.jpg,2025-12-03T06:09:29Z,,"Kopiere den aktuellen Link
Zur Merkliste hinzufügen
Der Zeitplan für einen Ausstieg der EU aus russischen Gaslieferungen steht. Vertreter aus dem Europaparlament und dem Rat der 27 EU-Länder einigt… [+2230 chars]",,de,'Gasspeicher'
"https://www.gamestar.de/artikel/frankreich-atomkraftwerk-quallen,3438710.html","https://www.gamestar.de/artikel/frankreich-atomkraftwerk-quallen,3438710.html",0,www.gamestar.de,Wissenschaft - Wie Quallen das zweitgrößte Atomkraftwerk Europas lahm legten – und warum der Mensch das größte Problem dabei ist,"Kaum ein Land ist derart eng mit einer Form Energieversorgung verzahnt, wie Frankreich mit Atomkraft. Dort kam es zu einem ungewöhnlichen Vorfall.",https://images.cgames.de/images/gamestar/293/teaser-atomkraft-gravelines-quallen-gs_6372144.jpg,2025-12-03T06:46:00Z,,"Eine einzelne Qualle kann wenig ausrichten Hunderte oder tausende hingegen schon.
(Bildquelle: Unsplash, Jeffrey Hamilton und Mick Truyts)
Wenn Atommeiler herunterfahren, um eine Katastrophe zu ver… [+6252 chars]",,de,'Atomkraft'
https://www.zeit.de/wirtschaft/2025-12/heizkosten-erneut-gestiegen-waermemonitor-diw-gxe,https://www.zeit.de/wirtschaft/2025-12/heizkosten-erneut-gestiegen-waermemonitor-diw-gxe,0,www.zeit.de,Deutsches Institut für Wirtschaftsforschung: Heizkosten stiegen 2024 um sechs Prozent,"Die Heizkosten haben sich im vergangenen Jahr auf 12,33 Cent pro Kilowattstunde verteuert. Ein erneutes Plus – allerdings deutlich niedriger als in den Jahren zuvor.",https://img.zeit.de/wirtschaft/2025-12/waermemonitor-deutschland-heizkosten-heizen-teurer-bild/wide__1300x731,2025-12-03T07:52:50Z,,"Die Heizkosten sind in Deutschland einer Studie 
zufolge erneut gestiegen. Eine 
Kilowattstunde Heizungsenergie verteuerte sich im vergangenen Jahr in Deutschland in Zwei- und 
Mehrfamilienhäusern… [+3343 chars]",,de,'Heizkosten'
https://www.stern.de/wirtschaft/news/heizkosten-steigen-nicht-mehr-so-schnell-wie-bisher-36922128.html,https://www.stern.de/wirtschaft/news/heizkosten-steigen-nicht-mehr-so-schnell-wie-bisher-36922128.html,0,www.stern.de,Energieversorgung: Heizkosten steigen weiter – aber langsamer als bisher,Die Heizkosten steigen und steigen – unabhängig von der Art der Heizung. Das Deutsche Institut für Wirtschaftsforschung hat aber auch einen positiven Trend ausgemacht.,https://image.stern.de/36922130/t/df/v1/w1440/r1.7778/-/heizkosten-symbolbild.jpg,2025-12-03T08:09:00Z,,"Kopiere den aktuellen Link
Zur Merkliste hinzufügen
Die Heizkosten steigen und steigen unabhängig von der Art der Heizung. Das Deutsche Institut für Wirtschaftsforschung hat aber auch einen positiv… [+4618 chars]",,de,'Heizkosten'
https://www.tagesschau.de/wirtschaft/verbraucher/heizen-kosten-gas-oel-fernwaerme-100.html,https://www.tagesschau.de/wirtschaft/verbraucher/heizen-kosten-gas-oel-fernwaerme-100.html,0,www.tagesschau.de,"Kosten für Erdgas, Öl, Fernwärme: Heizen erneut teurer geworden",Die Heizkosten sind einer Studie zufolge erneut gestiegen - allerdings deutlich moderater als in den Jahren zuvor. Innerhalb Deutschlands gibt es dabei ein deutliche Preisunterschiede.,https://images.tagesschau.de/image/43a80482-901e-4ba9-867f-41b68216c555/AAABmuLtwB0/AAABmt42H9g/16x9-big/heizen-122.jpg?width=1280,2025-12-03T08:35:53Z,,"Stand: 03.12.2025 09:35 Uhr
Die Heizkosten sind einer Studie zufolge erneut gestiegen - allerdings deutlich moderater als in den Jahren zuvor. Innerhalb Deutschlands gibt es dabei ein deutliche Prei… [+3020 chars]",,de,'Heizkosten'
https://www.zeit.de/news/2025-12/03/kretschmer-eu-beschluss-zu-russischem-gas-fehlentscheidung,https://www.zeit.de/news/2025-12/03/kretschmer-eu-beschluss-zu-russischem-gas-fehlentscheidung,0,www.zeit.de,Energie: Kretschmer: EU-Beschluss zu russischem Gas Fehlentscheidung,Hier finden Sie Informationen zu dem Thema „Energie“. Lesen Sie jetzt „Kretschmer: EU-Beschluss zu russischem Gas Fehlentscheidung“.,https://img.zeit.de/news/2025-12/03/kretschmer-eu-beschluss-zu-russischem-gas-fehlentscheidung-image-group/wide__1300x731,2025-12-03T13:55:54Z,,"Sachsens Regierungschef Michael Kretschmer (CDU) hält den Beschluss der EU zum kompletten Verzicht auf russisches Erdgas für unverständlich. Er halte das für eine Fehlentscheidung, sagte er der Deuts… [+1775 chars]",,de,'Gas'
https://www.dw.com/de/eu-beschliesst-ausstieg-aus-russischem-gas-bis-ende-2027/a-74999320,https://www.dw.com/de/eu-beschliesst-ausstieg-aus-russischem-gas-bis-ende-2027/a-74999320,0,www.dw.com,Gas aus Russland: EU beschließt Ausstieg bis Ende 2027,"Die EU will binnen zwei Jahren komplett aus russischen Gasimporten aussteigen. Kommissionspräsidentin von der Leyen spricht von einer ""neuen Ära"" der Unabhängigkeit von Moskau. Ungarn will gegen die Entscheidung klagen.",https://static.dw.com/image/75001637_6.jpg,2025-12-03T14:59:00Z,,"Vertreter aus dem Europaparlament und dem Rat der 27 EU-Länder haben sich darauf verständigt, spätestens von November 2027 an kein Gas mehr aus Russland zu importieren. Der Ausstieg soll schrittweise… [+3624 chars]",,de,'Gasspeicher'
https://www.jungewelt.de/artikel/513416.energiepreisentwicklung-heizen-wieder-teurer.html,https://www.jungewelt.de/artikel/513416.energiepreisentwicklung-heizen-wieder-teurer.html,0,www.jungewelt.de,Energiepreisentwicklung: Heizen wieder teurer [Online-Abo],Die Heizkosten sind in Deutschland erneut gestiegen. Konstant höhere Preise in Ostdeutschland.,https://www.jungewelt.de/img/1100/216384.jpg,2025-12-03T18:36:55Z,,"Uneingeschränkter Zugriff auf alle Inhalte: Erleben Sie die Tageszeitung junge Welt in gedruckter oder digitaler Form oder beides kombiniert.
Nachrichtenauswahl und -aufbereitung erfordern finanziel… [+458 chars]",,de,'Heizkosten'
https://t3n.de/news/heizkosten-senken-heizkurve-einstellen-1661085/,https://t3n.de/news/heizkosten-senken-heizkurve-einstellen-1661085/,0,t3n.de,Heizkurve richtig einstellen: Bis zu 15 Prozent Heizkosten sparen,"Schon mit einfachen Eingriffen in das Heizsystem ließe sich viel Energie sparen, etwa mit der richtigen Heizkurve. Doch nicht alle Hersteller erlauben das. Ein Teil unserer teuer bezahlten Heizwärme fließt regelmäßig ungenutzt durch die Heizungsrohre. „Häufig…",https://cdn.t3n.de/news/wp-content/uploads/2024/12/shutterstock_2518184145.jpg?class=content,2025-12-04T08:05:00Z,,"Ein Teil unserer teuer bezahlten Heizwärme fließt regelmäßig ungenutzt durch die Heizungsrohre. Häufig sind Heizungen total überhöht eingestellt, aber die Kunden merken es nicht, weil es ausreichend … [+7629 chars]",,de,'Heizkosten'
https://t3n.de/news/gasversorgung-in-deutschland-1711690/,https://t3n.de/news/gasversorgung-in-deutschland-1711690/,0,t3n.de,Wie steht es um die Gasversorgung in Deutschland? Die wichtigsten Fragen beantwortet,"Die aktuelle Heizperiode rückt den Blick auf die Energieversorgung in Deutschland in den Fokus. Wir klären die wichtigsten Fragen zum Gasverbrauch, zu Kosten und zu Alternativen.weiterlesen auf t3n.de",https://cdn.t3n.de/news/wp-content/uploads/2024/12/shutterstock_2518184145.jpg?class=content,2025-12-05T10:55:00Z,,"Zunächst eine gute Nachricht: Gasmangel wird es in diesem Winter wohl nicht geben. Die Bundesnetzagentur schätzt die Gasversorgung in Deutschland als stabil ein, mahnt aber, dass ein sparsamer Gasver… [+6965 chars]",,de,'Gas'
https://www.zeit.de/news/2025-12/05/gasaustritt-in-rheinhessen-explosionsfaehiges-gemisch,https://www.zeit.de/news/2025-12/05/gasaustritt-in-rheinhessen-explosionsfaehiges-gemisch,0,www.zeit.de,"Mehrere Haushalte ohne Gas: Gasaustritt in Rheinhessen - ""Explosionsfähiges Gemisch""","Hier finden Sie Informationen zu dem Thema „Mehrere Haushalte ohne Gas“. Lesen Sie jetzt „Gasaustritt in Rheinhessen - ""Explosionsfähiges Gemisch""“.",https://img.zeit.de/news/2025-12/05/gasaustritt-in-rheinhessen-explosionsfaehiges-gemisch-image-group/wide__1300x731,2025-12-05T19:12:21Z,,"In Schwabenheim an der Selz (Rheinhessen) ist die Feuerwehr wegen eines Gasaustritts im Einsatz. «Beim Eintreffen der ersten Kräfte hat sich die Gasausströmung bestätigt», sagte ein Verwaltungssprech… [+949 chars]",,de,'Gas'
