index,url,valid,domain,title,description,image,published,archive,content,quote,language,keyword
https://www.stern.de/wirtschaft/news/energie--reiche-zu-gasspeichern---sorgen-sind-nicht-angebracht--37096124.html,https://www.stern.de/wirtschaft/news/energie--reiche-zu-gasspeichern---sorgen-sind-nicht-angebracht--37096124.html,0,www.stern.de,"Energie: Reiche zu Gasspeichern: ""Sorgen sind nicht angebracht""","Der Füllstand der Gasspeicher liegt bei 35 Prozent. Warum Wirtschaftsministerin Katherina Reiche dennoch überzeugt ist, dass Deutschland gut durch den Winter kommt.",https://image.stern.de/37096126/t/dh/v1/w1440/r1.7778/-/01--obwdalkcwcv3axs2048jpeg---8ff2bfca91c0c570.jpg,2026-02-01T11:24:04Z,,"Kopiere den aktuellen Link
Zur Merkliste hinzufügen
Der Füllstand der Gasspeicher liegt bei 35 Prozent. Warum Wirtschaftsministerin Katherina Reiche dennoch überzeugt ist, dass Deutschland gut durc… [+605 chars]",,de,'Gasspeicher'
https://taz.de/Proteste-zu-Iran/!6150317/,https://taz.de/Proteste-zu-Iran/!6150317/,0,taz.de,Proteste zu Iran: Gespaltenes Exil,Mehrere Demos und eine Videoaktion mit Projektionen auf öffentliche Gebäude prangern die Gewalt des Mullah-Regimes im Iran an.,https://taz.de/picture/8223069/1200/JPEG-image-408F-8B76-AF-0.jpeg,2026-02-01T14:35:00Z,,Mehrere Demos und eine Videoaktion mit Projektionen auf öffentliche Gebäude prangern die Gewalt des Mullah-Regimes im Iran an. mehr...,,de,'öffentliche Gebäude'
https://www.faz.net/aktuell/gesellschaft/bombenzyklon-trifft-usa-north-carolina-versinkt-im-schnee-accg-200495220.html,https://www.faz.net/aktuell/gesellschaft/bombenzyklon-trifft-usa-north-carolina-versinkt-im-schnee-accg-200495220.html,0,www.faz.net,"Schnee, Orkanböen, Sturmfluten: Bombenzyklon trifft USA","Eine gefährliche Kältewelle erfasst den Süden der USA. In North Carolina fallen örtlich Schneemengen, die zu den höchsten seit Beginn der Aufzeichnungen zählen.",https://media0.faz.net/image/w1200h627/91131d3cd1e5/w4000h2090x0y169o/202602/43601.0.1725169934/streugut-ist-dieser-tage-in.webp,2026-02-01T17:03:26Z,,"Ein schwerer Wintersturm hat Schnee, Orkanböen, Sturmfluten und gefährliche Kälte in den Südosten der USA gebracht. Ein Tiefdruckgebiet vor der Küste entwickelte sich in der Nacht zum Sonntag nach An… [+1799 chars]",,de,'Kälte'
https://www.tagesschau.de/inland/winterwetter-warnstreiks-100.html,https://www.tagesschau.de/inland/winterwetter-warnstreiks-100.html,0,www.tagesschau.de,Winterwetter und Warnstreiks: Erhebliche Verkehrsbehinderungen am Montag,"Eis, Schnee, Kälte - und ein Ende ist nicht in Sicht: Zum Wochenstart müssen Pendler vielerorts mit Einschränkungen auf Straßen und Schienen rechnen. Dazu kommt: Die Gewerkschaft Verdi hat flächendeckend zu Warnstreiks im öffentlichen Nahverkehr aufgerufen.",https://images.tagesschau.de/image/ee8ece4d-71b0-40e3-839a-1235da24b71a/AAABlgUhPcg/AAABmyZE0EA/16x9-big/eisregen-115.jpg?width=1280,2026-02-01T19:21:30Z,,"Stand: 01.02.2026 20:21 Uhr
Eis, Schnee, Kälte - und ein Ende ist nicht in Sicht: Zum Wochenstart müssen Pendler vielerorts mit Einschränkungen auf Straßen und Schienen rechnen. Dazu kommt: Die Gewe… [+1838 chars]",,de,'Kälte'
https://www.faz.net/aktuell/karriere-hochschule/psychologe-hannes-zacher-warnt-vor-generationenlabels-accg-110826809.html,https://www.faz.net/aktuell/karriere-hochschule/psychologe-hannes-zacher-warnt-vor-generationenlabels-accg-110826809.html,0,www.faz.net,Psychologie-Professor warnt: „Generationen sind Erfindungen der Generationenindustrie“,"Generation X, Y, Z oder Alpha: Solche Labels sind unwissenschaftlich, sagt Hannes Zacher. Ältere dichteten Jüngeren negative Eigenschaften an, um sich selbst aufzuwerten. Arbeitgeber sollten dem keine Beachtung schenken.",https://media0.faz.net/image/w1200h627/ef9e118a49b3/w6720h3511x0y484o/202504/43601.0.971728233/wer-gehoert-hier-zu-welcher.webp,2026-02-02T07:29:06Z,,"Herr Zacher, viel ist von der Generation Y, der GenZ und nun der Generation Alpha die Rede. Fallen Ihnen typische Eigenschaften dieser Generationen ein? 
Ungern. Ich verwende solche Labels nicht, we… [+10623 chars]",,de,'Ältere Generation'
https://www.faz.net/aktuell/karriere-hochschule/klassenzimmer/luxemburg-streitet-ueber-unisextoiletten-accg-200498047.html,https://www.faz.net/aktuell/karriere-hochschule/klassenzimmer/luxemburg-streitet-ueber-unisextoiletten-accg-200498047.html,0,www.faz.net,Regierungskrise: Nur noch Unisex-Toiletten in neuen Schulen in Luxemburg,Keine Trennung mehr nach Geschlechtern: Schultoiletten und Umkleiden sollen in Luxemburg für jedes Geschlecht nutzbar sein. So plant es das Bildungsministerium. Das führt nun zu einer Regierungskrise.,https://media0.faz.net/image/w1200h627/cbd9ce31d828/w5000h2612x0y621o/202602/f8e8d7d2-29de-49fb-8d31-49a58f47251d/ueber-die-unisex-toiletten.webp,2026-02-02T11:34:21Z,,Seit Längerem segelt der luxemburgische Bildungsminister Claude Meisch von der liberalen Partei DP gegen die öffentliche Meinung. Mit seinem neuesten Plan hat er auch den christsozialen Koalitionspar… [+3925 chars],,de,'Geschlecht'
https://www.zeit.de/news/2026-02/03/vorsorge-untersuchungen-auch-fuer-jugendliche,https://www.zeit.de/news/2026-02/03/vorsorge-untersuchungen-auch-fuer-jugendliche,0,www.zeit.de,Kinder-Gesundheit: Vorsorge-Untersuchungen auch für Jugendliche,Hier finden Sie Informationen zu dem Thema „Kinder-Gesundheit“. Lesen Sie jetzt „Vorsorge-Untersuchungen auch für Jugendliche“.,https://img.zeit.de/news/2026-02/03/vorsorge-untersuchungen-auch-fuer-jugendliche-image-group/wide__1300x731,2026-02-03T03:00:38Z,,"Das Land Hessen will erreichen, dass mehr Eltern mit ihren Kindern zur Jugendvorsorge-Untersuchung J1 gehen. Um die Teilnahmequote zu steigern, sollen die Familien künftig persönlich eingeladen werde… [+1777 chars]",,de,'Kinder'
https://www.zeit.de/news/2026-02/03/glatteisgefahr-im-westen-eisige-kaelte-im-osten,https://www.zeit.de/news/2026-02/03/glatteisgefahr-im-westen-eisige-kaelte-im-osten,0,www.zeit.de,Wetter: Glatteisgefahr im Westen - eisige Kälte im Osten,Hier finden Sie Informationen zu dem Thema „Wetter“. Lesen Sie jetzt „Glatteisgefahr im Westen - eisige Kälte im Osten“.,https://img.zeit.de/news/2026-02/03/glatteisgefahr-im-westen-eisige-kaelte-im-osten-image-group/wide__1300x731,2026-02-03T03:41:42Z,,"Während die Menschen im Osten und Nordosten mit den eisigen Temperaturen zu kämpfen haben, droht im Westen und Südwesten Deutschlands zur Wochenmitte neue Glatteisgefahr. Am Dienstag fällt dort laut … [+2939 chars]",,de,'Kälte'
https://www.nzz.ch/zuerich/altes-kispi-areal-wird-wohl-noch-jahrelang-leer-stehen-widerstand-im-quartier-ld.1922875,https://www.nzz.ch/zuerich/altes-kispi-areal-wird-wohl-noch-jahrelang-leer-stehen-widerstand-im-quartier-ld.1922875,0,www.nzz.ch,"Weil sich der Bau des Zentrums für Zahnmedizin verzögert, wird das ehemalige Kinderspital jahrelang leer stehen – das sorgt für Kritik im Quartier",Auf dem Areal sind Asylunterkünfte geplant. Andere Nutzungen wären aufwendig.,"https://img.nzz.ch/2024/11/02/3619b258-c511-4cd5-8e09-c270be86da69.jpeg?width=1200&height=674&fit=bounds&quality=75&auto=webp&crop=4418,2485,x0,y230&wmark=nzz",2026-02-03T04:05:00Z,,"Auf dem Areal sind Asylunterkünfte geplant. Andere Nutzungen wären aufwendig.
Das Kinderspital steht leer. Für viele Quartierbewohner ist das eine unbefriedigende Situation.
Am Fuss des Zürichbergs… [+5052 chars]",,de,'öffentliche Gebäude'
https://www.stern.de/politik/deutschland/gas-versorgung-in-deutschland--geht-uns-gerade-der-stoff-aus--37098832.html,https://www.stern.de/politik/deutschland/gas-versorgung-in-deutschland--geht-uns-gerade-der-stoff-aus--37098832.html,0,www.stern.de,Energieversorgung: Ist das Gas bald alle?,"Die Füllstände sinken, der Bibber-Winter dauert an: Rauscht Deutschland in eine Gas-Krise? Alles stabil, betont die Bundesnetzagentur. Doch es gibt auch mahnende Stimmen.",https://image.stern.de/37098932/t/R-/v1/w1440/r1.7778/-/gas-versorgung-in-deutschland--geht-uns-der-stoff-aus-.jpg,2026-02-03T08:08:00Z,,"Kopiere den aktuellen Link
Zur Merkliste hinzufügen
Die Füllstände sinken, der Bibber-Winter dauert an: Rauscht Deutschland in eine Gas-Krise? Alles stabil, betont die Bundesnetzagentur. Doch es gi… [+3141 chars]",,de,'Gas'
https://www.focus.de/panorama/richterin-will-chef-entfuehrer-aufrufen-ploetzlich-ergreift-christina-block-das-wort_7c90a6ab-fdcd-499e-9651-4d43bd9d6199.html,https://www.focus.de/panorama/richterin-will-chef-entfuehrer-aufrufen-ploetzlich-ergreift-christina-block-das-wort_7c90a6ab-fdcd-499e-9651-4d43bd9d6199.html,0,www.focus.de,In Block-Verhandlung kommt erneut der Kronzeuge in die Mangel,Ende April 2025 hatte die Staatsanwaltschaft Hamburg Anklage wegen der mutmaßlichen Entführung der Kinder aus Dänemark in der Nacht zum 1. Januar 2024 erhoben. Alle News zum Block-Prozess im Liveticker.,https://quadro.burda-forward.de/ctf/024f8251-7657-4851-a8f2-43c61f69e15c.c9e58c6e-8393-410f-84dc-153b6fa2af27.jpeg?im=RegionOfInterestCrop%3D%281200%2C630%29%2CregionOfInterest%3D%281430%2C418%29&hash=05055f03c4155a9979393d072fcd12f58626b48624f803c28d7e3b23c6b8935d,2026-02-03T09:56:00Z,,"FOCUS-online-Reporter Niklas Golitschek ist vor Ort beim Prozess in Hamburg.
Wichtige Protagonisten:
<ul><li>Christina Block, Angeklagte (Anwälte Ingo Bott &amp; Paula Wlodarek)</li><li>Stephan Hen… [+190786 chars]",,de,'Kinder'
https://www.zeit.de/politik/2026-02/demokratie-herausforderung-cdu-parteitag-landtagswahlen-nationalismus,https://www.zeit.de/politik/2026-02/demokratie-herausforderung-cdu-parteitag-landtagswahlen-nationalismus,0,www.zeit.de,Demokratische Herausforderungen: Frisst der Nationalismus seine Kinder?,"Der CDU-Parteitag, Grönland und die Landtagswahlen. Wir diskutieren über Herausforderungen für die Demokratie – und darüber, ob die politische Mitte das Jahr überlebt.",https://img.zeit.de/politik/2020-03/podcast-politikteil-illu/wide__5ba8fd__1300x731,2026-02-03T09:57:15Z,,"Was haben der CDU-Parteitag, die Wahl in Baden-Württemberg, Donald Trump und Sven Schulze gemeinsam?
In allen Fällen geht es darum, ob die politische Mitte das Jahr überlebt. 
Kann Manuel Hagel noc… [+932 chars]",,de,'Kinder'
https://www.tagesschau.de/ausland/europa/ukraine-krieg-russland-selenskyj-rutte-nato-100.html,https://www.tagesschau.de/ausland/europa/ukraine-krieg-russland-selenskyj-rutte-nato-100.html,0,www.tagesschau.de,Massive Angriffe auf Energieinfrastruktur bei -20 Grad,Landesweiter Raketenalarm bei eisiger Kälte: Kurz vor weiteren Gesprächen zu einem möglichen Frieden hat Moskau die Ukraine erneut massiv angegriffen. Stunden danach traf NATO-Generalsekretär Rutte zu einem Überraschungsbesuch in Kiew ein.,https://images.tagesschau.de/image/900f6999-93e4-4001-99fb-437c21dccbc4/AAABnCL72Po/AAABmyZE0EA/16x9-big/wohnhaus-kiew-118.jpg?width=1280,2026-02-03T10:56:10Z,,"Stand: 03.02.2026 11:56 Uhr
Landesweiter Raketenalarm bei eisiger Kälte: Kurz vor weiteren Gesprächen zu einem möglichen Frieden hat Moskau die Ukraine erneut massiv angegriffen. Stunden danach traf… [+3830 chars]",,de,'Kälte'
https://www.zeit.de/news/2026-02/03/nach-tod-in-gartenlaube-gas-vergiftung-bestaetigt,https://www.zeit.de/news/2026-02/03/nach-tod-in-gartenlaube-gas-vergiftung-bestaetigt,0,www.zeit.de,Kohlenstoffmonoxid: Nach Tod in Gartenlaube: Gas-Vergiftung bestätigt,Hier finden Sie Informationen zu dem Thema „Kohlenstoffmonoxid“. Lesen Sie jetzt „Nach Tod in Gartenlaube: Gas-Vergiftung bestätigt“.,https://img.zeit.de/news/2026-02/03/nach-tod-in-gartenlaube-gas-vergiftung-bestaetigt-image-group/wide__1300x731,2026-02-03T13:26:43Z,,Nach dem Tod von zwei Menschen in einer Kleingartenanlage in Schwedt/Oder hat sich der Verdacht einer Kohlenstoffmonoxid-Vergiftung als Todesursache bestätigt. Die Untersuchung der Toten habe das erg… [+626 chars],,de,'Kohle'
https://www.tagesspiegel.de/berlin/kohlenstoffmonoxid-nach-tod-in-gartenlaube-gas-vergiftung-bestatigt-15212997.html,https://www.tagesspiegel.de/berlin/kohlenstoffmonoxid-nach-tod-in-gartenlaube-gas-vergiftung-bestatigt-15212997.html,0,www.tagesspiegel.de,Kohlenstoffmonoxid: Nach Tod in Gartenlaube: Gas-Vergiftung bestätigt,Vor einigen Wochen wurden zwei Menschen tot in einer Gartenlaube in Schwedt gefunden. Nun steht die Todesursache fest.,https://www.tagesspiegel.de/images/15212996/alternates/BASE_16_9_W1400/1770125569000/polizei-symbolbild.jpeg,2026-02-03T13:32:49Z,,Nach dem Tod von zwei Menschen in einer Kleingartenanlage in Schwedt/Oder hat sich der Verdacht einer Kohlenstoffmonoxid-Vergiftung als Todesursache bestätigt. Die Untersuchung der Toten habe das erg… [+678 chars],,de,'Kohle'
https://www.zeit.de/news/2026-02/03/thueringer-gasspeicher-zu-rund-37-prozent-gefuellt,https://www.zeit.de/news/2026-02/03/thueringer-gasspeicher-zu-rund-37-prozent-gefuellt,0,www.zeit.de,Energiereserven: Thüringer Gasspeicher zu rund 37 Prozent gefüllt,Hier finden Sie Informationen zu dem Thema „Energiereserven“. Lesen Sie jetzt „Thüringer Gasspeicher zu rund 37 Prozent gefüllt“.,https://img.zeit.de/news/2026-02/03/thueringer-gasspeicher-zu-rund-37-prozent-gefuellt-image-group/wide__1300x731,2026-02-03T14:10:23Z,,Thüringens Erdgasspeicher sind aktuell zu rund 37 Prozent gefüllt. Die benachbarten unterirdischen Gasspeicher in Allmenhausen (Kyffhäuserkreis) und Kirchheilingen (Unstrut-Hainich-Kreis) beherbergen… [+1815 chars],,de,'Gas'
https://www.stern.de/gesellschaft/regional/thueringen/sanierungsplaene--wer-traut-sich-ans-haus-von-goethes-freundin--37102774.html,https://www.stern.de/gesellschaft/regional/thueringen/sanierungsplaene--wer-traut-sich-ans-haus-von-goethes-freundin--37102774.html,0,www.stern.de,Sanierungspläne: Wer traut sich ans Haus von Goethes Freundin?,"Etliche Jahre und einen juristischen Marathon hat es gebraucht, damit das denkmalgeschützte Gebäude wieder der Stadt gehört. Nun sucht Weimar Interessenten für Sanierung und Betrieb.",https://image.stern.de/37102776/t/-W/v1/w1440/r1.7778/-/03--6ozragxgvyv10axs2048jpeg---68d17a0c67ced75b.jpg,2026-02-03T14:22:38Z,,"Kopiere den aktuellen Link
Zur Merkliste hinzufügen
Etliche Jahre und einen juristischen Marathon hat es gebraucht, damit das denkmalgeschützte Gebäude wieder der Stadt gehört. Nun sucht Weimar Int… [+1765 chars]",,de,'Sanierung'
https://www.zeit.de/news/2026-02/03/wer-traut-sich-ans-haus-von-goethes-freundin,https://www.zeit.de/news/2026-02/03/wer-traut-sich-ans-haus-von-goethes-freundin,0,www.zeit.de,Sanierungspläne: Wer traut sich ans Haus von Goethes Freundin?,Hier finden Sie Informationen zu dem Thema „Sanierungspläne“. Lesen Sie jetzt „Wer traut sich ans Haus von Goethes Freundin?“.,https://img.zeit.de/news/2026-02/03/wer-traut-sich-ans-haus-von-goethes-freundin-image-group/wide__1300x731,2026-02-03T14:22:38Z,,"Die Stadt Weimar sucht Konzepte für die Sanierung und den späteren Betrieb des historischen Hauses der Frau von Stein. Interessenten sind demnach aufgerufen, bis zum 16. März entsprechende Vorschläge… [+1567 chars]",,de,'Sanierung'
https://www.zeit.de/news/2026-02/03/grippe-und-magen-darm-krankenhaeuser-verhaengen-besuchssperre,https://www.zeit.de/news/2026-02/03/grippe-und-magen-darm-krankenhaeuser-verhaengen-besuchssperre,0,www.zeit.de,Virusinfektionen: Grippe und Magen-Darm: Krankenhäuser verhängen Besuchssperre,Hier finden Sie Informationen zu dem Thema „Virusinfektionen“. Lesen Sie jetzt „Grippe und Magen-Darm: Krankenhäuser verhängen Besuchssperre“.,https://img.zeit.de/news/2026-02/03/grippe-und-magen-darm-krankenhaeuser-verhaengen-besuchssperre-image-group/wide__1300x731,2026-02-03T15:17:11Z,,Kleine Krankenhäuser im Südosten Brandenburgs haben aufgrund vieler Virusinfektionen ein vorübergehendes Besuchsverbot verhängt. In der Lausitz Klinik Forst (Spree-Neiße-Kreis) gilt zum Schutz von Pe… [+1009 chars],,de,'Grippe'
https://taz.de/Gasbohrungen-vor-Borkum/!6150834/,https://taz.de/Gasbohrungen-vor-Borkum/!6150834/,0,taz.de,Gasbohrungen vor Borkum: Der Ministerpräsident und die Gas-Lobby,"Neue Runde im Tauziehen um die Bohrungen vor Borkum: Umweltverbände werfen Olaf Lies (SPD) vor, sich mit dem Gasförderer gemein zu machen.",https://taz.de/picture/8227121/1200/406821904.jpeg,2026-02-03T16:44:00Z,,"Neue Runde im Tauziehen um die Bohrungen vor Borkum: Umweltverbände werfen Olaf Lies (SPD) vor, sich mit dem Gasförderer gemein zu machen. mehr...",,de,'Gas'
https://www.faz.net/aktuell/politik/putins-kaelte-terror-gegen-die-ukraine-warum-noch-reden-110830729.html,https://www.faz.net/aktuell/politik/putins-kaelte-terror-gegen-die-ukraine-warum-noch-reden-110830729.html,0,www.faz.net,Angriffe bei Kälte: Der Kreml will die Ukrainer brechen,Gespräche mit dem russischen Regime sind selbst angesichts des Terrors gegen frierende Zivilisten nicht sinnlos. Aber sie müssten von stärkerem Druck begleitet werden.,https://media0.faz.net/image/w1200h627/c8f14cda66af/w3000h1567x0y216o/022026/1.10830720/menschen-in-kiew-suchen-am.webp,2026-02-03T17:35:24Z,,"In Russland regieren Verbrecher. Wie anders will man die Männer nennen, die bei dauerhaft zweistelligen Minustemperaturen die zivile Energieinfrastruktur von Millionenstädten wie Kiew und Charkiw bes… [+1791 chars]",,de,'Kälte'
https://www.bild.de/regional/berlin/gunnar-schupelius-deutsches-historisches-museum-bleibt-zu-698205456f72c99c11b1a8f4,https://www.bild.de/regional/berlin/gunnar-schupelius-deutsches-historisches-museum-bleibt-zu-698205456f72c99c11b1a8f4,0,www.bild.de,Gunnar Schupelius – Mein Ärger - Deutsches Historisches Museum bleibt zu,"Die Sanierung sollte Ende 2025 abgeschlossen sein, hat aber noch gar nicht begonnen. Es ist ein unfassbares Versagen zweier Bundesbehörden.","https://images.bild.de/698205456f72c99c11b1a8f4/65ba9eec4906f7da685141220f7b0f0f,f992f163?w=1280",2026-02-03T17:36:02Z,,"TTS-Player überspringenArtikel weiterlesenBerlin Die Sanierung sollte Ende 2025 abgeschlossen sein, hat aber noch gar nicht begonnen. Es ist ein unfassbares Versagen zweier Bundesbehörden.
Das Deuts… [+1670 chars]",,de,'Sanierung'
https://www.faz.net/aktuell/wirtschaft/mehr-wirtschaft/sinkende-oeleinnahmen-russlands-haushaltsnoete-wachsen-110830710.html,https://www.faz.net/aktuell/wirtschaft/mehr-wirtschaft/sinkende-oeleinnahmen-russlands-haushaltsnoete-wachsen-110830710.html,0,www.faz.net,Sinkende Öleinnahmen: Russlands Haushaltsnöte wachsen,Der Kreml verdient immer weniger Geld mit dem Öl- und Gasverkauf. Nun droht mit Indien einer der wichtigsten verbliebenen Kunden wegzubrechen.,https://media0.faz.net/image/w1200h627/3fbbb9e26ff4/w3000h1567x0y159o/022025/1.10830707/eine-nicht-unkomplizierte.webp,2026-02-03T18:10:21Z,,Schon das vergangene Jahr war kein gutes für den russischen Haushalt. Um knapp 24 Prozent brachen die Öl- und Gaseinnahmen im Vergleich zu 2024 ein. Dieses Jahr könnte sich die Lage noch einmal versc… [+6683 chars],,de,'Gas'
https://www.n-tv.de/politik/Es-geht-um-mehr-als-nur-um-Oel-und-Gas-id30320800.html,https://www.n-tv.de/politik/Es-geht-um-mehr-als-nur-um-Oel-und-Gas-id30320800.html,0,www.n-tv.de,"SPD lobt Merz' Golfstaaten-Reise: ""Es geht um mehr als nur um Öl und Gas""","Bundeskanzler Merz fliegt in die Golfregion, besucht Saudi-Arabien, Katar und die Vereinigten Emirate. Koalitionspartner SPD lobt seine ""realistische Außenpolitik"". Außenpolitiker Ahmetovic erklärt, es würden künftig auch ""Dinge passieren, die nicht sofort be…",https://www.n-tv.de/img/30320862/1770143960/Img_16_9/1200/Bundeskanzler-Friedrich-Merz-CDU-r-steht-gegenueber-von-Scheich-Tamim-bin-Hamad-bin-Khalifa-Al-Thani-Emir-von-Katar-vor-einem-bilateralen-Gespraech-beim-Gaza-Gipfel-unter-Vorsitz-von-Aegyptens-Praesident-al-Sisi-mit-Beteiligung-von-US-Praesident-Trump-Bei-dem-Treffen-von-Staats-und-Regierungschefs-soll-die-Unterstuetzung-fuer-den-Gaza-Streifen-nach-dem-Waffenstillstand-zwischen-Israel-und-der-Hamas-beraten-werden.jpg,2026-02-03T18:33:45Z,,"Der Hannoveraner Adis Ahmetovic sitzt seit 2021 für die SPD im Bundestag und ist außenpolitischer Sprecher der Fraktion. 
Bundeskanzler Merz fliegt in die Golfregion, besucht Saudi-Arabien, Katar un… [+8992 chars]",,de,'Gas'
https://www.welt.de/wirtschaft/article6982461e48913c228139486c/deutsche-bahn-muessen-mit-jahrzehnt-der-sanierungen-rechnen-hunderte-stellwerke-nicht-digitalisierungsfaehig.html,https://www.welt.de/wirtschaft/article6982461e48913c228139486c/deutsche-bahn-muessen-mit-jahrzehnt-der-sanierungen-rechnen-hunderte-stellwerke-nicht-digitalisierungsfaehig.html,0,www.welt.de,„Jahrzehnt der Sanierungen“ – Hunderte Stellwerke können nicht digitalisiert werden,"Der Chef der Bahn-Infrastrukturtochter DB InfraGo, Philipp Nagl, erwartet trotz zusätzlicher Bundesmittel einen langen Weg aus der Krise. Die Sanierung des maroden Schienennetzes werde etwa ein Jahrzehnt dauern – auch weil Stellwerke oft noch mit Seilzügen fu…",https://images.welt.de/6982461e48913c228139486c/e7d1e40e8b604db8fe9bb31e57f30ff7-master/ci16x9-w1200/558540044-jpg,2026-02-03T23:10:08Z,,Trotz der Milliarden aus dem Infrastruktur-Sondervermögen wird sich der schlechte Zustand des Schienennetzes nach Einschätzung von DB InfraGo-Chef Philipp Nagl nur langsam verbessern. Wir müssen mit … [+1458 chars],,de,'Sanierung'
https://www.zeit.de/news/2026-02/04/berlin-oeffnet-tueren-orte-zum-aufwaermen,https://www.zeit.de/news/2026-02/04/berlin-oeffnet-tueren-orte-zum-aufwaermen,0,www.zeit.de,Kälte: Berlin öffnet Türen: Orte zum Aufwärmen,Hier finden Sie Informationen zu dem Thema „Kälte“. Lesen Sie jetzt „Berlin öffnet Türen: Orte zum Aufwärmen“.,https://img.zeit.de/news/2026-02/04/berlin-oeffnet-tueren-orte-zum-aufwaermen-image-group/wide__1300x731,2026-02-04T04:00:12Z,,"Der Kälte für ein paar Stunden entkommen, sich ein wenig aufwärmen und das alles, ohne Geld auszugeben: Das ist in Berlin an vielen Orten möglich. 
Zum Beispiel in den beiden Standorten der Zentral-… [+1085 chars]",,de,'Kälte'
https://www.bild.de/sport/fussball/deutscher-fussball-atmet-auf-kohle-urteil-bei-fortuna-duesseldorf-gefallen-69821f5048913c2281394609,https://www.bild.de/sport/fussball/deutscher-fussball-atmet-auf-kohle-urteil-bei-fortuna-duesseldorf-gefallen-69821f5048913c2281394609,0,www.bild.de,Es geht um Corona-Hilfen - Deutscher Fußball atmet nach Kohle-Urteil auf,"Jetzt ist klar, ob Fortuna Düsseldorf Corona-Überbrückungshilfen zurückzahlen muss oder nicht. Andere Klubs aus der Bundesliga und 2. Liga betrifft das auch.","https://images.bild.de/69821f5048913c2281394609/2e2da3fc2f5e0ee212ea1e048d918532,e71fc8bc?w=1280",2026-02-04T05:00:47Z,,"Seit Ende 2023 steckt Fortuna Düsseldorf in einem Streit um Corona-Überbrückungshilfen, die zurückgezahlt werden sollten. Bei BILDplus erfahren Sie, wie der nun ausgegangen ist und was das für Folgen… [+21 chars]",,de,'Kohle'
https://www.zeit.de/news/2026-02/04/winterwetter-legt-teile-des-bahn-fernverkehrs-lahm,https://www.zeit.de/news/2026-02/04/winterwetter-legt-teile-des-bahn-fernverkehrs-lahm,0,www.zeit.de,"Schnee, Eis, Kälte: Winterwetter legt Teile des Bahn-Fernverkehrs lahm","Hier finden Sie Informationen zu dem Thema „Schnee, Eis, Kälte“. Lesen Sie jetzt „Winterwetter legt Teile des Bahn-Fernverkehrs lahm“.",https://img.zeit.de/news/2026-02/04/winterwetter-legt-teile-des-bahn-fernverkehrs-lahm-image-group/wide__1300x731,2026-02-04T08:11:13Z,,"Das Winterwetter sorgt im Fernverkehr der Deutschen Bahn zwischen Berlin und Hannover am Morgen für zahlreiche Ausfälle. Wie die Bahn online mitteilte, fällt unter anderem der ICE-Sprinter zwischen B… [+338 chars]",,de,'Kälte'
https://www.stern.de/news/-jahrzehnt-der-sanierungen---bahnnetz-chef-erwartet-schrittweise-verbesserung-37104768.html,https://www.stern.de/news/-jahrzehnt-der-sanierungen---bahnnetz-chef-erwartet-schrittweise-verbesserung-37104768.html,0,www.stern.de,"""Jahrzehnt der Sanierungen"": Bahnnetz-Chef erwartet schrittweise Verbesserung","Der schlechte Zustand des deutschen Schienennetzes wird sich nach Einschätzung des Chefs der Infrastruktursparte DB Infrago, Philipp Nagl, in den kommenden Jahren verbessern - allerdings nur schrittweise. ""Wir müssen mit einem Jahrzehnt der Sanierungen rechne…",https://image.stern.de/37104770/t/26/v1/w1440/r1.7778/-/04--ice-der-deutschen-bahn-in-berlin---c55f593da16fe9ca.jpg,2026-02-04T08:54:25Z,,"Kopiere den aktuellen Link
Zur Merkliste hinzufügen
Der schlechte Zustand des deutschen Schienennetzes wird sich nach Einschätzung des Chefs der Infrastruktursparte DB Infrago, Philipp Nagl, in den… [+1737 chars]",,de,'Sanierung'
https://www.bild.de/sport/fussball/2-liga-fortuna-duesseldorf-hat-corona-kohle-schon-vergoldet-698228f106b45afdb339c430,https://www.bild.de/sport/fussball/2-liga-fortuna-duesseldorf-hat-corona-kohle-schon-vergoldet-698228f106b45afdb339c430,0,www.bild.de,"1,7 Mio. Euro zum Großteil weg - Fortuna hat Corona-Kohle schon vergoldet","Fortuna Düsseldorf darf 1,7 Mio. Euro Corona-Überbrückungshilfen behalten - und hat einen Großteil schon für Top-Transfer Satoshi Tanaka gut angelegt.","https://images.bild.de/698228f106b45afdb339c430/04205a8e0bc41ca01f4b1a9d1e9acb4d,9792fae7?w=1280",2026-02-04T10:00:51Z,,"TTS-Player überspringenArtikel weiterlesenWas BILD am Mittwochmorgen berichtet hatte, ist nun auch offiziell: Fortuna darf 1,7 Millionen Euro Corona-Überbrückungshilfen behalten und das Geld, das der… [+1798 chars]",,de,'Kohle'
