index,url,valid,domain,title,description,image,published,archive,content,quote,language,keyword
https://stadt-bremerhaven.de/google-entwickelt-offenbar-gemini-version-fuer-kinder/,https://stadt-bremerhaven.de/google-entwickelt-offenbar-gemini-version-fuer-kinder/,0,stadt-bremerhaven.de,Google entwickelt offenbar Gemini-Version für Kinder,"Google arbeitet laut Bericht derzeit an einer speziellen Version seiner KI-Plattform Gemini, die sich gezielt an Kinder richtet. Diese Information stammt aus einer APK-Analyse der Google-App (Version 16.12.39), bei der entsprechende Code-Fragmente entdeckt wu…",https://stadt-bremerhaven.de/wp-content/uploads/2025/04/google-gemini.jpg,2025-04-01T15:30:25Z,,"Google arbeitet laut Bericht derzeit an einer speziellen Version seiner KI-Plattform Gemini, die sich gezielt an Kinder richtet. Diese Information stammt aus einer APK-Analyse der Google-App (Version… [+1626 chars]",,de,'Kinder'
https://www.stern.de/gesellschaft/regional/baden-wuerttemberg/verkehrsministerkonferenz--baden-wuerttemberg-will-ausgleich-bei-hohen-co-2-preisen-35604650.html,https://www.stern.de/gesellschaft/regional/baden-wuerttemberg/verkehrsministerkonferenz--baden-wuerttemberg-will-ausgleich-bei-hohen-co-2-preisen-35604650.html,0,www.stern.de,Verkehrsministerkonferenz: Baden-Württemberg will Ausgleich bei hohen CO-2-Preisen,"2027 könnten die Preise für Benzin, Öl und Gas wegen Änderungen bei CO-2-Emissionspreisen deutlich steigen. Baden-Württemberg fordert den Bund nun auf, das mit EU-Geldern für Härtefälle abzufedern.",https://image.stern.de/35604652/t/-0/v1/w1440/r1.7778/-/02--7u4p7irnggv20axs2048jpeg---1dc99f676d35b591.jpg,2025-04-02T01:30:42Z,,"Kopiere den aktuellen Link
Zur Merkliste hinzufügen
2027 könnten die Preise für Benzin, Öl und Gas wegen Änderungen bei CO-2-Emissionspreisen deutlich steigen. Baden-Württemberg fordert den Bund nu… [+1890 chars]",,de,'Heizkosten'
https://www.zeit.de/news/2025-04/02/gashaendler-vng-erzielt-starkes-ergebnis-trotz-unsicherheiten,https://www.zeit.de/news/2025-04/02/gashaendler-vng-erzielt-starkes-ergebnis-trotz-unsicherheiten,0,www.zeit.de,Energie: Gashändler VNG erzielt starkes Ergebnis trotz Unsicherheiten,Hier finden Sie Informationen zu dem Thema „Energie“. Lesen Sie jetzt „Gashändler VNG erzielt starkes Ergebnis trotz Unsicherheiten“.,https://img.zeit.de/news/2025-04/02/gashaendler-vng-erzielt-starkes-ergebnis-trotz-unsicherheiten-image-group/wide__1300x731,2025-04-02T12:17:02Z,,Der Leipziger Gasgroßhändler VNG hat das Geschäftsjahr 2024 trotz schwieriger politischer Rahmenbedingungen mit einem starken Ergebnis abgeschlossen. Das bereinigte operative Ergebnis vor Zinsen und … [+2362 chars],,de,'Gas'
https://www.tagesspiegel.de/sport/schwangerschaft-und-sport-norwegens-fussallliga-mit-historischer-mutterschutzregel-13475392.html,https://www.tagesspiegel.de/sport/schwangerschaft-und-sport-norwegens-fussallliga-mit-historischer-mutterschutzregel-13475392.html,0,www.tagesspiegel.de,Schwangerschaft und Sport: Norwegens Fußallliga mit „historischer“ Mutterschutzregel,"Die norwegische Liga will mit einer neuen Regel dafür sorgen, dass Familie und Spitzenfußball besser vereinbar werden. Schwangere Spielerinnen erhalten automatisch einen neuen Vertrag.",,2025-04-02T13:03:31Z,,"Die höchste norwegische Fußballliga stärkt ihre Regeln zum Mutterschutz. Spielerinnen, die sich vor Ablauf ihres Vertrages in der zwölften Schwangerschaftswoche befinden, sollen automatisch eine Vert… [+1954 chars]",,de,'Schwangere'
https://www.zeit.de/gesellschaft/2025-04/ermittlungen-achim-lippoth-untersuchungshaft-verbrechen-videopodcast,https://www.zeit.de/gesellschaft/2025-04/ermittlungen-achim-lippoth-untersuchungshaft-verbrechen-videopodcast,0,www.zeit.de,"Ermittlungen gegen Achim Lippoth: ""Höchstgradig manipulativ""","Der Fotograf Achim Lippoth soll jahrzehntelang Kinder missbraucht haben. Nachdem lange nichts passiert ist, wird doch gegen ihn ermittelt.",https://img.zeit.de/gesellschaft/2025-04/ermittlungen-achim-lippoth-untersuchungshaft-verbrechen-videopodcast-foto/wide__1300x731,2025-04-03T11:22:53Z,http://archive.md/20250403120434/https://www.zeit.de/gesellschaft/2025-04/ermittlungen-achim-lippoth-untersuchungshaft-verbrechen-videopodcast,"2021 geht ein mutmaßliches Opfer von Kinderfotograf Achim Lippoth zur Polizei. Lippoth muss in Untersuchungshaft und weitere mutmaßliche Geschädigte werden gesucht. 
Wie ging es weiter? Und wer war … [+424 chars]",,de,'Kinder'
https://www.zeit.de/news/2025-04/03/vater-meldet-kinder-fuer-israel-trip-krank,https://www.zeit.de/news/2025-04/03/vater-meldet-kinder-fuer-israel-trip-krank,0,www.zeit.de,Schule: Vater meldet Kinder für Israel-Trip krank,Hier finden Sie Informationen zu dem Thema „Schule“. Lesen Sie jetzt „Vater meldet Kinder für Israel-Trip krank“.,https://img.zeit.de/news/2025-04/03/vater-meldet-kinder-fuer-israel-trip-krank-image-group/wide__1300x731,2025-04-03T12:38:52Z,,"Weil er mit seinen schulpflichtigen Kindern einen Kurztrip nach Israel machen wollte, muss ein Vater jetzt mit einem Bußgeld rechnen. Der 35-Jährige war nach Polizeiangaben zusammen mit seinen 13 und… [+579 chars]",,de,'Kinder'
https://www.tagesspiegel.de/wirtschaft/klagefristen-urteil-starkt-sonderkundigungsschutz-fur-schwangere-13485010.html,https://www.tagesspiegel.de/wirtschaft/klagefristen-urteil-starkt-sonderkundigungsschutz-fur-schwangere-13485010.html,0,www.tagesspiegel.de,Klagefristen: Urteil stärkt Sonderkündigungsschutz für Schwangere,"Schwangeren darf nicht gekündigt werden. Doch was ist, wenn die Frau erst nach ihrem Rauswurf von der zu diesem Zeitpunkt bereits bestehenden Schwangerschaft erfährt und verspätet klagt?",https://www.tagesspiegel.de/images/13485007/alternates/BASE_16_9_W1400/1743695956000/bundesarbeitsgericht.jpeg,2025-04-03T15:59:16Z,,"Für Schwangere gelten laut einem Urteil des Bundesarbeitsgerichts längere Fristen bei Kündigungsschutzklagen. Klagen seien auf Antrag nachträglich dann zulässig, wenn eine Frau schuldlos von ihrer zu… [+1988 chars]",,de,'Schwangere'
