index,url,valid,domain,title,description,image,published,archive,content,quote,language,keyword
https://www.stern.de/wirtschaft/energie-sparen-im-alltag--so-klappt-es-2025-am-besten-33096664.html,https://www.stern.de/wirtschaft/energie-sparen-im-alltag--so-klappt-es-2025-am-besten-33096664.html,0,www.stern.de,Tipps und Tricks: Energiesparen im Alltag: So schonen Sie Ihren Geldbeutel,"Strom und Heizkosten sind hoch – ebenfalls die Angst vor leeren Energiespeichern. Höchste Zeit, sich über Energiesparen im Alltag Gedanken zu machen. Der stern verrät ein paar Tipps.",https://image.stern.de/33096688/t/7q/v2/w1440/r1.7778/-/energiesparen.jpg,2025-01-07T14:50:00Z,,"Kopiere den aktuellen Link
Strom und Heizkosten sind hoch ebenfalls die Angst vor leeren Energiespeichern. Höchste Zeit, sich über Energiesparen im Alltag Gedanken zu machen. Der stern verrät ein pa… [+3352 chars]",,de,'Heizkosten'
https://www.focus.de/gesundheit/news/humane-metapneumoviren-wie-gefaehrlich-hmpv-ist-das-sollten-sie-ueber-das-virus-wissen_id_260613933.html,https://www.focus.de/gesundheit/news/humane-metapneumoviren-wie-gefaehrlich-hmpv-ist-das-sollten-sie-ueber-das-virus-wissen_id_260613933.html,0,www.focus.de,Humane Metapneumoviren - Volle Kliniken in China: So hoch ist die Gefahr durch hMPV in Deutschland,"Das humane Metapneumovirus, kurz hMPV, breitet sich derzeit aus, vor allem in China. Der Erreger führt zu Beschwerden, die denen einer Grippe ähneln. FOCUS online erklärt die Lage in Deutschland und wer besonders gefährdet ist.",https://p6.focus.de/img/fotos/id_260614618/humanemetapneumoviren.jpg?im=Crop%3D%280%2C60%2C2047%2C1022%29%3BResize%3D%281200%2C627%29&impolicy=perceptual&quality=mediumHigh&hash=ef0d71a86e92b7f3fac90294e2fb8399e9b9b7bda0c9abee8e2ae8ec6fe12e5b,2025-01-07T14:55:18Z,,"Das humane Metapneumovirus, kurz hMPV, breitet sich derzeit aus, vor allem in China. Der Erreger führt zu Beschwerden, die denen einer Grippe ähneln. FOCUS online erklärt die Lage in Deutschland und … [+5341 chars]",,de,'Grippe'
https://www.autobild.de/artikel/smartes-heizkoerperthermostat-aqara-e1-srts-a01-amazon-angebot-27788987.html,https://www.autobild.de/artikel/smartes-heizkoerperthermostat-aqara-e1-srts-a01-amazon-angebot-27788987.html,0,www.autobild.de,Aqara-Heizkörperthermostat E1 mit Zigbee 3.0 zum heißen Preis,"Wenn Sie Ihre Heizkosten senken möchten, dann setzen Sie auf smarte Heizkörperthermostate. Bei Amazon ist aktuell der populäre Heizkörperregler Aqara E1 zum Sparpreis im Angebot.",https://i.auto-bild.de/ir_img/3/8/8/1/0/9/9/Amazon-Angebot--Beliebtes-Aqara-Heizkoerperthermostat-E1-mit-Zigbee-3-0-zum-2869-2048x1152-5dbf3f05335d397b.jpg?impolicy=og_images,2025-01-07T16:00:00Z,,"Amazon Prime 30 Tage kostenlos testen
statt 8,99 EUR
0,00 EUR",,de,'Heizkosten'
https://www.zeit.de/zeit-magazin/leben/2025-01/doppelleben-ehe-scheidung-kinder-psychologe,https://www.zeit.de/zeit-magazin/leben/2025-01/doppelleben-ehe-scheidung-kinder-psychologe,0,www.zeit.de,"Doppelleben in der Ehe: ""Man will den gut verdienenden Ehemann nicht aufgeben""","Ein Seitensprung? Scheidungsanwältin Helene Klaar erklärt, warum Menschen darauf unterschiedlich reagieren. Und wie Frauen trotz kleiner Kinder ein Doppelleben führen.",https://img.zeit.de/zeit-magazin/leben/2024-11/doppelleben-ehe-scheidung-kinder-psychologe-bild/wide__1300x731,2025-01-07T16:10:33Z,http://archive.md/20250107161440/https://www.zeit.de/zeit-magazin/leben/2025-01/doppelleben-ehe-scheidung-kinder-psychologe,"Seit fünf Jahrzehnten vertritt die bekannte Wiener
Anwältin Dr. Helene Klaar Menschen, die sich scheiden lassen wollen. Heute
wollen wir von ihr wissen:Wie lange ist so ein Doppelleben durchzuhalte… [+1305 chars]",,de,'Kinder'
https://www.rostock-heute.de/frachter-lingeborg-blackout-manoevrierunfaehig/122711,https://www.rostock-heute.de/frachter-lingeborg-blackout-manoevrierunfaehig/122711,0,www.rostock-heute.de,Nach einem Blackout lag das Frachtschiff „Lingeborg“ heute Mittag manövrierunfähig im Warnow-Fahrwasser bei Rostock – zwei Schlepper brachten den Havaristen in den Überseehafen.,"Heute Mittag (07.01.2025, 12:04 Uhr) erhielt die Wasserschutzpolizeiinspektion (WSPI) Rostock von der Verkehrszentrale Rostock die Meldung, dass ein Frachter im Fahrwasser der Unterwarnow einen Maschinenausfall hat. Der Kapitän des 122 Meter langen Frachters …",https://www.rostock-heute.de/wp-content/uploads/2025/01/Frachter_Blackout_Manoevrierunfaehig_Warnow_Fahrwasser-1200x800.jpg,2025-01-07T16:32:00Z,,"7. Januar 2025 Frachter nach Blackout manövrierunfähig im Fahrwasser
Heute Mittag (07.01.2025, 12:04 Uhr) erhielt die Wasserschutzpolizeiinspektion (WSPI) Rostock von der Verkehrszentrale Rostock di… [+1883 chars]",,de,'Blackout'
https://www.bild.de/leben-wissen/wissenschaft/klima-angst-bei-kindern-schulbuecher-foerdern-katastrophendenken-67693304de8d7c116225dbc1,https://www.bild.de/leben-wissen/wissenschaft/klima-angst-bei-kindern-schulbuecher-foerdern-katastrophendenken-67693304de8d7c116225dbc1,0,www.bild.de,Nachweislich falsche Darstellungen - So werden in Schulbüchern Klima-Fakten verzerrt,"Kinder und Jugendliche leiden unter Klima-Angst, während Medien und Schulbücher weiterhin katastrophale Darstellungen des Klimawandels verbreiten.","https://images.bild.de/67693304de8d7c116225dbc1/0de17ef4de8d08a6a047d0b299c3acfb,1e9e44f4?w=1280",2025-01-08T03:56:46Z,http://archive.md/20250108060826/https://www.bild.de/leben-wissen/wissenschaft/klima-angst-bei-kindern-schulbuecher-foerdern-katastrophendenken-67693304de8d7c116225dbc1,"In Hörspielen, im Theater und im Fernsehen wird Kindern klimabedingter Weltuntergang eingebläut. 
In einem Werbefilm, verbreitet von Fridays for Future, wimmert ein Kind, als der Vater es ins Bett b… [+9739 chars]",,de,'Obdachlosigkeit'
https://www.nzz.ch/meinung/die-renaissance-der-kernenergie-ld.1861744,https://www.nzz.ch/meinung/die-renaissance-der-kernenergie-ld.1861744,0,www.nzz.ch,GASTKOMMENTAR - Die Renaissance der Kernenergie,"Seit der Energiewende von 2011 wird die Kernkraft in der Schweiz oft als «Technologie von gestern» abgetan. Doch die globale Entwicklung erzählt eine andere Geschichte. Die Blackout-Initiative wird dem Volk die Möglichkeit geben, über die Kernenergie erneut a…","https://img.nzz.ch/2024/12/06/7b3e175c-f1ba-45fa-8633-eac9410864a0.jpeg?width=1200&height=675&fit=bounds&quality=75&auto=webp&crop=7680,4320,x0,y0&wmark=nzz",2025-01-08T04:30:00Z,http://archive.md/20250108115638/https://www.nzz.ch/meinung/die-renaissance-der-kernenergie-ld.1861744,"Die Axpo hat kürzlich angekündigt, Beznau 1 noch bis 2033 in Betrieb zu lassen.
Im Ausland, insbesondere in den USA, hat sich eine regelrechte Renaissance der Kernenergie entfaltet. Bereits letztes … [+5213 chars]",,de,'Blackout'
https://www.focus.de/panorama/welt/schueler-frieren-bei-arktischen-temperaturen-im-klassenzimmer-eltern-greifen-stadt-an_5f614525-6f72-4c9b-9d22-96e91aca8ae7.html,https://www.focus.de/panorama/welt/schueler-frieren-bei-arktischen-temperaturen-im-klassenzimmer-eltern-greifen-stadt-an_5f614525-6f72-4c9b-9d22-96e91aca8ae7.html,0,www.focus.de,"Unterricht in Winterjacke - Schüler frieren bei „arktischen Temperaturen“ im Klassenzimmer, Eltern greifen Stadt an",Nach den Ferien fiel die Heizung am Luitpold-Gymnasium in München aus. Die Schüler mussten sich mit Winterkleidung vor der „arktischen“ Kälte schützen.,https://quadro.burda-forward.de/ctf/0b9161fb-1db0-4040-bd5d-48a834f1304d.9fd1b53e-80fc-4782-ae3e-34dd69e692b9.jpg?im=RegionOfInterestCrop%3D%281200%2C630%29%2CregionOfInterest%3D%28634%2C603%29&hash=bbfaffdab926a65a3d1f37fada9fb802674d46fdd5c1a8086b7481ea17b5ed22,2025-01-08T10:32:00Z,,"Nach den Weihnachtsferien fiel nach Informationen der tz die Heizung im Luitpold-Gymnasium in München aus. Schüler mussten am Dienstag mit Winterkleidung im Unterricht sitzen, um sich vor der Kälte z… [+2801 chars]",,de,'Kälte'
https://www.zeit.de/news/2025-01/08/zwei-kinder-in-leipzig-bei-unfaellen-verletzt,https://www.zeit.de/news/2025-01/08/zwei-kinder-in-leipzig-bei-unfaellen-verletzt,0,www.zeit.de,Verkehr: Zwei Kinder in Leipzig bei Unfällen verletzt,Hier finden Sie Informationen zu dem Thema „Verkehr“. Lesen Sie jetzt „Zwei Kinder in Leipzig bei Unfällen verletzt“.,https://img.zeit.de/news/2025-01/08/zwei-kinder-in-leipzig-bei-unfaellen-verletzt-image-group/wide__1300x731,2025-01-08T10:43:01Z,,"Zwei Kinder sind bei Verkehrsunfällen in Leipzig verletzt worden, eines davon schwer. Nach Polizeiangaben war eine Neunjährige am Dienstag bei Rot über die Ampel gegangen und von einem Auto erfasst w… [+291 chars]",,de,'Kinder'
https://www.zeit.de/2025/01/fernwaerme-hamburg-umwelt-klimaschutz-waermewende,https://www.zeit.de/2025/01/fernwaerme-hamburg-umwelt-klimaschutz-waermewende,0,www.zeit.de,Fernwärme in Hamburg: Jetzt beginnt die heiße Phase,In Hamburg werden viele allein durch ihre Heizung zu Klimasündern. Ein Großteil der Fernwärme wird noch mit Kohle erzeugt. Das soll sich nun ändern.,https://img.zeit.de/hamburg/2024-12/fernwaerme-hamburg-teaser/wide__1300x731,2025-01-08T10:58:12Z,http://archive.md/20241231132459/https://www.zeit.de/2025/01/fernwaerme-hamburg-umwelt-klimaschutz-waermewende,"Fernwärme in Hamburg klingt dieses Wort immer ein wenig nach Hoffnung. Nach einer besseren Zukunft. 1842 hatte der Große Brand weite Teile der Innenstadt zerstört, mehr als 50 Menschen starben und me… [+682 chars]",,de,'Kohle'
https://www.zeit.de/2025/02/leistungssport-deutschland-finanzierung-foerderung-olympia,https://www.zeit.de/2025/02/leistungssport-deutschland-finanzierung-foerderung-olympia,0,www.zeit.de,Leistungssport in Deutschland : Knapp vorbei,"Vierte Plätze statt Medaillen und Kinder, die keine Purzelbäume mehr können: Die Präsidenten der drei größten Sportverbände warnen – und fordern einen Sportminister.",https://img.zeit.de/2025/02/knapp-vorbei-bild-1/wide__1300x731,2025-01-08T11:02:38Z,http://archive.md/20250108110457/https://www.zeit.de/2025/02/leistungssport-deutschland-finanzierung-foerderung-olympia,Die wichtigsten Repräsentanten des deutschen Sports sitzen nicht oft an einem Tisch. Auf dem DFB-Campus in Frankfurt sind die drei Präsidenten zum ersten gemeinsamen Interview überhaupt zusammengekom… [+422 chars],,de,'Kinder'
https://www.tagesspiegel.de/berlin/bezirke/aktion-kaffee-gegen-kalte-funf-berliner-bezirke-wetten-fur-die-kaltehilfe-12981373.html,https://www.tagesspiegel.de/berlin/bezirke/aktion-kaffee-gegen-kalte-funf-berliner-bezirke-wetten-fur-die-kaltehilfe-12981373.html,0,www.tagesspiegel.de,Aktion „Kaffee gegen Kälte“: Fünf Berliner Bezirke wetten für die Kältehilfe,Zum ersten Mal beteiligen sich fünf Berliner Bezirke an der Wette für die Obdachlosenhilfe. Anwohner können sich bis zum 20. Januar an der Aktion beteiligen.,https://www.tagesspiegel.de/images/12981310/alternates/BASE_16_9_W1400/1736342226000/kaltehilfe-in-berlin.jpeg,2025-01-08T13:22:16Z,,"Zum Jahresstart geht die Kaffeewette für die Kältehilfe in die nächste Runde: Was auf Initiative Neuköllns begann, umfasst mittlerweile fünf Bezirke. Die Bezirksbürgermeister:innen von Neukölln, Rein… [+2430 chars]",,de,'Obdachlosigkeit'
https://www.faz.net/aktuell/wirtschaft/atomkraft-wird-in-australien-zum-wahlkampfhit-110205500.html,https://www.faz.net/aktuell/wirtschaft/atomkraft-wird-in-australien-zum-wahlkampfhit-110205500.html,0,www.faz.net,Klimaschutz: Atomkraft wird in Australien zum Wahlkampfhit,"Eigentlich ist Nuklearenergie in Down Under verboten. Die Opposition will trotzdem AKWs bauen – und so junge, unzufriedene Männer gewinnen.",https://media0.faz.net/ppmedia/aktuell/470583929/1.10205496/facebook_teaser_fplus/kohlekraftwerk-in-victoria.jpg,2025-01-08T18:04:36Z,http://archive.md/20250108183816/https://www.faz.net/aktuell/wirtschaft/atomkraft-wird-in-australien-zum-wahlkampfhit-110205500.html,"Wie die meisten Dinge im Leben kann man auch die Atomkraft unterschiedlich sehen. Aus­tralien bildet da keine Ausnahme, allerdings verläuft der Meinungsgraben hier zwischen den Geschlechtern. Während… [+205 chars]",,de,'Atomkraft'
https://tirol.orf.at/stories/3288254/,https://tirol.orf.at/stories/3288254/,0,tirol.orf.at,Fahrverbot für Lkws wird ausgeweitet,"Wegen der Sanierung der Luegbrücke gilt in Tirol  ab Samstag ein erweitertes Lkw-Fahrverbot. Bis März dürfen Lkws über 7,5 Tonnen auf der Brenner- und auf der Inntalautobahn an Samstagen nur von 5.00 bis 7.00 Uhr fahren. So sollen die Verkehrssicherheit gewäh…",https://ibs.orf.at/tir?image=https%3A%2F%2Foekastatic.orf.at%2Fmims%2F2024%2F41%2F73%2Fcrops%2Fw%3D1200%2Ch%3D627%2Cq%3D75%2F2377191_master_907773_themenbild_tirol_luegbruecke_brennerautobahn_a13_8.jpg%3Fs%3De00f982812b27fd060cd746096173aedfaed128c,2025-01-09T05:32:07Z,,"Wie Enrico Leitgeb, Leiter der Landesverkehrsabteilung der Polizei, erklärte, wird die Polizei bei der Einreise an der Brennergrenze und in Kiefersfelden Kontrollen durchführen. Fahrzeuge, die nicht … [+638 chars]",,de,'Sanierung'
https://www.sueddeutsche.de/politik/bundestagswahl-2025-news-neuwahlen-cdu-agenda-2030-wirtschaftswachstum-li.3177045,https://www.sueddeutsche.de/politik/bundestagswahl-2025-news-neuwahlen-cdu-agenda-2030-wirtschaftswachstum-li.3177045,0,www.sueddeutsche.de,Bundestagswahl 2025: CDU will mit „Agenda 2030“ Wachstum ankurbeln,"Das Wirtschaftsprogramm sieht Steuererleichterungen für Firmen und Bürger vor, die Wirtschaftswachstum bringen sollen. Aussagen zur Atomkraft oder der Schuldenbremse macht das Programm nicht. CSU-Chef Söder und CDU-Politiker Günther liefern sich einen Schlaga…",https://www.sueddeutsche.de/2022/06/13/13adb391-2bed-42c1-a22a-fcca103a4078.jpeg?q=60&fm=webp&width=1200&rect=0%2C174%2C1290%2C726,2025-01-09T07:12:00Z,http://archive.md/20250109111827/https://www.sueddeutsche.de/politik/bundestagswahl-2025-news-neuwahlen-cdu-agenda-2030-wirtschaftswachstum-li.3177045,"Ein ""Agenda 2030""-Programm verspricht Firmen und Bürgern Steuererleichterungen und in der Folge hohe Wachstumsquoten. ""Mit dieser Agenda 2030 setzen wir uns für Deutschland ein wirtschaftspolitisches… [+4216 chars]",,de,'Atomkraft'
https://www.focus.de/finanzen/news/es-muss-jetzt-klappen-db-aufsichtsratschef-fordert-infrastrukturfonds-und-macht-druck-bei-sanierung_id_260619337.html,https://www.focus.de/finanzen/news/es-muss-jetzt-klappen-db-aufsichtsratschef-fordert-infrastrukturfonds-und-macht-druck-bei-sanierung_id_260619337.html,0,www.focus.de,„Es muss jetzt klappen“ - DB-Aufsichtsratschef fordert Infrastrukturfonds und macht Druck bei Sanierung,"Werner Gatzer, der Aufsichtsratschef der Deutschen Bahn, erhöht den Druck auf die Sanierung des Staatskonzerns. Im Zuge dessen wirbt er für einen Infrastrukturfonds.",https://p6.focus.de/img/regional/bayern/id_260576368/die-bahn-hat-26-millionen-euro-in-marktredwitz-und-pechbrunn-in-der-oberpfalz-investiert.-symbolbild-.jpg?im=Crop%3D%280%2C170%2C2048%2C1024%29%3BResize%3D%281200%2C627%29&impolicy=perceptual&quality=mediumHigh&hash=d42423355f2e247a163791b8326006a90f18597acccf1c22609548c62d3b067a,2025-01-09T07:37:55Z,,"Werner Gatzer, der Aufsichtsratschef der Deutschen Bahn, erhöht den Druck auf die Sanierung des Staatskonzerns. Im Zuge dessen wirbt er für einen Infrastrukturfonds.150 Milliarden für die nächsten ze… [+2853 chars]",,de,'Sanierung'
https://www.faz.net/aktuell/wirtschaft/mehr-wirtschaft/import-aus-frankreich-dieser-atomstrom-ist-unschlagbar-guenstig-110218860.html,https://www.faz.net/aktuell/wirtschaft/mehr-wirtschaft/import-aus-frankreich-dieser-atomstrom-ist-unschlagbar-guenstig-110218860.html,0,www.faz.net,Import aus Frankreich: „Dieser Atomstrom ist unschlagbar günstig“,Frankreich setzt stark auf Atomkraft und Deutschland nutzt immer mehr Strom aus dem Nachbarland. Das kommt nicht von ungefähr.,https://media0.faz.net/ppmedia/aktuell/wirtschaft/4059344361/1.10220054/facebook_teaser/kuehltuerme-des-atomkraftwerks.jpg,2025-01-09T08:24:04Z,http://archive.md/20250109082941/https://www.faz.net/aktuell/wirtschaft/mehr-wirtschaft/import-aus-frankreich-dieser-atomstrom-ist-unschlagbar-guenstig-110218860.html,"Frankreich war 2024 mit netto 13 TWh größter Stromlieferant. Grund sind niedrigere Kosten. Strom wird im europäischen Verbund dort erzeugt, wo dies am günstigsten möglich ist, betont die Bundesnetzag… [+9733 chars]",,de,'Atomkraft'
https://www.bild.de/sport/fussball/bayern-bangt-um-superstar-musiala-grippe-vor-bundesliga-spiel-677f932c75a660732be0488d,https://www.bild.de/sport/fussball/bayern-bangt-um-superstar-musiala-grippe-vor-bundesliga-spiel-677f932c75a660732be0488d,0,www.bild.de,Fällt der Bayern-Star aus? - Grippe! Jetzt wird es eng für Musiala!,"Jamal Musiala, Bayerns Offensiv-Star, kämpft mit einer Grippe und könnte das erste Bundesliga-Spiel des Jahres gegen Borussia Mönchengladbach verpassen.","https://images.bild.de/677f932c75a660732be0488d/521bedce6c09575b3b08d8d8f245b67e,f7e4d391?w=1280",2025-01-09T09:36:40Z,,"Bayern zittert immer mehr um seinen Superstar!
Jamal Musiala (21) trainierte zuletzt am Sonntag mit dem Team, fehlt seitdem mit Erkältung. Und anscheinend ist es nicht besser geworden. Bayern sprich… [+1779 chars]",,de,'Grippe'
https://www.focus.de/politik/ausland/republik-moldau-winter-am-dnister-ohne-russisches-gas_26b7b1fb-d43e-43da-afcc-1288be7b956e.html,https://www.focus.de/politik/ausland/republik-moldau-winter-am-dnister-ohne-russisches-gas_26b7b1fb-d43e-43da-afcc-1288be7b956e.html,0,www.focus.de,Ausland - Republik Moldau: Winter am Dnister ohne russisches Gas,Am 1. Januar hat Russland die Gaslieferungen an die Republik Moldau eingestellt. Die russisch kontrollierte separatistische Region Transnistrien und die benachbarten Dörfer bleiben in der Kälte.,https://quadro.burda-forward.de/ctf/089a45cd-192e-49c3-b86c-5e5bb95f0c00.b52613ef-3360-4488-9ba6-b3d140ac9054.png?im=Resize%3D%281200%2C630%29&hash=5a8f1cbf2813e6f38a9bca7b16f22dd341708c0ff0e53eedacd487f419ae9ec4,2025-01-09T10:01:38Z,https://web.archive.org/web/20250109113149/https://www.focus.de/politik/ausland/republik-moldau-winter-am-dnister-ohne-russisches-gas_26b7b1fb-d43e-43da-afcc-1288be7b956e.html,Es ist kalt in den ersten Tagen des Jahres 2025 in der Republik Moldau. In den Nächten liegen die Temperaturen um den Gefrierpunkt. An den Tagen steigen sie bei Sonnenschein etwas an. An diesem 7. Ja… [+5765 chars],,de,'Gas'
https://www.tagesschau.de/inland/rki-grippe-104.html,https://www.tagesschau.de/inland/rki-grippe-104.html,0,www.tagesschau.de,RKI warnt vor aufkommender Grippewelle - immer mehr Fälle,Wie in den vergangenen Jahren nimmt die Zahl der Grippefälle auch in diesem Januar deutlich zu. Das Robert Koch-Institut erkennt in dem Anstieg Anzeichen für den Beginn einer Grippewelle. Es gibt auch Todesopfer.,https://images.tagesschau.de/image/420b581b-80ab-4ae9-9358-d6ba3dd821d8/AAABlEsrvsA/AAABkZLhkrw/16x9-1280/grippe-138.jpg,2025-01-09T13:05:46Z,,"Stand: 09.01.2025 14:05 Uhr
Wie in den vergangenen Jahren nimmt die Zahl der Grippefälle auch in diesem Januar deutlich zu. Das Robert Koch-Institut erkennt in dem Anstieg Anzeichen für den Beginn e… [+1750 chars]",,de,'Grippe'
https://www.zeit.de/zeit-leo/2025/01/quetschkartoffeln-kochen-kinder-rezept,https://www.zeit.de/zeit-leo/2025/01/quetschkartoffeln-kochen-kinder-rezept,0,www.zeit.de,Quetschkartoffeln : Da bist du platt!,"Das leckerste Kartoffelrezept für Kinder ist auch das einfachste: Kartoffeln zerquetschen, Käse drauf, nomnomnom. Für Erwachsene bleibt nur mit viel Glück was übrig.",https://img.zeit.de/zeit-magazin/wochenmarkt/2025-01/quetschkartoffeln-kochen-kinder-rezept-teaser/wide__1300x731,2025-01-09T13:09:15Z,http://archive.md/20250109131530/https://www.zeit.de/zeit-leo/2025/01/quetschkartoffeln-kochen-kinder-rezept,"Kochen ist kinderleicht! In unserer Serie ""Von Kindern für Kinder"" 
stellen junge Menschen ihre Lieblingsrezepte vor. Mit vielen Fotos und 
einer genauen Anleitung erklären sie Schritt für Schritt,… [+394 chars]",,de,'Kinder'
https://www.tagesspiegel.de/gesundheit/deutliche-mehr-erkrankte-rki-erwartet-beginn-der-grippewelle-in-deutschland-12988219.html,https://www.tagesspiegel.de/gesundheit/deutliche-mehr-erkrankte-rki-erwartet-beginn-der-grippewelle-in-deutschland-12988219.html,0,www.tagesspiegel.de,Deutliche mehr Erkrankte: RKI erwartet Beginn der Grippewelle in Deutschland,"Winter ist Erkältungszeit, die Menschen husten und schniefen. Nun zeichnet sich nach Angaben des Robert Koch-Instituts zudem der Start der jährlichen Grippewelle ab.",https://www.tagesspiegel.de/images/12988330/alternates/BASE_16_9_W1400/1736428098000/grippe.jpeg,2025-01-09T13:10:29Z,,Meist geht es im Januar los so offenbar auch im Jahr 2025: Der Beginn der Grippewelle in Deutschland deutet sich nach Angaben des Robert Koch-Instituts (RKI) an. Die Zahl der gemeldeten Fälle ist sei… [+2729 chars],,de,'Grippe'
https://www.zeit.de/news/2025-01/09/zwei-maenner-wegen-missbrauchs-in-kinderheim-verurteilt,https://www.zeit.de/news/2025-01/09/zwei-maenner-wegen-missbrauchs-in-kinderheim-verurteilt,0,www.zeit.de,Urteil nach 25 Jahren: Zwei Männer wegen Missbrauchs in Kinderheim verurteilt,Hier finden Sie Informationen zu dem Thema „Urteil nach 25 Jahren“. Lesen Sie jetzt „Zwei Männer wegen Missbrauchs in Kinderheim verurteilt“.,https://img.zeit.de/news/2025-01/09/zwei-maenner-wegen-missbrauchs-in-kinderheim-verurteilt-image-group/wide__1300x731,2025-01-09T14:47:54Z,,"Weil sie um die Jahrtausendwende zwei Minderjährige in einem Kinderheim sexuell missbraucht haben sollen, sind zwei Männer verurteilt worden - einer von ihnen zu einer Haftstrafe von drei Jahren, der… [+929 chars]",,de,'Ältere'
https://www.nzz.ch/schweiz/baut-die-schweiz-die-windkraft-nicht-aus-braucht-es-im-grossen-stil-gaskraftwerke-das-zeigt-eine-neue-studie-ld.1865491,https://www.nzz.ch/schweiz/baut-die-schweiz-die-windkraft-nicht-aus-braucht-es-im-grossen-stil-gaskraftwerke-das-zeigt-eine-neue-studie-ld.1865491,0,www.nzz.ch,"Baut die Schweiz die Windkraft nicht aus, braucht es im grossen Stil Gaskraftwerke – das zeigt eine neue Studie","Riesige Überschüsse im Sommer, eine klaffende Stromlücke im Winter: Gelingt es der Schweiz nicht, das Stromgesetz umzusetzen, drohen gemäss dem Verband der Elektrizitätsunternehmen gravierende Versorgungsprobleme.","https://img.nzz.ch/2025/01/09/4ca6f8ce-5744-4bf5-a763-377b15c2a171.jpeg?width=1200&height=675&fit=bounds&quality=75&auto=webp&crop=4787,2693,x0,y281&wmark=nzz",2025-01-09T16:39:15Z,http://archive.md/20250110031435/https://www.nzz.ch/schweiz/baut-die-schweiz-die-windkraft-nicht-aus-braucht-es-im-grossen-stil-gaskraftwerke-das-zeigt-eine-neue-studie-ld.1865491,"Mehr Windturbinen, wie hier am Gotthard, wären laut einer Studie der Stromwirtschaft der optimale Weg hin zu einer sicheren und klimaneutralen Energieversorgung.
Wie schafft es die Schweiz, bis 2050… [+5673 chars]",,de,'Blackout'
https://orf.at/stories/3381359/,https://orf.at/stories/3381359/,0,orf.at,"Atomkraft, Mars und Hitler: Musk sprach mit Weidel",,https://orf.at/mojo/1_4_1/storyserver//news/common/images/og-fallback-news.png,2025-01-09T19:52:24Z,,"In einem Onlinegespräch mit der Chefin der deutschen AfD, Alice Weidel, hat US-Milliardär Elon Musk erneut intensiv für deren Partei geworben, während Weidel ein düsteres Bild von Deutschland zeichne… [+2006 chars]",,de,'Atomkraft'
https://futurezone.at/digital-life/ammoniak-atomkraft-frachtschiffe-sauberer-klimaneutral-co2-schifffahrt/402996531,https://futurezone.at/digital-life/ammoniak-atomkraft-frachtschiffe-sauberer-klimaneutral-co2-schifffahrt/402996531,0,futurezone.at,Ammoniak und Atomkraft sollen Frachtschiffe sauberer machen,Die Schifffahrt muss grüner werden und sucht nach alternativen Treibstoffen. 2 Begriffe tauchen dabei immer wieder auf: Ammoniak und Atomkraft.,https://image.futurezone.at/images/facebook/8902491/atomschiff.jpg,2025-01-10T05:00:00Z,,"Die Schifffahrt muss grüner werden und sucht nach alternativen Treibstoffen. 2 Begriffe tauchen dabei immer wieder auf: Ammoniak und Atomkraft.
Beim Superyacht Design Festival Anfang Februar in Kitz… [+232 chars]",,de,'Atomkraft'
https://www.diepresse.com/19240701/stephansplatz-und-huetteldorf-wiener-linien-sanieren-aufzuege-bei-u-bahnstationen,https://www.diepresse.com/19240701/stephansplatz-und-huetteldorf-wiener-linien-sanieren-aufzuege-bei-u-bahnstationen,0,www.diepresse.com,Stephansplatz und Hütteldorf: Wiener Linien sanieren Aufzüge bei U-Bahnstationen,Insgesamt werden in Wien elf Aufzüge und zwölf Rolltreppen modernisiert. Im Durchschnitt dauern die Arbeiten an den Liften acht Wochen. Im Jänner beginnen die ersten Sanierungen.,https://img.diepresse.com/public/incoming/nywdip-kein-Titel/alternates/DPR_SOCIAL_NACHRICHTEN/kein%20Titel,2025-01-10T09:34:38Z,,"Insgesamt werden in Wien elf Aufzüge und zwölf Rolltreppen modernisiert. Im Durchschnitt dauern die Arbeiten an den Liften acht Wochen. Im Jänner beginnen die ersten Sanierungen.
10 Millionen Mal is… [+2371 chars]",,de,'Sanierung'
https://www.bild.de/sport/fussball/hannover-96-grippe-alarm-gefaehrdete-testspiel-6780e29fa21b1554a3e60e85,https://www.bild.de/sport/fussball/hannover-96-grippe-alarm-gefaehrdete-testspiel-6780e29fa21b1554a3e60e85,0,www.bild.de,Testspiel fast abgesagt - Grippe-Alarm bei Hannover 96,Fast wäre die Zweitliga-Generalprobe im türkischen Belek ausgefallen. Mehrere Profis von Hannover 96 liegen flach.,"https://images.bild.de/6780e29fa21b1554a3e60e85/05dc661a53ec5092cc7e671b5bf7f43b,a31c1dbd?w=1280",2025-01-10T09:51:26Z,,"Gegen Magdeburg und Bern spielt Hannover 96 am Freitagmorgen die Doppel-Generalprobe für den Zweitliga-Start gegen Regensburg am 17. Januar. Beinahe hätte der Aufstiegskandidat umplanen müssen. 
Ein… [+1601 chars]",,de,'Grippe'
