index,url,valid,domain,title,description,image,published,archive,content,quote,language,keyword
https://www.jungewelt.de/artikel/456235.kinderbetreuung-krise-in-den-kitas.html,https://www.jungewelt.de/artikel/456235.kinderbetreuung-krise-in-den-kitas.html,0,www.jungewelt.de,Kinderbetreuung: Krise in den Kitas,Mehr als die Hälfte der Eltern hat keinen zuverlässigen Kitaplatz. Personalmangel enorm • Foto: -/dpa,https://www.jungewelt.de/img/1100/183865.jpg,2023-08-04T17:41:48Z,,Die Kinderbetreuung wurde in den vergangenen Jahren zwar ausgebaut. Doch verlässlich sind die Angebote nicht. Das belegt eine am Freitag veröffentlichte Untersuchung des Wirtschafts- und Sozialwissen… [+2335 chars],,de,'Kinder'
https://www.bild.de/news/inland/news-inland/eurojackpot-am-freitag-4-08-23-gewinnzahlen-und-quoten-84902484.bild.html,https://www.bild.de/news/inland/news-inland/eurojackpot-am-freitag-4-08-23-gewinnzahlen-und-quoten-84902484.bild.html,0,www.bild.de,Lottozahlen und Quoten im Überblick - Der Eurojackpot am Freitag wurde geknackt,"Ein eigenes Haus, Autos für die großen Kinder, nicht mehr zur Arbeit müssen ... Mit ein...Foto: Shutterstock / Wirestock Creators","https://images.bild.de/64ca0aace98fa73a8ae22aea/21e6b592cc35a73b71b80bc0441a2b8b,8d018670?w=1280",2023-08-04T18:10:29Z,,"Ein eigenes Haus, Autos für die großen Kinder, nicht mehr zur Arbeit müssen ... Mit einem größeren Gewinn beim Eurojackpot können solche Träume wahr werden.
Jeden Dienstag und Freitag fiebern Lotto-… [+3335 chars]",,de,'Kinder'
https://www.n-tv.de/panorama/Menschen-in-der-Tuerkei-ringen-um-Normalitaet-article24295130.html,https://www.n-tv.de/panorama/Menschen-in-der-Tuerkei-ringen-um-Normalitaet-article24295130.html,0,www.n-tv.de,Sechs Monate nach Erdbeben: Menschen in der Türkei ringen um Normalität,"Ein halbes Jahr nach dem verheerenden Erdbeben liegen große Teile der betroffenen Region der Türkei noch immer in Trümmern. Die Obdachlosigkeit ist hoch, die Wartelisten für sogenannte Containerstädte lang. Großangelegte Neubauprojekte laufen - doch die Zeit …",https://bilder3.n-tv.de/img/incoming/crop24295110/7611323577-cImg_16_9-w1200/418812682.jpg,2023-08-06T07:12:06Z,https://web.archive.org/web/20230806080857/https://www.n-tv.de/panorama/Menschen-in-der-Tuerkei-ringen-um-Normalitaet-article24295130.html,"Ein halbes Jahr nach dem verheerenden Erdbeben liegen große Teile der betroffenen Region der Türkei noch immer in Trümmern. Die Obdachlosigkeit ist hoch, die Wartelisten für sogenannte Containerstädt… [+7164 chars]",,de,'Obdachlosigkeit'
https://www.stern.de/gesellschaft/regional/bayern/gesundheit--holetschek--nehme-warnung-vor-klinik-engpaessen-sehr-ernst--33711644.html,https://www.stern.de/gesellschaft/regional/bayern/gesundheit--holetschek--nehme-warnung-vor-klinik-engpaessen-sehr-ernst--33711644.html,0,www.stern.de,Gesundheit: Holetschek: Nehme Warnung vor Klinik-Engpässen sehr ernst,"Eltern harren stundenlang in Wartezimmern aus, schwer kranke Kinder müssen in ferne Kliniken mit freien Plätzen transportiert werden: Das RS-Virus hat im vergangenen Winter für eine dramatische Situation gesorgt. Was bringt der nächste Winter? Die Sorge ist g…",https://image.stern.de/33711646/t/Rr/v3/w1440/r1.7778/-/06--urnnewsmldpacom2009010123080599713943v3w800h600l547t120r1788b1523jpeg---73d87f0155971350.jpg,2023-08-06T08:16:42Z,,"Eltern harren stundenlang in Wartezimmern aus, schwer kranke Kinder müssen in ferne Kliniken mit freien Plätzen transportiert werden: Das RS-Virus hat im vergangenen Winter für eine dramatische Situa… [+3261 chars]",,de,'Kinder'
https://consent.google.com/ml?continue=https://news.google.com/rss/articles/CBMicWh0dHBzOi8vd3d3LmJ1bnRlLmRlL3JveWFscy9icml0aXNjaGVzLWtvZW5pZ3NoYXVzL3ByaW56LWhhcnJ5LWZsdWNodC1uYWNoLWFmcmlrYS1vaG5lLW1lZ2hhbi11bmQtZGllLWtpbmRlci5odG1s0gF1aHR0cHM6Ly93d3cuYnVudGUuZGUvcm95YWxzL2JyaXRpc2NoZXMta29lbmlnc2hhdXMvcHJpbnotaGFycnktZmx1Y2h0LW5hY2gtYWZyaWthLW9obmUtbWVnaGFuLXVuZC1kaWUta2luZGVyLmFtcC5odG1s?oc%3D5&gl=FR&hl=en-US&cm=2&pc=n&src=1,https://consent.google.com/ml?continue=https://news.google.com/rss/articles/CBMicWh0dHBzOi8vd3d3LmJ1bnRlLmRlL3JveWFscy9icml0aXNjaGVzLWtvZW5pZ3NoYXVzL3ByaW56LWhhcnJ5LWZsdWNodC1uYWNoLWFmcmlrYS1vaG5lLW1lZ2hhbi11bmQtZGllLWtpbmRlci5odG1s0gF1aHR0cHM6Ly93d3cuYnVudGUuZGUvcm95YWxzL2JyaXRpc2NoZXMta29lbmlnc2hhdXMvcHJpbnotaGFycnktZmx1Y2h0LW5hY2gtYWZyaWthLW9obmUtbWVnaGFuLXVuZC1kaWUta2luZGVyLmFtcC5odG1s?oc%3D5&gl=FR&hl=en-US&cm=2&pc=n&src=1,0,consent.google.com,Prinz Harry: Flucht nach Afrika – ohne Meghan und die Kinder - BUNTE.de,"<ol><li>Prinz Harry: Flucht nach Afrika – ohne Meghan und die Kinder  BUNTE.de
</li><li>Prinz Harry: Sein letzter Ausweg heißt Afrika  Gala.de
</li><li>Meghan Markle: Sie hat Prinz Harry bereits verlassen! Herzogin Meghan wohnt schon im Hotel  news.de
</li…",,2023-08-06T08:38:06Z,,"We use cookies and data to<ul><li>Deliver and maintain Google services</li><li>Track outages and protect against spam, fraud, and abuse</li><li>Measure audience engagement and site statistics to unde… [+1131 chars]",,de,'Kinder'
https://www.handelsblatt.com/arts_und_style/lifestyle/rath-checkt-ein-excelsior-hotel-ernst-mehr-koeln-geht-nicht/29295320.html,https://www.handelsblatt.com/arts_und_style/lifestyle/rath-checkt-ein-excelsior-hotel-ernst-mehr-koeln-geht-nicht/29295320.html,0,www.handelsblatt.com,Rath checkt ein: Excelsior Hotel Ernst: Mehr Köln geht nicht,Das Excelsior ist das einzige Grandhotel der Domstadt – und so fest wie kein anderes deutsches Hotel in seiner Stadt verwurzelt. Besonders beeindruckend ist dabei die Gastronomie.,https://www.handelsblatt.com/images/mit-wiedererkennungswert/29296106/3-format2003.jpg,2023-08-06T08:51:41Z,,"Ein Stadthotel in Familienbesitz mit langer Geschichte das gibt es heute kaum noch. Viele der großen, namhaften Häuser gehören längst zu einer der großen Marken. Eine der Ausnahmen steht in Köln, dir… [+7493 chars]",,de,'Gas'
https://www.bild.de/unterhaltung/tv/tv/my-mom-your-dad-mit-amira-pocher-konzept-sendezeit-teilnehmer-84769398.bild.html,https://www.bild.de/unterhaltung/tv/tv/my-mom-your-dad-mit-amira-pocher-konzept-sendezeit-teilnehmer-84769398.bild.html,0,www.bild.de,"Alle Infos zur Show - Neue Show „My Mom, Your Dad“ mit Amira Pocher","Die große Liebe für alleinerziehende Mütter und Väter. Das Besondere: die eigenen Kinder schlüpfen in die Rolle des Amors. Alle Infos zu „My Mom, Your Dad“!","https://images.bild.de/64ba535fd26ae13f2a546b5d/991b1e3039761afda016e1bd6263b02c,3539966a?w=1280",2023-08-06T08:56:16Z,,"Die Kinder suchen den neuen Partner für einen Elternteil aus? In dieser 
Reality-Show soll das möglich werden!
12 Single-Mütter und -Väter wurden von den eigenen Kindern für die My Mom, Your Dad no… [+3272 chars]",,de,'Kinder'
https://www.tagesschau.de/ausland/mittelmeer-migranten-peleponnes-100.html,https://www.tagesschau.de/ausland/mittelmeer-migranten-peleponnes-100.html,0,www.tagesschau.de,Dutzende Migranten aus Seenot vor griechischer Halbinsel gerettet,"Die griechische Küstenwache hat südwestlich der Halbinsel Peloponnes 49 Menschen aus Seenot gerettet, darunter auch acht Kinder. Drei der Geretteten wurden als mutmaßliche Schleuser festgenommen.",https://images.tagesschau.de/image/00f35856-879e-4b10-bb55-2cbe2f1dfc80/AAABicn_3mI/AAABibBxqrQ/16x9-1280/rettungsring-107.jpg,2023-08-06T09:09:36Z,,"Stand: 06.08.2023 11:09 Uhr
Die griechische Küstenwache hat südwestlich der Halbinsel Peloponnes 49 Menschen aus Seenot gerettet, darunter auch acht Kinder. Drei der Geretteten wurden als mutmaßlich… [+1379 chars]",,de,'Kinder'
https://www.wiwo.de/unternehmen/handel/60-jahre-carrera-autos-der-groesste-feind-der-carrera-bahn-ist-der-fruehjahrsputz-der-mutter/29301798.html,https://www.wiwo.de/unternehmen/handel/60-jahre-carrera-autos-der-groesste-feind-der-carrera-bahn-ist-der-fruehjahrsputz-der-mutter/29301798.html,0,www.wiwo.de,60 Jahre Carrera-Autos: „Der größte Feind der Carrera-Bahn ist der Frühjahrsputz der Mutter“,Für viele sind sie ein Stück Kindheit – manche haben sie auch noch als Erwachsene: Carrera-Autos gibt es seit nunmehr 60 Jahren. Doch schon lange wird Carrera durch ein strukturelles Problem im Kinderzimmer ausgebremst.,https://www.wiwo.de/images/60-jahre-carrera/29301866/3-format11240.jpg,2023-08-06T09:32:36Z,,"Auch die Autos vom Chef fliegen aus der Kurve. Ich bin nicht so gut, aber ich weiß, wie es geht, sagt Stefan Krings. Der Mann hat aus Sicht von Kindern und Motorsportfreunden eine Art Traumjob. Er le… [+5901 chars]",,de,'Kinder'
