index,url,valid,domain,title,description,image,published,archive,content,quote,language,keyword
https://www.nzz.ch/meinung/corona-das-nationale-pandemie-ende-muss-jetzt-verkuendet-werden-ld.1719682,https://www.nzz.ch/meinung/corona-das-nationale-pandemie-ende-muss-jetzt-verkuendet-werden-ld.1719682,0,www.nzz.ch,"KOMMENTAR - Warum so feige, liebe Politiker? Ihr dürft getrost das Ende der Corona-Pandemie verkünden","Offenbar fällt es vielen schwer zu begreifen, dass das Coronavirus in Deutschland und der Schweiz mittlerweile keine pandemische Bedrohung mehr ist. Wir dürfen und müssen nun damit umgehen wie mit anderen Erregern, sei es Grippe, Masern oder HIV.","https://img.nzz.ch/2023/01/05/928c8970-f165-4a96-9c20-5a7e986f58a0.jpeg?width=1200&height=675&fit=bound&quality=75&auto=webp&crop=6000,3375,x0,y129&wmark=nzz",2023-01-05T17:00:00Z,https://web.archive.org/web/20230105171635/https://www.nzz.ch/meinung/corona-das-nationale-pandemie-ende-muss-jetzt-verkuendet-werden-ld.1719682,"Die pandemische Phase ist bei uns zu Ende. Das dürfen wir feiern wie hier Menschen in einem Club in London.
Stephanie Lahrtz, Redaktorin im Ressort Wissenschaft und Technologie.
Sie lesen einen Aus… [+4365 chars]",,de,'Grippe'
https://orf.at/stories/3300238/,https://orf.at/stories/3300238/,0,orf.at,Rekorde und Premieren in fünf Jahren,Mehr als fünf Jahre lang haben der Nationalrat und der Bundesrat wegen der Sanierung des historischen Parlaments in der Hofburg getagt. Während dieser Zeit registrierte die Parlamentsdirektion viele Rekorde und Premieren. Mit ihnen lassen sich die vergangenen…,https://ibs.orf.at/news?image=https%3A%2F%2Fassets.orf.at%2Fmims%2F2023%2F01%2F24%2Fcrops%2Fw%3D1200%2Ch%3D630%2Cq%3D75%2F1630608_master_598424_parlament_statistik_fuenf_jahre_row.jpg%3Fs%3Dcf8bd3d394d30556ee5652b279c53790992b7995,2023-01-06T06:39:50Z,https://web.archive.org/web/20230106065341/https://orf.at/stories/3300238/,"Wenn das historische Parlament kommende Woche mit einem Festakt nach mehr als fünf Jahren seine Tore wieder öffnet, ist es für die meisten Abgeordneten und Mitglieder des Bundesrats allerdings keine … [+5466 chars]",,de,'öffentliche Gebäude'
https://www.stern.de/politik/deutschland/kernspaltung--teil-zwei--der-laufzeitstreit-geht-in-die-verlaengerung-33070378.html,https://www.stern.de/politik/deutschland/kernspaltung--teil-zwei--der-laufzeitstreit-geht-in-die-verlaengerung-33070378.html,0,www.stern.de,"Atomkraftwerke in Deutschland: Kernspaltung, zweiter Teil? Der Laufzeitstreit geht in die Verlängerung",Die Laufzeitdebatte wird zur Langzeitdebatte: Verkehrsminister Volker Wissing (FDP) provoziert einen neuen Akw-Streit in der Ampel-Koaliton.,https://image.stern.de/33071722/t/Dl/v1/w1440/r1.7778/-/robert-habeck-volker-wissing.jpg,2023-01-06T08:25:00Z,https://web.archive.org/web/20230106082829/https://www.stern.de/politik/deutschland/kernspaltung--teil-zwei--der-laufzeitstreit-geht-in-die-verlaengerung-33070378.html,"Wieder nicht geklappt, Deutschland verfehlt erneut sein Klimaziel. Das prognostiziert jedenfalls die Denkfabrik Agora Energiewende, die am Mittwoch ihren Bericht zum CO2-Ausstoß der Bundesrepublik vo… [+6070 chars]",,de,'Atomkraft'
https://ooe.orf.at/stories/3189263/,https://ooe.orf.at/stories/3189263/,0,ooe.orf.at,Ein Drittel ist nicht auf Blackout vorbereitet,"Bei einem Blackout würden schlagartig große Teile der Infrastruktur lahmgelegt werden. Wasserversorgung, Licht, Handynetz würden schlagartig stillstehen. Fast ein Drittel der Menschen in Oberösterreich ist laut Schätzungen darauf kaum oder gar nicht vorbereit…",https://ibs.orf.at/ooe?image=https%3A%2F%2Foekastatic.orf.at%2Fmims%2F2023%2F01%2F33%2Fcrops%2Fw%3D1200%2Ch%3D627%2Cq%3D75%2F1631777_master_598833_230106_ooeh_blackout_was_brauche_ich_was_kostet_es_00_02_28_22.jpg%3Fs%3D18fe094bd8642764f20c08df473da463a59092f4,2023-01-06T11:27:43Z,https://web.archive.org/web/20230106115326/https://ooe.orf.at/stories/3189263/,"Ein Radio, das mit einer Kurbel angetrieben wird, ist im Fall eines Blackouts der vielleicht einzige Weg, um noch an Informationen zu kommen. Und die Nachfrage nach den Geräten ist seit der Corona-Pa… [+1168 chars]",,de,'Blackout'
https://www.tagesschau.de/wirtschaft/verbraucher/gasverbrauch-deutschland-101.html,https://www.tagesschau.de/wirtschaft/verbraucher/gasverbrauch-deutschland-101.html,0,www.tagesschau.de,Gasverbrauch in Deutschland 2022 um 14 Prozent gesunken,Die milden Temperaturen haben geholfen: Der Erdgasverbrauch ist 2022 erheblich gesunken. Er lag 14 Prozent unter dem Durchschnitt der vorherigen vier Jahre. Norwegen löste zudem Russland als wichtigsten Gaslieferanten ab.,https://www.tagesschau.de/multimedia/bilder/gasflamme-117~_v-original.jpg,2023-01-06T12:27:10Z,https://web.archive.org/web/20230106125617/https://www.tagesschau.de/wirtschaft/verbraucher/gasverbrauch-deutschland-101.html,Die milden Temperaturen haben geholfen: Der Erdgasverbrauch ist 2022 erheblich gesunken. Er lag 14 Prozent unter dem Durchschnitt der vorherigen vier Jahre. Norwegen löste zudem Russland als wichtigs… [+1541 chars],,de,'Gasspeicher'
https://www.sueddeutsche.de/muenchen/muenchen-stadtwerke-florian-bieberbach-energiepreise-interview-1.5727810,https://www.sueddeutsche.de/muenchen/muenchen-stadtwerke-florian-bieberbach-energiepreise-interview-1.5727810,0,www.sueddeutsche.de,"SWM: Stadtwerke-Chef: ""Die letzte Gasheizung wird vielleicht erst 2045 abgeschaltet""","Florian Bieberbach erklärt, warum München bei Energie zurzeit zu den teuersten Großstädten Deutschlands gehört - es Preisbremsen aber nicht gebraucht hätte. Ein Gespräch über die Notwendigkeit, Gas zu sparen, und Energie-Prognosen für 2023.",https://www.sueddeutsche.de/image/sz.1.5727811/1200x675?v=1673013838,2023-01-06T13:33:05Z,https://web.archive.org/web/20230106185352/https://www.sueddeutsche.de/muenchen/muenchen-stadtwerke-florian-bieberbach-energiepreise-interview-1.5727810,"6. Januar 2023, 14:33 UhrLesezeit: 6 min
Florian Bieberbach ist seit Januar 2013 Vorsitzender der Geschäftsführung der Stadtwerke München GmbH (SWM). Er sagt: ""Die Mehrzahl der Kunden rief nicht weg… [+798 chars]",,de,'Blackout'
https://www.sueddeutsche.de/muenchen/muenchen-stadtwerke-chef-florian-bieberbach-energiepreise-interview-1.5727810,https://www.sueddeutsche.de/muenchen/muenchen-stadtwerke-chef-florian-bieberbach-energiepreise-interview-1.5727810,0,www.sueddeutsche.de,"SWM: Stadtwerke-Chef: ""Die letzte Gasheizung wird vielleicht erst 2045 abgeschaltet""","Florian Bieberbach erklärt, warum München bei Gas, Strom und Fernwärme zurzeit zu den teuersten Großstädten Deutschlands gehört - und warum es die Preisbremsen des Bundes trotzdem nicht gebraucht hätte. Ein Gespräch über die hohen Erträge der SWM-Windparks un…",https://www.sueddeutsche.de/image/sz.1.5727811/1200x675?v=1673011967,2023-01-06T13:33:05Z,http://archive.md/20230106140141/https://www.sueddeutsche.de/muenchen/muenchen-stadtwerke-chef-florian-bieberbach-energiepreise-interview-1.5727810,"6. Januar 2023, 14:33 UhrLesezeit: 6 min
Florian Bieberbach ist seit Januar 2013 Vorsitzender der Geschäftsführung der Stadtwerke München GmbH (SWM). Er sagt: ""Die Mehrzahl der Kunden rief nicht weg… [+881 chars]",,de,'Blackout'
https://www.zeit.de/news/2023-01/06/mehr-gewalttaten-durch-kinder-und-jugendliche,https://www.zeit.de/news/2023-01/06/mehr-gewalttaten-durch-kinder-und-jugendliche,0,www.zeit.de,Jugend: Mehr Gewalttaten durch Kinder und Jugendliche,,,2023-01-06T16:23:58Z,https://web.archive.org/web/20230106165306/https://www.zeit.de/news/2023-01/06/mehr-gewalttaten-durch-kinder-und-jugendliche,"When browsing with ads:
We collect personal data and also transmit it to third-party providers
 that help us improve and finance our digital content. Some of the information stored on your device, … [+732 chars]",,de,'Kinder'
https://www.nzz.ch/visuals/grippe-corona-und-rsv-virus-deutschland-gehen-die-aerzte-aus-ld.1710078,https://www.nzz.ch/visuals/grippe-corona-und-rsv-virus-deutschland-gehen-die-aerzte-aus-ld.1710078,0,www.nzz.ch,"Die Grippe, Corona und RSV zeigen erneut: Deutschland gehen die Ärzte aus",Wegen Personalmangels müssen Spitäler in Deutschland derzeit Behandlungen verschieben. Überall fehlt es an Ärzten. Doch daran ist nicht nur der demografische Wandel schuld.,"https://img.nzz.ch/2022/12/16/682a26b8-16fc-4289-afbe-66e1048954ad.png?width=1200&height=675&fit=bound&quality=75&auto=webp&crop=1799,1012,x1,y0&wmark=nzz",2023-01-07T04:30:00Z,https://web.archive.org/web/20230107051444/https://www.nzz.ch/visuals/grippe-corona-und-rsv-virus-deutschland-gehen-die-aerzte-aus-ld.1710078,Die Berliner Charité ist Europas grösstes Universitätsspital und eines der renommiertesten Spitäler Deutschlands. Rund 2700 Ärztinnen und Ärzte und über 5000 Pflegekräfte kümmern sich dort um Tausend… [+6629 chars],,de,'Grippe'
https://www.faz.net/aktuell/rhein-main/region-und-hessen/wiesbaden-informiert-die-buerger-worauf-im-notfall-zu-achten-ist-18579281.html,https://www.faz.net/aktuell/rhein-main/region-und-hessen/wiesbaden-informiert-die-buerger-worauf-im-notfall-zu-achten-ist-18579281.html,0,www.faz.net,Notfall-Vorsorge in Wiesbaden: Blackout ist „extrem unwahrscheinlich“,"Ein Blackout gilt zwar als extrem unwahrscheinlich. Die Stadt Wiesbaden erläutert den Bürgern vorsorglich trotzdem, wie sie sich darauf vorbereiten können – und erklärt den Unterschied zwischen Hamstern und Bevorraten.",https://media1.faz.net/ppmedia/aktuell/3657736945/1.8579277/facebook_teaser/wiesbaden-im-notfall-sollen.jpg,2023-01-07T05:30:00Z,https://web.archive.org/web/20230107053154/http://www.faz.net/aktuell/rhein-main/region-und-hessen/wiesbaden-informiert-die-buerger-worauf-im-notfall-zu-achten-ist-18579281.html,Ein großflächiger und länger anhaltender Stromausfall ist in Wiesbaden extrem unwahrscheinlich. Die Stadtwerke Wiesbaden Netz GmbH (sw netz) und die Mainzer Netze GmbH sehen sich in dieser Einschätzu… [+4178 chars],,de,'Blackout'
https://www.stern.de/gesellschaft/regional/hamburg-schleswig-holstein/sprache--gleichstellungssenatorin--gendersprache-muss-moeglich-sein-33076926.html,https://www.stern.de/gesellschaft/regional/hamburg-schleswig-holstein/sprache--gleichstellungssenatorin--gendersprache-muss-moeglich-sein-33076926.html,0,www.stern.de,Sprache: Gleichstellungssenatorin: Gendersprache muss möglich sein,"Eine genderneutrale Sprache soll dafür sorgen, dass sich alle Menschen angesprochen fühlen können - unabhängig von ihrem Geschlecht. Doch das Gendern erregt die Gemüter, und es stellt sich die Frage, wie weit darf es damit im Amtsdeutsch gehen?",https://image.stern.de/33076928/t/p3/v1/w1440/r1.7778/-/07--urnnewsmldpacom2009010123010799134224v2w800h600l1778t135r3107b1910jpeg---0740aaeb04afdcf5.jpg,2023-01-07T08:11:27Z,https://web.archive.org/web/20230107133900/https://www.stern.de/gesellschaft/regional/hamburg-schleswig-holstein/sprache--gleichstellungssenatorin--gendersprache-muss-moeglich-sein-33076926.html,"Eine genderneutrale Sprache soll dafür sorgen, dass sich alle Menschen angesprochen fühlen können - unabhängig von ihrem Geschlecht. Doch das Gendern erregt die Gemüter, und es stellt sich die Frage,… [+2083 chars]",,de,'Geschlecht'
https://www.zeit.de/news/2023-01/07/energetische-sanierung-von-wohnhaeusern-konzepte-foerdern,https://www.zeit.de/news/2023-01/07/energetische-sanierung-von-wohnhaeusern-konzepte-foerdern,0,www.zeit.de,Landespolitik: Energetische Sanierung von Wohnhäusern: Konzepte fördern,,,2023-01-07T09:34:52Z,https://web.archive.org/web/20230107212001/https://www.zeit.de/news/2023-01/07/energetische-sanierung-von-wohnhaeusern-konzepte-foerdern,"When browsing with ads:
We collect personal data and also transmit it to third-party providers
 that help us improve and finance our digital content. Some of the information stored on your device, … [+732 chars]",,de,'Sanierung'
https://www.sport1.de/news/internationaler-fussball/fa-cup/2023/01/fa-cup-irre-liverpool-keeper-alisson-leistet-sich-mega-patzer,https://www.sport1.de/news/internationaler-fussball/fa-cup/2023/01/fa-cup-irre-liverpool-keeper-alisson-leistet-sich-mega-patzer,0,www.sport1.de,FA Cup: Nach Alissons Blackout: Nächster Dämpfer für Liverpool - SPORT1,"<ol><li>FA Cup: Nach Alissons Blackout: Nächster Dämpfer für Liverpool  SPORT1
</li><li>Wolves zwingen Liverpool ins Wiederholungsspiel  kicker
</li><li>FC Liverpool: Jürgen Klopp muss für Cody Gakpo Spieler aus dem Kader rausschmeißen  SportBILD
</li><li>…",https://reshape.sport1.de/c/t/e6867de9-cea2-448c-a6ec-de07ad7beb7c/1200x630,2023-01-07T21:54:08Z,https://web.archive.org/web/20230107211202/http://www.sport1.de/news/internationaler-fussball/fa-cup/2023/01/fa-cup-irre-liverpool-keeper-alisson-leistet-sich-mega-patzer,"Der FC Liverpool hat auch aufgrund eines folgenschweren Fehlers von Alisson Becker den nächsten Rückschlag hinnehmen müssen. Im FA Cup kam das Team von Jürgen Klopp, indem PSV-Neuzugang Cody Gakpo se… [+1807 chars]",,de,'Blackout'
https://web.de/magazine/politik/luisa-neubauer-verstaerkt-klimaaktivisten-luetzerath-37624670,https://web.de/magazine/politik/luisa-neubauer-verstaerkt-klimaaktivisten-luetzerath-37624670,0,web.de,Luisa Neubauer verstärkt Klimaaktivisten in Lützerath - WEB.DE News,"<ol><li>Luisa Neubauer verstärkt Klimaaktivisten in Lützerath  WEB.DE News
</li><li>Lützerath: Blockierer betonieren Gasflaschen ein – Und jetzt kommt Luisa Neubauer  WELT
</li><li>Proteste gegen geplante Räumung: Aktivisten errichten Barrikaden in Lützerat…","https://i0.web.de/image/714/37624714,pd=2,f=opengraph/protest-abriss-dorfes-luetzerath.jpg",2023-01-08T08:34:32Z,https://web.archive.org/web/20230108092553/https://web.de/magazine/politik/luisa-neubauer-verstaerkt-klimaaktivisten-luetzerath-37624670,<ul><li>Der Konflikt um das von Klimaaktivisten besetzte Dorf Lützerath an der Abbruchkante des Rheinischen Tagebaus spitzt sich zu.</li><li>Eine Räumung könnte in wenigen Tagen beginnen.</li><li>Jet… [+3339 chars],,de,'Kohle'
https://www.bild.de/sport/fussball/hoffenheim/bundesliga-fuer-30-mio-euro-leeds-will-bundesliga-stuermer-82479142.bild.html,https://www.bild.de/sport/fussball/hoffenheim/bundesliga-fuer-30-mio-euro-leeds-will-bundesliga-stuermer-82479142.bild.html,0,www.bild.de,Für 30 Mio. Euro! - Leeds will Bundesliga-Star,Der englische Erstligist Leeds United baggert um einen Bundesliga-Star und will ordentlich Kohle hinblättern.,"https://images.bild.de/63ba7eb640c5f6071ead2523/ef64d1c7e4e667750f506be3810e888e,e48cdd98?w=1280",2023-01-08T08:54:55Z,https://web.archive.org/web/20230108085918/https://www.bild.de/sport/fussball/hoffenheim/bundesliga-fuer-30-mio-euro-leeds-will-bundesliga-stuermer-82479142.bild.html,"Die TSG Hoffenheim kennt sich mit Wechseln ihrer Stürmer nach England bestens aus!
Wie Sky und der italienische Transfer-Guru Fabrizio Romano berichten, soll der englische Erstligist Leeds United be… [+2347 chars]",,de,'Kohle'
"https://www.ndr.de/nachrichten/hamburg/Polizeieinsatz-gegen-Klima-Aktivisten-in-Hamburg,polizei6692.html","https://www.ndr.de/nachrichten/hamburg/Polizeieinsatz-gegen-Klima-Aktivisten-in-Hamburg,polizei6692.html",0,www.ndr.de,Polizeieinsatz gegen Klima-Aktivisten in Hamburg - NDR.de,"<ol><li>Polizeieinsatz gegen Klima-Aktivisten in Hamburg  NDR.de
</li><li>Lützerath: Blockierer betonieren Gasflaschen ein – Und jetzt kommt Luisa Neubauer  WELT
</li><li>Lützerath: Klimaaktivisten verkünden Protestpläne  t-online
</li><li>Klimaaktivisten:…",https://www.ndr.de/nachrichten/hamburg/verkehrskontrolle186_v-contentxl.jpg,2023-01-08T09:27:55Z,"https://web.archive.org/web/20230108104243/https://www.ndr.de/nachrichten/hamburg/Polizeieinsatz-gegen-Klima-Aktivisten-in-Hamburg,polizei6692.html","Stand: 08.01.2023 10:25 Uhr
Die Hamburger Polizei hat am frühen Sonntagmorgen einen Protestbus von Klima-Aktivistinnen und -Aktivisten stundenlang gestoppt. Nach Angaben des Lagezentrums wurden die … [+1695 chars]",,de,'Gas'
https://www.tagesspiegel.de/politik/polizei-berichtet-von-gewaltausbruch-bei-blockade-von-klimaschutzaktivisten-9145761.html,https://www.tagesspiegel.de/politik/polizei-berichtet-von-gewaltausbruch-bei-blockade-von-klimaschutzaktivisten-9145761.html,0,www.tagesspiegel.de,Gegen Räumung von Lützerath: Polizei berichtet von Gewaltausbruch bei Blockade von Klimaschutzaktivisten,"Hunderte Demonstranten befinden sich in Lützerath, um eine Räumung des Ortes für den Kohleabbau zu verhindern. Auch Klimaaktivistin Luisa Neubauer ist dabei.",https://www.tagesspiegel.de/images/germany-energy-climate-coal/alternates/BASE_16_9_W1400/germany-energy-climate-coal.jpeg,2023-01-08T10:07:18Z,https://web.archive.org/web/20230108183511/https://www.tagesspiegel.de/politik/polizei-berichtet-von-gewaltausbruch-bei-blockade-von-klimaschutzaktivisten-9145761.html,Im Anschluss an eine Versammlung und ein Konzert im Braunkohleort Lützerath (NRW) am Tagebau Garzweiler am Sonntag ist es zu Übergriffen gekommen. Die Veranstaltungsfläche sei von Aktivisten gestürmt… [+5499 chars],,de,'Kohle'
https://www.tagesspiegel.de/politik/innenminister-reul-sieht-keine-wahl-polizei-blickt-sorgenvoll-auf-raumung-von-lutzerath-9145761.html,https://www.tagesspiegel.de/politik/innenminister-reul-sieht-keine-wahl-polizei-blickt-sorgenvoll-auf-raumung-von-lutzerath-9145761.html,0,www.tagesspiegel.de,Innenminister Reul sieht „keine Wahl“: Polizei blickt „sorgenvoll“ auf Räumung von Lützerath,"Hunderte Demonstranten befinden sich in Lützerath, um eine Räumung des Ortes für den Kohleabbau zu verhindern. Die Räumung dürfte eine Herausforderung für die Polizei werden.",https://www.tagesspiegel.de/images/polizeiwache-im-container/alternates/BASE_16_9_W1400/polizeiwache-im-container.jpeg,2023-01-08T10:07:18Z,https://web.archive.org/web/20230109083723/https://www.tagesspiegel.de/politik/innenminister-reul-sieht-keine-wahl-polizei-blickt-sorgenvoll-auf-raumung-von-lutzerath-9145761.html,"Die Aachener Polizei schaut sorgenvoll auf die kommenden Tage und Wochen, in denen die Räumung des von Klimaaktivisten besetzten Dorfes Lützerath beginnen könnte. Das wird ein herausfordernder Einsat… [+6812 chars]",,de,'Kohle'
https://www.morgenpost.de/politik/article237315133/Luetzerath-vor-der-Raeumung-Vorbereitung-auf-den-Showdown.html,https://www.morgenpost.de/politik/article237315133/Luetzerath-vor-der-Raeumung-Vorbereitung-auf-den-Showdown.html,0,www.morgenpost.de,Klimaschutz: Lützerath vor der Räumung: Vorbereitung auf den Showdown,"RWE will die Kohle unter Lützerath abbaggern, Aktivistinnen und Aktivisten wollen das verhindern – und das Dorf wochenlang halten.",https://img.morgenpost.de/img/politik/crop237315131/0142601744-w820-cv16_9-q85/023ed694-8f53-11ed-9b0f-1fe7b722ba38.jpg,2023-01-08T13:39:32Z,https://web.archive.org/web/20230108140806/https://www.morgenpost.de/politik/article237315133/Luetzerath-vor-der-Raeumung-Vorbereitung-auf-den-Showdown.html,Berlin. Lützerath bereitet sich vor auf den Showdown: Vor einer geplanten Räumung in den kommenden Tagen unterstrichen Vertreterinnen und Vertreter des Bündnisses Lützerath unräumbar ihre Entschlosse… [+2280 chars],,de,'Kohle'
https://www.bild.de/regional/dresden/dresden-aktuell/acht-jahre-eher-raus-widerstand-gegen-frueheren-kohleausstieg-im-osten-82482460.bild.html,https://www.bild.de/regional/dresden/dresden-aktuell/acht-jahre-eher-raus-widerstand-gegen-frueheren-kohleausstieg-im-osten-82482460.bild.html,0,www.bild.de,Acht Jahre eher raus? - Widerstand gegen früheren Kohleausstieg im Osten,Gegen einen vorgezogenen Kohleausstieg 2030 regt sich in Sachsen deutlicher Widerstand.Foto: Patrick Pleul/dpa,"https://images.bild.de/63bac8521b711c51aa7c4212/d1be3e6bf532298b5ed1e3e527184e6f,74424ab4?w=1280",2023-01-08T14:05:16Z,https://web.archive.org/web/20230108140957/https://www.bild.de/regional/dresden/dresden-aktuell/acht-jahre-eher-raus-widerstand-gegen-frueheren-kohleausstieg-im-osten-82482460.bild.html,"Dresden Gegen einen vorgezogenen Kohleausstieg 2030 im Osten regt sich in Sachsen weiter deutlicher Widerstand. 
Der Landesvorstand der CDU fordert die Bundesregierung auf, zum vereinbarten Ausstieg… [+2883 chars]",,de,'Kohle'
https://www.welt.de/politik/deutschland/video243093371/Luisa-Neubauer-in-Luetzerath-Die-Gruenen-haben-mit-diesem-Kohle-Deal-eine-fatale-Entscheidung-getroffen.html,https://www.welt.de/politik/deutschland/video243093371/Luisa-Neubauer-in-Luetzerath-Die-Gruenen-haben-mit-diesem-Kohle-Deal-eine-fatale-Entscheidung-getroffen.html,0,www.welt.de,„Die Grünen haben mit diesem Kohle-Deal eine fatale Entscheidung getroffen“,"Der Konflikt um das von Klimaaktivisten besetzte Dorf Lützerath an der Abbruchkante des Tagebaus spitzt sich zu. Eine Räumung könnte in wenigen Tagen beginnen. Im Interview erklärt „Fridays for Future“-Organisatorin und Grünen-Mitglied Luisa Neubauer, warum s…",https://img.welt.de/img/videos/mobile243093529/4551359117-ci16x9-w1200/start-neubarer-JPG.jpg,2023-01-08T14:53:23Z,https://web.archive.org/web/20230108150647/https://www.welt.de/politik/deutschland/video243093371/Luisa-Neubauer-in-Luetzerath-Die-Gruenen-haben-mit-diesem-Kohle-Deal-eine-fatale-Entscheidung-getroffen.html,"Die WELT als ePaper: Die vollständige Ausgabe steht Ihnen bereits am Vorabend zur Verfügung so sind Sie immer hochaktuell informiert. Weitere Informationen: http://epaper.welt.de 
 Der Kurz-Link die… [+49 chars]",,de,'Kohle'
https://www.freitag.de/autoren/lennart-laberenz/luetzerath-mit-beton-und-barrikaden-gegen-den-kohlebagger,https://www.freitag.de/autoren/lennart-laberenz/luetzerath-mit-beton-und-barrikaden-gegen-den-kohlebagger,0,www.freitag.de,Braunkohle | Lützerath: Mit Beton und Barrikaden gegen den Kohlebagger,"Die Zukunft des Dorfes im rheinischen Kohlerevier entscheidet über Deutschlands Beitrag zum 1,5 Grad-Ziel. Die Räumung soll noch diesen Monat kommen. Vor Ort rüsten sich Aktivisten für die Verteidigung. Ein Besuch Drinnen, im eiskalten Wohnzimmer, hört man nu…",https://www.freitag.de/autoren/lennart-laberenz/luetzerath-mit-beton-und-barrikaden-gegen-den-kohlebagger/@@images/social_image,2023-01-08T15:00:00Z,https://web.archive.org/web/20230108150559/https://www.freitag.de/autoren/lennart-laberenz/luetzerath-mit-beton-und-barrikaden-gegen-den-kohlebagger,"Drinnen, im eiskalten Wohnzimmer, hört man nur einen dünnen Ton. Als schleife Wind beharrlich um Kanten. Obertöne, konstantes Mahlen greift durch den verwilderten Garten, an der Schiebetür fehlt der … [+538 chars]",,de,'Kohle'
https://www.sueddeutsche.de/politik/berlin-gefluechtete-notstand-1.5728227,https://www.sueddeutsche.de/politik/berlin-gefluechtete-notstand-1.5728227,0,www.sueddeutsche.de,"Geflüchtete: ""Das große Ziel ist, Obdachlosigkeit zu vermeiden""",Tag für Tag kommen in Berlin Hunderte Geflüchtete an. Der Senat sucht händeringend Wohnraum und Helfer. Anders als 2015 ist von dem Notstand in der Stadt allerdings kaum etwas zu spüren. Das macht es für die Flüchtlinge nicht leichter.,https://www.sueddeutsche.de/image/sz.1.5728228/1200x675?v=1673180128,2023-01-08T16:07:37Z,,Tag für Tag kommen in Berlin Hunderte Geflüchtete an. Der Senat sucht händeringend Wohnraum und Helfer. Anders als 2015 ist von dem Notstand in der Stadt allerdings kaum etwas zu spüren. Das macht es… [+7533 chars],,de,'Obdachlosigkeit'
https://www.focus.de/immobilien/experten/wohnungsmarkt-kaputt-reguliert-das-kostet-sie-das-gesetz-zur-aufteilung-der-kohlendioxidkosten_id_182565375.html,https://www.focus.de/immobilien/experten/wohnungsmarkt-kaputt-reguliert-das-kostet-sie-das-gesetz-zur-aufteilung-der-kohlendioxidkosten_id_182565375.html,0,www.focus.de,Wohnungsmarkt kaputt reguliert - Das kostet Sie das Gesetz zur Aufteilung der Kohlendioxidkosten,Seit dem 1. Januar 2023 ist das Kohlendioxidkostenaufteilungsgesetz (CO2KostAufG) in Kraft. Es gilt für für Mieter und Vermieter. Und kommt einer erzieherische Maßnahme unter dem Deckmantel des Klimaschutzes gleich. Schade.Von FOCUS-online-Experte Carsten Zim…,https://p6.focus.de/img/fotos/id_179359775/rauch.jpg?im=Crop%3D%280%2C103%2C2048%2C1026%29%3BResize%3D%281200%2C627%29&impolicy=perceptual&quality=medium&hash=e912471710ca1ec20b0e09f491d673fb4a1551dd9caba97b8b0fd052b14f53a4,2023-01-09T10:21:48Z,https://web.archive.org/web/20230109112453/https://www.focus.de/immobilien/experten/wohnungsmarkt-kaputt-reguliert-das-kostet-sie-das-gesetz-zur-aufteilung-der-kohlendioxidkosten_id_182565375.html,Seit dem 1. Januar 2023 ist das Kohlendioxidkostenaufteilungsgesetz (CO2KostAufG) in Kraft. Es gilt für für Mieter und Vermieter. Und kommt einer erzieherische Maßnahme unter dem Deckmantel des Klima… [+10677 chars],,de,'Heizkosten'
https://www.zeit.de/news/2023-01/09/rund-690-000-euro-fuer-sanierung-von-kleist-museum,https://www.zeit.de/news/2023-01/09/rund-690-000-euro-fuer-sanierung-von-kleist-museum,0,www.zeit.de,Frankfurt (Oder): Rund 690.000 Euro für Sanierung von Kleist-Museum,,,2023-01-09T11:38:32Z,https://web.archive.org/web/20230109174040/https://www.zeit.de/news/2023-01/09/rund-690-000-euro-fuer-sanierung-von-kleist-museum,"When browsing with ads:
We collect personal data and also transmit it to third-party providers
 that help us improve and finance our digital content. Some of the information stored on your device, … [+732 chars]",,de,'Sanierung'
