index,url,valid,domain,title,description,image,published,archive,content,quote,language,keyword
https://orf.at/stories/3292000/,https://orf.at/stories/3292000/,0,orf.at,Von Stromausfall zu Stromausfall,"In vielen Teilen der Ukraine ist in den vergangenen Wochen immer wieder das Licht ausgegangen. Grund dafür sind russische Angriffe auf die Energieinfrastruktur des Landes. Moskau betreibe „Energieterror“, heißt es aus Kiew. Die Angriffe treffen das tägliche L…",https://ibs.orf.at/news?image=https%3A%2F%2Fassets.orf.at%2Fmims%2F2022%2F45%2F09%2Fcrops%2Fw%3D1200%2Ch%3D630%2Cq%3D75%2F1556115_master_568509_ukraine_krieg_stromausfaelle_bilder_gal02_kiew_blackout_r.jpg%3Fs%3D2dbd9f43ab6a3c695d430af25787e967d116fd61,2022-11-01T22:49:47Z,,In vielen Teilen der Ukraine ist in den vergangenen Wochen immer wieder das Licht ausgegangen. Grund dafür sind russische Angriffe auf die Energieinfrastruktur des Landes. Moskau betreibe Energieterr… [+239 chars],,de,'Winter'
https://www.sueddeutsche.de/politik/daenemark-wahl-fredriksen-1.5685415,https://www.sueddeutsche.de/politik/daenemark-wahl-fredriksen-1.5685415,0,www.sueddeutsche.de,Wahl in Dänemark: Unklare Verhältnisse,"Die Dänen haben gewählt - und dafür gesorgt, dass das Mitte-Links-Bündnis unter Führung von Ministerpräsidentin Mette Frederiksen die Mehrheit verfehlt. Alles deutet auf schwierige Koalitionsverhandlungen hin.",https://www.sueddeutsche.de/image/sz.1.5685419/1200x675?v=1667340235,2022-11-01T22:04:08Z,,"Die Dänen haben gewählt - und dafür gesorgt, dass das Mitte-Links-Bündnis unter Führung von Ministerpräsidentin Mette Frederiksen die Mehrheit verfehlt. Alles deutet auf schwierige Koalitionsverhandl… [+3675 chars]",,de,'Winter'
https://www.wettbasis.com/sportwetten-tipps/marseille-vs-tottenham-tipp-prognose-quoten-01-11-2022-champions-league,https://www.wettbasis.com/sportwetten-tipps/marseille-vs-tottenham-tipp-prognose-quoten-01-11-2022-champions-league,0,www.wettbasis.com,"Marseille vs. Tottenham Tipp, Prognose & Quoten 01.11.2022 – Champions League - Wettbasis","<ol><li>Marseille vs. Tottenham Tipp, Prognose & Quoten 01.11.2022 – Champions League  Wettbasis
</li><li>Tottenham Hotspur: Nachtruhe in Marseille zweimal gestört  kicker
</li><li>Champions League: Tottenham nach Last-Minute-Wahnsinn weiter - Jubiläum für …",https://www.wettbasis.com/wp-content/uploads/2022/10/tottenham-son-marseille-graetsche-2022.jpg,2022-11-01T21:48:58Z,https://web.archive.org/web/20221101214742/https://www.wettbasis.com/sportwetten-tipps/marseille-vs-tottenham-tipp-prognose-quoten-01-11-2022-champions-league,"Crunchtime in der europäischen Königsklasse. Zum großen Showdown kommt es dabei in Gruppe D, der spannendsten aller Vorrundengruppen vor dem letzten Spieltag der Gruppenphase. Hier würde wohl sogar m… [+10720 chars]",,de,'Winter'
https://www.n-tv.de/politik/Tuerkei-zuversichtlich-Getreideabkommen-bleibt-bestehen--article23143824.html,https://www.n-tv.de/politik/Tuerkei-zuversichtlich-Getreideabkommen-bleibt-bestehen--article23143824.html,0,www.n-tv.de,Ukraine-Krieg im Liveticker: +++ Türkei zuversichtlich: Getreideabkommen bleibt bestehen +++,"Berlin, Washington, Br\u00fcssel - \u00fcberall. n-tv berichtet von allen wichtigen Schaupl\u00e4tzen der Innen- und Au\u00dfenpolitik.",https://bilder2.n-tv.de/img/incoming/crop23332537/9041326157-cImg_16_9-w1200/Liveticker1-grau-1-Kopie.jpg,2022-11-01T21:15:00Z,,"Der türkische Verteidigungsminister Hulusi Akar zeigt sich zuversichtlich, dass das von den UN und seinem Land vermittelte Getreide-Abkommen zwischen Russland und der Ukraine bestehen bleibt. Es gebe… [+29460 chars]",,de,'Winter'
https://www.sueddeutsche.de/muenchen/ebersberg/ebersberg-altes-kino-alter-speicher-vorverkauf-1.5684962,https://www.sueddeutsche.de/muenchen/ebersberg/ebersberg-altes-kino-alter-speicher-vorverkauf-1.5684962,0,www.sueddeutsche.de,Kultur in Ebersberg: Die Magie des Augenblicks,Der Vorverkauf für die Wintersaison im Alten Kino und Alten Speicher hat begonnen.,https://www.sueddeutsche.de/image/sz.1.5624675/1200x675?v=1667319339,2022-11-01T20:49:59Z,,"Der Vorverkauf für die Wintersaison im Alten Kino und Alten Speicher hat begonnen.Der Herbst zeigt sich von der schönsten Seite, da tauchen Altes Kino und Alter Speicher bereits tief in den Winter ei… [+4994 chars]",,de,'Winter'
https://www.tagesspiegel.de/politik/ukraine-invasion-tag-251-der-iran-wird-zum-nebenkriegsschauplatz-8822728.html,https://www.tagesspiegel.de/politik/ukraine-invasion-tag-251-der-iran-wird-zum-nebenkriegsschauplatz-8822728.html,0,www.tagesspiegel.de,Ukraine-Invasion Tag 251: Der Iran wird zum Nebenkriegsschauplatz,"Der Iran liefert weitere Waffen, Putin stellt Bedingungen für Rückkehr zu Getreideabkommen. Der Überblick am Abend.",https://www.tagesspiegel.de/images/conference-on-interaction-and-confidence-building-measures-in-asia/alternates/BASE_16_9_W1400/conference-on-interaction-and-confidence-building-measures-in-asia.jpeg,2022-11-01T19:28:25Z,https://web.archive.org/web/20221101195959/https://www.tagesspiegel.de/politik/ukraine-invasion-tag-251-der-iran-wird-zum-nebenkriegsschauplatz-8822728.html,"Der US-Fernsehsender CNN berichtet (Quelle hier), dass der Iran Boden-Boden-Raketen und weitere Drohnen an Moskau liefern will. So weit, so bekannt (mehr hier). Interessant ist die Gesamtstückzahl de… [+7117 chars]",,de,'Winter'
https://www.n-tv.de/leute/Diese-Stars-kehren-Twitter-den-Ruecken-article23689389.html,https://www.n-tv.de/leute/Diese-Stars-kehren-Twitter-den-Ruecken-article23689389.html,0,www.n-tv.de,"Einige bleiben, um zu ""kämpfen"": Diese Stars kehren Twitter den Rücken",Nach der Twitter-Übernahme will Elon Musk den Kurznachrichtendienst umkrempeln. Gleichzeitig nehmen auf der Plattform rassistische Beleidigungen zu. Einige Stars haben genug und verabschieden sich von Twitter. Andere denken erst darüber nach.,https://bilder1.n-tv.de/img/incoming/crop23689444/3611324958-cImg_16_9-w1200/318759689.jpg,2022-11-01T19:23:35Z,,Nach der Twitter-Übernahme will Elon Musk den Kurznachrichtendienst umkrempeln. Gleichzeitig nehmen auf der Plattform rassistische Beleidigungen zu. Einige Stars haben genug und verabschieden sich vo… [+3671 chars],,de,'Winter'
https://www.n-tv.de/technik/Shahed-Catcher-gegen-iranische-Kamikaze-Drohnen-article23688155.html,https://www.n-tv.de/technik/Shahed-Catcher-gegen-iranische-Kamikaze-Drohnen-article23688155.html,0,www.n-tv.de,"Ukraine geht ""nächsten Schritt"": ""Shahed Catcher"" gegen iranische Kamikaze-Drohnen","Die Ukraine rüstet im Drohnenkrieg auf. Unter anderem soll ein System namens ""Shahed Catcher"" iranische Kamikaze-Drohnen abfangen, indem es sie ""blendet"". Der nächste Schritt seien ""Drohnen, die Drohnen abfangen"", sagt Digitalminister Fedorow. Und alle Ukrain…",https://bilder3.n-tv.de/img/incoming/crop23689158/8891322308-cImg_16_9-w1200/Shahed.jpg,2022-11-01T18:44:51Z,https://web.archive.org/web/20221101214919/https://www.n-tv.de/technik/Shahed-Catcher-gegen-iranische-Kamikaze-Drohnen-article23688155.html,"Die Ukraine rüstet im Drohnenkrieg auf. Unter anderem soll ein System namens ""Shahed Catcher"" iranische Kamikaze-Drohnen abfangen, indem es sie ""blendet"". Der nächste Schritt seien ""Drohnen, die Droh… [+7400 chars]",,de,'Winter'
https://www.kicker.de/achillessehne-betroffen-muss-kimpembe-die-wm-sausen-lassen-923884/artikel,https://www.kicker.de/achillessehne-betroffen-muss-kimpembe-die-wm-sausen-lassen-923884/artikel,0,www.kicker.de,Achillessehne betroffen: Muss Kimpembe die WM sausen lassen?,Der Titelverteidiger bei der kommenden Winter-Weltmeisterschaft in Katar hat bislang so einige personelle Fragezeichen. Das neueste kommt aus Paris: PSG-Profi Presnel Kimpembe fehlt Frankreich womöglich.,"https://derivates.kicker.de/image/upload/c_crop,x_0,y_108,w_3239,h_1822/w_1200,q_auto/v1/2022/11/01/24c5d04e-6d95-49a3-bf29-96129932ae5a.jpeg",2022-11-01T17:55:00Z,,Der Titelverteidiger bei der kommenden Winter-Weltmeisterschaft in Katar hat bislang so einige personelle Fragezeichen. Das neueste kommt aus Paris: PSG-Profi Presnel Kimpembe fehlt Frankreich womögl… [+1799 chars],,de,'Winter'
https://www.sueddeutsche.de/muenchen/luitpoldpark-bye-bye-goldener-herbst-1.5685364,https://www.sueddeutsche.de/muenchen/luitpoldpark-bye-bye-goldener-herbst-1.5685364,0,www.sueddeutsche.de,"Luitpoldpark: Bye-bye, goldener Herbst!","Die Halloween-Kürbisse sind fast schon verrottet, zum Kastaniensammeln ist es zu spät, nur ein wenig Sonne hat der Oktober noch übriggelassen für einen letzten...",https://www.sueddeutsche.de/image/sz.1.5685365/1200x675?v=1667320036,2022-11-01T17:49:51Z,,"Die Halloween-Kürbisse sind fast schon verrottet, zum Kastaniensammeln ist es zu spät, nur ein wenig Sonne hat der Oktober noch übriggelassen für einen letzten Spaziergang ohne warme Schuhe und Regen… [+991 chars]",,de,'Winter'
https://www.bild.de/sport/fussball/hannover-96/hannover-96-sebastian-kerk-und-sebastian-stolze-absturz-im-doppelpack-81802916.bild.html,https://www.bild.de/sport/fussball/hannover-96/hannover-96-sebastian-kerk-und-sebastian-stolze-absturz-im-doppelpack-81802916.bild.html,0,www.bild.de,Kerk und Stolze - Sebi-Absturz im Doppelpack bei 96,Die 96-Profis Sebastian Kerk und Sebastian Stolze. Gegen den KSC hockten beide Sebis 90 Minuten auf der Bank.,"https://images.bild.de/6361442a1b6fd64732ea8249/1d240dfeb6f61e7b2e951a87ace35181,a0ed67?w=1280",2022-11-01T17:45:15Z,https://web.archive.org/web/20221101184910/https://www.bild.de/sport/fussball/hannover-96/hannover-96-sebastian-kerk-und-sebastian-stolze-absturz-im-doppelpack-81802916.bild.html,"Im Sommer 2021 war alles Sebi bei 
Hannover 96.
Die ersten drei Neuen von Sportchef Marcus Mann und Ex-Trainer Jan Zimmermann waren alles Sebis: Sebastian Ernst (27), Sebastian Stolze (27) und Seba… [+2399 chars]",,de,'Winter'
https://www.welt.de/politik/deutschland/article241912735/Niedersachsen-Wenn-ein-gruener-Atomkraftgegner-die-AKW-Aufsicht-bekommt.html,https://www.welt.de/politik/deutschland/article241912735/Niedersachsen-Wenn-ein-gruener-Atomkraftgegner-die-AKW-Aufsicht-bekommt.html,0,www.welt.de,Wenn ein grüner Atomkraftgegner die AKW-Aufsicht bekommt,Der Grüne Christian Meyer gilt als entschiedener Gegner der AKW-Laufzeitverlängerung. Als künftiger Umweltminister Niedersachsens wird er für die Sicherheitsüberprüfungen des Kraftwerks Emsland zuständig sein. Dessen Restlauf-Frist könnte auf ein sehr übersch…,https://img.welt.de/img/politik/deutschland/mobile241914345/8701350827-ci16x9-w1200/DWO-Teaser-Weil-Meyer-ms-jpg.jpg,2022-11-01T17:40:36Z,http://archive.md/20221101201841/https://www.welt.de/politik/deutschland/article241912735/Niedersachsen-Wenn-ein-gruener-Atomkraftgegner-die-AKW-Aufsicht-bekommt.html,"Besonders gut hatten Niedersachsens Grüne nicht abgeschnitten bei der Landtagswahl am 9. Oktober. 14,5 Prozent waren gerade noch so erträglich angesichts von 18 bis 20 Prozent, auf die die Partei der… [+4755 chars]",,de,'Winter'
https://www.bild.de/sport/fussball/fussball-international/wie-dirk-nowitzki-deutschem-fussballer-gelingt-in-den-usa-ein-historischer-erfol-81795188.bild.html,https://www.bild.de/sport/fussball/fussball-international/wie-dirk-nowitzki-deutschem-fussballer-gelingt-in-den-usa-ein-historischer-erfol-81795188.bild.html,0,www.bild.de,Was für eine Ehre für Hany Mukhtar - Deutscher US-Profi ist der Fußball-Nowitzki!,Hany Mukthar hat als dritter Deutscher den MVP-Award in einer US-Profi-Liga erhalten. Warum Flick dennoch nicht mit ihm plant.Foto: Reuters,"https://images.bild.de/63603f04e146ff35a368e77c/73706d31f6ea50ae0ac42ca971c5c763,8bdf49b2?w=1280",2022-11-01T17:40:20Z,https://web.archive.org/web/20221101184312/https://www.bild.de/sport/fussball/fussball-international/wie-dirk-nowitzki-deutschem-fussballer-gelingt-in-den-usa-ein-historischer-erfol-81795188.bild.html,"Es ist die größte Auszeichnung der amerikanischen Profi-Ligen jetzt hat sie der dritte Deutsche erhalten!
Fußballer Hany Mukhtar (27) wurde in den USA zum wertvollsten Spieler der Major League Socce… [+2796 chars]",,de,'Winter'
https://www.giga.de/news/reichweite-bei-e-autos-so-weit-kommt-ihr-mit-eurem-stromer-wirklich/,https://www.giga.de/news/reichweite-bei-e-autos-so-weit-kommt-ihr-mit-eurem-stromer-wirklich/,0,www.giga.de,Reichweite bei E-Autos: So weit kommt ihr mit eurem Stromer wirklich,"Die Reichweite ist für E-Auto-Käufer eines der wichtigsten Kriterien. Hersteller überbieten sich daher mit immer neuen Spitzenwerten. Dabei ist klar: Die Maximalreichweite holt ihr im Alltag ohnehin nicht raus. Der ADAC verrät, was von den Angaben der Herstel…",https://crops.giga.de/4f/e8/2b/e9a68fa7596ddf441393e7d9ec_YyAxODA1eDk0Mys1OCsxNjgCcmUgMTIwMCA2MjcDNDhlNmE5ZDQ5N2U=.jpg,2022-11-01T17:39:57Z,,Die Reichweite ist für E-Auto-Käufer eines der wichtigsten Kriterien. Hersteller überbieten sich daher mit immer neuen Spitzenwerten. Dabei ist klar: Die Maximalreichweite holt ihr im Alltag ohnehin … [+2386 chars],,de,'Winter'
https://www.stern.de/sport/bvb-kapitaen--rennen-gegen-die-zeit--reus-hofft-auf-wm-platz-32870736.html,https://www.stern.de/sport/bvb-kapitaen--rennen-gegen-die-zeit--reus-hofft-auf-wm-platz-32870736.html,0,www.stern.de,BVB-Kapitän: Rennen gegen die Zeit: Reus hofft auf WM-Platz,Marco Reus gilt als Pechvogel des deutschen Nationalteams. Nach bereits zwei verletzungsbedingt verpassten großen Turnieren wird für den BVB-Kapitän nun auch die Zeit bis zur WM in Katar knapp.,https://image.stern.de/32870738/t/cm/v1/w1440/r1.7778/-/01--urnnewsmldpacom2009010122110199345466v3w800h600l710t26r1990b905jpeg---c85f27a1bbc6e50d.jpg,2022-11-01T17:32:22Z,,"Marco Reus gilt als Pechvogel des deutschen Nationalteams. Nach bereits zwei verletzungsbedingt verpassten großen Turnieren wird für den BVB-Kapitän nun auch die Zeit bis zur WM in Katar knapp.
Die … [+2695 chars]",,de,'Winter'
https://www.stern.de/gesellschaft/regional/nordrhein-westfalen/champions-league--rennen-gegen-die-zeit--reus-hofft-auf-wm-platz-32870622.html,https://www.stern.de/gesellschaft/regional/nordrhein-westfalen/champions-league--rennen-gegen-die-zeit--reus-hofft-auf-wm-platz-32870622.html,0,www.stern.de,Champions League: Rennen gegen die Zeit: Reus hofft auf WM-Platz,Marco Reus gilt als Pechvogel des deutschen Nationalteams. Nach bereits zwei verletzungsbedingt verpassten großen Turnieren wird für den BVB-Kapitän nun auch die Zeit bis zur WM in Katar knapp.,https://image.stern.de/32870624/t/FY/v1/w1440/r1.7778/-/01--urnnewsmldpacom2009010122110199345369v3w800h600l975t39r2255b918jpeg---3630d6d7f6292b5b.jpg,2022-11-01T17:26:55Z,,"Marco Reus gilt als Pechvogel des deutschen Nationalteams. Nach bereits zwei verletzungsbedingt verpassten großen Turnieren wird für den BVB-Kapitän nun auch die Zeit bis zur WM in Katar knapp.
Die … [+2674 chars]",,de,'Winter'
https://www.transfermarkt.de/xavis-reaktion-auf-lewandowski-bdquo-vielleicht-fehlt-uns-die-reife-ldquo-ndash-transfers-nicht-ausgeschlossen/view/news/413188,https://www.transfermarkt.de/xavis-reaktion-auf-lewandowski-bdquo-vielleicht-fehlt-uns-die-reife-ldquo-ndash-transfers-nicht-ausgeschlossen/view/news/413188,0,www.transfermarkt.de,FC Barcelona: Xavi reagiert auf Robert Lewandowskis Aussagen,Die Enttäuschung über das Verpassen der Champions-League-K.o.-Phase ist beim FC Barcelona in diesen Tagen nach wie vor spürbar. Das Duell mit Viktoria Pilsen am...,https://tmssl.akamaized.net/images/foto/big/xavi-robert-lewandowski-1667320742-95427.jpg?lm=1667320752,2022-11-01T17:18:01Z,,"Vor CL-Spiel gegen Pilsen 
Die Enttäuschung über das Verpassen der Champions-League-K.o.-Phase ist beim FC Barcelona in diesen Tagen nach wie vor spürbar. Das Duell mit Viktoria Pilsen am Dienstagab… [+4092 chars]",,de,'Winter'
https://www.morgenpost.de/politik/article236805713/gaspreisbremse-winter-preise-energie-gas-kommentar.html,https://www.morgenpost.de/politik/article236805713/gaspreisbremse-winter-preise-energie-gas-kommentar.html,0,www.morgenpost.de,Kommentar: Trotz Gaspreisbremse: Dieser Winter bleibt teuer,Die Gaspreisbremse kommt. Aber klar ist: Energie bleibt dennoch teuer und Gas ein knappes Gut. Der Winter wird nicht sorgenfrei werden.,https://img.morgenpost.de/img/politik/crop236805711/4442603065-w820-cv16_9-q85/39759c10-5a01-11ed-b3f8-977c7755fac0.jpg,2022-11-01T17:17:26Z,,"Berlin.  Die gute Nachricht vor dem Winter: Das Konzept der Bundesregierung für eine Gaspreisbremse nimmt Gestalt an. Den Abschlag für Dezember übernimmt erst einmal der Staat, diesen Beschluss will … [+1895 chars]",,de,'Winter'
https://www.faz.net/aktuell/politik/inland/habeck-spricht-mit-unternehmern-in-sachsen-ueber-energie-18429806.html,https://www.faz.net/aktuell/politik/inland/habeck-spricht-mit-unternehmern-in-sachsen-ueber-energie-18429806.html,0,www.faz.net,Habeck tagt mit sächsischem Kabinett und Unternehmern,Die Wirtschaft in Ostdeutschland ist krisenanfälliger als im Westen. Bundeswirtschaftsminister Robert Habeck weiß das. Trotzdem schlägt ihm in Dresden der geballte Frust entgegen.,https://media0.faz.net/ppmedia/aktuell/politik/3075644558/1.8429980/facebook_teaser/robert-habeck-und-michael.jpg,2022-11-01T17:12:04Z,https://web.archive.org/web/20221101171327/http://www.faz.net/aktuell/politik/inland/habeck-spricht-mit-unternehmern-in-sachsen-ueber-energie-18429806.html,Beinahe täglicher Protest macht offensichtlich auch wütendste Wutbürger mal müde. Am Dienstagnachmittag ließen sich jedenfalls trotz reichweitenstarken Aufrufs im Messengerdienst Telegram nur etwa dr… [+5574 chars],,de,'Winter'
https://www.spiegel.de/ausland/russland-trifft-zivile-ziele-in-der-ukraine-sie-wollen-uns-alle-ausloeschen-a-7629399d-0fd0-4b98-9eab-99440689c0f5,https://www.spiegel.de/ausland/russland-trifft-zivile-ziele-in-der-ukraine-sie-wollen-uns-alle-ausloeschen-a-7629399d-0fd0-4b98-9eab-99440689c0f5,0,www.spiegel.de,Russland trifft zivile Ziele in der Ukraine: »Sie wollen uns alle auslöschen«,Marschflugkörper gegen Schulen und Wohngebäude: Bei Putins Angriffskrieg gegen die Ukraine werden immer wieder auch zivile Ziele getroffen. Viele Menschen reagieren auf den Terror inzwischen mit Fatalismus.,https://cdn.prod.www.spiegel.de/images/d285b3d0-b8d5-47cb-a2f1-2d994252181c_w1280_r1.77_fpx69.86_fpy54.98.jpg,2022-11-01T17:05:05Z,https://web.archive.org/web/20221101170816/https://www.spiegel.de/ausland/russland-trifft-zivile-ziele-in-der-ukraine-sie-wollen-uns-alle-ausloeschen-a-7629399d-0fd0-4b98-9eab-99440689c0f5,"Russland trifft zivile Ziele in der Ukraine»Sie wollen uns alle auslöschen«
Russland will den Ukrainern einen harten Winter bescheren: Bei den jüngsten Raketenangriffen zielte Moskau vor allem auf E… [+3462 chars]",,de,'Winter'
https://www.urlaubspiraten.de/hotels/berghotel-hinterduxerhof-kufstein,https://www.urlaubspiraten.de/hotels/berghotel-hinterduxerhof-kufstein,0,www.urlaubspiraten.de,Winter am Wilden Kaiser,2 Nächte im Berghotel ab 99€ p.P. ✔️ Halbpension Plus ✔️ unweit von Kufstein ✔️ Wintertermine ✔️ Jetzt günstig buchen!,https://image.urlaubspiraten.de/720/image/upload/v1662044652/Impressions%20and%20Other%20Assets/shutterstock_1663769008_mqdmy6.jpg,2022-11-01T17:01:00Z,https://web.archive.org/web/20210816130508/https://www.urlaubspiraten.de/hotels/berghotel-hinterduxerhof-kufstein,"Euer Hotel
Beim Berghotel Hinterduxerhof handelt es sich um ein familiengeführtes Hotel rund 4km entfernt vom Zentrum Kufsteins. Das Hotel ist Mitglied der Tiroler Wirtshauskultur, weshalb euch währ… [+1757 chars]",,de,'Winter'
https://www.sueddeutsche.de/politik/energiekrise-sparen-gas-und-strompreisbremse-massnahmen-1.5685340,https://www.sueddeutsche.de/politik/energiekrise-sparen-gas-und-strompreisbremse-massnahmen-1.5685340,0,www.sueddeutsche.de,Preisbremse für Gas und Strom: Wie die Bundesregierung die Bürger entlasten will,Die Bundesregierung will die Bürger in der Energiekrise entlasten - und gleichzeitig zum Sparen von Gas und Strom bringen,https://www.sueddeutsche.de/image/sz.1.5685341/1200x675?v=1667322598,2022-11-01T17:00:40Z,,"Wie die Bundesregierung die Bürger entlasten und gleichzeitig zum Sparen von Strom und Gas animieren will. Wer wollte es den Menschen verübeln, dass sie den Sommer im Herbst noch einmal in vollen Züg… [+8204 chars]",,de,'Winter'
https://www.freitag.de/autoren/der-freitag/fussball-wm-olympia-co-gegen-permanenten-boykott-helfen-nur-radikale-ideen,https://www.freitag.de/autoren/der-freitag/fussball-wm-olympia-co-gegen-permanenten-boykott-helfen-nur-radikale-ideen,0,www.freitag.de,"Sport | Fußball-WM, Olympia & Co: Gegen den permanenten Boykott helfen nur radikale Maßnahmen","Skavenarbeit, Homophobie, Kriegsbeteiligungen: Irgendwas ist immer. Große Sportevents gehören deshalb bis auf Weiteres in möglichst unwichtige Kleinstaaten Und nun zum Sport. Ernsthaft? In Zeiten wie diesen? Genau über diesen Reflex muss reden, wem der Sport …",https://www.freitag.de/autoren/der-freitag/fussball-wm-olympia-co-gegen-permanenten-boykott-helfen-nur-radikale-ideen/@@images/social_image,2022-11-01T17:00:00Z,,"Und nun zum Sport. Ernsthaft? In Zeiten wie diesen? Genau über diesen Reflex muss reden, wem der Sport etwas bedeutet. Und das sollte er, denn er ist ein Blitzableiter. Er konzentriert die Leidenscha… [+4081 chars]",,de,'Winter'
https://www.nzz.ch/schweiz/merkwuerdige-uebersterblichkeit-in-der-schweiz-in-diesem-herbst-ld.1710104,https://www.nzz.ch/schweiz/merkwuerdige-uebersterblichkeit-in-der-schweiz-in-diesem-herbst-ld.1710104,0,www.nzz.ch,Merkwürdige Übersterblichkeit in der Schweiz in diesem Herbst – seit Ende September starben 700 bis 800 Menschen mehr als erwartet,Der Hitzesommer dieses Jahres hat in der Schweiz viele Todesopfer gefordert. Seit vier Wochen weisen die Bundesstatistiker für die Altersgruppe 65+ erneut eine Übersterblichkeit aus – und diesmal sind Erklärungen schwieriger.,"https://img.nzz.ch/2022/01/17/cd1b9be2-bbe3-4335-95c1-e0622a78cb52.jpeg?width=1200&height=674&fit=bound&quality=75&auto=webp&crop=5746,3228,x0,y301&wmark=nzz",2022-11-01T17:00:00Z,http://archive.md/20221101202012/https://www.nzz.ch/schweiz/merkwuerdige-uebersterblichkeit-in-der-schweiz-in-diesem-herbst-ld.1710104,"Intensivstation für Covid-19-Patienten. Es ist unklar, wie stark die jüngste Übersterblichkeit der Pandemie anzulasten ist.
Gemessen an den offiziellen Todeszahlen ist die schlimmste Phase der Coron… [+5322 chars]",,de,'Winter'
https://www.tagesspiegel.de/berlin/bezirke/bei-uns-findet-jeder-geborgenheit-johanniter-offnen-notunterkunft-fur-obdachlose-in-berlin-kreuzberg-8821987.html,https://www.tagesspiegel.de/berlin/bezirke/bei-uns-findet-jeder-geborgenheit-johanniter-offnen-notunterkunft-fur-obdachlose-in-berlin-kreuzberg-8821987.html,0,www.tagesspiegel.de,„Bei uns findet jeder Geborgenheit“: Johanniter öffnen Notunterkunft für Obdachlose in Berlin-Kreuzberg,"In der ehemaligen Gerhart-Hauptmann-Schule ist Platz für rund 80 Menschen. Neben warmen Mahlzeiten, Duschen und Gesprächen gibt es dort auch ärztliche Hilfe.",https://www.tagesspiegel.de/images/obdachlos1/alternates/BASE_16_9_W1400/obdachlos.jpeg,2022-11-01T16:58:50Z,https://web.archive.org/web/20221101184724/https://www.tagesspiegel.de/berlin/bezirke/bei-uns-findet-jeder-geborgenheit-johanniter-offnen-notunterkunft-fur-obdachlose-in-berlin-kreuzberg-8821987.html,"Hilfe für Obdachlose in den Nächten, die jetzt kälter werden: Die Johanniter haben am Dienstag wieder ihre Notübernachtung in der Ohlauer Straße 22 in Berlin-Kreuzberg, der ehemaligen Gerhart-Hauptma… [+2832 chars]",,de,'Winter'
https://www.stern.de/sport/champions-league--entspannter-showdown-fuer-bvb---reus-macht-fortschritte-32868702.html,https://www.stern.de/sport/champions-league--entspannter-showdown-fuer-bvb---reus-macht-fortschritte-32868702.html,0,www.stern.de,Champions League: Entspannter Showdown für BVB - Reus macht Fortschritte,Als Gruppenzweiter hat der BVB die Qualifikation für das Achtelfinale in der Champions League bereits sicher. Deshalb könnten in Kopenhagen Kräfte geschont werden. Doch die Siegprämie lockt.,https://image.stern.de/32868704/t/aD/v3/w1440/r1.7778/-/01--urnnewsmldpacom2009010122110199339306v2w800h600l695t54r1997b1011jpeg---7b1ae9545902d2d2.jpg,2022-11-01T16:55:35Z,,"Als Gruppenzweiter hat der BVB die Qualifikation für das Achtelfinale in der Champions League bereits sicher. Deshalb könnten in Kopenhagen Kräfte geschont werden. Doch die Siegprämie lockt.
Ein Spa… [+3826 chars]",,de,'Winter'
https://www.welt.de/politik/ausland/article241896231/Ukraine-News-Getreideabkommen-Putin-telefoniert-mit-Erdogan.html,https://www.welt.de/politik/ausland/article241896231/Ukraine-News-Getreideabkommen-Putin-telefoniert-mit-Erdogan.html,0,www.welt.de,Putin telefoniert mit Erdogan – und stellt Bedingungen für Rückkehr zu Getreidedeal,"In einem Telefonat mit dem türkischen Präsidenten hat Wladimir Putin „echte Garantien“ von Kiew für das Getreideabkommen gefordert. Die Ukraine warf Moskau vor, das Abkommen unter „falschem Vorwand“ ausgesetzt zu haben. Mehr im Liveticker.",https://img.welt.de/img/politik/ausland/mobile241913905/0581355947-ci16x9-w1200/Russia-Azerbaijan-Armenia.jpg,2022-11-01T16:49:00Z,https://web.archive.org/web/20221101170007/https://www.welt.de/politik/ausland/article241896231/Ukraine-News-Getreideabkommen-Putin-telefoniert-mit-Erdogan.html,Der russische Präsident Wladimir Putin hat echte Garantien von Kiew für die Einhaltung des Abkommens über ukrainische Getreideexporte gefordert. Diese Forderung habe Putin in einem Telefonat mit dem … [+26950 chars],,de,'Winter'
