index,url,valid,domain,title,description,image,published,archive,content,quote,language,keyword
https://www.handelsblatt.com/politik/deutschland/energieversorgung-wie-sicher-ist-die-gasversorgung-im-naechsten-winter/28973210.html,https://www.handelsblatt.com/politik/deutschland/energieversorgung-wie-sicher-ist-die-gasversorgung-im-naechsten-winter/28973210.html,0,www.handelsblatt.com,Energieversorgung: Der nächste Winter wird zum Belastungstest für die Gasversorgung,Diesen Winter dürfte in Deutschland kein Gas fehlen. Einer Studie zufolge ist das für die nächste Heizperiode aber unsicher – auch weil Haushalte und Industrie nicht mehr so viel Energie sparen.,https://www.handelsblatt.com/images/schwimmendes-lng-terminal-neptune-im-hafen-von-lubmin/28973298/5-format2003.jpg,2023-02-10T11:37:34Z,https://web.archive.org/web/20230210124912/https://www.handelsblatt.com/politik/deutschland/energieversorgung-wie-sicher-ist-die-gasversorgung-im-naechsten-winter/28973210.html,"Schwimmendes LNG-Terminal Neptune"" im Hafen von LubminPipeline-Gas aus Russland muss durch Flüssigerdgas ((LNG) ersetzt werden.
(Foto: Paul-Langrock.de) 
Berlin Der Winter ist zwar noch nicht vorüb… [+1271 chars]",,de,'Gas'
https://www.zeit.de/entdecken/2023-02/torero-schulen-spanien-stierkampf-madrid-kinder,https://www.zeit.de/entdecken/2023-02/torero-schulen-spanien-stierkampf-madrid-kinder,0,www.zeit.de,"Torero-Schulen in Spanien: Der Tod, ein Kinderspiel","Der Stierkampf ist in Spanien umstritten wie nie. Trotzdem trainieren in eigenen Schulen Kinder dafür, Torero zu werden.",,2023-02-10T12:06:21Z,https://web.archive.org/web/20230210122312/https://www.zeit.de/entdecken/2023-02/torero-schulen-spanien-stierkampf-madrid-kinder,"When browsing with ads:
We collect personal data and also transmit it to third-party providers
 that help us improve and finance our digital content. Some of the information stored on your device, … [+732 chars]",,de,'Kinder'
https://tirol.orf.at/stories/3194189/,https://tirol.orf.at/stories/3194189/,0,tirol.orf.at,TIWAG gibt höhere Einkaufspreise weiter,"Anfang Juni bzw Anfang Juli steigen in Tirol die Preise bei Strom und Gas stark. Man müsse die erhöhten Großhandelspreise an die Kunden weitergeben, erklärte TIWAG-Vorstandsvorsitzender Erich Entstrasser. Das Land stellt einen zweistelligen Millionenbetrag fü…",https://ibs.orf.at/tir?image=https%3A%2F%2Foekastatic.orf.at%2Fmims%2F2020%2F07%2F48%2Fcrops%2Fw%3D1200%2Ch%3D627%2Cq%3D75%2F465239_master_155548_tiwag.jpg%3Fs%3D875a9e8f23f6e6681f4bf54fe931d85fc8981a89,2023-02-10T12:28:24Z,https://web.archive.org/web/20230210125425/https://tirol.orf.at/stories/3194189/,"Der Strompreis erhöht sich um rund 28 Prozent, das sind etwa 18 Euro im Monat für einen durchschnittlichen Haushalt. Bei Gas verdoppelt sich der Preis sogar, die monatliche Mehrbelastung beträgt rund… [+4365 chars]",,de,'Gas'
https://www.n-tv.de/politik/Regierung-von-Moldau-tritt-zurueck-article23908122.html,https://www.n-tv.de/politik/Regierung-von-Moldau-tritt-zurueck-article23908122.html,0,www.n-tv.de,Turbulente Lage im Land: Regierung von Moldau tritt zurück,Die Regierung des kleinen Moldau reagiert auf die Auswirkungen des russischen Angriffskriegs im eigenen Land - und tritt zurück. Die Preissteigerungen und die große Abhängigkeit von russischem Gas führten zu zahlreichen Protesten. Hinter dem Rücktritt wird je…,https://bilder3.n-tv.de/img/incoming/crop23908154/3211322858-cImg_16_9-w1200/394378160.jpg,2023-02-10T12:28:26Z,https://web.archive.org/web/20230211062027/https://www.n-tv.de/politik/Regierung-von-Moldau-tritt-zurueck-article23908122.html,Die Regierung des kleinen Moldau reagiert auf die Auswirkungen des russischen Angriffskriegs im eigenen Land - und tritt zurück. Die Preissteigerungen und die große Abhängigkeit von russischem Gas fü… [+1679 chars],,de,'Gas'
https://www.faz.net/aktuell/politik/ausland/russische-kriegsverbrechen-wie-moskau-ukrainische-kinder-klaut-18652181.html,https://www.faz.net/aktuell/politik/ausland/russische-kriegsverbrechen-wie-moskau-ukrainische-kinder-klaut-18652181.html,0,www.faz.net,Russische Kriegsverbrechen: Wie Moskau ukrainische Kinder klaut,"Zehntausende Jungen und Mädchen sind seit Beginn des Krieges aus der Ukraine verschleppt worden. Etliche wurden schon von russischen Familien zwangsadoptiert, nur wenigen gelingt die Rückkehr.",https://media0.faz.net/ppmedia/aktuell/3304951658/1.8652180/facebook_teaser/kinder-in-einem-lager-am.jpg,2023-02-10T12:45:55Z,https://web.archive.org/web/20230210144155/https://www.faz.net/aktuell/politik/ausland/russische-kriegsverbrechen-wie-moskau-ukrainische-kinder-klaut-18652181.html,"Serhij aus der Nähe von Mariupol erlebt im Dezember ein Weihnachtswunder. Nach fast acht Monaten kehrt er in die Ukraine zurück. Am Kiewer Hauptbahnhof, so zeigt es ein Foto, empfängt ihn ein Vertret… [+3678 chars]",,de,'Kinder'
https://www.handelsblatt.com/unternehmen/energie/gasspeicher-in-deutschland-fuellstand-liegt-nun-bei-74-prozent/28819652.html,https://www.handelsblatt.com/unternehmen/energie/gasspeicher-in-deutschland-fuellstand-liegt-nun-bei-74-prozent/28819652.html,0,www.handelsblatt.com,Gasspeicher in Deutschland: Füllstand liegt nun bei 74 Prozent,Ein hoher Gasspeicher-Füllstand ist für Deutschlands Gasversorgung in der Energiekrise essenziell. Wie steht es aktuell um die Gasreserven? Ein Überblick.,https://www.handelsblatt.com/images/gasspeicher-in-sachsen-anhalt/28877480/2-format2003.jpg,2023-02-10T12:51:31Z,https://web.archive.org/web/20230210132057/https://www.handelsblatt.com/unternehmen/energie/gasspeicher-in-deutschland-fuellstand-liegt-nun-bei-74-prozent/28819652.html,"Gasspeicher in Sachsen-AnhaltDer Gasspeicher-Füllstand in Deutschland ist in der Energiekrise zum wichtigen Faktor geworden.
(Foto: dpa)
Düsseldorf Ein stabiler Füllstand der deutschen Gasspeicher … [+7435 chars]",,de,'Gas'
https://www.zeit.de/news/2023-02/10/aok-kleine-kinder-verbringen-viel-zeit-an-digitalen-geraeten,https://www.zeit.de/news/2023-02/10/aok-kleine-kinder-verbringen-viel-zeit-an-digitalen-geraeten,0,www.zeit.de,Medienkonsum: AOK: Kleine Kinder verbringen viel Zeit an digitalen Geräten,,,2023-02-10T13:28:15Z,,"When browsing with ads:
We collect personal data and also transmit it to third-party providers
 that help us improve and finance our digital content. Some of the information stored on your device, … [+732 chars]",,de,'Kinder'
https://www.handelsblatt.com/unternehmen/gasheizung-was-kostet-die-waermepumpe-langfristig-im-vergleich/28822824.html,https://www.handelsblatt.com/unternehmen/gasheizung-was-kostet-die-waermepumpe-langfristig-im-vergleich/28822824.html,0,www.handelsblatt.com,Das Beste aus 2022: Was kostet die Wärmepumpe langfristig im Vergleich?,"Hohe Energiepreise drängen zum Umrüsten der Gasheizung. Was kosten die Alternativen Wärmepumpe, Fernwärme und Pelletheizung langfristig im Vergleich? Eine Übersicht.",https://www.handelsblatt.com/images/heizkosten/28886330/2-format2003.png,2023-02-10T13:39:57Z,https://web.archive.org/web/20230210142337/https://www.handelsblatt.com/unternehmen/gasheizung-was-kostet-die-waermepumpe-langfristig-im-vergleich/28822824.html,"HeizkostenBeim Erneuern oder Umrüsten einer Gasheizung auf Wärmepumpe, Fernwärme oder Pelletheizung summieren sich die Kosten.
(Foto: Getty Images) 
Düsseldorf Obwohl die Füllstände der Gasspeicher… [+1219 chars]",,de,'Gasspeicher'
https://www.n-tv.de/panorama/Kaelte-hilft-Verschuetteten-beim-Uberleben-article23907661.html,https://www.n-tv.de/panorama/Kaelte-hilft-Verschuetteten-beim-Uberleben-article23907661.html,0,www.n-tv.de,"Noch Rettungschancen nach Beben?: ""Kälte hilft Verschütteten beim Überleben""",Die kritische Überlebensgrenze nach Erdbeben liegt für Menschen bei ungefähr 72 Stunden. Diese sind mittlerweile überschritten. Freiwillige aus Deutschland suchen trotzdem weiter nach Leben. Die Eisestemperaturen in der Türkei kommen ihnen dabei sogar entgege…,https://bilder2.n-tv.de/img/incoming/crop23907773/3791323570-cImg_16_9-w1200/394750247.jpg,2023-02-10T13:58:47Z,https://web.archive.org/web/20230210143248/https://www.n-tv.de/panorama/Kaelte-hilft-Verschuetteten-beim-Uberleben-article23907661.html,"Mit jeder Stunde nimmt die Chance, nach dem Erdbeben noch Überlebende unter den Trümmern zu finden, ab. Mittlerweile ist die kritische Überlebensgrenze von 72 Stunden überschritten. Die Freiwilligen … [+6104 chars]",,de,'Kälte'
https://snipz.de/2023/lixada-camping-gas-heizstrahler/,https://snipz.de/2023/lixada-camping-gas-heizstrahler/,0,snipz.de,"Lixada Camping Gas-Heizstrahler für 20,79€","Bei Amazon gibt es heute den Lixada Camping Gas-Heizstrahler für nur 20,79€ inkl. Versand. Auf den Preis kommt ihr durch den Einsatz des Gutscheincodes G45MIC2Q bei der Bestellung an der Kasse. Im Preisvergleich gibt es den Lixada Camping Gas-Heizstrahler son…",https://gadgetwelt.de/wp-content/uploads/2023/02/gasstrahler2.jpg,2023-02-10T14:12:06Z,,"Bei Amazon gibt es heute den Lixada Camping Gas-Heizstrahler für nur 20,79 inkl. Versand.
Auf den Preis kommt ihr durch den Einsatz des Gutscheincodes G45MIC2Q bei der Bestellung an der Kasse.
Im P… [+452 chars]",,de,'Gas'
https://www.tagesspiegel.de/berlin/bezirke/neue-ideen-fur-alte-gasspeicher-das-berliner-gewerbegebiet-marienpark-will-nachhaltig-wachsen-9326327.html,https://www.tagesspiegel.de/berlin/bezirke/neue-ideen-fur-alte-gasspeicher-das-berliner-gewerbegebiet-marienpark-will-nachhaltig-wachsen-9326327.html,0,www.tagesspiegel.de,Neue Ideen für alte Gasspeicher: Das Berliner Gewerbegebiet Marienpark will nachhaltig wachsen,Bis zu 4000 Arbeitsplätze sollen in dem Gewerbepark im Berliner Stadtteil entstehen. Auf dem Gelände war einst ein Gaswerk in Betrieb. Auch alte Anlagen könnten wieder belebt werden.,https://www.tagesspiegel.de/images/gewerbegebiet-marienpark/alternates/BASE_16_9_W1400/gewerbegebiet-marienpark.jpeg,2023-02-10T14:20:07Z,https://web.archive.org/web/20230210143939/https://www.tagesspiegel.de/berlin/bezirke/neue-ideen-fur-alte-gasspeicher-das-berliner-gewerbegebiet-marienpark-will-nachhaltig-wachsen-9326327.html,Der kleine Werbefilm mit Luftaufnahmen zeigt es deutlich: Der Marienpark im Nordwesten Mariendorfs am Teltowkanal gelegen ist ein Gewerbegebiet mit schönen denkmalgeschützten Backsteinbauten und ziem… [+126 chars],,de,'Gasspeicher'
https://www.bild.de/sport/fussball/hsv/hsv-nach-auto-crash-jean-luc-domp-darf-gegen-heidenheim-gas-geben-82858656.bild.html,https://www.bild.de/sport/fussball/hsv/hsv-nach-auto-crash-jean-luc-domp-darf-gegen-heidenheim-gas-geben-82858656.bild.html,0,www.bild.de,Nach Auto-Crash - Dompé darf gegen Heidenheim Gas geben,HSV-Trainer Tim Walter wird Crash-Stürmer Jean-Luc Dompé Samstag spielen lassen. Vorher gab es aber kritische Worte.,"https://images.bild.de/63e655889d90e758e48a73c4/ce846cc2a75543c625678e8c549c8b92,365abd28?w=1280",2023-02-10T14:39:19Z,https://web.archive.org/web/20230211052957/https://www.bild.de/sport/fussball/hsv/hsv-nach-auto-crash-jean-luc-domp-darf-gegen-heidenheim-gas-geben-82858656.bild.html,"Tim Walter (47) setzt auf seinen Vollgas-Stürmer Jean-Luc Dompé (27).
Mittwochabend hatte der HSV-Profi am Hafen einen Crash mit seinem BMW M3 (510 PS). Die Polizei ermittelt auch wegen des Verdacht… [+973 chars]",,de,'Gas'
https://www.wiwo.de/finanzen/steuern-recht/strom-und-gaspreise-lohnt-sich-der-wechsel-zum-billigstromanbieter-wieder/28975898.html,https://www.wiwo.de/finanzen/steuern-recht/strom-und-gaspreise-lohnt-sich-der-wechsel-zum-billigstromanbieter-wieder/28975898.html,0,www.wiwo.de,Strom- und Gaspreise: Lohnt sich der Wechsel zum Billigstromanbieter wieder?,Nach dem Energiepreisschock im Herbst sind die Preise für Strom und Gas wieder gefallen. Wechselwillige können jetzt im Schnitt zwischen 200 und 300 Euro pro Jahr sparen – sollten den Anbieter aber sorgfältig auswählen.,https://www.wiwo.de/images/strompreiserhoehungen/28975940/3-format11240.jpg,2023-02-10T15:40:25Z,https://web.archive.org/web/20230210162202/https://www.wiwo.de/finanzen/steuern-recht/strom-und-gaspreise-lohnt-sich-der-wechsel-zum-billigstromanbieter-wieder/28975898.html,"Privathaushalte können inzwischen wieder günstigere Gas- und Stromtarife bekommen. Die Preise an den Energiebeschaffungsmärkten sind für Anbieter zuletzt gesunken, erklärt Christoph Maurer, Geschäfts… [+5386 chars]",,de,'Gas'
https://www.focus.de/panorama/welt/berliner-silvester-krawalle-und-die-integrationsfrage_id_185449189.html,https://www.focus.de/panorama/welt/berliner-silvester-krawalle-und-die-integrationsfrage_id_185449189.html,0,www.focus.de,"Gastbeitrag von Leslie Mandoki - Weiter arm, sexy und dysfunktional? Berlin, nimm dir ein Beispiel an Bayern!",Die Silvester-Krawalle in Berlin haben eine neue Integrationsdebatte ausgelöst. Doch eine zukunftsweisende Lösung für die Probleme mit Migration und Integration gibt es bis heute nicht. Am Sonntag haben die Berliner nun erneut die Wahl und mit ihr die Möglich…,https://p6.focus.de/img/fotos/id_185452418/mandoki.jpg?im=Crop%3D%280%2C123%2C3464%2C1732%29%3BResize%3D%281200%2C627%29&impolicy=perceptual&quality=medium&hash=f8508d77b41174d36cd41055ffb8184dd5e385c67f04c8ad20afd4b4cdb4f9d8,2023-02-10T15:49:18Z,https://web.archive.org/web/20230210160719/https://www.focus.de/panorama/welt/berliner-silvester-krawalle-und-die-integrationsfrage_id_185449189.html,Die Silvester-Krawalle in Berlin haben eine neue Integrationsdebatte ausgelöst. Doch eine zukunftsweisende Lösung für die Probleme mit Migration und Integration gibt es bis heute nicht. Am Sonntag ha… [+15461 chars],,de,'Gas'
https://www.handelsblatt.com/meinung/kommentare/kommentar-das-gefaehrliche-fehlkalkuel-der-oel-und-gaskonzerne-/28975502.html,https://www.handelsblatt.com/meinung/kommentare/kommentar-das-gefaehrliche-fehlkalkuel-der-oel-und-gaskonzerne-/28975502.html,0,www.handelsblatt.com,Kommentar: Das gefährliche Fehlkalkül der Öl- und Gaskonzerne,"Shell, BP, Exxon und Co. bremsen den ohnehin viel zu trägen grünen Umbau. Gleichzeitig halten sie sich mit Investitionen zurück. Das ist nicht nur schädlich fürs Klima.",https://www.handelsblatt.com/images/shell/28975560/2-format2003.jpg,2023-02-10T16:19:52Z,https://web.archive.org/web/20230210170705/https://www.handelsblatt.com/meinung/kommentare/kommentar-das-gefaehrliche-fehlkalkuel-der-oel-und-gaskonzerne-/28975502.html,"ShellDer Energiekonzern hat seinen Gewinn 2022 verdoppelt.
(Foto: AP) 
In den Chefetagen der Ölkonzerne dürfte in diesem Jahr die Feierlaune groß sein. Während Staaten, Verbraucher und Unternehmen … [+1179 chars]",,de,'Gas'
https://www.zeit.de/gesellschaft/zeitgeschehen/2023-02/das-rote-telefon-kinder-drogen-goerlitzer-park,https://www.zeit.de/gesellschaft/zeitgeschehen/2023-02/das-rote-telefon-kinder-drogen-goerlitzer-park,0,www.zeit.de,"Das Rote Telefon: ""Kinder sind kleine nackte kackende Maden, die brauchen Liebe""","Vielen am Roten Telefon ist die Welt um sie herum gerade zu viel. Sie fragen sich: Wie konnte es so weit kommen? Und wie rette ich mich, meine Kinder – und die Welt?",,2023-02-11T12:11:37Z,https://web.archive.org/web/20230211122305/https://www.zeit.de/gesellschaft/zeitgeschehen/2023-02/das-rote-telefon-kinder-drogen-goerlitzer-park,"When browsing with ads:
We collect personal data and also transmit it to third-party providers
 that help us improve and finance our digital content. Some of the information stored on your device, … [+732 chars]",,de,'Kinder'
https://www.zeit.de/zett/2023-02/moderne-familienmodelle-lebensziele-erreichen-verantwortung-aufruf,https://www.zeit.de/zett/2023-02/moderne-familienmodelle-lebensziele-erreichen-verantwortung-aufruf,0,www.zeit.de,Moderne Familienmodelle: Mit wem willst du Familie sein?,"Haus, Kinder, Vermögen: Was man wirklich will, schafft man auch allein. Oder mit guten Freund:innen. Welchen großen Schritt bist du ohne Partner:in gegangen?",,2023-02-11T13:43:31Z,https://web.archive.org/web/20230211142213/https://www.zeit.de/zett/2023-02/moderne-familienmodelle-lebensziele-erreichen-verantwortung-aufruf,"When browsing with ads:
We collect personal data and also transmit it to third-party providers
 that help us improve and finance our digital content. Some of the information stored on your device, … [+732 chars]",,de,'Kinder'
https://www.zeit.de/news/2023-02/11/vorschlaege-fuer-thueringer-kinder-inklusionspreis-gesucht,https://www.zeit.de/news/2023-02/11/vorschlaege-fuer-thueringer-kinder-inklusionspreis-gesucht,0,www.zeit.de,Gesellschaft: Vorschläge für Thüringer Kinder-Inklusionspreis gesucht,,,2023-02-11T14:13:08Z,,"When browsing with ads:
We collect personal data and also transmit it to third-party providers
 that help us improve and finance our digital content. Some of the information stored on your device, … [+732 chars]",,de,'Kinder'
https://www.transfermarkt.de/jarolim-uber-image-bdquo-blackout-ldquo-und-hsv-abschied-andere-rolle-bdquo-hatte-ich-akzeptiert-ldquo-/view/news/418032,https://www.transfermarkt.de/jarolim-uber-image-bdquo-blackout-ldquo-und-hsv-abschied-andere-rolle-bdquo-hatte-ich-akzeptiert-ldquo-/view/news/418032,0,www.transfermarkt.de,"HSV: David Jarolim über Karriere, Image, „Blackout“ und Abschied 2012","Als David Jarolim zurückruft, meldet er sich aus Prag. Kalt, aber gemütlich sei es. Mit dem Herzen ist er natürlich nach wie vor in der Stadt seiner nachhaltigsten...",https://tmssl.akamaized.net/images/foto/big/interview-david-jarolim-hsv-2023-facebook-1676026634-101785.jpg?lm=1676026636,2023-02-11T18:30:00Z,,"Als David Jarolim zurückruft, meldet er sich aus Prag. Kalt, aber gemütlich sei es. Mit dem Herzen ist er natürlich nach wie vor in der Stadt seiner nachhaltigsten Karrierestation, auch wenn das mit … [+25187 chars]",,de,'Blackout'
https://www.faz.net/aktuell/politik/ausland/polizei-in-argentinien-ermittelt-zu-geburtstourismus-von-russinnen-18672084.html,https://www.faz.net/aktuell/politik/ausland/polizei-in-argentinien-ermittelt-zu-geburtstourismus-von-russinnen-18672084.html,0,www.faz.net,Staatsbürgerschaft für Kinder: Ermittlungen zu Geburtstourismus von Russinnen nach Argentinien,"Vermehrt reisen teils hochschwangere Russinnen zur Entbindung nach Argentinien. Die Kinder erhalten automatisch die Staatsbürgerschaft. Nun soll geprüft werden, ob ein kriminelles Netzwerk hinter dem Tourismus steckt.",https://media0.faz.net/ppmedia/aktuell/731441717/1.8672096/facebook_teaser/der-flughafen-jorge-newbery-in.jpg,2023-02-11T21:21:01Z,https://web.archive.org/web/20230211221743/https://www.faz.net/aktuell/politik/ausland/polizei-in-argentinien-ermittelt-zu-geburtstourismus-von-russinnen-18672084.html,"Nach der Einreise von Tausenden schwangeren Russinnen nach Argentinien haben die Behörden Ermittlungen eingeleitet. Geprüft werde, ob ein kriminelles Netzwerk hinter dem Geburtstourismus in das südam… [+1739 chars]",,de,'Kinder'
https://www.bild.de/regional/frankfurt/frankfurt-aktuell/hunderte-millionen-euro-schaden-drohen-hessens-wirtschaft-zittert-vor-blackout-82878368.bild.html,https://www.bild.de/regional/frankfurt/frankfurt-aktuell/hunderte-millionen-euro-schaden-drohen-hessens-wirtschaft-zittert-vor-blackout-82878368.bild.html,0,www.bild.de,Hunderte Millionen Euro Schaden drohen - Hessens Wirtschaft zittert vor Blackout,"Kein Strom. Stundenlang. Für die Wirtschaft ist das ein Schreckens-Szenario! Drei Unternehmer aus Hessen berichten, warum sie vor dem Blackout zittern.","https://images.bild.de/63e91bf06697cf6cec31edf8/9c14b6673a0eb9667134a904983e9c0a,42c2fe3c?w=1280",2023-02-13T07:53:07Z,https://web.archive.org/web/20230213135124/https://www.bild.de/regional/frankfurt/frankfurt-aktuell/hunderte-millionen-euro-schaden-drohen-hessens-wirtschaft-zittert-vor-blackout-82878368.bild.html,"Frankfurt Kein Strom. Stundenlang. Für die Wirtschaft ist das ein Schreckens-Szenario!
Ein Blackout von ein- bis eineinhalb Stunden würde in Hessen mehrere hundert Millionen Schaden verursachen. Dab… [+1927 chars]",,de,'Blackout'
https://www.sueddeutsche.de/muenchen/ebersberg/schwimmen-landkreis-ebersberg-kurse-ausgebucht-1.5750323,https://www.sueddeutsche.de/muenchen/ebersberg/schwimmen-landkreis-ebersberg-kurse-ausgebucht-1.5750323,0,www.sueddeutsche.de,Schwimmkurse für Kinder: Ausgebucht bis in den Herbst,"Immer weniger Kinder können schwimmen, das hat eine neue Studie gezeigt. Viele Akteure im Landkreis Ebersberg bemühen sich, das zu ändern - doch einfach ist das nicht.",https://www.sueddeutsche.de/image/sz.1.5750325/1200x675?v=1676281672,2023-02-13T20:38:54Z,,"Immer weniger Kinder können schwimmen, das hat eine neue Studie gezeigt. Viele Akteure im Landkreis Ebersberg bemühen sich, das zu ändern - doch einfach ist das nicht.Der Sommer ist noch fern, die Ba… [+5700 chars]",,de,'Sanierung'
https://www.focus.de/immobilien/wohnen/energieverbrauch/energie-preissturz-jetzt-koennen-sie-bei-strom-und-gas-richtig-sparen_id_185727136.html,https://www.focus.de/immobilien/wohnen/energieverbrauch/energie-preissturz-jetzt-koennen-sie-bei-strom-und-gas-richtig-sparen_id_185727136.html,0,www.focus.de,Energie-Preissturz - Bei diesen Anbietern sind Strom und Gas jetzt wieder günstig,Seit Wochen fallen die Preise für Strom und Gas. Versorger reagieren endlich und senken ihre Tarife deutlich - zum Teil sogar unter die Strompreisbremse. Das macht einen Wechsel wieder attraktiv.,https://p6.focus.de/img/regional/hamburg/id_185416415/ein-stromzaehler-zeigt-in-einem-mietshaus-die-verbrauchten-kilowattstunden-an..jpg?im=Crop%3D%280%2C55%2C2048%2C1024%29%3BResize%3D%281200%2C627%29&impolicy=perceptual&quality=medium&hash=7cd28283b39821f6aa1db306c1a38f06f2404afb2d41aa098f8b8023c41777af,2023-02-14T07:08:00Z,https://web.archive.org/web/20230214082245/https://www.focus.de/immobilien/wohnen/energieverbrauch/energie-preissturz-jetzt-koennen-sie-bei-strom-und-gas-richtig-sparen_id_185727136.html,Seit Wochen fallen die Preise für Strom und Gas. Versorger reagieren endlich und senken ihre Tarife deutlich - zum Teil sogar unter die Strompreisbremse. Das macht einen Wechsel wieder attraktiv. Ung… [+3501 chars],,de,'Gas'
https://www.tagesschau.de/wirtschaft/verbraucher/gaspreis-gasanbieter-wechsel-energieversorger-101.html,https://www.tagesschau.de/wirtschaft/verbraucher/gaspreis-gasanbieter-wechsel-energieversorger-101.html,0,www.tagesschau.de,Sinkender Gaspreis: Lohnt sich ein Anbieterwechsel?,Nach erklommenen Rekordhöhen ist der Gaspreis wieder deutlich gesunken. Lohnt sich bereits jetzt wieder ein Anbieterwechsel? Fakt ist: Der Tarif-Dschungel bleibt unübersichtlich. <em>Von Ingo Nathusius.</em>,https://www.tagesschau.de/multimedia/bilder/gaspreis-105~_v-original.jpg,2023-02-14T07:20:13Z,https://web.archive.org/web/20230214080646/https://www.tagesschau.de/wirtschaft/verbraucher/gaspreis-gasanbieter-wechsel-energieversorger-101.html,"Nach erklommenen Rekordhöhen ist der Gaspreis wieder deutlich gesunken. Lohnt sich bereits jetzt wieder ein Anbieterwechsel? Fakt ist: Der Tarif-Dschungel bleibt unübersichtlich.
Der Gaspreis ist fü… [+5142 chars]",,de,'Gas'
https://www.stern.de/gesellschaft/regional/bayern/landkreis-aschaffenburg--keine-anklage-nach-tod-zweier-kinder-durch-giftiges-gas-33194626.html,https://www.stern.de/gesellschaft/regional/bayern/landkreis-aschaffenburg--keine-anklage-nach-tod-zweier-kinder-durch-giftiges-gas-33194626.html,0,www.stern.de,Landkreis Aschaffenburg: Keine Anklage nach Tod zweier Kinder durch giftiges Gas,"Gut ein Jahr nach dem Tod zweier Kinder im unterfränkischen Karlstein sind die Ermittlungen abgeschlossen. Es werde keine Anklage gegen den Vater der beiden erhoben, der den Tod des Mädchens und des Jungen durch ein im Haus benutztes Schädlingsbekämpfungsmitt…",https://image.stern.de/33194628/t/Uq/v1/w1440/r1.7778/-/14--urnnewsmldpacom2009010123021499587557v2w800h600l926t0r2206b898jpeg---4d801d4829a9b525.jpg,2023-02-14T07:54:06Z,https://web.archive.org/web/20230214082226/https://www.stern.de/gesellschaft/regional/bayern/landkreis-aschaffenburg--keine-anklage-nach-tod-zweier-kinder-durch-giftiges-gas-33194626.html,"Gut ein Jahr nach dem Tod zweier Kinder im unterfränkischen Karlstein sind die Ermittlungen abgeschlossen. Es werde keine Anklage gegen den Vater der beiden erhoben, der den Tod des Mädchens und des … [+1799 chars]",,de,'Kinder'
https://www.zeit.de/news/2023-02/14/keine-anklage-nach-tod-zweier-kinder-durch-giftiges-gas,https://www.zeit.de/news/2023-02/14/keine-anklage-nach-tod-zweier-kinder-durch-giftiges-gas,0,www.zeit.de,Landkreis Aschaffenburg: Keine Anklage nach Tod zweier Kinder durch giftiges Gas,,,2023-02-14T07:54:06Z,https://web.archive.org/web/20230214080636/https://www.zeit.de/news/2023-02/14/keine-anklage-nach-tod-zweier-kinder-durch-giftiges-gas,"When browsing with ads:
We collect personal data and also transmit it to third-party providers
 that help us improve and finance our digital content. Some of the information stored on your device, … [+732 chars]",,de,'Gas'
https://www.telepolis.de/features/Blackout-bei-der-Aktienrente-7494219.html,https://www.telepolis.de/features/Blackout-bei-der-Aktienrente-7494219.html,0,www.telepolis.de,Blackout bei der Aktienrente,"Hallo Journalisten, lebt ihr noch? Kommentar mit Hintergrund.",https://heise.cloudimg.io/bound/1200x1200/q85.png-lossy-85.webp-lossy-85.foil1/_www-heise-de_/imgs/18/3/6/9/8/1/6/9/ffce15092302ab87.jpeg,2023-02-14T09:00:00Z,https://web.archive.org/web/20230214112110/https://www.telepolis.de/features/Blackout-bei-der-Aktienrente-7494219.html,"Hallo Journalisten, lebt ihr noch? Kommentar mit Hintergrund.
 wer nicht mehr lebt, fragt nicht mehr nach und nachrechnen kann er/sie dann natürlich auch nicht mehr. Unisono meldet die Presse1: Die … [+3617 chars]",,de,'Blackout'
