index,url,valid,domain,title,description,image,published,archive,content,quote,language,keyword
https://www.stern.de/gesellschaft/regional/berlin-brandenburg/gesellschaft--aeltere-paare-in-brandenburg-lassen-sich-haeufiger-scheiden-33903746.html,https://www.stern.de/gesellschaft/regional/berlin-brandenburg/gesellschaft--aeltere-paare-in-brandenburg-lassen-sich-haeufiger-scheiden-33903746.html,0,www.stern.de,Gesellschaft: Ältere Paare in Brandenburg lassen sich häufiger scheiden,"Im vergangenen Jahr sind in Brandenburg deutlich mehr Langzeit-Ehen zerbrochen als im Vorjahr. Die Anzahl der geschiedenen sogenannten silbernen Ehen stieg im Jahresvergleich um 16 Prozent auf 756, teilte das Amt für Statistik Berlin-Brandenburg am Mittwoch m…",https://image.stern.de/33903748/t/SO/v1/w1440/r1.7778/-/11--urnnewsmldpacom2009010123101199526129v3w800h600l670t192r1847b1628jpeg---eed3d7d09d99c2dd.jpg,2023-10-11T11:38:22Z,,"Im vergangenen Jahr sind in Brandenburg deutlich mehr Langzeit-Ehen zerbrochen als im Vorjahr. Die Anzahl der geschiedenen sogenannten silbernen Ehen stieg im Jahresvergleich um 16 Prozent auf 756, t… [+828 chars]",,de,'Ältere'
https://www.tagesspiegel.de/politik/preise-fur-strom-gas-und-fernwarme-gedeckelt-bundesregierung-verlangert-energiepreisbremsen-bis-ende-marz-10606384.html,https://www.tagesspiegel.de/politik/preise-fur-strom-gas-und-fernwarme-gedeckelt-bundesregierung-verlangert-energiepreisbremsen-bis-ende-marz-10606384.html,0,www.tagesspiegel.de,"Preise für Strom, Gas und Fernwärme gedeckelt: Bundesregierung verlängert Energiepreisbremsen bis Ende März",Die bisherigen Preisbremsen wären Ende des Jahres ausgelaufen. Auch Verbraucherschützer und Ökonomen befürworten die Verlängerung.,https://www.tagesspiegel.de/images/gasheizung-gaszahler/alternates/BASE_16_9_W1400/gasheizung---gaszaehler.jpeg,2023-10-11T11:38:30Z,,"Die Bundesregierung hat die Verlängerung der Preisbremsen für Strom, Gas und Fernwärme um drei Monate beschlossen. Das Bundeskabinett verabschiedete am Mittwoch eine Formulierungshilfe für Änderungen… [+1447 chars]",,de,'Gas'
https://www.morgenpost.de/politik/article239777897/Erdogans-Israel-Dilemma-hat-einen-Grund-Er-braucht-Gas.html,https://www.morgenpost.de/politik/article239777897/Erdogans-Israel-Dilemma-hat-einen-Grund-Er-braucht-Gas.html,0,www.morgenpost.de,Angriffe der Hamas: Erdogans Israel-Dilemma hat einen Grund: Er braucht Gas,Der Krieg in Israel bringt Erdogan in ein Dilemma. Er gilt als Schutzpatron von Islamisten – und sucht bessere Beziehungen zu Israel.,https://img.morgenpost.de/img/incoming/crop239777895/1142604530-w820-cv16_9-q85/405016581.jpg,2023-10-11T12:11:27Z,,"Athen. Wenn Recep Tayyip Erdogan seinen Anhängern zuwinkt, streckt er vier Finger aus. Den Daumen legt er an die Handfläche. Der sogenannte Rabia-Gruß ist das Erkennungszeichen der ägyptischen Muslim… [+4502 chars]",,de,'Gas'
https://www.stern.de/news/mehrwertsteuer-auf-gas-und-fernwaerme-steigt-im-januar-wieder-auf-19-prozent-33904004.html,https://www.stern.de/news/mehrwertsteuer-auf-gas-und-fernwaerme-steigt-im-januar-wieder-auf-19-prozent-33904004.html,0,www.stern.de,Mehrwertsteuer auf Gas und Fernwärme steigt im Januar wieder auf 19 Prozent,Die Mehrwertsteuer auf Gaslieferungen und Fernwärme steigt im kommenden Jahr wieder auf 19 Prozent. Die Absenkung der Mehrwertsteuer auf sieben Prozent sei im vergangenen Jahr befristet als Entlastungsmaßnahme beschlossen worden und werde nicht über den 31. D…,https://image.stern.de/33904006/t/Qn/v1/w1440/r1.7778/-/11--gasflamme---9441246407b64d04.jpg,2023-10-11T12:55:55Z,,Die Mehrwertsteuer auf Gaslieferungen und Fernwärme steigt im kommenden Jahr wieder auf 19 Prozent. Die Absenkung der Mehrwertsteuer auf sieben Prozent sei im vergangenen Jahr befristet als Entlastun… [+1096 chars],,de,'Gas'
https://www.tagesspiegel.de/verbraucher/preise-konnten-in-der-heizsaison-anziehen-mehrwertsteuer-auf-gas-soll-ab-januar-wieder-auf-den-regularen-satz-steigen-10607209.html,https://www.tagesspiegel.de/verbraucher/preise-konnten-in-der-heizsaison-anziehen-mehrwertsteuer-auf-gas-soll-ab-januar-wieder-auf-den-regularen-satz-steigen-10607209.html,0,www.tagesspiegel.de,Preise könnten in der Heizsaison anziehen: Mehrwertsteuer auf Gas soll ab Januar wieder auf den regulären Satz steigen,Wegen der hohen Energiepreise hatte die Bundesregierung den Mehrwertsteuersatz vorübergehend von 19 auf 7 Prozent gesenkt. Nun soll die Regelung vorzeitig enden.,https://www.tagesspiegel.de/images/bundestagsausschuss-hort-experten-zum-heizungsgesetz/alternates/BASE_16_9_W1400/bundestagsausschuss-hoert-experten-zum-heizungsgesetz.jpeg,2023-10-11T13:03:47Z,,Die Mehrwertsteuer auf Gas soll nach dem Willen der Bundesregierung ab Januar wieder auf den regulären Satz steigen. Entsprechende Pläne von Finanzminister Christian Lindner (FDP) billigte das Kabine… [+1379 chars],,de,'Gas'
https://www.focus.de/finanzen/news/emir-von-katar-in-berlin-hamas-foerderer-und-habecks-lng-kumpel-scholz-muss-einen-drahtseilakt-hinlegen_id_222841515.html,https://www.focus.de/finanzen/news/emir-von-katar-in-berlin-hamas-foerderer-und-habecks-lng-kumpel-scholz-muss-einen-drahtseilakt-hinlegen_id_222841515.html,0,www.focus.de,Emir von Katar - Habecks dubioser LNG-Kumpel kommt nach Berlin - das wird für Scholz zum Balanceakt,"Der Scheich von Katar isst morgen mit dem deutschen Kanzler zu Mittag. Er ist nicht nur Gaslieferant und Multiinvestor in Deutschland, sondern neben dem Mullah-Regime in Teheran der größte Geldgeber der Terrororganisation Hamas. Für den Kanzler wird das zum B…",https://p6.focus.de/img/fotos/id_222842732/bundeswirtschaftsmin-76135518.jpg?im=Crop%3D%280%2C0%2C3368%2C1686%29%3BResize%3D%281200%2C627%29&impolicy=perceptual&quality=mediumHigh&hash=b7543d29a1d667a377d47fc41a64df0f8d39826a31d1dbb88aa483cd42c876ee,2023-10-11T13:23:18Z,,"Der Scheich von Katar isst morgen mit dem deutschen Kanzler zu Mittag. Er ist nicht nur Gaslieferant und Multiinvestor in Deutschland, sondern neben dem Mullah-Regime in Teheran der größte Geldgeber … [+6408 chars]",,de,'Gas'
https://www.welt.de/politik/deutschland/article247939914/Bundesregierung-verlaengert-Energiepreisbremsen-und-verstaerkt-Kampf-gegen-Geldwaesche.html,https://www.welt.de/politik/deutschland/article247939914/Bundesregierung-verlaengert-Energiepreisbremsen-und-verstaerkt-Kampf-gegen-Geldwaesche.html,0,www.welt.de,Bundesregierung verlängert Energiepreisbremsen – und verstärkt Kampf gegen Geldwäsche,"Künftig sollen auch „die großen Fische ins Netz gehen“: Das Kabinett macht den Weg frei für eine von Minister Lindner geplante Behörde gegen Finanzkriminalität. Die Bundesregierung beschloss darüber hinaus die Verlängerung der Preisbremsen für Strom, Gas und …",https://img.welt.de/img/politik/deutschland/mobile247939960/2011352157-ci16x9-w1200/A-session-of-the-lower-house-of-parliament-Bundestag-in-Berlin.jpg,2023-10-11T13:39:31Z,,Die Bundesregierung will verstärkt gegen Geldwäsche vorgehen und dafür eine neue Behörde schaffen. Das Kabinett gab am Mittwoch grünes Licht für entsprechende Pläne von Finanzminister Christian Lindn… [+2334 chars],,de,'Gas'
https://www.faz.net/aktuell/wirtschaft/klima-nachhaltigkeit/krieg-in-israel-gasmaerkte-geraten-unter-druck-19236188.html,https://www.faz.net/aktuell/wirtschaft/klima-nachhaltigkeit/krieg-in-israel-gasmaerkte-geraten-unter-druck-19236188.html,0,www.faz.net,Krieg in Israel: Gasmärkte geraten unter Druck,Der Preis ist mit Beginn des Krieges in Israel deutlich gestiegen. In Deutschland mehren sich Forderungen nach einem Ende des Fracking-Verbots.,https://media0.faz.net/ppmedia/aktuell/3631241278/1.9236202/facebook_teaser/aufgrund-der-eskalierenden.jpg,2023-10-11T14:18:57Z,,Die Turbulenzen auf den Gasmärkten haben sich mit Beginn des Krieges in Israel verschärft. Der Preis für den richtungsweisenden Terminkontrakt TTF stieg seit Donnerstag um fast 37 Prozent auf zeitwei… [+4236 chars],,de,'Gas'
https://www.sueddeutsche.de/wirtschaft/erdgas-mehrwertsteuer-steigt-1.6285170,https://www.sueddeutsche.de/wirtschaft/erdgas-mehrwertsteuer-steigt-1.6285170,0,www.sueddeutsche.de,Beschluss der Bundesregierung: Mehrwertsteuer auf Gas soll wieder steigen,Das verteuert Erdgas für Verbraucher. Die Energiepreisbremsen allerdings sollen noch bis Frühjahr 2024 gelten.,https://www.sueddeutsche.de/image/sz.1.5719849/1200x675?v=1697035696,2023-10-11T14:56:58Z,,Das verteuert Erdgas für Verbraucher. Die Union hält das für eine schlechte Idee.Die Mehrwertsteuer auf Gas soll nach dem Willen der Bundesregierung ab Januar wieder auf den regulären Satz steigen. E… [+1427 chars],,de,'Gas'
https://www.freitag.de/autoren/sebastianpuschner/jung-westdeutsch-zukunftsbesorgt-wem-die-afd-ihre-juengsten-erfolge-verdankt,https://www.freitag.de/autoren/sebastianpuschner/jung-westdeutsch-zukunftsbesorgt-wem-die-afd-ihre-juengsten-erfolge-verdankt,0,www.freitag.de,"Wahlverhalten | Jung, westdeutsch, Angst vor der Zukunft: Wem die AfD ihre jüngsten Erfolge verdankt","In Hessen und Bayern haben am seltensten ältere Menschen die AfD gewählt. Bei den Erstwählern hingegen war die Partei Björn Höckes und Alice Weidels ganz vorne mit dabei Als normal gilt etwas erst, wenn es sich im Westen etabliert hat. Eine AfD mit den häufig…",https://www.freitag.de/autoren/sebastianpuschner/jung-westdeutsch-zukunftsbesorgt-wem-die-afd-ihre-juengsten-erfolge-verdankt/@@images/social_image,2023-10-11T15:00:00Z,,"Als normal gilt etwas erst, wenn es sich im Westen etabliert hat. Eine AfD mit den häufig verzerrten Gesichtern eines Björn Höcke und einer Alice Weidel in der ersten Reihe als ganz normalen Teil des… [+3350 chars]",,de,'Gas'
https://www.sueddeutsche.de/politik/finnland-russland-pipeline-balticconnector-1.6284992,https://www.sueddeutsche.de/politik/finnland-russland-pipeline-balticconnector-1.6284992,0,www.sueddeutsche.de,Finnland: Sabotage unter Wasser,"Viele Indizien, aber kein klares Bild: In Finnland und Estland geht man davon aus, dass die Gas-Pipeline ""Balticconnector"" absichtlich zerstört wurde.",https://www.sueddeutsche.de/image/sz.1.6284993/1200x675?v=1697037690,2023-10-11T15:21:39Z,,"Ein Schiff in der Nähe des Lecks, seismische Erschütterungen, ein zerstörtes Datenkabel - in Finnland ist man mittlerweile überzeugt, dass die ""Balticconnector"" durch einen Anschlag beschädigt wurde.… [+5036 chars]",,de,'Gas'
https://www.stern.de/news/finnischer-betreiber--reparatur-von-gaspipeline-dauert-mindestens-fuenf-monate-33904670.html,https://www.stern.de/news/finnischer-betreiber--reparatur-von-gaspipeline-dauert-mindestens-fuenf-monate-33904670.html,0,www.stern.de,Finnischer Betreiber: Reparatur von Gaspipeline dauert mindestens fünf Monate,"Die Reparatur der mutmaßlich durch äußere Einwirkung beschädigten Gaspipeline zwischen Estland und Finnland wird nach Angaben des Betreibers mindestens fünf Monate dauern. Dies teilte der finnische Staatskonzern Gasgrid am Mittwoch ""auf der Grundlage vorläufi…",https://image.stern.de/33904672/t/re/v1/w1440/r1.7778/-/11--verdichterstation-der-gaspipeline-balticconnector-in-finnland---386bfd07ea4605f8.jpg,2023-10-11T15:43:18Z,,Die Reparatur der mutmaßlich durch äußere Einwirkung beschädigten Gaspipeline zwischen Estland und Finnland wird nach Angaben des Betreibers mindestens fünf Monate dauern. Dies teilte der finnische S… [+2064 chars],,de,'Gas'
https://www.stern.de/politik/heikler-gast--der-emir-von-katar-zu-besuch-in-berlin-33904514.html,https://www.stern.de/politik/heikler-gast--der-emir-von-katar-zu-besuch-in-berlin-33904514.html,0,www.stern.de,Heikler Besuch: Der Emir von Katar kommt nach Berlin – ein treuer Freund der Hamas,"Kanzler Scholz empfängt einen schwierigen Gast: Am Donnerstag kommt der Emir von Katar – schwerreicher Investor, künftiger Gas-Lieferant und leider auch Sponsor des palästinensischen Terrors.",https://image.stern.de/33904618/t/Sv/v1/w1440/r1.7778/-/emir-katar.jpg,2023-10-11T15:52:00Z,,"Wenn es um den Emir von Katar geht, denkt man hierzulande vor allem an Christian Wulff. Und an den unglückseligen Anruf des damaligen Bundespräsidenten auf der Mailbox des damaligen Chefredakteurs de… [+5036 chars]",,de,'Gas'
https://www.tagesschau.de/inland/habeck-kohlekraftwerke-lngs-100.html,https://www.tagesschau.de/inland/habeck-kohlekraftwerke-lngs-100.html,0,www.tagesschau.de,Reserve-Kohlekraftwerke gehen laut Habeck 2024 vom Netz,Bundeswirtschaftsminister Habeck will die reaktivierten Reserve-Kohlekraftwerke 2024 vom Netz nehmen. Dann gebe es eine ausreichend solide Infrastruktur von LNG-Terminals. Habeck sprach sich auch für eine Verlängerung der Gas- und Strompreisbremse aus.,https://images.tagesschau.de/image/1fead8e9-c7ce-477c-ba67-bcce68a7dbef/AAABiyFKxFE/AAABibBxqrQ/16x9-1280/habeck-464.jpg,2023-10-12T00:52:44Z,,"Stand: 12.10.2023 02:52 Uhr
Bundeswirtschaftsminister Habeck will die reaktivierten Reserve-Kohlekraftwerke 2024 vom Netz nehmen. Dann gebe es eine ausreichend solide Infrastruktur von LNG-Terminals… [+1977 chars]",,de,'Gas'
https://www.faz.net/aktuell/wirtschaft/habeck-will-reserve-kohlekraftwerke-2024-vom-netz-nehmen-19237410.html,https://www.faz.net/aktuell/wirtschaft/habeck-will-reserve-kohlekraftwerke-2024-vom-netz-nehmen-19237410.html,0,www.faz.net,Habeck will Reserve-Kohlekraftwerke 2024 vom Netz nehmen,Die wegen der Energiekrise reaktivierten Kohlekraftwerke sollen laut dem Bundeswirtschaftsminister noch bis zum nächsten Jahr in Betrieb bleiben. Die Abschaltung erfolge nach der Fertigstellung weiterer LNG-Terminals.,https://media1.faz.net/ppmedia/aktuell/wirtschaft/1289863948/1.9237461/facebook_teaser/bundeswirtschaftsminister.jpg,2023-10-12T01:55:01Z,,"Bundeswirtschaftsminister Robert Habeck will im kommenden Jahr die wegen der Energiekrise reaktivierten Kohlekraftwerke vom Netz nehmen. Das werde geschehen, sobald 2024 weitere geplante Flüssiggaste… [+1608 chars]",,de,'Kohle'
https://www.telepolis.de/features/Heizung-Drei-einfache-Tipps-um-Heizkosten-zu-sparen-9331991.html,https://www.telepolis.de/features/Heizung-Drei-einfache-Tipps-um-Heizkosten-zu-sparen-9331991.html,0,www.telepolis.de,"Heizung: Drei einfache Tipps, um Heizkosten zu sparen",Sie wollen Heizkosten sparen? Mit diesen drei Tipps können Sie Ihren Energieverbrauch deutlich senken. Ein Tausch der Heizung ist dafür nicht notwendig.,https://heise.cloudimg.io/bound/1200x1200/q85.png-lossy-85.webp-lossy-85.foil1/_www-heise-de_/imgs/18/4/3/1/7/1/7/9/money-7725149_1280__1_-8a355b4edc928c4d.jpeg,2023-10-12T05:30:00Z,,"(Bild: Frauke Riether, Pixabay)
Sie wollen Heizkosten sparen? Mit diesen drei Tipps können Sie Ihren Energieverbrauch deutlich senken. Ein Tausch der Heizung ist dafür nicht notwendig.
Richtig heiz… [+4216 chars]",,de,'Sanierung'
https://www.welt.de/wirtschaft/article247951944/Subventionen-Sprengt-bislang-gekannten-Rahmen-Finanzhilfen-des-Bundes-vervielfacht.html,https://www.welt.de/wirtschaft/article247951944/Subventionen-Sprengt-bislang-gekannten-Rahmen-Finanzhilfen-des-Bundes-vervielfacht.html,0,www.welt.de,„Sprengt bislang gekannten Rahmen“ – Finanzhilfen des Bundes vervielfacht,"Seit 2021 haben sich die Subventionen des Bundes deutlich erhöht. Die Finanzhilfen verdrängten damit die Sozialausgaben als größten Ausgabeposten des Staates. Schuld ist vor allem die Energiekrise, am heftigsten schlagen Strom- und Gaspreisbremse zu Buche.",https://img.welt.de/img/politik/deutschland/mobile247951984/2911358197-ci16x9-w1200/Gasherd-mit-Flamme.jpg,2023-10-12T07:37:43Z,,Die Finanzhilfen des Bundes könnten sich einer Studie zufolge in diesem Jahr wegen der Energiekrise mehr als verdoppeln und zwar auf bis zu 208 Milliarden Euro. Das geht es aus dem Subventionsbericht… [+3281 chars],,de,'Gas'
https://www.zeit.de/zeit-wissen/2023/05/kindererziehung-psyche-entwicklung-haushalt-aufgaben,https://www.zeit.de/zeit-wissen/2023/05/kindererziehung-psyche-entwicklung-haushalt-aufgaben,0,www.zeit.de,"Kindererziehung: Gibt es Arbeit, die gut ist für Kinder?","Nein, wir reden hier nicht von der Ausbeutung Minderjähriger. Uns geht es um die Idee, die Kleinen mehr einzubeziehen. Forschung und andere Kulturen wissen mehr darüber.",,2023-10-12T10:28:23Z,,"When browsing with ads:
We collect personal data and also transmit it to third-party providers
 that help us improve and finance our digital content. Some of the information stored on your device, … [+821 chars]",,de,'Kinder'
https://www.tagesschau.de/wirtschaft/verivox-gaspreisbremse-wenig-entlastung-100.html,https://www.tagesschau.de/wirtschaft/verivox-gaspreisbremse-wenig-entlastung-100.html,0,www.tagesschau.de,Verivox: Gaspreisbremse bringt Kunden wenig Entlastung,"Die Bundesregierung will die Energiepreisbremsen verlängern. Weil sie gleichzeitig die Mehrwertsteuer auf Gas wieder anheben will, dürften Verbraucher unterm Strich kaum entlastet werden.",https://images.tagesschau.de/image/c638e2e0-1e82-4e63-af67-ac6cbcc765c0/AAABiyM0x4s/AAABibBxqrQ/16x9-1280/strom-160.jpg,2023-10-12T11:09:44Z,,"Stand: 12.10.2023 13:09 Uhr
Die Bundesregierung will die Energiepreisbremsen verlängern. Weil sie gleichzeitig die Mehrwertsteuer auf Gas wieder anheben will, dürften Verbraucher unterm Strich kaum … [+2891 chars]",,de,'Gas'
https://www.bild.de/regional/hamburg/hamburg-aktuell/medizinerin-fluechtet-vor-schimmel-in-meiner-arzt-praxis-wird-man-krank-85695286.bild.html,https://www.bild.de/regional/hamburg/hamburg-aktuell/medizinerin-fluechtet-vor-schimmel-in-meiner-arzt-praxis-wird-man-krank-85695286.bild.html,0,www.bild.de,Flucht vor Schimmel - In meiner Arzt-Praxis wird man krank,Im Hamburg-St. Pauli gibt es ohnehin zu wenig Hausärzte. Nun musste Dr. Anja Böhner ihre Praxis verlassen.,"https://images.bild.de/65250d10e9ba8143105741f5/d0040096ff437f0e251a2ad0784b9171,ce26c3eb?w=1280",2023-10-12T11:49:05Z,,"Hamburg Die riesige orange Belüftungsanlage rauscht gegen die Feuchtigkeit an, die sich unaufhaltsam durch die Mauern zieht. Hinter der Plastikplane zieht sich ein schwarzer Belag an den Wänden entla… [+2944 chars]",,de,'Schimmel'
https://www.zeit.de/news/2023-10/12/verband-gasmangellage-bei-extremer-kaelte-weiter-moeglich,https://www.zeit.de/news/2023-10/12/verband-gasmangellage-bei-extremer-kaelte-weiter-moeglich,0,www.zeit.de,Energie: Verband: Gasmangellage bei extremer Kälte weiter möglich,,,2023-10-12T12:34:26Z,,"When browsing with ads:
We collect personal data and also transmit it to third-party providers
 that help us improve and finance our digital content. Some of the information stored on your device, … [+821 chars]",,de,'Kälte'
https://www.morgenpost.de/wirtschaft/article239785695/Verband-Gasmangellage-bei-extremer-Kaelte-weiter-moeglich.html,https://www.morgenpost.de/wirtschaft/article239785695/Verband-Gasmangellage-bei-extremer-Kaelte-weiter-moeglich.html,0,www.morgenpost.de,Energie: Verband: Gasmangellage bei extremer Kälte weiter möglich,Der Verband der Gasspeicherbetreiber Ines hält die Gefahr einer Gasmangellage trotz gut gefüllter Speicher nicht für ausgeschlossen. Allerdings nur „bei extrem kalten Temperaturen“ im Winter.,https://img.morgenpost.de/img/wirtschaft/crop239785693/361260496-w820-cv16_9-q85/Erdgasspeicher-Rehden.jpg,2023-10-12T12:34:26Z,,Berlin. Trotz der derzeit nahezu vollständig gefüllten Gasspeicher besteht aus Sicht des Verbands der Gasspeicherbetreiber Ines weiter die Gefahr einer Gasmangellage bei extrem kalten Temperaturen im… [+1569 chars],,de,'Gasspeicher'
https://www.sueddeutsche.de/sport/olympia-beachvolleyball-laura-ludwig-paris-2024-1.6286831,https://www.sueddeutsche.de/sport/olympia-beachvolleyball-laura-ludwig-paris-2024-1.6286831,0,www.sueddeutsche.de,Beachvolleyball: Traurig in Tlaxcala,Laura Ludwig und Louisa Lippmann hatten große Erwartungen bei der WM in Mexiko - die Mutter zweier Kinder und die Novizin im Sand verlieren aber in der ersten K.-o.-Runde.,https://www.sueddeutsche.de/image/sz.1.6286832/1200x675?v=1697121585,2023-10-12T14:38:19Z,,"Der Wind blies am Mittwoch kräftig durch die 3500 Zuschauer fassende Stierkampfarena im Zentrum von Tlaxcala, der Hauptstadt des gleichnamigen mexikanischen Bundesstaats. Schwarze Gewitterwolken zoge… [+4620 chars]",,de,'Kinder'
https://www.zeit.de/news/2023-10/13/stiftung-baut-mobiles-schwimmbad-fuer-kinder-unterricht,https://www.zeit.de/news/2023-10/13/stiftung-baut-mobiles-schwimmbad-fuer-kinder-unterricht,0,www.zeit.de,Kommunen: Stiftung baut mobiles Schwimmbad für Kinder-Unterricht,,,2023-10-13T03:39:14Z,,"When browsing with ads:
We collect personal data and also transmit it to third-party providers
 that help us improve and finance our digital content. Some of the information stored on your device, … [+821 chars]",,de,'Kinder'
https://www.stern.de/gesellschaft/regional/thueringen/finanzen--studierende-erhalten-rund-22-millionen-euro-energiepauschale-33909062.html,https://www.stern.de/gesellschaft/regional/thueringen/finanzen--studierende-erhalten-rund-22-millionen-euro-energiepauschale-33909062.html,0,www.stern.de,Finanzen: Studierende erhalten rund 22 Millionen Euro Energiepauschale,"Mit 200 Euro Energiepauschale sollen Studierende finanziell unterstützt werden. Die Antragsfrist ist inzwischen abgelaufen und in Thüringen haben viele Studis diese nicht verstreichen lassen. Von einer Besonderheit abgesehen, ist die Antragsquote besonders ho…",https://image.stern.de/33909064/t/FH/v1/w1440/r1.7778/-/13--urnnewsmldpacom2009010123101399547905v3w800h600l640t384r1920b1155jpeg---6643b3295178fc55.jpg,2023-10-13T04:07:43Z,,Mit 200 Euro Energiepauschale sollen Studierende finanziell unterstützt werden. Die Antragsfrist ist inzwischen abgelaufen und in Thüringen haben viele Studis diese nicht verstreichen lassen. Von ein… [+1887 chars],,de,'Energiepauschale'
https://www.zeit.de/news/2023-10/13/studierende-erhalten-rund-22-millionen-euro-energiepauschale,https://www.zeit.de/news/2023-10/13/studierende-erhalten-rund-22-millionen-euro-energiepauschale,0,www.zeit.de,Finanzen: Studierende erhalten rund 22 Millionen Euro Energiepauschale,,,2023-10-13T04:07:43Z,,"When browsing with ads:
We collect personal data and also transmit it to third-party providers
 that help us improve and finance our digital content. Some of the information stored on your device, … [+821 chars]",,de,'Energiepauschale'
https://www.zeit.de/news/2023-10/13/kinder-heimlich-fotografiert-haftstrafe-fuer-erpresser,https://www.zeit.de/news/2023-10/13/kinder-heimlich-fotografiert-haftstrafe-fuer-erpresser,0,www.zeit.de,Amtsgericht Hamburg : Kinder heimlich fotografiert: Haftstrafe für Erpresser,,,2023-10-13T08:44:40Z,,"When browsing with ads:
We collect personal data and also transmit it to third-party providers
 that help us improve and finance our digital content. Some of the information stored on your device, … [+821 chars]",,de,'Kinder'
https://www.zeit.de/news/2023-10/13/59-jaehriger-soll-zwei-kinder-sexuell-missbraucht-haben,https://www.zeit.de/news/2023-10/13/59-jaehriger-soll-zwei-kinder-sexuell-missbraucht-haben,0,www.zeit.de,Prozess: 59-Jähriger soll zwei Kinder sexuell missbraucht haben,,,2023-10-13T08:56:02Z,,"When browsing with ads:
We collect personal data and also transmit it to third-party providers
 that help us improve and finance our digital content. Some of the information stored on your device, … [+821 chars]",,de,'Kinder'
https://www.zeit.de/news/2023-10/13/bildungssenatorin-viele-juedische-kinder-zu-hause,https://www.zeit.de/news/2023-10/13/bildungssenatorin-viele-juedische-kinder-zu-hause,0,www.zeit.de,Gewaltaufrufe: Bildungssenatorin: Viele jüdische Kinder zu Hause,,,2023-10-13T13:44:14Z,,"When browsing with ads:
We collect personal data and also transmit it to third-party providers
 that help us improve and finance our digital content. Some of the information stored on your device, … [+821 chars]",,de,'Kinder'
https://www.zeit.de/news/2023-10/13/kinder-bezahlen-mit-falschgeld-ladenbesitzer-ruft-polizei,https://www.zeit.de/news/2023-10/13/kinder-bezahlen-mit-falschgeld-ladenbesitzer-ruft-polizei,0,www.zeit.de,Ludwigshafen am Rhein: Kinder bezahlen mit Falschgeld: Ladenbesitzer ruft Polizei,,,2023-10-13T13:50:29Z,,"When browsing with ads:
We collect personal data and also transmit it to third-party providers
 that help us improve and finance our digital content. Some of the information stored on your device, … [+821 chars]",,de,'Kinder'
https://www.zeit.de/news/2023-10/14/mehrzahl-der-ukrainischen-kinder-im-gemeinsamen-unterricht,https://www.zeit.de/news/2023-10/14/mehrzahl-der-ukrainischen-kinder-im-gemeinsamen-unterricht,0,www.zeit.de,Migration: Mehrzahl der ukrainischen Kinder im gemeinsamen Unterricht,,,2023-10-14T06:23:54Z,,"When browsing with ads:
We collect personal data and also transmit it to third-party providers
 that help us improve and finance our digital content. Some of the information stored on your device, … [+821 chars]",,de,'Kinder'
https://www.zeit.de/news/2023-10/14/31-000-kinder-mit-migrationshintergrund-lernen-in-thueringen,https://www.zeit.de/news/2023-10/14/31-000-kinder-mit-migrationshintergrund-lernen-in-thueringen,0,www.zeit.de,Bildung: 31.000 Kinder mit Migrationshintergrund lernen in Thüringen,,,2023-10-14T06:31:31Z,,"When browsing with ads:
We collect personal data and also transmit it to third-party providers
 that help us improve and finance our digital content. Some of the information stored on your device, … [+821 chars]",,de,'Kinder'
