index,url,valid,domain,title,description,image,published,archive,content,quote,language,keyword
https://www.stern.de/familie/ran-an-den-rasen--die-top-3-gartenarbeiten-im-oktober-32786850.html,https://www.stern.de/familie/ran-an-den-rasen--die-top-3-gartenarbeiten-im-oktober-32786850.html,0,www.stern.de,"Herbst im Garten: Rasen, Laub und Beete: Hier müssen Gärtner im Oktober dringend ran","Der Herbst ist so etwas wie die Saure-Gurken-Zeit des Gartenjahres. Abgesehen von den wild umherfliegenden bunten Blättern bewegt sich nicht viel. Für den Winterschlaf ist es aber auch noch etwas zu früh. Doch was tun, bis der erste Frost kommt?",https://image.stern.de/32789636/t/VX/v6/w1440/r1.7778/-/gartenarbeit-oktober-2022.jpg,2022-10-06T12:14:00Z,https://web.archive.org/web/20221006124013/https://www.stern.de/familie/ran-an-den-rasen--die-top-3-gartenarbeiten-im-oktober-32786850.html,Der Herbst ist so etwas wie die Saure-Gurken-Zeit des Gartenjahres. Abgesehen von den wild umherfliegenden bunten Blättern bewegt sich nicht viel. Für den Winterschlaf ist es aber auch noch etwas zu … [+5376 chars],,de,'Schnee'
https://www.stern.de/auto/e-mobilitaet/jeep-stellt-ersten-elektro-suv-mit-diversen-fahrassistenzsystemen-vor-32826136.html,https://www.stern.de/auto/e-mobilitaet/jeep-stellt-ersten-elektro-suv-mit-diversen-fahrassistenzsystemen-vor-32826136.html,0,www.stern.de,Premiere auf Pariser Autosalon: Jeep stellt erstes Elektro-Modell vor – ein Kleinwagen-SUV mit diversen Fahrassistenzsystemen,"Jeep bringt mit dem Avenger sein erstes Elektroauto auf den europäischen Markt. Das Kleinwagen-SUV erscheint mit diversen Fahrassistenzsystemen, App-Steuerung aus der Ferne und einem 400-Volt-Elektromotor.",https://image.stern.de/32826498/t/9D/v3/w1440/r1.7778/-/jeep-suv-elektroauto-autosalon-paris.jpg,2022-10-18T11:52:00Z,https://web.archive.org/web/20221018115755/https://www.stern.de/auto/e-mobilitaet/jeep-stellt-ersten-elektro-suv-mit-diversen-fahrassistenzsystemen-vor-32826136.html,Mit dem Start des diesjährigen Pariser Autosalons am Montag hat auch Jeep den Weg in eine neue Richtung geebnet. Die US-amerikanische Automarke aus dem Stellantis-Konzern hat ihr erstes Elektroauto f… [+4418 chars],,de,'Schnee'
https://www.stern.de/familie/die-top-3-gartenarbeiten-im-oktober--was-im-herbst-zu-tun-ist-32786850.html,https://www.stern.de/familie/die-top-3-gartenarbeiten-im-oktober--was-im-herbst-zu-tun-ist-32786850.html,0,www.stern.de,"Herbst im Garten: Rasen, Laub und Beete: Hier müssen Gärtner im Oktober dringend ran","Der Herbst ist so etwas wie die Saure-Gurken-Zeit des Gartenjahres. Abgesehen von den wild umherfliegenden bunten Blättern bewegt sich nicht viel. Für den Winterschlaf ist es aber auch noch etwas zu früh. Doch was tun, bis der erste Frost kommt?",https://image.stern.de/32789636/t/VX/v6/w1440/r1.7778/-/gartenarbeit-oktober-2022.jpg,2022-10-24T07:56:00Z,https://web.archive.org/web/20221024080618/https://www.stern.de/familie/die-top-3-gartenarbeiten-im-oktober--was-im-herbst-zu-tun-ist-32786850.html,Der Herbst ist so etwas wie die Saure-Gurken-Zeit des Gartenjahres. Abgesehen von den wild umherfliegenden bunten Blättern bewegt sich nicht viel. Für den Winterschlaf ist es aber auch noch etwas zu … [+5376 chars],,de,'Schnee'
https://www.chip.de/news/Barfussschuhe-fuer-den-Winter-Modelle-fuer-jedes-Wetter_184478013.html,https://www.chip.de/news/Barfussschuhe-fuer-den-Winter-Modelle-fuer-jedes-Wetter_184478013.html,0,www.chip.de,Barfußschuhe für den Winter: Modelle für jedes Wetter,"Bei Barfußschuhen denkt man an zunächst an sommerliche Temperaturen und grüne Wiesen. Barfußschuhe lassen sich aber auch im Winter bei Frost und Schnee tragen - zumindest dann, wenn man Barfußschuhe hat, die auch bei kühlem Wetter warm und trocken halten.",https://www.chip.de/ii/1/2/6/6/8/2/0/6/6/Schuhe-GettyImages-1283877464-a15966e0ac7b8ab5.jpg,2022-10-20T10:27:00Z,https://web.archive.org/web/20221021121235/https://www.chip.de/news/Barfussschuhe-fuer-den-Winter-Modelle-fuer-jedes-Wetter_184478013.html,"Die mit einem Symbol oder grüner Unterstreichung gekennzeichneten Links sind Affiliate-Links. Kommt darüber ein Einkauf zustande,
 erhalten wir eine Provision - ohne Mehrkosten für Sie! Mehr Infos.",,de,'Schnee'
https://www.chip.de/news/Barfussschuhe-fuer-den-Winter-Gute-Modelle-fuer-jedes-Wetter_184478013.html,https://www.chip.de/news/Barfussschuhe-fuer-den-Winter-Gute-Modelle-fuer-jedes-Wetter_184478013.html,0,www.chip.de,Barfußschuhe für den Winter: Gute Modelle für jedes Wetter,"Bei Barfußschuhen denkt man zunächst an sommerliche Temperaturen und grüne Wiesen. Barfußschuhe lassen sich aber auch im Winter bei Frost und Schnee tragen - zumindest dann, wenn man Barfußschuhe hat, die auch bei kühlem Wetter warm und trocken halten.",https://www.chip.de/ii/1/2/6/6/8/2/0/6/6/Schuhe-GettyImages-1283877464-a15966e0ac7b8ab5.jpg,2022-10-24T07:45:00Z,,"Die mit einem Symbol oder grüner Unterstreichung gekennzeichneten Links sind Affiliate-Links. Kommt darüber ein Einkauf zustande,
 erhalten wir eine Provision - ohne Mehrkosten für Sie! Mehr Infos.",,de,'Schnee'
https://www.kicker.de/autofahrer-und-radler-was-sie-duerfen-und-was-nicht-920602/artikel,https://www.kicker.de/autofahrer-und-radler-was-sie-duerfen-und-was-nicht-920602/artikel,0,www.kicker.de,Autofahrer und Radler: Was sie dürfen - und was nicht,"Das Verhältnis zwischen Autofahrern und Radlern ist ein angespanntes. Oft hat das mit Unkenntnis der gängigen Regeln zu tun. Das führt dann zu Missverständnissen, die im schlimmsten Fall tödlich enden. Die gängigen Thesen - und wie sie zu beantworten sind:","https://derivates.kicker.de/image/upload/c_crop,x_111,y_221,w_2139,h_1204/w_1200,q_auto/v1/2022/10/09/8490cd70-85c7-4cc9-9876-28c128295ba5.jpeg",2022-10-09T09:37:06Z,https://web.archive.org/web/20221010221551/https://www.kicker.de/autofahrer-und-radler-was-sie-duerfen-und-was-nicht-920602/artikel,"Das Verhältnis zwischen Autofahrern und Radlern ist ein angespanntes. Oft hat das mit Unkenntnis der gängigen Regeln zu tun. Das führt dann zu Missverständnissen, die im schlimmsten Fall tödlich ende… [+3567 chars]",,de,'Schnee'
https://www.kicker.de/skirennfahrer-im-krisenmodus-energiedesaster-oder-panikmache-921812/artikel,https://www.kicker.de/skirennfahrer-im-krisenmodus-energiedesaster-oder-panikmache-921812/artikel,0,www.kicker.de,"Skirennfahrer im ""Krisenmodus"": Energiedesaster oder Panikmache?",Kein Plan B! Am Samstag starten die Skirennfahrer in Sölden in ihren nächsten ungewissen Winter. Flutlicht und Kunstschnee müssen auch in der Energiekrise her. Die Prognosen sind düster.,"https://derivates.kicker.de/image/upload/c_crop,x_34,y_383,w_3431,h_1930/w_1200,q_auto/v1/2022/10/18/56e9c50a-d1fc-4a25-a049-13ee375f19ed.jpeg",2022-10-18T07:04:51Z,,"Kein Plan B! Am Samstag starten die Skirennfahrer in Sölden in ihren nächsten ungewissen Winter. Flutlicht und Kunstschnee müssen auch in der Energiekrise her. Die Prognosen sind düster. 
 Schneekan… [+4373 chars]",,de,'Schnee'
https://www.nzz.ch/schweiz/everest-1952-die-vergessene-pioniertat-der-schweizer-bergsteiger-ld.1707410,https://www.nzz.ch/schweiz/everest-1952-die-vergessene-pioniertat-der-schweizer-bergsteiger-ld.1707410,0,www.nzz.ch,Everest 1952 – die vergessene Pioniertat der Schweizer Bergsteiger,Mit zwei Expeditionen wollten Schweizer Alpinisten vor 70 Jahren den Mount Everest bezwingen. Die Erstbesteigung des höchsten Bergs der Welt misslang zwar knapp – ebnete aber den Briten den Weg zum Gipfel. Ein Blick zurück.,"https://img.nzz.ch/2022/10/14/7dc4ef6f-bda7-4003-96a2-5e3f4defdaf0.jpeg?width=1200&height=674&fit=bound&quality=75&auto=webp&crop=5817,3268,x0,y576&wmark=nzz",2022-10-17T03:30:00Z,,"Gefährlich und unwegsam: Die Schweizer Expedition sucht sich eine Route durch den Khumbu-Eisbruch.
Es ist ein ungleiches Duo, das sich auf 8400 Metern über Meer ins Zelt flüchtet. Der eine, Raymond … [+11444 chars]",,de,'Schnee'
https://www.nzz.ch/mobilitaet/didi-mateschitz-und-sein-faible-fuer-alte-flieger-flying-bulls-ld.1708806,https://www.nzz.ch/mobilitaet/didi-mateschitz-und-sein-faible-fuer-alte-flieger-flying-bulls-ld.1708806,0,www.nzz.ch,Dietrich Mateschitz hatte ein Faible für Flugzeug-Oldies,"Der am Wochenende verstorbene Österreicher war nicht nur Unternehmer und Formel-1-Mogul, er war auch Liebhaber historischer Flugzeuge. Die Flying Bulls in Salzburg sind durch ihn entstanden. Ein Überblick.","https://img.nzz.ch/2022/10/24/5e415e30-e4da-4508-bac3-582e23b6cf66.jpeg?width=663&height=373&fit=bound&quality=75&auto=webp&crop=663,373,x534,y387",2022-10-25T03:30:00Z,,"Die F4-U Corsair der Flying Bulls im Flug, in Formation mit der Fotomaschine B-25. 
Es ist vermutlich dem Schriftsteller Antoine de Saint-Exupéry zu verdanken, dem Schöpfer des «Kleinen Prinzen», da… [+7371 chars]",,de,'Schnee'
https://www.nzz.ch/wirtschaft/zinsanstieg-und-kurssturz-der-aktien-reserven-der-bank-schmelzen-ld.1705456,https://www.nzz.ch/wirtschaft/zinsanstieg-und-kurssturz-der-aktien-reserven-der-bank-schmelzen-ld.1705456,0,www.nzz.ch,Zinsanstieg und Kurssturz der Aktien: Die Reserven der Pensionskassen und der Nationalbank sind weggeschmolzen,Die Marktturbulenzen dieses Jahres treffen nebst den Privatanlegern auch viele Profis. Die Nationalbank dürfte seit Anfang Jahr Verluste von total 140 bis 150 Milliarden Franken erlitten haben. Eine Gewinnausschüttung an Bund und Kantone für dieses Jahr ist u…,"https://img.nzz.ch/2022/10/02/3990e12d-7984-4d81-b78a-2b2a9e53927d.jpeg?width=1200&height=675&fit=bound&quality=75&auto=webp&crop=3788,2131,x0,y222&wmark=nzz",2022-10-03T03:30:00Z,https://web.archive.org/web/20221003054029/https://www.nzz.ch/wirtschaft/zinsanstieg-und-kurssturz-der-aktien-reserven-der-bank-schmelzen-ld.1705456,"Der Sitz der Nationalbank in Zürich.
Heroin, Zigaretten, Subventionen und künstlich tiefe Zinsen sind im Kern das Gleiche: eine Droge. Der Entzug einer Droge führt fast naturgemäss zu einem Aufschre… [+8623 chars]",,de,'Schnee'
https://www.nzz.ch/schweiz/wir-wollen-rund-um-das-matterhorn-keinen-billigen-massentourismus-sagt-der-ok-praesident-der-zermatter-weltcup-abfahrt-ld.1707530,https://www.nzz.ch/schweiz/wir-wollen-rund-um-das-matterhorn-keinen-billigen-massentourismus-sagt-der-ok-praesident-der-zermatter-weltcup-abfahrt-ld.1707530,0,www.nzz.ch,"INTERVIEW - «Wir wollen rund um das Matterhorn keinen billigen Massentourismus», sagt der OK-Präsident der Zermatter Weltcup-Abfahrt","Franz Julen, der Verwaltungsratspräsident der Zermatt Bergbahnen, wehrt sich dagegen, dass der Wintersport in der Energiekrise zum Prügelknaben der Nation wird.","https://img.nzz.ch/2022/10/19/ee295ffc-26b2-4949-9423-7793f9d09809.jpeg?width=1200&height=675&fit=bound&quality=75&auto=webp&crop=5504,3096,x0,y1640&wmark=nzz",2022-10-21T04:39:50Z,https://web.archive.org/web/20221021044328/https://www.nzz.ch/schweiz/wir-wollen-rund-um-das-matterhorn-keinen-billigen-massentourismus-sagt-der-ok-praesident-der-zermatter-weltcup-abfahrt-ld.1707530,"Mit einer Bergbahnverbindung über das Klein Matterhorn will Franz Julen Touristen aus Asien und den USA ins Wallis holen.
Herr Julen, der Tourismus hat ein Imageproblem. Während der Corona-Pandemie … [+11441 chars]",,de,'Schnee'
https://www.nzz.ch/sport/sport-aufstand-der-underdogs-in-der-national-league-kloten-siegt-im-derby-fc-luzern-schafft-eine-spektakulaere-wende-ld.1566300,https://www.nzz.ch/sport/sport-aufstand-der-underdogs-in-der-national-league-kloten-siegt-im-derby-fc-luzern-schafft-eine-spektakulaere-wende-ld.1566300,0,www.nzz.ch,KURZMELDUNGEN - Sport: Aufstand der Underdogs in der National League – Kloten siegt im Derby +++ FC Luzern schafft eine spektakuläre Wende,"Wawrinka startet in Basel gegen Ruud, die Weltnummer 3. Und Männer-Abfahrten in Zermatt wegen Schneemangels abgesagt. Die wichtigsten Sportmeldungen im Überblick.","https://img.nzz.ch/2022/10/22/21314737-8f5a-48ba-9f46-d61a846482de.jpeg?width=1200&height=674&fit=bound&quality=75&auto=webp&crop=3659,2056,x0,y382&wmark=nzz",2022-10-22T20:46:37Z,https://web.archive.org/web/20221022215219/https://www.nzz.ch/sport/sport-aufstand-der-underdogs-in-der-national-league-kloten-siegt-im-derby-fc-luzern-schafft-eine-spektakulaere-wende-ld.1566300,"Eishockey: Aufstand der Underdogs in der National League Kloten siegt im Derby
Kloten wehrt sich erfolgreich gegen den ZSC.
(sda) Gleich drei Underdogs verblüffen in den Spielen vom Samstag: Lugano… [+15690 chars]",,de,'Schnee'
https://www.nzz.ch/wirtschaft/wirtschaft-adidas-stellt-zusammenarbeit-mit-rapper-kanye-west-ein-ld.1708415,https://www.nzz.ch/wirtschaft/wirtschaft-adidas-stellt-zusammenarbeit-mit-rapper-kanye-west-ein-ld.1708415,0,www.nzz.ch,KURZMELDUNGEN - Wirtschaft: Adidas stellt Zusammenarbeit mit Rapper Kanye West ein,"NZZ Nachrichten, Hintergründe, Meinungen aus der Schweiz, International, Sport, Digital, Wirtschaft, Auto & mehr. Fundierte Berichterstattung rund um die Uhr.","https://img.nzz.ch/2022/10/25/09a3a784-055c-43ac-ae8e-819e1427eb53.jpeg?width=1200&height=675&fit=bound&quality=75&auto=webp&crop=3141,1767,x0,y94&wmark=nzz",2022-10-25T11:22:43Z,,"Adidas will nicht mehr mit Kanye West zusammenarbeiten
Adidas stellt die Zusammenarbeit mit dem Rapper Kanye West ein, und damit auch die gemeinsame Modelinie Yeezy. 
lia./(dpa) Nach antisemitische… [+15913 chars]",,de,'Schnee'
https://www.nzz.ch/sport/sport-thomas-reis-ist-der-neue-schalke-trainer-fc-barcelona-unterliegt-den-bayern-03-ld.1566300,https://www.nzz.ch/sport/sport-thomas-reis-ist-der-neue-schalke-trainer-fc-barcelona-unterliegt-den-bayern-03-ld.1566300,0,www.nzz.ch,KURZMELDUNGEN - Sport: Thomas Reis ist der neue Schalke-Trainer +++ FC Barcelona unterliegt den Bayern 0:3,Die wichtigsten Sportmeldungen im Überblick.,"https://img.nzz.ch/2022/10/27/c4917ff6-1f12-42fc-8787-b7526bd17ad2.jpeg?width=1200&height=675&fit=bound&quality=75&auto=webp&crop=5184,2916,x0,y24&wmark=nzz",2022-10-27T08:10:45Z,,"Fussball: Thomas Reis ist der neue Schalke-Trainer 
Thomas Reis, zuletzt bei Bochum, übernimmt nun das Team von Schalke.
(sda) Der beim VfL Bochum nicht mehr erwünschte Thomas Reis hat bereits wied… [+14240 chars]",,de,'Schnee'
https://www.faz.net/aktuell/wirtschaft/auto-verkehr/rueckschlag-fuer-die-robotaxis-ford-und-vw-steigen-aus-projekt-aus-18418256.html,https://www.faz.net/aktuell/wirtschaft/auto-verkehr/rueckschlag-fuer-die-robotaxis-ford-und-vw-steigen-aus-projekt-aus-18418256.html,0,www.faz.net,Rückschlag für die Robotaxis: Ford und VW steigen aus Projekt aus,Ford und Volkswagen steigen aus einem Milliardenprojekt für autonomes Fahren aus. Die Entwicklung ist schwerer als gedacht. VW plant jetzt mit neuem Partner.,https://media1.faz.net/ppmedia/aktuell/988352240/1.8418253/facebook_teaser_fplus/ford-chef-jim-hackett-rechts.jpg,2022-10-27T17:59:05Z,,"Die Aufmerksamkeit war riesig, als Herbert Diess und Jim Hackett, damals die Chefs von Volkswagen und Ford , im Herbst 2019 ihre neue Kooperation zum autonomen Fahren bekanntgaben. Gemeinsam investie… [+1189 chars]",,de,'Herbst'
https://www.faz.net/aktuell/gesellschaft/gesundheit/coronavirus/wochenbericht-des-rki-gewisse-entspannung-bei-corona-zahlen-18419307.html,https://www.faz.net/aktuell/gesellschaft/gesundheit/coronavirus/wochenbericht-des-rki-gewisse-entspannung-bei-corona-zahlen-18419307.html,0,www.faz.net,RKI-Wochenbericht: „Gewisse Entspannung“ bei Corona-Zahlen,"In Deutschland deutet sich ein Rückgang der Coronafälle an. Das Robert-Koch-Institut warnt aber davor, die Situation zu unterschätzen. Die niedrigen Ansteckungszahlen könnten mit den Herbstferien verbunden sein.",https://media0.faz.net/ppmedia/aktuell/wirtschaft/2212512456/1.8419320/facebook_teaser/ein-mann-mit-ffp-2-maske-im.jpg,2022-10-27T17:45:55Z,https://web.archive.org/web/20221028085038/https://www.faz.net/aktuell/gesellschaft/gesundheit/coronavirus/wochenbericht-des-rki-gewisse-entspannung-bei-corona-zahlen-18419307.html,Bei den Corona-Zahlen in Deutschland zeichnet sich laut Robert-Koch-Institut (RKI) ein abnehmender Trend ab die weitere Entwicklung müsse jedoch noch abgewartet werden. Bei den Erkrankungszahlen durc… [+1450 chars],,de,'Herbst'
https://www.faz.net/aktuell/gesellschaft/gesundheit/coronavirus/rki-wochenbericht-mehr-nachweise-von-hoellenhund-sublinie-18419307.html,https://www.faz.net/aktuell/gesellschaft/gesundheit/coronavirus/rki-wochenbericht-mehr-nachweise-von-hoellenhund-sublinie-18419307.html,0,www.faz.net,RKI-Wochenbericht: Mehr Nachweise von „Höllenhund“-Sublinie,Schon bald könnte eine neue Corona-Variante in Deutschland vorherrschen. Die Zahl der Infektionen geht laut Robert Koch-Institut jedoch vorerst zurück.,https://media0.faz.net/ppmedia/aktuell/wirtschaft/2212512456/1.8419320/facebook_teaser/ein-mann-mit-ffp-2-maske-im.jpg,2022-10-27T17:45:55Z,https://web.archive.org/web/20221028055556/https://www.faz.net/aktuell/gesellschaft/gesundheit/coronavirus/rki-wochenbericht-mehr-nachweise-von-hoellenhund-sublinie-18419307.html,Bestimmte Abkömmlinge der Omikron-Sublinie BA.5 werden laut Robert-Koch-Institut (RKI) zunehmend in Deutschland nachgewiesen. Seit Ende August/Anfang September verzeichne man einen deutlichen Anstieg… [+4318 chars],,de,'Herbst'
https://www.bild.de/sport/fussball/fussball/ex-aue-trainer-stipic-leonhardts-aus-tat-mir-im-herzen-weh-81741718.bild.html,https://www.bild.de/sport/fussball/fussball/ex-aue-trainer-stipic-leonhardts-aus-tat-mir-im-herzen-weh-81741718.bild.html,0,www.bild.de,Ex-Aue-Trainer Stipic - „Leonhardts Aus tat mir im Herzen weh“,Jetzt ist Tomislav Stipic (43) ein Titelsammler! Der Kroate wurde am 19. Oktober mit FK Auda Pokalsieger in Lettland.,"https://images.bild.de/6359283b8c74d471d8a449da/2a7b4afd719c569c1b54127719d08915,55c972c?w=1280",2022-10-27T17:45:45Z,https://web.archive.org/web/20221027221109/https://www.bild.de/sport/fussball/fussball/ex-aue-trainer-stipic-leonhardts-aus-tat-mir-im-herzen-weh-81741718.bild.html,Jetzt ist Tomislav Stipic (43) ein Titelsammler! Der Kroate wurde am 19. Oktober mit FK Auda Pokalsieger in Lettland. Im Finale gegen FK Riga FS gab es ein 1:0. Bereits im August war Stipic vom Boss … [+1922 chars],,de,'Herbst'
https://www.brigitte.de/aktuell/rothenburg-ob-der-tauber--die-schoensten-plaetze-der-stadt-an-der-romantischen-strasse-13414740.html,https://www.brigitte.de/aktuell/rothenburg-ob-der-tauber--die-schoensten-plaetze-der-stadt-an-der-romantischen-strasse-13414740.html,0,www.brigitte.de,Rothenburg ob der Tauber: Die schönsten Plätze der Stadt an der Romantischen Straße,"Von Schlösschen bis zum Hexenhaus, von Schneebällen bis zum Federweißen: Rothenburg ob der Tauber bietet viel Abwechslung - ein Rundgang.",https://image.brigitte.de/13414742/t/z0/v1/w1440/r1.7778/-/27--die-schoensten-plaetze-der-stadt-an-der-romantischen-strasse---1-1---spoton-article-1031760.jpg,2022-10-27T17:41:00Z,,"Von Schlösschen bis zum Hexenhaus, von Schneebällen bis zum Federweißen: Rothenburg ob der Tauber bietet viel Abwechslung - ein Rundgang.
Wenn die ersten Turmspitzen und Bergfriede über den Wipfeln … [+3040 chars]",,de,'Herbst'
https://www.morgenpost.de/bezirke/friedrichshain-kreuzberg/article236773741/Kreuzberger-Prinzenbad-bleibt-laenger-geoeffnet.html,https://www.morgenpost.de/bezirke/friedrichshain-kreuzberg/article236773741/Kreuzberger-Prinzenbad-bleibt-laenger-geoeffnet.html,0,www.morgenpost.de,Schwimmen: Kreuzberger Prinzenbad bleibt länger geöffnet,Der Oktobersommer macht es möglich: Das Freibad wird noch mal eine Woche länger offen bleiben.,https://img.morgenpost.de/img/berlin/crop236654897/0582602125-w820-cv16_9-q85/Prinzenbad.jpg,2022-10-27T17:37:11Z,,"Der milde Herbst mit Temperaturen über 20 Grad macht es in diesem Jahr möglich: Die Saison im Sommerbad Kreuzberg, dem Prinzenbad, wird um eine weitere Woche verlängert. Das teilten die Bäderbetriebe… [+1244 chars]",,de,'Herbst'
https://www.jungewelt.de/artikel/437589.gedenkstättenkonzept-der-hansestadt-antikommunismus-spielt-bis-heute-eine-tragende-rolle.html,https://www.jungewelt.de/artikel/437589.gedenkstättenkonzept-der-hansestadt-antikommunismus-spielt-bis-heute-eine-tragende-rolle.html,0,www.jungewelt.de,Gedenkstättenkonzept der Hansestadt: »Antikommunismus spielt bis heute eine tragende Rolle«,Hamburg: VVN-BdA misstrauisch gegenüber geplantem Konzept der Stadt für ihre Gedenkstätten. Ein Gespräch mit Cornelia Kerth • Foto: Willi Schewski/imago images,https://www.jungewelt.de/img/1100/173084.jpg,2022-10-27T17:36:44Z,,"In diesem Herbst soll in Hamburg ein Gesamtkonzept für die Gedenkstätten veröffentlicht werden. Worum geht es?
Mit dem »rot-grünen« Koalitionsvertrag im Juni 2020 hat die »Stiftung Hamburger Gedenks… [+3839 chars]",,de,'Herbst'
https://www.jungewelt.de/artikel/437420.sds-kongress-in-leipzig-wollen-keine-linksliberale-kurskorrektur.html,https://www.jungewelt.de/artikel/437420.sds-kongress-in-leipzig-wollen-keine-linksliberale-kurskorrektur.html,0,www.jungewelt.de,SDS-Kongress in Leipzig: »Wollen keine linksliberale Kurskorrektur«,Linker Studierendenverband veranstaltet »System-Change-Kongress« an der Uni Leipzig. Ein Gespräch mit Nathalie Steinert • Foto: Müller-Stauffenberg/imago images,https://www.jungewelt.de/img/1100/173086.jpg,2022-10-27T17:36:44Z,https://web.archive.org/web/20221027183506/https://www.jungewelt.de/artikel/437420.sds-kongress-in-leipzig-wollen-keine-linksliberale-kurskorrektur.html,"Der Sozialistisch-Demokratische Studierendenverband Die Linke.SDS organisiert an der UniversitätLeipzigvon diesem Freitag an bis Sonntag einen »System-Change-Kongress«. Was erwarten Sie sich davon?
… [+3763 chars]",,de,'Herbst'
https://www.stern.de/kultur/rothenburg-ob-der-tauber--die-schoensten-plaetze-der-mittelalter-stadt-32856856.html,https://www.stern.de/kultur/rothenburg-ob-der-tauber--die-schoensten-plaetze-der-mittelalter-stadt-32856856.html,0,www.stern.de,Rothenburg ob der Tauber: Die schönsten Plätze der Mittelalter-Stadt,"Von Schlösschen bis zum Hexenhaus, von Schneebällen bis zum Federweißen: Rothenburg ob der Tauber bietet viel Abwechslung - ein Rundgang.",https://image.stern.de/32856860/t/gc/v1/w1440/r1.7778/-/27--die-schoensten-plaetze-der-mittelalter-stadt---16-9---spoton-article-1031760.jpg,2022-10-27T17:35:00Z,,"Von Schlösschen bis zum Hexenhaus, von Schneebällen bis zum Federweißen: Rothenburg ob der Tauber bietet viel Abwechslung - ein Rundgang.
Wenn die ersten Turmspitzen und Bergfriede über den Wipfeln … [+3040 chars]",,de,'Herbst'
https://www.dw.com/de/russland-will-lgbt-propaganda-komplett-verbieten/a-63578486,https://www.dw.com/de/russland-will-lgbt-propaganda-komplett-verbieten/a-63578486,0,www.dw.com,"Russland will ""LGBT-Propaganda"" komplett verbieten","Die russische Staatsduma hat in erster Lesung einen Gesetzesentwurf beschlossen, der ein vollständiges Verbot von ""Propaganda nicht-traditioneller sexueller Beziehungen"" in Russland beinhaltet. Was genau ist vorgesehen? In erster Lesung haben alle 400 anwesen…",https://static.dw.com/image/62437847_6.jpg,2022-10-27T17:25:00Z,,"In erster Lesung haben alle 400 anwesenden Abgeordneten der russischen Staatsduma, die 450 Sitze hat, einen Gesetzentwurf  gebilligt, der ""Propaganda nicht-traditioneller sexueller Beziehungen"" volls… [+5236 chars]",,de,'Herbst'
https://www.spiegel.de/politik/deutschland/die-linke-sahra-wagenknecht-und-der-heisse-herbst-podcast-a-45fc8c19-bf00-4214-9463-46df9ae3dc81,https://www.spiegel.de/politik/deutschland/die-linke-sahra-wagenknecht-und-der-heisse-herbst-podcast-a-45fc8c19-bf00-4214-9463-46df9ae3dc81,0,www.spiegel.de,"Die Linke, Sahra Wagenknecht und der »heiße Herbst« - Podcast","Warum gelingt es den Rechten, Proteste in der Energiekrise zu mobilisieren, aber den Linken kaum? Und welche Rolle spielt das prominenteste Gesicht der Linkspartei? Antworten im Stimmenfang.",https://cdn.prod.www.spiegel.de/images/ebd5a682-a1a6-4a27-ac67-a57a678ed355_w1280_r1.77_fpx56_fpy36.jpg,2022-10-27T17:08:00Z,https://web.archive.org/web/20221027202910/https://www.spiegel.de/politik/deutschland/die-linke-sahra-wagenknecht-und-der-heisse-herbst-podcast-a-45fc8c19-bf00-4214-9463-46df9ae3dc81,"Die Energiekrise stürzt viele Deutsche in Existenzsorgen. Während Rechtsradikale vor allem in Ostdeutschland erfolgreich zu Protesten aufrufen, tut sich die Linke mit der Mobilisierung bislang schwer… [+128 chars]",,de,'Herbst'
https://burgenland.orf.at/stories/3179811/,https://burgenland.orf.at/stories/3179811/,0,burgenland.orf.at,Grusel und Gedenken als Umsatzbringer,"Halloween nächste Woche hat sich zunehmend zu einem Wirtschaftsfaktor für den Handel entwickelt. Von Allerheiligen profitieren die heimischen Gärtnereien: Die Gräber der Verstorbenen schön zu schmücken, bleibt eine aufrechte Tradition.",https://ibs.orf.at/bgl?image=https%3A%2F%2Foekastatic.orf.at%2Fmims%2F2022%2F44%2F63%2Fcrops%2Fw%3D1200%2Ch%3D627%2Cq%3D75%2F1551211_master_566463_allerheiligen_halloween_reportage_c0025-00_00_00_00.jpg%3Fs%3D249e2d00d49ad22f56042edc3c04ea655de228d7,2022-10-27T17:03:44Z,,"In den burgenländischen Blumenhandlungen und Gärtnereien herrscht jetzt Hochbetrieb. Allerheiligen sei eine große Herausforderung, so die Oberwarter Floristin Michaela Grandits. Es werde jede Hand ge… [+1530 chars]",,de,'Herbst'
