index,url,valid,domain,title,description,image,published,archive,content,quote,language,keyword
https://www.welt.de/satire/article242491997/Wegen-Energieverschwendung-EU-verbietet-Macht-hoch-die-Tuer.html,https://www.welt.de/satire/article242491997/Wegen-Energieverschwendung-EU-verbietet-Macht-hoch-die-Tuer.html,0,www.welt.de,Wegen Heizkosten – EU verbietet „Macht hoch die Tür“,"Die EU bereitet sich auf mögliche Blackouts und Heizungsausfälle vor: Da viele Weihnachtslieder zu widersinnigen Aktionen im Winter animieren, sollen sie in diesem Advent nicht gespielt oder gesungen werden.",https://img.welt.de/img/satire/mobile242492063/1501354937-ci16x9-w1200/Weihnachtsmarkt-Konstanz-am-Bodensee-2022.jpg,2022-12-05T12:02:39Z,,Brüssel greift durch! Nach der Verabschiedung des Erdöl-Embargos gegen Russland will die Europäische Union nun auch ihre Bürgerinnen und Bürger deutlicher als bislang für einen bewussteren Umgang mit… [+2502 chars],,de,'Heizkosten'
https://t3n.de/news/architekten-wohnhaeuser-mond-planen-1518717/,https://t3n.de/news/architekten-wohnhaeuser-mond-planen-1518717/,0,t3n.de,"Strahlung, Kälte, Bakterien: Wie Architekten Wohnhäuser für den Mond planen","Noch vor dem Ende dieses Jahrzehnts könnten Menschen dauerhaft auf dem Mond leben. Auch eine Besiedlung des Mars ist geplant. Aber extraterrestrische Häuser stellen Architekt:innen vor einige Herausforderungen.
Noch in diesem Jahrzehnt sollen den Plänen der N…",,2022-12-05T14:12:17Z,,Noch vor dem Ende dieses Jahrzehnts könnten Menschen dauerhaft auf dem Mond leben. Auch eine Besiedlung des Mars ist geplant. Aber extraterrestrische Häuser stellen Architekt:innen vor einige Herausf… [+4308 chars],,de,'Kälte'
https://www.stern.de/wirtschaft/news/wilhelmshaven--spezialschiff-fuer-lng-terminal-kommt-mitte-dezember-32977948.html,https://www.stern.de/wirtschaft/news/wilhelmshaven--spezialschiff-fuer-lng-terminal-kommt-mitte-dezember-32977948.html,0,www.stern.de,Wilhelmshaven: Spezialschiff für LNG-Terminal kommt Mitte Dezember,Düsseldorf/Wilhelmshaven - Der Gasimporteur Uniper erwartet Mitte Dezember das Spezialschiff «Hoegh Esperanza» als technisches Herzstück für das neue,https://image.stern.de/32977950/t/hT/v1/w1440/r1.7778/-/05--urnnewsmldpacom2009010122120599787640v3w800h600l640t709r1848b1534jpeg---dc0a9da3c4da0e84.jpg,2022-12-05T14:27:11Z,https://web.archive.org/web/20221205150625/https://www.stern.de/wirtschaft/news/wilhelmshaven--spezialschiff-fuer-lng-terminal-kommt-mitte-dezember-32977948.html,"Die ""Hoegh Esperanza"" wird bald in Wilhelmshaven erwartet. Die Anlage soll am 17. Dezember offiziell in Betrieb genommen werden.
Der Gasimporteur Uniper erwartet Mitte Dezember das Spezialschiff ""Ho… [+1210 chars]",,de,'Gas'
https://www.morgenpost.de/lifestyle/wohnen/article237080757/Wenig-heizen-ohne-Folgeschaeden.html,https://www.morgenpost.de/lifestyle/wohnen/article237080757/Wenig-heizen-ohne-Folgeschaeden.html,0,www.morgenpost.de,Energie sparen: Wenig heizen ohne Folgeschäden,"Das Heizen ist immens teuer geworden. Also versuchen wir, so wenig wie möglich zu heizen. Die Folge: Geplatzte Wasserleitungen oder Schimmel. Doch es geht beides: Das Haus schützen und Energie sparen.",https://img.morgenpost.de/img/wohnen/crop237080755/6472604198-w820-cv16_9-q85/Wenig-heizen-ohne-Folgeschaeden.jpg,2022-12-05T15:47:08Z,,"Berlin (dpa/tmn). Es ist schon ganz schön kalt draußen, trotzdem heizt noch nicht jeder. Und viele heizen weniger als in den Vorjahren. Der meistgenannte Grund laut einer YouGov-Umfrage im Auftrag de… [+2421 chars]",,de,'Kälte'
https://www.stern.de/gesellschaft/regional/nordrhein-westfalen/energie--energiekonzern-rwe-leitet-verfahren-gegen-gazprom-ein-32978458.html,https://www.stern.de/gesellschaft/regional/nordrhein-westfalen/energie--energiekonzern-rwe-leitet-verfahren-gegen-gazprom-ein-32978458.html,0,www.stern.de,Energie: Energiekonzern RWE leitet Verfahren gegen Gazprom ein,"Wegen ausbleibender Gaslieferungen strengt nach Uniper nun auch der Energiekonzern RWE ein Schiedsgerichtsverfahren gegen den russischen Staatskonzern Gazprom an. RWE habe die erforderlichen rechtlichen Schritte eingeleitet, sagte ein Sprecher am Montag in Es…",https://image.stern.de/32978460/t/rx/v1/w1440/r1.7778/-/05--urnnewsmldpacom2009010122120599789751v3w800h600l657t140r2364b1557jpeg---b36c2a4e7a74f3c2.jpg,2022-12-05T16:11:18Z,,Wegen ausbleibender Gaslieferungen strengt nach Uniper nun auch der Energiekonzern RWE ein Schiedsgerichtsverfahren gegen den russischen Staatskonzern Gazprom an. RWE habe die erforderlichen rechtlic… [+939 chars],,de,'Gas'
https://www.zeit.de/news/2022-12/05/rwe-leitet-schiedsgerichtsverfahren-gegen-gazprom-ein,https://www.zeit.de/news/2022-12/05/rwe-leitet-schiedsgerichtsverfahren-gegen-gazprom-ein,0,www.zeit.de,Gasversorgung: RWE leitet Schiedsgerichtsverfahren gegen Gazprom ein,,,2022-12-05T16:24:40Z,,"When browsing with ads:
We collect personal data and also transmit it to third-party providers
 that help us improve and finance our digital content. Some of the information stored on your device, … [+732 chars]",,de,'Gas'
https://www.morgenpost.de/wirtschaft/article237078789/RWE-leitet-Schiedsgerichtsverfahren-gegen-Gazprom-ein.html,https://www.morgenpost.de/wirtschaft/article237078789/RWE-leitet-Schiedsgerichtsverfahren-gegen-Gazprom-ein.html,0,www.morgenpost.de,Gasversorgung: RWE leitet Schiedsgerichtsverfahren gegen Gazprom ein,"Der Energieriese aus Essen hat rechtliche Schritte gegen den russischen Staatskonzern Gazprom eingeleitet. Er folgt damit dem Unternehmen Uniper, das das bereits vor einigen Tagen getan hat.",https://img.morgenpost.de/img/wirtschaft/crop237078787/7312602215-w820-cv16_9-q85/RWE.jpg,2022-12-05T16:24:40Z,,Essen. Wegen ausbleibender Gaslieferungen strengt nach Uniper nun auch der Energiekonzern RWE ein Schiedsgerichtsverfahren gegen den russischen Staatskonzern Gazprom an. RWE habe die erforderlichen r… [+569 chars],,de,'Gas'
https://www.stern.de/gesellschaft/regional/niedersachsen-bremen/leer--nikolaus-und-knecht-ruprecht-beschenken-kinder-32978666.html,https://www.stern.de/gesellschaft/regional/niedersachsen-bremen/leer--nikolaus-und-knecht-ruprecht-beschenken-kinder-32978666.html,0,www.stern.de,Leer: Nikolaus und Knecht Ruprecht beschenken Kinder,"Kurz vor dem Nikolaus-Tag haben mehrere hundert Kinder in Weener (Landkreis Leer) Stutenkerle und Süßigkeiten bekommen. Die Kinder warteten am Montagnachmittag an verschiedenen Orten, wo sie von Nikolaus und seinem Knecht Ruprecht in einer Kutsche besucht wur…",https://image.stern.de/32978668/t/N8/v1/w1440/r1.7778/-/05--urnnewsmldpacom2009010122120599790656v4w800h600l742t0r1763b1400jpeg---de8be4cd3377500b.jpg,2022-12-05T17:13:18Z,,"Kurz vor dem Nikolaus-Tag haben mehrere hundert Kinder in Weener (Landkreis Leer) Stutenkerle und Süßigkeiten bekommen. Die Kinder warteten am Montagnachmittag an verschiedenen Orten, wo sie von Niko… [+1475 chars]",,de,'Kinder'
https://www.spiegel.de/panorama/justiz/oesterreich-lehrer-in-wien-missbrauchte-laut-kommissions-bericht-mindestens-40-schueler-a-4548ff89-7473-4554-b67b-605bd37181db,https://www.spiegel.de/panorama/justiz/oesterreich-lehrer-in-wien-missbrauchte-laut-kommissions-bericht-mindestens-40-schueler-a-4548ff89-7473-4554-b67b-605bd37181db,0,www.spiegel.de,Österreich: Lehrer in Wien missbrauchte laut Kommissions-Bericht mindestens 40 Schüler,Er verabreichte ihnen K.-o.-Tropfen und filmte sie: Ein Lehrer aus Wien missbrauchte laut einer Untersuchung Dutzende Kinder. Es ist von einem »Systemversagen« die Rede.,https://cdn.prod.www.spiegel.de/images/226d4365-6122-4329-b165-6c885f357b1a_w1280_r1.77_fpx66.64_fpy49.99.jpg,2022-12-05T18:43:34Z,https://web.archive.org/web/20221205195431/https://www.spiegel.de/panorama/justiz/oesterreich-lehrer-in-wien-missbrauchte-laut-kommissions-bericht-mindestens-40-schueler-a-4548ff89-7473-4554-b67b-605bd37181db,"Da der Mann auch an einer benachbarten Schule unterrichtete, würden nun Briefe an deren ehemalige Schülerinnen und Schüler geschickt, um von etwaigen Missbrauchshandlungen zu erfahren und Hilfe anzub… [+488 chars]",,de,'Kinder'
https://www.n-tv.de/politik/10-15-Ukrainischer-Stromversorger-rechnet-mit-Hoehepunkt-der-Kaelte--article23143824.html,https://www.n-tv.de/politik/10-15-Ukrainischer-Stromversorger-rechnet-mit-Hoehepunkt-der-Kaelte--article23143824.html,0,www.n-tv.de,"Ukraine-Krieg im Liveticker: +++ 10:15 Ukrainischer Stromversorger rechnet mit ""Höhepunkt der Kälte"" +++","Berlin, Washington, Br\u00fcssel - \u00fcberall. n-tv berichtet von allen wichtigen Schaupl\u00e4tzen der Innen- und Au\u00dfenpolitik.",https://bilder2.n-tv.de/img/incoming/crop23332537/9041326157-cImg_16_9-w1200/Liveticker1-grau-1-Kopie.jpg,2022-12-05T23:30:00Z,,"Nach der erneuten russischen Angriffswelle arbeitet die Ukraine daran, beschädigte Energieanlagen zu reparieren. Aufgrund der Folgen des Beschusses und um das ""Gleichgewicht zwischen Stromerzeugung u… [+16307 chars]",,de,'Kälte'
https://sz-magazin.sueddeutsche.de/gesundheit/kaelte-frieren-erkaeltung-winter-92172,https://sz-magazin.sueddeutsche.de/gesundheit/kaelte-frieren-erkaeltung-winter-92172,0,sz-magazin.sueddeutsche.de,"»Im Winter sollte man zur Ruhe kommen, kürzer treten«","Es ist kalt draußen. Jetzt erstmal Glühwein? »Bloß nicht«, sagt Kälteforscher Michael Hohenauer. Im Interview erklärt er, mit welchem Trick man sich besser ans Frieren gewöhnt, ob ein Winterbäuchlein isoliert – und warum es schadet, im Schlafzimmer zu viel zu…",https://szm-media.sueddeutsche.de/image/szm/324e7f87e1a3cd3d5a355b131d4d88c1/t0l0w1200h630/1280/image.jpeg,2022-12-06T02:41:00Z,,"SZ-Magazin: Herr Hohenauer, haben Sie heute schon gefroren? Erich Hohenauer: Ja, morgens, auf dem Weg zum Auto auf dem Parkplatz. Da habe ich etwas gefröstelt. Weil ich in Eile war und mit halboffene… [+474 chars]",,de,'Kälte'
https://www.n-tv.de/wirtschaft/Theranos-Gruenderin-Holmes-geht-in-Berufung-article23764679.html,https://www.n-tv.de/wirtschaft/Theranos-Gruenderin-Holmes-geht-in-Berufung-article23764679.html,0,www.n-tv.de,Lange Haft fÃ¼r Bluttest-Betrug: Theranos-GrÃ¼nderin Holmes geht in Berufung,"FÃ¼r elf Jahre soll Elizabeth Holmes ins GefÃ¤ngnis, weil sie mit ihrer Bluttest-Firma Theranos Anleger im groÃŸen Stil betrogen hat. FÃ¼r die schwangere 38-JÃ¤hrige ist das Urteil, das ein Gericht Mitte November fÃ¤llt, ein Schlag ins Gesicht. Jetzt legt sie Berufâ€¦",https://bilder3.n-tv.de/img/incoming/crop23764678/8371328181-cImg_16_9-w1200/imago0098071621h.jpg,2022-12-06T04:15:23Z,https://web.archive.org/web/20221206043104/https://www.n-tv.de/wirtschaft/Theranos-Gruenderin-Holmes-geht-in-Berufung-article23764679.html,"FÃ¼r elf Jahre soll Elizabeth Holmes ins GefÃ¤ngnis, weil sie mit ihrer Bluttest-Firma Theranos Anleger im groÃŸen Stil betrogen hat. FÃ¼r die schwangere 38-JÃ¤hrige ist das Urteil, das ein Gericht Mitte â€¦ [+2040 chars]",,de,'Schwangere'
https://www.nzz.ch/feuilleton/gendersternchen-wie-kam-das-zeichen-in-die-sprache-ld.1715402,https://www.nzz.ch/feuilleton/gendersternchen-wie-kam-das-zeichen-in-die-sprache-ld.1715402,0,www.nzz.ch,"Der Genderstern hat sich in vielen Institutionen durchgesetzt, gleichzeitig provoziert er noch immer. Wie kam der * eigentlich in die Welt?","Das Sternchen ist von der Subkultur an die Hochschulen vorgedrungen und hat die Politik erobert. Das macht nicht allen Feministinnen und Linguistinnen Freude, die für eine geschlechtergerechte Sprache kämpfen.","https://img.nzz.ch/2022/12/05/bc7990be-2625-41b5-b7cf-e08d3559dd04.jpeg?width=1200&height=674&fit=bound&quality=75&auto=webp&crop=2502,1406,x0,y547&wmark=nzz",2022-12-06T04:30:00Z,,"Vor Jahrzehnten sind sie dem IT-Kosmos entsprungen, heute sind die Sternchen überall verbreitet.
Der Genderstern soll verschwinden, tschüss und auf Nimmerwiedersehen. In der Stadt Zürich jedenfalls … [+11180 chars]",,de,'Geschlecht'
https://www.zeit.de/news/2022-12/06/luxemburg-uebertrifft-erneut-gas-einsparziel,https://www.zeit.de/news/2022-12/06/luxemburg-uebertrifft-erneut-gas-einsparziel,0,www.zeit.de,Energie: Luxemburg übertrifft erneut Gas-Einsparziel,,,2022-12-06T04:53:42Z,https://web.archive.org/web/20221207045701/https://www.zeit.de/news/2022-12/06/luxemburg-uebertrifft-erneut-gas-einsparziel,"When browsing with ads:
We collect personal data and also transmit it to third-party providers
 that help us improve and finance our digital content. Some of the information stored on your device, … [+732 chars]",,de,'Gas'
https://www.diepresse.com/6224248/angreifer-schnitten-schwangere-in-mexiko-auf-und-stahlen-ungeborenes,https://www.diepresse.com/6224248/angreifer-schnitten-schwangere-in-mexiko-auf-und-stahlen-ungeborenes,0,www.diepresse.com,Angreifer schnitten Schwangere in Mexiko auf und stahlen Ungeborenes,"Ein Pärchen konnte mit einem Neugeborenen festgenommen werden. Sie haben die Tat begangen, weil die Frau offenbar keine Kinder bekommen kann. Die angegriffene Frau überlebte nicht.",https://www.diepresse.com/assets_v2/images/diepresse_nachrichten.png,2022-12-06T05:21:00Z,,"Ein Pärchen konnte mit einem Neugeborenen festgenommen werden. Sie haben die Tat begangen, weil die Frau offenbar keine Kinder bekommen kann. Die angegriffene Frau überlebte nicht.
Im Osten Mexikos … [+867 chars]",,de,'Schwangere'
https://www.stern.de/gesellschaft/regional/mecklenburg-vorpommern/wetter--kaelte-und-glaette-in-mecklenburg-vorpommern-erwartet-32979642.html,https://www.stern.de/gesellschaft/regional/mecklenburg-vorpommern/wetter--kaelte-und-glaette-in-mecklenburg-vorpommern-erwartet-32979642.html,0,www.stern.de,Wetter: Kälte und Glätte in Mecklenburg-Vorpommern erwartet,"Ein anhaltender Tiefdruckeinfluss sorgt in Mecklenburg-Vorpommern am Dienstag für viele Wolken und Winterwetter. Wie der Deutsche Wetterdienst (DWD) mitteilte, kann es am Morgen zu Glatteis durch überfrierende Nässe oder etwas Schneematsch kommen. Auch Neusch…",https://image.stern.de/32979644/t/zZ/v1/w1440/r1.7778/-/06--urnnewsmldpacom2009010122120699795394v2w800h600l1089t510r2812b1673jpeg---ac19db031c93fd64.jpg,2022-12-06T05:38:02Z,,"Ein anhaltender Tiefdruckeinfluss sorgt in Mecklenburg-Vorpommern am Dienstag für viele Wolken und Winterwetter. Wie der Deutsche Wetterdienst (DWD) mitteilte, kann es am Morgen zu Glatteis durch übe… [+1019 chars]",,de,'Kälte'
https://www.zeit.de/news/2022-12/06/kaelte-und-glaette-in-mecklenburg-vorpommern-erwartet,https://www.zeit.de/news/2022-12/06/kaelte-und-glaette-in-mecklenburg-vorpommern-erwartet,0,www.zeit.de,Wetter: Kälte und Glätte in Mecklenburg-Vorpommern erwartet,,,2022-12-06T05:38:02Z,https://web.archive.org/web/20221207045659/https://www.zeit.de/news/2022-12/06/kaelte-und-glaette-in-mecklenburg-vorpommern-erwartet,"When browsing with ads:
We collect personal data and also transmit it to third-party providers
 that help us improve and finance our digital content. Some of the information stored on your device, … [+732 chars]",,de,'Kälte'
https://orf.at/stories/3296617/,https://orf.at/stories/3296617/,0,orf.at,Mexiko: Schwangere aufgeschnitten und Ungeborenes gestohlen,,https://orf.at/mojo/1_4_1/storyserver//news/common/images/og-fallback-news.png,2022-12-06T05:52:25Z,https://web.archive.org/web/20221206071849/https://orf.at/stories/3296617/,"Im Osten Mexikos ist eine schwangere Frau gestorben, nachdem zwei Angreifer sie aufgeschnitten haben, um ihr ungeborenes Kind zu stehlen. Ein Mann und eine Frau sollen ihr Opfer aufgeschnitten haben,… [+670 chars]",,de,'Schwangere'
https://www.tagesspiegel.de/gesellschaft/femizid-in-mexiko-angreifer-schneiden-schwangere-auf-und-stehlen-ungeborenes-baby-8978455.html,https://www.tagesspiegel.de/gesellschaft/femizid-in-mexiko-angreifer-schneiden-schwangere-auf-und-stehlen-ungeborenes-baby-8978455.html,0,www.tagesspiegel.de,Femizid in Mexiko: Angreifer schneiden Schwangere auf und stehlen ungeborenes Baby,"Ãœber soziale Medien lockten die Angreifer eine schwangere Frau in Mexiko, um sie dann aufzuschneiden und das ungeborene Baby zu entfÃ¼hren. Der Vorwurf lautet Femizid.",https://www.tagesspiegel.de/images/imago0101392136hjpg/alternates/BASE_16_9_W1400/imago0101392136hjpg.jpeg,2022-12-06T06:23:02Z,https://web.archive.org/web/20221206082519/https://www.tagesspiegel.de/gesellschaft/femizid-in-mexiko-angreifer-schneiden-schwangere-auf-und-stehlen-ungeborenes-baby-8978455.html,"Im Osten Mexikos ist eine schwangere Frau gestorben, nachdem zwei Angreifer sie aufgeschnitten haben, um ihr ungeborenes Kind zu stehlen. Ein Mann und eine Frau sollen ihr Opfer aufgeschnitten haben,â€¦ [+1317 chars]",,de,'Schwangere'
https://www.handelsblatt.com/politik/deutschland/energieversorgungskrise-wie-die-industrie-die-preisbremsen-fuer-strom-und-gas-noch-aendern-will/28849486.html,https://www.handelsblatt.com/politik/deutschland/energieversorgungskrise-wie-die-industrie-die-preisbremsen-fuer-strom-und-gas-noch-aendern-will/28849486.html,0,www.handelsblatt.com,Energieversorgungskrise: Wie die Industrie die Preisbremsen für Strom und Gas noch ändern will,"Mit einem Brief an die Fraktionschefs der Ampelregierung und Union versucht die chemische Industrie, die Preisbremsen noch abzuändern. Die Förderhöchstgrenze solle abgeschafft werden.",https://www.handelsblatt.com/images/industriepark-hoechst/28849658/2-format2003.jpg,2022-12-06T06:54:18Z,https://web.archive.org/web/20221206082517/https://www.handelsblatt.com/politik/deutschland/energieversorgungskrise-wie-die-industrie-die-preisbremsen-fuer-strom-und-gas-noch-aendern-will/28849486.html,Berlin Mit den geplanten Preisbremsen für Strom und Gas soll die deutsche Industrie vor den schlimmsten Folgen der hohen Energiepreise bewahrt werden. Doch die Ende November vom Bundeskabinett beschl… [+3736 chars],,de,'Gas'
https://www.spiegel.de/wirtschaft/unternehmen/gaskrise-rwe-fordert-schadensersatz-von-gazprom-a-dc6fc820-7644-46e7-b86d-87e58243cb6c,https://www.spiegel.de/wirtschaft/unternehmen/gaskrise-rwe-fordert-schadensersatz-von-gazprom-a-dc6fc820-7644-46e7-b86d-87e58243cb6c,0,www.spiegel.de,Gaskrise: RWE fordert Schadensersatz von Gazprom,"Nach Uniper will nun auch RWE Geld von Gazprom. Der deutsche Versorger musste im Sommer teuer Gas nachkaufen, nachdem der russische Staatskonzern seine Lieferungen gedrosselt hatte.",https://cdn.prod.www.spiegel.de/images/16a34bca-88de-4fbf-907b-47fea4cde5a8_w1280_r1.77_fpx56.57_fpy44.99.jpg,2022-12-06T07:32:59Z,,"Maubach sagte, man sei es den Aktionären, den Mitarbeitern und den deutschen Steuerzahlern schuldig, den Rechtsweg zu beschreiten. Notfalls werde Uniper vor deutsche Gerichte ziehen.
Der ebenfalls s… [+193 chars]",,de,'Gas'
https://www.stern.de/sport/laufbekleidung-im-winter--das-sind-die-wichtigsten-kriterien-9558704.html,https://www.stern.de/sport/laufbekleidung-im-winter--das-sind-die-wichtigsten-kriterien-9558704.html,0,www.stern.de,Sport im Freien: Laufbekleidung für den Winter: Das sind die wichtigsten Eigenschaften,"Mit den sinkenden Temperaturen steigt die Unlust auf den obligatorischen Rundlauf im Freien. Dabei ist Joggen im Winter vor allem eins: gesund. Warum das so ist und wie Sie der Kälte mit der richtigen Laufbekleidung trotzen können, wird hier erläutert.",https://image.stern.de/9558706/t/Vm/v3/w1440/r1.7778/-/laufbekleidung-winter.jpg,2022-12-06T08:01:00Z,https://web.archive.org/web/20221206083103/https://www.stern.de/sport/laufbekleidung-im-winter--das-sind-die-wichtigsten-kriterien-9558704.html,"Laut einer aktuellen Statistik gingen im Jahr 2022 über sechs Millionen Menschen ab 14 Jahren häufig Joggen oder machten einen Wald- oder Geländelauf. Die Zahlen machen deutlich, wie groß das Interes… [+4863 chars]",,de,'Kälte'
https://www.spiegel.de/wirtschaft/soziales/lng-importe-aus-russland-steigen-auf-rekordhoch-a-0acf1b83-0b99-47ce-96a6-002503ffe8b6,https://www.spiegel.de/wirtschaft/soziales/lng-importe-aus-russland-steigen-auf-rekordhoch-a-0acf1b83-0b99-47ce-96a6-002503ffe8b6,0,www.spiegel.de,LNG-Importe aus Russland steigen auf Rekordhoch,Russland hat die Gaslieferungen nach Europa nur über die Pipelines gedrosselt. Per Flüssiggastanker dagegen sind die Exporte laut »Handelsblatt« stark gestiegen. Der Kreml verdient daran Milliarden.,https://cdn.prod.www.spiegel.de/images/182aed32-3f35-4506-a57f-0b17126c3e4e_w1280_r1.77_fpx52.66_fpy46.95.jpg,2022-12-06T09:14:27Z,https://web.archive.org/web/20221206095421/https://www.spiegel.de/wirtschaft/soziales/lng-importe-aus-russland-steigen-auf-rekordhoch-a-0acf1b83-0b99-47ce-96a6-002503ffe8b6,"Der Kreml verdient an den LNG-Lieferungen ziemlich gut. Von Januar bis November dürften fast 27 Milliarden Euro nach Moskau geflossen sein, heißt es in dem Bericht.
Insgesamt aber ist die Menge, die… [+352 chars]",,de,'Gas'
https://www.spiegel.de/panorama/gesellschaft/briefe-an-den-nikolaus-was-wuenschen-sich-die-kinder-in-diesem-jahr-herr-weddehage-a-22fa2252-4a09-45a1-9678-e15d443dd0d4,https://www.spiegel.de/panorama/gesellschaft/briefe-an-den-nikolaus-was-wuenschen-sich-die-kinder-in-diesem-jahr-herr-weddehage-a-22fa2252-4a09-45a1-9678-e15d443dd0d4,0,www.spiegel.de,"Briefe an den Nikolaus: Was wünschen sich die Kinder in diesem Jahr, Herr Weddehage?","Hubert Weddehage, 68, leitet das Nikolausbüro in Nikolausdorf im Landkreis Cloppenburg und findet: Die rund 6000 Briefe der Kinder aus aller Welt an ihn und seine Helferinnen und Helfer verraten viel über unsere Zeit.",https://cdn.prod.www.spiegel.de/images/9f741b24-b009-4c0f-b80a-82336042b96c_w1280_r1.77_fpx60_fpy50.jpg,2022-12-06T09:41:55Z,https://web.archive.org/web/20221206102458/https://www.spiegel.de/panorama/gesellschaft/briefe-an-den-nikolaus-was-wuenschen-sich-die-kinder-in-diesem-jahr-herr-weddehage-a-22fa2252-4a09-45a1-9678-e15d443dd0d4,"In diesem Jahr erwarten wir, dass der Krieg in der Ukraine in den Briefen eine bedeutende Rolle spielen wird. Ich habe selbst zwei Enkelkinder, 5 und 8 Jahre alt. Die bekommen auch schon mit, was in … [+616 chars]",,de,'Kinder'
https://www.spiegel.de/panorama/bildung/digitalversagen-schon-wieder-faellt-die-schule-aus-kommentar-a-db685942-5d03-4989-b863-d99ea700dbf2,https://www.spiegel.de/panorama/bildung/digitalversagen-schon-wieder-faellt-die-schule-aus-kommentar-a-db685942-5d03-4989-b863-d99ea700dbf2,0,www.spiegel.de,Digitalversagen: Schon wieder fällt die Schule aus - Kommentar,"Der Staat hat Millionen ausgegeben, um die Schulen zu digitalisieren. Trotzdem klappt es nicht mit dem Online-Unterricht. Dabei bräuchten wir ihn gerade jetzt, da Tausende Kinder zu Hause bleiben müssen.",https://cdn.prod.www.spiegel.de/images/37f67e33-e5e1-4bce-aba4-413c6cab3b82_w1280_r1.77_fpx66.44_fpy50.jpg,2022-12-06T09:50:34Z,https://web.archive.org/web/20221206095839/https://www.spiegel.de/panorama/bildung/digitalversagen-schon-wieder-faellt-die-schule-aus-kommentar-a-db685942-5d03-4989-b863-d99ea700dbf2,"Mehr Perspektiven, mehr verstehen.
Freier Zugang zu allen Artikeln, Videos, Audioinhalten und Podcasts
<ul><li>
Alle Artikel auf SPIEGEL.de frei zugänglich
</li><li>
DER SPIEGEL als E-Paper und … [+743 chars]",,de,'Kinder'
https://www.tagesspiegel.de/politik/schlimmer-als-corona-sportvereine-kampfen-mit-hohen-energiepreisen-8963320.html,https://www.tagesspiegel.de/politik/schlimmer-als-corona-sportvereine-kampfen-mit-hohen-energiepreisen-8963320.html,0,www.tagesspiegel.de,Schlimmer als Corona?: Sportvereine kämpfen mit hohen Energiepreisen,Für manche Klubs sind die Gas- und Stromkosten existenzbedrohend. Der „Bewegungsgipfel“ der Bundesregierung soll sich dem Thema annehmen.,https://www.tagesspiegel.de/images/hallenbader-offnen-nach-und-nach2/alternates/BASE_16_9_W1400/hallenbaeder-oeffnen-nach-und-nach.jpeg,2022-12-06T11:08:23Z,https://web.archive.org/web/20221206173927/https://www.tagesspiegel.de/politik/schlimmer-als-corona-sportvereine-kampfen-mit-hohen-energiepreisen-8963320.html,"Die Energiekrise könnte Deutschlands Breitensport härter treffen als die Corona-Pandemie. Was die hohen Gas- und Strompreise bedeuten, hat man im bayerischen Mittenwald bereits zu spüren bekommen - d… [+5570 chars]",,de,'Gas'
https://www.dw.com/de/erneuerbare-energien-ausbau-schneller-als-geplant/a-64000438,https://www.dw.com/de/erneuerbare-energien-ausbau-schneller-als-geplant/a-64000438,0,www.dw.com,Erneuerbare Energien: Ausbau schneller als geplant,"Drohende Gasknappheit und horrende Preise nähren die Hoffnung, dass die Abhängigkeit von fossilen Brennstoffen schneller endet. Aber ist sie berechtigt? Und ginge es vielleicht noch schneller? Die weltweite Energiekrise führt nach einer neuen Studie der Inter…",https://static.dw.com/image/57913902_6.jpg,2022-12-06T12:59:00Z,,Die weltweite Energiekrise führt nach einer neuen Studie der Internationalen Energieagentur IEA zu einer drastischen Beschleunigung des Ausbaus erneuerbarer Energien. Die Gesamtkapazität wird sich de… [+2945 chars],,de,'Gas'
https://taz.de/Bericht-der-Energieagentur-IEA/!5901738/,https://taz.de/Bericht-der-Energieagentur-IEA/!5901738/,0,taz.de,Bericht der Energieagentur IEA: Stromkrise bringt Erneuerbare voran,Der Ausbau von erneuerbaren Energien geht schneller voran als gedacht. In fünf Jahren könnten sie Kohle als größte Stromerzeugungsquelle ablösen.,https://taz.de/picture/5960822/948/31181399-1.jpeg,2022-12-06T14:39:00Z,,"Der Ausbau von erneuerbaren Energien geht schneller voran als gedacht. In fünf Jahren könnten sie Kohle als größte Stromerzeugungsquelle ablösen.
Es geht voran: Solaranlagen im südindischen Bundesst… [+2354 chars]",,de,'Kohle'
