index,url,valid,domain,title,description,image,published,archive,content,quote,language,keyword
https://www.n-tv.de/politik/CSU-Generalsekretaer-Bayern-will-wieder-Windraeder-bauen-article25753563.html,https://www.n-tv.de/politik/CSU-Generalsekretaer-Bayern-will-wieder-Windraeder-bauen-article25753563.html,0,www.n-tv.de,"Neue Bundesregierung bei Lanz: ""Energie ist das Megathema für unsere Zukunft""","Die neue Bundesregierung kündigt einen Politikwechsel an. Dieser soll auch Investitionen in die Infrastruktur und in erneuerbare Energien betreffen. Dabei will die CSU von Atomkraft nichts mehr wissen, dafür interessiert sich Generalsekretär Huber bei Markus …",https://www.n-tv.de/img/incoming/crop25753640/4051321210-cImg_16_9-w1200/503101046.jpg,2025-05-08T05:56:05Z,https://web.archive.org/web/20250508071236/https://www.n-tv.de/politik/CSU-Generalsekretaer-Bayern-will-wieder-Windraeder-bauen-article25753563.html,Die neue Bundesregierung kündigt einen Politikwechsel an. Dieser soll auch Investitionen in die Infrastruktur und in erneuerbare Energien betreffen. Dabei will die CSU von Atomkraft nichts mehr wisse… [+3873 chars],,de,'Atomkraft'
https://www.diepresse.com/19660591/gruene-kritisieren-familienfeindliche-sparplaene-der-regierung,https://www.diepresse.com/19660591/gruene-kritisieren-familienfeindliche-sparplaene-der-regierung,0,www.diepresse.com,Grüne kritisieren „familienfeindliche“ Sparpläne der Regierung,"Jene Menschen, die viele Kinder und wenig Einkommen hätten, würden am meisten belastet, richtet der grüne Klubobmann Werner Kogler ÖVP, SPÖ und Neos aus. Zudem agiere die Koalition „wirtschaftsfeindlich und konjunkturschädlich“.",https://img.diepresse.com/public/incoming/2ilnd-imago-images-0807636450/alternates/DPR_SOCIAL_NACHRICHTEN/imago%20images%200807636450,2025-05-08T08:40:47Z,,"Jene Menschen, die viele Kinder und wenig Einkommen hätten, würden am meisten belastet, richtet der grüne Klubobmann Werner Kogler ÖVP, SPÖ und Neos aus. Zudem agiere die Koalition wirtschaftsfeindli… [+2754 chars]",,de,'Sanierung'
https://www.zeit.de/news/2025-05/08/kinder-bewerfen-auto-mit-hundekot,https://www.zeit.de/news/2025-05/08/kinder-bewerfen-auto-mit-hundekot,0,www.zeit.de,Straßenverkehr: Kinder bewerfen Auto mit Hundekot,Hier finden Sie Informationen zu dem Thema „Straßenverkehr“. Lesen Sie jetzt „Kinder bewerfen Auto mit Hundekot“.,https://img.zeit.de/news/2025-05/08/kinder-bewerfen-auto-mit-hundekot-image-group/wide__1300x731,2025-05-08T10:25:32Z,,"Auf der Autobahn 6 im baden-württembergischen Hohenlohekreis hat es Hundehaufen geregnet. Ein 46 Jahre alter Autofahrer fuhr bei Bretzfeld in Richtung Mannheim, als plötzlich ein mit Hundekot gefüllt… [+689 chars]",,de,'Kinder'
https://www.faz.net/aktuell/politik/inland/steinmeier-im-bundestag-wir-alle-sind-kinder-des-8-mai-110463355.html,https://www.faz.net/aktuell/politik/inland/steinmeier-im-bundestag-wir-alle-sind-kinder-des-8-mai-110463355.html,0,www.faz.net,Steinmeier im Bundestag: „Wir alle sind Kinder des 8. Mai“,Der Bundespräsident erinnert an das Geschenk der Freiheit und spricht vom „Wunder der Versöhnung“ zwischen Deutschland und Israel. Russische Propaganda verurteilt er scharf.,https://media0.faz.net/ppmedia/aktuell/4187257996/1.10463628/facebook_teaser/bundespraesident-steinmeier-am.jpg,2025-05-08T11:32:09Z,http://archive.md/20250508114500/https://www.faz.net/aktuell/politik/inland/steinmeier-im-bundestag-wir-alle-sind-kinder-des-8-mai-110463355.html,80 Jahre nach der Befreiung Deutschlands am 8. Mai 1945 hat Bundespräsident Frank-Walter Steinmeier bei einer Gedenkstunde im Bundestag den alliierten Soldaten und der Widerstandsbewegung gegen den N… [+4993 chars],,de,'Kinder'
https://www.voltairenet.org/article222227.html,https://www.voltairenet.org/article222227.html,0,www.voltairenet.org,"Die wahre Instabilität der Elektrizitätsnetze als Ursache des Mega-Blackouts: Die ""Grüne Agenda"" auf der Anklagebank , von Alfredo Jalife-Rahme","Während europäische Journalisten nach dem Ursprung des Stromausfalls in Spanien und Portugal suchen, sagen Wissenschaftler, dass es sich um ein technisches Problem handelt, das die Stromleitungsnetze durch momentane Überproduktion systematisch beeinträchtigt.…",https://www.voltairenet.org/IMG/logo/222223arton.jpg?1746701496,2025-05-08T12:30:10Z,https://web.archive.org/web/20250508211139/https://www.voltairenet.org/article222227.html,Ein 10 bis 24 Stunden dauernder allgemeiner Stromausfall - je nach betroffenem Ort - unterbrach die Aktivitäten auf der Iberischen Halbinsel (und im Süden Frankreichs) und traumatisierte ihre gebrech… [+4311 chars],,de,'Blackout'
https://www.zeit.de/news/2025-05/08/17-kinder-bei-brand-eines-zirkuszelts-verletzt,https://www.zeit.de/news/2025-05/08/17-kinder-bei-brand-eines-zirkuszelts-verletzt,0,www.zeit.de,Notfall: 17 Kinder bei Brand eines Zirkuszelts verletzt,Hier finden Sie Informationen zu dem Thema „Notfall“. Lesen Sie jetzt „17 Kinder bei Brand eines Zirkuszelts verletzt“.,https://img.zeit.de/news/2025-05/08/17-kinder-bei-brand-eines-zirkuszelts-verletzt-image-group/wide__1300x731,2025-05-08T12:53:41Z,https://web.archive.org/web/20250509212433/https://www.zeit.de/news/2025-05/08/17-kinder-bei-brand-eines-zirkuszelts-verletzt,"Beim Brand eines Zirkuszeltes in Aldenhoven im Kreis Düren sind 17 Kinder und drei Erwachsene verletzt worden. Ein Zirkusmitarbeiter erlitt nach Polizeiangaben schwere Verletzungen, zwei Achtjährige … [+466 chars]",,de,'Kinder'
https://www.zeit.de/news/2025-05/08/mehrere-kinder-nach-schulbusunfall-noch-in-der-klinik,https://www.zeit.de/news/2025-05/08/mehrere-kinder-nach-schulbusunfall-noch-in-der-klinik,0,www.zeit.de,Unfall nach Bremsmanöver: Mehrere Kinder nach Schulbusunfall noch in der Klinik,Hier finden Sie Informationen zu dem Thema „Unfall nach Bremsmanöver“. Lesen Sie jetzt „Mehrere Kinder nach Schulbusunfall noch in der Klinik“.,https://img.zeit.de/news/2025-05/08/mehrere-kinder-nach-schulbusunfall-noch-in-der-klinik-image-group/wide__1300x731,2025-05-08T12:59:16Z,https://web.archive.org/web/20250511112551/https://www.zeit.de/news/2025-05/08/mehrere-kinder-nach-schulbusunfall-noch-in-der-klinik,Einen Tag nach einem Schulbusunfall nahe Schwerin sind mehrere Kinder in einem Krankenhaus noch in ärztlicher Behandlung. Laut Polizei soll es sich um sieben Kinder handeln. Durch den Vorfall seien n… [+1125 chars],,de,'Kinder'
https://www.faz.net/aktuell/gesellschaft/kriminalitaet/steak-house-erbin-block-beschuldigt-verstorbene-mutter-der-kindesentfuehrung-110463762.html,https://www.faz.net/aktuell/gesellschaft/kriminalitaet/steak-house-erbin-block-beschuldigt-verstorbene-mutter-der-kindesentfuehrung-110463762.html,0,www.faz.net,Bericht: Steak-House-Erbin Block beschuldigt verstorbene Mutter der Kindesentführung,"Die Steak-House-Erbin Christina Block beschuldigt einem Bericht zufolge ihre verstorbene Mutter, die Entführung zwei ihrer Kinder in Auftrag gegeben zu haben. Auch ihr Anwalt äußert sich. Ermittler sehen darin eine Schutzbehauptung.",https://media1.faz.net/ppmedia/aktuell/gesellschaft/582037373/1.10463767/facebook_teaser/steak-house-erbin-christina.jpg,2025-05-08T13:13:32Z,https://web.archive.org/web/20250509161005/https://www.faz.net/aktuell/gesellschaft/kriminalitaet/steak-house-erbin-block-beschuldigt-verstorbene-mutter-der-kindesentfuehrung-110463762.html,"Die Hamburger Steak-House-Erbin Christina Block beschuldigt offenbar ihre verstorbene Mutter, für die Entführung ihrer Kinder verantwortlich zu sein. Das berichtet die Zeitschrift Spiegel unter Beruf… [+2267 chars]",,de,'Kinder'
https://www.golem.de/sonstiges/zustimmung/auswahl.html?from=https://www.golem.de/news/elementl-power-google-plant-drei-kernkraftwerke-fuer-ki-rechenzentren-2505-196034.html&referer=https://t.co/2865c896e6,https://www.golem.de/sonstiges/zustimmung/auswahl.html?from=https://www.golem.de/news/elementl-power-google-plant-drei-kernkraftwerke-fuer-ki-rechenzentren-2505-196034.html&referer=https://t.co/2865c896e6,0,www.golem.de,Elementl Power: Google plant drei Kernkraftwerke für KI-Rechenzentren,"KI ist enorm energiehungrig. Um die Kapazität seiner Rechenzentren steigern zu können, will Google noch stärker auf Kernenergie setzen. (Atomkraft, Google)",,2025-05-08T13:14:01Z,,"Besuchen Sie Golem.de wie gewohnt mit Werbung und Tracking,
 indem Sie der Nutzung aller Cookies zustimmen.
 Details zum Tracking finden Sie im Privacy Center.
Skript wurde nicht geladen. Informat… [+607 chars]",,de,'Atomkraft'
https://www.n-tv.de/leute/Jack-Whites-Ex-Frauen-liegen-im-Clinch-article25754892.html,https://www.n-tv.de/leute/Jack-Whites-Ex-Frauen-liegen-im-Clinch-article25754892.html,0,www.n-tv.de,"Nach Sturz, Koma, Schlaganfall: Jack Whites (Ex-)Frauen liegen im Clinch","Während Jack White nach mehreren gesundheitlichen Rückschlägen noch immer in der Klinik liegt, eskaliert ein Streit zwischen seiner Ex-Frau Marie-Louise Gassen und seiner aktuellen Ehefrau Rafaella Nußbaum. Dabei geht es um angebliche Kontaktverbote und wie s…",https://www.n-tv.de/img/incoming/crop25754918/4521329428-cImg_16_9-w1200/imago802093057.jpg,2025-05-08T15:07:20Z,https://web.archive.org/web/20250508214614/https://www.n-tv.de/leute/Jack-Whites-Ex-Frauen-liegen-im-Clinch-article25754892.html,"Während Jack White nach mehreren gesundheitlichen Rückschlägen noch immer in der Klinik liegt, eskaliert ein Streit zwischen seiner Ex-Frau Marie-Louise Gassen und seiner aktuellen Ehefrau Rafaella N… [+2441 chars]",,de,'Kohle'
https://www.faz.net/aktuell/wirtschaft/unternehmen/ist-der-techem-deal-noch-zu-retten-110464362.html,https://www.faz.net/aktuell/wirtschaft/unternehmen/ist-der-techem-deal-noch-zu-retten-110464362.html,0,www.faz.net,Ist der Techem-Deal noch zu retten?,Mieter und Wohnungseigner kennen Techem: Das Unternehmen berechnet Heizkosten in Mehrparteienhäusern. Der geplante milliardenschwere Verkauf an den US-Investor TPG steht nun in Zweifel.,https://media1.faz.net/ppmedia/aktuell/wirtschaft/3061880169/1.10020049/facebook_teaser/die-1952-gegruendete-techem.jpg,2025-05-08T15:16:28Z,http://archive.md/20250508153357/https://www.faz.net/aktuell/wirtschaft/unternehmen/ist-der-techem-deal-noch-zu-retten-110464362.html,Nach dem Rückschlag im milliardenschweren Übernahmeverfahren um den Heizkostenableser Techem denken die designierten Käufer über einen Plan B nach. Die beteiligten Finanzinvestoren erwögen Dealkonstr… [+4279 chars],,de,'Heizkosten'
https://www.designmadeingermany.de/2013/223983/,https://www.designmadeingermany.de/2013/223983/,0,www.designmadeingermany.de,#1x13584,"Das Slanted Magazine #45—Sex erforscht Sexualität, Geschlecht und Körperpolitik durch eine kuratierte Auswahl künstlerischer Publikationen und kritischer Essays. In Zusammenarbeit mit dem Münchn",https://www.designmadeingermany.de/2013/wp-content/uploads/formidable/9/Slanted-45-Sex-02-1800x1200.jpg,2025-05-08T16:03:09Z,,"Das Slanted Magazine #45Sex erforscht Sexualität, Geschlecht und Körperpolitik durch eine kuratierte Auswahl künstlerischer Publikationen und kritischer Essays. In Zusammenarbeit mit dem Münchner Arc… [+1578 chars]",,de,'Geschlecht'
https://www.zeit.de/news/2025-05/09/minister-pocht-auf-geld-fuer-drittes-beitragsfreies-kita-jahr,https://www.zeit.de/news/2025-05/09/minister-pocht-auf-geld-fuer-drittes-beitragsfreies-kita-jahr,0,www.zeit.de,Kinder und Familien: Minister pocht auf Geld für drittes beitragsfreies Kita-Jahr,Hier finden Sie Informationen zu dem Thema „Kinder und Familien“. Lesen Sie jetzt „Minister pocht auf Geld für drittes beitragsfreies Kita-Jahr“.,https://img.zeit.de/news/2025-05/09/minister-pocht-auf-geld-fuer-drittes-beitragsfreies-kita-jahr-image-group/wide__1300x731,2025-05-09T02:00:44Z,,"Für die Aufstellung des Doppelhaushaltes für die Jahre 2026 und 2027 fordert Thüringens Bildungsminister Christian Tischner (CDU) von den Abgeordneten des Landtages, dass sie die beschlossene Einführ… [+1419 chars]",,de,'Kinder'
https://www.zeit.de/news/2025-05/09/gates-millionen-kinder-sterben-wegen-musks-etatkuerzungen,https://www.zeit.de/news/2025-05/09/gates-millionen-kinder-sterben-wegen-musks-etatkuerzungen,0,www.zeit.de,Kritik an Tesla-Chef: Gates: Millionen Kinder sterben wegen Musks Etatkürzungen,Hier finden Sie Informationen zu dem Thema „Kritik an Tesla-Chef“. Lesen Sie jetzt „Gates: Millionen Kinder sterben wegen Musks Etatkürzungen“.,https://img.zeit.de/news/2025-05/09/gates-millionen-kinder-sterben-wegen-musks-etatkuerzungen-image-group/wide__1300x731,2025-05-09T02:36:10Z,https://web.archive.org/web/20250510035618/https://www.zeit.de/news/2025-05/09/gates-millionen-kinder-sterben-wegen-musks-etatkuerzungen,Nach der Meinung von Microsoft-Mitgründer und Großspender Bill Gates ist Tech-Milliardär Elon Musk mit der drastischen Kürzung von US-Hilfsprogrammen für den Tod von Millionen Kindern mitverantwortli… [+2033 chars],,de,'Kinder'
https://www.stern.de/panorama/niedersachsen-und-bremen--abenteuer-fuer-einen-guten-zweck--tag-und-nacht-auf-der-weser-35707670.html,https://www.stern.de/panorama/niedersachsen-und-bremen--abenteuer-fuer-einen-guten-zweck--tag-und-nacht-auf-der-weser-35707670.html,0,www.stern.de,Niedersachsen und Bremen: Abenteuer für einen guten Zweck: Tag und Nacht auf der Weser,"431 Kilometer Tag und Nacht auf einem SUP - vier Männer wollen trotz Wind, Kälte und Schlafmangel weiterpaddeln. Sie möchten ein Abenteuer und dabei etwas Gutes tun.",https://image.stern.de/35707672/t/Tj/v1/w1440/r1.7778/-/09--ydomhklu2cv12axs2048jpeg---b997da7f727f02e2.jpg,2025-05-09T03:00:50Z,https://web.archive.org/web/20250509060959/https://www.stern.de/panorama/niedersachsen-und-bremen--abenteuer-fuer-einen-guten-zweck--tag-und-nacht-auf-der-weser-35707670.html,"Kopiere den aktuellen Link
Zur Merkliste hinzufügen
431 Kilometer Tag und Nacht auf einem SUP - vier Männer wollen trotz Wind, Kälte und Schlafmangel weiterpaddeln. Sie möchten ein Abenteuer und da… [+2142 chars]",,de,'Kälte'
https://www.tagesspiegel.de/gesellschaft/panorama/niedersachsen-und-bremen-abenteuer-fur-einen-guten-zweck-tag-und-nacht-auf-der-weser-13662517.html,https://www.tagesspiegel.de/gesellschaft/panorama/niedersachsen-und-bremen-abenteuer-fur-einen-guten-zweck-tag-und-nacht-auf-der-weser-13662517.html,0,www.tagesspiegel.de,Niedersachsen und Bremen: Abenteuer für einen guten Zweck: Tag und Nacht auf der Weser,"431 Kilometer Tag und Nacht auf einem SUP - vier Männer wollen trotz Wind, Kälte und Schlafmangel weiterpaddeln. Sie möchten ein Abenteuer und dabei etwas Gutes tun.",https://www.tagesspiegel.de/images/13662514/alternates/BASE_16_9_W1400/1746759761000/stand-up-paddler-wollen-weser-auf-rund-430-km-nonstop-befahren.jpeg,2025-05-09T03:02:42Z,https://web.archive.org/web/20250511001001/https://www.tagesspiegel.de/gesellschaft/panorama/niedersachsen-und-bremen-abenteuer-fur-einen-guten-zweck-tag-und-nacht-auf-der-weser-13662517.html,Auf einem mehr als fünf Meter langen Board wollen vier Männer auf der Weser von Hann. Münden im Landkreis Göttingen bis nach Bremerhaven paddeln. Die Strecke von 431 Kilometern will das Team mit dem … [+2676 chars],,de,'Kälte'
https://www.tagesspiegel.de/wirtschaft/arbeit-online-konferenzen-bedeuten-fur-viele-noch-immer-stress-13662529.html,https://www.tagesspiegel.de/wirtschaft/arbeit-online-konferenzen-bedeuten-fur-viele-noch-immer-stress-13662529.html,0,www.tagesspiegel.de,Arbeit: Online-Konferenzen bedeuten für viele noch immer Stress,Oft geht es dabei um technische Sorgen. Auch Geschlecht und Alter spielen eine Rolle - teilweise entgegen gängigen Klischees.,https://www.tagesspiegel.de/images/13662523/alternates/BASE_16_9_W1400/1746759766000/video-konferenz.jpeg,2025-05-09T03:02:46Z,https://web.archive.org/web/20250509092224/https://www.tagesspiegel.de/wirtschaft/arbeit-online-konferenzen-bedeuten-fur-viele-noch-immer-stress-13662529.html,"Auch fünf Jahre nachdem die Corona-Pandemie Videokonferenzen zum Durchbruch verholfen hat, bedeuten sie für viele Menschen Stress. Wie stark, das kommt auch darauf an, wer mit wem spricht, wie eine U… [+3043 chars]",,de,'Geschlecht'
https://www.n-tv.de/politik/Neuer-Digitalminister-ist-jetzt-CDU-Mitglied-article25756371.html,https://www.n-tv.de/politik/Neuer-Digitalminister-ist-jetzt-CDU-Mitglied-article25756371.html,0,www.n-tv.de,"""Schon längst politische Heimat"": Neuer Digitalminister ist jetzt CDU-Mitglied","Passend zu Hendrik Wüsts Motto ""Von der Kohle zur KI"" ist Karsten Wildberger nun Teil der nordrhein-westfälischen CDU. In dem Bundesland fühlt sich der neue Bundesdigitalminister nicht nur politisch zu Hause.",https://www.n-tv.de/img/incoming/crop25756420/4751322471-cImg_16_9-w1200/add21dd708f8ae0e7f0c9864cd101a46.jpg,2025-05-09T06:42:07Z,https://web.archive.org/web/20250509073603/https://www.n-tv.de/politik/Neuer-Digitalminister-ist-jetzt-CDU-Mitglied-article25756371.html,"Passend zu Hendrik Wüsts Motto ""Von der Kohle zur KI"" ist Karsten Wildberger nun Teil der nordrhein-westfälischen CDU. In dem Bundesland fühlt sich der neue Bundesdigitalminister nicht nur politisch … [+1609 chars]",,de,'Kohle'
https://www.zeit.de/sport/2025-05/frauenliegestuetze-sport-uebung-maenner-frauen,https://www.zeit.de/sport/2025-05/frauenliegestuetze-sport-uebung-maenner-frauen,0,www.zeit.de,Frauenliegestütze: Der Lügestütz,Der sogenannte Frauenliegestütz auf Knien ist ein Missverständnis. Einen richtigen Liegestütz kann jeder lernen. Dabei kommt's nämlich nur sehr wenig aufs Geschlecht an.,https://img.zeit.de/sport/2025-05/frauenliegestuetze-sport-uebung-2/wide__1300x731,2025-05-09T06:44:45Z,http://archive.md/20250509065115/https://www.zeit.de/sport/2025-05/frauenliegestuetze-sport-uebung-maenner-frauen,"Am Anfang war der Liegestütz. Das jedenfalls legt der vermutlich älteste Oberarmknochen der Welt nahe. Er ist geschätzte 370 Millionen Jahre alt, wurde in Pennsylvania gefunden und von seinem Besitze… [+513 chars]",,de,'Geschlecht'
https://www.tagesspiegel.de/internationales/signal-aus-nancy-frankreich-und-polen-rucken-enger-zusammen-13653982.html,https://www.tagesspiegel.de/internationales/signal-aus-nancy-frankreich-und-polen-rucken-enger-zusammen-13653982.html,0,www.tagesspiegel.de,Signal aus Nancy: Frankreich und Polen rücken enger zusammen,"Verteidigung, Atomkraft, Bildung: Während es bei Merz’Antrittsbesuch in Warschau auch Misstöne gab, besiegeln Polens Premier Tusk und Präsident Macron heute einen Neustart der Beziehungen.",https://www.tagesspiegel.de/images/13655968/alternates/BASE_16_9_W1400/1746637829000/french-president-macron-visits-warsaw.jpeg,2025-05-09T06:46:56Z,http://archive.md/20250509071623/https://www.tagesspiegel.de/internationales/signal-aus-nancy-frankreich-und-polen-rucken-enger-zusammen-13653982.html,"Verteidigung, Atomkraft, Bildung: Während es bei MerzAntrittsbesuch in Warschau auch Misstöne gab, besiegeln Polens Premier Tusk und Präsident Macron heute einen Neustart der Beziehungen. 
Heute, 08… [+6 chars]",,de,'Atomkraft'
https://www.faz.net/aktuell/wirtschaft/blackout-in-spanien-frankreich-wird-mitverantwortlich-gemacht-110464386.html,https://www.faz.net/aktuell/wirtschaft/blackout-in-spanien-frankreich-wird-mitverantwortlich-gemacht-110464386.html,0,www.faz.net,Blockierter Netzausbau: Ist Frankreich mitverantwortlich für den Blackout?,Der schlechte Anschluss der Iberischen Halbinsel an Frankreich ist schon seit Jahren eine Achillesferse im europäischen Stromnetz. In Spanien gibt es Unmut über die Pariser Blockade beim Leitungsbau.,https://media1.faz.net/ppmedia/aktuell/gesellschaft/672021798/1.10464491/facebook_teaser/wegen-des-stromausfalls-in-der.jpg,2025-05-09T07:14:35Z,http://archive.md/20250509073440/http://www.faz.net/aktuell/wirtschaft/blackout-in-spanien-frankreich-wird-mitverantwortlich-gemacht-110464386.html,Ist Frankreich mitverantwortlich für den iberischen Blackout? Nach dem stundenlangen Stromausfall in Spanien und Portugal richten sich die Schuldzuweisungen auch an den Nachbarn auf der anderen Pyren… [+7003 chars],,de,'Blackout'
https://www.zeit.de/gesellschaft/2025-05/christina-block-sorgerecht-entzug-anklage,https://www.zeit.de/gesellschaft/2025-05/christina-block-sorgerecht-entzug-anklage,0,www.zeit.de,Christina Block: Nun soll es Omi gewesen sein,Laut Anklageschrift steht fest: Steakhaus-Erbin Christina Block ließ ihre eigenen Kinder entführen. Die bestreitet das – und beschuldigt die verstorbene Großmutter.,https://img.zeit.de/gesellschaft/2025-05/christina-block-sorgerecht-entzug-anklage-bild/wide__1300x731,2025-05-09T08:28:49Z,http://archive.md/20250509083204/https://www.zeit.de/gesellschaft/2025-05/christina-block-sorgerecht-entzug-anklage,"In
der Not fallen den Menschen die erstaunlichsten Sachen ein. Solche sind auch
nachzulesen in der an Räubergeschichten wahrlich nicht armen Anklageschrift
gegen Christina Block. Die Staatsanwalts… [+551 chars]",,de,'Kinder'
https://www.zeit.de/news/2025-05/09/reiche-kuendigt-neue-gaskraftwerke-fuer-deutschland-an,https://www.zeit.de/news/2025-05/09/reiche-kuendigt-neue-gaskraftwerke-fuer-deutschland-an,0,www.zeit.de,Bundeswirtschaftsministerin: Reiche kündigt neue Gaskraftwerke für Deutschland an,Hier finden Sie Informationen zu dem Thema „Bundeswirtschaftsministerin“. Lesen Sie jetzt „Reiche kündigt neue Gaskraftwerke für Deutschland an“.,https://img.zeit.de/news/2025-05/09/reiche-kuendigt-neue-gaskraftwerke-fuer-deutschland-an-image-group/wide__1300x731,2025-05-09T08:47:39Z,,"Bundeswirtschaftsministerin Katherina Reiche fordert den schnellen Zubau von neuen Gaskraftwerken in Deutschland. «Wir brauchen flexible Gaskraftwerke, die dann Strom liefern, wenn der Wind nicht weh… [+2746 chars]",,de,'Gas'
https://www.stern.de/wirtschaft/news/bundeswirtschaftsministerin--reiche-kuendigt-neue-gaskraftwerke-fuer-deutschland-an-35708480.html,https://www.stern.de/wirtschaft/news/bundeswirtschaftsministerin--reiche-kuendigt-neue-gaskraftwerke-fuer-deutschland-an-35708480.html,0,www.stern.de,Bundeswirtschaftsministerin: Reiche kündigt neue Gaskraftwerke für Deutschland an,Kurz nach ihrem Amtsantritt als Bundeswirtschaftsministerin macht Katharina Reiche eine erste öffentliche Bestandsaufnahme zur Lage im Land. Dabei nennt sie Prioritäten und was nicht mehr geht.,https://image.stern.de/35708482/t/AK/v1/w1440/r1.7778/-/09--fqanxhg4u7v21axs2048jpeg---e01c37d5c1f05a78.jpg,2025-05-09T08:47:39Z,https://web.archive.org/web/20250509104249/https://www.stern.de/wirtschaft/news/bundeswirtschaftsministerin--reiche-kuendigt-neue-gaskraftwerke-fuer-deutschland-an-35708480.html,"Kopiere den aktuellen Link
Zur Merkliste hinzufügen
Kurz nach ihrem Amtsantritt als Bundeswirtschaftsministerin macht Katharina Reiche eine erste öffentliche Bestandsaufnahme zur Lage im Land. Dabe… [+2955 chars]",,de,'Kohle'
https://www.tagesspiegel.de/wirtschaft/bundeswirtschaftsministerin-reiche-kundigt-neue-gaskraftwerke-fur-deutschland-an-13663594.html,https://www.tagesspiegel.de/wirtschaft/bundeswirtschaftsministerin-reiche-kundigt-neue-gaskraftwerke-fur-deutschland-an-13663594.html,0,www.tagesspiegel.de,Bundeswirtschaftsministerin: Reiche kündigt neue Gaskraftwerke für Deutschland an,Kurz nach ihrem Amtsantritt als Bundeswirtschaftsministerin macht Katharina Reiche eine erste öffentliche Bestandsaufnahme zur Lage im Land. Dabei nennt sie Prioritäten und was nicht mehr geht.,https://www.tagesspiegel.de/images/13663591/alternates/BASE_16_9_W1400/1746780545000/katharina-reiche.jpeg,2025-05-09T08:49:05Z,https://web.archive.org/web/20250510044231/https://www.tagesspiegel.de/wirtschaft/bundeswirtschaftsministerin-reiche-kundigt-neue-gaskraftwerke-fur-deutschland-an-13663594.html,"Bundeswirtschaftsministerin Katharina Reiche fordert den schnellen Zubau von neuen Gaskraftwerken in Deutschland. Wir brauchen flexible Gaskraftwerke, die dann Strom liefern, wenn der Wind nicht weht… [+3452 chars]",,de,'Gas'
https://www.faz.net/aktuell/wirtschaft/klima-nachhaltigkeit/reiche-will-schnell-neue-gaskraftwerke-110466034.html,https://www.faz.net/aktuell/wirtschaft/klima-nachhaltigkeit/reiche-will-schnell-neue-gaskraftwerke-110466034.html,0,www.faz.net,Reiche will schnell neue Gaskraftwerke,Bei ihrem ersten größeren Auftritt betont die neue Bundeswirtschaftsministerin die Bedeutung von Gas. Sie wolle sich „ehrlich machen“ zum Stand der Energiewende.,https://media0.faz.net/ppmedia/aktuell/politik/3178300444/1.10466050/facebook_teaser/wirtschaftsministerin.jpg,2025-05-09T09:47:51Z,,"Bundeswirtschaftsministerin Katherina Reiche fordert den schnellen Zubau von neuen Gaskraftwerken in Deutschland. Wir brauchen flexible Gaskraftwerke, die dann Strom liefern, wenn der Wind nicht weht… [+2564 chars]",,de,'Gas'
https://www.bild.de/sport/fussball/fc-bayern-max-eberl-spricht-kohle-machtwort-im-vertrags-poker-mit-leroy-sane-681dbe100592585716091e12,https://www.bild.de/sport/fussball/fc-bayern-max-eberl-spricht-kohle-machtwort-im-vertrags-poker-mit-leroy-sane-681dbe100592585716091e12,0,www.bild.de,„Sonst macht das Mode“ - Eberls Kohle-Machtwort an Sané!,Bayern-Sportvorstand Max Eberl hat im Vertrags-Poker um die Zukunft von Flügel-Star Leroy Sané ein Kohle-Machtwort gesprochen.,"https://images.bild.de/681dbe100592585716091e12/c21dada270cfc77c6acecefbe17edd6e,b0de4a77?w=1280",2025-05-09T10:06:54Z,https://web.archive.org/web/20250509111829/https://www.bild.de/sport/fussball/fc-bayern-max-eberl-spricht-kohle-machtwort-im-vertrags-poker-mit-leroy-sane-681dbe100592585716091e12,"Klartext von Max Eberl (51)!
Der Sportvorstand des FC Bayern hat sich am Freitagvormittag zum plötzlich stockenden Zukunfts-Poker mit Leroy Sané (29) geäußert.
Er sagte auf der Pressekonferenz: Wen… [+2977 chars]",,de,'Kohle'
