index,url,valid,domain,title,description,image,published,archive,content,quote,language,keyword
https://taz.de/Hohe-Kosten-fuer-Gas-und-Strom/!5965703/,https://taz.de/Hohe-Kosten-fuer-Gas-und-Strom/!5965703/,0,taz.de,Hohe Kosten für Gas und Strom: Energiearmut hat zugenommen,Für Haushalte mit wenig Geld sind hohe Strom- und Gaspreise ein großes Problem. Das zeigt ein Bericht des Sachverständigenrats für Verbraucherfragen.,https://taz.de/picture/6575101/948/33793522-1.jpeg,2023-10-09T15:46:00Z,,"Für Haushalte mit wenig Geld sind hohe Strom- und Gaspreise ein großes Problem. Das zeigt ein Bericht des Sachverständigenrats für Verbraucherfragen.
Die Heizkosten steigen, vor allem für ärmere Men… [+3387 chars]",,de,'Gas'
https://www.freitag.de/autoren/the-guardian/gaza-die-hospitaeler-koennen-die-flut-und-schwere-der-faelle-kaum-mehr-bewaeltigen,https://www.freitag.de/autoren/the-guardian/gaza-die-hospitaeler-koennen-die-flut-und-schwere-der-faelle-kaum-mehr-bewaeltigen,0,www.freitag.de,"Extreme Notlage | Gazastreifen: „Die Menschen haben große Angst vor dem, was kommt“","Palästinensische Zivilisten fliehen vor den israelischen Angriffswellen. Sie suchen Zuflucht, soweit es die gibt. Strom und Gas sind durch Israel weitgehend abgeschaltet, die medizinische Infrastruktur liegt am Boden Zehntausende versuchen im Gazastreifen, si…",https://www.freitag.de/autoren/the-guardian/gaza-die-hospitaeler-koennen-die-flut-und-schwere-der-faelle-kaum-mehr-bewaeltigen/@@images/social_image,2023-10-09T16:00:00Z,,"Zehntausende versuchen im Gazastreifen, sich vor jeder neuen Welle israelischer Luftangriffe in Sicherheit zu bringen. Als wir anfingen, nach der Situation in den Krankenhäusern zu fragen, mit denen … [+528 chars]",,de,'Gas'
https://www.faz.net/aktuell/wirtschaft/gas-oel-waermepumpen-beunruhigende-energiearmut-19231738.html,https://www.faz.net/aktuell/wirtschaft/gas-oel-waermepumpen-beunruhigende-energiearmut-19231738.html,0,www.faz.net,Beunruhigende Energiearmut,"Die Sachverständigen für Verbraucherfragen warnen vor hohen Heizkosten – für ärmere Haushalte. Besserverdiener heizen öfter mit Wärmepumpen, was weniger kostet.",https://media1.faz.net/ppmedia/aktuell/wirtschaft/3248775892/1.9231733/facebook_teaser/teures-gas.jpg,2023-10-09T16:54:00Z,,"Die Belastung der Haushalte durch Energiekosten ergibt ein beunruhigendes Bild. Das ist die Quintessenz einer Analyse, die der Sachverständigenrat für Verbraucherfragen am Montag in Berlin vorstellte… [+4734 chars]",,de,'Gas'
https://www.tagesspiegel.de/berlin/gesicht-der-bahnhofsmission-am-berliner-zoo-wie-dieter-puhl-auch-als-rentner-weiter-gegen-obdachlosigkeit-kampft-10582387.html,https://www.tagesspiegel.de/berlin/gesicht-der-bahnhofsmission-am-berliner-zoo-wie-dieter-puhl-auch-als-rentner-weiter-gegen-obdachlosigkeit-kampft-10582387.html,0,www.tagesspiegel.de,Gesicht der Bahnhofsmission am Berliner Zoo: Wie Dieter Puhl auch als Rentner weiter gegen Obdachlosigkeit kämpft,Dieter Puhl ist seit Oktober im Ruhestand. Jetzt will der langjährige Leiter der Bahnhofsmission am Zoo Menschen im Kampf gegen Obdachlosigkeit zusammenführen.,https://www.tagesspiegel.de/images/dieter-puhl-nur-fuer-redaktionelle-zwecke-editorial-use-only-pdieter-puhl-der-leiter-be/alternates/BASE_16_9_W1400/dieter-puhl--nur-fuer-redaktionelle-zwecke--editorial-use-only-pdieter-puhl-der-leiter-be.jpeg,2023-10-09T19:40:19Z,,"Pitsidia auf Kreta natürlich, was auch sonst? Dieter Puhl fliegt seit 31 Jahren in das 600-Einwohner-Dorf, um Urlaub zu machen. Nun ist er wieder nach Pitsidia geflogen, aber diesmal ganz besonders w… [+156 chars]",,de,'Obdachlosigkeit'
https://www.morgenpost.de/berlin/article239767041/Dressur-und-Springreiten-auf-dem-Steckenpferd.html,https://www.morgenpost.de/berlin/article239767041/Dressur-und-Springreiten-auf-dem-Steckenpferd.html,0,www.morgenpost.de,Trend Hobby Horsing: Dressur- und Springreiten auf dem Steckenpferd,"Schimmel, Rappe oder Fuchs - beim Hobby Horsing in der Berliner Wuhlheide sind alle Fellfarben vertreten. Allerdings geht es hier nicht ums echte Pferd, sondern um eines aus Holz und Stoff.",https://img.morgenpost.de/img/berlin/crop239767039/3792605367-w820-cv16_9-q85/Hobby-Horsing.jpg,2023-10-10T03:23:21Z,,"Berlin. Reiten ohne Pferd - das wird auch in Berlin immer beliebter. Das Ganze heißt Hobby Horsing. Marie-Louise Zirzlaff und Tom Ehrenteit zeigen in der Berliner Wuhlheide, wie es geht. Sie bauen de… [+1535 chars]",,de,'Schimmel'
https://www.zeit.de/news/2023-10/10/festakt-zu-90-jahren-kinder-und-jugend-aliyah,https://www.zeit.de/news/2023-10/10/festakt-zu-90-jahren-kinder-und-jugend-aliyah,0,www.zeit.de,Jüdisches Kinderhilfswerk: Festakt zu 90 Jahren Kinder- und Jugend-Aliyah,,,2023-10-10T03:35:36Z,,"When browsing with ads:
We collect personal data and also transmit it to third-party providers
 that help us improve and finance our digital content. Some of the information stored on your device, … [+821 chars]",,de,'Kinder'
https://www.welt.de/reise/Kreuzfahrt/article247898844/Kreuzfahrt-mit-Kind-An-der-Reisevollmacht-kann-der-Urlaub-scheitern.html,https://www.welt.de/reise/Kreuzfahrt/article247898844/Kreuzfahrt-mit-Kind-An-der-Reisevollmacht-kann-der-Urlaub-scheitern.html,0,www.welt.de,Woran die Kreuzfahrt mit Kind leicht scheitert,"Manchmal endet eine Kreuzfahrt mit Kindern schon vor der Einschiffung. Denn immer mehr Reedereien verlangen eine Reisevollmacht für die Kleinen, um Probleme mit dem Sorgerecht zu vermeiden. Mit den Regeln des jeweiligen Anbieters sollten sich Urlauber also re…",https://img.welt.de/img/reise/mobile247902268/5691356107-ci16x9-w1200/GettyImages-679589950.jpg,2023-10-10T05:14:37Z,,"Keine Reisevollmacht für die Kinder dabei? Dann ist die Kreuzfahrt womöglich schon zu Ende, bevor sie überhaupt begonnen hat. Das Risiko haben vor allem Alleinerziehende, Geschiedene und Getrenntlebe… [+5045 chars]",,de,'Kinder'
https://orf.at/stories/3334487/,https://orf.at/stories/3334487/,0,orf.at,IEA: Globaler Gasbedarf wächst künftig langsamer,,https://orf.at/mojo/1_4_1/storyserver//news/common/images/og-fallback-news.png,2023-10-10T05:26:28Z,,Die Internationale Energieagentur (IEA) prognostiziert für die kommenden Jahre ein verlangsamtes Wachstum der globalen Nachfrage nach Gas. Dies geht aus dem mittelfristigen Gasmarktbericht 2023 der I… [+1247 chars],,de,'Gas'
https://www.focus.de/finanzen/experts/gastbeitrag-von-helena-biewer-mit-kohle-oder-strom-so-geniessen-sie-grillen-gesund-und-sicher_id_203057023.html,https://www.focus.de/finanzen/experts/gastbeitrag-von-helena-biewer-mit-kohle-oder-strom-so-geniessen-sie-grillen-gesund-und-sicher_id_203057023.html,0,www.focus.de,Gastbeitrag von Helena Biewer - Mit Kohle oder Strom: So genießen Sie Grillen gesund und sicher,"So leidenschaftlich wie über den richtigen Fußballverein diskutieren die Deutschen sonst nur noch über den perfekten Grill. Beim Barbecue am Samstagabend mit Freunden lässt sich beides vereinen – am liebsten bei Rippchen, Gemüsespieß, Soße und Dip.Von FOCUS-o…",https://p6.focus.de/img/fotos/id_203057021/grillen.jpg?im=Crop%3D%280%2C54%2C760%2C380%29%3BResize%3D%281200%2C627%29&impolicy=perceptual&quality=mediumHigh&hash=6e5c8ed66f01726730f709b7eaebf6927bc6501ba0c3a5186e6988e8a258ec26,2023-10-10T05:48:15Z,,"<ul><li>
Kommentare</li><li>
E-Mail</li><li>
Teilen</li><li>
Mehr</li><li>
Twitter</li><li>
Drucken</li><li>
Feedback</li><li>
Fehler meldenSie haben einen Fehler gefunden?
Bitte markieren S… [+5188 chars]",,de,'Kohle'
https://www.spektrum.de/rezension/buchkritik-zu-schleichender-blackout/2166777,https://www.spektrum.de/rezension/buchkritik-zu-schleichender-blackout/2166777,0,www.spektrum.de,Digitalisierung ohne Sinn und Verstand?,"Die Autoren analysieren die Faktoren, die die digitale Transformation in Deutschland bremsen und zeigen Lösungsmöglichkeiten auf. Eine Rezension (Rezension zu Schleichender Blackout von Valentina Kerst, Fedor Ruhose)",https://static.spektrum.de/fm/47/f2000/cover.7955271.jpg,2023-10-10T06:10:42Z,,"Der vorliegende Text beschäftigt sich mit den in Deutschland herrschenden Problemen in Sachen Digitalisierung. Dass es hier – im Unterschied zu anderen Ländern der EU – viele Mängel gibt, ist ein off… [+2047 chars]",,de,'Blackout'
https://www.tagesschau.de/wirtschaft/verbraucher/energiekrise-erdgas-strom-verbrauch-100.html,https://www.tagesschau.de/wirtschaft/verbraucher/energiekrise-erdgas-strom-verbrauch-100.html,0,www.tagesschau.de,Strom und Gas: Keine Entwarnung ein Jahr nach der Energiekrise,Mit dem Herbst steigt der Energieverbrauch wieder. Auch wenn die Speicher voll sind: Vor allem bei der Gasversorgung sehen Experten weiterhin Risiken - und raten zu Sparsamkeit. Von Julia Henninger.,https://images.tagesschau.de/image/c060ad08-f473-4316-825e-8f0a4da8fd76/AAABixQhdW4/AAABibBxqrQ/16x9-1280/schornsteine-110.jpg,2023-10-10T06:26:16Z,,"Stand: 10.10.2023 08:26 Uhr
Mit dem Herbst steigt der Energieverbrauch wieder. Auch wenn die Speicher voll sind: Vor allem bei der Gasversorgung sehen Experten weiterhin Risiken - und raten zu Spars… [+5590 chars]",,de,'Gas'
https://www.focus.de/panorama/welt/empoerung-ist-gross-junger-mann-gibt-sitzplatz-im-zug-nicht-fuer-schwangere-auf-jetzt-hat-er-frage_id_222030298.html,https://www.focus.de/panorama/welt/empoerung-ist-gross-junger-mann-gibt-sitzplatz-im-zug-nicht-fuer-schwangere-auf-jetzt-hat-er-frage_id_222030298.html,0,www.focus.de,"Empörung ist groß - Sitzplatz-Drama im Zug: Junger Mann weigert sich, Schwangerer Platz anzubieten","Ein junger Mann löst Empörung aus, nachdem er seinen Sitzplatz im Zug nicht für eine schwangere Frau räumt, obwohl andere Passagiere ihn dazu auffordern. Der Fall erinnert an eine Begebenheit, in der ein älterer Herr aufgefordert wird, seinen Platz wegen eine…",https://p6.focus.de/img/fotos/id_222032162/schwangere.jpg?im=Crop%3D%280%2C288%2C3464%2C1732%29%3BResize%3D%281200%2C627%29&impolicy=perceptual&quality=mediumHigh&hash=e2625d2ab53973b4ff9ac6cb3ad4731878ffd1be7369565d9b40d21313cbc03b,2023-10-10T06:39:22Z,,"Ein junger Mann löst Empörung aus, nachdem er seinen Sitzplatz im Zug nicht für eine schwangere Frau räumt, obwohl andere Passagiere ihn dazu auffordern. Der Fall erinnert an eine Begebenheit, in der… [+2935 chars]",,de,'ältere Mensch'
https://www.focus.de/finanzen/news/millionen-mieter-betroffen-diesen-heizungsbrief-ihres-vermieters-sollten-sie-nicht-ignorieren_id_221486019.html,https://www.focus.de/finanzen/news/millionen-mieter-betroffen-diesen-heizungsbrief-ihres-vermieters-sollten-sie-nicht-ignorieren_id_221486019.html,0,www.focus.de,Millionen Mieter betroffen - Diesen Heizungsbrief Ihres Vermieters sollten Sie nicht ignorieren,"Im Herbst hängt oft der Ablesezettel im Hausflur. Zu einem festgelegten Termin kommen dann Handwerker vorbei, um den Verbrauch von Wasser, Strom, Gas und Heizung abzulesen. In diesem Jahr könnte auch ein Brief des Vermieters im Briefkasten liegen.",https://p6.focus.de/img/fotos/id_11146604/urn-newsml-dpa-com-20090101-190913-99-860435-large-4-3.jpg?im=Crop%3D%280%2C100%2C800%2C400%29%3BResize%3D%281200%2C627%29&impolicy=perceptual&quality=mediumHigh&hash=59d118000ade7c291cbce30af851fc71b582588c55f3f321ed67c776153d8ac3,2023-10-10T06:58:55Z,,"Im Herbst hängt oft der Ablesezettel im Hausflur. Zu einem festgelegten Termin kommen dann Handwerker vorbei, um den Verbrauch von Wasser, Strom, Gas und Heizung abzulesen. In diesem Jahr könnte auch… [+3975 chars]",,de,'Gas'
https://www.diepresse.com/17729267/globaler-gasbedarf-geht-zurueck,https://www.diepresse.com/17729267/globaler-gasbedarf-geht-zurueck,0,www.diepresse.com,Globaler Gasbedarf geht zurück,Das Wachstum konzentriert sich auf aufstrebende asiatische Märkte. Die globalen Märkte befinden sich in einer Phase großer Veränderungen.,https://img.diepresse.com/public/incoming/p0aer4-imago0098488323h.jpg/alternates/DPR_SOCIAL_NACHRICHTEN/imago0098488323h.jpg,2023-10-10T07:23:15Z,,"Das Wachstum konzentriert sich auf aufstrebende asiatische Märkte. Die globalen Märkte befinden sich in einer Phase großer Veränderungen. 
Die Internationale Energieagentur (IEA) prognostiziert für … [+1984 chars]",,de,'Gas'
https://www.focus.de/politik/meinung/gastbeitrag-von-michael-wolffsohn-beim-thema-judenhass-muss-deutschland-jetzt-ein-schweres-defizit-beheben_id_222029368.html,https://www.focus.de/politik/meinung/gastbeitrag-von-michael-wolffsohn-beim-thema-judenhass-muss-deutschland-jetzt-ein-schweres-defizit-beheben_id_222029368.html,0,www.focus.de,Gastbeitrag von Michael Wolffsohn - Beim Thema Judenhass muss Deutschland jetzt ein schweres Defizit beheben,"Die Rolle Deutschlands im israelisch-palästinensischen Konflikt ist vielschichtig und umstritten, insbesondere in der Auseinandersetzung mit Antisemitismus und Antiisraelismus. Die Diskussion um deutsches Geld für Palästinenser wirft Fragen nach der ethischen…",https://p6.focus.de/img/fotos/id_222067000/wolfssohn.png?im=Crop%3D%280%2C2%2C1117%2C558%29%3BResize%3D%281200%2C627%29&impolicy=perceptual&quality=mediumHigh&hash=dee0afb38ae74655e8db04ec4ca7e97b0e9c8847b551c624ddc068c381856d9e,2023-10-10T08:00:57Z,,"Die Rolle Deutschlands im israelisch-palästinensischen Konflikt ist vielschichtig und umstritten, insbesondere in der Auseinandersetzung mit Antisemitismus und Antiisraelismus. Die Diskussion um deut… [+5908 chars]",,de,'Gas'
https://www.stern.de/panorama/freizeit--hobby-horsing---springreiten-auf-dem-steckenpferd-33900028.html,https://www.stern.de/panorama/freizeit--hobby-horsing---springreiten-auf-dem-steckenpferd-33900028.html,0,www.stern.de,Freizeit: Hobby Horsing - Springreiten auf dem Steckenpferd,"Schimmel, Rappe oder Fuchs - beim Hobby Horsing sind alle Fellfarben vertreten. Allerdings geht es hier nicht ums echte Pferd, sondern um eines aus Holz und Stoff.",https://image.stern.de/33900030/t/EV/v1/w1440/r1.7778/-/10--urnnewsmldpacom2009010123101099512073v3w800h600l91t123r2559b1964jpeg---cfc812bf2ea6b18a.jpg,2023-10-10T10:37:23Z,,"Schimmel, Rappe oder Fuchs - beim Hobby Horsing sind alle Fellfarben vertreten. Allerdings geht es hier nicht ums echte Pferd, sondern um eines aus Holz und Stoff.
Reiten ohne Pferd - das ist eine i… [+1722 chars]",,de,'Schimmel'
https://www.morgenpost.de/vermischtes/article239769469/Hobby-Horsing-Springreiten-auf-dem-Steckenpferd.html,https://www.morgenpost.de/vermischtes/article239769469/Hobby-Horsing-Springreiten-auf-dem-Steckenpferd.html,0,www.morgenpost.de,Freizeit: Hobby Horsing - Springreiten auf dem Steckenpferd,"Schimmel, Rappe oder Fuchs - beim Hobby Horsing sind alle Fellfarben vertreten. Allerdings geht es hier nicht ums echte Pferd, sondern um eines aus Holz und Stoff.",https://img.morgenpost.de/img/vermischtes/crop239769467/3522604802-w820-cv16_9-q85/Hobby-Horsing.jpg,2023-10-10T10:37:23Z,,"Berlin. Reiten ohne Pferd - das ist eine inzwischen beliebte Freizeitbeschäftigung. Das Ganze heißt Hobby Horsing. Marie-Louise Zirzlaff und Tom Ehrenteit zeigen in der Berliner Wuhlheide, wie es geh… [+1550 chars]",,de,'Schimmel'
https://www.diepresse.com/17729643/solaranlagen-in-den-alpen-produzieren-im-winter-mehr-strom,https://www.diepresse.com/17729643/solaranlagen-in-den-alpen-produzieren-im-winter-mehr-strom,0,www.diepresse.com,Solaranlagen in den Alpen produzieren im Winter mehr Strom,"Ein Forschungsprojekt im Schweizer Davos lieferte eindeutige Aussagen: Mehr Sonneneinstrahlung in hohen Lagen, Kälte sowie Reflexion wegen des Schnees begünstigen die Stromerzeugung in den winterlichen Alpen.",https://img.diepresse.com/public/incoming/mqxrrv-imago0053050073h.jpg/alternates/DPR_SOCIAL_NACHRICHTEN/imago0053050073h.jpg,2023-10-10T11:28:34Z,,"Ein Forschungsprojekt im Schweizer Davos lieferte eindeutige Aussagen: Mehr Sonneneinstrahlung in hohen Lagen, Kälte sowie Reflexion wegen des Schnees begünstigen die Stromerzeugung in den winterlich… [+1933 chars]",,de,'Kälte'
https://www.n-tv.de/politik/UN-Gazastreifen-Belagerung-verstoesst-gegen-Voelkerrecht-article24453720.html,https://www.n-tv.de/politik/UN-Gazastreifen-Belagerung-verstoesst-gegen-Voelkerrecht-article24453720.html,0,www.n-tv.de,Es leiden vor allem Zivilisten: UN: Gazastreifen-Belagerung verstößt gegen Völkerrecht,"Nach dem Angriff der radikalislamistischen Hamas verkündet Israel die vollständige Belagerung des Gazastreifens. Lebensmittel, Wasser, Strom und Gas soll es nicht mehr geben. Für den Menschenrechtsrat der Vereinten Nationen ist das Vorhaben klar völkerrechtsw…",https://bilder3.n-tv.de/img/incoming/crop24453814/1721322059-cImg_16_9-w1200/429676879.jpg,2023-10-10T11:28:36Z,,"Nach dem Angriff der radikalislamistischen Hamas verkündet Israel die vollständige Belagerung des Gazastreifens. Lebensmittel, Wasser, Strom und Gas soll es nicht mehr geben. Für den Menschenrechtsra… [+2597 chars]",,de,'Gas'
https://www.focus.de/digital/rueckruf-wegen-schimmel-beliebte-kekse-sollten-nicht-mehr-gegessen-werden_id_222188383.html,https://www.focus.de/digital/rueckruf-wegen-schimmel-beliebte-kekse-sollten-nicht-mehr-gegessen-werden_id_222188383.html,0,www.focus.de,Gesundheitsschäden drohen - TK Maxx ruft zwei Chargen beliebter Keksprodukte zurück,"Weil die Kekse Schimmel enthalten können, informiert TK Maxx über den Rückruf der „Biscotti Darlings“. Kunden sollten die Süßwaren nicht mehr verzehren.",https://p6.focus.de/img/fotos/id_222202929/keks-rueckruf-bei-tk-maxx.jpg?im=Crop%3D%280%2C177%2C2121%2C1060%29%3BResize%3D%281200%2C627%29&impolicy=perceptual&quality=medium&hash=e686018ebc6287670e0c3dd8e657b759b6ed388f2afcc1ac4d6548c40db99a52,2023-10-10T13:15:43Z,,Die Einzelhandelskette TK Maxx hat eine wichtige Warnung herausgegeben: In zwei Chargen ihrer Biscotti Darlings Kekse wurde Schimmel bei Tests nachgewiesen. Aus diesem Grund wird dringend davon abger… [+1082 chars],,de,'Schimmel'
https://www.zeit.de/news/2023-10/10/nach-todesfall-eltern-koennen-bei-schwimmkursen-dabei-sein,https://www.zeit.de/news/2023-10/10/nach-todesfall-eltern-koennen-bei-schwimmkursen-dabei-sein,0,www.zeit.de,Kinder: Nach Todesfall: Eltern können bei Schwimmkursen dabei sein,,,2023-10-10T13:17:14Z,,"When browsing with ads:
We collect personal data and also transmit it to third-party providers
 that help us improve and finance our digital content. Some of the information stored on your device, … [+821 chars]",,de,'Kinder'
https://www.tagesspiegel.de/berlin/bezirke/katastrophenschutzleuchturm-in-berlin-adlershof-wohin-im-notfall-10596010.html,https://www.tagesspiegel.de/berlin/bezirke/katastrophenschutzleuchturm-in-berlin-adlershof-wohin-im-notfall-10596010.html,0,www.tagesspiegel.de,„Katastrophenschutzleuchturm“ in Berlin-Adlershof: Wohin im Notfall?,"Für den Fall eines Blackouts richten die Berliner Bezirke Anlaufstellen für die Bürger:innen ein, an denen sie Informationen erhalten. Treptow-Köpenick will alles an einem Ort bündeln.",https://www.tagesspiegel.de/images/hochspannungsmast-symbolfoto-stromversorgung-blackout-energiekrise1/alternates/BASE_16_9_W1400/hochspannungsmast-symbolfoto-stromversorgung-blackout-energiekrise.jpeg,2023-10-10T13:39:58Z,,Am späten Mittag des 19. Februar 2019 gehen in Köpenick plötzlich die Lichter aus: Ein Bagger hat bei Bauarbeiten an der Salvador-Allende-Brücke zwei zentrale Stromkabel durchtrennt. 31 Stunden lang … [+2461 chars],,de,'Blackout'
https://www.faz.net/aktuell/politik/ausland/schweden-und-die-gangkriminalitaet-junger-migranten-19224697.html,https://www.faz.net/aktuell/politik/ausland/schweden-und-die-gangkriminalitaet-junger-migranten-19224697.html,0,www.faz.net,Gangkriminalität in Schweden: Der blutige Preis der Naivität,In Schweden eskaliert die Gangkriminalität. Die Täter sind oft Kinder und Jugendliche mit Migrationshintergrund. Jetzt sollen härtere Strafen helfen.,https://media0.faz.net/ppmedia/aktuell/3043908486/1.9224696/facebook_teaser/in-einem-vorort-uppsalas.jpg,2023-10-10T13:49:04Z,,"In der Gemeinde Haninge, rund eine halbe Stunde mit dem Pendlerzug südlich von Stockholm, wirkt die feine Hauptstadt sehr fern. Große Plattenbauten wechseln sich ab mit heruntergekommenen Mehrfamilie… [+2926 chars]",,de,'Kinder'
https://www.tagesspiegel.de/kultur/tod-auf-der-schulfeier-traumabewaltigung-mit-desiree-nosbuch-10602373.html,https://www.tagesspiegel.de/kultur/tod-auf-der-schulfeier-traumabewaltigung-mit-desiree-nosbuch-10602373.html,0,www.tagesspiegel.de,Tod auf der Schulfeier: Traumabewältigung mit Désirée Nosbuch,Im neuen Irland-Krimi „Blackout“ findet erneut Kriminalpsychologin Cathrin Blake die entscheidenden Hinweise zur Lösung des Falles.,https://www.tagesspiegel.de/images/ard-1irlandkrimiblackoutkeyvisualjpg/alternates/BASE_16_9_W1400/ard-1irlandkrimiblackoutkeyvisualjpg.jpeg,2023-10-10T14:08:29Z,,"Die Irland-Krimis gehören zu den erfolgreichsten ARD-Produktionen. Von den bisher ausgestrahlten sechs Episoden kamen vier auf 5,5 Millionen Zuschauer und mehr. An diesem und am nächsten Donnerstag u… [+2525 chars]",,de,'Blackout'
https://www.n-tv.de/politik/Finnland-vermutet-aeussere-Aktivitaeten-bei-Leck-in-Gas-Pipeline-article24454701.html,https://www.n-tv.de/politik/Finnland-vermutet-aeussere-Aktivitaeten-bei-Leck-in-Gas-Pipeline-article24454701.html,0,www.n-tv.de,"Erneuter Anschlag auf Pipeline?: Finnland vermutet ""äußere Aktivitäten"" bei Leck in Gas-Pipeline","Der Betrieb der Gas-Pipeline Balticconnector wird aufgrund eines Druckabfalls eingestellt. Finnlands Präsident Niinistö äußert die Vermutung, dass der Schaden kein Unfall ist. Die NATO erklärt ihr Bereitschaft zu helfen.",https://bilder4.n-tv.de/img/incoming/crop24454811/6951328942-cImg_16_9-w1200/427756393.jpg,2023-10-10T14:27:56Z,,"Der Betrieb der Gas-Pipeline Balticconnector wird aufgrund eines Druckabfalls eingestellt. Finnlands Präsident Niinistö äußert die Vermutung, dass der Schaden kein Unfall ist. Die NATO erklärt ihr Be… [+2892 chars]",,de,'Gas'
https://www.welt.de/politik/ausland/article247929970/Israel-Hamas-Terroristen-sollen-Kleinkinder-in-Kibbuz-enthauptet-haben.html,https://www.welt.de/politik/ausland/article247929970/Israel-Hamas-Terroristen-sollen-Kleinkinder-in-Kibbuz-enthauptet-haben.html,0,www.welt.de,Dutzende Leichen in Kibbuz entdeckt – „Es ist mehr wie ein Pogrom aus der Zeit unserer Großeltern“,"Die Gewalt, mit der radikalislamische Hamas-Terroristen gegen die israelische Zivilbevölkerung vorgingen, scheint unbeschreiblich. Nun wurde bekannt, dass beim Überfall auf einen grenznahen Kibbuz offenbar Dutzende Kinder getötet wurden.",https://img.welt.de/img/bildergalerien/mobile247929890/5141356467-ci16x9-w1200/Massive-Raketenangriffe-aus-Gazastreifen-auf-Israel.jpg,2023-10-10T19:39:40Z,,Verstörende Berichte aus dem grenznahen Kibbuz Kfar Azza erschüttern die internationale Gemeinschaft. Bewaffnete Terroristen der radikalislamischen Hamas sollen dort am Sonntag Dutzende Israelis getö… [+2182 chars],,de,'Ältere'
https://www.zeit.de/zeit-magazin/familie/2023-10/kinderernaehrung-suessigkeiten-strenge-eltern-zucker,https://www.zeit.de/zeit-magazin/familie/2023-10/kinderernaehrung-suessigkeiten-strenge-eltern-zucker,0,www.zeit.de,Kinderernährung: Kinder müssen sich nicht wie vegane Influencer ernähren,Dinkelpizza und vegane Muffins mit Rübensirup: Viele Eltern übertrumpfen sich mit der gesunden Ernährung ihrer Kinder. Dabei kann Süßkram eine wichtige Funktion erfüllen.,,2023-10-11T04:04:03Z,,"When browsing with ads:
We collect personal data and also transmit it to third-party providers
 that help us improve and finance our digital content. Some of the information stored on your device, … [+821 chars]",,de,'Kinder'
https://www.zeit.de/news/2023-10/11/kinder-loesen-brand-in-unbewohntem-gebaeude-aus,https://www.zeit.de/news/2023-10/11/kinder-loesen-brand-in-unbewohntem-gebaeude-aus,0,www.zeit.de,Rosenheim: Kinder lösen Brand in unbewohntem Gebäude aus,,,2023-10-11T09:37:02Z,,"When browsing with ads:
We collect personal data and also transmit it to third-party providers
 that help us improve and finance our digital content. Some of the information stored on your device, … [+821 chars]",,de,'Kinder'
https://www.tagesschau.de/wirtschaft/gaspreis-ttf-chevron-israel-anstieg-100.html,https://www.tagesschau.de/wirtschaft/gaspreis-ttf-chevron-israel-anstieg-100.html,0,www.tagesschau.de,Förderfeld in Israel stillgelegt: Europäischer Gaspreis steigt,Israel hat zu Beginn der Woche die Produktion in einem Gasfeld vor seiner Südküste ausgesetzt. Der europäische Gaspreis reagiert auf die Stillegung mit einem deutlichen Anstieg.,https://images.tagesschau.de/image/c9b7d660-b66b-41b4-8473-98aeb1696b6b/AAABix4KYeM/AAABibBxqrQ/16x9-1280/gas-israel-102.jpg,2023-10-11T09:58:10Z,,"Stand: 11.10.2023 11:58 Uhr
Israel hat zu Beginn der Woche die Produktion in einem Gasfeld vor seiner Südküste ausgesetzt. Der europäische Gaspreis reagiert auf die Stillegung mit einem deutlichen A… [+2179 chars]",,de,'Gas'
