index,url,valid,domain,title,description,image,published,archive,content,quote,language,keyword
https://www.morgenpost.de/vermischtes/article236804705/nordsee-wattenmeer-seehunde-population.html,https://www.morgenpost.de/vermischtes/article236804705/nordsee-wattenmeer-seehunde-population.html,0,www.morgenpost.de,Urlaubsregion: Nordsee: Deutlich weniger Seehunde – Ursache noch unklar,"Im Wattenmeer in der Nordsee wurden 2022 deutlich weniger Seehunde gezählt als sonst. Fachleute haben eine Vermutung, woran das liegen könnte.",https://img.morgenpost.de/img/incoming/crop236803075/2832608884-w820-cv16_9-q85/seehund.jpg,2022-11-01T16:48:34Z,,"Berlin. Das Wattenmeer zählt zu den am stärksten geschützten Naturparks in Deutschland. Seehunde kommen hier zahlreich vor. Urlauberinnen und Urlauber ziehen verzückt ihre Kameras, wenn sie sie auf d… [+3355 chars]",,de,'Winter'
https://www.computerbild.de/artikel/Nikon-Winter-Sofortrabatt-Cashback-2022-2023-34013595.html,https://www.computerbild.de/artikel/Nikon-Winter-Sofortrabatt-Cashback-2022-2023-34013595.html,0,www.computerbild.de,Nikon Winter Sofortrabatt: Sparen bei Kameras und Objektiven,"Bis zum 16. Januar 2023 gibt es für ausgewählte Kameras und Objektive von Nikon satte Rabatte – bis zu 500 Euro. Wie Sie sparen, sagt COMPUTER BILD.",https://i.computer-bild.de/imgs/1/4/6/3/9/8/5/9/Nikon_Winter_Cashback_2022-727d66c1b3a38f02.jpg,2022-11-01T16:41:00Z,,"Bis zum 16. Januar 2023 gibt es für ausgewählte Kameras und Objektive von Nikon satte Rabatte bis zu 500 Euro. Wie Sie sparen, sagt COMPUTER BILD.
Auf der Suche nach einer neuen Kamera, neuen Objekt… [+2333 chars]",,de,'Winter'
https://www.stern.de/gesellschaft/regional/mecklenburg-vorpommern/konjunktur--ihk-umfrage--mangel-an-planbarkeit-belastet-unternehmen-32870540.html,https://www.stern.de/gesellschaft/regional/mecklenburg-vorpommern/konjunktur--ihk-umfrage--mangel-an-planbarkeit-belastet-unternehmen-32870540.html,0,www.stern.de,Konjunktur: IHK-Umfrage: Mangel an Planbarkeit belastet Unternehmen,Der Konjunkturindex der Industrie- und Handelskammern hat in Mecklenburg-Vorpommern einen neuen Tiefsstand erreicht. Vor allem die ungewisse Lage in der Energiekrise dämpft die Erwartungen der Betriebe.,https://image.stern.de/32870542/t/pD/v1/w1440/r1.7778/-/01--urnnewsmldpacom2009010122110199344831v3w800h600l517t177r4505b2878jpeg---4761e3d0466540be.jpg,2022-11-01T16:38:45Z,,Der Konjunkturindex der Industrie- und Handelskammern hat in Mecklenburg-Vorpommern einen neuen Tiefsstand erreicht. Vor allem die ungewisse Lage in der Energiekrise dämpft die Erwartungen der Betrie… [+2069 chars],,de,'Winter'
https://taz.de/Baerbock-in-Zentralasien/!5888895/,https://taz.de/Baerbock-in-Zentralasien/!5888895/,0,taz.de,Baerbock in Zentralasien: Bodenschätze versus Bürgerrechte,Die Außenministerin ist in Kasachstan und Usbekistan unterwegs. Dabei signalisiert Baerbock ein klares Interesse an wirtschaftlicher Kooperation.,https://taz.de/picture/5887060/948/31392563-1.jpg,2022-11-01T16:34:00Z,,"Die Außenministerin ist in Kasachstan und Usbekistan unterwegs. Dabei signalisiert Baerbock ein klares Interesse an wirtschaftlicher Kooperation.
Empfang beim usbekischen Kollegen: Außenministerin A… [+3559 chars]",,de,'Winter'
https://www.morgenpost.de/bezirke/reinickendorf/article236805411/Die-Wasserbueffel-Saison-geht-zu-Ende-im-Tegeler-Fliess.html,https://www.morgenpost.de/bezirke/reinickendorf/article236805411/Die-Wasserbueffel-Saison-geht-zu-Ende-im-Tegeler-Fliess.html,0,www.morgenpost.de,Weideabtrieb: Die Wasserbüffel-Saison geht zu Ende im Tegeler Fließ,"Die ersten Tiere wurden schon in den Stall bei Potsdam gebracht. Wer sich beeilt, kann noch einige von ihnen in Freiheit beobachten.",https://img.morgenpost.de/img/reinickendorf/crop236805409/3852608229-w820-cv16_9-q85/d66f04da-59fb-11ed-b3f8-977c7755fac0.jpg,2022-11-01T16:13:36Z,,Berlin.  Sie stammen aus den Feuchtgebieten und Sumpfwäldern Asiens. Doch seit 2015 gibt es sie in der warmen Jahreszeit auch im Tegeler Fließ: Wasserbüffel. Nun neigt sich die diesjährige Weidesaiso… [+2554 chars],,de,'Winter'
https://www.sueddeutsche.de/meinung/gaspreis-gaspreisbremse-energiekrise-deutschland-1.5685213,https://www.sueddeutsche.de/meinung/gaspreis-gaspreisbremse-energiekrise-deutschland-1.5685213,0,www.sueddeutsche.de,"Expertenkommission Gas und Wärme: Die Ideen der Gaspreiskommission sind unvollkommen, aber richtig","So kurz vor dem Winter ist keine Zeit mehr für einen detailreichen, gerechten Plan zur Wärmeversorgung. Aber die Experten haben ein bemerkenswertes Bündel an Empfehlungen geschnürt - und sie werfen ein grelles Licht auf die Versäumnisse der Regierung.",https://www.sueddeutsche.de/image/sz.1.5685214/1200x675?v=1667310726,2022-11-01T16:10:06Z,https://web.archive.org/web/20221101162008/https://www.sueddeutsche.de/meinung/gaspreis-gaspreisbremse-energiekrise-deutschland-1.5685213,"So kurz vor dem Winter ist keine Zeit mehr für einen detailreichen, gerechten Plan zur Wärmeversorgung. Aber die Experten haben ein bemerkenswertes Bündel an Empfehlungen geschnürt - und sie werfen e… [+501 chars]",,de,'Winter'
https://www.brigitte.de/aktuell/nach-elon-musks-uebernahme--diese-stars-legen-ihre-twitter-accounts-auf-eis-13417004.html,https://www.brigitte.de/aktuell/nach-elon-musks-uebernahme--diese-stars-legen-ihre-twitter-accounts-auf-eis-13417004.html,0,www.brigitte.de,Nach Elon Musks Übernahme: Diese Stars legen ihre Twitter-Accounts auf Eis,Tesla-Chef Elon Musk hat vor Kurzem Twitter übernommen. Daraufhin haben sich einige Stars vom Kurznachrichtendienst verabschiedet.,https://image.brigitte.de/13417006/t/57/v1/w1440/r1.7778/-/01--diese-stars-legen-ihre-twitter-accounts-auf-eis---1-1---spoton-article-1032614.jpg,2022-11-01T16:00:00Z,,"Tesla-Chef Elon Musk hat vor Kurzem Twitter übernommen. Daraufhin haben sich einige Stars vom Kurznachrichtendienst verabschiedet.
Es hat nicht lange gedauert, bis nach Elon Musks (51) Twitter-Übern… [+3795 chars]",,de,'Winter'
https://www.stern.de/lifestyle/leute/nach-elon-musks-uebernahme--diese-stars-kehren-twitter-den-ruecken-32870220.html,https://www.stern.de/lifestyle/leute/nach-elon-musks-uebernahme--diese-stars-kehren-twitter-den-ruecken-32870220.html,0,www.stern.de,Nach Elon Musks Übernahme: Diese Stars kehren Twitter den Rücken,Tesla-Chef Elon Musk hat vor Kurzem Twitter übernommen. Daraufhin haben sich einige Stars vom Kurznachrichtendienst verabschiedet.,https://image.stern.de/32870224/t/Ev/v1/w1440/r1.7778/-/01--diese-stars-kehren-twitter-den-ruecken---16-9---spoton-article-1032614.jpg,2022-11-01T15:56:00Z,https://web.archive.org/web/20221101161308/https://www.stern.de/lifestyle/leute/nach-elon-musks-uebernahme--diese-stars-kehren-twitter-den-ruecken-32870220.html,"Tesla-Chef Elon Musk hat vor Kurzem Twitter übernommen. Daraufhin haben sich einige Stars vom Kurznachrichtendienst verabschiedet.
Es hat nicht lange gedauert, bis nach Elon Musks (51) Twitter-Übern… [+3795 chars]",,de,'Winter'
https://www.urlaubspiraten.de/pauschalreisen/hotel-moevenpick-resort-and-marine-spa-sousse-tunesien,https://www.urlaubspiraten.de/pauschalreisen/hotel-moevenpick-resort-and-marine-spa-sousse-tunesien,0,www.urlaubspiraten.de,Tunesien = Sonne satt!,"1 Woche Luxus im 5* Mövenpick Resort direkt am hoteleigenen Strand inkl. Flügen, Transfer & All Inclusive!",https://image.urlaubspiraten.de/720/image/upload/v1667296863/Impressions%20and%20Other%20Assets/299277_yggpya.webp,2022-11-01T15:55:00Z,https://web.archive.org/web/20221101160249/https://www.urlaubspiraten.de/pauschalreisen/hotel-moevenpick-resort-and-marine-spa-sousse-tunesien,"Ahoi Piraten!
Habt ihr Lust noch mal ins Warme zu Fliegen? Wie wäre es dann mal mit Tunesien?! Am Horizont der lebhaftesten Stadt Tunesiens, Sousse, befindet sich das 5* Mövenpick Resort &amp; Marin… [+834 chars]",,de,'Winter'
https://www.tagesspiegel.de/wissen/steigende-preise-belasten-studierende-hohere-mieten-in-berliner-wohnheimen-8820004.html,https://www.tagesspiegel.de/wissen/steigende-preise-belasten-studierende-hohere-mieten-in-berliner-wohnheimen-8820004.html,0,www.tagesspiegel.de,Steigende Preise belasten Studierende: Höhere Mieten in Berliner Wohnheimen,"Selbst im Wohnheim kommen Studierende nicht mehr so günstig unter wie zuvor: Die Mieten sind gestiegen, weitere Erhöhungen drohen. Die Studis protestieren.",https://www.tagesspiegel.de/potsdam/images/heprodimagesfotos93120171005studenten4175120171004145906980jpg/alternates/BASE_16_9_W1400/heprodimagesfotos93120171005studenten4175120171004145906980jpg.jpeg,2022-11-01T15:53:57Z,https://web.archive.org/web/20221101161944/https://www.tagesspiegel.de/wissen/steigende-preise-belasten-studierende-hohere-mieten-in-berliner-wohnheimen-8820004.html,In etlichen Berliner Studentenwohnheimen steigen die Mieten um 50 Prozent und die Vertragslaufzeiten halbieren sich von zwei Jahren auf ein Jahr. Das berichtet ein Bewohner und Mitglied der studentis… [+4571 chars],,de,'Winter'
https://www.welt.de/sport/article241898365/WM-Start-in-Katar-2022-in-19-Tagen-Diese-Stars-werden-nicht-mehr-rechtzeitig-fit.html,https://www.welt.de/sport/article241898365/WM-Start-in-Katar-2022-in-19-Tagen-Diese-Stars-werden-nicht-mehr-rechtzeitig-fit.html,0,www.welt.de,Diese Stars werden nicht mehr rechtzeitig fit,"Am 20. November beginnt in Katar die umstrittene Winter-WM. Viele Nationaltrainer plagen vor der Weltmeisterschaft Verletzungssorgen. Besonders groß sind sie beim Titelverteidiger Frankreich, der auf seine komplette Mittelfeld-Zentrale verzichten muss.",https://img.welt.de/img/sport/mobile241905575/1871359987-ci16x9-w1200/FILES-FBL-FRA-WC2022-POGBA.jpg,2022-11-01T15:51:26Z,https://web.archive.org/web/20221101155944/http://www.welt.de/sport/article241898365/WM-Start-in-Katar-2022-in-19-Tagen-Diese-Stars-werden-nicht-mehr-rechtzeitig-fit.html,"Die Schmerzen im Knie wurden zu stark. Obwohl sich Paul Pogba lange gegen einen Eingriff gewehrt hatte, ließ er sich im vergangenen September dann doch operieren. Der Mittelfeldstar von Juventus Turi… [+3607 chars]",,de,'Winter'
https://www.brigitte.de/aktuell/buzz/energiesparen-beim-waeschewaschen--unterschaetzter-fehler-kostet-dich-viel-geld-13416566.html,https://www.brigitte.de/aktuell/buzz/energiesparen-beim-waeschewaschen--unterschaetzter-fehler-kostet-dich-viel-geld-13416566.html,0,www.brigitte.de,Sparen: Dieser unterschätzte Wäschefehler kostet dich viel Geld,"Während viele Leute beim Kauf einer Waschmaschine auf einen sparsamen Verbrauch achten, schleichen sich anderswo kostspielige Fehler ein. Welcher Wäschefehler besonders häufig unterschätzt wird und wie man ihn vermeiden kann – wir verraten es dir.",https://image.brigitte.de/13416600/t/yj/v2/w1440/r1.7778/-/sparen-unterschaetzer-waesche-fehler.jpg,2022-11-01T15:06:00Z,https://web.archive.org/web/20221101155204/https://www.brigitte.de/aktuell/buzz/energiesparen-beim-waeschewaschen--unterschaetzter-fehler-kostet-dich-viel-geld-13416566.html,"01.11.2022, 16:06
 1 Min.
Während viele Leute beim Kauf einer Waschmaschine auf einen sparsamen Verbrauch achten, schleichen sich anderswo kostspielige Fehler ein. Welcher Wäschefehler besonders hä… [+2293 chars]",,de,'Winter'
https://www.sueddeutsche.de/wirtschaft/bosch-china-elektromobilitaet-ukraine-energie-hartung-1.5685327,https://www.sueddeutsche.de/wirtschaft/bosch-china-elektromobilitaet-ukraine-energie-hartung-1.5685327,0,www.sueddeutsche.de,"Bosch-Chef Stefan Hartung: ""Auch die Konsumenten müssen beim Kampf gegen den Klimawandel mitziehen""","Ein unerschütterlicher Optimist, trotz all der Krisen in der Welt: Bosch-Chef Hartung glaubt, dass die Geschäfte im Jahr 2024 wieder normal laufen werden",https://www.sueddeutsche.de/image/sz.1.5685329/1200x675?v=1667315018,2022-11-01T15:03:45Z,https://web.archive.org/web/20221101151818/https://www.sueddeutsche.de/wirtschaft/bosch-china-elektromobilitaet-ukraine-energie-hartung-1.5685327,"Ein unerschütterlicher Optimist, trotz all der Krisen in der Welt: Bosch-Chef Hartung glaubt, dass die Geschäfte im Jahr 2024 wieder normal laufen werdenStefan Hartung, 56, ist für Bosch eine ziemlic… [+10866 chars]",,de,'Winter'
https://www.bild.de/sport/fussball/borussia-dortmund/bvb-comeback-von-marco-reus-erneut-verschoben-81800672.bild.html,https://www.bild.de/sport/fussball/borussia-dortmund/bvb-comeback-von-marco-reus-erneut-verschoben-81800672.bild.html,0,www.bild.de,Kapitän fehlt auch in Kopenhagen - BVB wieder ohne Reus!,Das Zittern um seine WM geht weiter! Marco Reus flog nicht mit nach Kopenhagen.Foto: TOBIAS SCHWARZ/AFP,"https://images.bild.de/63612643e146ff35a368e8b3/bebd545e63b8a7eccad8e532b096feeb,eac143a2?w=1280",2022-11-01T15:00:14Z,https://web.archive.org/web/20221101151107/https://www.bild.de/sport/fussball/borussia-dortmund/bvb-comeback-von-marco-reus-erneut-verschoben-81800672.bild.html,"Das Zittern um seine WM-Teilnahme geht weiter!
BVB-Kapitän Marco Reus (33) fliegt auch diesmal nicht mit seiner Mannschaft zum Champions-League-Auswärtsspiel nach Kopenhagen (Mi., 21 Uhr/DAZN).
Dor… [+1018 chars]",,de,'Winter'
https://www.brigitte.de/aktuell/schuhtrends-2022--high-boots-sind-trend--je-hoeher-der-schaft-umso-besser-13416934.html,https://www.brigitte.de/aktuell/schuhtrends-2022--high-boots-sind-trend--je-hoeher-der-schaft-umso-besser-13416934.html,0,www.brigitte.de,Schuhtrends 2022: High Boots sind Trend: Je höher der Schaft umso besser,Ankle Boots müssen 2022 im Schrank bleiben. Stattdessen träumen wir von Stiefeln mit langem Schaft: von Calf High Boots bis zu Overknees.,https://image.brigitte.de/13416936/t/d_/v1/w1440/r1.7778/-/01--high-boots-sind-trend--je-hoeher-der-schaft-umso-besser---1-1---spoton-article-1030473.jpg,2022-11-01T14:59:00Z,,"Ankle Boots müssen 2022 im Schrank bleiben. Stattdessen träumen wir von Stiefeln mit langem Schaft: von Calf High Boots bis zu Overknees.
Die Sneaker wandern in den Schuhschrank, während ganz bestim… [+2436 chars]",,de,'Winter'
https://www.deutsche-startups.de/2022/11/01/dealmonitor-volocopter-cloudbrixx/,https://www.deutsche-startups.de/2022/11/01/dealmonitor-volocopter-cloudbrixx/,0,www.deutsche-startups.de,#DealMonitor - Volocopter bekommt 182 Millionen – Insight investiert in Software Defined Automation – Miles übernimmt WeShare,"Der #DealMonitor, unsere Übersicht über Investments und Exits, bietet werktäglich alle Deals des Tages. Heute geht es um Volocopter, Software Defined Automation, Cloudbrixx, ImpactNexus, WeShare, Miles, Tapkey und Dom Security.",https://www.deutsche-startups.de/app/uploads/2022/01/ds-streetart-56.jpg,2022-11-01T14:55:10Z,https://web.archive.org/web/20221101151238/https://www.deutsche-startups.de/2022/11/01/dealmonitor-volocopter-cloudbrixx/,"Im #DealMonitor für den 1. November werfen wir einen Blick auf die wichtigsten, spannendsten und interessantesten Investments und Exits des Tages in der DACH-Region. Alle Deals der Vortage gibt es im… [+4300 chars]",,de,'Winter'
https://www.stern.de/kultur/schuhtrends-2022--high-boots-loesen-jetzt-ankle-boots-ab-32869786.html,https://www.stern.de/kultur/schuhtrends-2022--high-boots-loesen-jetzt-ankle-boots-ab-32869786.html,0,www.stern.de,Schuhtrends 2022: High Boots lösen jetzt Ankle Boots ab,Ankle Boots müssen 2022 im Schrank bleiben. Stattdessen träumen wir von Stiefeln mit langem Schaft: von Calf High Boots bis zu Overknees.,https://image.stern.de/32869790/t/Oq/v1/w1440/r1.7778/-/01--high-boots-loesen-jetzt-ankle-boots-ab---16-9---spoton-article-1030473.jpg,2022-11-01T14:54:00Z,https://web.archive.org/web/20221101154017/https://www.stern.de/kultur/schuhtrends-2022--high-boots-loesen-jetzt-ankle-boots-ab-32869786.html,"Ankle Boots müssen 2022 im Schrank bleiben. Stattdessen träumen wir von Stiefeln mit langem Schaft: von Calf High Boots bis zu Overknees.
Die Sneaker wandern in den Schuhschrank, während ganz bestim… [+2436 chars]",,de,'Winter'
https://www.kino.de/serie/young-royals/news/young-royals-staffel-3-wird-es-eine-fortsetzung-der-netflixserie-geben/,https://www.kino.de/serie/young-royals/news/young-royals-staffel-3-wird-es-eine-fortsetzung-der-netflixserie-geben/,0,www.kino.de,„Young Royals“ Staffel 3: Wird es eine Fortsetzung der Netflixserie geben?,"Am Internat Hillerska ist ein neues Semester angebrochen, das reichlich Drama mit sich bringt. Wird es in „Young Royals“ Staffel 3 weitergehen?..",https://crops.giga.de/6e/1b/1a/b0eaa252719a693c08a7f0c95c_YyAzNzAweDIwODErMTIrMTUCcmUgMTkyMCAxMDgwAzZiYmE1MTZjYTA1.jpg,2022-11-01T14:48:18Z,,"Am Internat Hillerska ist ein neues Semester angebrochen, das reichlich Drama mit sich bringt. Wird es in „Young Royals“ Staffel 3 weitergehen?
Young Royals
Streaming bei:
Die Ferien sind vorbei, … [+4674 chars]",,de,'Winter'
https://www.morgenpost.de/bezirke/pankow/article236804605/Ein-Autobahn-Baer-begruesst-Reisende-die-ueber-Pankow-fahren.html,https://www.morgenpost.de/bezirke/pankow/article236804605/Ein-Autobahn-Baer-begruesst-Reisende-die-ueber-Pankow-fahren.html,0,www.morgenpost.de,"Enthüllung: Ein Autobahn-Bär begrüßt Reisende, die über Pankow fahren",Zum Ende der Bauarbeiten an der A114 wurde die vierte Skulptur des Berliner Wappentieres aufgestellt.,https://img.morgenpost.de/img/pankow/crop236804603/051260784-w820-cv16_9-q85/41e09bc4-59e4-11ed-b3f8-977c7755fac0.jpg,2022-11-01T14:48:14Z,https://web.archive.org/web/20221101151144/https://www.morgenpost.de/bezirke/pankow/article236804605/Ein-Autobahn-Baer-begruesst-Reisende-die-ueber-Pankow-fahren.html,"Berlin.  Nun empfängt der Berliner Bär auch alle Reisenden, die über Pankow nach Berlin fahren. Mit der Eröffnung der vollständig sanierten A114 wurde am Dienstagmorgen der vierte Berliner Autobahn-B… [+1784 chars]",,de,'Winter'
https://www.bild.de/regional/ruhrgebiet/ruhrgebiet-aktuell/selber-saegen-im-schlosspark-stadt-essen-fuehrt-buerger-brennholz-ein-81800584.bild.html,https://www.bild.de/regional/ruhrgebiet/ruhrgebiet-aktuell/selber-saegen-im-schlosspark-stadt-essen-fuehrt-buerger-brennholz-ein-81800584.bild.html,0,www.bild.de,Selber sägen im Schlosspark - Stadt Essen führt Bürger-Brennholz ein,Der Ansturm auf das städtische Brennholz in Essen ist wegen der Energiekrise gewaltig. BILD erklärt die Regeln beim Selbersägen.,"https://images.bild.de/6361255f1b47e91811238b58/844a2b2ffb0856ac6ea9ed2f17eac3cf,dc0541f8?w=1280",2022-11-01T14:48:13Z,https://web.archive.org/web/20221101145525/https://www.bild.de/regional/ruhrgebiet/ruhrgebiet-aktuell/selber-saegen-im-schlosspark-stadt-essen-fuehrt-buerger-brennholz-ein-81800584.bild.html,"Essen Stolz blickt Stefan Beier (49) auf die halb zersägte Buche im Schlosspark Borbeck in Essen.
Mit seiner Kettensäge (71 cm Schwert) hat er den Baum bereits in handliche Holzstücke zerschnitten. … [+1957 chars]",,de,'Winter'
https://www.dw.com/de/wm-gastgeber-katar-gibt-sicherheitsgarantie-f%C3%BCr-fans/a-63616390,https://www.dw.com/de/wm-gastgeber-katar-gibt-sicherheitsgarantie-f%C3%BCr-fans/a-63616390,0,www.dw.com,"WM-Gastgeber Katar gibt ""Sicherheitsgarantie"" für Fans","Innenministerin Nancy Faeser und DFB-Präsident Bernd Neuendorf kehren von ihrem Besuch in Katar zurück und bringen ein Zugeständnis des WM-Gastgebers von ihrer ""Inspektionsreise"" mit. Beim Rückflug aus Katar hatten die Bundesinnenministerin und der Präsident …",https://static.dw.com/image/63616557_6.jpg,2022-11-01T14:44:00Z,,Beim Rückflug aus Katar hatten die Bundesinnenministerin und der Präsident des Deutschen Fußball-Bundes (DFB) immerhin einen Teilerfolg im Gepäck: Nancy Faeser und Bernd Neuendorf waren zwei Tage lan… [+3425 chars],,de,'Winter'
https://orf.at/stories/3292020/,https://orf.at/stories/3292020/,0,orf.at,Moskau will Angriffe auf ukrainische Infrastruktur fortsetzen,,https://orf.at/mojo/1_4_1/storyserver//news/common/images/og-fallback-news.png,2022-11-01T14:43:41Z,https://web.archive.org/web/20221101184545/https://orf.at/stories/3292020/,Russlands Verteidigungsminister Sergej Schoigu hat eine Fortsetzung der Raketenangriffe auf die ukrainische Infrastruktur angekündigt. Damit würden effektiv Objekte zerstört und das militärische Pote… [+1812 chars],,de,'Winter'
https://www.stern.de/sport/fussball/werder-bremen--2022-fuer-felix-agu-gelaufen-32869720.html,https://www.stern.de/sport/fussball/werder-bremen--2022-fuer-felix-agu-gelaufen-32869720.html,0,www.stern.de,Werder Bremen: 2022 für Felix Agu gelaufen,Die aktuelle Saison verläuft für Felix Agu nicht wirklich nach Plan. Nun fällt der Youngster auch noch wochenlang aus.,https://image.stern.de/32869722/t/ub/v1/w1440/r1.7778/-/01--werder-bremen--2022-fuer-felix-agu-gelaufen--aufmacher-.jpg,2022-11-01T14:41:00Z,https://web.archive.org/web/20221101150949/https://www.stern.de/sport/fussball/werder-bremen--2022-fuer-felix-agu-gelaufen-32869720.html,"Die aktuelle Saison verläuft für Felix Agu nicht wirklich nach Plan. Nun fällt der Youngster auch noch wochenlang aus.
Die aktuelle Saison verläuft für Felix Agu nicht wirklich nach Plan. Nun fällt … [+1165 chars]",,de,'Winter'
https://www.heise.de/news/Klimaforschung-Ueberdurchschnittlicher-Temperaturanstieg-in-Europa-7327831.html,https://www.heise.de/news/Klimaforschung-Ueberdurchschnittlicher-Temperaturanstieg-in-Europa-7327831.html,0,www.heise.de,Klimaforschung: Überdurchschnittlicher Temperaturanstieg in Europa,"Von 1991 bis 2021 sind die Temperaturen in Europa durchschnittlich um 0,5 °C pro Jahrzehnt gestiegen, teilt die Weltwetterorganisation WMO mit.",https://heise.cloudimg.io/bound/1200x1200/q85.png-lossy-85.webp-lossy-85.foil1/_www-heise-de_/imgs/18/3/6/3/6/6/6/7/temp-c7f294a67d0f2e7e.jpg,2022-11-02T15:26:00Z,,"In Europa sind die Temperaturen in den vergangenen 30 Jahren mehr als doppelt so schnell gestiegen wie im globalen Durchschnitt. Das berichtet die Weltwetterorganisation (WMO) in Genf, die zusammen m… [+1912 chars]",,de,'Schnee'
https://www.tagesschau.de/wissen/klima/studie-europa-hitze-temperaturen-101.html,https://www.tagesschau.de/wissen/klima/studie-europa-hitze-temperaturen-101.html,0,www.tagesschau.de,Klima-Studie: Europa erwärmt sich besonders schnell,"Der Temperaturanstieg in Europa fällt deutlich höher aus als im Rest der Welt, warnt eine Studie. Zwischen 1991 und 2021 sei es pro Jahrzehnt um 0,5 Grad Celsius wärmer geworden. Immerhin gebe es Fortschritte bei der CO2-Reduktion.",https://www.tagesschau.de/multimedia/bilder/duerre-po-101~_v-original.jpg,2022-11-02T17:19:23Z,,"Der Temperaturanstieg in Europa fällt deutlich höher aus als im Rest der Welt, warnt eine Studie. Zwischen 1991 und 2021 sei es pro Jahrzehnt um 0,5 Grad Celsius wärmer geworden. Immerhin gebe es For… [+3021 chars]",,de,'Schnee'
https://www.sueddeutsche.de/muenchen/landkreismuenchen/spd-antrag-solarmodule-parkplaetze-1.5685963,https://www.sueddeutsche.de/muenchen/landkreismuenchen/spd-antrag-solarmodule-parkplaetze-1.5685963,0,www.sueddeutsche.de,Unterschleißheim: Solarstrom vom Parkplatz,Die SPD will die Installation von Photovoltaik-Modulen über Parkflächen prüfen lassen.,https://www.sueddeutsche.de/assets/png/sz-ecb090256670a577bd629a9718686332.png,2022-11-02T20:34:34Z,,"Was anderswo möglich ist, müsste doch auch in Unterschleißheim zu machen sein: Die SPD hat deshalb einen Prüfantrag gestellt, damit sich die Stadt mit einer Überdachung von Parkplätzen durch Photovol… [+1084 chars]",,de,'Schnee'
https://www.sueddeutsche.de/wissen/europa-klimakrise-temperaturanstieg-1.5685785,https://www.sueddeutsche.de/wissen/europa-klimakrise-temperaturanstieg-1.5685785,0,www.sueddeutsche.de,Klimakrise: Überdurchschnittlicher Temperaturanstieg in Europa,In Europa sind die Temperaturen in den vergangenen 30 Jahren mehr als doppelt so schnell gestiegen wie im globalen Durchschnitt.,https://www.sueddeutsche.de/image/sz.1.5631377/1200x675?v=1667396236,2022-11-02T14:13:39Z,,In Europa sind die Temperaturen in den vergangenen 30 Jahren mehr als doppelt so schnell gestiegen wie im globalen Durchschnitt.In Europa sind die Temperaturen in den vergangenen 30 Jahren mehr als d… [+1545 chars],,de,'Schnee'
https://efahrer.chip.de/news/x-e-autos-im-schnee-getestet-so-schlagen-sich-tesla-kia-ev6-bmw-i4-co_1010031,https://efahrer.chip.de/news/x-e-autos-im-schnee-getestet-so-schlagen-sich-tesla-kia-ev6-bmw-i4-co_1010031,0,efahrer.chip.de,"7 E-Autos im Schnee getestet: So schlagen sich Tesla, KIA EV6, BMW i4 & Co.",Wie kommen moderne Stromer mit Allrad eigentlich mit Schnee und Eis zu Recht? Funktioniert der Allradantrieb trotz anderer Kraftübertragung so gut wie bei Verbrennern? Diesen Fragen widmet sich ein aktueller Test.,https://im-efahrer.chip.de/files/kiaev6-635e3cf271241.jpg?imPolicy=IfOrientation&width=1200&height=630&color=%23000000&hash=f7dca80d55aaf3086c23abbe2da7a64348a39e50f100f59ec69ad9f8bce45d29,2022-11-02T16:02:00Z,https://web.archive.org/web/20221031075049/https://efahrer.chip.de/news/x-e-autos-im-schnee-getestet-so-schlagen-sich-tesla-kia-ev6-bmw-i4-co_1010031,Wie kommen moderne Stromer mit Allrad eigentlich mit Schnee und Eis zu Recht? Funktioniert der Allradantrieb trotz anderer Kraftübertragung so gut wie bei Verbrennern? Diesen Fragen widmet sich ein a… [+7812 chars],,de,'Schnee'
