index,url,valid,domain,title,description,image,published,archive,content,quote,language,keyword
https://www.stern.de/wirtschaft/news/energie--reiche-zu-gasspeichern---sorgen-sind-nicht-angebracht--37096124.html,https://www.stern.de/wirtschaft/news/energie--reiche-zu-gasspeichern---sorgen-sind-nicht-angebracht--37096124.html,0,www.stern.de,"Energie: Reiche zu Gasspeichern: ""Sorgen sind nicht angebracht""","Der Füllstand der Gasspeicher liegt bei 35 Prozent. Warum Wirtschaftsministerin Katherina Reiche dennoch überzeugt ist, dass Deutschland gut durch den Winter kommt.",https://image.stern.de/37096126/t/dh/v1/w1440/r1.7778/-/01--obwdalkcwcv3axs2048jpeg---8ff2bfca91c0c570.jpg,2026-02-01T11:24:04Z,,"Kopiere den aktuellen Link
Zur Merkliste hinzufügen
Der Füllstand der Gasspeicher liegt bei 35 Prozent. Warum Wirtschaftsministerin Katherina Reiche dennoch überzeugt ist, dass Deutschland gut durc… [+605 chars]",,de,'Gasspeicher'
https://taz.de/Proteste-zu-Iran/!6150317/,https://taz.de/Proteste-zu-Iran/!6150317/,0,taz.de,Proteste zu Iran: Gespaltenes Exil,Mehrere Demos und eine Videoaktion mit Projektionen auf öffentliche Gebäude prangern die Gewalt des Mullah-Regimes im Iran an.,https://taz.de/picture/8223069/1200/JPEG-image-408F-8B76-AF-0.jpeg,2026-02-01T14:35:00Z,,Mehrere Demos und eine Videoaktion mit Projektionen auf öffentliche Gebäude prangern die Gewalt des Mullah-Regimes im Iran an. mehr...,,de,'öffentliche Gebäude'
https://www.faz.net/aktuell/karriere-hochschule/psychologe-hannes-zacher-warnt-vor-generationenlabels-accg-110826809.html,https://www.faz.net/aktuell/karriere-hochschule/psychologe-hannes-zacher-warnt-vor-generationenlabels-accg-110826809.html,0,www.faz.net,Psychologie-Professor warnt: „Generationen sind Erfindungen der Generationenindustrie“,"Generation X, Y, Z oder Alpha: Solche Labels sind unwissenschaftlich, sagt Hannes Zacher. Ältere dichteten Jüngeren negative Eigenschaften an, um sich selbst aufzuwerten. Arbeitgeber sollten dem keine Beachtung schenken.",https://media0.faz.net/image/w1200h627/ef9e118a49b3/w6720h3511x0y484o/202504/43601.0.971728233/wer-gehoert-hier-zu-welcher.webp,2026-02-02T07:29:06Z,,"Herr Zacher, viel ist von der Generation Y, der GenZ und nun der Generation Alpha die Rede. Fallen Ihnen typische Eigenschaften dieser Generationen ein? 
Ungern. Ich verwende solche Labels nicht, we… [+10623 chars]",,de,'Ältere Generation'
https://www.zeit.de/news/2026-02/03/vorsorge-untersuchungen-auch-fuer-jugendliche,https://www.zeit.de/news/2026-02/03/vorsorge-untersuchungen-auch-fuer-jugendliche,0,www.zeit.de,Kinder-Gesundheit: Vorsorge-Untersuchungen auch für Jugendliche,Hier finden Sie Informationen zu dem Thema „Kinder-Gesundheit“. Lesen Sie jetzt „Vorsorge-Untersuchungen auch für Jugendliche“.,https://img.zeit.de/news/2026-02/03/vorsorge-untersuchungen-auch-fuer-jugendliche-image-group/wide__1300x731,2026-02-03T03:00:38Z,,"Das Land Hessen will erreichen, dass mehr Eltern mit ihren Kindern zur Jugendvorsorge-Untersuchung J1 gehen. Um die Teilnahmequote zu steigern, sollen die Familien künftig persönlich eingeladen werde… [+1777 chars]",,de,'Kinder'
https://www.nzz.ch/zuerich/altes-kispi-areal-wird-wohl-noch-jahrelang-leer-stehen-widerstand-im-quartier-ld.1922875,https://www.nzz.ch/zuerich/altes-kispi-areal-wird-wohl-noch-jahrelang-leer-stehen-widerstand-im-quartier-ld.1922875,0,www.nzz.ch,"Weil sich der Bau des Zentrums für Zahnmedizin verzögert, wird das ehemalige Kinderspital jahrelang leer stehen – das sorgt für Kritik im Quartier",Auf dem Areal sind Asylunterkünfte geplant. Andere Nutzungen wären aufwendig.,"https://img.nzz.ch/2024/11/02/3619b258-c511-4cd5-8e09-c270be86da69.jpeg?width=1200&height=674&fit=bounds&quality=75&auto=webp&crop=4418,2485,x0,y230&wmark=nzz",2026-02-03T04:05:00Z,,"Auf dem Areal sind Asylunterkünfte geplant. Andere Nutzungen wären aufwendig.
Das Kinderspital steht leer. Für viele Quartierbewohner ist das eine unbefriedigende Situation.
Am Fuss des Zürichbergs… [+5052 chars]",,de,'öffentliche Gebäude'
https://www.focus.de/panorama/richterin-will-chef-entfuehrer-aufrufen-ploetzlich-ergreift-christina-block-das-wort_7c90a6ab-fdcd-499e-9651-4d43bd9d6199.html,https://www.focus.de/panorama/richterin-will-chef-entfuehrer-aufrufen-ploetzlich-ergreift-christina-block-das-wort_7c90a6ab-fdcd-499e-9651-4d43bd9d6199.html,0,www.focus.de,In Block-Verhandlung kommt erneut der Kronzeuge in die Mangel,Ende April 2025 hatte die Staatsanwaltschaft Hamburg Anklage wegen der mutmaßlichen Entführung der Kinder aus Dänemark in der Nacht zum 1. Januar 2024 erhoben. Alle News zum Block-Prozess im Liveticker.,https://quadro.burda-forward.de/ctf/024f8251-7657-4851-a8f2-43c61f69e15c.c9e58c6e-8393-410f-84dc-153b6fa2af27.jpeg?im=RegionOfInterestCrop%3D%281200%2C630%29%2CregionOfInterest%3D%281430%2C418%29&hash=05055f03c4155a9979393d072fcd12f58626b48624f803c28d7e3b23c6b8935d,2026-02-03T09:56:00Z,,"FOCUS-online-Reporter Niklas Golitschek ist vor Ort beim Prozess in Hamburg.
Wichtige Protagonisten:
<ul><li>Christina Block, Angeklagte (Anwälte Ingo Bott &amp; Paula Wlodarek)</li><li>Stephan Hen… [+190786 chars]",,de,'Kinder'
https://www.zeit.de/news/2026-02/03/nach-tod-in-gartenlaube-gas-vergiftung-bestaetigt,https://www.zeit.de/news/2026-02/03/nach-tod-in-gartenlaube-gas-vergiftung-bestaetigt,0,www.zeit.de,Kohlenstoffmonoxid: Nach Tod in Gartenlaube: Gas-Vergiftung bestätigt,Hier finden Sie Informationen zu dem Thema „Kohlenstoffmonoxid“. Lesen Sie jetzt „Nach Tod in Gartenlaube: Gas-Vergiftung bestätigt“.,https://img.zeit.de/news/2026-02/03/nach-tod-in-gartenlaube-gas-vergiftung-bestaetigt-image-group/wide__1300x731,2026-02-03T13:26:43Z,,Nach dem Tod von zwei Menschen in einer Kleingartenanlage in Schwedt/Oder hat sich der Verdacht einer Kohlenstoffmonoxid-Vergiftung als Todesursache bestätigt. Die Untersuchung der Toten habe das erg… [+626 chars],,de,'Kohle'
https://www.tagesspiegel.de/berlin/kohlenstoffmonoxid-nach-tod-in-gartenlaube-gas-vergiftung-bestatigt-15212997.html,https://www.tagesspiegel.de/berlin/kohlenstoffmonoxid-nach-tod-in-gartenlaube-gas-vergiftung-bestatigt-15212997.html,0,www.tagesspiegel.de,Kohlenstoffmonoxid: Nach Tod in Gartenlaube: Gas-Vergiftung bestätigt,Vor einigen Wochen wurden zwei Menschen tot in einer Gartenlaube in Schwedt gefunden. Nun steht die Todesursache fest.,https://www.tagesspiegel.de/images/15212996/alternates/BASE_16_9_W1400/1770125569000/polizei-symbolbild.jpeg,2026-02-03T13:32:49Z,,Nach dem Tod von zwei Menschen in einer Kleingartenanlage in Schwedt/Oder hat sich der Verdacht einer Kohlenstoffmonoxid-Vergiftung als Todesursache bestätigt. Die Untersuchung der Toten habe das erg… [+678 chars],,de,'Kohle'
https://taz.de/Gasbohrungen-vor-Borkum/!6150834/,https://taz.de/Gasbohrungen-vor-Borkum/!6150834/,0,taz.de,Gasbohrungen vor Borkum: Der Ministerpräsident und die Gas-Lobby,"Neue Runde im Tauziehen um die Bohrungen vor Borkum: Umweltverbände werfen Olaf Lies (SPD) vor, sich mit dem Gasförderer gemein zu machen.",https://taz.de/picture/8227121/1200/406821904.jpeg,2026-02-03T16:44:00Z,,"Neue Runde im Tauziehen um die Bohrungen vor Borkum: Umweltverbände werfen Olaf Lies (SPD) vor, sich mit dem Gasförderer gemein zu machen. mehr...",,de,'Gas'
https://www.faz.net/aktuell/wirtschaft/mehr-wirtschaft/sinkende-oeleinnahmen-russlands-haushaltsnoete-wachsen-110830710.html,https://www.faz.net/aktuell/wirtschaft/mehr-wirtschaft/sinkende-oeleinnahmen-russlands-haushaltsnoete-wachsen-110830710.html,0,www.faz.net,Sinkende Öleinnahmen: Russlands Haushaltsnöte wachsen,Der Kreml verdient immer weniger Geld mit dem Öl- und Gasverkauf. Nun droht mit Indien einer der wichtigsten verbliebenen Kunden wegzubrechen.,https://media0.faz.net/image/w1200h627/3fbbb9e26ff4/w3000h1567x0y159o/022025/1.10830707/eine-nicht-unkomplizierte.webp,2026-02-03T18:10:21Z,,Schon das vergangene Jahr war kein gutes für den russischen Haushalt. Um knapp 24 Prozent brachen die Öl- und Gaseinnahmen im Vergleich zu 2024 ein. Dieses Jahr könnte sich die Lage noch einmal versc… [+6683 chars],,de,'Gas'
https://www.zeit.de/news/2026-02/05/tausende-strom-und-gassperren-in-berlin,https://www.zeit.de/news/2026-02/05/tausende-strom-und-gassperren-in-berlin,0,www.zeit.de,Energie: Tausende Strom- und Gassperren in Berlin,Hier finden Sie Informationen zu dem Thema „Energie“. Lesen Sie jetzt „Tausende Strom- und Gassperren in Berlin“.,https://img.zeit.de/news/2026-02/05/tausende-strom-und-gassperren-in-berlin-image-group/wide__1300x731,2026-02-05T11:33:08Z,,Wegen offener Rechnungen haben Versorger im vergangenen Jahr Tausenden Berliner Haushalten Strom oder Gas abstellen lassen. Das geht aus Antworten der Wirtschaftsverwaltung auf entsprechende parlamen… [+2161 chars],,de,'Gas'
