index,url,valid,domain,title,description,image,published,archive,content,quote,language,keyword
https://www.focus.de/politik/ausland/kiewer-aerztin-schlaegt-alarm-putins-attacken-loesen-massive-grippewelle-aus_b1d83dbf-2266-4a03-9f2b-d905a2d414cc.html,https://www.focus.de/politik/ausland/kiewer-aerztin-schlaegt-alarm-putins-attacken-loesen-massive-grippewelle-aus_b1d83dbf-2266-4a03-9f2b-d905a2d414cc.html,0,www.focus.de,Kiewer Ärztin schlägt Alarm: Putins Attacken lösen massive Grippewelle aus,Die russischen Luftangriffe gegen die Energieinfrastruktur der Ukraine sorgen für gesundheitliche Probleme bei der Zivilbevölkerung. Eine Kiewer Ärztin warnt vor steigenden Infektionszahlen.,https://quadro.burda-forward.de/ctf/ced4a5e2-d3ca-4728-b868-389aca18c466.3dffad36-1d39-469b-b613-01d69e162f73.jpeg?im=RegionOfInterestCrop%3D%281200%2C630%29%2CregionOfInterest%3D%281024%2C683%29&hash=f0fb6500f6ca735f5f9cc8aa88bb7f53340a40e017e622d8cab496fc37508fbe,2026-02-10T07:56:00Z,,Russische Angriffe führen seit Monaten zu großflächigen Ausfällen der Heiz- und Stromversorgung in der gesamten Ukraine. Das hat neben den unmittelbaren Gefahren durch die Bombardierungen auch gesund… [+1623 chars],,de,'Grippe'
https://www.welt.de/politik/deutschland/plus698ad8c7b08ffe5b8f60b688/formular-des-auswaertigen-amts-mann-als-leibliche-mutter-jetzt-liefert-eine-berliner-behoerde-die-bemerkenswerte-erklaerung.html,https://www.welt.de/politik/deutschland/plus698ad8c7b08ffe5b8f60b688/formular-des-auswaertigen-amts-mann-als-leibliche-mutter-jetzt-liefert-eine-berliner-behoerde-die-bemerkenswerte-erklaerung.html,0,www.welt.de,Mann als „leibliche Mutter“? Jetzt liefert eine Berliner Behörde die bemerkenswerte Erklärung,"Ein Formular des Auswärtigen Amts bietet die Option, dass eine „leibliche Mutter“ ihr Geschlecht zum Zeitpunkt der Geburt des Kindes als „männlich“ angeben kann. Entwickelt wurde das Papier vom Standesamt I Berlin. Auf WELT-Anfrage erklärt die Behörde, was da…",https://images.welt.de/698ad8c7b08ffe5b8f60b688/9b95abce5720de3b2f22c432313b5373/ci16x9-w1200/dwosb-ip-geschlecht-mutter-ks-jpg,2026-02-10T12:11:06Z,,"Ein Formular des Auswärtigen Amts bietet die Option, dass eine leibliche Mutter ihr Geschlecht zum Zeitpunkt der Geburt des Kindes als männlich angeben kann. Entwickelt wurde das Papier vom Standesam… [+68 chars]",,de,'Geschlecht'
https://www.stern.de/gesundheit/dating--junge-frauen-setzen-vermehrt-auf-abstinenz-von-maennern-34598368.html,https://www.stern.de/gesundheit/dating--junge-frauen-setzen-vermehrt-auf-abstinenz-von-maennern-34598368.html,0,www.stern.de,"Datingtrend gegen das Daten: #boysober: Immer mehr junge Frauen schwören aufs ""Entgiften"" von Männern","Schwere Zeiten für Männer. Ein neuer Datingtrend sorgt dafür, dass mehr und mehr Frauen dem anderen Geschlecht abschwören. Der Entzug soll das mentale Wohlbefinden steigern.",https://image.stern.de/34600094/t/Fa/v3/w1440/r1.7778/-/datingtrend-frauen-allein.jpg,2026-02-10T13:20:00Z,,"Kopiere den aktuellen Link
Zur Merkliste hinzufügen
Schwere Zeiten für Männer. Ein neuer Datingtrend sorgt dafür, dass mehr und mehr Frauen dem anderen Geschlecht abschwören. Der Entzug soll das me… [+4407 chars]",,de,'Geschlecht'
https://www.tagesspiegel.de/sport/habe-keine-korperlichen-vorteile-erster-trans-athlet-bei-olympischen-winterspielen--aufschrei-bleibt-aus-15237727.html,https://www.tagesspiegel.de/sport/habe-keine-korperlichen-vorteile-erster-trans-athlet-bei-olympischen-winterspielen--aufschrei-bleibt-aus-15237727.html,0,www.tagesspiegel.de,„Habe keine körperlichen Vorteile“: Erster trans Athlet bei Olympischen Winterspielen – Aufschrei bleibt aus,"Ski-Freestyler Elis Lundholm identifiziert sich als Mann, startet in Italien aber in der Frauenkategorie. Das Thema Geschlecht polarisiert bei Olympia immer wieder – doch diesmal liegt der Fall anders.",https://www.tagesspiegel.de/images/15237695/alternates/BASE_16_9_W1400/1770742892000/260208-elis-lundholm-of-the-swedish-national-freestyle-skiing-moguls-team-poses-for-a-portrait-at-a-press-event-during-d.jpeg,2026-02-10T17:23:07Z,,"Es ist eine kleine Premiere: Bei den Olympischen Winterspielen geht am Mittwoch zum ersten Mal ein Athlet an den Start, der offen trans ist. Der schwedische Ski-Freestyler Elis Lundholm muss auf der … [+4569 chars]",,de,'Geschlecht'
https://netzpolitik.org/2026/selbstbestimmungsgesetz-in-baden-wuerttemberg-die-automatische-datenweitergabe-ist-ein-skandal/,https://netzpolitik.org/2026/selbstbestimmungsgesetz-in-baden-wuerttemberg-die-automatische-datenweitergabe-ist-ein-skandal/,0,netzpolitik.org,Selbstbestimmungsgesetz in Baden-Württemberg: „Die automatische Datenweitergabe ist ein Skandal“,"Was wurde aus dem Selbstbestimmungsgesetz? In Bayern und nun auch in Baden-Württemberg sollen frühere Vornamen und Geschlechtseintrag an die Polizeibehörden übermittelt werden. – Alle Rechte vorbehalten IMAGO / Bernd Elmenthaler
Eigentlich sollte das Selbstb…",https://cdn.netzpolitik.org/wp-upload/2026/02/imago444459963-1200x675.jpg,2026-02-10T18:19:29Z,,Menschen in Deutschland können seit inzwischen mehr als einem Jahr den Geschlechtseintrag und Vornamen ohne fremde Begutachtung dem gelebten Geschlecht anpassen. Seit dieser Zeit ist das Selbstbestim… [+11834 chars],,de,'Geschlecht'
https://www.focus.de/panorama/welt/frau-bekommt-job-absage-von-feuerwehr-die-muss-ihr-nun-8000-euro-entschaedigung-zahlen_8ac38439-cc15-4a8e-8f25-7de20a5d7d7c.html,https://www.focus.de/panorama/welt/frau-bekommt-job-absage-von-feuerwehr-die-muss-ihr-nun-8000-euro-entschaedigung-zahlen_8ac38439-cc15-4a8e-8f25-7de20a5d7d7c.html,0,www.focus.de,Frau bekommt Job-Absage von Feuerwehr – die muss ihr nun 8000 Euro Entschädigung zahlen,Ein Fitnesstest für Feuerwehr-Bewerber sorgt für Ärger. Eine Frau erhält 8000 Euro Entschädigung wegen Alters- und Geschlechterdiskriminierung.,https://quadro.burda-forward.de/ctf/1fb0b75c-1d0f-49b5-b8cc-ce1093fbaea4.41a90f2c-ad52-4b6c-9df9-30582b87823b.jpg?im=RegionOfInterestCrop%3D%281200%2C630%29%2CregionOfInterest%3D%28917%2C521%29&hash=a5b47b3ae429e70a563dfae9d4f343564401882bcfea3c3bf692054ba51db41c,2026-02-10T20:00:00Z,,"Der Stadtrat von Cork in Irland wurde verpflichtet, einer Bewerberin 8000 Euro Entschädigung zu zahlen, nachdem ihre Bewerbung um eine Vollzeitstelle bei der Feuerwehr abgelehnt worden war. Die Workp… [+1342 chars]",,de,'Geschlecht'
https://www.stern.de/wirtschaft/news/klimaschutz--studie--weniger-rueckhalt-fuer-die-energiewende-37125616.html,https://www.stern.de/wirtschaft/news/klimaschutz--studie--weniger-rueckhalt-fuer-die-energiewende-37125616.html,0,www.stern.de,Klimaschutz: Studie: Weniger Rückhalt für die Energiewende,Fossile Energieträger wie Kohle und Gas sollen in Deutschland schrittweise durch erneuerbare Energien ersetzt werden - für mehr Klimaschutz. Doch in der Bevölkerung gibt es Skepsis.,https://image.stern.de/37125618/t/sy/v1/w1440/r1.7778/-/11--f3o4eqiu5wv7axs2048jpeg---f5b63e677ea55fca.jpg,2026-02-11T03:00:36Z,,"Kopiere den aktuellen Link
Zur Merkliste hinzufügen
Fossile Energieträger wie Kohle und Gas sollen in Deutschland schrittweise durch erneuerbare Energien ersetzt werden - für mehr Klimaschutz. Doch… [+2397 chars]",,de,'Gas'
https://www.tagesspiegel.de/wirtschaft/klimaschutz-studie-weniger-ruckhalt-fur-die-energiewende-15238098.html,https://www.tagesspiegel.de/wirtschaft/klimaschutz-studie-weniger-ruckhalt-fur-die-energiewende-15238098.html,0,www.tagesspiegel.de,Klimaschutz: Studie: Weniger Rückhalt für die Energiewende,Fossile Energieträger wie Kohle und Gas sollen in Deutschland schrittweise durch erneuerbare Energien ersetzt werden - für mehr Klimaschutz. Doch in der Bevölkerung gibt es Skepsis.,https://www.tagesspiegel.de/images/15238097/alternates/BASE_16_9_W1400/1770778937000/windrader-hinter-solaranlagen.jpeg,2026-02-11T03:02:18Z,,"In Deutschland gibt es laut einer Umfrage in der Bevölkerung weniger Rückhalt für die Energiewende und den Klimaschutz. Der Anteil derer, die sich große Sorgen über die Folgen des Klimawandels machen… [+2256 chars]",,de,'Gas'
https://www.zeit.de/news/2026-02/11/entstehung-von-moral-wie-gehen-kinder-mit-bestechung-um,https://www.zeit.de/news/2026-02/11/entstehung-von-moral-wie-gehen-kinder-mit-bestechung-um,0,www.zeit.de,Psychologie der Korruption: Entstehung von Moral: Wie gehen Kinder mit Bestechung um,Hier finden Sie Informationen zu dem Thema „Psychologie der Korruption“. Lesen Sie jetzt „Entstehung von Moral: Wie gehen Kinder mit Bestechung um“.,https://img.zeit.de/news/2026-02/11/entstehung-von-moral-wie-gehen-kinder-mit-bestechung-um-image-group/wide__1300x731,2026-02-11T04:00:12Z,,"Kinder reagieren auf Bestechung je nach Alter unterschiedlich. Einer Studie zufolge lehnen Kinder Bestechung nicht von Anfang an ab, sondern diese Haltung entwickelt sich mit zunehmendem Alter. Das s… [+4383 chars]",,de,'Kinder'
https://www.faz.net/aktuell/politik/ukraine/unermuedlich-wie-arbeiter-in-der-ukraine-die-kraftwerke-reparieren-accg-110834930.html,https://www.faz.net/aktuell/politik/ukraine/unermuedlich-wie-arbeiter-in-der-ukraine-die-kraftwerke-reparieren-accg-110834930.html,0,www.faz.net,Ukrainische Kraftwerksarbeiter: Sie kämpfen um jede Kilowattstunde,"Bei klirrender Kälte greift Russland in der Ukraine Wärme- und Stromkraftwerke an. Die Arbeiter dort reparieren im Akkord, obwohl jederzeit der nächste Angriff folgen kann.",https://media0.faz.net/image/w1200h627/918c5f605b4a/w3000h1567x0y388o/022026/1.10834929/raeumt-auf-mitarbeiter-jewhen.webp,2026-02-11T10:27:26Z,,"Von dort, wo Jewhen normalerweise arbeitet, bietet sich ein Bild der Verwüstung. Das Dach des Kraftwerks ist teilweise eingestürzt. Stahlträger liegen verkeilt über Turbinen, abgebrochene Betonsäulen… [+9267 chars]",,de,'Kälte'
https://www.bild.de/sport/olympia/monatsgehaelter-unserer-olympia-stars-enthuellt-gold-helden-liegen-zwischen-9-000-18-000-euro-top-verdiener-kriegt-1-16-mio-698c1fcc332510962831e153,https://www.bild.de/sport/olympia/monatsgehaelter-unserer-olympia-stars-enthuellt-gold-helden-liegen-zwischen-9-000-18-000-euro-top-verdiener-kriegt-1-16-mio-698c1fcc332510962831e153,0,www.bild.de,"Top-Verdiener kriegt 1,16 Mio. - Monatsgehälter unserer Olympia-Stars enthüllt","So groß war das Geld-Gefälle im deutschen Olympia-Team noch nie! So viel Kohle kommt durch Förderung, Preisgeld und Sponsoren zusammen.","https://images.bild.de/698c1fcc332510962831e153/640467febe6217a5909c2c3b610bd3ab,c647c4d1?w=1280",2026-02-11T11:00:42Z,,Durch die Eishockey-Profis aus der NHL sind gleich sieben Gehaltsmillionäre bei den Winterspielen dabei. Von solchen Einnahmen können die meisten deutschen Olympia-Teilnehmer nur träumen. Die Mehrhei… [+233 chars],,de,'Kohle'
https://www.n-tv.de/politik/Russischer-Drohnenangriff-in-Bohoduchiw-Drei-Kinder-und-Vater-getoetet-id30349834.html,https://www.n-tv.de/politik/Russischer-Drohnenangriff-in-Bohoduchiw-Drei-Kinder-und-Vater-getoetet-id30349834.html,0,www.n-tv.de,Schwangere Mutter überlebt: Russische Drohne tötet drei Kinder und den Vater,"Bei einem russischen Angriff in der Ostukraine wird ein Wohnhaus zerstört, eine Familie fast vollständig ausgelöscht. Wie die Behörden berichten, wird die schwangere Mutter lebend aus den Trümmern gerettet. Auch die Stadt Saporischschja wird offenbar nicht ve…",https://www.n-tv.de/img/30350246/1770806480/Img_16_9/1200/RUSSIA-JANUARY-28-2026-A-FPV-drone-is-used-by-Russia-s-Dnepr-Group-of-Forces-on-the-Zaporozhye-front-of-Russia-s-special-military-operation-Credit-Image-Alexander-Polegenko-TASS-via-ZUMA-Press.jpg,2026-02-11T11:10:00Z,,"Tag für Tag töten russische Drohnen Zivilisten in der Ukraine. (Foto: picture alliance / ZUMAPRESS.com)
Bei einem russischen Angriff in der Ostukraine wird ein Wohnhaus zerstört, eine Familie fast v… [+1526 chars]",,de,'Schwangere'
https://www.n-tv.de/wissen/Sind-Kinder-schon-bestechlich-id30350320.html,https://www.n-tv.de/wissen/Sind-Kinder-schon-bestechlich-id30350320.html,0,www.n-tv.de,Moral bei Minderjährigen: Sind Kinder schon bestechlich?,Korruption ist in vielen Ländern der Welt ein großes Problem und betrifft natürlich in erster Linie Amtsträger. Aber sind eigentlich auch bereits Kinder für Bestechung anfällig? Eine internationale Studie hat das nun untersucht - und auch die Rolle von Alter …,https://www.n-tv.de/img/30350597/1770810322/Img_16_9/1200/ILLUSTRATION-Ein-kleines-Maedchen-und-seine-Mutter-sitzen-am-11-08-2021-in-Weyhe-Niedersachsen-vor-Geldscheinen-gestellte-Szene.jpg,2026-02-11T11:29:02Z,,"Moral bei MinderjährigenSind Kinder schon bestechlich?
Um die Entwicklung von Bestechlichkeit im Kindesalter zu untersuchen, wurde ein Malwettbewerb veranstaltet - und auch Geld spielte eine Rolle. … [+4889 chars]",,de,'ältere Mensch'
https://t3n.de/news/amazon-plant-content-marktplatz-publisher-sollen-fuer-ki-training-bezahlt-werden-1729129/,https://t3n.de/news/amazon-plant-content-marktplatz-publisher-sollen-fuer-ki-training-bezahlt-werden-1729129/,0,t3n.de,Content gegen Kohle fürs KI-Training: Amazon könnte AI Marketplace für Publisher starten,"Bei Amazon können Publisher möglicherweise bald nach Microsofts Vorbild für Content entlohnt werden, der für das KI-Training genutzt wird. Doch die Entwicklung kommt reichlich spät.",https://onlinemarketing.de/wp-content/uploads/2023/04/Titelbild-neu-53.png,2026-02-11T11:34:00Z,,"Unternehmen wie OpenAI, Google und Co. haben bereits eine Reihe von isolierten Deals mit Publishern oder Content-Plattformen wie Reddit abgeschlossen, um journalistische Inhalte oder User-Generated C… [+4315 chars]",,de,'Kohle'
https://hallespektrum.de/aktuelles/energiepreise-in-sachsen-anhalt-ruecklaeufig-langfristiger-vergleich-zeigt-jedoch-deutliche-belastungen/475296/,https://hallespektrum.de/aktuelles/energiepreise-in-sachsen-anhalt-ruecklaeufig-langfristiger-vergleich-zeigt-jedoch-deutliche-belastungen/475296/,0,hallespektrum.de,Energiepreise in Sachsen-Anhalt rückläufig – Langfristiger Vergleich zeigt jedoch deutliche Belastungen,"Die Preise für Haushaltsenergien in Sachsen-Anhalt sind im Januar 2026 im Vergleich zum Vorjahresmonat um insgesamt 4,1 Prozent gesunken. Trotz winterlicher Temperaturen verbilligten sich nahezu alle Energieträger: Strom um 4,6 Prozent, Kohle um 4,3 Prozent, …",https://hallespektrum.de/wp-content/uploads/2025/12/analog_film_photo_of_a_typical_German_garden_gnome_sitting_in_his_cosy_living_room_in_front_of_a_war_1056640118.jpg,2026-02-11T11:55:38Z,,"Die Preise für Haushaltsenergien in Sachsen-Anhalt sind im Januar 2026 im Vergleich zum Vorjahresmonat um insgesamt 4,1 Prozent gesunken. Trotz winterlicher Temperaturen verbilligten sich nahezu alle… [+1401 chars]",,de,'Kohle'
https://www.zeit.de/news/2026-02/13/dwd-kaelte-und-glaette-kehren-nach-nrw-zurueck,https://www.zeit.de/news/2026-02/13/dwd-kaelte-und-glaette-kehren-nach-nrw-zurueck,0,www.zeit.de,Glatte Straßen: DWD: Kälte und Glätte kehren nach NRW zurück,Hier finden Sie Informationen zu dem Thema „Glatte Straßen“. Lesen Sie jetzt „DWD: Kälte und Glätte kehren nach NRW zurück“.,https://img.zeit.de/news/2026-02/13/dwd-kaelte-und-glaette-kehren-nach-nrw-zurueck-image-group/wide__1300x731,2026-02-13T04:50:13Z,,Die Temperaturen fallen in Nordrhein-Westfalen nach zwei wärmeren Tagen wieder stark ab. Dies geht aus Prognosen des Deutschen Wetterdienstes (DWD) hervor. Der Freitag bleibt demnach zunächst verregn… [+850 chars],,de,'Kälte'
https://www.zeit.de/news/2026-02/13/exxonmobil-beschaeftigte-arbeiten-wieder-unter-tarifvertraegen,https://www.zeit.de/news/2026-02/13/exxonmobil-beschaeftigte-arbeiten-wieder-unter-tarifvertraegen,0,www.zeit.de,Öl und Gas: ExxonMobil-Beschäftigte arbeiten wieder unter Tarifverträgen,Hier finden Sie Informationen zu dem Thema „Öl und Gas“. Lesen Sie jetzt „ExxonMobil-Beschäftigte arbeiten wieder unter Tarifverträgen“.,https://img.zeit.de/news/2026-02/13/exxonmobil-beschaeftigte-arbeiten-wieder-unter-tarifvertraegen-image-group/wide__1300x731,2026-02-13T15:12:01Z,,"Die Mitarbeiter des Öl- und Gaskonzerns ExxonMobil arbeiten in Deutschland wieder unter Tarifverträgen. Der US-Konzern und die Industriegewerkschaft Bergbau, Chemie, Energie (IG BCE) haben sich schon… [+746 chars]",,de,'Gas'
