index,url,valid,domain,title,description,image,published,archive,content,quote,language,keyword
https://www.bild.de/bild-plus/sport/fussball/hsv/hsv-deutlich-mehr-kohle-da-etat-fuer-die-1-liga-enthuellt-82746354.bild.html,https://www.bild.de/bild-plus/sport/fussball/hsv/hsv-deutlich-mehr-kohle-da-etat-fuer-die-1-liga-enthuellt-82746354.bild.html,0,www.bild.de,*** BILDplus Inhalt *** Deutlich mehr Kohle da - HSV-Etat für die 1. Liga enthüllt,Der HSV plant erstklassig! Beim Aufstieg hätte der Nord-Klub richtig Kohle zur Verfügung.Foto: Christian Charisius/dpa,"https://images.bild.de/63d9421778d320538af12a07/d13d0a109e05e67aeb46441c24812d30,5092acd0?w=1280",2023-02-01T03:00:42Z,https://web.archive.org/web/20230201041503/https://www.bild.de/bild-plus/sport/fussball/hsv/hsv-deutlich-mehr-kohle-da-etat-fuer-die-1-liga-enthuellt-82746354.bild.html,"Der HSV plant erstklassig!
Schon jetzt steht fest: Sollte der Nord-Klub aufsteigen, würde der Etat für die Rückkehr ins Oberhaus richtig aufgestockt werden.
Vor allem Sportvorstand Jonas Boldt (41)… [+169 chars]",,de,'Kohle'
https://www.handelsblatt.com/unternehmen/energie/bericht-auch-bei-frueherem-kohleausstieg-stromversorgung-laut-bundesnetzagentur-sicher/28955834.html,https://www.handelsblatt.com/unternehmen/energie/bericht-auch-bei-frueherem-kohleausstieg-stromversorgung-laut-bundesnetzagentur-sicher/28955834.html,0,www.handelsblatt.com,Bericht: Auch bei früherem Kohleausstieg Stromversorgung laut Bundesnetzagentur sicher,Auch bei einem vollständigen vorgezogenen Kohleausstieg bis 2030 wäre eine sichere Stromversorgung gewährleistet. Der Bericht wird nun dem Kabinett vorgelegt.,https://www.handelsblatt.com/images/kohleabbau/28955852/2-format2003.jpg,2023-02-01T03:42:00Z,https://web.archive.org/web/20230201042536/https://www.handelsblatt.com/unternehmen/energie/bericht-auch-bei-frueherem-kohleausstieg-stromversorgung-laut-bundesnetzagentur-sicher/28955834.html,"KohleabbauAuch ohne Kohle ab 2030 ist die Stromversorgung gesichert.
(Foto: dpa)
Berlin Die Bundesnetzagentur kommt zu dem Schluss, dass auch bei einem vorgezogenen Kohleausstieg bis 2030 die Strom… [+2190 chars]",,de,'Kohle'
https://www.bild.de/bild-plus/regional/frankfurt/frankfurt-aktuell/wiesbaden-nach-alarm-im-harz-ist-hessen-fuer-einen-blackout-geruestet-82741868.bild.html,https://www.bild.de/bild-plus/regional/frankfurt/frankfurt-aktuell/wiesbaden-nach-alarm-im-harz-ist-hessen-fuer-einen-blackout-geruestet-82741868.bild.html,0,www.bild.de,*** BILDplus Inhalt *** Nach Alarm im Harz - Ist Hessen für einen Blackout gerüstet?,Kein Strom. Stundenlang! Ist Hessen für einen Blackout wie im Harz gerüstet?Foto: picture alliance / ASSOCIATED PRESS,"https://images.bild.de/63d9052e3670f04a575be676/89fa4279ebc825b7b740a7efef5678c3,c225dabc?w=1280",2023-02-01T05:01:16Z,https://web.archive.org/web/20230201053816/https://www.bild.de/bild-plus/regional/frankfurt/frankfurt-aktuell/wiesbaden-nach-alarm-im-harz-ist-hessen-fuer-einen-blackout-geruestet-82741868.bild.html,"Kein Strom. Stundenlang! Ist Hessen für einen Blackout wie im Harz gerüstet?
Fakt ist: Wirtschafts-Minister Tarek Al-Wazir (52, Grüne) hat Vorsichtsmaßnahmen für den Ernstfall treffen lassen.
Lesen… [+64 chars]",,de,'Blackout'
https://www.diepresse.com/6245611/gasverbrauch-in-oesterreich-im-dezember-um-107-prozent-gesunken,https://www.diepresse.com/6245611/gasverbrauch-in-oesterreich-im-dezember-um-107-prozent-gesunken,0,www.diepresse.com,"Gasverbrauch in Österreich im Dezember um 10,7 Prozent gesunken","Trotz niedriger Temperaturen ist der Gasverbrauch im Vergleich zum Vorjahr gesunken. Der Stromverbrauch ist ebenfalls, wenn auch nicht ganz so deutlich, zurückgegangen.",https://www.diepresse.com/assets_v2/images/diepresse_nachrichten.png,2023-02-01T05:31:00Z,https://web.archive.org/web/20230203020817/https://www.diepresse.com/6245611/gasverbrauch-in-oesterreich-im-dezember-um-107-prozent-gesunken,"Trotz niedriger Temperaturen ist der Gasverbrauch im Vergleich zum Vorjahr gesunken. Der Stromverbrauch ist ebenfalls, wenn auch nicht ganz so deutlich, zurückgegangen.
Der Verbrauch von Gas und Str… [+1311 chars]",,de,'Gas'
https://orf.at/stories/3303454/,https://orf.at/stories/3303454/,0,orf.at,"Gasverbrauch im Dezember um 10,7 Prozent unter Vorjahr",,https://orf.at/mojo/1_4_1/storyserver//news/common/images/og-fallback-news.png,2023-02-01T05:43:15Z,https://web.archive.org/web/20230201054927/https://orf.at/stories/3303454/,"Der Verbrauch von Gas und Strom ist zum Jahresende weiter gesunken. Der Gasverbrauch ist im Dezember im Vergleich zum Vorjahresmonat trotz durchschnittlich niedrigerer Temperaturen um 10,7 Prozent ge… [+961 chars]",,de,'Gasspeicher'
https://www.morgenpost.de/wirtschaft/article237518181/verpuffung-gasspeicheranlage-zwischenfall-rehden.html,https://www.morgenpost.de/wirtschaft/article237518181/verpuffung-gasspeicheranlage-zwischenfall-rehden.html,0,www.morgenpost.de,Erdgas: Verpuffung: Deutschlands größte Gasspeicheranlage gestoppt,"Der Erdgasspeicher in Rehden ist die größte Anlage in Deutschland. Am Dienstag kam es dort zu einer Verpuffung - lesen Sie hier, was das bedeutet und welche Auswirkungen das auf die Gasversorgung hat.",https://img.morgenpost.de/img/frontpage/crop237517951/609260233-w820-cv16_9-q85/erdgasspeicher-rehden-5FAC5800C47A1D2C.jpg,2023-02-01T08:51:08Z,https://web.archive.org/web/20230201093423/https://www.morgenpost.de/wirtschaft/article237518181/verpuffung-gasspeicheranlage-zwischenfall-rehden.html,Berlin/Rehden. Zwischenfall in Deutschlands größter Gasspeicheranlage: Nach einer Verpuffung musste die Einlagerung von Gas in der Einrichtung in Rehden gestoppt worden. Die Bundesnetzagentur erwarte… [+1503 chars],,de,'Gasspeicher'
https://www.telepolis.de/features/Volle-Gasspeicher-in-Deutschland-zu-welchem-Preis-7477595.html,https://www.telepolis.de/features/Volle-Gasspeicher-in-Deutschland-zu-welchem-Preis-7477595.html,0,www.telepolis.de,Volle Gasspeicher in Deutschland zu welchem Preis?,"Die kurzfristige Trennung vom russischen Gas und die folgende Sicherung der deutschen Gasversorgung hat zahlreiche bislang wenig berücksichtigte Langzeitfolgen, deren Kosten für die Endverbraucher bislang nur schwer abschätzbar sind.",https://heise.cloudimg.io/bound/1200x1200/q85.png-lossy-85.webp-lossy-85.foil1/_www-heise-de_/imgs/18/3/6/8/9/3/9/9/302b36a3775e6c28.jpeg,2023-02-01T09:00:00Z,,"Die kurzfristige Trennung vom russischen Gas und die folgende Sicherung der deutschen Gasversorgung hat zahlreiche bislang wenig berücksichtigte Langzeitfolgen, deren Kosten für die Endverbraucher bi… [+4640 chars]",,de,'Gas'
https://www.zeit.de/news/2023-02/01/kultusminister-piwarz-als-vorleser-fuer-ukrainische-kinder,https://www.zeit.de/news/2023-02/01/kultusminister-piwarz-als-vorleser-fuer-ukrainische-kinder,0,www.zeit.de,Flüchtlinge: Kultusminister Piwarz als Vorleser für ukrainische Kinder,,,2023-02-01T09:15:18Z,https://web.archive.org/web/20230201092521/https://www.zeit.de/news/2023-02/01/kultusminister-piwarz-als-vorleser-fuer-ukrainische-kinder,"When browsing with ads:
We collect personal data and also transmit it to third-party providers
 that help us improve and finance our digital content. Some of the information stored on your device, … [+732 chars]",,de,'Kinder'
https://noe.orf.at/stories/3192780/,https://noe.orf.at/stories/3192780/,0,noe.orf.at,Keine massive Grippewelle mehr befürchet,Seit Jahresbeginn gehen die Grippezahlen zurück. Auch in den vergangenen beiden Wochen wurden wieder weniger grippale Infekte und Grippefälle registriert. Von Seiten der niederösterreichischen Ärztekammer gibt es vorsichtige Entwarnung.,https://ibs.orf.at/noe?image=https%3A%2F%2Foekastatic.orf.at%2Fmims%2F2019%2F19%2F57%2Fcrops%2Fw%3D1200%2Ch%3D627%2Cq%3D75%2F145260_master_34257_grippe_apa_barbara_gindl.jpg%3Fs%3D7a3d0f6b6caaedf770695b546306f1be8deba8d6,2023-02-01T09:18:05Z,https://web.archive.org/web/20230201094043/https://noe.orf.at/stories/3192780/,In der Kalenderwoche vier wurden von der Österreichischen Gesundheitskasse (ÖGK) 9.710 grippale Infekte und Grippefälle in Niederösterreich registriert. In der Woche davor waren es noch rund 70 Fälle… [+1311 chars],,de,'Grippe'
https://www.focus.de/klima/der-welt-klima-ticker-von-focus-online-neue-studie-belegt-kohleverstromung-ist-teurer-als-wind-und-solarenergie_id_184475707.html,https://www.focus.de/klima/der-welt-klima-ticker-von-focus-online-neue-studie-belegt-kohleverstromung-ist-teurer-als-wind-und-solarenergie_id_184475707.html,0,www.focus.de,Der Welt-Klima-Ticker von FOCUS online - Neue Studie belegt: Kohleverstromung ist teurer als Wind- und Solarenergie,"Das sind die wichtigsten globalen Nachrichten des Tages zum Thema Klima und Nachhaltigkeit - kompakt, schnell und ausgewogen.",https://p6.focus.de/img/fotos/id_8269181/urn-newsml-dpa-com-20090101-180108-99-550663-large-4-3.jpg?im=Crop%3D%280%2C100%2C800%2C400%29%3BResize%3D%281200%2C627%29&hash=e20699f0f49afc289ef6811c5129c77a837cbf6305971c8eac1661cf700cde71,2023-02-01T09:59:38Z,https://web.archive.org/web/20230201154330/https://www.focus.de/klima/der-welt-klima-ticker-von-focus-online-neue-studie-belegt-kohleverstromung-ist-teurer-als-wind-und-solarenergie_id_184475707.html,"Das sind die wichtigsten globalen Nachrichten des Tages zum Thema Klima und Nachhaltigkeit - kompakt, schnell und ausgewogen.
+++ Der Welt-Klima-Ticker +++
 
Neue Studie belegt: Kohleverstromung i… [+20193 chars]",,de,'Kohle'
https://www.welt.de/wirtschaft/article243538533/Das-ist-zu-wenig-Eon-Chef-Birnbaum-fordert-Verbraucher-zum-Sparen-auf.html,https://www.welt.de/wirtschaft/article243538533/Das-ist-zu-wenig-Eon-Chef-Birnbaum-fordert-Verbraucher-zum-Sparen-auf.html,0,www.welt.de,„Das ist zu wenig“ – Eon-Chef fordert Verbraucher zum Sparen auf,Private Verbraucher haben nach Ansicht des Energieversorgers Eon in den vergangenen Monaten nicht genug Gas eingespart. Eon-Chef Leonhard Birnbaum beklagt ein falsches Gefühl der Sicherheit. Man könne nicht auf einen warmen Winter setzen.,https://img.welt.de/img/regionales/nrw/mobile243538337/3901356037-ci16x9-w1200/Leonhard-Birnbaum.jpg,2023-02-01T10:06:07Z,https://web.archive.org/web/20230202042041/http://www.welt.de/wirtschaft/article243538533/Das-ist-zu-wenig-Eon-Chef-Birnbaum-fordert-Verbraucher-zum-Sparen-auf.html,"Sein Geschäft ist Energie, doch er würde lieber weniger davon verkaufen: Der Chef des Energiekonzerns Eon Leonhard Birnbaum hat die privaten Verbraucher aufgefordert, größere Anstrengungen zum Einspa… [+1647 chars]",,de,'Gas'
https://www.bild.de/politik/inland/politik-inland/eon-chef-schlaegt-alarm-die-deutschen-sparen-zu-wenig-beim-gasverbrauch-82751626.bild.html,https://www.bild.de/politik/inland/politik-inland/eon-chef-schlaegt-alarm-die-deutschen-sparen-zu-wenig-beim-gasverbrauch-82751626.bild.html,0,www.bild.de,Eon-Chef schlägt Alarm - Die Deutschen sparen „zu wenig“ beim Gasverbrauch,"Viele Deutsche haben diesen Winter viel Energie gespart. Das reicht offenbar nicht.Foto: Hauke-Christian Dittrich/dpa, Roland Weihrauch/dpa","https://images.bild.de/63da2b523948940cb5293d5a/09f0c8e76d6356808345d9ebca304a4a,40385d83?w=1280",2023-02-01T10:36:27Z,https://web.archive.org/web/20230201110728/https://www.bild.de/politik/inland/politik-inland/eon-chef-schlaegt-alarm-die-deutschen-sparen-zu-wenig-beim-gasverbrauch-82751626.bild.html,"Viele Deutsche haben diesen Winter so viel Energie gespart wie selten zuvor.
Doch selbst das soll nicht genug sein!
Der Chef des Energiekonzerns Eon Leonhard Birnbaum hat die privaten Verbraucher a… [+1747 chars]",,de,'Gasspeicher'
https://www.sueddeutsche.de/wirtschaft/us-konzern-wolfspeed-saarland-halbleiter-chips-milliarden-1.5742589,https://www.sueddeutsche.de/wirtschaft/us-konzern-wolfspeed-saarland-halbleiter-chips-milliarden-1.5742589,0,www.sueddeutsche.de,Halbleiterindustrie: US-Konzern will Milliarden im Saarland investieren,Halbleiter statt Kohle: Der Chip-Hersteller Wolfspeed plant eine hochmoderne Fabrik in der Nähe von Saarlouis. Es soll ein Vorzeigeprojekt für den Strukturwandel werden.,https://www.sueddeutsche.de/image/sz.1.5742591/1200x675?v=1675252371,2023-02-01T11:52:52Z,http://archive.md/20230201121948/https://www.sueddeutsche.de/wirtschaft/us-konzern-wolfspeed-saarland-halbleiter-chips-milliarden-1.5742589,Halbleiter statt Kohle: Der Chip-Hersteller Wolfspeed plant eine hochmoderne Fabrik in der Nähe von Saarlouis. Es soll ein Vorzeigeprojekt für den Strukturwandel werden. Es sind Milliarden für das Sa… [+580 chars],,de,'Kohle'
https://www.zeit.de/news/2023-02/01/wohl-erstmal-keine-einlagerung-am-gasspeicher-rehden,https://www.zeit.de/news/2023-02/01/wohl-erstmal-keine-einlagerung-am-gasspeicher-rehden,0,www.zeit.de,Nach Verpuffung: Wohl erstmal keine Einlagerung am Gasspeicher Rehden,,,2023-02-01T12:11:27Z,https://web.archive.org/web/20230202080908/https://www.zeit.de/news/2023-02/01/wohl-erstmal-keine-einlagerung-am-gasspeicher-rehden,"When browsing with ads:
We collect personal data and also transmit it to third-party providers
 that help us improve and finance our digital content. Some of the information stored on your device, … [+732 chars]",,de,'Gasspeicher'
https://www.zeit.de/news/2023-02/01/sanierung-von-galeria-nimmt-wichtige-huerde,https://www.zeit.de/news/2023-02/01/sanierung-von-galeria-nimmt-wichtige-huerde,0,www.zeit.de,Einzelhandel: Sanierung von Galeria nimmt wichtige Hürde,,,2023-02-01T12:22:03Z,https://web.archive.org/web/20230201130819/https://www.zeit.de/news/2023-02/01/sanierung-von-galeria-nimmt-wichtige-huerde,"When browsing with ads:
We collect personal data and also transmit it to third-party providers
 that help us improve and finance our digital content. Some of the information stored on your device, … [+732 chars]",,de,'Sanierung'
https://www.handelsblatt.com/unternehmen/energie/gasspeicher-in-deutschland-fuellstand-auf-79-prozent-gefallen/28819652.html,https://www.handelsblatt.com/unternehmen/energie/gasspeicher-in-deutschland-fuellstand-auf-79-prozent-gefallen/28819652.html,0,www.handelsblatt.com,Gasspeicher in Deutschland: Füllstand auf 79 Prozent gefallen,Ein hoher Gasspeicher-Füllstand ist für Deutschlands Gasversorgung in der Energiekrise essenziell. Wie steht es aktuell um die Gasreserven? Ein Überblick.,https://www.handelsblatt.com/images/gasspeicher-in-sachsen-anhalt/28877480/2-format2003.jpg,2023-02-01T12:22:16Z,https://web.archive.org/web/20230201135212/https://www.handelsblatt.com/unternehmen/energie/gasspeicher-in-deutschland-fuellstand-auf-79-prozent-gefallen/28819652.html,"Gasspeicher in Sachsen-AnhaltDer Gasspeicher-Füllstand in Deutschland ist in der Energiekrise zum wichtigen Faktor geworden.
(Foto: dpa)
Düsseldorf Ein stabiler Füllstand der deutschen Gasspeicher … [+7396 chars]",,de,'Gas'
https://www.stern.de/panorama/weltgeschehen/lotto-gewinner-erhielt-180-mio-euro---und-haute-richtig-auf-den-putz-33156888.html,https://www.stern.de/panorama/weltgeschehen/lotto-gewinner-erhielt-180-mio-euro---und-haute-richtig-auf-den-putz-33156888.html,0,www.stern.de,"Reichtum: Lotto-Gewinner sahnte einst 180 Millionen ab – jetzt wird öffentlich, wie krass er die Kohle verprasste","Colin Weir gewann einen der größten Jackpots, die in Europa jemals ausgezahlt wurden – und genoss das Geld in vollen Zügen. Er gab im Schnitt 113.000 Euro pro Woche aus.",https://image.stern.de/33157196/t/cM/v1/w1440/r1.7778/-/lotto-bild-1.jpg,2023-02-01T13:00:34Z,https://web.archive.org/web/20230201163658/https://www.stern.de/panorama/weltgeschehen/lotto-gewinner-erhielt-180-mio-euro---und-haute-richtig-auf-den-putz-33156888.html,"Es ist wahrscheinlich der Traum vieler: Mal ordentlich in die Vollen gehen und richtig viel Kohle raushauen für Dinge, die eigentlich unvernünftig oder gar sinnlos erscheinen. Ganz im Sinne von Ex-Fu… [+2255 chars]",,de,'Kohle'
https://www.sueddeutsche.de/wirtschaft/energie-heizoel-pellets-haertefallhilfe-1.5743245,https://www.sueddeutsche.de/wirtschaft/energie-heizoel-pellets-haertefallhilfe-1.5743245,0,www.sueddeutsche.de,Finanzhilfe: Heizölkunden müssen auf Energiekosten-Zuschuss warten,"Die finanzielle Entlastung für Haushalte, die mit Heizöl, Pellets, Flüssiggas oder Kohle heizen, kommt nicht voran. Woran es hapert - und warum es in Berlin die Hilfen schon gibt.",https://www.sueddeutsche.de/image/sz.1.5695770/1200x675?v=1675257385,2023-02-01T13:13:39Z,https://web.archive.org/web/20230201131803/https://www.sueddeutsche.de/wirtschaft/energie-heizoel-pellets-haertefallhilfe-1.5743245,"Die finanzielle Entlastung für Haushalte, die mit Heizöl, Pellets, Flüssiggas oder Kohle heizen, kommt nicht voran. Woran es hapert - und warum es in Berlin die Hilfen schon gibt.Haushalte, die mit H… [+2142 chars]",,de,'Kohle'
https://www.tagesspiegel.de/berlin/zuschuss-fur-heizol-und-pellets-warum-sie-ihren-antrag-jetzt-stellen-sollten-9276732.html,https://www.tagesspiegel.de/berlin/zuschuss-fur-heizol-und-pellets-warum-sie-ihren-antrag-jetzt-stellen-sollten-9276732.html,0,www.tagesspiegel.de,Zuschuss für Heizöl und Pellets in Berlin: Warum Sie Ihren Antrag jetzt stellen sollten,"Berlin zahlt Menschen, die mit Öl, Kohle oder Pellets heizen, bis zu 2000 Euro als Ausgleich für die gestiegenen Kosten. Das Interesse ist groß.",https://www.tagesspiegel.de/berlin/images/heizal/alternates/BASE_16_9_W1400/heizl.jpeg,2023-02-01T14:18:07Z,https://web.archive.org/web/20230201143837/https://www.tagesspiegel.de/berlin/zuschuss-fur-heizol-und-pellets-warum-sie-ihren-antrag-jetzt-stellen-sollten-9276732.html,"Viele Berliner haben offensichtlich schon in den Startlöchern gesessen. Am Dienstagnachmittag hatte die Investitionsbank Berlin (IBB) die Onlineseite freigeschaltet, mit der Menschen die Heizkostenhi… [+4557 chars]",,de,'Kohle'
https://www.zeit.de/news/2023-02/01/vergabeverfahren-fuer-gasteig-sanierung-abgebrochen,https://www.zeit.de/news/2023-02/01/vergabeverfahren-fuer-gasteig-sanierung-abgebrochen,0,www.zeit.de,München: Vergabeverfahren für Gasteig-Sanierung abgebrochen,,,2023-02-01T14:22:09Z,https://web.archive.org/web/20230201143928/https://www.zeit.de/news/2023-02/01/vergabeverfahren-fuer-gasteig-sanierung-abgebrochen,"When browsing with ads:
We collect personal data and also transmit it to third-party providers
 that help us improve and finance our digital content. Some of the information stored on your device, … [+732 chars]",,de,'Gas'
https://www.zeit.de/news/2023-02/01/innenministerin-will-sanierung-von-polizeidienststellen,https://www.zeit.de/news/2023-02/01/innenministerin-will-sanierung-von-polizeidienststellen,0,www.zeit.de,Innere Sicherheit: Innenministerin will Sanierung von Polizeidienststellen,,,2023-02-01T14:30:55Z,https://web.archive.org/web/20230201145537/https://www.zeit.de/news/2023-02/01/innenministerin-will-sanierung-von-polizeidienststellen,"When browsing with ads:
We collect personal data and also transmit it to third-party providers
 that help us improve and finance our digital content. Some of the information stored on your device, … [+732 chars]",,de,'Sanierung'
https://www.sueddeutsche.de/muenchen/muenchen-gasteig-sanierung-investor-streit-1.5743393,https://www.sueddeutsche.de/muenchen/muenchen-gasteig-sanierung-investor-streit-1.5743393,0,www.sueddeutsche.de,Gasteig-Debatte: Tendenz zur Generalsanierung,"Der Münchner Stadtrat hebt das Vergabeverfahren für die Gasteig-Modernisierung auf, weil sich kein Unternehmen gefunden hat. Die Verwaltung soll im nächsten halben Jahr alle Optionen noch einmal prüfen.",https://www.sueddeutsche.de/image/sz.1.5743394/1200x675?v=1675263366,2023-02-01T14:56:16Z,https://web.archive.org/web/20230201165606/https://www.sueddeutsche.de/muenchen/muenchen-gasteig-sanierung-investor-streit-1.5743393,"Der Münchner Stadtrat hebt das Vergabeverfahren für die Gasteig-Modernisierung auf, weil sich kein Unternehmen gefunden hat. Die Verwaltung soll im nächsten halben Jahr alle Optionen noch einmal prüf… [+3363 chars]",,de,'Sanierung'
https://taz.de/Bericht-der-Bundesnetzagentur/!5909437/,https://taz.de/Bericht-der-Bundesnetzagentur/!5909437/,0,taz.de,Bericht der Bundesnetzagentur: Der Strom fließt sicher weiter,"Die Versorgung mit Elektrizität ist mittelfristig gewährleistet, sagt die Bundesnetzagentur. Das gelte auch bei einem vorgezogenen Kohleausstieg.",https://taz.de/picture/6070177/948/32075091-1.jpeg,2023-02-01T15:37:00Z,https://web.archive.org/web/20230201182409/https://taz.de/Bericht-der-Bundesnetzagentur/!5909437/,"Die Versorgung mit Elektrizität ist mittelfristig gewährleistet, sagt die Bundesnetzagentur. Das gelte auch bei einem vorgezogenen Kohleausstieg.
Im Rheinischen Revier hier bei Lützerath kommt der K… [+3808 chars]",,de,'Kohle'
https://www.sueddeutsche.de/wirtschaft/chip-saarland-halbleiterindustrie-wirtschaftsfoederung-1.5743468,https://www.sueddeutsche.de/wirtschaft/chip-saarland-halbleiterindustrie-wirtschaftsfoederung-1.5743468,0,www.sueddeutsche.de,"Chipfabrik: ""Die industrielle Revolution kehrt ins Saarland zurück""","In Ensdorf entsteht eine neue Chipfabrik mit 600 Beschäftigten, auf dem Gelände eines alten Kohlekraftwerks. Da kommt sogar der Kanzler vorbei.",https://www.sueddeutsche.de/image/sz.1.5743469/1200x675?v=1675266686,2023-02-01T15:41:59Z,http://archive.md/20230202084210/https://www.sueddeutsche.de/wirtschaft/chip-saarland-halbleiterindustrie-wirtschaftsfoederung-1.5743468,"In Ensdorf entsteht eine neue Chipfabrik mit 600 Beschäftigten, auf dem Gelände eines alten Kohlekraftwerks. Da kommt sogar der Kanzler vorbei.Großer Bahnhof in der kleinen Gemeinde Ensdorf im Saarla… [+5064 chars]",,de,'Kohle'
https://www.bild.de/regional/sachsen-anhalt/sachsen-anhalt-news/vogelgrippe-20000-puten-in-sachsen-anhalt-getoetet-82761362.bild.html,https://www.bild.de/regional/sachsen-anhalt/sachsen-anhalt-news/vogelgrippe-20000-puten-in-sachsen-anhalt-getoetet-82761362.bild.html,0,www.bild.de,Vogelgrippe weitet sich aus - 20 000 Puten in Börde getötet,Haldensleben (Sachsen-Anhalt) – Diese Grippe ist wirklich die Pest! Vogelgrippen-Schock im Bördekreis.,"https://images.bild.de/63dad633e151491846a8f40a/cab3e16446ec4e26ced9666993bb0cd0,9180a5fe?w=1280",2023-02-01T21:24:48Z,https://web.archive.org/web/20230201212947/https://www.bild.de/regional/sachsen-anhalt/sachsen-anhalt-news/vogelgrippe-20000-puten-in-sachsen-anhalt-getoetet-82761362.bild.html,"Haldensleben (Sachsen-Anhalt) Diese Grippe ist wirklich die Pest!
Vogelgrippen-Schock im Bördekreis. Nach einem positiven Test muss der gesamte Bestand einer Putenzuchtanlage in Wieglitz 20 000 Tier… [+753 chars]",,de,'Grippe'
https://www.zeit.de/politik/deutschland/2023-02/coronavirus-karl-lauterbach-fehler-pandemie-bekaempfung,https://www.zeit.de/politik/deutschland/2023-02/coronavirus-karl-lauterbach-fehler-pandemie-bekaempfung,0,www.zeit.de,Coronavirus: Karl Lauterbach bemängelt Fehler bei Pandemiebekämpfung,"Deutschland habe gegen Corona strenge Maßnahmen beschlossen – einige seien falsch gewesen, sagt Bundesgesundheitsminister Lauterbach. So wurden Kinder zu stark isoliert.",,2023-02-01T22:37:17Z,https://web.archive.org/web/20230201234043/https://www.zeit.de/politik/deutschland/2023-02/coronavirus-karl-lauterbach-fehler-pandemie-bekaempfung,"When browsing with ads:
We collect personal data and also transmit it to third-party providers
 that help us improve and finance our digital content. Some of the information stored on your device, … [+732 chars]",,de,'Kinder'
https://steiermark.orf.at/stories/3192967/,https://steiermark.orf.at/stories/3192967/,0,steiermark.orf.at,Ein Ende der Grippewelle ist in Sicht,"Nach zwei Pandemiejahren hat die Steiermark heuer mit einer massiven Influenzawelle zu kämpfen gehabt – Personalengpässe, überfüllte Kliniken sowie randvolle Praxen waren die Folge. Nun ebbt die Grippewelle langsam ab.",https://ibs.orf.at/stm?image=https%3A%2F%2Foekastatic.orf.at%2Fmims%2F2023%2F01%2F15%2Fcrops%2Fw%3D1200%2Ch%3D627%2Cq%3D75%2F1630016_master_598215_virus_header.jpg%3Fs%3D260466d30876a38562259b393bdf93f840f44b06,2023-02-02T06:31:00Z,https://web.archive.org/web/20230202070521/https://steiermark.orf.at/stories/3192967/,Rund 9.500 Steirerinnen und Steirer sind aktuell wegen Influenza oder grippaler Infekte bei der ÖGK arbeitsunfähig gemeldet. Mit Beginn der etwas wärmer werdenden Jahreszeit und den bevorstehenden Se… [+1331 chars],,de,'Grippe'
https://www.zeit.de/politik/ausland/2023-01/ukraine-kinder-verschleppung-russland,https://www.zeit.de/politik/ausland/2023-01/ukraine-kinder-verschleppung-russland,0,www.zeit.de,"Verschleppung ukrainischer Kinder: Verschleppt, umerzogen, russifiziert","Die massenhafte Verschleppung ukrainischer Kinder nach Russland ist eines der grausamsten Verbrechen dieses Krieges. Wie Ukrainer versuchen, ihre Kinder zurückzuholen.",,2023-02-02T12:41:45Z,https://web.archive.org/web/20230202132255/https://www.zeit.de/politik/ausland/2023-01/ukraine-kinder-verschleppung-russland,"When browsing with ads:
We collect personal data and also transmit it to third-party providers
 that help us improve and finance our digital content. Some of the information stored on your device, … [+732 chars]",,de,'Kinder'
