index,url,valid,domain,title,description,image,published,archive,content,quote,language,keyword
https://www.sueddeutsche.de/politik/japan-wohnungen-obdachlosigkeit-li.3158938,https://www.sueddeutsche.de/politik/japan-wohnungen-obdachlosigkeit-li.3158938,0,www.sueddeutsche.de,Obdachlosigkeit in Japan: Ein paar Quadratmeter für jeden,In Japan sind 2024 noch weniger Menschen ohne Wohnung als schon in den Jahren zuvor. Was macht das Land im Kampf gegen Obdachlosigkeit besser als viele andere Länder?,https://www.sueddeutsche.de/2025/01/03/5ac3bd04-71e3-4a82-a5d6-92c5631787a0.jpeg?q=60&fm=webp&width=1200&rect=0%2C200%2C4000%2C2250,2025-01-03T11:48:13Z,,"In Japan sind 2024 noch weniger Menschen ohne Wohnung als schon in den Jahren zuvor. Was macht das Land im Kampf gegen Obdachlosigkeit besser als viele andere Länder?Das Vergessen ist auch so etwas, … [+290 chars]",,de,'Obdachlosigkeit'
https://www.stern.de/familie/luftfeuchtigkeit-senken--diese-tipps-helfen-im-winter-am-besten-33946060.html,https://www.stern.de/familie/luftfeuchtigkeit-senken--diese-tipps-helfen-im-winter-am-besten-33946060.html,0,www.stern.de,Gegen Schimmel: Mit diesen Tipps können Sie zu Hause die Luftfeuchtigkeit senken,"Wenn Sie zuhause beschlagene Fensterscheiben sehen, kann es sein, dass die Luftfeuchtigkeit zu hoch ist. Wie Sie sie senken können und was Sie noch beachten sollten.",https://image.stern.de/33946062/t/Gt/v2/w1440/r1.7778/-/luftfeuchtigkeit-senken.jpg,2025-01-03T13:15:00Z,,"Kopiere den aktuellen Link
Wenn Sie zuhause beschlagene Fensterscheiben sehen, kann es sein, dass die Luftfeuchtigkeit zu hoch ist. Wie Sie sie senken können und was Sie noch beachten sollten. 
Bes… [+6303 chars]",,de,'Schimmel'
https://www.zeit.de/news/2025-01/03/kinder-sollen-schneemann-auf-gleisen-gebaut-haben,https://www.zeit.de/news/2025-01/03/kinder-sollen-schneemann-auf-gleisen-gebaut-haben,0,www.zeit.de,Zug macht Notbremsung: Kinder sollen Schneemann auf Gleisen gebaut haben,Hier finden Sie Informationen zu dem Thema „Zug macht Notbremsung“. Lesen Sie jetzt „Kinder sollen Schneemann auf Gleisen gebaut haben“.,https://img.zeit.de/news/2025-01/03/kinder-sollen-schneemann-auf-gleisen-gebaut-haben-image-group/wide__1300x731,2025-01-03T15:24:14Z,,"Eine Gruppe von Kindern soll am Bahnhof in Gingen an der Fils (Kreis Göppingen) einen Schneemann auf den Gleisen gebaut haben. Ein Zug musste deshalb eine Notbremsung einlegen, wie die Bundespolizei … [+499 chars]",,de,'Kinder'
https://www.stern.de/gesellschaft/regional/niedersachsen-bremen/atomkraft--deutlich-mehr-uran-aus-russland-nach-lingen-geliefert-35353744.html,https://www.stern.de/gesellschaft/regional/niedersachsen-bremen/atomkraft--deutlich-mehr-uran-aus-russland-nach-lingen-geliefert-35353744.html,0,www.stern.de,Atomkraft: Deutlich mehr Uran aus Russland nach Lingen geliefert,Trotz des Ukrainekriegs kam im vergangenen Jahr tonnenweise Uran aus Russland ins niedersächsische Lingen. Niedersachsens Umweltminister Meyer kritisiert diese Entwicklung und warnt.,https://image.stern.de/35353746/t/ZT/v1/w1440/r1.7778/-/03--bdnf2upxcjv5axs2048jpeg---17d20cf6799847f1.jpg,2025-01-03T16:57:55Z,,"Kopiere den aktuellen Link
Trotz des Ukrainekriegs kam im vergangenen Jahr tonnenweise Uran aus Russland ins niedersächsische Lingen. Niedersachsens Umweltminister Meyer kritisiert diese Entwicklung… [+1757 chars]",,de,'Atomkraft'
https://www.zeit.de/news/2025-01/03/deutlich-mehr-uran-aus-russland-nach-lingen-geliefert,https://www.zeit.de/news/2025-01/03/deutlich-mehr-uran-aus-russland-nach-lingen-geliefert,0,www.zeit.de,Atomkraft: Deutlich mehr Uran aus Russland nach Lingen geliefert,Hier finden Sie Informationen zu dem Thema „Atomkraft“. Lesen Sie jetzt „Deutlich mehr Uran aus Russland nach Lingen geliefert“.,https://img.zeit.de/news/2025-01/03/deutlich-mehr-uran-aus-russland-nach-lingen-geliefert-image-group/wide__1300x731,2025-01-03T16:57:55Z,,"Im vergangenen Jahr sind 68,8 Tonnen Uran aus Russland zur Brennelementefabrik im niedersächsischen Lingen geliefert worden. Trotz des russischen Kriegs gegen die Ukraine wuchs die Menge um rund 66 P… [+1584 chars]",,de,'Atomkraft'
https://taz.de/Russische-Gaslieferungen-nach-Europa/!6056722/,https://taz.de/Russische-Gaslieferungen-nach-Europa/!6056722/,0,taz.de,Russische Gaslieferungen nach Europa: Kein russisches Gas mehr durch die Ukraine,Seit Beginn des Jahres fließt kein Gas aus Russland mehr durch die Ukraine. Damit verliert Gazprom Einnahmen in Milliardenhöhe. Welche Konsequenzen drohen Europa?,https://taz.de/picture/7445436/1200/37339859-1.jpeg,2025-01-03T18:54:00Z,https://web.archive.org/web/20250103193656/https://taz.de/Russische-Gaslieferungen-nach-Europa/!6056722/,Seit Beginn des Jahres fließt kein Gas aus Russland mehr durch die Ukraine. Damit verliert Gazprom Einnahmen in Milliardenhöhe. Welche Konsequenzen drohen Europa? mehr...,,de,'Gas'
https://www.focus.de/panorama/fuer-frauen-saunen-verband-empfiehlt-sichtkontrolle-des-erscheinungsbildes_id_260607218.html,https://www.focus.de/panorama/fuer-frauen-saunen-verband-empfiehlt-sichtkontrolle-des-erscheinungsbildes_id_260607218.html,0,www.focus.de,„Eintrag des Geschlechts nicht entscheidend“ - Verband empfiehlt „Sichtkontrolle des Erscheinungsbildes“ in Frauen-Saunen,"Der Deutsche Sauna-Bund empfiehlt, den Zugang zu Frauensaunas nur biologischen Frauen zu gewähren. Entscheidend sind primäre Geschlechtsmerkmale, nicht der Geschlechtseintrag im Ausweis.",https://p6.focus.de/img/fotos/id_260607217/der-deutsche-sauna-bund-empfiehlt-den-zugang-zu-frauensaunas-nur-biologischen-frauen-zu-gewaehren.-symbolbild-.jpg?im=Crop%3D%280%2C205%2C2469%2C1234%29%3BResize%3D%281200%2C627%29&impolicy=perceptual&quality=mediumHigh&hash=c5aadb3030ee1ab00cb1fc84828c246b7a4a117b6137b28e3e8f9fa8743f1eff,2025-01-03T19:21:01Z,,"Der Deutsche Sauna-Bund empfiehlt, den Zugang zu Frauensaunas nur biologischen Frauen zu gewähren. Entscheidend sind primäre Geschlechtsmerkmale, nicht der Geschlechtseintrag im Ausweis.Der Deutsche … [+1959 chars]",,de,'Geschlecht'
https://www.faz.net/aktuell/rhein-main/frankfurt/vonovia-baut-in-frankfurt-neue-wohnungen-110210301.html,https://www.faz.net/aktuell/rhein-main/frankfurt/vonovia-baut-in-frankfurt-neue-wohnungen-110210301.html,0,www.faz.net,Kosten gesunken: Vonovia will in Frankfurt wieder neue Wohnungen bauen,"Der Wohnungsbaukonzern Vonovia hatte sich wegen hoher Kosten vom Wohnungsbau weitgehend verabschiedet. Zwar steht die Sanierung des Bestands immer noch im Vordergrund, doch sind in Frankfurt auch wieder Neubauprojekte geplant.",https://media0.faz.net/ppmedia/aktuell/3330003480/1.10210296/facebook_teaser/frisch-saniert-vonovia.jpg,2025-01-04T06:00:12Z,http://archive.md/20250104153939/http://www.faz.net/aktuell/rhein-main/frankfurt/vonovia-baut-in-frankfurt-neue-wohnungen-110210301.html,"Auch dem Neubau wolle sich das Unternehmen trotz schwieriger Rahmenbedingungen wieder widmen, so Schulze. Für 2025 seien zunächst 24 Wohnungen geplant, weitere Projekte stellt er für 2026 in Aussicht… [+3519 chars]",,de,'Sanierung'
https://www.bild.de/sport/fussball/1-fc-magdeburg-dominiert-test-gegen-gangwon-aber-zwei-stars-fehlen-677942f637e71f1aec28a105,https://www.bild.de/sport/fussball/1-fc-magdeburg-dominiert-test-gegen-gangwon-aber-zwei-stars-fehlen-677942f637e71f1aec28a105,0,www.bild.de,"5:0 gegen Korea-Klub - Holmström schlägt ein, aber zwei FCM-Stars raus","Der 1. FC Magdeburg gewinnt souverän 5:0 im Türkei-Camp gegen den südkoreanischen Erstligisten Gangwon FC, doch zwei Stars sind von Grippe betroffen.","https://images.bild.de/677942f637e71f1aec28a105/637ffd22c6517d550a773b38adf26a57,d9917e80?w=1280",2025-01-04T15:04:18Z,,"Dieser Zweitligist ist schon wieder in bester Baller-Laune!
Der 1. FC Magdeburg hat das erste Testspiel im Türkei-Camp klar gewonnen. 5:0 (1:0) siegten die Blau-Weißen gegen 
Korea-Klub Gangwon FC.… [+1247 chars]",,de,'Grippe'
https://taz.de/Obdachlosigkeit-in-New-York/!6056778/,https://taz.de/Obdachlosigkeit-in-New-York/!6056778/,0,taz.de,Obdachlosigkeit in New York: Eine moralische Verletzung,Housing First sollte den Umgang mit Obdachlosen revolutionieren. Nun gilt das Konzept in seiner Heimat als gescheitert.,https://taz.de/picture/7444626/1200/37335378-1.jpeg,2025-01-04T18:57:00Z,http://archive.md/20250105081351/https://taz.de/Obdachlosigkeit-in-New-York/!6056778/,Housing First sollte den Umgang mit Obdachlosen revolutionieren. Nun gilt das Konzept in seiner Heimat als gescheitert. mehr...,,de,'Obdachlosigkeit'
https://taz.de/Das-dritte-Geschlecht/!6054751/,https://taz.de/Das-dritte-Geschlecht/!6054751/,0,taz.de,Das dritte Geschlecht: Mein Leben als „X“,Seit November trägt un­se­r:e nicht-binär:e Au­to­r:in offiziell einen Mischnamen – und hat gemischte Gefühle dazu.,https://taz.de/picture/7438299/1200/37291300-1-2-1.jpeg,2025-01-04T18:58:00Z,,Seit November trägt un­se­r:e nicht-binär:e Au­to­r:in offiziell einen Mischnamen – und hat gemischte Gefühle dazu. mehr...,,de,'Geschlecht'
https://www.tagesschau.de/inland/gesellschaft/wetter-glaette-104.html,https://www.tagesschau.de/inland/gesellschaft/wetter-glaette-104.html,0,www.tagesschau.de,Bundesweite Warnung vor gefährlicher Glätte,Nach klirrender Kälte wird es vielerorts wärmer. Doch das sorgt auch für spiegelglatte Straßen. Der Deutsche Wetterdienst rät zur Vorsicht. Unnötige Fahrten sollten vermieden werden.,https://images.tagesschau.de/image/d6b40ec4-f806-4de6-b22e-d26899704a6b/AAABlDLRz5k/AAABkZLhkrw/16x9-1280/schnee-hamburg-108.jpg,2025-01-04T20:23:09Z,https://web.archive.org/web/20250104220033/https://www.tagesschau.de/inland/gesellschaft/wetter-glaette-104.html,"Stand: 04.01.2025 21:23 Uhr
Nach klirrender Kälte wird es vielerorts wärmer. Doch das sorgt auch für spiegelglatte Straßen. Der Deutsche Wetterdienst rät zur Vorsicht. Unnötige Fahrten sollten vermi… [+4204 chars]",,de,'Kälte'
https://www.bild.de/leben-wissen/wohnen-living/schimmel-in-der-wohnung-alles-ueber-schimmel-im-winter-6759a37b423348047ff9eb3b,https://www.bild.de/leben-wissen/wohnen-living/schimmel-in-der-wohnung-alles-ueber-schimmel-im-winter-6759a37b423348047ff9eb3b,0,www.bild.de,"Wohnen im Winter - Was, wenn in der Wohnung Schimmel ist?","Wie man Schimmel erkennt, wo und warum Schimmel auftritt und was dann zu tun ist. Hier kommen die Tipps von BILD.","https://images.bild.de/6759a37b423348047ff9eb3b/f2a3d4ec4facc6a446795b01094707df,dd1b4484?w=1280",2025-01-05T08:00:37Z,,"Das wünscht sich keiner, doch so viele sind davon betroffen ...
Wenn es draußen kalt wird, ändern sich nicht sich nur die Temperaturen. Es entstehen auch neue, potenzielle Gefahren in den Wohnräumen… [+4024 chars]",,de,'Schimmel'
https://www.n-tv.de/panorama/Dresden-bat-saechsisches-Verkehrsministerium-mehrfach-um-Hilfe-bei-Carolabruecke-article25467508.html,https://www.n-tv.de/panorama/Dresden-bat-saechsisches-Verkehrsministerium-mehrfach-um-Hilfe-bei-Carolabruecke-article25467508.html,0,www.n-tv.de,Streit um Sanierungsgelder: Dresden bat sächsisches Verkehrsministerium mehrfach um Hilfe bei Carolabrücke,Im vergangenen September stürzt die Dresdner Carolabrücke ein. Der Sanierungsbedarf ist bereits Jahre vorher offensichtlich. Der Stadt Dresden fehlt das Geld für die Arbeiten und bitte das Land um finanzielle Hilfe. Doch auch das ist klamm.,https://bilder2.n-tv.de/img/incoming/crop25467509/6441321087-cImg_16_9-w1200/498818579.jpg,2025-01-05T09:06:29Z,,Im vergangenen September stürzt die Dresdner Carolabrücke ein. Der Sanierungsbedarf ist bereits Jahre vorher offensichtlich. Der Stadt Dresden fehlt das Geld für die Arbeiten und bitte das Land um fi… [+3615 chars],,de,'Sanierung'
https://www.n-tv.de/panorama/Sachsens-Verkehrsminister-lehnte-Foerdergelder-fuer-Carolabruecke-ab-article25467508.html,https://www.n-tv.de/panorama/Sachsens-Verkehrsminister-lehnte-Foerdergelder-fuer-Carolabruecke-ab-article25467508.html,0,www.n-tv.de,Dresden bat mehrfach um Hilfe: Sachsens Verkehrsminister lehnte Fördergelder für Carolabrücke ab,"Im vergangenen September stürzt die Dresdner Carolabrücke ein. Der Sanierungsbedarf ist bereits Jahre vorher offensichtlich. Doch obwohl die Stadt Dresden das Land mehrfach um Fördermittel für die dringend notwendigen Arbeiten bittet, bleibt das Verkehrsminis…",https://bilder2.n-tv.de/img/incoming/crop25467509/6441321087-cImg_16_9-w1200/498818579.jpg,2025-01-05T09:06:29Z,,Im vergangenen September stürzt die Dresdner Carolabrücke ein. Der Sanierungsbedarf ist bereits Jahre vorher offensichtlich. Doch obwohl die Stadt Dresden das Land mehrfach um Fördermittel für die dr… [+3478 chars],,de,'Sanierung'
https://www.zeit.de/news/2025-01/05/glaetteunfall-30-jaehrige-und-zwei-kinder-verletzt,https://www.zeit.de/news/2025-01/05/glaetteunfall-30-jaehrige-und-zwei-kinder-verletzt,0,www.zeit.de,Verkehr: Glätteunfall: 30-Jährige und zwei Kinder verletzt,Hier finden Sie Informationen zu dem Thema „Verkehr“. Lesen Sie jetzt „Glätteunfall: 30-Jährige und zwei Kinder verletzt“.,https://img.zeit.de/news/2025-01/05/glaetteunfall-30-jaehrige-und-zwei-kinder-verletzt-image-group/wide__1300x731,2025-01-05T10:09:12Z,,Bei einem Autounfall auf der Autobahn 24 sind bei Meyenburg (Landkreis Prignitz) eine 30-Jährige und zwei Kinder im Alter von einem und sechs Jahren leicht verletzt worden. Der 40-jährige Fahrer des … [+549 chars],,de,'Kinder'
https://www.bild.de/leben-wissen/hmpv-was-steckt-hinter-dem-humanen-metapneumovirus-in-china-677a334037e71f1aec28a5e3,https://www.bild.de/leben-wissen/hmpv-was-steckt-hinter-dem-humanen-metapneumovirus-in-china-677a334037e71f1aec28a5e3,0,www.bild.de,Symptome wie bei Grippe oder Corona - Wie gefährlich ist das China-Virus?,"Ein Virus in China, da läuten bei vielen die Alarmglocken. Was steckt wirklich hinter HMPV, wie groß ist die Gefahr? Und wie ist die Lage in Deutschland?","https://images.bild.de/677a334037e71f1aec28a5e3/6c39c9bb00451f1498b4909d513684dd,8d554c00?w=1280",2025-01-05T11:43:53Z,,"Ein Virus-Ausbruch in China da läuten bei vielen die Alarmglocken. Doch was steckt wirklich hinter HMPV und wie viel Gefahr geht von ihm aus?
Ende 2024 berichteten Medien über einen Anstieg der Infe… [+1774 chars]",,de,'Grippe'
https://www.bild.de/regional/berlin/schoenster-platz-berlins-wird-im-februar-wiedereroeffnet-677a70cd37e71f1aec28a8d6,https://www.bild.de/regional/berlin/schoenster-platz-berlins-wird-im-februar-wiedereroeffnet-677a70cd37e71f1aec28a8d6,0,www.bild.de,Sanierung abgeschlossen - Bahn frei für den „schönsten Platz Berlins“,Der Gendarmenmarkt in Berlin-Mitte gilt als Touristen-Hotspot und feiert nach zweijähriger Sanierung endlich sein Comeback!,"https://images.bild.de/677a70cd37e71f1aec28a8d6/60bf4d3f3341d93d720b0cf1159abeca,524480c1?w=1280",2025-01-05T14:53:26Z,,Berlin Nach zwei Jahren Bauzeit wurden Ende Dezember 2024 die Hauptbauarbeiten auf dem Gendarmenmarkt welcher auch als schönster Platz Berlins bekannt ist abgeschlossen. Der Zeitpunkt für die Wiedere… [+1998 chars],,de,'Sanierung'
https://www.morgenpost.de/bezirke/spandau/article408007820/mieterberatung-legt-jahresbilanz-vor-ein-problem-dominiert.html,https://www.morgenpost.de/bezirke/spandau/article408007820/mieterberatung-legt-jahresbilanz-vor-ein-problem-dominiert.html,0,www.morgenpost.de,Mieterberatung legt Jahresbilanz vor: Ein Problem dominiert,Der Alternative Mieter- und Verbraucherschutzbund (AMV) meldet für 2024 einen neuen Beratungsrekord: Die Zahl der Hilfesuchenden stieg auf 3.859. Hauptgrund: Heizkosten.,https://img.sparknews.funkemedien.de/408018236/408018236_1736090936_v16_9_1600.jpeg,2025-01-05T15:28:51Z,http://archive.md/20250105211521/https://www.morgenpost.de/bezirke/spandau/article408007820/mieterberatung-legt-jahresbilanz-vor-ein-problem-dominiert.html,Spandau. Der Alternative Mieter- und Verbraucherschutzbund meldet neue Rekordzahlen. Vor allem hohe Heizkosten belasten die Mieter.,,de,'Heizkosten'
https://www.morgenpost.de/panorama/article408019482/neue-hmpv-faelle-in-china-was-es-mit-dem-virus-auf-sich-hat.html,https://www.morgenpost.de/panorama/article408019482/neue-hmpv-faelle-in-china-was-es-mit-dem-virus-auf-sich-hat.html,0,www.morgenpost.de,Neue HMPV-Fälle in China: Was es mit dem Virus auf sich hat,"In China steigt die Zahl der Infektionen mit dem Atemwegsvirus HMPV an. Die Symptome erinnern an Grippe, RSV und Corona.",https://img.sparknews.funkemedien.de/405440690/405440690_1703851435_v16_9_1600.jpeg,2025-01-05T19:48:21Z,,"Berlin/Peking. In China steigt die Zahl der Infektionen mit dem Atemwegsvirus HMPV an. Die Symptome erinnern an Grippe, RSV und Corona.
Fünf Jahre nach dem Ausbruch von Corona werden ungute Erinneru… [+1923 chars]",,de,'Grippe'
https://www.zeit.de/news/2025-01/06/rauchgasvergiftung-durch-kohle-frau-muss-ins-krankenhaus,https://www.zeit.de/news/2025-01/06/rauchgasvergiftung-durch-kohle-frau-muss-ins-krankenhaus,0,www.zeit.de,Einsatz in Schlitz: Rauchgasvergiftung durch Kohle: Frau muss ins Krankenhaus,Hier finden Sie Informationen zu dem Thema „Einsatz in Schlitz“. Lesen Sie jetzt „Rauchgasvergiftung durch Kohle: Frau muss ins Krankenhaus“.,https://img.zeit.de/news/2025-01/06/rauchgasvergiftung-durch-kohle-frau-muss-ins-krankenhaus-image-group/wide__1300x731,2025-01-06T01:19:12Z,,Eine Frau hat in einer Unterkunft für Geflüchtete in Schlitz (Vogelsbergkreis) Kerzen und Holzkohle angezündet und sich als Folge eine Kohlenmonoxidvergiftung zugezogen. In dem Zimmer der 47-Jährigen… [+362 chars],,de,'Kohle'
https://www.stern.de/gesellschaft/regional/hessen/einsatz-in-schlitz--rauchgasvergiftung-durch-kohle--frau-muss-ins-krankenhaus-35356354.html,https://www.stern.de/gesellschaft/regional/hessen/einsatz-in-schlitz--rauchgasvergiftung-durch-kohle--frau-muss-ins-krankenhaus-35356354.html,0,www.stern.de,Einsatz in Schlitz: Rauchgasvergiftung durch Kohle: Frau muss ins Krankenhaus,Schlitz (lhe) - Eine Frau hat in einer Unterkunft für Geflüchtete in Schlitz (Vogelsbergkreis) Kerzen und Holzkohle angezündet und sich als Folge eine,https://image.stern.de/35356356/t/3F/v1/w1440/r1.7778/-/06--wvstki4ifbv4axs2048jpeg---30412cb42bfe7ea0.jpg,2025-01-06T01:19:12Z,,"Kopiere den aktuellen Link
Brennende Kohle lässt in einer Flüchtlingsunterkunft dichten Rauch entstehen. Eine Bewohnerin wird verletzt.
Eine Frau hat in einer Unterkunft für Geflüchtete in Schlitz … [+460 chars]",,de,'Kohle'
https://www.morgenpost.de/blogs-kolumnen/article408000319/wohnen-auf-parkplaetzen-elend-oder-neuer-trend.html,https://www.morgenpost.de/blogs-kolumnen/article408000319/wohnen-auf-parkplaetzen-elend-oder-neuer-trend.html,0,www.morgenpost.de,Obdachlosigkeit: Das ist das traurigste Auto von Berlin,Elend oder neuer Trend? In immer mehr Fahrzeugen am Straßenrand wird wird gewohnt – auch in umgewidmeten Anhängern oder Schrottautos: Die Stadtflucht-Kolumne.,https://img.sparknews.funkemedien.de/408000693/408000693_fc_1736139035_v16_9_1600.jpeg,2025-01-06T04:30:00Z,http://archive.md/20250106083546/https://www.morgenpost.de/blogs-kolumnen/article408000319/wohnen-auf-parkplaetzen-elend-oder-neuer-trend.html,Berlin. In immer mehr Fahrzeugen am Straßenrand wird wird gewohnt auch in umgewidmeten Anhängern oder Schrottautos: die Stadtflucht-Kolumne.,,de,'Obdachlosigkeit'
https://www.stern.de/familie/schimmel-im-schlafzimmer-bekaempfen--so-klappt-es-am-besten-34333828.html,https://www.stern.de/familie/schimmel-im-schlafzimmer-bekaempfen--so-klappt-es-am-besten-34333828.html,0,www.stern.de,Tipps zur Vorbeugung: Schimmel im Schlafzimmer: Mit diesen Methoden können Sie ihn bekämpfen,"Wer mit Schimmel im Schlafzimmer zu kämpfen hat, sollte schnell reagieren. Wir verraten, welche Methoden dabei helfen können, ihn wirksam zu bekämpfen und ihm vorzubeugen.",https://image.stern.de/34333830/t/jG/v3/w1440/r1.7778/-/schimmel-im-schlafzimmer.jpg,2025-01-06T08:35:00Z,,"Kopiere den aktuellen Link
Wer mit Schimmel im Schlafzimmer zu kämpfen hat, sollte schnell reagieren. Wir verraten, welche Methoden dabei helfen können, ihn wirksam zu bekämpfen und ihm vorzubeugen.… [+6149 chars]",,de,'Schimmel'
https://www.zeit.de/arbeit/2024-12/personalmangel-kitas-kitaleitung-kinderbetreuung-eltern-kinder,https://www.zeit.de/arbeit/2024-12/personalmangel-kitas-kitaleitung-kinderbetreuung-eltern-kinder,0,www.zeit.de,"Personalmangel in Kitas: ""Ich frage mich oft: Warum lassen Erzieher so viel mit sich machen?""",In Nordrhein-Westfalen darf notfalls eine Erzieherin für 60 Kinder zuständig sein. Kitaleiter Thorsten Bonhoff findet das absurd und zweifelt an seinem Beruf.,https://img.zeit.de/arbeit/2025-01/personalmangel-kitas-kitaleitung-kinderbetreuung-eltern-kinder-bild/wide__1300x731,2025-01-06T12:19:40Z,http://archive.md/20250106122355/https://www.zeit.de/arbeit/2024-12/personalmangel-kitas-kitaleitung-kinderbetreuung-eltern-kinder,"Schließen
Artikelzusammenfassung
In Nordrhein-Westfalen soll künftig eine Fachkraft für 60 Kinder ausreichen, um Kitas trotz Personalnotstands geöffnet zu halten. Ergänzungskräfte wie Sozialassiste… [+929 chars]",,de,'Kinder'
https://www.faz.net/aktuell/wirtschaft/unternehmen/quest-one-von-null-auf-eine-milliarde-euro-umsatz-in-nur-fuenf-jahren-110205318.html,https://www.faz.net/aktuell/wirtschaft/unternehmen/quest-one-von-null-auf-eine-milliarde-euro-umsatz-in-nur-fuenf-jahren-110205318.html,0,www.faz.net,Quest One: Von null auf eine Milliarde Euro Umsatz in nur fünf Jahren,"Wenn Kohle, Öl und Gas ersetzt werden sollen, müssen riesige Summen in die Wasserstoffproduktion investiert werden. Ohne Elektrolyseure geht das nicht.",https://media1.faz.net/ppmedia/aktuell/35218636/1.10205315/facebook_teaser_fplus/geschaeftsfuehrer-robin-von.jpg,2025-01-06T13:58:19Z,,"Noch ist Quest One ein kleines Pflänzchen, aber die Pläne sind groß. Im Jahr 2030 müssen wir mehr als eine Milliarde Euro Umsatz haben, sagt Robin von Plettenberg, Geschäftsführer von Quest One, eine… [+218 chars]",,de,'Kohle'
https://www.zeit.de/politik/ausland/2025-01/biden-joe-us-praesident-usa-offshore-oel-gas-bohrungen,https://www.zeit.de/politik/ausland/2025-01/biden-joe-us-praesident-usa-offshore-oel-gas-bohrungen,0,www.zeit.de,Offshore-Bohrungen: Biden blockiert Öl- und Gasförderung vor den Küsten der USA,"Keine Bohrungen nach Öl und Gas vor den meisten US-Küsten: Das hat US-Präsident Joe Biden verfügt. Trump kündigte an, das Verbot wieder aufheben zu wollen.",https://img.zeit.de/politik/ausland/2025-01/offshore-usa-gas-oelfoerderung-bohrverbot-biden/wide__1300x731,2025-01-06T15:31:36Z,,US-Präsident Joe Biden hat Bohrungen nach Öl und Gas für einen großen Teil der Gewässer vor den Küsten der Vereinigten Staaten verboten. Zwei Wochen vor dem Ende seiner Amtszeit blockierte er damit B… [+1391 chars],,de,'Gas'
https://www.tagesschau.de/ausland/amerika/wintersturm-usa-108.html,https://www.tagesschau.de/ausland/amerika/wintersturm-usa-108.html,0,www.tagesschau.de,Wintersturm fegt über Osten der USA hinweg,"Ein heftiger Wintersturm hat den Osten der USA getroffen. Hunderttausende Menschen waren zwischenzeitlich ohne Strom. Schnee, Blitzeis und Kälte sorgten für Unfälle, ausgefallene Flüge und geschlossene Schulen.",https://images.tagesschau.de/image/18f10173-0691-4d96-b2f6-f9c5e8492a91/AAABlDxdDCw/AAABkZLhkrw/16x9-1280/schnee-cincinnati-100.jpg,2025-01-06T17:03:36Z,https://web.archive.org/web/20250108152607/https://www.tagesschau.de/ausland/amerika/wintersturm-usa-108.html,"Stand: 06.01.2025 18:03 Uhr
Ein heftiger Wintersturm hat den Osten der USA getroffen. Hunderttausende Menschen waren zwischenzeitlich ohne Strom. Schnee, Blitzeis und Kälte sorgten für Unfälle, ausg… [+3465 chars]",,de,'Kälte'
https://www.focus.de/kultur/kino_tv/wer-wird-millionaer-peinlicher-blackout-bei-100-euro-frage_56a59bea-7c6c-4388-8583-5c5f76134d9c.html,https://www.focus.de/kultur/kino_tv/wer-wird-millionaer-peinlicher-blackout-bei-100-euro-frage_56a59bea-7c6c-4388-8583-5c5f76134d9c.html,0,www.focus.de,"""Den Ausstrahlungstermin erfährt keiner"" - Von wegen 3 Millionen: ""Wer wird Millionär?""-Kandidat hat bei 100-Euro-Frage Blackout","Gleich zum Auftakt gibt es bei der 3-Millionen-Euro-Ausgabe von ""Wer wird Millionär?"" (RTL) peinliche Momente: Ein 20-jähriger Student verzweifelt schon am Wortspiel der 100 Euro-Frage.",https://quadro.burda-forward.de/ctf/fed62e92-91d0-40ec-84ba-119fa01c7d1b.bbdbeb68-f8c8-4b19-9769-8b83473aad96.jpeg?im=Resize%3D%281200%2C630%29&hash=4f3b49cef8b1e32b737cefffe2aed8758a40226c73dc851b9cb05ced7acd121a,2025-01-07T05:29:00Z,,"Kaum war Tag 1 der 3-Millionen-Euro-Woche bei ""Wer wird Millionär?"" gestartet, verlangte Günther Jauch seinen Kandidaten bereits einiges ab. So wollte er bei Gina Bouillon aus Köthen den Wohnort hart… [+4932 chars]",,de,'Blackout'
https://www.zeit.de/news/2025-01/07/mann-wirft-boeller-auf-kinder-keine-verletzten,https://www.zeit.de/news/2025-01/07/mann-wirft-boeller-auf-kinder-keine-verletzten,0,www.zeit.de,Frankfurt/Main: Mann wirft Böller auf Kinder - Keine Verletzten,Hier finden Sie Informationen zu dem Thema „Frankfurt/Main“. Lesen Sie jetzt „Mann wirft Böller auf Kinder - Keine Verletzten“.,https://img.zeit.de/news/2025-01/07/mann-wirft-boeller-auf-kinder-keine-verletzten-image-group/wide__1300x731,2025-01-07T11:00:48Z,,"Ein Mann soll auf einer Straße in Frankfurt mindestens einen Böller auf zwei Kinder geworfen haben. Einer der Jungs soll gespürt haben, wie ihn der Knallkörper am Rücken berührt. Die beiden zwölfjähr… [+419 chars]",,de,'Kinder'
