index,url,valid,domain,title,description,image,published,archive,content,quote,language,keyword
https://www.nzz.ch/feuilleton/sergei-gerasimow-kriegstagebuch-aus-charkiw-teil-373-ld.1718626,https://www.nzz.ch/feuilleton/sergei-gerasimow-kriegstagebuch-aus-charkiw-teil-373-ld.1718626,0,www.nzz.ch,"SERIE - «Kinder lieben Stromausfälle. Sie sind froh, keine Schule zu haben», sagt die Frau, während wir in der Kälte vor dem Supermarkt warten","Sergei Gerasimow harrt in Charkiw aus. In seinem Kriegstagebuch berichtet der ukrainische Schriftsteller über den schrecklichen, auch absurden Alltag in einer Stadt, die noch immer beschossen wird.","https://img.nzz.ch/2022/12/28/8824dc7d-a484-42d2-8e0e-6e69512e3059.jpeg?width=1200&height=675&fit=bound&quality=75&auto=webp&crop=8542,4805,x0,y890&wmark=nzz",2023-01-01T04:30:00Z,https://web.archive.org/web/20230101044337/https://www.nzz.ch/feuilleton/sergei-gerasimow-kriegstagebuch-aus-charkiw-teil-373-ld.1718626,"Supermarkt mit Bancomat in Charkiw, Oktober 2022.
30. November 2022
Ich stehe um sechs Uhr auf. Die Stadt ist noch dunkel. Heute werde ich mit meiner Bankkarte Bargeld abheben. Das letzte Mal habe … [+4842 chars]",,de,'Kälte'
https://www.fr.de/wirtschaft/aenderungen-2023-neuerungen-regeln-gesetze-kindergeld-rente-energiepauschale-steuern-91997691.html,https://www.fr.de/wirtschaft/aenderungen-2023-neuerungen-regeln-gesetze-kindergeld-rente-energiepauschale-steuern-91997691.html,0,www.fr.de,"Rente, Energiepauschale, Kindergeld: Diese Änderungen kommen im Januar 2023 - fr.de","<ol><li>Rente, Energiepauschale, Kindergeld: Diese Änderungen kommen im Januar 2023  fr.de
</li><li>Ab heute: Rente, Steuern, Energie – Das ändert sich ab Januar 2023 für Sie  t-online - Finanzen
</li><li>Bürgergeld, Parkgebühren und Tattoofarben: Das änder…",https://www.fr.de/bilder/2022/12/27/91997691/30573825-januar-2023-aenderungen-neuerungen-regeln-gesetze-kindergeld-rente-energiepauschale-steuern-2gYWuYF9U2fe.jpg,2023-01-01T10:41:00Z,https://web.archive.org/web/20230101054351/https://www.fr.de/wirtschaft/aenderungen-2023-neuerungen-regeln-gesetze-kindergeld-rente-energiepauschale-steuern-91997691.html,"<ol><li>Startseite</li><li>Wirtschaft</li></ol>Erstellt: 01.01.2023, 11:41 Uhr
Von: Alina Schröder
KommentareTeilen
Mit dem Jahreswechsel treten gleich mehrere Änderungen und neue Regelungen in Kr… [+4731 chars]",,de,'Energiepauschale'
https://www.faz.net/aktuell/stil/mode-design/alpaka-wolle-waermt-im-winter-besonders-gut-18522306.html,https://www.faz.net/aktuell/stil/mode-design/alpaka-wolle-waermt-im-winter-besonders-gut-18522306.html,0,www.faz.net,Alpaka-Wolle wärmt im Winter besonders gut,Importiert aus Peru: Jannik Weich vertreibt Produkte aus Alpaka-Wolle in Europa. Bei extremer Kälte wärmt die Wolle und das Fell der Lasttiere besonders gut. Auch ökologisch punkten die Alpakas.,https://media1.faz.net/ppmedia/aktuell/gesellschaft/837713081/1.8522303/facebook_teaser/ideale-thermoeigenschaften-das.jpg,2023-01-01T13:15:57Z,https://web.archive.org/web/20230101131702/http://www.faz.net/aktuell/stil/mode-design/alpaka-wolle-waermt-im-winter-besonders-gut-18522306.html,"Viele verbinden Alpaka-Wolle mit den bunten Mützen, wie sie die Bauern in den peruanischen Anden tragen; die traten in Europa in den Siebzigerjahren ihren Siegeszug an, weil sie an den Ohren so schön… [+4327 chars]",,de,'Kälte'
https://www.merkur.de/verbraucher/kindergeld-2023-aenderungen-buergergeld-rente-buerger-verbraucher-neu-uebersicht-aktuell-91996318.html,https://www.merkur.de/verbraucher/kindergeld-2023-aenderungen-buergergeld-rente-buerger-verbraucher-neu-uebersicht-aktuell-91996318.html,0,www.merkur.de,"Rente, Bürgergeld, Kindergeld: Was ist neu bei den Änderungen ab Januar 2023 - Merkur.de","<ol><li>Rente, Bürgergeld, Kindergeld: Was ist neu bei den Änderungen ab Januar 2023  Merkur.de
</li><li>BÜRGERGELD, RENTE, KINDERGELD: Neues Jahr! Das ändert sich 2023  WELT Nachrichtensender
</li><li>Ab heute: Rente, Steuern, Energie – Das ändert sich ab …",https://www.merkur.de/bilder/2022/12/26/91996318/30549713-geld-aenderungen-2023-28fe.jpg,2023-01-01T18:46:59Z,,"<ol><li>Startseite</li><li>Verbraucher</li></ol>Erstellt: 01.01.2023, 13:42 Uhr
Von: Maximilian Kettenbach
KommentareTeilen
2023 gibt es einige finanzielle Änderungen. Entlastungen für Privathaush… [+8605 chars]",,de,'Kinder'
https://www.wiwo.de/unternehmen/energie/energie-industrie-laengere-laufzeiten-der-atomkraftwerke-denkbar/28899412.html,https://www.wiwo.de/unternehmen/energie/energie-industrie-laengere-laufzeiten-der-atomkraftwerke-denkbar/28899412.html,0,www.wiwo.de,Energie: Industrie: Längere Laufzeiten der Atomkraftwerke denkbar,Industrie: Längere Laufzeiten der Atomkraftwerke denkbar,https://www.wiwo.de/images/kernkraftwerk-neckarwestheim/28899410/1-format11240.jpg,2023-01-02T05:45:40Z,https://web.archive.org/web/20230102055817/http://www.wiwo.de/unternehmen/energie/energie-industrie-laengere-laufzeiten-der-atomkraftwerke-denkbar/28899412.html,"Wir sehen ja aktuell, wie dringend wir jede Kilowattstunde Strom benötigen, gerade in den sonnen- und windarmen Wintermonaten, sagte Russwurm der Deutschen Presse-Agentur. Unseren europäischen Nachba… [+2347 chars]",,de,'Atomkraft'
https://steiermark.orf.at/stories/3188589/,https://steiermark.orf.at/stories/3188589/,0,steiermark.orf.at,Gratis-Impfprogramm wird ausgeweitet,"Das Jahr 2023 hat auch im Gesundheitsbereich Neuerungen im Gepäck. Unter anderem ist eine Ausweitung des Gratis-Impfprogramms vorgesehen, um den HPV-Impfschutz weiter zu erhöhen, die Grippe-Impfung wird günstiger.",https://ibs.orf.at/stm?image=https%3A%2F%2Foekastatic.orf.at%2Fmims%2F2019%2F34%2F26%2Fcrops%2Fw%3D1200%2Ch%3D627%2Cq%3D75%2F268358_master_80726_apathemenbild_impfenmedikamentpharmainjektionen__-_apa-bilderdienst_-_17.07.17_-_abd0046.jpg%3Fs%3Ddb9c633e8ffa5780146b6e32e0b619ecd3e7a206,2023-01-02T06:29:00Z,,Die HPV-Impfung ist seit 2014 für Kinder zwischen dem vollendeten 9. und dem 12. Lebensjahr gratis. Ab Februar wird die Gratis-Impfung auf Jugendliche und junge Erwachsene bis zum 21. Lebensjahr ausg… [+1647 chars],,de,'Grippe'
https://www.sueddeutsche.de/politik/deutschland-energiekrise-liveblog-industrie-atomkraft-stromnetz-1.5722235,https://www.sueddeutsche.de/politik/deutschland-energiekrise-liveblog-industrie-atomkraft-stromnetz-1.5722235,0,www.sueddeutsche.de,Liveblog zur Energiekrise: BDI-Präsident kann sich deutsche Atomkraft noch länger vorstellen,"Das Stromnetz hat den Stresstest noch vor sich, sagt Russwurm. Deshalb schließt er eine Laufzeitverlängerung nicht aus. Bundestagspräsidentin Bas will zusätzliche Unterstützung für Haushalte mit sehr geringem Einkommen.",https://www.sueddeutsche.de/image/sz.1.5722311/1200x675?v=1672161806,2023-01-02T07:54:09Z,https://web.archive.org/web/20230102080709/https://www.sueddeutsche.de/politik/deutschland-energiekrise-liveblog-industrie-atomkraft-stromnetz-1.5722235,"Der Krieg Russlands gegen die Ukraine hat auch massive Folgen für die Energieversorgung in Europa und Deutschland. Die Politik versucht, diese sicherzustellen und die Menschen wegen der stark steigen… [+131 chars]",,de,'Atomkraft'
https://www.handelsblatt.com/unternehmen/gasheizung-tauschen-welche-heizung-ist-die-beste-alternative/28822824.html,https://www.handelsblatt.com/unternehmen/gasheizung-tauschen-welche-heizung-ist-die-beste-alternative/28822824.html,0,www.handelsblatt.com,Das Beste aus 2022: Welche Heizung ist die beste Alternative?,"Hohe Energiepreise drängen zum Umrüsten der Gasheizung. Was kosten die Alternativen Wärmepumpe, Fernwärme und Pelletheizung langfristig im Vergleich? Eine Übersicht.",https://www.handelsblatt.com/images/heizkosten/28886330/2-format2003.png,2023-01-02T09:02:30Z,https://web.archive.org/web/20230102105356/https://www.handelsblatt.com/unternehmen/gasheizung-tauschen-welche-heizung-ist-die-beste-alternative/28822824.html,"HeizkostenBeim Erneuern oder Umrüsten einer Gasheizung auf Wärmepumpe, Fernwärme oder Pelletheizung summieren sich die Kosten.
(Foto: Getty Images) 
Düsseldorf Wegen steigender Energiekosten denken… [+1394 chars]",,de,'Gas'
https://www.zeit.de/news/2023-01/02/geburtenzahl-sinkt-um-6-3-prozent,https://www.zeit.de/news/2023-01/02/geburtenzahl-sinkt-um-6-3-prozent,0,www.zeit.de,"Kinder: Geburtenzahl sinkt um 6,3 Prozent",,,2023-01-02T09:41:24Z,https://web.archive.org/web/20230102100729/https://www.zeit.de/news/2023-01/02/geburtenzahl-sinkt-um-6-3-prozent,"When browsing with ads:
We collect personal data and also transmit it to third-party providers
 that help us improve and finance our digital content. Some of the information stored on your device, … [+732 chars]",,de,'Kinder'
https://www.zeit.de/news/2023-01/02/hamburger-kinder-und-jugendnotdienst-massiv-ueberlastet,https://www.zeit.de/news/2023-01/02/hamburger-kinder-und-jugendnotdienst-massiv-ueberlastet,0,www.zeit.de,Unterbringungshilfe: Hamburger Kinder- und Jugendnotdienst massiv überlastet,,,2023-01-02T10:33:14Z,https://web.archive.org/web/20230103051212/https://www.zeit.de/news/2023-01/02/hamburger-kinder-und-jugendnotdienst-massiv-ueberlastet,"When browsing with ads:
We collect personal data and also transmit it to third-party providers
 that help us improve and finance our digital content. Some of the information stored on your device, … [+732 chars]",,de,'Kinder'
https://www.welt.de/politik/deutschland/article242980331/Atomkraft-Wenn-wir-neue-Brennstaebe-kaufen-laufen-die-AKW-womoeglich-noch-20-Jahre.html,https://www.welt.de/politik/deutschland/article242980331/Atomkraft-Wenn-wir-neue-Brennstaebe-kaufen-laufen-die-AKW-womoeglich-noch-20-Jahre.html,0,www.welt.de,"„Wenn wir neue Brennstäbe kaufen, laufen die Kernkraftwerke womöglich noch 20 Jahre“",Bundestagspräsidentin Bärbel Bas fordert ein Ende der Debatte über eine weitere Verlängerung von AKW-Laufzeiten. Ein Festhalten an der Atomkraft würde die Transformation der Energiewirtschaft ausbremsen. Anderer Meinung ist die Wirtschaftsweise Ulrike Malmend…,https://img.welt.de/img/politik/deutschland/mobile242980425/2411359327-ci16x9-w1200/Bundestag.jpg,2023-01-02T10:56:00Z,https://web.archive.org/web/20230102111334/https://www.welt.de/politik/deutschland/article242980331/Atomkraft-Wenn-wir-neue-Brennstaebe-kaufen-laufen-die-AKW-womoeglich-noch-20-Jahre.html,Bundestagspräsidentin Bärbel Bas (SPD) hat wiederkehrende Rufe der FDP und der Opposition nach längeren AKW-Laufzeiten kritisiert. Machen wir uns nichts vor: Wenn wir jetzt neue Brennstäbe kaufen wür… [+3574 chars],,de,'Atomkraft'
https://www.golem.de/sonstiges/zustimmung/auswahl.html?from=https://www.golem.de/news/it-bildung-fuer-schueler-calliope-mini-kann-vieles-und-koennte-noch-mehr-2301-170578.html&referer=https://t.co/031c7accc0,https://www.golem.de/sonstiges/zustimmung/auswahl.html?from=https://www.golem.de/news/it-bildung-fuer-schueler-calliope-mini-kann-vieles-und-koennte-noch-mehr-2301-170578.html&referer=https://t.co/031c7accc0,0,www.golem.de,(g+) IT-Bildung für Schüler: Calliope Mini kann vieles - und könnte noch mehr,"Der Calliope Mini ist ein Einplatinencomputer für den Bildungsbereich, besonders für Kinder zwischen 8 und 12 Jahren. Durchgesetzt hat er sich bislang nicht. Dabei hätte er das Potenzial dazu, leider wird es nicht genutzt. Von Karsten Lüth (Bildung, Internet)",,2023-01-02T11:00:02Z,,"Besuchen Sie Golem.de wie gewohnt mit Werbung und Tracking,
 indem Sie der Nutzung aller Cookies zustimmen.
 Details zum Tracking finden Sie im Privacy Center.
Skript wurde nicht geladen. Informat… [+607 chars]",,de,'Kinder'
https://www.faz.net/aktuell/wirtschaft/historische-hyperinflation/auch-wertbestaendige-anleihen-sind-nicht-ohne-risiken-frankfurter-zeitung-von-1922-18565635.html,https://www.faz.net/aktuell/wirtschaft/historische-hyperinflation/auch-wertbestaendige-anleihen-sind-nicht-ohne-risiken-frankfurter-zeitung-von-1922-18565635.html,0,www.faz.net,Auch wertbeständige Anleihen sind nicht ohne Risiken – Frankfurter Zeitung von 1922,"Anleihen auf Urprodukte wie Roggen, Koks und Kohle spiegeln die Zerrüttung des Geldwesens. Wichtig ist, dass der Schuldner über das Urprodukt verfügt. Aus der Frankfurter Zeitung vom 2. Januar 1923.",https://media0.faz.net/ppmedia/aktuell/1126169309/1.8560884/facebook_teaser/eine-wechselstube-in-berlin.jpg,2023-01-02T11:31:11Z,,"In bemerkenswerter Zahl häufen sich die Versuche, auf wertbeständiger Rechnungsbasis Schuldtitel auszugeben, den für Verzinsung und Tilgung in gleicher Weise wie für die Kapitalaufnahme ein sicher ma… [+5459 chars]",,de,'Kohle'
https://www.merkur.de/verbraucher/kindergeld-2023-aenderungen-buergergeld-rente-buerger-verbraucher-uebersicht-neu-aktuell-91996318.html,https://www.merkur.de/verbraucher/kindergeld-2023-aenderungen-buergergeld-rente-buerger-verbraucher-uebersicht-neu-aktuell-91996318.html,0,www.merkur.de,"Rente, Bürgergeld, Kindergeld: Was ist neu bei den Änderungen ab Januar 2023 - Merkur.de","<ol><li>Rente, Bürgergeld, Kindergeld: Was ist neu bei den Änderungen ab Januar 2023  Merkur.de
</li><li>BÜRGERGELD, RENTE, KINDERGELD: Neues Jahr! Das ändert sich 2023  WELT Nachrichtensender
</li><li>Rente, Krankenversicherung, Steuern: Was sich 2023 beim…",https://www.merkur.de/bilder/2022/12/26/91996318/30549713-geld-aenderungen-2023-28fe.jpg,2023-01-02T11:31:50Z,https://web.archive.org/web/20230102061649/https://www.merkur.de/verbraucher/kindergeld-2023-aenderungen-buergergeld-rente-buerger-verbraucher-uebersicht-neu-aktuell-91996318.html,"<ol><li>Startseite</li><li>Verbraucher</li></ol>Erstellt: 02.01.2023, 06:18 Uhr
Von: Maximilian Kettenbach
KommentareTeilen
2023 gibt es einige finanzielle Änderungen. Entlastungen für Privathaush… [+8605 chars]",,de,'Energiepauschale'
https://help.orf.at/stories/3216905/,https://help.orf.at/stories/3216905/,0,help.orf.at,Hohe Heizkosten: Mehr Anfragen bei Verbraucherschlichtung,Die gestiegenen Energiekosten haben 2022 zu deutlich mehr Anfragen bei der Verbraucherschlichtung Austria geführt. Im Vorjahr wendeten sich Verbraucherinnen und Verbraucher in 1.400 Fällen an die staatlich anerkannte Schlichtungsstelle. Maßgeblich zu dem Zuwa…,https://ibs.orf.at/help?image=https%3A%2F%2Ftubestatic.orf.at%2Fmims%2F2022%2F37%2F91%2Fcrops%2Fw%3D1200%2Ch%3D627%2Cq%3D75%2F1492550_master_541591_strom_heizung.jpg%3Fs%3D0cb42c9eea2682f4e945de876bf5752890df96ce,2023-01-02T11:35:00Z,https://web.archive.org/web/20230102121042/https://help.orf.at/stories/3216905/,"Die Beschwerden an die Schlichtungsstelle sind vielfältig: etwa Probleme rund um die Fitnesscenterverträge; Möbelbestellungen, bei denen etwas schiefgegangen ist; Onlinebestellungen, die nie eintreff… [+1611 chars]",,de,'Heizkosten'
https://www.tagesspiegel.de/berlin/was-wenn-der-strom-ausfallt-vielen-berliner-behorden-fehlt-ein-konzept-fur-den-blackout-9111628.html,https://www.tagesspiegel.de/berlin/was-wenn-der-strom-ausfallt-vielen-berliner-behorden-fehlt-ein-konzept-fur-den-blackout-9111628.html,0,www.tagesspiegel.de,"Was, wenn der Strom ausfällt? : Vielen Berliner Behörden fehlt ein Konzept für den Blackout",Seit dem Angriff Russlands auf die Ukraine geht die Sorge vor großflächigen Stromausfällen um. Verwaltung und Bezirke in Berlin sind darauf nicht gut vorbereitet.,https://www.tagesspiegel.de/images/stromausfall-bei-mehr-als-30-000-haushalten-in-berlin1/alternates/BASE_16_9_W1400/stromausfall-bei-mehr-als-30-000-haushalten-in-berlin.jpeg,2023-01-02T11:42:14Z,https://web.archive.org/web/20230102114913/https://www.tagesspiegel.de/berlin/was-wenn-der-strom-ausfallt-vielen-berliner-behorden-fehlt-ein-konzept-fur-den-blackout-9111628.html,"Fällt in Berlin großflächig der Strom aus, droht selbst zentralen Teilen der Berliner Verwaltung die Arbeitsunfähigkeit. Unter anderem in der Senatskanzlei, der Wirtschafts- und der Verkehrsverwaltun… [+282 chars]",,de,'Blackout'
https://orf.at/stories/3299835/,https://orf.at/stories/3299835/,0,orf.at,Hohe Heizkosten: Mehr Anfragen bei Verbraucherschlichtung,,https://orf.at/mojo/1_4_1/storyserver//news/common/images/og-fallback-news.png,2023-01-02T11:45:21Z,https://web.archive.org/web/20230102150635/https://orf.at/stories/3299835/,Die gestiegenen Energiekosten haben 2022 zu deutlich mehr Anfragen bei der Verbraucherschlichtung Austria geführt. Im Vorjahr wendeten sich Verbraucherinnen und Verbraucher in 1.400 Fällen an die sta… [+153 chars],,de,'Heizkosten'
https://ooe.orf.at/stories/3188670/,https://ooe.orf.at/stories/3188670/,0,ooe.orf.at,Ab heute höherer Heizkostenzuschuss,"Ab heute kann der erhöhte Heizkostenzuschuss des Landes Oberösterreich beantragt werden. Betroffene erhalten mehr Geld, außerdem wurden die Einkommensgrenzen gesenkt, damit mehr Menschen den Zuschuss erhalten. Die Maßnahmen stoßen auf Kritik.",https://ibs.orf.at/ooe?image=https%3A%2F%2Foekastatic.orf.at%2Fmims%2F2020%2F41%2F73%2Fcrops%2Fw%3D1200%2Ch%3D627%2Cq%3D75%2F711547_master_246573_adobestock_319272177.jpeg%3Fs%3D4ee90dfe6988a082940eb4ae8acc036455d9a606,2023-01-02T12:44:07Z,https://web.archive.org/web/20230102133826/https://ooe.orf.at/stories/3188670/,"Wer sich die gestiegenen Heizkosten kaum mehr leisten kann, hat von diesem Montag an die Möglichkeit, einen höheren Heizkostenzuschuss vom Land Oberösterreich zu beziehen. Der Zuschuss wurde um 200 E… [+979 chars]",,de,'Heizkosten'
https://www.diepresse.com/6233696/kaerntner-ordinationen-aechzen-unter-grippe-und-corona-faellen,https://www.diepresse.com/6233696/kaerntner-ordinationen-aechzen-unter-grippe-und-corona-faellen,0,www.diepresse.com,Kärntner Ordinationen ächzen unter Grippe- und Corona-Fällen,"Die Ärztekammer fordert Unterstützung durch Versicherungsträger und die öffentliche Hand. Durch die hohe Anzahl an Erkrankten stoßen sowohl die Spitäler als auch der niedergelassene Bereich an ihre Grenzen, sagt der Präsident der Ärztekammer.",https://www.diepresse.com/assets_v2/images/diepresse_nachrichten.png,2023-01-02T12:57:00Z,,Die Ärztekammer fordert Unterstützung durch Versicherungsträger und die öffentliche Hand. Durch die hohe Anzahl an Erkrankten stoßen sowohl die Spitäler als auch der niedergelassene Bereich an ihre G… [+1440 chars],,de,'Grippe'
https://taz.de/Atomkraftwerke-als-Denkmaeler/!5901660/,https://taz.de/Atomkraftwerke-als-Denkmaeler/!5901660/,0,taz.de,Atomkraftwerke als Denkmäler: Nicht geliebte Objekte,"Manche wurden von berühmten Architekten gebaut, andere sind Denkmäler der sozialen Bewegungen. Was tun mit den Atomkraftwerken?",https://taz.de/picture/6002592/948/AKW-EInleitung-Innenraum-Wuergassen-Nils-Stoya-sw-ergebnis-1.jpeg,2023-01-02T14:52:00Z,,"Manche wurden von berühmten Architekten gebaut, andere sind Denkmäler der sozialen Bewegungen. Was tun mit den Atomkraftwerken?
Reaktor Würgassen: Die kontaminierten Teile sind rückgebaut, die Beton… [+7645 chars]",,de,'Atomkraft'
https://www.stern.de/gesellschaft/regional/sachsen-anhalt/energie--debatte-in-sachsen-anhalt-um-frueheren-kohleausstieg-im-osten-33061848.html,https://www.stern.de/gesellschaft/regional/sachsen-anhalt/energie--debatte-in-sachsen-anhalt-um-frueheren-kohleausstieg-im-osten-33061848.html,0,www.stern.de,Energie: Debatte in Sachsen-Anhalt um früheren Kohleausstieg im Osten,Im Rheinischen Revier wird der Kohleausstieg um acht Jahre auf 2030 vorgezogen. Bundeswirtschaftsminister Habeck kann sich das auch im Osten vorstellen. In Sachsen-Anhalt trifft der Vorstoß jedoch nicht nur auf Zustimmung.,https://image.stern.de/33061850/t/fG/v2/w1440/r1.7778/-/02--urnnewsmldpacom200901012301029981042v3w800h600l554t277r1981b1440jpeg---945071f820901c72.jpg,2023-01-02T16:11:32Z,https://web.archive.org/web/20230102163130/https://www.stern.de/gesellschaft/regional/sachsen-anhalt/energie--debatte-in-sachsen-anhalt-um-frueheren-kohleausstieg-im-osten-33061848.html,Im Rheinischen Revier wird der Kohleausstieg um acht Jahre auf 2030 vorgezogen. Bundeswirtschaftsminister Habeck kann sich das auch im Osten vorstellen. In Sachsen-Anhalt trifft der Vorstoß jedoch ni… [+4499 chars],,de,'Heizkosten'
https://www.faz.net/aktuell/politik/volker-wissing-will-akw-laufzeiten-von-experten-festlegen-lassen-18574367.html,https://www.faz.net/aktuell/politik/volker-wissing-will-akw-laufzeiten-von-experten-festlegen-lassen-18574367.html,0,www.faz.net,Wissing will Expertenkommission zur AkW-Laufzeitverlängerung,"Der Bundesverkehrsminister warnt vor einem „Fiasko“ bei der Transformation des Autoverkehrs. Wegen der Kohle könnten E-Autos nicht nur teuer, sondern auch klimaschädlich sein.",https://media0.faz.net/ppmedia/aktuell/gesellschaft/4004193738/1.8574164/facebook_teaser/volker-wissing.jpg,2023-01-02T16:29:24Z,,"Bundesverkehrsminister Volker Wissing (FDP) schlägt vor, eine unabhängige Expertenkommission über eine weitere Laufzeitverlängerung der drei Atomkraftwerke entscheiden zu lassen. Der Minister widersp… [+2215 chars]",,de,'Kohle'
https://www.morgenpost.de/politik/article237274777/atomkraft-union-forderung-stresstest-winter.html,https://www.morgenpost.de/politik/article237274777/atomkraft-union-forderung-stresstest-winter.html,0,www.morgenpost.de,Energiepolitik: Atomkraft: Union fordert Stresstest für den nächsten Winter,Die Union fordert einen weiteren Stresstest für das Stromsystem. Der kommende Winter werde noch kritischer. Akws sollten länger laufen.,https://img.morgenpost.de/img/politik/crop237274773/4582606128-w820-cv16_9-q85/2c128276-8ab3-11ed-9563-b559bc59aa18.jpg,2023-01-02T21:00:00Z,https://web.archive.org/web/20230102210733/https://www.morgenpost.de/politik/article237274777/atomkraft-union-forderung-stresstest-winter.html,"Berlin. Eigentlich ist der Atomausstieg in Deutschland beschlossene Sache, doch angesichts der Energiekrise schwelt die Debatte über einen möglichen Weiterbetrieb der verbliebenen Meiler weiter. Nun … [+5313 chars]",,de,'Atomkraft'
https://www.handelsblatt.com/unternehmen/gasheizung-tauschen-welche-heizung-ist-momentan-die-beste-alternative/28822824.html,https://www.handelsblatt.com/unternehmen/gasheizung-tauschen-welche-heizung-ist-momentan-die-beste-alternative/28822824.html,0,www.handelsblatt.com,Das Beste aus 2022: Welche Heizung ist momentan die beste Alternative?,"Hohe Energiepreise drängen zum Umrüsten der Gasheizung. Was kosten die Alternativen Wärmepumpe, Fernwärme und Pelletheizung langfristig im Vergleich? Eine Übersicht.",https://www.handelsblatt.com/images/heizkosten/28886330/2-format2003.png,2023-01-03T05:08:02Z,https://web.archive.org/web/20230103053809/https://www.handelsblatt.com/unternehmen/gasheizung-tauschen-welche-heizung-ist-momentan-die-beste-alternative/28822824.html,"HeizkostenBeim Erneuern oder Umrüsten einer Gasheizung auf Wärmepumpe, Fernwärme oder Pelletheizung summieren sich die Kosten.
(Foto: Getty Images) 
Düsseldorf Wegen steigender Energiekosten denken… [+1394 chars]",,de,'Heizkosten'
https://www.welt.de/reise/staedtereisen/article242986075/Belgien-In-Antwerpen-wurde-das-Viertel-am-Hafen-zum-coolen-Quartier.html,https://www.welt.de/reise/staedtereisen/article242986075/Belgien-In-Antwerpen-wurde-das-Viertel-am-Hafen-zum-coolen-Quartier.html,0,www.welt.de,Aus Pfui wird Hui – Antwerpens hippes Hafenviertel,"Früher gab es in der Gegend um den alten Hafen in Antwerpen vor allem Leerstand und Prostitution. Ein Museumsbau wurde dann zur Initialzündung für ein angesagtes Quartier, das heute mit Kultur, coolen Clubs und spannender Gastronomie lockt.",https://img.welt.de/img/reise/nah/mobile242986059/2571355287-ci16x9-w1200/Hippes-Hafenviertel-Das-neue-Gesicht-von-Antwerpen-10.jpg,2023-01-03T06:41:33Z,https://web.archive.org/web/20230103065912/https://www.welt.de/reise/staedtereisen/article242986075/Belgien-In-Antwerpen-wurde-das-Viertel-am-Hafen-zum-coolen-Quartier.html,"Selbst die Einwohner kamen kaum hierher. Das lag nicht an der Entfernung. Das Antwerpener Viertel um den alten Hafen herum war zu verrufen. Mit seinen leerstehenden Lagerhallen, Speicherhäusern, Dock… [+8376 chars]",,de,'Sanierung'
https://www.faz.net/aktuell/wirtschaft/autobahn-sanierung-staedten-droht-eine-enorme-verkehrsbelastung-18574218.html,https://www.faz.net/aktuell/wirtschaft/autobahn-sanierung-staedten-droht-eine-enorme-verkehrsbelastung-18574218.html,0,www.faz.net,Sanierung der Infrastruktur: „Wir müssen noch für viele Jahre mit 500 Autobahnbaustellen leben“,"Erstmals gibt es einen Chef für das deutsche Autobahnnetz. Stephan Krenz muss Tausende Brücken sanieren. Gehe es nicht schneller voran als bisher, droht den Städten eine enorme Verkehrsbelastung. Ein Interview.",https://media1.faz.net/ppmedia/aktuell/2456216053/1.8574365/facebook_teaser/nicht-ueberall-freie-fahrt-auf.jpg,2023-01-03T09:08:54Z,https://web.archive.org/web/20230103095511/https://www.faz.net/aktuell/wirtschaft/autobahn-sanierung-staedten-droht-eine-enorme-verkehrsbelastung-18574218.html,"Herr Krenz, Deutschland scheint voller Autobahnbaustellen zu sein. Werden die denn 2023 weniger werden?
In den Erhalt der Infrastruktur wurde in der Vergangenheit zu wenig investiert. Daher haben wi… [+3624 chars]",,de,'Sanierung'
