index,url,valid,domain,title,description,image,published,archive,content,quote,language,keyword
https://vorarlberg.orf.at/stories/3218172/,https://vorarlberg.orf.at/stories/3218172/,0,vorarlberg.orf.at,Honigernte fällt heuer besser aus als gedacht,"Die Honigernte fällt in diesem Jahr besser aus als gedacht. Das Imker-Jahr begann im April und im Mai zwar mit Dauerregen und Kälte, doch der warme Juni konnte die trüben Frühlingstage wieder wettmachen. Durchschnittlich werden in Vorarlberg jährlich rund 100…",https://ibs.orf.at/vbg?image=https%3A%2F%2Foekastatic.orf.at%2Fmims%2F2019%2F31%2F57%2Fcrops%2Fw%3D1200%2Ch%3D627%2Cq%3D75%2F243939_master_71157_honigernte_.jpg%3Fs%3D1ceeba5eae90ad59f46bc78e8335eaadeec59108,2023-08-01T03:45:58Z,https://web.archive.org/web/20230801042031/https://vorarlberg.orf.at/stories/3218172/,"Nach dem verregneten Mai brachte der Juni den Bienen eine Erholungsphase, so konnte das Blütenjahr gut genutzt werden, sagt Gerhard Mohr, der Präsident des Vorarlberger Imkerverbands.
Nach etlichen … [+1256 chars]",,de,'Kälte'
https://www.welt.de/wirtschaft/article246675930/Hans-Werner-Sinn-Der-Klimawandel-beschleunigt-sich-wegen-des-Verbrennerverbots.html,https://www.welt.de/wirtschaft/article246675930/Hans-Werner-Sinn-Der-Klimawandel-beschleunigt-sich-wegen-des-Verbrennerverbots.html,0,www.welt.de,„Der Klimawandel beschleunigt sich wegen des Verbrennerverbots“,"Ein Verbot von Verbrennungsmotoren ruiniere die Automobilindustrie und subventioniere Länder wie China, sagt der frühere Ifo-Chef Hans-Werner Sinn. Zu weniger Kohlenstoffemissionen führe das nicht, argumentiert der Ökonom – im Gegenteil.",https://img.welt.de/img/wirtschaft/mobile246675948/0111353457-ci16x9-w1200/Hans-Werner-Sinn.jpg,2023-08-01T04:22:59Z,https://web.archive.org/web/20230801144136/https://www.welt.de/wirtschaft/article246675930/Hans-Werner-Sinn-Der-Klimawandel-beschleunigt-sich-wegen-des-Verbrennerverbots.html,"Der emeritierte Präsident des Ifo-Instituts, Hans-Werner Sinn, kritisiert die Energiepolitik der Bundesregierung. Der CO-Ausstoß bei Öl, Kohle und Co. könne nur reduziert werden, wenn alle oder fast … [+1619 chars]",,de,'Kohle'
https://www.faz.net/aktuell/gesellschaft/australien-erzieher-soll-91-kinder-missbraucht-haben-19072641.html,https://www.faz.net/aktuell/gesellschaft/australien-erzieher-soll-91-kinder-missbraucht-haben-19072641.html,0,www.faz.net,Australien: Erzieher soll 91 Kinder missbraucht haben,91 Kinder soll der Mann zwischen 2007 und 2022 in Sydney und im Ausland missbraucht haben. Der Angeklagte sitzt bereits seit längerem in Haft.,https://media1.faz.net/ppmedia/aktuell/gesellschaft/3046316642/1.9072665/facebook_teaser/polizeiautos-in-sydney.jpg,2023-08-01T04:40:24Z,https://web.archive.org/web/20230801045050/https://www.faz.net/aktuell/gesellschaft/australien-erzieher-soll-91-kinder-missbraucht-haben-19072641.html,Ein ehemaliger Erzieher ist in Australien wegen 1623 Kindesmissbrauchsdelikten an 91 Kindern angeklagt worden. Dazu gehörten 136 Fälle von Vergewaltigung und 110 Fälle von Geschlechtsverkehr mit eine… [+907 chars],,de,'Kinder'
https://www.handelsblatt.com/unternehmen/energie/gaskonzern-uniper-nimmt-abschied-von-erdgas-und-kohle/29288792.html,https://www.handelsblatt.com/unternehmen/energie/gaskonzern-uniper-nimmt-abschied-von-erdgas-und-kohle/29288792.html,0,www.handelsblatt.com,Gaskonzern: Uniper will acht Milliarden Euro in grüne Transformation investieren,Der durch den Staat gerettete Gashändler legt eine neue Strategie vor. So will Uniper bis 2029 komplett aus der Kohleverstromung aussteigen.,https://www.handelsblatt.com/images/uniper-zentrale-in-duesseldorf/29289018/2-format2003.jpg,2023-08-01T06:21:30Z,,"Düsseldorf Der krisengeschüttelte Konzern Uniper hat eine neue Strategie zur Zukunft des Unternehmens. Bis 2030 will der Konzern acht Milliarden Euro investieren, um die eigenen Geschäftsbereiche nac… [+5050 chars]",,de,'Gas'
https://www.welt.de/wirtschaft/video246677094/Hans-Werner-Sinn-Der-Klimawandel-beschleunigt-sich-wegen-des-Verbrennerverbots.html,https://www.welt.de/wirtschaft/video246677094/Hans-Werner-Sinn-Der-Klimawandel-beschleunigt-sich-wegen-des-Verbrennerverbots.html,0,www.welt.de,„Der Klimawandel beschleunigt sich wegen des Verbrennerverbots“,"Der emeritierte Präsident des Ifo-Instituts, Hans-Werner Sinn, kritisiert die Energiepolitik der Bundesregierung. Der CO₂-Ausstoß bei Öl, Kohle und Co. könne nur reduziert werden, wenn „alle oder fast alle mitmachen, denn was wir nicht verbrauchen, verbrauche…",https://img.welt.de/img/wirtschaft/mobile246677260/1401352397-ci16x9-w1200/Hans-Werner-Sinn.jpg,2023-08-01T06:57:14Z,,"Die WELT als ePaper: Die vollständige Ausgabe steht Ihnen bereits am Vorabend zur Verfügung so sind Sie immer hochaktuell informiert. Weitere Informationen: http://epaper.welt.de 
 Der Kurz-Link die… [+49 chars]",,de,'Kohle'
https://www.stern.de/lifestyle/leute/serena-williams--geschlecht-von-zweitem-baby-enthuellt-33699798.html,https://www.stern.de/lifestyle/leute/serena-williams--geschlecht-von-zweitem-baby-enthuellt-33699798.html,0,www.stern.de,Serena Williams: Geschlecht von zweitem Baby enthüllt,Ein Kuchen-Streich und eine Enthüllung mit Drohnen: Serena Williams hat das Geschlecht ihres zweiten Babys erfahren.,https://image.stern.de/33699802/t/cp/v1/w1440/r1.7778/-/01--geschlecht-von-zweitem-baby-enthuellt---16-9---spoton-article-1049625.jpg,2023-08-01T07:12:00Z,https://web.archive.org/web/20230829110154/https://www.stern.de/lifestyle/leute/serena-williams--geschlecht-von-zweitem-baby-enthuellt-33699798.html,"Ein Kuchen-Streich und eine Enthüllung mit Drohnen: Serena Williams hat das Geschlecht ihres zweiten Babys erfahren.
Serena Williams (41) hat das Geschlecht ihres zweiten Babys erfahren - und verrie… [+1881 chars]",,de,'Geschlecht'
https://www.bild.de/regional/muenchen/muenchen-regional-politik-und-wirtschaft/muenchen-geldstrafe-fuer-gastro-queen-forster-kakerlaken-im-kismet-84884964.bild.html,https://www.bild.de/regional/muenchen/muenchen-regional-politik-und-wirtschaft/muenchen-geldstrafe-fuer-gastro-queen-forster-kakerlaken-im-kismet-84884964.bild.html,0,www.bild.de,"Geldstrafe für Gastro-Queen Forster - Mäusekot und Kakerlaken im „Kismet""",Im Kismet stellten Lebensmittel-Kontrolleure des KVR im Februar erhebliche Beanstandungen fest. Insgesamt 18 Mängel wurden aufgeführt.,"https://images.bild.de/64c7bd45f053a0369ebc0283/a3a068fb8539a0b1255d0d98244c4f99,b4b3e67b?w=1280",2023-08-01T07:37:44Z,,"München Im Betrieb herrschten unhygienische und ekelerregende Zustände!"" So formulierte es die Staatsanwaltschaft in einem Strafbefehl gegen die Münchner Gastro-Queen Sandra Forster (49). 
Sie führt… [+1806 chars]",,de,'Schimmel'
https://www.handelsblatt.com/politik/deutschland/energie-habeck-rahmen-fuer-foerderung-von-neuen-gaskraftwerken-steht-neuer-atomreaktor-geht-in-den-usa-ans-netz/28616386.html,https://www.handelsblatt.com/politik/deutschland/energie-habeck-rahmen-fuer-foerderung-von-neuen-gaskraftwerken-steht-neuer-atomreaktor-geht-in-den-usa-ans-netz/28616386.html,0,www.handelsblatt.com,+++ Energiekrise +++: Habeck: Rahmen für Förderung von neuen Gaskraftwerken steht – Neuer Atomreaktor geht in den USA ans Netz,Ölpreise haben stärksten Preisschub seit 18 Monaten hinter sich +++ Bericht: London will massiv in Kohlendioxidspeicherung investieren +++ Der Newsblog.,https://www.handelsblatt.com/images/bundeswirtschaftsminister-habeck/29290014/2-format2003.jpg,2023-08-01T08:28:42Z,https://web.archive.org/web/20230801100832/https://www.handelsblatt.com/politik/deutschland/energie-habeck-rahmen-fuer-foerderung-von-neuen-gaskraftwerken-steht-neuer-atomreaktor-geht-in-den-usa-ans-netz/28616386.html,"<li>Herr Max Heck19.07.2023, 09:54 Uhr
Die AfD kostet uns den Wohlstand
Der Unternehmer fordert Führungskräfte auf, Haltung gegen Intoleranz und Rechtsextremismus zu zeigen und gibt der Politik Tip… [+4235 chars]",,de,'Gasspeicher'
https://www.welt.de/wirtschaft/article246672194/Militaerputsch-im-Niger-Die-heikle-Uran-Abhaengigkeit-der-EU.html,https://www.welt.de/wirtschaft/article246672194/Militaerputsch-im-Niger-Die-heikle-Uran-Abhaengigkeit-der-EU.html,0,www.welt.de,Freiheit durch Atomkraft? Fall Niger zeigt die heikle Uran-Abhängigkeit der EU,"Wegen seines Urans ist kein Land auf der Welt für die Versorgung der europäischen Kernkraftwerke wichtiger als der Niger. Doch nun sorgt der militärische Putsch für Unruhen. Sollte die Produktion längere Zeit zum Erliegen kommen, steht die EU vor einer prekär…",https://img.welt.de/img/wirtschaft/mobile246674018/8261359787-ci16x9-w1200/Satellite-Image-of-Arlit-Uranium-Mine-Arlit-Niger.jpg,2023-08-01T08:37:49Z,https://web.archive.org/web/20230801090622/https://www.welt.de/wirtschaft/article246672194/Militaerputsch-im-Niger-Die-heikle-Uran-Abhaengigkeit-der-EU.html,"Vor wenigen Wochen noch schien alles gut. Wenigstens so gut, wie es das Unternehmen im Niger erwarten konnte in einem Land, das mal mehr, mal weniger stabil ist. Es gibt immer wieder Proteste und Dro… [+4235 chars]",,de,'Atomkraft'
https://www.n-tv.de/wirtschaft/Uniper-kehrt-Kohle-und-Erdgas-den-Ruecken-article24297758.html,https://www.n-tv.de/wirtschaft/Uniper-kehrt-Kohle-und-Erdgas-den-Ruecken-article24297758.html,0,www.n-tv.de,Klimaneutral bis 2040: Uniper kehrt Kohle und Erdgas den Rücken,Bislang basiert das Geschäftsmodell von Uniper vorrangig auf Erdgas. Doch damit soll schon bald Schluss sein. Nach der Rückkehr in die schwarzen Zahlen will der krisengeschüttelte Konzern acht Milliarden Euro in klimafreundlichere Technik investieren.,https://bilder1.n-tv.de/img/incoming/crop24285364/7341328127-cImg_16_9-w1200/fd4760619a012d02dcd06b4c50222d72.jpg,2023-08-01T08:51:39Z,,Bislang basiert das Geschäftsmodell von Uniper vorrangig auf Erdgas. Doch damit soll schon bald Schluss sein. Nach der Rückkehr in die schwarzen Zahlen will der krisengeschüttelte Konzern acht Millia… [+2057 chars],,de,'Gasspeicher'
https://www.tagesspiegel.de/wirtschaft/abschied-von-der-kohle-uniper-will-acht-milliarden-in-grunen-umbau-investieren-10243729.html,https://www.tagesspiegel.de/wirtschaft/abschied-von-der-kohle-uniper-will-acht-milliarden-in-grunen-umbau-investieren-10243729.html,0,www.tagesspiegel.de,Abschied von der Kohle: Uniper will acht Milliarden in grünen Umbau investieren,Der durch den Staat gerettete Gashändler legt eine neue Strategie vor. So will Uniper bis 2029 komplett aus der Kohleverstromung aussteigen.,https://www.tagesspiegel.de/images/uniper3/alternates/BASE_16_9_W1400/uniper.jpeg,2023-08-01T09:34:40Z,https://web.archive.org/web/20230801101411/https://www.tagesspiegel.de/wirtschaft/abschied-von-der-kohle-uniper-will-acht-milliarden-in-grunen-umbau-investieren-10243729.html,"Der krisengeschüttelte Konzern Uniper hat eine neue Strategie zur Zukunft des Unternehmens. Bis 2030 will der Konzern acht Milliarden Euro investieren, um die eigenen Geschäftsbereiche nachhaltiger a… [+5372 chars]",,de,'Kohle'
https://www.diepresse.com/13545926/serena-williams-gender-reveal-party-die-geschichte-hinter-dem-trend,https://www.diepresse.com/13545926/serena-williams-gender-reveal-party-die-geschichte-hinter-dem-trend,0,www.diepresse.com,Serena Williams „Gender Reveal“ Party: Die Geschichte hinter dem Trend,Mit einer „Gender Reveal“ Party feiert Tennisstar Serena Williams das Geschlecht ihres zweiten Kindes: Es wird ein Mädchen. Doch was steht hinter dem Trend „Gender Reveal“?,https://img.diepresse.com/public/incoming/gr8bk3-imago0235385134h.jpg/alternates/DPR_SOCIAL_NACHRICHTEN/imago0235385134h.jpg,2023-08-01T09:53:30Z,https://web.archive.org/web/20230801112315/https://www.diepresse.com/13545926/serena-williams-gender-reveal-party-die-geschichte-hinter-dem-trend,"Mit einer Gender Reveal Party feiert Tennisstar Serena Williams das Geschlecht ihres zweiten Kindes: Es wird ein Mädchen. Doch was steht hinter dem Trend Gender Reveal? 
Dass sie ein Mädchen bekommt… [+3026 chars]",,de,'Geschlecht'
https://www.stern.de/panorama/weltgeschehen/landkreis-kassel--zwei-familien-pruegeln-sich-auf-einem-spielplatz--33697122.html,https://www.stern.de/panorama/weltgeschehen/landkreis-kassel--zwei-familien-pruegeln-sich-auf-einem-spielplatz--33697122.html,0,www.stern.de,PANORAMA-NACHRICHTEN: Zwei Familien prügeln sich auf Spielplatz im Landkreis Kassel,Zwei Familien prügeln sich auf Spielplatz in Vellmar bei Kassel +++ Frau mit Kindern bei Unfall mit Traktor schwer verletzt +++ Motorcross-Festival versinkt im Chaos +++ Ausgewählte Panorama-Nachrichten aus Deutschland,https://image.stern.de/33700592/t/5o/v2/w1440/r1.7778/-/kassel-vellmar-spielplatz.jpg,2023-08-01T09:57:00Z,,Zwei Familien prügeln sich auf Spielplatz in Vellmar bei Kassel +++ Frau mit Kindern bei Unfall mit Traktor schwer verletzt +++ Motorcross-Festival versinkt im Chaos +++ Ausgewählte Panorama-Nachrich… [+13020 chars],,de,'Schwangere'
https://www.tagesschau.de/inland/gesellschaft/kita-platz-rechtsanspruch-100.html,https://www.tagesschau.de/inland/gesellschaft/kita-platz-rechtsanspruch-100.html,0,www.tagesschau.de,Betreuung für Unter-Dreijährige: Kita-Rechtsanspruch mit Lücken,Fast jedes Kind über drei Jahren wird in einer Kita betreut. Eltern jüngerer Kinder gehen aber oft leer aus. Wie kann das sein - zehn Jahre nach Einführung des Rechtsanspruchs auf einen Kitaplatz? Von Peter Sonnenberg.,https://images.tagesschau.de/image/9ebbf0e0-915b-41cf-a7c2-b199af6af9c5/AAABiayc8go/AAABibBxqrQ/16x9-1280/kita-rucksaecke-100.jpg,2023-08-01T10:08:17Z,https://web.archive.org/web/20230801113017/https://www.tagesschau.de/inland/gesellschaft/kita-platz-rechtsanspruch-100.html,"Stand: 01.08.2023 12:08 Uhr
Fast jedes Kind über drei Jahren wird in einer Kita betreut. Eltern jüngerer Kinder gehen aber oft leer aus. Wie kann das sein - zehn Jahre nach Einführung des Rechtsansp… [+6922 chars]",,de,'Ältere'
https://www.tagesschau.de/wirtschaft/unternehmen/uniper-strategie-klimaneutral-100.html,https://www.tagesschau.de/wirtschaft/unternehmen/uniper-strategie-klimaneutral-100.html,0,www.tagesschau.de,Gasimporteur Uniper will Geschäftsmodell neu ausrichten,"Vor gut einem Jahr stand das Energieunternehmen Uniper am Abgrund, der Bund musste es mit Milliardenhilfen retten. Heute geht es dem Konzern deutlich besser - und er will mittelfristig weg vom Geschäft mit Gas und Kohle. Von Volker Hirth.",https://images.tagesschau.de/image/42c37788-dad5-43f2-825e-be798d061b27/AAABibC4KBc/AAABibBxqrQ/16x9-1280/uniper-157.jpg,2023-08-01T11:03:38Z,,"Stand: 01.08.2023 13:03 Uhr
Vor gut einem Jahr stand das Energieunternehmen Uniper am Abgrund, der Bund musste es mit Milliardenhilfen retten. Heute geht es dem Konzern deutlich besser - und er will… [+2853 chars]",,de,'Gas'
https://www.wiwo.de/my/finanzen/immobilien/energetische-sanierung-wie-vermieter-die-miete-nach-einer-modernisierung-erhoehen-duerfen/29283426.html,https://www.wiwo.de/my/finanzen/immobilien/energetische-sanierung-wie-vermieter-die-miete-nach-einer-modernisierung-erhoehen-duerfen/29283426.html,0,www.wiwo.de,Energetische Sanierung: Wie Vermieter die Miete nach einer Modernisierung erhöhen dürfen,"Staatseingriffe wie das Heizungsgesetz machen Mieterhöhungen nach Sanierungen komplizierter. Welche Regeln gelten, wie Vermieter teure Fehler vermeiden.",https://www.wiwo.de/images/imago0160256864h/29289230/2-format11240.jpg,2023-08-01T11:20:24Z,https://web.archive.org/web/20230801132141/https://www.wiwo.de/my/finanzen/immobilien/energetische-sanierung-wie-vermieter-die-miete-nach-einer-modernisierung-erhoehen-duerfen/29283426.html,"Energetische Sanierung Wie Vermieter die Miete nach einer Modernisierung erhöhen dürfen
Staatseingriffe wie das Heizungsgesetz machen Mieterhöhungen nach Sanierungen komplizierter. Welche Regeln gel… [+13220 chars]",,de,'Sanierung'
https://www.tagesschau.de/inland/gesellschaft/rauchen-auto-verbot-100.html,https://www.tagesschau.de/inland/gesellschaft/rauchen-auto-verbot-100.html,0,www.tagesschau.de,Zigaretten im Auto: Schlimmer als jede Raucherkneipe,"Ein Entwurf des Bundesgesundheitsministeriums sieht vor: Rauchen im Auto soll künftig verboten sein, wenn Minderjährige oder Schwangere mitfahren. In vielen Ländern Europas ist das längst umgesetzt. Von Sebastian Grosser.",https://images.tagesschau.de/image/5b6ed1db-6e62-4dca-a57d-9b938c78f99d/AAABiauLfSg/AAABibBxqrQ/16x9-1280/raucher-auto-100.jpg,2023-08-01T12:15:02Z,,"Stand: 01.08.2023 14:15 Uhr
Ein Entwurf des Bundesgesundheitsministeriums sieht vor: Rauchen im Auto soll künftig verboten sein, wenn Minderjährige oder Schwangere im Auto mitfahren. In vielen Lände… [+5638 chars]",,de,'Schwangere'
https://www.zeit.de/gesellschaft/familie/2023-08/kitaplaetze-rechtsanspruch,https://www.zeit.de/gesellschaft/familie/2023-08/kitaplaetze-rechtsanspruch,0,www.zeit.de,Institut der deutschen Wirtschaft : Hunderttausende Kitaplätze fehlen trotz Rechtsanspruch auf Betreuung,Seit zehn Jahren gibt es den Anspruch auf einen Kitaplatz für Kinder ab einem Jahr. Dennoch ist die Betreuungslücke dem Kölner Wirtschaftsinstitut zufolge gewachsen.,,2023-08-01T12:16:48Z,https://web.archive.org/web/20230802093356/https://www.zeit.de/gesellschaft/familie/2023-08/kitaplaetze-rechtsanspruch,"When browsing with ads:
We collect personal data and also transmit it to third-party providers
 that help us improve and finance our digital content. Some of the information stored on your device, … [+821 chars]",,de,'Kinder'
https://shop.zeit.de/buecher/kinderbuecher/8509/zeit-edition-kunterbunte-gefuehle,https://shop.zeit.de/buecher/kinderbuecher/8509/zeit-edition-kunterbunte-gefuehle,0,shop.zeit.de,kunterbunte-gefuehle-teaser,"Mit der neuen ZEIT-Edition »Kunterbunte Gefühle« erhalten Kinder ab 4 Jahren Zugang zur großen Welt der Emotionen. Zu ganz verschiedenen Gefühlen wie Freude und Neugier, aber auch Wut oder Traurigkeit zeigen 8 ausgewählte...",https://zeitshop.cstatic.io/media/image/b8/a8/b5/44636_Kunterbunte_Gefuehle_VB_Packshot-mit-Hintergrund.jpg,2023-08-01T13:40:05Z,,"Mit der neuen ZEIT-Edition »Kunterbunte Gefühle« erhalten Kinder ab 4 Jahren Zugang zur großen Welt der Emotionen. Zu ganz verschiedenen Gefühlen wie Freude und Neugier, aber auch Wut oder Traurigkei… [+1216 chars]",,de,'Kinder'
https://www.wiwo.de/unternehmen/industrie/covestro-chef-die-frage-ist-doch-wofuer-das-geld-ausgegeben-wird-/29290750.html,https://www.wiwo.de/unternehmen/industrie/covestro-chef-die-frage-ist-doch-wofuer-das-geld-ausgegeben-wird-/29290750.html,0,www.wiwo.de,"Covestro-Chef: „Die Frage ist doch, wofür das Geld ausgegeben wird“","Covestro-CEO Markus Steilemann drängt die Ampelkoalition zu mehr Unterstützung. Er erklärt, warum er trotz allem noch Hoffnung für die deutsche Chemieindustrie hat – und warnt vor einer neuen Abhängigkeit bei Öl und Gas.",https://www.wiwo.de/images/covestro-corrosion-protection/29290930/2-format11240.jpg,2023-08-01T13:56:37Z,https://web.archive.org/web/20230801145205/https://www.wiwo.de/unternehmen/industrie/covestro-chef-die-frage-ist-doch-wofuer-das-geld-ausgegeben-wird-/29290750.html,"WirtschaftsWoche: Herr Steilemann, die deutsche Wirtschaft lahmt, die Chemieindustrie in Deutschland geht den Bach runter. Sie haben die Risiken selbst beschrieben: hohe Energiekosten und Steuern, sc… [+6500 chars]",,de,'Gas'
https://taz.de/Atomkraft-in-USA/!5947937/,https://taz.de/Atomkraft-in-USA/!5947937/,0,taz.de,Atomkraft in USA: Neuer Meiler am Netz,Nach mehr als 30 Jahren ist in den USA wieder ein AKW-Block in Betrieb genommen worden. Er soll die Renaissance der Atomkraft einläuten.,https://taz.de/picture/6426344/948/33319961-1.jpeg,2023-08-01T14:55:00Z,https://web.archive.org/web/20230801151328/https://taz.de/Atomkraft-in-USA/!5947937/,"Nach mehr als 30 Jahren ist in den USA wieder ein AKW-Block in Betrieb genommen worden. Er soll die Renaissance der Atomkraft einläuten.
Macht ordentlich Dampf: Der neue Atommeiler Vogtle 3 (Kühltur… [+2167 chars]",,de,'Atomkraft'
https://www.zeit.de/news/2023-08/02/vier-kinder-bei-autounfall-schwer-verletzt,https://www.zeit.de/news/2023-08/02/vier-kinder-bei-autounfall-schwer-verletzt,0,www.zeit.de,Hannover: Vier Kinder bei Autounfall schwer verletzt,,,2023-08-02T03:38:00Z,https://web.archive.org/web/20230803153832/https://www.zeit.de/news/2023-08/02/vier-kinder-bei-autounfall-schwer-verletzt,"When browsing with ads:
We collect personal data and also transmit it to third-party providers
 that help us improve and finance our digital content. Some of the information stored on your device, … [+821 chars]",,de,'Kinder'
https://www.welt.de/kmpkt/article246629126/Immer-laecheln-Aufschrei-in-Japan-nach-Flyer-ueber-schwangere-Frauen.html,https://www.welt.de/kmpkt/article246629126/Immer-laecheln-Aufschrei-in-Japan-nach-Flyer-ueber-schwangere-Frauen.html,0,www.welt.de,Japanische Stadt entschuldigt sich für Flyer über schwangere Frauen,Für Kind und Haushalt alles opfern und dabei immer gut gelaunt sein? Das Klischee versuchte die japanische Stadt Onomichi über Jahre hinweg zu verbreiten. Nun gab es Kritik – die Ungleichheit zwischen den Geschlechtern hat jedoch tiefere Wurzeln.,https://img.welt.de/img/kmpkt/mobile246637650/5401359867-ci16x9-w1200/GettyImages-1143082695.jpg,2023-08-02T05:26:13Z,,"Hausarbeiten nachgehen, den Ehemann massieren und immer schön lächeln: So sollten sich Frauen während der Schwangerschaft verhalten zumindest nach Ermessen der japanischen Stadt Onomichi. Die Lokalre… [+3935 chars]",,de,'Geschlecht'
https://taz.de/Sobo-Swobodniks-Film-Geschlechterkampf/!5947908/,https://taz.de/Sobo-Swobodniks-Film-Geschlechterkampf/!5947908/,0,taz.de,Sobo Swobodniks Film „Geschlechterkampf“: Dasein ohne faule Kompromisse,Punch auf Punch: In „Geschlechterkampf“ durchquert Hauptdarstellerin Margarita Breitkreiz in einem atemlosen Rausch geschlechtliche Abgründe.,https://taz.de/picture/6425771/948/margarita-breitkreiz-in-geschlechterkampf-c-filmgalerie-451-1.jpeg,2023-08-02T07:04:00Z,https://web.archive.org/web/20230802100609/https://taz.de/Sobo-Swobodniks-Film-Geschlechterkampf/!5947908/,"Punch auf Punch: In Geschlechterkampf durchquert Hauptdarstellerin Margarita Breitkreiz in einem atemlosen Rausch geschlechtliche Abgründe.
Bereit zum Angriff, hier mit Buch: Margarita Breitkreiz in… [+7692 chars]",,de,'Geschlecht'
https://www.handelsblatt.com/unternehmen/energie/energie-uniper-verabschiedet-sich-von-der-kohle/29288792.html,https://www.handelsblatt.com/unternehmen/energie/energie-uniper-verabschiedet-sich-von-der-kohle/29288792.html,0,www.handelsblatt.com,Gaskonzern: Uniper nimmt Abschied von der Kohle – Acht Milliarden für eine „grüne Transformation“,Der durch den Staat gerettete Gashändler legt eine neue Strategie vor. So will Uniper bis 2029 komplett aus der Kohleverstromung aussteigen.,https://www.handelsblatt.com/images/uniper-zentrale-in-duesseldorf/29289018/4-format2003.jpg,2023-08-02T07:29:34Z,https://web.archive.org/web/20230802075504/https://www.handelsblatt.com/unternehmen/energie/energie-uniper-verabschiedet-sich-von-der-kohle/29288792.html,"Düsseldorf Der krisengeschüttelte Konzern Uniper hat eine neue Zukunftsstrategie: Bis 2030 will der Konzern acht Milliarden Euro investieren, um die eigenen Geschäftsbereiche nachhaltiger aufzustelle… [+6110 chars]",,de,'Kohle'
https://www.basicthinking.de/blog/2023/08/02/interview-g2a/,https://www.basicthinking.de/blog/2023/08/02/interview-g2a/,0,www.basicthinking.de,Interview: Die Erfolgsstory von G2A – Digitale Vielfalt und Werte im Fokus,"In diesem Interview erklärt uns Dorota Wróbel, Chief R&D Officer von G2A.COM, das Konzept hinter dem Unternehmen und wie es die digitale Welt nutzt, um die Spieleindustrie voranzubringen. Sie erklärt, wie wichtig die Geschlechtervielfalt in der Branche ist un…",https://www.basicthinking.de/blog/wp-content/uploads/2023/07/g2a-vielfalt-in-der-gaming-branche.jpg,2023-08-02T07:30:34Z,https://web.archive.org/web/20230802073225/https://www.basicthinking.de/blog/2023/08/02/interview-g2a/,"In diesem Interview erklärt uns Dorota Wróbel, Chief R&amp;D Officer von G2A.COM, das Konzept hinter dem Unternehmen und wie es die digitale Welt nutzt, um die Spieleindustrie voranzubringen. Sie erk… [+11178 chars]",,de,'Ältere Generation'
https://www.bild.de/ratgeber/gesundheit/gesundheit/grippe-erkennen-und-behandeln-symptome-und-ursachen-im-ueberblick-84822934.bild.html,https://www.bild.de/ratgeber/gesundheit/gesundheit/grippe-erkennen-und-behandeln-symptome-und-ursachen-im-ueberblick-84822934.bild.html,0,www.bild.de,"Symptome, Ursachen, Behandlung - Grippe: Alles, was Sie wissen müssen","Die Symptome einer Grippe ähneln oft der einer Erkältung. Wie man sie erkennt und am besten behandelt, lesen Sie hier.","https://images.bild.de/64c0db6c3d0fd24c12015eb9/f6b39163c6c0ae21bc61888c7beb4cbb,3099b369?w=1280",2023-08-02T07:51:44Z,,"Fieber, Appetitlosigkeit und Schüttelfrost können Anzeichen einer Erkältung sein. Oder einer Grippe!
Der spürbare Unterschied zwischen beiden 
Krankheiten liegt in der Schwere und Dauer der Symptom… [+8665 chars]",,de,'ältere Mensch'
