index,url,valid,domain,title,description,image,published,archive,content,quote,language,keyword
https://www.wissenschaft.de/zeitpunkte/14-oktoberdurchbruch-in-sachen-bildung/,https://www.wissenschaft.de/zeitpunkte/14-oktoberdurchbruch-in-sachen-bildung/,0,www.wissenschaft.de,Durchbruch in Sachen Bildung,"In der Republik Polen-Litauen beherrschten lange Zeit die Jesuiten das Bildungswesen. Sie betrieben ein ganzes System von Jesuitenschulen, die, wenngleich in den Augen mancher Aufklärer allzu konservativ ausgerichtet, vielen Kindern und Jugendlichen Bildung e…",,2023-10-01T05:00:46Z,,"In der Republik Polen-Litauen beherrschten lange Zeit die Jesuiten das Bildungswesen. Sie betrieben ein ganzes System von Jesuitenschulen, die, wenngleich in den Augen mancher Aufklärer allzu konserv… [+1226 chars]",,de,'Kinder'
https://www.welt.de/kultur/kino/plus247748094/Kino-Warum-der-neue-Paw-Patrol-Film-nichts-fuer-Kinder-unter-6-Jahren-ist.html,https://www.welt.de/kultur/kino/plus247748094/Kino-Warum-der-neue-Paw-Patrol-Film-nichts-fuer-Kinder-unter-6-Jahren-ist.html,0,www.welt.de,Warum der neue „Paw Patrol“-Film nichts für Kinder unter 6 Jahren ist,"„Paw Patrol“ gilt als Schrecken der Eltern – und hat mit seinem Teamgedanken doch eine Generation geprägt. Auf Netflix laufen Dutzende Serien, die das pädagogische Prinzip kopieren. Im neuen Kinofilm buhlt die Hundestaffel nun um ein neues Publikum – und geht…",https://img.welt.de/img/kultur/kino/mobile247748096/9761354697-ci16x9-w1200-fnov-fpotl-fpi157750653/Paw-Patrol-The-Mighty-Movie-3.jpg,2023-10-01T05:50:36Z,,"Die WELT als ePaper: Die vollständige Ausgabe steht Ihnen bereits am Vorabend zur Verfügung so sind Sie immer hochaktuell informiert. Weitere Informationen: http://epaper.welt.de 
 Der Kurz-Link die… [+49 chars]",,de,'Kinder'
https://orf.at/stories/3333104/,https://orf.at/stories/3333104/,0,orf.at,Gasspeicher zu Beginn der Heizsaison gut gefüllt,,https://orf.at/mojo/1_4_1/storyserver//news/common/images/og-fallback-news.png,2023-10-01T06:07:57Z,https://web.archive.org/web/20231002013715/https://orf.at/stories/3333104/,"Österreich kann der mit 1. Oktober beginnenden Heizsaison wohl mit Blick auf den Gasspeicherstand gelassen entgegensehen: Die Speicher sind derzeit zu 94 Prozent gefüllt, teilte das Klimaschutzminist… [+687 chars]",,de,'Gasspeicher'
https://www.stern.de/gesellschaft/regional/bayern/straubing--19-jaehrige-tritt-schwangerer-frau-in-den-bauch-33875190.html,https://www.stern.de/gesellschaft/regional/bayern/straubing--19-jaehrige-tritt-schwangerer-frau-in-den-bauch-33875190.html,0,www.stern.de,Straubing: 19-Jährige tritt schwangerer Frau in den Bauch,"Während eines Streits soll eine Frau in Straubing einer 18-jährigen Schwangeren in den Bauch getreten haben. Die Schwangere sei dabei leicht verletzt worden, ihrem ungeborenen Baby gehe es aber gut, teilte die Polizei am Sonntag mit. Demnach waren die beiden …",https://image.stern.de/33875192/t/Tv/v1/w1440/r1.7778/-/01--urnnewsmldpacom2009010123100199399328v2w800h600l1372t600r3372b1929jpeg---5433c71c064565d0.jpg,2023-10-01T07:30:49Z,,"Während eines Streits soll eine Frau in Straubing einer 18-jährigen Schwangeren in den Bauch getreten haben. Die Schwangere sei dabei leicht verletzt worden, ihrem ungeborenen Baby gehe es aber gut, … [+779 chars]",,de,'Schwangere'
https://www.diepresse.com/17710908/gasspeicher-zum-beginn-der-heizsaison-gut-gefuellt,https://www.diepresse.com/17710908/gasspeicher-zum-beginn-der-heizsaison-gut-gefuellt,0,www.diepresse.com,Gasspeicher zum Beginn der Heizsaison gut gefüllt,Die Gasspeicher sind bis zu 94 Prozent gefüllt. Im Vorjahr habe man so viel gar nicht verbraucht.,https://img.diepresse.com/public/incoming/ujb9dx-imago-images-0303064515/alternates/DPR_SOCIAL_NACHRICHTEN/imago%20images%200303064515,2023-10-01T07:34:08Z,,"Die Gasspeicher sind bis zu 94 Prozent gefüllt. Im Vorjahr habe man so viel gar nicht verbraucht. 
Österreich kann der mit 1. Oktober beginnenden Heizsaison gelassen entgegensehen: Die Gasspeicher s… [+976 chars]",,de,'Gas'
https://www.zeit.de/news/2023-10/01/info-portal-zur-sanierung-im-denkmalschutz-gestartet,https://www.zeit.de/news/2023-10/01/info-portal-zur-sanierung-im-denkmalschutz-gestartet,0,www.zeit.de,Energieeffizienz: Info-Portal zur Sanierung im Denkmalschutz gestartet,,,2023-10-01T07:38:19Z,,"When browsing with ads:
We collect personal data and also transmit it to third-party providers
 that help us improve and finance our digital content. Some of the information stored on your device, … [+821 chars]",,de,'Sanierung'
https://www.stern.de/gesellschaft/regional/hessen/energieeffizienz--info-portal-zur-sanierung-im-denkmalschutz-gestartet-33875212.html,https://www.stern.de/gesellschaft/regional/hessen/energieeffizienz--info-portal-zur-sanierung-im-denkmalschutz-gestartet-33875212.html,0,www.stern.de,Energieeffizienz: Info-Portal zur Sanierung im Denkmalschutz gestartet,"Wer sein denkmalgeschütztes Haus in Hessen energetisch sanieren will, kann sich künftig auf einem neuen digitalen Ratgeberportal informieren. Das Landesamt für Denkmalpflege und die Landesenergieagentur haben unter der Adresse www.denkmalschutz-und-modernisie…",https://image.stern.de/33875214/t/Ia/v1/w1440/r1.7778/-/01--urnnewsmldpacom2009010123100199399420v2w800h600l479t322r1438b966jpeg---b351fe7c11e7dc5c.jpg,2023-10-01T07:38:19Z,,"Wer sein denkmalgeschütztes Haus in Hessen energetisch sanieren will, kann sich künftig auf einem neuen digitalen Ratgeberportal informieren. Das Landesamt für Denkmalpflege und die Landesenergieagen… [+1828 chars]",,de,'Sanierung'
https://salzburg.orf.at/stories/3226423/,https://salzburg.orf.at/stories/3226423/,0,salzburg.orf.at,Salzburg AG: Teurere Gaspreise nun scharf,Für Gaskunden der Salzburg AG erhöht sich der Gaspreis ab Sonntag um das Doppelte. Die Kilowattstunde kostet nun zwölf Cent brutto statt wie bisher knapp sechs Cent. Der Energieversorger hat die Preiserhöhung zuletzt mit Turbulenzen auf den Energiemärkten beg…,https://ibs.orf.at/sbg?image=https%3A%2F%2Foekastatic.orf.at%2Fmims%2F2023%2F24%2F65%2Fcrops%2Fw%3D1200%2Ch%3D627%2Cq%3D75%2F1827646_master_682065_nz6_5877.jpg%3Fs%3Dad543f41717bc541c11c1b47b3fdf3f4dfe694ce,2023-10-01T08:00:00Z,,"Für einen Haushalt mit einem Durchschnittsverbrauch von 15.000 kWh bedeutet das monatliche Mehrkosten von 74 Euro brutto. Für Härtefälle hat die Salzburg AG Unterstützungen angekündigt. Haushalte, di… [+737 chars]",,de,'Gas'
https://www.zeit.de/news/2023-10/01/radfahrer-von-projektil-getroffen-schuetzen-wohl-kinder,https://www.zeit.de/news/2023-10/01/radfahrer-von-projektil-getroffen-schuetzen-wohl-kinder,0,www.zeit.de,Hanau: Radfahrer von Projektil getroffen: Schützen wohl Kinder,,,2023-10-01T08:32:23Z,,"When browsing with ads:
We collect personal data and also transmit it to third-party providers
 that help us improve and finance our digital content. Some of the information stored on your device, … [+821 chars]",,de,'Kinder'
https://orf.at/stories/3333115/,https://orf.at/stories/3333115/,0,orf.at,Niederlande schließen Europas größtes Gasfeld,,https://orf.at/mojo/1_4_1/storyserver//news/common/images/og-fallback-news.png,2023-10-01T08:36:21Z,,Die Niederlande haben die Förderung aus Europas größtem Gasfeld in der Provinz Groningen eingestellt. Nach Behördenangaben wurde die Produktion in dem seit Jahren von Erdbeben erschütterten Groningen… [+1101 chars],,de,'Gas'
https://www.sueddeutsche.de/politik/duesseldorf-gaslaternen-licht-klima-1.6261260,https://www.sueddeutsche.de/politik/duesseldorf-gaslaternen-licht-klima-1.6261260,0,www.sueddeutsche.de,Nordrhein-Westfalen: Kampf ums Licht,"Jede fünfte Straßenlampe in Düsseldorf brennt noch mit Gas. Aber wie lange noch? Die Stadt will die fossilen Laternen verschrotten - und stößt auf Gegenwehr von Bürgern, die ein Stück Geschichte und ein ""Weltkulturerbe"" verteidigen.",https://www.sueddeutsche.de/image/sz.1.6261261/1200x675?v=1696152567,2023-10-01T09:18:45Z,,"Jede fünfte Straßenlampe in Düsseldorf brennt noch mit Gas. Aber wie lange noch? Die Stadt will die fossilen Laternen verschrotten - und stößt auf Gegenwehr von Bürgern, die ein Stück Geschichte und … [+478 chars]",,de,'Gas'
https://www.focus.de/panorama/oktoberfest/oktoberfest-budget-ami-gruppe-laesst-es-auf-der-wiesn-krachen-doch-dann-kommt-die-mega-rechnung_id_215151993.html,https://www.focus.de/panorama/oktoberfest/oktoberfest-budget-ami-gruppe-laesst-es-auf-der-wiesn-krachen-doch-dann-kommt-die-mega-rechnung_id_215151993.html,0,www.focus.de,Oktoberfest-Budget - So viel Kohle gibt Gruppe von Amerikanern auf der Wiesn aus,Eine Gruppe Amerikaner lässt es auf dem Oktoberfest richtig krachen – und die Mega-Rechnung kann sich sehen lassen. Doch auch andere Wiesn-Besucher rechnen mit hohen Ausgaben für die Wiesn-Party.Von FOCUS-online-Reporter Niklas Golitschek,https://p6.focus.de/img/fotos/id_215152082/wiesn-oktoberfest.jpg?im=Crop%3D%280%2C117%2C1136%2C568%29%3BResize%3D%281200%2C627%29&impolicy=perceptual&quality=mediumHigh&hash=baa4a30fd223e360c12afbe0bec6478474781c847f188ca779f07b46618f9eb7,2023-10-01T09:45:29Z,,Eine Gruppe Amerikaner lässt es auf dem Oktoberfest richtig krachen und die Mega-Rechnung kann sich sehen lassen. Doch auch andere Wiesn-Besucher rechnen mit hohen Ausgaben für die Wiesn-Party.Für Ma… [+2946 chars],,de,'Kohle'
https://www.focus.de/finanzen/news/gastbeitrag-von-rainer-zitelmann-nicht-der-markt-sondern-der-staat-versagt-dauernd-jedoch-anders-als-sie-denken_id_214421134.html,https://www.focus.de/finanzen/news/gastbeitrag-von-rainer-zitelmann-nicht-der-markt-sondern-der-staat-versagt-dauernd-jedoch-anders-als-sie-denken_id_214421134.html,0,www.focus.de,"Gastbeitrag von Rainer Zitelmann - Der Staat versagt - aber nicht so, wie Sie vielleicht denken","Viele Probleme in Deutschland haben ihre Ursache nicht in einem zu starken oder zu schwachen Staat. Der Staat ist vielmehr dort zu stark, wo er schwach sein sollte und dort zu schwach, wo er eigentlich stark sein sollte.Von FOCUS-online-Gastautor Rainer Zitel…",https://p6.focus.de/img/fotos/id_203861678/scholz-bemueht-sich-79132183.jpg?im=Crop%3D%280%2C74%2C3923%2C1964%29%3BResize%3D%281200%2C627%29&impolicy=perceptual&quality=mediumHigh&hash=3b84a6812f5e783dd81c946d547b98437022ebef94b94bfd9ea716f47bca42ee,2023-10-01T09:47:23Z,,"Viele Probleme in Deutschland haben ihre Ursache nicht in einem zu starken oder zu schwachen Staat. Der Staat ist vielmehr dort zu stark, wo er schwach sein sollte und dort zu schwach, wo er eigentli… [+7021 chars]",,de,'Gas'
https://www.sueddeutsche.de/wirtschaft/man-energy-solutions-gasturbinen-china-1.6265722,https://www.sueddeutsche.de/wirtschaft/man-energy-solutions-gasturbinen-china-1.6265722,0,www.sueddeutsche.de,China: Ein heißes Geschäft,"Das Augsburger Unternehmen MAN Energy Solutions hat für seine kleine Gasturbinen-Sparte einen chinesischen Käufer gewählt. Experten befürchten nun, dass die Turbinen auch militärisch genutzt und wichtige Technologien abgezogen werden könnten.",https://www.sueddeutsche.de/image/sz.1.5720820/1200x675?v=1696156006,2023-10-01T10:28:30Z,,"Das Augsburger Unternehmen MAN Energy Solutions hat für seine kleine Gasturbinen-Sparte einen chinesischen Käufer gewählt. Experten befürchten nun, dass die Turbinen auch militärisch genutzt und wich… [+1100 chars]",,de,'Gas'
https://www.focus.de/finanzen/landtagswahlen-lidl-gaspreise-15-wichtige-aenderungen-ab-oktober-2023_id_208151929.html,https://www.focus.de/finanzen/landtagswahlen-lidl-gaspreise-15-wichtige-aenderungen-ab-oktober-2023_id_208151929.html,0,www.focus.de,"Landtagswahlen, Lidl, Gaspreise - Die wichtigsten Änderungen ab Oktober 2023","Viele Änderungen kommen ab Oktober 2023. Wichtig werden unter anderem die Landtagswahlen sowie die veränderte Gasumlage, die sich auf den Gaspreis positiv auswirken könnte. Fünfzehn wichtige Änderungen lesen Sie hier im Überblick.",https://p6.focus.de/img/fotos/id_208164251/aenderungen-ab-oktober-2023.jpg?im=Crop%3D%2822%2C0%2C566%2C283%29%3BResize%3D%281200%2C627%29&impolicy=perceptual&quality=mediumHigh&hash=f13cb703d9003cba166c079649208ebf3f7159cc0a80482c5c3950eacdc77555,2023-10-01T10:58:57Z,,"Viele Änderungen kommen ab Oktober 2023. Wichtig werden unter anderem die Landtagswahlen sowie die veränderte Gasumlage, die sich auf den Gaspreis positiv auswirken könnte. Fünfzehn wichtige Änderung… [+7216 chars]",,de,'Gas'
https://www.tagesspiegel.de/berlin/bezirke/obdachlosigkeit-in-berlin-lichtenberg-safe-spaces-fur-frauen-und-trans-personen-10557256.html,https://www.tagesspiegel.de/berlin/bezirke/obdachlosigkeit-in-berlin-lichtenberg-safe-spaces-fur-frauen-und-trans-personen-10557256.html,0,www.tagesspiegel.de,Obdachlosigkeit in Berlin-Lichtenberg: „Safe Spaces“ für Frauen* und nicht binäre Personen,Der Bezirk Lichtenberg plant seit Jahren Safe Places für obdachlose Menschen. Bei der Umsetzung hackt es noch. Nun soll das Klientel erweitert werden.,https://www.tagesspiegel.de/berlin/images/neuer-inhalt-5315/alternates/BASE_16_9_W1400/neuer-inhalt-5315.jpeg,2023-10-01T11:04:02Z,,"Seit Jahren bekommt es der Bezirk Berlin-Lichtenberg nicht hin, Safe Places für obdachlose Menschen einzurichten, obwohl es mehrfach konkrete Planungen dazu gegeben hat. Es sollen Orte sein, auf dene… [+3080 chars]",,de,'Obdachlosigkeit'
https://ooe.orf.at/stories/3226472/,https://ooe.orf.at/stories/3226472/,0,ooe.orf.at,Seniorenbund: Mehr Geld für Pflege daheim,"Der Oberösterreichische Seniorenbundes fordert anlässlich des Tages der älteren Generation am Sonntag, mehr Geld vom Bund für die Betreuung von pflegebedürftigen Menschen. Denn ein Platz in einem Pflegeheim würde dem Bund weit mehr kosten, so Seniorenbund Obm…",https://ibs.orf.at/ooe?image=https%3A%2F%2Foekastatic.orf.at%2Fmims%2F2023%2F34%2F02%2Fcrops%2Fw%3D1200%2Ch%3D627%2Cq%3D75%2F1914223_master_718302_themenbild_pflegepflegepersonalkrankenpflegegesundheitsbedienstetepatientspitalkrankenhaus_6.jpg%3Fs%3D6b6d788d58aa85129a515913b1bc2ec5ca993827,2023-10-01T13:41:53Z,,In den eigenen vier Wänden altern. Das würde laut einer Studie des Wirtschafts- und Forschungsinstitutes Imas für 73 Prozent der befragten Menschen über 60 in Oberösterreich an Bedeutung gewinnen. Am… [+707 chars],,de,'ältere Mensch'
https://www.tagesspiegel.de/internationales/holland-schliesst-europas-grosstes-gasfeld-kaum-auf-langfristige-risiken-geachtet-10558402.html,https://www.tagesspiegel.de/internationales/holland-schliesst-europas-grosstes-gasfeld-kaum-auf-langfristige-risiken-geachtet-10558402.html,0,www.tagesspiegel.de,Holland schließt Europas größtes Gasfeld : „Kaum auf langfristige Risiken geachtet“,Die holländische Regierung will die verbleibenden Bohrlöcher im Gasfeld Groningen bis Oktober 2024  „dauerhaft schließen“. Anwohner klagen seit Jahrzehnten über Erdbeben.,https://www.tagesspiegel.de/images/files-netherlands-environment-energy-gas-earthquake/alternates/BASE_16_9_W1400/files-netherlands-environment-energy-gas-earthquake.jpeg,2023-10-01T19:58:28Z,,Holland hat die Förderung aus Europas größtem Gasfeld in der Provinz Groningeneingestellt. Nach Behördenangaben wurde die Produktion in dem seit Jahren von Erdbeben erschütterten Groningen-Feld am So… [+3228 chars],,de,'Gas'
https://orf.at/stories/3333123/,https://orf.at/stories/3333123/,0,orf.at,Groningen soll nicht mehr beben,Jahrelang ist die Region Groningen in den Niederlanden von Hunderten Erdbeben heimgesucht worden. Am Sonntag wurde die Förderung aus Europas größtem Gasfeld offiziell eingestellt. Elf Bohrlöcher des in den 1960er Jahren eröffneten Standorts sollen jedoch im F…,https://ibs.orf.at/news?image=https%3A%2F%2Fassets.orf.at%2Fmims%2F2023%2F40%2F47%2Fcrops%2Fw%3D1200%2Ch%3D630%2Cq%3D75%2F1957800_master_736547_niederlande_gasfeld_schliesst_afp.jpg%3Fs%3D14eba3b76b949f265ef21e12bb89c523b4996231,2023-10-01T21:29:58Z,,"Die unterirdischen Gasfelder bei Groningen im Norden der Niederlande sind die größten Vorkommen in Europa. Seit mehr als zwei Jahrzehnten klagen die Anrainer und Anrainerinnen über Erdbeben, die dire… [+4670 chars]",,de,'Gas'
https://www.telepolis.de/features/Wie-der-Staat-mit-RWE-kooperiert-um-die-Umweltkatastrophe-zu-verschaerfen-9322684.html,https://www.telepolis.de/features/Wie-der-Staat-mit-RWE-kooperiert-um-die-Umweltkatastrophe-zu-verschaerfen-9322684.html,0,www.telepolis.de,"Wie der Staat mit RWE kooperiert, um die Umweltkatastrophe zu verschärfen","Polizei lässt Konzern-Trupps räumen. Politische Drehtüren schwingen, Grenzen zwischen dem Energieriesen und Kommunen verwischen. Über die Macht der schmutzigen Kohle in Deutschland.",https://heise.cloudimg.io/bound/1200x1200/q85.png-lossy-85.webp-lossy-85.foil1/_www-heise-de_/imgs/18/4/3/1/2/1/0/5/Polizei_Luetzerath_2-0bde60dc99c628a1.jpeg,2023-10-01T22:00:00Z,,"Nach der Räumung in Lützerath, Anfang 2023. Bild: unwisemonkeys / CC BY-NC 2.0 Deed
Polizei lässt Konzern-Trupps räumen. Politische Drehtüren schwingen, Grenzen zwischen dem Energieriesen und Kommun… [+3781 chars]",,de,'Kohle'
https://www.tagesschau.de/ausland/europa/bulgarien-kohleausstieg-protest-100.html,https://www.tagesschau.de/ausland/europa/bulgarien-kohleausstieg-protest-100.html,0,www.tagesschau.de,Bulgariens Kohlearbeiter wehren sich gegen Klimaschutz-Pläne,"Auch Bulgarien hat den Ausstieg aus der Kohle beschlossen - auf den letzten Drücker, um sich 2,2 Milliarden Euro EU-Hilfen zu sichern. In den Kohleregionen gibt es Proteste dagegen. Klimaschutz-Argumente sind kaum zu hören. Von Silke Hahnen.",https://images.tagesschau.de/image/c30a8bf2-953b-4083-a935-9421f5515fab/AAABiu2fppU/AAABibBxqrQ/16x9-1280/bulgarien-kohleausstieg-protest-102.jpg,2023-10-01T23:42:57Z,,"Stand: 02.10.2023 01:42 Uhr
Auch Bulgarien hat den Ausstieg aus der Kohle beschlossen - auf den letzten Drücker, um sich 2,2 Milliarden Euro EU-Hilfen zu sichern. In den Kohleregionen gibt es Protes… [+3376 chars]",,de,'Kohle'
https://www.dw.com/de/europas-gr%C3%B6%C3%9Ftes-erdgasfeld-ist-geschlossen/a-66977050,https://www.dw.com/de/europas-gr%C3%B6%C3%9Ftes-erdgasfeld-ist-geschlossen/a-66977050,0,www.dw.com,Europas größtes Erdgasfeld ist geschlossen,Die Niederlande haben die Produktion aus den Gasfeldern in der Provinz Groningen eingestellt. 60 Jahre lang wurde dort Gas gefördert. Der Staat hat viel Geld verdient. Doch die Region hat Schäden davongetragen.,https://static.dw.com/image/66898421_6.jpg,2023-10-02T01:00:00Z,,"Die unterirdischen Gasfelder bei Groningen im Norden der Niederlande sind die größten Vorkommen in Europa. Seit den 1960er Jahren wird das Erdgas hier gefördert, rund 2300 Milliarden Kubikmeter holte… [+1956 chars]",,de,'Gas'
https://www.zeit.de/news/2023-10/02/autos-mit-steinen-beworfen-kinder-im-verdacht,https://www.zeit.de/news/2023-10/02/autos-mit-steinen-beworfen-kinder-im-verdacht,0,www.zeit.de,Neckar-Odenwald-Kreis: Autos mit Steinen beworfen: Kinder im Verdacht,,,2023-10-02T12:14:15Z,,"When browsing with ads:
We collect personal data and also transmit it to third-party providers
 that help us improve and finance our digital content. Some of the information stored on your device, … [+821 chars]",,de,'Kinder'
https://www.zeit.de/news/2023-10/02/polizei-sexuelle-uebergriffe-auf-kinder-in-schwimmbad,https://www.zeit.de/news/2023-10/02/polizei-sexuelle-uebergriffe-auf-kinder-in-schwimmbad,0,www.zeit.de,Ermittlungen: Polizei: Sexuelle Übergriffe auf Kinder in Schwimmbad,,,2023-10-02T12:23:03Z,,"When browsing with ads:
We collect personal data and also transmit it to third-party providers
 that help us improve and finance our digital content. Some of the information stored on your device, … [+821 chars]",,de,'Kinder'
https://www.pcgames.de/Frostpunk-2-Spiel-73439/Specials/Preview-Vorschau-PC-Release-Steam-Epic-Games-Store-GoG-1430282/,https://www.pcgames.de/Frostpunk-2-Spiel-73439/Specials/Preview-Vorschau-PC-Release-Steam-Epic-Games-Store-GoG-1430282/,0,www.pcgames.de,Frostpunk 2 Vorschau: Das wird eins der besten Strategiespiele 2024!,"Die Kälte ist bezwungen, doch der Kampf ums Überleben geht weiter. Während die Stadt in Frostpunk 2 neue Größen erreicht, wachsen mit ihr auch die sozialen Spannungen. Unsere XL-Vorschau zum vielversprechenden Survival-Aufbauspiel.",https://www.pcgames.de/screenshots/medium/2021/08/Frostpunk_2_liar_art_logo-pc-games.jpg,2023-10-02T14:00:00Z,,"Im nervenaufreibenden Kampf gegen die eisige Kälte müssen Stadtverwalter im anspruchsvollen Aufbau-Strategie-Hit Frostpunk oftmals harte Entscheidungen treffen. Die Ressourcen sind durchgehend knapp,… [+6319 chars]",,de,'Kälte'
https://www.zeit.de/news/2023-10/02/flasche-beschaedigt-giftiges-gas-ausgetreten,https://www.zeit.de/news/2023-10/02/flasche-beschaedigt-giftiges-gas-ausgetreten,0,www.zeit.de,Landkreis Ravensburg: Flasche beschädigt: Giftiges Gas ausgetreten,,,2023-10-02T14:28:49Z,,"When browsing with ads:
We collect personal data and also transmit it to third-party providers
 that help us improve and finance our digital content. Some of the information stored on your device, … [+821 chars]",,de,'Gas'
https://www.zeit.de/zeit-magazin/2023/41/krieg-europa-ukraine-russland-neuer-eiserner-vorhang,https://www.zeit.de/zeit-magazin/2023/41/krieg-europa-ukraine-russland-neuer-eiserner-vorhang,0,www.zeit.de,Krieg in Europa: Wo die Welt sich teilt,"Ein neuer Eiserner Vorhang teilt Europa, seit Russlands die Ukraine angreift. Unser Reporter ist ihn entlang gereist – und traf besorgte Alte und Kinder in Uniformen.",,2023-10-02T14:40:44Z,,"When browsing with ads:
We collect personal data and also transmit it to third-party providers
 that help us improve and finance our digital content. Some of the information stored on your device, … [+821 chars]",,de,'Kinder'
https://wien.orf.at/stories/3226605/,https://wien.orf.at/stories/3226605/,0,wien.orf.at,„Schimmelspürhunde“ erschnüffeln Befall,"Das gute Riechvermögen von Hunden wird schon lange eingesetzt, um etwa Menschen oder Drogen aufzuspüren. In Wien gibt es nun eine Firma, die so genannte „Schimmelspürhunde“ vermietet – sie kommen in Wohnungen und erschnüffeln selbst unsichtbaren Schimmelbefal…",https://ibs.orf.at/wie?image=https%3A%2F%2Foekastatic.orf.at%2Fmims%2F2023%2F40%2F79%2Fcrops%2Fw%3D1200%2Ch%3D627%2Cq%3D75%2F1958939_master_736979_whatsapp_image_2023-09-29_at_10.06.34_4.jpeg%3Fs%3Dc8ca90ad077e4edbf94a2b95e86dda9bac213bd4,2023-10-03T03:02:00Z,,Der Jack Russel Terrier Sam und sein Besitzer Raphael Ledwina sind dieses Mal in einem Reihenhaus in der Donaustadt im Einsatz: Die Besitzerin hatte bereits Probleme mit Schimmel nun hat sie die Firm… [+1951 chars],,de,'Schimmel'
https://www.n-tv.de/politik/Bundesregierung-wertet-Energiegeld-Bilanz-als-Erfolg-article24437916.html,https://www.n-tv.de/politik/Bundesregierung-wertet-Energiegeld-Bilanz-als-Erfolg-article24437916.html,0,www.n-tv.de,560 Millionen Euro ausgezahlt: Bundesregierung wertet Energiegeld-Bilanz als Erfolg,"Mittels Energiepauschale sollen Studenten und Fachschüler vom Bund entlastet werden. Pro Person stehen 200 Euro zur Verfügung. Seit Frühjahr können sie diese beantragen. Nun gibt es erste Zahlen, wie viele Menschen das Angebot wahrgenommen haben - und die Reg…",https://bilder3.n-tv.de/img/incoming/crop24437926/6981328624-cImg_16_9-w1200/399916726.jpg,2023-10-03T03:34:35Z,,"Mittels Energiepauschale sollen Studenten und Fachschüler vom Bund entlastet werden. Pro Person stehen 200 Euro zur Verfügung. Seit Frühjahr können sie diese beantragen. Nun gibt es erste Zahlen, wie… [+1670 chars]",,de,'Energiepauschale'
https://www.zeit.de/arbeit/2023-09/vollzeit-arbeiten-zwillinge-familie-alltag,https://www.zeit.de/arbeit/2023-09/vollzeit-arbeiten-zwillinge-familie-alltag,0,www.zeit.de,"Vollzeit arbeiten mit Zwillingen: ""Ich würde sogar gern noch mehr arbeiten""","Sie hat drei Jobs, er zwei, gemeinsam erziehen sie Zwillinge. Ein Paar erzählt, dass fünf Jobs und zwei Kinder leichter zu organisieren sind als ein gemeinsamer Haushalt.",,2023-10-03T04:50:10Z,,"When browsing with ads:
We collect personal data and also transmit it to third-party providers
 that help us improve and finance our digital content. Some of the information stored on your device, … [+821 chars]",,de,'Kinder'
https://www.zeit.de/news/2023-10/03/immer-mehr-wohnungslose-menschen-kommen-in-notunterkuenfte,https://www.zeit.de/news/2023-10/03/immer-mehr-wohnungslose-menschen-kommen-in-notunterkuenfte,0,www.zeit.de,Obdachlosigkeit: Immer mehr wohnungslose Menschen kommen in Notunterkünfte,,,2023-10-03T07:27:01Z,,"When browsing with ads:
We collect personal data and also transmit it to third-party providers
 that help us improve and finance our digital content. Some of the information stored on your device, … [+821 chars]",,de,'Obdachlosigkeit'
