index,url,valid,domain,title,description,image,published,archive,content,quote,language,keyword
https://www.freitag.de/autoren/hahalter/und-rauchen-verboten,https://www.freitag.de/autoren/hahalter/und-rauchen-verboten,0,www.freitag.de,und | Rauchen verboten,"die reine Vernunft Kürzlich kam eine ältere Frau zu meinem »Schalter«, den ich in einer kleinen Bibliothek bewache, und fragt mich, ob ich den Rauch rieche? Sofort bin ich elektrisiert, und bereit, den Brandalarmknopf zu betätigen, den es leider in meiner Näh…",https://www.freitag.de/++theme++freitag.theme/freitag/fallbacks/fallback-community-3-2.png,2022-12-15T15:55:13Z,,"Kürzlich kam eine ältere Frau zu meinem »Schalter«, den ich in einer kleinen Bibliothek bewache, und fragt mich, ob ich den Rauch rieche? Sofort bin ich elektrisiert, und bereit, den Brandalarmknopf … [+4583 chars]",,de,'ältere Mensch'
https://www.handelsblatt.com/unternehmen/energie/gasspeicher-fuellstand-ausspeicherung-erreicht-wegen-kaelte-rekordwert/28819652.html,https://www.handelsblatt.com/unternehmen/energie/gasspeicher-fuellstand-ausspeicherung-erreicht-wegen-kaelte-rekordwert/28819652.html,0,www.handelsblatt.com,Energieversorgung: Gasspeicher leeren sich so schnell wie noch in diesem Winter,Ein hoher Speicher-Füllstand ist für Deutschlands Gasversorgung in der Energiekrise essenziell. Wie steht es aktuell um die Reserven? Ein Überblick.,https://www.handelsblatt.com/images/gasspeicher-nahe-muenchen/28819656/4-format2003.jpg,2022-12-15T16:02:41Z,https://web.archive.org/web/20221215170827/https://www.handelsblatt.com/unternehmen/energie/gasspeicher-fuellstand-ausspeicherung-erreicht-wegen-kaelte-rekordwert/28819652.html,"Gasspeicher nahe MünchenDer Füllstand der deutschen Gasspeicher ist in der Energiekrise zum wichtigen Faktor geworden.
(Foto: dpa)
Düsseldorf Die Kälte in Deutschland und Europa verschärft dieser T… [+8578 chars]",,de,'Gasspeicher'
https://www.welt.de/politik/deutschland/article242707201/Diskriminierung-Ab-diesem-Alter-gelten-Sie-in-Deutschland-als-alt.html,https://www.welt.de/politik/deutschland/article242707201/Diskriminierung-Ab-diesem-Alter-gelten-Sie-in-Deutschland-als-alt.html,0,www.welt.de,Ab diesem Alter gelten Sie in Deutschland als alt,"Hierzulande herrschen fragwürdige Rollenklischees über ältere Menschen. Diese würden oft als mächtige „Verhinderer“ notwendiger Veränderungen dargestellt, zeigt eine Studie. Und was sagt die Antidiskriminierungsbeauftragte Ferda Ataman zum Feindbild „alter we…",https://img.welt.de/img/politik/deutschland/mobile242707195/6661353107-ci16x9-w1200/Cheerful-senior-friends-enjoying-outdoor-night-concert-in-city-2.jpg,2022-12-15T16:14:51Z,,"Ab wann gelten Menschen in unserer Gesellschaft als alt? Wer sich diese Frage schon einmal bangen Herzens gestellt hat, hat am Donnerstag eine Antwort bekommen. Ab 61 Jahren. Das ist der Durchschnitt… [+4426 chars]",,de,'ältere Mensch'
https://www.focus.de/kultur/vermischtes/pietro-lombardi-liebkosungen-fuer-laura-und-das-ungeborene-baby_id_180457387.html,https://www.focus.de/kultur/vermischtes/pietro-lombardi-liebkosungen-fuer-laura-und-das-ungeborene-baby_id_180457387.html,0,www.focus.de,DSDS-Star gibt EindrÃ¼cke auf Instagram - Nach Klinik-Aufenthalt von Laura Maria zeigt sich Pietro Lombardi erleichtert,Die vergangenen Tage waren fÃ¼r DSDS-Star Pietro Lombardi und seine schwangere Verlobte nicht einfach. Denn Laura Maria musste wegen Komplikationen ins Krankenhaus. Nun ist das Paar aber wieder Zuhause und lÃ¤sst seine Fans am Alltag teilhaben.,https://p6.focus.de/img/kultur/vermischtes/id_180446704/pietro-lombardi-moechte-jeden-weg-mit-seiner-laura-maria-gehen..jpg?im=Crop%3D%280%2C125%2C1000%2C500%29%3BResize%3D%281200%2C627%29&impolicy=perceptual&quality=medium&hash=ab19fb2c0f5292f2e79682be6f73bd8fe92f2be91fecabae3ac687c87e6ff858,2022-12-15T16:40:53Z,https://web.archive.org/web/20221215171000/https://www.focus.de/kultur/vermischtes/pietro-lombardi-liebkosungen-fuer-laura-und-das-ungeborene-baby_id_180457387.html,"Pietro Lombardi und seine schwangere Freundin Laura Maria sind nach ihrem kurzen Krankenhausaufenthalt wieder zu Hause. Pietro hat auf Instagram ein Foto von ihr gepostet und bestÃ¤tigt, dass sie wiedâ€¦ [+1822 chars]",,de,'Schwangere'
https://www.handelsblatt.com/unternehmen/energie/energiekrise-gasimporteur-vng-bekommt-850-millionen-euro-neues-kapital/28871438.html,https://www.handelsblatt.com/unternehmen/energie/energiekrise-gasimporteur-vng-bekommt-850-millionen-euro-neues-kapital/28871438.html,0,www.handelsblatt.com,Energiekrise: Gasimporteur VNG bekommt 850 Millionen Euro neues Kapital,"Die Anteilseigner EnBW, VUB und OEW erhöhen das Eigenkapital des Leipziger Unternehmens. Zuvor hatte VNG bereits hunderte Millionen Euro vom Staat zugesagt bekommen.",https://www.handelsblatt.com/images/untergrund-gasspeicher-von-vng/28871480/2-format2003.jpg,2022-12-15T17:27:03Z,https://web.archive.org/web/20221215224356/https://www.handelsblatt.com/unternehmen/energie/energiekrise-gasimporteur-vng-bekommt-850-millionen-euro-neues-kapital/28871438.html,"Untergrund-Gasspeicher von VNGDas Unternehmen erhält neben Staatshilfen nun auch 850 Millionen Euro von den Anteilseignern.
(Foto: dpa)
Karlsruhe, Leipzig, Berlin Der Leipziger Gasimporteur VNG bek… [+1222 chars]",,de,'Gas'
https://www.tagesspiegel.de/obdachlosen-helfen-berlins-sharing-autos-mit-kaltekits-ausgestattet-9027601.html,https://www.tagesspiegel.de/obdachlosen-helfen-berlins-sharing-autos-mit-kaltekits-ausgestattet-9027601.html,0,www.tagesspiegel.de,Obdachlosen helfen: Berlins Sharing-Autos mit Kältekits ausgestattet,Aktiv gegen Obdachlosigkeit auch beim Autofahren helfen. Dieses Ziel will das Carsharing-Unternehmen Miles Mobility mit Kältekits in ihren Autos erreichen.,,2022-12-15T17:39:34Z,https://web.archive.org/web/20221216082005/https://www.tagesspiegel.de/obdachlosen-helfen-berlins-sharing-autos-mit-kaltekits-ausgestattet-9027601.html,"In Berlin sind nach allgemeinen Schätzungen 10.000 Menschen von Obdachlosigkeit betroffen, sie verbringen ihre Winternächte draußen, auf gefrorenem Boden. Oliver Mackprang möchte dieser akuten Krise … [+200 chars]",,de,'Obdachlosigkeit'
https://www.tagesspiegel.de/berlin/hilfe-fur-obdachlose-berliner-carsharing-anbieter-stattet-autos-mit-kaltekits-aus-9027601.html,https://www.tagesspiegel.de/berlin/hilfe-fur-obdachlose-berliner-carsharing-anbieter-stattet-autos-mit-kaltekits-aus-9027601.html,0,www.tagesspiegel.de,Hilfe für Obdachlose: Berliner Carsharing-Anbieter stattet Autos mit Wärme-Kits aus,Aktiv gegen Obdachlosigkeit auch beim Autofahren helfen. Dieses Ziel will das Carsharing-Unternehmen Miles Mobility mit Kältekits in seinen Autos erreichen.,https://www.tagesspiegel.de/images/neu-in-berlin-warmedreieck/alternates/BASE_16_9_W1400/neu-in-berlin-waermedreieck.jpeg,2022-12-15T17:39:34Z,https://web.archive.org/web/20221216114734/https://www.tagesspiegel.de/berlin/hilfe-fur-obdachlose-berliner-carsharing-anbieter-stattet-autos-mit-kaltekits-aus-9027601.html,"In Berlin sind nach allgemeinen Schätzungen 10.000 Menschen von Obdachlosigkeit betroffen, sie verbringen ihre Winternächte draußen, auf gefrorenem Boden. Oliver Mackprang möchte dieser akuten Krise … [+208 chars]",,de,'Kälte'
https://www.sueddeutsche.de/muenchen/ebersberg/landkreis-ebersberg-kinderbetreuung-kindertagesstaetten-corona-personalnot-1.5716059,https://www.sueddeutsche.de/muenchen/ebersberg/landkreis-ebersberg-kinderbetreuung-kindertagesstaetten-corona-personalnot-1.5716059,0,www.sueddeutsche.de,FachkrÃ¤ftemangel: Der lange Arm der Pandemie,"Geschlossene Gruppen, Ã¼berarbeitete Mitarbeiterinnen und Personalnot: Viele KindertagesstÃ¤tten im Landkreis Ebersberg haben derzeit mit einigen Problemen zu kÃ¤mpfen - und befinden sich seit Corona in einem Teufelskreis.",https://www.sueddeutsche.de/image/sz.1.4940960/1200x675?v=1671119593,2022-12-15T20:38:14Z,https://web.archive.org/web/20221216105124/https://www.sueddeutsche.de/muenchen/ebersberg/landkreis-ebersberg-kinderbetreuung-kindertagesstaetten-corona-personalnot-1.5716059,"Geschlossene Gruppen, Ã¼berarbeitete Mitarbeiterinnen und Personalnot: Viele KindertagesstÃ¤tten im Landkreis Ebersberg haben derzeit mit einigen Problemen zu kÃ¤mpfen - und befinden sich seit Corona inâ€¦ [+7112 chars]",,de,'Kinder'
https://www.stern.de/news/bundesrat-entscheidet-am-freitag-ueber-gaspreisbremse-33012716.html,https://www.stern.de/news/bundesrat-entscheidet-am-freitag-ueber-gaspreisbremse-33012716.html,0,www.stern.de,Bundesrat entscheidet am Freitag über Gaspreisbremse,"Der Bundesrat entscheidet am Freitag (ab 09.30 Uhr) über die Gas- und Strompreisbremse. Die Neuregelung sieht vor, dass der Gaspreis für Bürgerinnen und Bürger sowie kleine und mittlere Unternehmen bei bis zu 80 Prozent des Verbrauchs auf zwölf Cent je Kilowa…",https://image.stern.de/33012718/t/qh/v1/w1440/r1.7778/-/16--bundesrat-in-berlin---42e76b9775c1b89f.jpg,2022-12-16T03:19:28Z,,"Der Bundesrat entscheidet am Freitag (ab 09.30 Uhr) über die Gas- und Strompreisbremse. Die Neuregelung sieht vor, dass der Gaspreis für Bürgerinnen und Bürger sowie kleine und mittlere Unternehmen b… [+602 chars]",,de,'Gas'
https://www.stern.de/politik/ausland/gipfeltreffen--gaspreise--sanktionen--ungarn--eu-gibt-sich-geschlossen-33012734.html,https://www.stern.de/politik/ausland/gipfeltreffen--gaspreise--sanktionen--ungarn--eu-gibt-sich-geschlossen-33012734.html,0,www.stern.de,"Gipfeltreffen: Gaspreise, Sanktionen, Ungarn: EU gibt sich geschlossen","Ein zufriedener Kanzler, ein Megadeal - und kein Streit bis tief in die Nacht: Der letzte EU-Gipfel 2022 war in vielerlei Hinsicht besonders. Doch nicht bei allen Themen sind die Aussichten gleich rosig.",https://image.stern.de/33012736/t/OR/v1/w1440/r1.7778/-/16--urnnewsmldpacom2009010122121699919358v3w800h600l563t128r1843b981jpeg---bf3920d274966218.jpg,2022-12-16T03:41:34Z,,"Ein zufriedener Kanzler, ein Megadeal - und kein Streit bis tief in die Nacht: Der letzte EU-Gipfel 2022 war in vielerlei Hinsicht besonders. Doch nicht bei allen Themen sind die Aussichten gleich ro… [+5532 chars]",,de,'Gas'
https://oe3.orf.at/stories/3029726/,https://oe3.orf.at/stories/3029726/,0,oe3.orf.at,Christopher Seiler – Menschliche Wärme gegen klirrende Kälte,"Auf an Bangl liegt a Toda und da Schnee deckt eam zua, singen Seiler und Speer in ihrem Weihnachtslied „Der letzte Schnee“. Damit so etwas künftig nicht in unserem Land passiert, engagiert sich Christopher Seiler nun bei der Caritas und schnürt dort Gruft-Win…",https://tubestatic.orf.at/static/images/site/tube/20221250/gruft1.5989150.jpg,2022-12-16T05:10:00Z,https://web.archive.org/web/20221217071524/https://oe3.orf.at/stories/3029726/,"Auf an Bangl liegt a Toda und da Schnee deckt eam zua, singen Seiler und Speer in ihrem Weihnachtslied Der letzte Schnee. Damit so etwas künftig nicht in unserem Land passiert, engagiert sich Christo… [+3078 chars]",,de,'Kälte'
https://www.zeit.de/news/2022-12/16/nrw-europaminister-fuer-mehr-gasimporte-ueber-belgien,https://www.zeit.de/news/2022-12/16/nrw-europaminister-fuer-mehr-gasimporte-ueber-belgien,0,www.zeit.de,Energieversorgung: NRW-Europaminister für mehr Gasimporte über Belgien,,,2022-12-16T05:42:34Z,https://web.archive.org/web/20221216074626/https://www.zeit.de/news/2022-12/16/nrw-europaminister-fuer-mehr-gasimporte-ueber-belgien,"When browsing with ads:
We collect personal data and also transmit it to third-party providers
 that help us improve and finance our digital content. Some of the information stored on your device, … [+732 chars]",,de,'Gas'
https://www.stern.de/gesellschaft/regional/nordrhein-westfalen/energieversorgung--nrw-europaminister-fuer-mehr-gasimporte-ueber-belgien-33012924.html,https://www.stern.de/gesellschaft/regional/nordrhein-westfalen/energieversorgung--nrw-europaminister-fuer-mehr-gasimporte-ueber-belgien-33012924.html,0,www.stern.de,Energieversorgung: NRW-Europaminister für mehr Gasimporte über Belgien,"Nordrhein-Westfalens Europaminister Nathanael Liminski fordert angesichts der Gaskrise eine stärkere Westorientierung in der deutschen Energiepolitik. ""Bei der Sicherung der Energieversorgung konzentriert sich die Bundesregierung zu einseitig in Richtung Nord…",https://image.stern.de/33012926/t/Bk/v1/w1440/r1.7778/-/16--urnnewsmldpacom2009010122121699920645v3w800h600l547t138r1827b991jpeg---7d0bb24058e01773.jpg,2022-12-16T05:42:34Z,,"Nordrhein-Westfalens Europaminister Nathanael Liminski fordert angesichts der Gaskrise eine stärkere Westorientierung in der deutschen Energiepolitik. ""Bei der Sicherung der Energieversorgung konzent… [+2698 chars]",,de,'Gas'
https://www.wiwo.de/politik/ausland/ukraine-krieg-die-lage-am-freitag-neue-eu-sanktionen-gegen-russland/28116300.html,https://www.wiwo.de/politik/ausland/ukraine-krieg-die-lage-am-freitag-neue-eu-sanktionen-gegen-russland/28116300.html,0,www.wiwo.de,Ukraine-Krieg – die Lage am Freitag: Neue EU-Sanktionen gegen Russland,Die EU hat am Donnerstag ihr neuntes Sanktionspaket gegen Russland auf den Weg gebracht. Auch den Gaspreis wollen die Europäer deckeln. Kiew fordert derweil mehr Waffen für den Sieg. Aktuelle Ukraine-News im Überblick.,https://www.wiwo.de/images/ukraine-krieg-bachmut/28871984/4-format11240.jpg,2022-12-16T05:42:55Z,https://web.archive.org/web/20221216114317/https://www.wiwo.de/politik/ausland/ukraine-krieg-die-lage-am-freitag-neue-eu-sanktionen-gegen-russland/28116300.html,Die Europäische Union hat sich nach tagelangem Ringen auf ein neues Sanktionspaket gegen Russland verständigt das inzwischen neunte. Betroffen ist unter anderem der Bankensektor. Darüber hinaus soll … [+5779 chars],,de,'Gas'
https://www.handelsblatt.com/politik/international/ukraine-die-lage-am-morgen-neue-eu-sanktionen-gegen-russland-gaspreis-soll-gedeckelt-werden/28144208.html,https://www.handelsblatt.com/politik/international/ukraine-die-lage-am-morgen-neue-eu-sanktionen-gegen-russland-gaspreis-soll-gedeckelt-werden/28144208.html,0,www.handelsblatt.com,Ukraine – Die Lage am Morgen: Neue EU-Sanktionen gegen Russland – Gaspreis soll gedeckelt werden,Die EU hat am Donnerstag ihr neuntes Sanktionspaket gegen Russland auf den Weg gebracht. Auch den Gaspreis wollen die Europäer deckeln. Kiew fordert derweil mehr Waffen für den Sieg,https://www.handelsblatt.com/images/russischer-angriff-auf-charkiw/28871992/3-format2003.jpg,2022-12-16T05:49:52Z,https://web.archive.org/web/20221216114952/https://www.handelsblatt.com/politik/international/ukraine-die-lage-am-morgen-neue-eu-sanktionen-gegen-russland-gaspreis-soll-gedeckelt-werden/28144208.html,"Russischer Angriff auf CharkiwPolizisten betrachten eingesammelten Fragmente, die nach ukrainischen Angaben von russischen Raketen stammen, die in Charkiw eingeschlagen sind.
(Foto: dpa)
Brüssel/Ki… [+6767 chars]",,de,'Gas'
https://www.sueddeutsche.de/politik/eu-gaspreisdeckel-afrika-twitter-journalisten-1.5716642,https://www.sueddeutsche.de/politik/eu-gaspreisdeckel-afrika-twitter-journalisten-1.5716642,0,www.sueddeutsche.de,SZ am Morgen: Nachrichten des Tages - die Übersicht für Eilige,"EU deckelt Gaspreis, USA geben 2,5 Milliarden Dollar an Afrika, Twitter sperrt kritische Journalisten.",https://www.sueddeutsche.de/image/sz.1.5716404/1200x675?v=1671169661,2022-12-16T06:09:52Z,https://web.archive.org/web/20221216075127/https://www.sueddeutsche.de/politik/eu-gaspreisdeckel-afrika-twitter-journalisten-1.5716642,"Was wichtig ist und wird.Was heute wichtig ist
Die EU deckelt den Gaspreis. Beim Gipfel in Brüssel räumen Kanzler Scholz und die anderen Staats- und Regierungschefs letzte Streitpunkte aus. Nur bei … [+2305 chars]",,de,'Gas'
https://www.wiwo.de/politik/europa/gipfeltreffen-gaspreise-sanktionen-ungarn-eu-gibt-sich-geschlossen/28871842.html,https://www.wiwo.de/politik/europa/gipfeltreffen-gaspreise-sanktionen-ungarn-eu-gibt-sich-geschlossen/28871842.html,0,www.wiwo.de,"EU: Gaspreise, Sanktionen, Ungarn: EU gibt sich geschlossen","Ein zufriedener Kanzler, ein Megadeal - und kein Streit bis tief in die Nacht: Der letzte EU-Gipfel 2022 war in vielerlei Hinsicht besonders. Doch nicht bei allen Themen sind die Aussichten gleich rosig.",https://www.wiwo.de/images/eu-gipfel/28871840/1-format11240.jpg,2022-12-16T06:11:16Z,https://web.archive.org/web/20221216114805/https://www.wiwo.de/politik/europa/gipfeltreffen-gaspreise-sanktionen-ungarn-eu-gibt-sich-geschlossen/28871842.html,Beim letzten regulären Gipfel des Jahres haben die Staats- und Regierungschefs der EU-Staaten etliche Streitpunkte aus dem Weg geräumt. Am Ende eines vom russischen Krieg gegen die Ukraine geprägten … [+5832 chars],,de,'Gas'
https://www.stern.de/wirtschaft/news/energiekrise--gewerkschaft--preisbremsen--gutes-paket---aber-nachschaerfen-33012994.html,https://www.stern.de/wirtschaft/news/energiekrise--gewerkschaft--preisbremsen--gutes-paket---aber-nachschaerfen-33012994.html,0,www.stern.de,"Energiekrise: Gewerkschaft: Preisbremsen ""gutes Paket"", aber nachschärfen","Viel Zeit hatten Regierung und Parlament nicht, um Entlastungen für Bürger und Wirtschaft wegen der Rekordpreise für Energie auf den Weg zu bringen. Ein Mitglied der Gaskommission hält das Ergebnis bei dem Druck für tragbar.",https://image.stern.de/33012996/t/1j/v1/w1440/r1.7778/-/16--urnnewsmldpacom2009010122121699920882v3w800h600l847t192r1763b1020jpeg---65343d05d796b6ef.jpg,2022-12-16T06:12:23Z,,"Viel Zeit hatten Regierung und Parlament nicht, um Entlastungen für Bürger und Wirtschaft wegen der Rekordpreise für Energie auf den Weg zu bringen. Ein Mitglied der Gaskommission hält das Ergebnis b… [+2830 chars]",,de,'Gas'
https://www.morgenpost.de/wirtschaft/article237164681/Gewerkschaft-Preisbremsen-gutes-Paket-aber-nachschaerfen.html,https://www.morgenpost.de/wirtschaft/article237164681/Gewerkschaft-Preisbremsen-gutes-Paket-aber-nachschaerfen.html,0,www.morgenpost.de,"Energiekrise: Gewerkschaft: Preisbremsen „gutes Paket“, aber nachschärfen","Viel Zeit hatten Regierung und Parlament nicht, um Entlastungen für Bürger und Wirtschaft wegen der Rekordpreise für Energie auf den Weg zu bringen. Ein Mitglied der Gaskommission hält das Ergebnis bei dem Druck für tragbar.",https://img.morgenpost.de/img/wirtschaft/crop237164679/6442608663-w820-cv16_9-q85/Michael-Vassiliadis.jpg,2022-12-16T06:12:23Z,,"Berlin/Hannover. Der IG-BCE-Chef und Co-Vorsitzende der Gaskommission, Michael Vassiliadis, sieht mit den vom Bundestag beschlossenen Energiepreisbremsen einen wichtigen Schritt zur Entlastung von Ve… [+2603 chars]",,de,'Gas'
https://www.n-tv.de/politik/Das-waere-deutlich-sinnvoller-als-die-Giesskanne-article23787254.html,https://www.n-tv.de/politik/Das-waere-deutlich-sinnvoller-als-die-Giesskanne-article23787254.html,0,www.n-tv.de,"Schneider zur Gaspreisbremse: ""Das wäre deutlich sinnvoller als die Gießkanne""","Der Bundestag hat die Gas- und Strompreisbremse beschlossen. Alle Verbraucher werden entlastet, unabhängig von ihrem Einkommen. Im Interview mit ntv.de kritisiert Ulrich Schneider vom Paritätischen das. Ihm zufolge hätte es bessere Alternativen gegeben.",https://bilder4.n-tv.de/img/incoming/crop23496855/834132289-cImg_16_9-w1200/296928374.jpg,2022-12-16T06:15:58Z,https://web.archive.org/web/20221216073625/https://www.n-tv.de/politik/Das-waere-deutlich-sinnvoller-als-die-Giesskanne-article23787254.html,"Der Bundestag hat die Gas- und Strompreisbremse beschlossen. Alle Verbraucher werden entlastet, unabhängig von ihrem Einkommen. Im Interview mit ntv.de kritisiert Ulrich Schneider vom Paritätischen W… [+5717 chars]",,de,'Gas'
https://www.handelsblatt.com/politik/international/eu-gipfel-gaspreisdeckel-sanktionen-und-ein-megadeal-scholz-spuert-in-bruessel-seltenen-moment-der-zufriedenheit/28872054.html,https://www.handelsblatt.com/politik/international/eu-gipfel-gaspreisdeckel-sanktionen-und-ein-megadeal-scholz-spuert-in-bruessel-seltenen-moment-der-zufriedenheit/28872054.html,0,www.handelsblatt.com,"EU-Gipfel: Gaspreisdeckel, Sanktionen und ein Megadeal – Scholz spürt in Brüssel „seltenen Moment der Zufriedenheit“",Ein zufriedener Kanzler und kein Streit bis tief in die Nacht: Der letzte EU-Gipfel dieses Jahres war in vielerlei Hinsicht besonders. Die Ergebnisse im Überblick.,https://www.handelsblatt.com/images/bundeskanzler-olaf-scholz/28872076/3-format2003.jpg,2022-12-16T06:34:06Z,https://web.archive.org/web/20221216072831/https://www.handelsblatt.com/politik/international/eu-gipfel-gaspreisdeckel-sanktionen-und-ein-megadeal-scholz-spuert-in-bruessel-seltenen-moment-der-zufriedenheit/28872054.html,Brüssel Beim letzten regulären Gipfel des Jahres haben die Staats- und Regierungschefs der EU-Staaten etliche Streitpunkte aus dem Weg geräumt. Am Ende eines vom russischen Krieg gegen die Ukraine ge… [+5537 chars],,de,'Gas'
https://www.wiwo.de/politik/deutschland/energiekrise-gewerkschaft-preisbremsen-gutes-paket/28872030.html,https://www.wiwo.de/politik/deutschland/energiekrise-gewerkschaft-preisbremsen-gutes-paket/28872030.html,0,www.wiwo.de,Energie: Gewerkschaft: Preisbremsen „gutes Paket“,"Viel Zeit hatten Regierung und Parlament nicht, um Entlastungen für Bürger und Wirtschaft wegen der Rekordpreise für Energie auf den Weg zu bringen. Ein Mitglied der Gaskommission hält das Ergebnis bei dem Druck für tragbar.",https://www.wiwo.de/images/michael-vassiliadis/28872028/1-format11240.jpg,2022-12-16T07:10:29Z,https://web.archive.org/web/20221216114620/https://www.wiwo.de/politik/deutschland/energiekrise-gewerkschaft-preisbremsen-gutes-paket/28872030.html,"Der IG-BCE-Chef und Co-Vorsitzende der Gaskommission, Michael Vassiliadis, sieht mit den vom Bundestag beschlossenen Energiepreisbremsen einen wichtigen Schritt zur Entlastung von Verbrauchern und In… [+3130 chars]",,de,'Gas'
https://www.welt.de/wirtschaft/article242713835/EU-Gaspreisdeckel-Europas-beispielloser-Eingriff-in-die-Maerkte.html,https://www.welt.de/wirtschaft/article242713835/EU-Gaspreisdeckel-Europas-beispielloser-Eingriff-in-die-Maerkte.html,0,www.welt.de,Europas beispielloser Eingriff in die Märkte,Die Bundesregierung hat sich monatelang gegen einen europäischen Gaspreisdeckel gewehrt. Nach dem EU-Gipfel in Brüssel ist klar: Er dürfte trotzdem kommen. Doch eine entscheidende Frage ist noch offen.,https://img.welt.de/img/wirtschaft/mobile242713837/9381356517-ci16x9-w1200/EU-Gipfel.jpg,2022-12-16T07:12:00Z,https://web.archive.org/web/20221216122116/https://www.welt.de/wirtschaft/article242713835/EU-Gaspreisdeckel-Europas-beispielloser-Eingriff-in-die-Maerkte.html,Es kam auf drei Wörter an. Am Donnerstagabend verkündeten die 27 Staats- und Regierungschefs der Europäischen Union nach einem Gipfel in Brüssel einen beispiellosen Schritt. Sie wollen den Gaspreis d… [+4441 chars],,de,'Gas'
https://www.faz.net/aktuell/politik/hoeegh-esperanza-spezialschiff-fuer-fluessigerdgas-terminal-in-wilhelmshaven-18538682.html,https://www.faz.net/aktuell/politik/hoeegh-esperanza-spezialschiff-fuer-fluessigerdgas-terminal-in-wilhelmshaven-18538682.html,0,www.faz.net,Spezialschiff für Flüssigerdgas-Terminal erreicht Wilhelmshaven,"Mit der Ankunft des Spezialschiffes ist das Importterminal für Flüssigerdgas komplett - noch fehlen nötige Genehmigungen. Bis das erste Gas von dem Schiff in das deutsche Gasnetz eingespeist werden soll, dauert es aber wohl nicht mehr lang.",https://media1.faz.net/ppmedia/aktuell/wirtschaft/2178985563/1.8538681/facebook_teaser/das-spezialschiff-hoeegh.jpg,2022-12-16T07:29:48Z,https://web.archive.org/web/20221216083601/https://www.faz.net/aktuell/politik/hoeegh-esperanza-spezialschiff-fuer-fluessigerdgas-terminal-in-wilhelmshaven-18538682.html,"Wer den deutschen Einstieg in den Import von Flüssigerdgas (LNG) am Horizont vor Wilhelmshaven als Erstes erkennen wollte, musste genau hinschauen: Nur langsam zeichnete sich der dunkelblaue Rumpf de… [+5286 chars]",,de,'Gas'
"https://www.ndr.de/nachrichten/info/So-hoch-ist-der-Gasverbrauch-in-Deutschland-aktuell,gasverbrauch104.html","https://www.ndr.de/nachrichten/info/So-hoch-ist-der-Gasverbrauch-in-Deutschland-aktuell,gasverbrauch104.html",0,www.ndr.de,So hoch ist der Gasverbrauch in Deutschland aktuell - NDR.de,"<ol><li>So hoch ist der Gasverbrauch in Deutschland aktuell  NDR.de
</li><li>Gas: Sparziel „deutlich verfehlt“ - Zwei Indikatoren im kritischen Bereich - WELT  WELT
</li><li>Gasspeicher in Deutschland: Füllmenge sinkt wegen Kälte  t-online - Finanzen
</li>…",https://www.ndr.de/home/kaelte388_v-contentxl.jpg,2022-12-16T07:30:00Z,"https://web.archive.org/web/20221215172059/https://www.ndr.de/nachrichten/info/So-hoch-ist-der-Gasverbrauch-in-Deutschland-aktuell,gasverbrauch104.html","Stand: 16.12.2022 08:30 Uhr
Wegen niedriger Temperaturen wurde im Dezember weniger Gas gespart als Experten fordern. Droht nun ein Gasmangel? Aktuelle Daten helfen bei der Einordnung. Sie zeigen, wi… [+6203 chars]",,de,'Gasspeicher'
