index,url,valid,domain,title,description,image,published,archive,content,quote,language,keyword
https://www.morgenpost.de/politik/ausland/article239131061/Rund-30-Migranten-nach-zwei-Schiffbruechen-vermisst.html,https://www.morgenpost.de/politik/ausland/article239131061/Rund-30-Migranten-nach-zwei-Schiffbruechen-vermisst.html,0,www.morgenpost.de,Flüchtlinge: Rund 30 Migranten nach zwei Schiffbrüchen vermisst,"Vor Lampedusa kommt es zu zwei Unglücken mit Migrantenbooten. Zahlreiche Menschen, darunter auch Kinder, werden vermisst.",https://img.morgenpost.de/img/ausland/crop239131059/3342606402-w820-cv16_9-q85/Rettungsaktion-auf-Lampedusa.jpg,2023-08-06T15:41:07Z,https://web.archive.org/web/20230807132338/https://www.morgenpost.de/politik/ausland/article239131061/Rund-30-Migranten-nach-zwei-Schiffbruechen-vermisst.html,"Lampedusa  -. Vor der italienischen Mittelmeerinsel Lampedusa sind am Wochenende zwei Migrantenboote gekentert und haben möglicherweise viele Todesopfer gefordert. 
Wie die Küstenwache mitteilte, we… [+2554 chars]",,de,'Schwangere'
https://taz.de/Schiffbrueche-vor-Lampedusa/!5952536/,https://taz.de/Schiffbrueche-vor-Lampedusa/!5952536/,0,taz.de,Schiffbrüche vor Lampedusa: Rund 30 Vermisste im Mittelmeer,"Vor der italienischen Mittelmeerinsel Lampedusa sind am Wochenende zwei Migrantenboote gekentert. Dutzende Menschen, darunter auch Kinder, werden vermisst.",https://taz.de/picture/6434594/948/lampedusa-1.jpeg,2023-08-06T16:05:00Z,,"Vor der italienischen Mittelmeerinsel Lampedusa sind am Wochenende zwei Migrantenboote gekentert. Dutzende Menschen, darunter auch Kinder, werden vermisst.
Viele Boote wagen sich die gefährliche Übe… [+2542 chars]",,de,'Kinder'
https://www.zeit.de/news/2023-08/06/auto-faehrt-auf-gehweg-und-verletzt-vier-kinder,https://www.zeit.de/news/2023-08/06/auto-faehrt-auf-gehweg-und-verletzt-vier-kinder,0,www.zeit.de,Wuppertal: Auto fährt auf Gehweg und verletzt vier Kinder,,,2023-08-06T17:37:43Z,https://web.archive.org/web/20230807030856/https://www.zeit.de/news/2023-08/06/auto-faehrt-auf-gehweg-und-verletzt-vier-kinder,"When browsing with ads:
We collect personal data and also transmit it to third-party providers
 that help us improve and finance our digital content. Some of the information stored on your device, … [+821 chars]",,de,'Kinder'
https://www.morgenpost.de/berlin/article239121279/Blackout-So-sind-die-Berliner-Bezirke-vorbereitet.html,https://www.morgenpost.de/berlin/article239121279/Blackout-So-sind-die-Berliner-Bezirke-vorbereitet.html,0,www.morgenpost.de,Katastrophenschutz: Blackout: So sind die Berliner Bezirke vorbereitet,"Blackout, Stromausfall, Naturkatastrophe: Die Berliner Bezirke bereiten sich vor – doch es gibt Unterschiede.",https://img.morgenpost.de/img/berlin/crop239121277/5717545072-w820-cv16_9-q85-fnov-fpi231768577-fpotl/b9dfe86c-3398-11ee-8962-0a42cbd3bc9d.jpg,2023-08-07T04:00:00Z,https://web.archive.org/web/20230807070719/https://www.morgenpost.de/berlin/article239121279/Blackout-So-sind-die-Berliner-Bezirke-vorbereitet.html,=tqbo dmbttµ#bsujdmf``mpdbujpo#?Cfsmjo/'octq´=0tqbo? Fjo Cmbdlpvu- bmtp fjo mbohboibmufoefs =tuspoh?Tuspnbvtgbmm=0tuspoh? jo hbo{ Cfsmjo- xåsf nju wjfmfo Qspcmfnfo wfscvoefo; Lfjo Tuspn- lfjof Ifj{vo… [+15730 chars],,de,'Blackout'
https://www.stern.de/gesellschaft/regional/hamburg-schleswig-holstein/tourismus--hpa--sanierung-des-alten-elbtunnels-kommt-gut-voran-33714856.html,https://www.stern.de/gesellschaft/regional/hamburg-schleswig-holstein/tourismus--hpa--sanierung-des-alten-elbtunnels-kommt-gut-voran-33714856.html,0,www.stern.de,Tourismus: HPA: Sanierung des Alten Elbtunnels kommt gut voran,"Die Instandsetzung der Weströhre des denkmalgeschützten Alten Elbtunnels nahe den Landungsbrücken kommt nach Angaben der Hamburg Port Authority (HPA) gut voran. ""Nach dem erfolgreichen Abschluss des oberen Querschnitts wird nun der untere Tunnelquerschnitt sa…",https://image.stern.de/33714858/t/pu/v1/w1440/r1.7778/-/07--urnnewsmldpacom2009010123080799741046v3w800h600l640t422r1920b1267jpeg---aa1add5ff1348918.jpg,2023-08-07T04:35:11Z,,"Die Instandsetzung der Weströhre des denkmalgeschützten Alten Elbtunnels nahe den Landungsbrücken kommt nach Angaben der Hamburg Port Authority (HPA) gut voran. ""Nach dem erfolgreichen Abschluss des … [+1232 chars]",,de,'Sanierung'
https://www.zeit.de/news/2023-08/07/hpa-sanierung-des-alten-elbtunnels-kommt-gut-voran,https://www.zeit.de/news/2023-08/07/hpa-sanierung-des-alten-elbtunnels-kommt-gut-voran,0,www.zeit.de,Tourismus: HPA: Sanierung des Alten Elbtunnels kommt gut voran,,,2023-08-07T04:35:11Z,https://web.archive.org/web/20230808014403/https://www.zeit.de/news/2023-08/07/hpa-sanierung-des-alten-elbtunnels-kommt-gut-voran,"When browsing with ads:
We collect personal data and also transmit it to third-party providers
 that help us improve and finance our digital content. Some of the information stored on your device, … [+821 chars]",,de,'Sanierung'
https://www.telepolis.de/features/Nebenjobs-bei-Jugendlichen-Vor-allem-Kinder-aus-reichen-Familien-gehen-arbeiten-9235829.html,https://www.telepolis.de/features/Nebenjobs-bei-Jugendlichen-Vor-allem-Kinder-aus-reichen-Familien-gehen-arbeiten-9235829.html,0,www.telepolis.de,Nebenjobs bei Jugendlichen: Vor allem Kinder aus reichen Familien gehen arbeiten,Vom Zeitungen austragen bis zum Kellnern - Jugendliche aus ärmeren Familien haben seltener einen Nebenjob als reichere Kinder. Welche Rolle die Eltern dabei spielen.,https://heise.cloudimg.io/bound/1200x1200/q85.png-lossy-85.webp-lossy-85.foil1/_www-heise-de_/imgs/18/4/2/8/1/6/1/9/newspaper-gf589abde6_1280-f5786207a075bdcd.jpeg,2023-08-07T05:00:00Z,,"(Bild: DieElchin, Pixabay)
Vom Zeitungen austragen bis zum Kellnern - Jugendliche aus ärmeren Familien haben seltener einen Nebenjob als reichere Kinder. Welche Rolle die Eltern dabei spielen.
Jobb… [+3529 chars]",,de,'Kinder'
https://www.bild.de/regional/nuernberg/nuernberg-news/kult-spielzeug-aus-franken-carrera-bahn-wird-60-84950160.bild.html,https://www.bild.de/regional/nuernberg/nuernberg-news/kult-spielzeug-aus-franken-carrera-bahn-wird-60-84950160.bild.html,0,www.bild.de,Kult-Spielzeug aus Franken - Carrera-Bahn wird 60,"Nürnberg – Seit 60 Jahren geben kleine und große Hobby-Rennfahrer auf der Carrera-Bahn Gas. Das Kult-Spielzeug wurde in Fürth erfunden, auch einer der gr...","https://images.bild.de/64cf8aca1fcd12629fbb8f71/32638221fe5fc1a5457cb2cff24f67c9,bd507de6?w=1280",2023-08-07T05:05:16Z,https://web.archive.org/web/20230807071659/http://www.bild.de/regional/nuernberg/nuernberg-news/kult-spielzeug-aus-franken-carrera-bahn-wird-60-84950160.bild.html,"Nürnberg Seit 60 Jahren geben kleine und große Hobby-Rennfahrer auf der Carrera-Bahn Gas. Das Kult-Spielzeug wurde in Fürth erfunden, auch einer der größten Fan-Treffpunkte ist in Franken.
1920 als … [+2855 chars]",,de,'Kinder'
https://www.macerkopf.de/2023/08/07/eula-eva-apple-tv-clips/,https://www.macerkopf.de/2023/08/07/eula-eva-apple-tv-clips/,0,www.macerkopf.de,„Eula Eva“: Apple TV+ veröffentlicht drei kurze Clips,"Im März dieses Jahres ist die Kinder- und Familienserie „Eule Eva“ (im Englischen heißt die Serie „Eva the Owlet“) auf Apple TV+ gestartet. Um den Fokus auf die Serie zu lenken, stehen ab sofort drei kurze Clips auf YouTube bereit. Apple TV+ veröffentlicht dr…",https://www.macerkopf.de/wp-content/uploads/2023/03/apple_tv_plus_eule_eva.jpg,2023-08-07T05:11:18Z,,"Im März dieses Jahres ist die Kinder- und Familienserie Eule Eva (im Englischen heißt die Serie Eva the Owlet) auf Apple TV+ gestartet. Um den Fokus auf die Serie zu lenken, stehen ab sofort drei kur… [+1363 chars]",,de,'Kinder'
https://www.focus.de/gesundheit/news/wenn-kein-notfall-vorliegt-kinderaerzte-chef-eltern-sollen-fuer-besuch-von-notaufnahme-zahlen_id_201148969.html,https://www.focus.de/gesundheit/news/wenn-kein-notfall-vorliegt-kinderaerzte-chef-eltern-sollen-fuer-besuch-von-notaufnahme-zahlen_id_201148969.html,0,www.focus.de,Wenn kein Notfall vorliegt - Kinderärzte-Chef: Eltern sollen für Besuch von Notaufnahme zahlen,"Die Notaufnahmen in Deutschland sind am Limit. Immer öfter gehen Eltern mit ihren Kindern dorthin, obwohl es sich um gar keinen Notfall handelt. Das soll sich jetzt ändern. Zumindest wenn es nach Kinderärztepräsident Thomas Fischbach geht.",https://p6.focus.de/img/fotos/id_192963670/blick-auf-die-muenchner-klinik-in-schwabing..jpg?im=Crop%3D%280%2C288%2C3464%2C1732%29%3BResize%3D%281200%2C627%29&impolicy=perceptual&quality=mediumHigh&hash=d046762d0a30991bb59b0bca34c268d2f73e3a7458377a9b0f4943c9f0cdfadc,2023-08-07T05:21:14Z,,"Die Notaufnahmen in Deutschland sind am Limit. Immer öfter gehen Eltern mit ihren Kindern dorthin, obwohl es sich um gar keinen Notfall handelt. Das soll sich jetzt ändern. Zumindest wenn es nach Kin… [+2626 chars]",,de,'Kinder'
https://www.welt.de/wirtschaft/video246774844/Kinder-Notfallversorgung-Eigenbeteiligung-der-Eltern-gefordert-Zu-viele-kaemen-mit-einem-Pickel-am-Po.html,https://www.welt.de/wirtschaft/video246774844/Kinder-Notfallversorgung-Eigenbeteiligung-der-Eltern-gefordert-Zu-viele-kaemen-mit-einem-Pickel-am-Po.html,0,www.welt.de,Eigenbeteiligung der Eltern gefordert – Zu viele kämen mit einem „Pickel am Po“,"Thomas Fischbach, der Präsident des Berufsverbandes der Kinder- und Jugendärzte, hat eine Gebühr für Kinder-Notfallbehandlungen gefordert: „Die Notfallversorgung muss auf Notfälle konzentriert werden und nicht für die Pickel am Po der Kinder, für die die Elte…",https://img.welt.de/img/videos/mobile246774852/2381352797-ci16x9-w1200/OFF-Notfallversorgung-Kinder-Mo-0600-6-10-74-jpg.jpg,2023-08-07T05:50:42Z,,"Die WELT als ePaper: Die vollständige Ausgabe steht Ihnen bereits am Vorabend zur Verfügung so sind Sie immer hochaktuell informiert. Weitere Informationen: http://epaper.welt.de 
 Der Kurz-Link die… [+49 chars]",,de,'Kinder'
https://orf.at/stories/3326624/,https://orf.at/stories/3326624/,0,orf.at,UNICEF: 460 Millionen Kinder in Südasien von Hitze bedroht,,https://orf.at/mojo/1_4_1/storyserver//news/common/images/og-fallback-news.png,2023-08-07T06:08:58Z,,In Südasien sind laut einem Bericht des UNO-Kinderhilfswerks (UNICEF) jährlich rund 460 Millionen Minderjährige von extremer Hitze bedroht. Im globalen Vergleich seien Kinder in südasiatischen Länder… [+1023 chars],,de,'Kinder'
https://www.tagesschau.de/inland/gesellschaft/kinderaerzte-notdienst-gebuehr-100.html,https://www.tagesschau.de/inland/gesellschaft/kinderaerzte-notdienst-gebuehr-100.html,0,www.tagesschau.de,Kinderärztepräsident fordert Notdienst-Gebühr bei unnötigen Fällen,"Die Notaufnahmen stoßen an ihre Belastungsgrenzen - auch wegen unnötiger Behandlungen. Kinderärztepräsident Fischbach schlägt daher vor, bei nicht dringenden Fällen eine Gebühr zu erheben.",https://images.tagesschau.de/image/c48d677a-d8b4-4f5f-9f1a-f6eae6e6ef5f/AAABhn5ZbOM/AAABibBxqrQ/16x9-1280/kinderarzt-101.jpg,2023-08-07T06:39:39Z,,"Stand: 07.08.2023 08:39 Uhr
Die Notaufnahmen stoßen an ihre Belastungsgrenzen - auch wegen unnötiger Behandlungen. Kinderärztepräsident Fischbach schlägt daher vor, Eltern zur Kasse zu bitten, die m… [+3250 chars]",,de,'Kinder'
https://www.bild.de/regional/ruhrgebiet/ruhrgebiet-regional-politik-und-wirtschaft/vorsorge-fuer-den-blackout-polizei-bestellt-hunderttausende-notfall-kekse-84955850.bild.html,https://www.bild.de/regional/ruhrgebiet/ruhrgebiet-regional-politik-und-wirtschaft/vorsorge-fuer-den-blackout-polizei-bestellt-hunderttausende-notfall-kekse-84955850.bild.html,0,www.bild.de,Vorsorge für den Blackout - Polizei bestellt Hunderttausende Notfall-Kekse,"Die Polizei in NRW bereitet sich weiter auf einen möglichen totalen Stromausfall vor und will zahlreiche Notrationen anschaffen. Darunter Hunderttausende Kekse, Roggenbrot und Marmelade","https://images.bild.de/64d0921e1fcd12629fbb903c/6ecfa8deb24add822ad357b1cb114da2,a021ef00?w=1280",2023-08-07T07:21:34Z,https://web.archive.org/web/20230807075333/https://www.bild.de/regional/ruhrgebiet/ruhrgebiet-regional-politik-und-wirtschaft/vorsorge-fuer-den-blackout-polizei-bestellt-hunderttausende-notfall-kekse-84955850.bild.html,"Klatsche für die Post! Netzagentur stoppt Porto-Erhöhung
Klatsche für die Post! Netzagentur stoppt Porto-Erhöhung
Klatsche für die Post! Netzagentur stoppt Porto-Erhöhung
Klatsche für die Post! Ne… [+378 chars]",,de,'Blackout'
https://www.zeit.de/news/2023-08/07/unicef-460-millionen-kinder-in-suedasien-von-hitze-bedroht,https://www.zeit.de/news/2023-08/07/unicef-460-millionen-kinder-in-suedasien-von-hitze-bedroht,0,www.zeit.de,Gesundheit: Unicef: 460 Millionen Kinder in Südasien von Hitze bedroht,,,2023-08-07T07:52:49Z,https://web.archive.org/web/20230808014713/https://www.zeit.de/news/2023-08/07/unicef-460-millionen-kinder-in-suedasien-von-hitze-bedroht,"When browsing with ads:
We collect personal data and also transmit it to third-party providers
 that help us improve and finance our digital content. Some of the information stored on your device, … [+821 chars]",,de,'Kinder'
https://www.stern.de/panorama/wissen/gesundheit--unicef--460-millionen-kinder-in-suedasien-von-hitze-bedroht-33715218.html,https://www.stern.de/panorama/wissen/gesundheit--unicef--460-millionen-kinder-in-suedasien-von-hitze-bedroht-33715218.html,0,www.stern.de,Gesundheit: Unicef: 460 Millionen Kinder in Südasien von Hitze bedroht,"Unicef sorgt sich wegen extremer Hitze ""um Babys, Kleinkinder, unterernährte Kinder und schwangere Frauen"". In Südasien ist ein Großteil aller Kinder von den hohen Temperaturen betroffen.",https://image.stern.de/33715220/t/fy/v1/w1440/r1.7778/-/07--urnnewsmldpacom2009010123080799743105v3w800h600l619t548r1899b1398jpeg---6fedc7c9829f998f.jpg,2023-08-07T07:52:49Z,https://web.archive.org/web/20230807092602/https://www.stern.de/panorama/wissen/gesundheit--unicef--460-millionen-kinder-in-suedasien-von-hitze-bedroht-33715218.html,"Unicef sorgt sich wegen extremer Hitze ""um Babys, Kleinkinder, unterernährte Kinder und schwangere Frauen"". In Südasien ist ein Großteil aller Kinder von den hohen Temperaturen betroffen.
In Südasie… [+1551 chars]",,de,'Kinder'
https://www.morgenpost.de/web-wissen/article239132097/Unicef-460-Millionen-Kinder-in-Suedasien-von-Hitze-bedroht.html,https://www.morgenpost.de/web-wissen/article239132097/Unicef-460-Millionen-Kinder-in-Suedasien-von-Hitze-bedroht.html,0,www.morgenpost.de,Gesundheit: Unicef: 460 Millionen Kinder in Südasien von Hitze bedroht,"Unicef sorgt sich wegen extremer Hitze „um Babys, Kleinkinder, unterernährte Kinder und schwangere Frauen“. In Südasien ist ein Großteil aller Kinder von den hohen Temperaturen betroffen.",https://img.morgenpost.de/img/web-wissen/crop239132095/6252609554-w820-cv16_9-q85/Wasserknappheit-im-Iran.jpg,2023-08-07T07:52:49Z,https://web.archive.org/web/20230807135448/https://www.morgenpost.de/web-wissen/article239132097/Unicef-460-Millionen-Kinder-in-Suedasien-von-Hitze-bedroht.html,Islamabad/Neu Delhi. In Südasien sind laut einem Bericht des UN-Kinderhilfswerks Unicef jährlich rund 460 Millionen Minderjährige von extremer Hitze bedroht. Im globalen Vergleich seien Kinder in süd… [+1354 chars],,de,'Kinder'
https://www.diepresse.com/13929019/frau-bei-explosion-in-wiener-wohnhaus-verletzt,https://www.diepresse.com/13929019/frau-bei-explosion-in-wiener-wohnhaus-verletzt,0,www.diepresse.com,Frau bei Explosion in Wiener Wohnhaus verletzt,Die 30-jährige Schwangere wurde nur leicht verletzt und zur Abklärung ins Krankenhaus gebracht. Die Detonation ereignete sich Montagfrüh in der Goldschlagstraße in Wien-Penzing.,https://img.diepresse.com/public/incoming/izvrrq-kein-Titel/alternates/DPR_SOCIAL_NACHRICHTEN/%28kein%20Titel%29,2023-08-07T07:59:51Z,,"Die 30-jährige Schwangere wurde nur leicht verletzt und zur Abklärung ins Krankenhaus gebracht. Die Detonation ereignete sich Montagfrüh in der Goldschlagstraße in Wien-Penzing.
Bei der Explosion in… [+464 chars]",,de,'Schwangere'
https://www.tagesspiegel.de/berlin/wetter-in-berlin-und-brandenburg-aussichten-auch-in-zweiter-augustwoche-kuhl-und-nass-10272808.html,https://www.tagesspiegel.de/berlin/wetter-in-berlin-und-brandenburg-aussichten-auch-in-zweiter-augustwoche-kuhl-und-nass-10272808.html,0,www.tagesspiegel.de,Wetter in Berlin und Brandenburg: Aussichten auch für zweite Augustwoche kühl und nass,Auch in der zweiten Augustwoche ist in Berlin und Brandenburg mit viel Nässe sowie Kälte zu rechnen. Grund dafür ist ein Tief über der Ostsee.,,2023-08-07T08:30:53Z,https://web.archive.org/web/20230807090837/https://www.tagesspiegel.de/berlin/wetter-in-berlin-und-brandenburg-aussichten-auch-in-zweiter-augustwoche-kuhl-und-nass-10272808.html,"Weiterhin nass und kühl sind die Wetteraussichten für Berlin und Brandenburg. Grund dafür ist ein Tief über der Ostsee, wie der Deutsche Wetterdienst (DWD) mitteilte. Zum Wochenbeginn wird es bei max… [+1029 chars]",,de,'Kälte'
https://www.n-tv.de/politik/Man-waehlt-nicht-AfD-aus-Protest-article24310078.html,https://www.n-tv.de/politik/Man-waehlt-nicht-AfD-aus-Protest-article24310078.html,0,www.n-tv.de,"Trittin im ""ntv Frühstart"": ""Man wählt nicht AfD aus Protest""","Außenpolitiker Jürgen Trittin bezeichnet die AfD im ""ntv Frühstart"" als ""faschistische, verfassungsfeindliche Partei"". Söders Pläne zur Reaktivierung der Atomkraft hält der Grünen-Politiker für unrealistisch. Zudem schätzt Trittin, dass der diplomatische Druc…",https://bilder2.n-tv.de/img/incoming/crop24309821/4761327748-cImg_16_9-w1200/trittin-fs.jpg,2023-08-07T09:05:29Z,,"Außenpolitiker Jürgen Trittin bezeichnet die AfD im ""ntv Frühstart"" als ""faschistische, verfassungsfeindliche Partei"". Söders Pläne zur Reaktivierung der Atomkraft hält der Grünen-Politiker für unrea… [+3544 chars]",,de,'Atomkraft'
https://www.zeit.de/news/2023-08/07/von-sportwagen-auf-gehweg-erfasst-kinder-weiter-in-klinik,https://www.zeit.de/news/2023-08/07/von-sportwagen-auf-gehweg-erfasst-kinder-weiter-in-klinik,0,www.zeit.de,Wuppertal: Von Sportwagen auf Gehweg erfasst: Kinder weiter in Klinik,,,2023-08-07T10:32:22Z,https://web.archive.org/web/20230808014953/https://www.zeit.de/news/2023-08/07/von-sportwagen-auf-gehweg-erfasst-kinder-weiter-in-klinik,"When browsing with ads:
We collect personal data and also transmit it to third-party providers
 that help us improve and finance our digital content. Some of the information stored on your device, … [+821 chars]",,de,'Kinder'
https://www.bild.de/unterhaltung/leute/leute/tori-spelling-hollywood-star-im-bademantel-auf-dem-weg-zur-sammeltoilette-84956688.bild.html,https://www.bild.de/unterhaltung/leute/leute/tori-spelling-hollywood-star-im-bademantel-auf-dem-weg-zur-sammeltoilette-84956688.bild.html,0,www.bild.de,Hollywood-Star Tori Spelling - Im Bademantel zur Sammeltoilette,Schauspielerin Tori Spelling wohnt derzeit mit ihren Kindern auf einem Campingplatz. Jetzt wurde sie im Bademantel auf dem Weg zur Sammeltoilette gesehen.,"https://images.bild.de/64d0a5641fcd12629fbb906a/2018c56175b48401eb727deec090e8f5,a4b5ac85?w=1280",2023-08-07T11:32:41Z,https://web.archive.org/web/20230807141109/https://www.bild.de/unterhaltung/leute/leute/tori-spelling-hollywood-star-im-bademantel-auf-dem-weg-zur-sammeltoilette-84956688.bild.html,"So sieht man Hollywood-Stars selten bis gar nicht 
Schauspielerin Tori Spelling (50) badete einst im Luxus, lebte im 150 Millionen Euro teuren Haus ihres Vaters Aaron Spelling ( 83). Ein Schimmel-Be… [+2429 chars]",,de,'Kinder'
https://www.focus.de/wissen/mensch/graue-scheidungswelle-immer-mehr-aeltere-in-den-usa-alleine-gesellschaft-am-scheideweg_id_201176021.html,https://www.focus.de/wissen/mensch/graue-scheidungswelle-immer-mehr-aeltere-in-den-usa-alleine-gesellschaft-am-scheideweg_id_201176021.html,0,www.focus.de,Graue Scheidungswelle - Immer mehr Ältere in den USA alleine – Gesellschaft am Scheideweg,"Die „Graue Scheidungsrevolution“ trifft Amerika. Zahlreiche Senioren stehen vor sozialen und wirtschaftlichen Herausforderungen, während Experten Alarm schlagen.",https://p6.focus.de/img/wissen/mensch/id_201176355/aeltere-frau-.jpg?im=Crop%3D%280%2C288%2C3464%2C1732%29%3BResize%3D%281200%2C627%29&impolicy=perceptual&quality=mediumHigh&hash=45c3a9caaaa6051b9fd925a7def9759726c42f076a7ade437facfbf9dd45cc18,2023-08-07T12:28:58Z,https://web.archive.org/web/20230807141014/https://www.focus.de/wissen/mensch/graue-scheidungswelle-immer-mehr-aeltere-in-den-usa-alleine-gesellschaft-am-scheideweg_id_201176021.html,"Die Graue Scheidungsrevolution trifft Amerika. Zahlreiche Senioren stehen vor sozialen und wirtschaftlichen Herausforderungen, während Experten Alarm schlagen.<ul><li>Graue Scheidungen lassen die Zah… [+2933 chars]",,de,'Ältere'
https://www.welt.de/politik/deutschland/video246782400/Mehr-Befugnisse-Zeitenwende-auch-fuer-deutsche-Nachrichtendienste-noetig.html,https://www.welt.de/politik/deutschland/video246782400/Mehr-Befugnisse-Zeitenwende-auch-fuer-deutsche-Nachrichtendienste-noetig.html,0,www.welt.de,„Zeitenwende auch für deutsche Nachrichtendienste nötig“,"Der ehemalige BND-Präsidenten August Hanning hat angesichts der „neuen Weltlage“ mehr Befugnisse für die deutschen Nachrichtendienste gefordert. „Andere können für uns nicht ständig die Kohle aus dem Feuer holen“, kritisiert Hanning im WELT-Interview.",https://img.welt.de/img/politik/deutschland/mobile246783970/9541352177-ci16x9-w1200/ONL-Hanning-12-00-11843-jpg.jpg,2023-08-07T13:04:07Z,https://web.archive.org/web/20230807131221/https://www.welt.de/politik/deutschland/video246782400/Mehr-Befugnisse-Zeitenwende-auch-fuer-deutsche-Nachrichtendienste-noetig.html,"Die WELT als ePaper: Die vollständige Ausgabe steht Ihnen bereits am Vorabend zur Verfügung so sind Sie immer hochaktuell informiert. Weitere Informationen: http://epaper.welt.de 
 Der Kurz-Link die… [+49 chars]",,de,'Kohle'
https://www.handelsblatt.com/finanzen/anlagestrategie/trends/warren-buffett-berkshire-hathaway-meldet-rekordergebnis/29302308.html,https://www.handelsblatt.com/finanzen/anlagestrategie/trends/warren-buffett-berkshire-hathaway-meldet-rekordergebnis/29302308.html,0,www.handelsblatt.com,Berkshire Hathaway: Pragmatisch und profitabel – wie Warren Buffett sein Energiegeschäft ausbaut,"Der Star-Investor investiert Milliarden in Öl und Gas, genauso wie in erneuerbare Energien. Nach einem Rekordquartalsgewinn soll die Strategie den Konzern langfristig stärken.",https://www.handelsblatt.com/images/warren-buffett/29303636/3-format2003.jpg,2023-08-07T13:38:03Z,https://web.archive.org/web/20230807142034/https://www.handelsblatt.com/finanzen/anlagestrategie/trends/warren-buffett-berkshire-hathaway-meldet-rekordergebnis/29302308.html,"Warren BuffettDer 92-Jährige ist einer der erfolgreichsten Investoren der Welt.
(Foto: AP)
Denver, Düsseldorf Die Geschäfte laufen wieder gut bei Warren Buffett. Der CEO von Berkshire Hathaway verb… [+1125 chars]",,de,'Gas'
https://www.sueddeutsche.de/bayern/diakonie-wohnungspolitik-obdachlosigkeit-1.6105719,https://www.sueddeutsche.de/bayern/diakonie-wohnungspolitik-obdachlosigkeit-1.6105719,0,www.sueddeutsche.de,Obdachlosigkeit: Diakonie Bayern fordert wirksame soziale Wohnungspolitik,Im Vergleich zu 2022 hat sich laut Statistik die Zahl wohnungsloser Menschen in Bayern auf 32 380 Menschen fast verdoppelt.,https://www.sueddeutsche.de/image/sz.1.6105720/1200x675?v=1691417412,2023-08-07T13:44:26Z,,Im Vergleich zu 2022 hat sich die Zahl wohnungsloser Menschen im Freistaat heuer fast verdoppelt. Das sei alarmierend.Angesichts der stark gestiegenen Zahl an wohnungslosen Menschen fordert die bayer… [+1289 chars],,de,'Obdachlosigkeit'
https://www.faz.net/aktuell/finanzen/meine-finanzen/testament-wie-sich-der-streit-ums-erbe-verhindern-laesst-19081339.html,https://www.faz.net/aktuell/finanzen/meine-finanzen/testament-wie-sich-der-streit-ums-erbe-verhindern-laesst-19081339.html,0,www.faz.net,Finanzplanung: Ohne Streit zum Erbe,Über das Testament zu reden ist in vielen Familien tabu. Es muss aber geschehen – und  früher als man denkt. Wie Kinder das heikle Thema anpacken können und warum Drängeln nichts bringt.,https://media0.faz.net/ppmedia/aktuell/2338737997/1.9085888/facebook_teaser_fplus/wer-bekommt-das-haus.jpg,2023-08-07T14:16:22Z,,"Die Mutter wurde 105 Jahre alt. Der 80-jährige Sohn erbt nun ihr Haus. Von einem Haus hatte er sein Leben lang geträumt, es sich aber nicht leisten können. Doch nun ist es zu spät. Er lebt in einem P… [+633 chars]",,de,'Kinder'
https://www.zeit.de/news/2023-08/07/schulungszentrum-fuer-wasserstoff-leitungstechniker-geplant,https://www.zeit.de/news/2023-08/07/schulungszentrum-fuer-wasserstoff-leitungstechniker-geplant,0,www.zeit.de,Gas: Schulungszentrum für Wasserstoff-Leitungstechniker geplant,,,2023-08-07T16:38:11Z,https://web.archive.org/web/20230811012052/https://www.zeit.de/news/2023-08/07/schulungszentrum-fuer-wasserstoff-leitungstechniker-geplant,"When browsing with ads:
We collect personal data and also transmit it to third-party providers
 that help us improve and finance our digital content. Some of the information stored on your device, … [+821 chars]",,de,'Gas'
