index,url,valid,domain,title,description,image,published,archive,content,quote,language,keyword
https://www.bild.de/politik/inland/dresdens-it-fiasko-parkscheine-und-behoerden-lahmgelegt-6780d7a187b4f36bb7ce2417,https://www.bild.de/politik/inland/dresdens-it-fiasko-parkscheine-und-behoerden-lahmgelegt-6780d7a187b4f36bb7ce2417,0,www.bild.de,"Parktickets, KfZ-Zulassungen unmöglich - IT-Blackout! Dresdens Stadtverwaltung lahmgelegt","Dresdens Verwaltung kämpft mit einem IT-Ausfall, der Parkscheine, Kfz-Zulassungsstelle und Kita-Portal betrifft. Ursache für den Blackout bleibt unklar.","https://images.bild.de/6780d7a187b4f36bb7ce2417/f2b7dc21668f57c31402ea5a80897d68,346acb8d?w=1280",2025-01-10T10:15:43Z,http://archive.md/20250110102217/https://www.bild.de/politik/inland/dresdens-it-fiasko-parkscheine-und-behoerden-lahmgelegt-6780d7a187b4f36bb7ce2417,"Derzeit kann man in Dresden nicht mal einen Parkschein ziehen.
Denn seit Donnerstag sind große Teile der IT in der Verwaltung Dresdens ausgefallen. Einer Hausmitteilung des Rathauses zufolge können … [+1356 chars]",,de,'Blackout'
https://www.zeit.de/familie/2025-01/alltag-kind-beschaeftigung-zuneigung-erziehung-haushalt,https://www.zeit.de/familie/2025-01/alltag-kind-beschaeftigung-zuneigung-erziehung-haushalt,0,www.zeit.de,Alltag mit Kind: Kinder würden ja helfen – wenn wir sie ließen,"Viele Eltern denken, sie müssten ihre Kinder dauerbespaßen. Dabei lernen sie im Familienalltag alles, was sie für eine gesunde Entwicklung und Erfolg im Leben brauchen.",https://img.zeit.de/familie/2025-01/alltag-kind-beschaeftigung-zuneigung-erziehung/wide__1300x731,2025-01-10T10:55:29Z,http://archive.md/20250110105940/https://www.zeit.de/familie/2025-01/alltag-kind-beschaeftigung-zuneigung-erziehung-haushalt,"Schließen
Artikelzusammenfassung
Eltern sind heutzutage nicht nur Eltern, sondern auch Kinderanimateure, die ihren Nachwuchs mit Spielen und Bastelaktionen unterhalten. Doch Experten betonen, dass … [+603 chars]",,de,'Kinder'
https://www.stern.de/wirtschaft/rentenkasse--warum-es-nichts-bringt--wenn-beamte-auch-einzahlen-34746226.html,https://www.stern.de/wirtschaft/rentenkasse--warum-es-nichts-bringt--wenn-beamte-auch-einzahlen-34746226.html,0,www.stern.de,"Altersversorgung: Würde es nützen, wenn Beamte und Selbstständige in die Rentenkasse einzahlen?","Der Sachverständigenrat prüft derzeit, ob Beamte und Selbstständige in die Rentenkasse einbezogen werden sollen. Warum das kein Patentrezept zur Sanierung...",https://image.stern.de/34748448/t/rX/v2/w1440/r1.7778/-/rente-rentenkasse.jpg,2025-01-10T11:44:00Z,,"Kopiere den aktuellen Link
Eine Simulationsrechnung zeigt auf, was die Einbeziehung von Beamten und Selbstständigen in die Rentenkasse bewirken würde. Warum das kein Patentrezept ist. 
Der Sachvers… [+1665 chars]",,de,'Sanierung'
https://www.tagesschau.de/inland/innenpolitik/weidel-musk-x-100.html,https://www.tagesschau.de/inland/innenpolitik/weidel-musk-x-100.html,0,www.tagesschau.de,Was bleibt vom Gespräch Weidel-Musk?,"Es ging um Gott und die Welt, um Hitler und Atomkraft. Es gab viel Lob und Schmeichelei. Milliardär Musk bot AfD-Chefin Weidel seine X-Bühne - und was bleibt nun nach den 75 Minuten? Ein Überblick.",https://images.tagesschau.de/image/2e4ea164-0849-403a-b79a-27c9f75ac6ff/AAABlE_N19U/AAABkZLhkrw/16x9-1280/weidel-musk-x-102.jpg,2025-01-10T12:08:13Z,http://archive.md/20250110123557/https://www.tagesschau.de/inland/innenpolitik/weidel-musk-x-100.html,"Stand: 10.01.2025 13:08 Uhr
Es ging um Gott und die Welt, um Hitler und Atomkraft. Es gab viel Lob und Schmeichelei. Milliardär Musk bot AfD-Chefin Weidel seine X-Bühne - und was bleibt nun nach den… [+11303 chars]",,de,'Atomkraft'
https://www.bild.de/sport/fussball/bvb-leverkusen-kracher-grippe-alarm-ganze-bvb-abwehr-faellt-aus-67812281a21b1554a3e6138a,https://www.bild.de/sport/fussball/bvb-leverkusen-kracher-grippe-alarm-ganze-bvb-abwehr-faellt-aus-67812281a21b1554a3e6138a,0,www.bild.de,Heute Bundesliga-Kracher gegen Leverkusen - Grippe-Alarm! Ganze BVB-Abwehr fällt aus,"Neues Jahr, altes Pech! Borussia Dortmund scheint in der laufenden Saison vom Verletzungspech verfolgt zu sein. Auch vor dem Leverkusen-Kracher.","https://images.bild.de/67812281a21b1554a3e6138a/effe58100501bbac9d6acb4aa2a244ee,c434c54?w=1280",2025-01-10T14:11:33Z,,"Neues Jahr, altes Pech!
Borussia Dortmund scheint in der laufenden Saison vom Verletzungspech verfolgt zu sein. Denn immer wieder musste der BVB im vergangenen Halbjahr mit einem Rumpf-Kader und zah… [+1721 chars]",,de,'Grippe'
https://taz.de/Fragen-und-Antworten-zur-Kernkraft/!6060921/,https://taz.de/Fragen-und-Antworten-zur-Kernkraft/!6060921/,0,taz.de,Fragen und Antworten zur Kernkraft: Atomkraft? Wie bitte?,"Die Union will abgeschaltete Atomkraftwerke einfach wieder anknipsen. Warum sich das leicht sagen, aber kaum umsetzen lässt.",https://taz.de/picture/7458221/1200/37382690-1.jpeg,2025-01-10T18:55:00Z,,"Die Union will abgeschaltete Atomkraftwerke einfach wieder anknipsen. Warum sich das leicht sagen, aber kaum umsetzen lässt. mehr...",,de,'Atomkraft'
https://www.zeit.de/news/2025-01/11/so-verlaeuft-die-grippesaison-im-suedwesten-bisher,https://www.zeit.de/news/2025-01/11/so-verlaeuft-die-grippesaison-im-suedwesten-bisher,0,www.zeit.de,Influenza: So verläuft die Grippesaison im Südwesten bisher,Hier finden Sie Informationen zu dem Thema „Influenza“. Lesen Sie jetzt „So verläuft die Grippesaison im Südwesten bisher“.,https://img.zeit.de/news/2025-01/11/so-verlaeuft-die-grippesaison-im-suedwesten-bisher-image-group/wide__1300x731,2025-01-11T03:00:40Z,,"Der Beginn der Grippewelle deutet sich auch im Südwesten an. Die Zahl der an das Landesgesundheitsamt übermittelten Influenza-Fälle ist seit Jahresbeginn deutlich angestiegen, wie eine Sprecherin des… [+1840 chars]",,de,'Grippe'
https://www.stern.de/gesellschaft/regional/thueringen/sanierungsstau--was-tun-mit-den-thueringer-kindergaerten--35372132.html,https://www.stern.de/gesellschaft/regional/thueringen/sanierungsstau--was-tun-mit-den-thueringer-kindergaerten--35372132.html,0,www.stern.de,Sanierungsstau: Was tun mit den Thüringer Kindergärten?,"Abriss oder Sanierung: Angesichts sinkender Geburtenraten stehen einige Kommunen vor der Frage, wie Kindergärten bedarfsgerecht und zukunftsfähig aufgestellt werden können.",https://image.stern.de/35372134/t/S5/v1/w1440/r1.7778/-/11--bhhxkcsbxfv10axs2048jpeg---23f3c6b47628e73e.jpg,2025-01-11T03:30:36Z,,"Kopiere den aktuellen Link
Abriss oder Sanierung: Angesichts sinkender Geburtenraten stehen einige Kommunen vor der Frage, wie Kindergärten bedarfsgerecht und zukunftsfähig aufgestellt werden können… [+3815 chars]",,de,'Sanierung'
https://www.zeit.de/news/2025-01/11/was-tun-mit-den-thueringer-kindergaerten,https://www.zeit.de/news/2025-01/11/was-tun-mit-den-thueringer-kindergaerten,0,www.zeit.de,Sanierungsstau: Was tun mit den Thüringer Kindergärten?,Hier finden Sie Informationen zu dem Thema „Sanierungsstau“. Lesen Sie jetzt „Was tun mit den Thüringer Kindergärten?“.,https://img.zeit.de/news/2025-01/11/was-tun-mit-den-thueringer-kindergaerten-image-group/wide__1300x731,2025-01-11T03:30:36Z,,"Der künftige Umgang mit Kindergärten stellt die Thüringer Kommunen vor große Herausforderungen. Während einige Städte mit einem Sanierungsstau zu kämpfen haben, stellt sich andernorts die Frage nach … [+3653 chars]",,de,'Kinder'
https://www.zeit.de/news/2025-01/11/hunderte-wollen-geschlechtseintrag-anpassen-lassen,https://www.zeit.de/news/2025-01/11/hunderte-wollen-geschlechtseintrag-anpassen-lassen,0,www.zeit.de,Selbstbestimmung: Hunderte wollen Geschlechtseintrag anpassen lassen,Hier finden Sie Informationen zu dem Thema „Selbstbestimmung“. Lesen Sie jetzt „Hunderte wollen Geschlechtseintrag anpassen lassen“.,https://img.zeit.de/news/2025-01/11/hunderte-wollen-geschlechtseintrag-anpassen-lassen-image-group/wide__1300x731,2025-01-11T10:03:35Z,,"Weil der bisherige Geschlechtseintrag für sie nicht passt, streben Hunderte Menschen bei den Standesämtern in Sachsen-Anhalt eine Änderung an. Seit dem 1. November 2024 regelt das Selbstbestimmungsge… [+1413 chars]",,de,'Geschlecht'
https://www.zeit.de/news/2025-01/12/sek-einsatz-in-essen-mann-droht-gas-in-wohnhaus-aufzudrehen,https://www.zeit.de/news/2025-01/12/sek-einsatz-in-essen-mann-droht-gas-in-wohnhaus-aufzudrehen,0,www.zeit.de,Notfall: SEK-Einsatz in Essen: Mann droht Gas in Wohnhaus aufzudrehen,Hier finden Sie Informationen zu dem Thema „Notfall“. Lesen Sie jetzt „SEK-Einsatz in Essen: Mann droht Gas in Wohnhaus aufzudrehen“.,https://img.zeit.de/news/2025-01/12/sek-einsatz-in-essen-mann-droht-gas-in-wohnhaus-aufzudrehen-image-group/wide__1300x731,2025-01-11T23:01:40Z,https://web.archive.org/web/20250112145633/https://www.zeit.de/news/2025-01/12/sek-einsatz-in-essen-mann-droht-gas-in-wohnhaus-aufzudrehen,"Weil ein Mann drohte, in einem Wohnhaus in Essen das Gas aufzudrehen, ist am Samstagabend das Spezialeinsatzkommando (SEK) ausgerückt. Die Bewohner des Hauses seien wegen der Bedrohungslage evakuiert… [+426 chars]",,de,'Gas'
https://www.zeit.de/news/2025-01/12/zwei-kinder-werden-von-auto-erfasst-und-schwer-verletzt,https://www.zeit.de/news/2025-01/12/zwei-kinder-werden-von-auto-erfasst-und-schwer-verletzt,0,www.zeit.de,Unfälle: Zwei Kinder werden von Auto erfasst und schwer verletzt,Hier finden Sie Informationen zu dem Thema „Unfälle“. Lesen Sie jetzt „Zwei Kinder werden von Auto erfasst und schwer verletzt“.,https://img.zeit.de/news/2025-01/12/zwei-kinder-werden-von-auto-erfasst-und-schwer-verletzt-image-group/wide__1300x731,2025-01-12T10:01:32Z,,Zwei neun Jahre alte Kinder sind in Siegburg südlich von Köln beim Betreten einer Straße von einem Auto erfasst und schwer verletzt worden. Das Mädchen und der Junge wollten laut einer Polizeimeldung… [+515 chars],,de,'Kinder'
https://www.zeit.de/news/2025-01/13/grippe-auf-vormarsch-in-sachsen-rueckgang-bei-corona-faellen,https://www.zeit.de/news/2025-01/13/grippe-auf-vormarsch-in-sachsen-rueckgang-bei-corona-faellen,0,www.zeit.de,Grippesaison: Grippe auf Vormarsch in Sachsen - Rückgang bei Corona-Fällen,Hier finden Sie Informationen zu dem Thema „Grippesaison“. Lesen Sie jetzt „Grippe auf Vormarsch in Sachsen - Rückgang bei Corona-Fällen“.,https://img.zeit.de/news/2025-01/13/grippe-auf-vormarsch-in-sachsen-rueckgang-bei-corona-faellen-image-group/wide__1300x731,2025-01-13T14:18:24Z,,Mit dem Ende der Weihnachtsferien in Sachsen nehmen die Meldungen über Atemwegsinfekte wieder zu. Nach dem ersten Bericht der Landesuntersuchungsanstalt (LUA) in diesem Jahr bestimmen nun hauptsächli… [+1239 chars],,de,'Grippe'
https://www.stern.de/gesellschaft/regional/sachsen/grippesaison--grippe-auf-vormarsch-in-sachsen---rueckgang-bei-corona-faellen-35376898.html,https://www.stern.de/gesellschaft/regional/sachsen/grippesaison--grippe-auf-vormarsch-in-sachsen---rueckgang-bei-corona-faellen-35376898.html,0,www.stern.de,Grippesaison: Grippe auf Vormarsch in Sachsen - Rückgang bei Corona-Fällen,Nach dem erwarteten Rückgang gemeldeter Atemwegserkrankungen über die Feiertage nehmen die Fallzahlen wieder zu. Die zuständigen Behörden sehen den Beginn der saisonalen Grippewelle.,https://image.stern.de/35376900/t/xS/v1/w1440/r1.7778/-/13--xkqd3tftkxv7axs2048jpeg---db240b74d640458d.jpg,2025-01-13T14:18:24Z,,"Kopiere den aktuellen Link
Nach dem erwarteten Rückgang gemeldeter Atemwegserkrankungen über die Feiertage nehmen die Fallzahlen wieder zu. Die zuständigen Behörden sehen den Beginn der saisonalen G… [+1411 chars]",,de,'Grippe'
https://www.faz.net/aktuell/wirtschaft/mehr-wirtschaft/merz-glaubt-nicht-an-eine-atomkraft-rueckkehr-110229309.html,https://www.faz.net/aktuell/wirtschaft/mehr-wirtschaft/merz-glaubt-nicht-an-eine-atomkraft-rueckkehr-110229309.html,0,www.faz.net,Merz glaubt nicht an eine Atomkraft-Rückkehr,Zur Reaktivierung der Reaktoren sagt der Kanzlerkandidat von CDU und CSU: „Da ist wahrscheinlich nichts mehr zu machen“. Die Stilllegung ist aus seiner Sicht ein „schwerer strategischer Fehler“ gewesen.,https://media0.faz.net/ppmedia/aktuell/politik/2105667722/1.10229304/facebook_teaser/friedrich-merz-auf-der.jpg,2025-01-13T18:41:13Z,http://archive.md/20250114081327/https://www.faz.net/aktuell/wirtschaft/mehr-wirtschaft/merz-glaubt-nicht-an-eine-atomkraft-rueckkehr-110229309.html,"Die Stilllegung zum April 2023 sei ein schwerer strategischer Fehler gewesen, sagte Merz auf der Betriebsrätekonferenz der Christlich-Demokratischen Arbeitnehmerschaft Deutschlands (CDA). Auf dem Höh… [+1239 chars]",,de,'Atomkraft'
https://www.faz.net/aktuell/politik/bundestagswahl/liveticker-zur-bundestagswahl-2025-wahlausschuss-laesst-41-parteien-zur-bundestagswahl-zu-faz-110093143.html,https://www.faz.net/aktuell/politik/bundestagswahl/liveticker-zur-bundestagswahl-2025-wahlausschuss-laesst-41-parteien-zur-bundestagswahl-zu-faz-110093143.html,0,www.faz.net,Liveblog zur Bundestagswahl: Wahlausschuss lässt 41 Parteien zur Bundestagswahl zu,Scholz zieht positive Bilanz seiner Amtszeit +++ Lindner hofft auf Schwarz-Gelb und bietet Unterstützung für Ukraine-Paket im Bundestag an +++ Wagenknecht will Gas in Russland kaufen  +++ alle Entwicklungen im Liveblog,https://media0.faz.net/ppmedia/aktuell/3143600781/1.10230416/facebook_teaser/sitzung-des.jpg,2025-01-14T13:48:01Z,http://archive.md/20250114143143/https://www.faz.net/aktuell/politik/bundestagswahl/liveticker-zur-bundestagswahl-2025-wahlausschuss-laesst-41-parteien-zur-bundestagswahl-zu-faz-110093143.html,"Sachsens Ministerpräsident Michael Kretschmer hat sich gegen eine Koalition der Union mit den Grünen im Bund ausgesprochen. Dieses Land braucht einen Politikwechsel, und deshalb verbieten sich Plansp… [+980 chars]",,de,'Gas'
https://www.tagesspiegel.de/internationales/beide-parteien-fur-wiederaufnahme-russischer-gaslieferungen-lawrow-lobt-afd-und-bsw-vor-bundestagswahl-13017067.html,https://www.tagesspiegel.de/internationales/beide-parteien-fur-wiederaufnahme-russischer-gaslieferungen-lawrow-lobt-afd-und-bsw-vor-bundestagswahl-13017067.html,0,www.tagesspiegel.de,Beide Parteien für Wiederaufnahme russischer Gaslieferungen : Lawrow lobt AfD und BSW vor Bundestagswahl,An der deutschen Politik lässt Russlands Außenminister in der Regel kein gutes Haar. Aber vor der Bundestagswahl sieht er auch „vernünftige“ Kräfte.,https://www.tagesspiegel.de/images/13017145/alternates/BASE_16_9_W1400/1736865525000/russlands-au-enminister-sergej-lawrow-hob-hervor-dass-afd-vertreter-auch-in-russischen-talkshows-auftreten-und-sich-dort-fur-bessere-beziehungen-zwischen-moskau-und-berlin-einsetzten.jpeg,2025-01-14T14:38:58Z,http://archive.md/20250114174930/https://www.tagesspiegel.de/internationales/beide-parteien-fur-wiederaufnahme-russischer-gaslieferungen-lawrow-lobt-afd-und-bsw-vor-bundestagswahl-13017067.html,"Der russische Außenminister Sergej Lawrow hat vor der Bundestagswahl die AfD und das BSW als Verteidiger nationaler deutscher Interessen gelobt. Es gebe in ihren Äußerungen viel Vernünftiges, sagte L… [+3041 chars]",,de,'Gas'
https://www.bild.de/leben-wissen/lifestyle/wilder-ritt-dieser-strauss-gibt-richtig-gas-67858bad33491a35e704f0ea,https://www.bild.de/leben-wissen/lifestyle/wilder-ritt-dieser-strauss-gibt-richtig-gas-67858bad33491a35e704f0ea,0,www.bild.de,Wilder Ritt - Dieser Strauß gibt richtig Gas,Und weg sind sie! Dieser Strauß sprintet auf einmal los – und seine Reiterin kann sich nur noch festklammern.,"https://images.bild.de/67858bad33491a35e704f0ea/4ebd4c40c5d869c69fc39b9e50b09cbb-landscape,e890963e?w=1280",2025-01-14T14:53:15Z,https://web.archive.org/web/20250114223541/https://www.bild.de/leben-wissen/lifestyle/wilder-ritt-dieser-strauss-gibt-richtig-gas-67858bad33491a35e704f0ea,"Mehr zum Video anzeigen 
Und weg sind sie! Dieser Strauß sprintet auf einmal los und seine Reiterin kann sich nur noch festklammern.
Quelle: ViralPress14.01.2025 - 15:53 Uhr",,de,'Gas'
https://www.stern.de/gesellschaft/regional/nordrhein-westfalen/entscheidung--duesseldorf-darf-4-000-gaslaternen-auf-led-umruesten-35380468.html,https://www.stern.de/gesellschaft/regional/nordrhein-westfalen/entscheidung--duesseldorf-darf-4-000-gaslaternen-auf-led-umruesten-35380468.html,0,www.stern.de,Entscheidung: Düsseldorf darf 4.000 Gaslaternen auf LED umrüsten,"Mit Gas betriebene Straßenlaternen sind teuer, umweltschädlich und störanfällig. In Düsseldorf stehen sie aber unter Denkmalschutz. Nun hat die Landesregierung entschieden.",https://image.stern.de/35380470/t/wW/v1/w1440/r1.7778/-/14--c7ebe5dwv7v6axs2048jpeg---adfb43498a00102e.jpg,2025-01-14T15:32:57Z,,"Kopiere den aktuellen Link
Mit Gas betriebene Straßenlaternen sind teuer, umweltschädlich und störanfällig. In Düsseldorf stehen sie aber unter Denkmalschutz. Nun hat die Landesregierung entschieden… [+1026 chars]",,de,'Gas'
https://www.diepresse.com/19254095/europa-verzichtet-auf-russengas-und-macht-arme-laender-damit-noch-aermer,https://www.diepresse.com/19254095/europa-verzichtet-auf-russengas-und-macht-arme-laender-damit-noch-aermer,0,www.diepresse.com,Europa verzichtet auf Russengas – und macht arme Länder damit noch ärmer [premium],"Angeheizt vom Krieg in der Ukraine, steht der Welt 2025 ein Gerangel um Gas bevor. Eigentlich verlieren alle – aber unterschiedlich stark.",https://img.diepresse.com/public/incoming/xvt5yu-FILES-FRANCE-ENVIRONMENT-CLIMATE-INDUSTRY-ENERGY/alternates/DPR_SOCIAL_MAGAZIN/FILES-FRANCE-ENVIRONMENT-CLIMATE-INDUSTRY-ENERGY,2025-01-14T19:18:46Z,,"Angeheizt vom Krieg in der Ukraine, steht der Welt 2025 ein Gerangel um Gas bevor. Eigentlich verlieren alle aber unterschiedlich stark. 
Zum ersten Mal seit der Verschärfung der Energiekrise durch … [+311 chars]",,de,'Gas'
https://www.welt.de/vermischtes/article255130128/Markus-Lanz-Ob-dann-das-eine-oder-andere-Gebiet-mehr-zur-Ukraine-gehoert-ist-nicht-relevant-sagt-Joerg-Urban.html,https://www.welt.de/vermischtes/article255130128/Markus-Lanz-Ob-dann-das-eine-oder-andere-Gebiet-mehr-zur-Ukraine-gehoert-ist-nicht-relevant-sagt-Joerg-Urban.html,0,www.welt.de,"„Ob dann das eine oder andere Gebiet mehr zur Ukraine gehört, ist nicht relevant“, sagt Jörg Urban","Wie weiter im Ukraine-Krieg? Und sollten die Deutschen wieder Gas aus Russland beziehen? Bei Markus Lanz zeigten die Vertreter von AfD und BSW, wie nahe sich Rechtsaußen und Linksaußen in dieser Frage sind.",https://img.welt.de/img/politik/ausland/mobile255130306/8647933727-ci16x9-w1200/Nominierung-Deutscher-Fernsehpreis-Markus-Lanz.jpg,2025-01-15T04:11:29Z,http://archive.md/20250115071509/https://www.welt.de/vermischtes/article255130128/Markus-Lanz-Ob-dann-das-eine-oder-andere-Gebiet-mehr-zur-Ukraine-gehoert-ist-nicht-relevant-sagt-Joerg-Urban.html,"Wie weiter im Ukraine-Krieg? Und sollten die Deutschen wieder Gas aus Russland beziehen? Bei Markus Lanz zeigten die Vertreter von AfD und BSW, wie nahe sich Rechtsaußen und Linksaußen in dieser Frag… [+5406 chars]",,de,'Gas'
https://www.spektrum.de/news/exoplaneten-nicht-alle-heissen-jupiter-sind-alleine/2249638,https://www.spektrum.de/news/exoplaneten-nicht-alle-heissen-jupiter-sind-alleine/2249638,0,www.spektrum.de,Exoplaneten: Nicht alle Heißen Jupiter sind allein,"Im System WASP-132 gibt es neben einem Heißen Jupiter noch zwei weitere Planeten, eine heiße Supererde weiter innen und kalten Gasplaneten weiter außen.",https://static.spektrum.de/fm/912/f1920x1080/WEB_Illustration_Wasp132_Unige_ThibautRoger_OriginalVersion.jpg,2025-01-15T08:30:00Z,,"Um den Stern WASP-132, der sich etwa 400 Lichtjahre von der Erde entfernt im südlichen Sternbild Wolf befindet, kreisen drei Exoplaneten auf unterschiedlichen Bahnen. Dies wäre weiter nichts Verwunde… [+1987 chars]",,de,'Gas'
https://www.horizont.net/marketing/nachrichten/frontalangriff-auf-lieferando-mit-diesem-ohrwurm-steigt-wolt-in-die-tv-werbung-ein-225153,https://www.horizont.net/marketing/nachrichten/frontalangriff-auf-lieferando-mit-diesem-ohrwurm-steigt-wolt-in-die-tv-werbung-ein-225153,0,www.horizont.net,Frontalangriff auf Lieferando: Mit diesem Ohrwurm steigt Wolt in die TV-Werbung ein,"Der Markt für Lieferdienste ist hart umkämpft. Gleich mehrere Anbieter versuchen, dem Marktführer Lieferando das Wasser abzugraben. Einer davon ist Wolt. Die Tochter des US-Konzerns DoorDash gibt jetzt auch in der Kommunikation Gas.",https://www.horizont.net/news/media/46/Wolt--459588.jpeg,2025-01-15T15:10:00Z,,"Der Markt für Lieferdienste ist hart umkämpft. Gleich mehrere Anbieter versuchen, dem Marktführer Lieferando das Wasser abzugraben. Einer davon ist Wolt. Die Tochter des US-Konzerns DoorDash gibt jet… [+184 chars]",,de,'Gas'
https://www.bild.de/regional/brandenburg/schulklasse-betroffen-chlorgas-alarm-18-verletzte-in-schwimmhalle-6787d141e1c7ef2d914caa4c,https://www.bild.de/regional/brandenburg/schulklasse-betroffen-chlorgas-alarm-18-verletzte-in-schwimmhalle-6787d141e1c7ef2d914caa4c,0,www.bild.de,Schulklasse betroffen - Chlorgas-Alarm! 18 Verletzte in Schwimmhalle,Strausberg – Gas-Alarm in Brandenburg! 18 Menschen sind bei einem mutmaßlichen Chlorgas-Austritt in einer Schwimmhalle in Strausberg (Landkreis Märkisch-...,"https://images.bild.de/6787d141e1c7ef2d914caa4c/8df9d734eaa2676c0ce2903fce2780b0,b726a17d?w=1280",2025-01-15T15:48:57Z,,"Strausberg Gas-Alarm in Brandenburg! 18 Menschen sind bei einem mutmaßlichen Chlorgas-Austritt in einer Schwimmhalle in Strausberg (Landkreis Märkisch-Oderland) verletzt worden, mindestens eine Perso… [+1270 chars]",,de,'Gas'
https://www.zeit.de/politik/deutschland/2025-01/untersuchungsausschuss-bundestag-atomausstieg-steffi-lemke-christian-lindner,https://www.zeit.de/politik/deutschland/2025-01/untersuchungsausschuss-bundestag-atomausstieg-steffi-lemke-christian-lindner,0,www.zeit.de,Untersuchungsausschuss: Lemke und Lindner widersprechen sich bei Befragung zum Atomausstieg,"Der Untersuchungsausschuss hat die Umweltministerin und den Ex-Finanzminister zur Atomkraft befragt. Lemke verteidigte den Ausstieg, Lindner unterstellte Parteipolitik.",https://img.zeit.de/administratives/sharing/fallback-image/wide__1300x731,2025-01-15T18:53:27Z,http://archive.md/20250117124723/https://www.zeit.de/politik/deutschland/2025-01/untersuchungsausschuss-bundestag-atomausstieg-steffi-lemke-christian-lindner,Bundesumweltministerin Steffi Lemke (Grüne) und der ehemalige Bundesfinanzminister Christian Lindner (FDP) haben bei einer Befragung durch den Untersuchungsausschuss des Bundestags zum Atomausstieg i… [+2110 chars],,de,'Atomkraft'
https://www.tagesspiegel.de/politik/atomausstieg-habeck-kontert-vorwurfe-zum-atomausstieg-13026904.html,https://www.tagesspiegel.de/politik/atomausstieg-habeck-kontert-vorwurfe-zum-atomausstieg-13026904.html,0,www.tagesspiegel.de,Atomausstieg: Habeck kontert Vorwürfe zum Atomausstieg,Vor bald drei Jahren gingen die letzten deutschen Atomkraftwerke vom Netz. Die politischen Entscheidungen davor werden heute heftig diskutiert. Habeck weist Vorwürfe zurück - und schaltet auf Attacke.,https://www.tagesspiegel.de/images/13032937/alternates/BASE_16_9_W1400/1737044941000/untersuchungsausschuss-zum-atomausstieg.jpeg,2025-01-16T03:32:23Z,,Wenige Wochen vor der Bundestagswahl hat Bundeswirtschaftsminister Robert Habeck im Untersuchungsausschuss des Bundestags Vorwürfe zum Atomausstieg gekontert. Der Grünen-Kanzlerkandidat wehrte sich g… [+6966 chars],,de,'Atomkraft'
https://www.globenewswire.com/news-release/2025/01/16/3010518/0/de/Gr%C3%B6%C3%9Fte-Pyro-Drohnen-Show-der-Welt-wird-den-Himmel-von-Hanoi-an-Silvester-2025-erleuchten.html,https://www.globenewswire.com/news-release/2025/01/16/3010518/0/de/Gr%C3%B6%C3%9Fte-Pyro-Drohnen-Show-der-Welt-wird-den-Himmel-von-Hanoi-an-Silvester-2025-erleuchten.html,0,www.globenewswire.com,Größte Pyro-Drohnen-Show der Welt wird den Himmel von Hanoi an Silvester 2025 erleuchten,"HANOI, Vietnam, Jan. 16, 2025 (GLOBE NEWSWIRE) -- Nach dem Erfolg des Hanoi Art Light Festivals 2024 wird die Vietnam Oil and Gas Group (Petrovietnam) zusammen mit Sponsorenpartnern ihre Zusammenarbeit mit dem Hanoi People's Committee fortsetzen, um das Kunst…",,2025-01-16T03:46:00Z,,"HANOI, Vietnam, Jan. 16, 2025 (GLOBE NEWSWIRE) -- Nach dem Erfolg des Hanoi Art Light Festivals 2024 wird die Vietnam Oil and Gas Group (Petrovietnam) zusammen mit Sponsorenpartnern ihre Zusammenarbe… [+4420 chars]",,de,'Gas'
https://www.tagesspiegel.de/wirtschaft/millionen-verbraucher-zahlen-zu-viel-fur-strom-und-gas-13027909.html,https://www.tagesspiegel.de/wirtschaft/millionen-verbraucher-zahlen-zu-viel-fur-strom-und-gas-13027909.html,0,www.tagesspiegel.de,Teure Grundversorgung: Millionen Verbraucher zahlen zu viel für Strom und Gas,Viele Familien zahlen in der Grundversorgung unnötig hohe Gas- und Strompreise. Dabei können Kunden in bestimmten Tarifen jährlich Hunderte Euro sparen.,https://www.tagesspiegel.de/images/13027801/alternates/BASE_16_9_W1400/1737017884000/imago794440419.jpeg,2025-01-16T09:10:00Z,http://archive.md/20250116095240/https://www.tagesspiegel.de/wirtschaft/millionen-verbraucher-zahlen-zu-viel-fur-strom-und-gas-13027909.html,Haushalte sind zum Jahresbeginn von deutlichen Preissprüngen bei Strom und Gas verschont geblieben. Die Mehrheit der Grundversorger senkt im Januar ihre Strom- und Gaspreise. Die Folge: Stromkunden z… [+163 chars],,de,'Gas'
