index,url,valid,domain,title,description,image,published,archive,content,quote,language,keyword
https://www.welt.de/wirtschaft/article256042880/Stromausfall-So-sind-die-Deutschen-auf-einen-Blackout-vorbereitet.html,https://www.welt.de/wirtschaft/article256042880/Stromausfall-So-sind-die-Deutschen-auf-einen-Blackout-vorbereitet.html,0,www.welt.de,Nach dem Mega-Blackout – So sind die Deutschen auf das Spanien-Szenario vorbereitet,"Ein Blackout wie in Spanien ist auch in Deutschland nicht völlig ausgeschlossen. Wie gut die Deutschen darauf vorbereitet wären, zeigt jetzt eine Verivox-Umfrage. Auch nach dem Vertrauen in die Behörden bei einem solchen Fall wurde gefragt.",https://img.welt.de/img/wirtschaft/mobile256043440/0217939797-ci16x9-w1200/Mass-Electrical-Outage-Spain.jpg,2025-05-01T07:31:08Z,,"Ein Blackout wie in Spanien ist auch in Deutschland nicht völlig ausgeschlossen. Wie gut die Deutschen darauf vorbereitet wären, zeigt jetzt eine Verivox-Umfrage. Auch nach dem Vertrauen in die Behör… [+4128 chars]",,de,'Blackout'
https://www.faz.net/aktuell/karriere-hochschule/klassenzimmer/ueberlassen-schueler-chatgpt-und-co-das-denken-schwaechen-sie-ihre-gehirne-110432277.html,https://www.faz.net/aktuell/karriere-hochschule/klassenzimmer/ueberlassen-schueler-chatgpt-und-co-das-denken-schwaechen-sie-ihre-gehirne-110432277.html,0,www.faz.net,Lernen mit KI: Chancen und Herausforderungen für Deutschlands Schulen,"Überlassen Kinder und Jugendliche ChatGPT und Co. das Denken, schwächen sie ihre Gehirne. Das dürfen Schulen nicht zulassen. Forscher haben erste Ergebnisse vorgelegt, wann KI den Lernerfolg erhöht – sie sind ermutigend.",https://media0.faz.net/ppmedia/aktuell/gesellschaft/1477537642/1.10449410/facebook_teaser/viele-kinder-und-jugendliche.jpg,2025-05-01T07:56:20Z,http://archive.md/20250501080150/https://www.faz.net/aktuell/karriere-hochschule/klassenzimmer/ueberlassen-schueler-chatgpt-und-co-das-denken-schwaechen-sie-ihre-gehirne-110432277.html,"Künstliche Intelligenz hat in den Schulen Einzug gehalten, auch wenn manche Lehrkräfte das noch nicht wahrhaben wollen. Die Bandbreite ist freilich groß. Wenige Lehrer setzen KI schon ganz offensiv i… [+4358 chars]",,de,'Kinder'
https://www.tagesschau.de/inland/gesellschaft/namensrecht-aenderungen-100.html,https://www.tagesschau.de/inland/gesellschaft/namensrecht-aenderungen-100.html,0,www.tagesschau.de,Was sich beim Namensrecht ändert,Bei der Wahl von Ehe- und Familiennamen gibt es ab sofort neue Freiheiten. Das Namensrecht bietet Paaren und Kindern künftig mehr Möglichkeiten. Mancherorts könnte das für Platzprobleme sorgen. Was ist jetzt erlaubt - und was nicht?,https://images.tagesschau.de/image/6a34d6b1-4cd9-4a9c-b715-33511f0aa98b/AAABloqzANM/AAABkZLhkrw/16x9-1280/familie-strand-100.jpg,2025-05-01T08:18:47Z,https://web.archive.org/web/20250501085504/https://www.tagesschau.de/inland/gesellschaft/namensrecht-aenderungen-100.html,"Stand: 01.05.2025 10:18 Uhr
Bei der Wahl von Ehe- und Familiennamen gibt es ab sofort neue Freiheiten. Das Namensrecht bietet Paaren und Kindern künftig mehr Möglichkeiten. Mancherorts könnte das fü… [+5048 chars]",,de,'Geschlecht'
https://www.welt.de/sport/basketball/video256045010/Video-Highlights-ALBA-BERLIN-SYNTAINICS-MBC-Basketball-Bundesliga.html,https://www.welt.de/sport/basketball/video256045010/Video-Highlights-ALBA-BERLIN-SYNTAINICS-MBC-Basketball-Bundesliga.html,0,www.welt.de,Souveräne Leistung – Alba Berlin lässt gegen Weißenfels nichts anbrennen,"Alba Berlin gibt auf der Zielgeraden der BBL-Saison nochmal richtig Gas. Das ist auch unbedingt nötig, wenn der Vizemeister die Playoffs erreichen will. Gegen den Syntainics MBC holt Alba einen überzeugenden Sieg. Die Highlights im Video.",https://img.welt.de/img/sport/basketball/mobile256045268/6077939717-ci16x9-w1200/DEU-DFL-2-FBL-Hertha-BSC-Training.jpg,2025-05-01T08:31:10Z,https://web.archive.org/web/20250502042820/https://www.welt.de/sport/basketball/video256045010/Video-Highlights-ALBA-BERLIN-SYNTAINICS-MBC-Basketball-Bundesliga.html,"Alba Berlin gibt auf der Zielgeraden der BBL-Saison nochmal richtig Gas. Das ist auch unbedingt nötig, wenn der Vizemeister die Playoffs erreichen will. Gegen den Syntainics MBC holt Alba einen überz… [+148 chars]",,de,'Gas'
https://www.n-tv.de/politik/Rohstoffdeal-steht-das-ist-bisher-darueber-bekannt-article25739754.html,https://www.n-tv.de/politik/Rohstoffdeal-steht-das-ist-bisher-darueber-bekannt-article25739754.html,0,www.n-tv.de,USA und Ukraine schließen Pakt: Rohstoffdeal steht - das ist bisher darüber bekannt,"Seltene Erden, Graphit, Lithium, Kohle - die Ukraine verfügt über immense Bodenschätze. Die USA verschaffen sich mit dem nun geschlossenen Deal Zugriff auf diese Rohstoffe. Doch auch die Ukraine profitiert - sowohl sicherheitspolitisch als auch wirtschaftlich.",https://www.n-tv.de/img/incoming/crop25739765/3411329972-cImg_16_9-w1200/6b614e294152f6a958e628fdfcbd62a0.jpg,2025-05-01T10:12:12Z,https://web.archive.org/web/20250501110028/https://www.n-tv.de/politik/Rohstoffdeal-steht-das-ist-bisher-darueber-bekannt-article25739754.html,Nach wochenlangen Verhandlungen haben die USA und die Ukraine ein Abkommen über den Abbau ukrainischer Rohstoffe und den Wiederaufbau des vom Krieg zerstörten Landes unterzeichnet. Sicherheitsgaranti… [+6094 chars],,de,'Kohle'
https://www.faz.net/aktuell/wissen/computer-mathematik/durchschnittlich-2-1-geburten-pro-frau-reichen-manchmal-nicht-110446769.html,https://www.faz.net/aktuell/wissen/computer-mathematik/durchschnittlich-2-1-geburten-pro-frau-reichen-manchmal-nicht-110446769.html,0,www.faz.net,"Durchschnittlich 2,1 Kinder reichen nicht überall","Frauen müssen möglicherweise mehr Kinder bekommen als bisher gedacht, damit die Menschheit nicht ausstirbt. Das haben Forscher aus Japan berechnet. Ihre Modellierung zeigt außerden, wie fatal es ist, wenn zu wenige Mädchen geboren werden.",https://media0.faz.net/ppmedia/aktuell/wissen/computer-mathematik/1122710208/1.10446798/facebook_teaser_fplus/davon-gibt-es-in-zukunft-immer.jpg,2025-05-01T11:20:33Z,https://web.archive.org/web/20250501112836/https://www.faz.net/aktuell/wissen/computer-mathematik/durchschnittlich-2-1-geburten-pro-frau-reichen-manchmal-nicht-110446769.html,"Auch wer es mit Zahlen nicht so hat, dürfte dieser schon einmal begegnet sein, wo immer über die Entwicklung der Weltbevölkerung berichtet wurde: 2,1. Es ist der Wert einer Größe, welche die Demograp… [+419 chars]",,de,'Kinder'
https://www.faz.net/aktuell/feuilleton/lissabon-der-grosse-blackout-am-flughafen-110449605.html,https://www.faz.net/aktuell/feuilleton/lissabon-der-grosse-blackout-am-flughafen-110449605.html,0,www.faz.net,Im Herz der Finsternis,"Maximales Pech, minimaler Trost: Am Flughafen von Lissabon sind wir in den schlimmsten Blackout der jüngeren Geschichte geraten – und erlebten doch Momente der Erleuchtung.",https://media0.faz.net/ppmedia/aktuell/170122313/1.10449602/facebook_teaser/nichts-geht-mehr-der-flughafen.jpg,2025-05-01T12:50:14Z,https://web.archive.org/web/20250501140822/https://www.faz.net/aktuell/feuilleton/lissabon-der-grosse-blackout-am-flughafen-110449605.html,"Plötzlich blieben die Gondeln stehen, die gerade noch über das Lissaboner Weltausstellungsgelände von 1998 geschwebt waren, und wir erkannten nicht das Menetekel, sondern machten dummen Witze. Doch d… [+10097 chars]",,de,'Blackout'
https://www.morgenpost.de/berlin/article408911750/polizei-berlin-ekel-essen-verpflegung-schimmel-kaese-polizisten-1-mai.html,https://www.morgenpost.de/berlin/article408911750/polizei-berlin-ekel-essen-verpflegung-schimmel-kaese-polizisten-1-mai.html,0,www.morgenpost.de,Schimmel-Käse? Polizisten erhalten am 1. Mai teilweise Ekel-Essen,Ausgerechnet vor dem schweren Einsatz am 1. Mai haben einige Beamte offenbar vergammeltes Essen bekommen. Und das nicht zum ersten Mal.,https://img.sparknews.funkemedien.de/408906803/408906803_1746033762_v16_9_1600.jpeg,2025-05-01T14:15:04Z,https://web.archive.org/web/20250502021058/https://www.morgenpost.de/berlin/article408911750/polizei-berlin-ekel-essen-verpflegung-schimmel-kaese-polizisten-1-mai.html,"Berlin. Ausgerechnet vor dem schweren Einsatz am 1. Mai haben einige Beamte offenbar vergammeltes Essen bekommen. Und das nicht zum ersten Mal.
Zum 1. Mai ist offenbar verdorbene Nahrung an einige B… [+1300 chars]",,de,'Schimmel'
https://vorarlberg.orf.at/stories/3302867/,https://vorarlberg.orf.at/stories/3302867/,0,vorarlberg.orf.at,Baukulturpreis: Wohnbau und Sanierungen prämiert,"Mit dem Baukulturpreis werden in Vorarlberg alle fünf Jahre Projekte ausgezeichnet, die für qualitätvolle Planung und Umsetzung stehen. Nachdem die diesjährigen Preisträger gekürt wurden, sind die prämierten Projekte nun im Vorarlberger Architektur Institut (…",https://ibs.orf.at/vbg?image=https%3A%2F%2Foekastatic.orf.at%2Fmims%2F2025%2F18%2F90%2Fcrops%2Fw%3D1200%2Ch%3D627%2Cq%3D75%2F2604212_master_999690_image_15.jpg%3Fs%3D4dc012c9c035bda95ae782e7ab83a296cb724fb3,2025-05-01T16:15:51Z,,"Die Ausstellung im VAI zeigt: Architektur ist Spiegelbild kultureller, politischer und wirtschaftlicher Prozesse. Die wirtschaftliche Entwicklung zeigt sich etwa in einem Rückgang der Einreichungen f… [+2274 chars]",,de,'öffentliche Gebäude'
https://www.morgenpost.de/blogs-kolumnen/article408882706/warum-frank-lange-obdachlos-einmal-im-jahr-nach-berlin-kommt.html,https://www.morgenpost.de/blogs-kolumnen/article408882706/warum-frank-lange-obdachlos-einmal-im-jahr-nach-berlin-kommt.html,0,www.morgenpost.de,"Warum Frank, lange obdachlos, einmal im Jahr nach Berlin kommt","Kolumne Nachtgestalten: Er verlor zwei Zehen, schlief auf Dachböden: Kolumnist Dieter Puhl über Frank, der es aus der Obdachlosigkeit schaffte – und was ihm half.",https://img.sparknews.funkemedien.de/405283094/405283094_1725524958_v16_9_1600.jpeg,2025-05-02T03:30:00Z,,"Berlin. Er verlor zwei Zehen, schlief auf Dachböden: Kolumnist Dieter Puhl über Frank, der es aus der Obdachlosigkeit schaffte und was ihm half.",,de,'Obdachlosigkeit'
https://www.stern.de/gesellschaft/verschwoerungserzaehlungen--fake-news--wie-holen-wir-onkel-otto-da-raus--35667714.html,https://www.stern.de/gesellschaft/verschwoerungserzaehlungen--fake-news--wie-holen-wir-onkel-otto-da-raus--35667714.html,0,www.stern.de,Radikalisierte Menschen 50+: Wie hole ich Onkel Otto aus seiner Filterblase?,"Gerade ältere Menschen verheddern sich häufig in Verschwörungserzählungen und Telegram-Gruppen. Eine Expertin erklärt, warum – und wie man den Onkel da wieder rausbekommt.",https://image.stern.de/35667730/t/ZY/v3/w1440/r1.7778/-/verschwoerungserzaehlungen-radikalisierung-alte-menschen.jpg,2025-05-02T05:48:00Z,https://web.archive.org/web/20250502084157/https://www.stern.de/gesellschaft/verschwoerungserzaehlungen--fake-news--wie-holen-wir-onkel-otto-da-raus--35667714.html,"Kopiere den aktuellen Link
Zur Merkliste hinzufügen
Frau Pohl, was kann ich tun, wenn mein Onkel Fakenews über WhatsApp weiterleitet?Es gibt da verschiedene Strategien. Wenn jemand noch nicht allzu… [+14058 chars]",,de,'ältere Mensch'
https://www.morgenpost.de/berlin/article408915102/waerme-adC3A9-berlin-erwarten-gewitter-sturmboeen-und-wieder-kaelte.html,https://www.morgenpost.de/berlin/article408915102/waerme-adC3A9-berlin-erwarten-gewitter-sturmboeen-und-wieder-kaelte.html,0,www.morgenpost.de,"Wärme adé: Berlin erwarten Gewitter, Sturmböen und wieder Kälte",Die T-Shirts können wieder in den Schrank gepackt werden. Am Abend soll es gewittern. Danach wird es in Berlin deutlich kälter.,https://img.sparknews.funkemedien.de/408913912/408913912_1746166140_v16_9_1600.jpeg,2025-05-02T06:08:53Z,http://archive.md/20250502122709/https://www.morgenpost.de/berlin/article408915102/waerme-adC3A9-berlin-erwarten-gewitter-sturmboeen-und-wieder-kaelte.html,"Berlin. Die T-Shirts können wieder in den Schrank gepackt werden. Am Abend soll es gewittern. Danach wird es in Berlin deutlich kälter.
En paar Tage konnten die Berlinerinnen und Berliner sonnige un… [+3252 chars]",,de,'Kälte'
https://www.welt.de/politik/ausland/plus256047722/Auf-Anordnung-von-Trump-Agenda-von-Aktivisten-US-Studie-faellt-vernichtendes-Urteil-zur-Behandlung-von-Transkindern.html,https://www.welt.de/politik/ausland/plus256047722/Auf-Anordnung-von-Trump-Agenda-von-Aktivisten-US-Studie-faellt-vernichtendes-Urteil-zur-Behandlung-von-Transkindern.html,0,www.welt.de,„Agenda von Aktivisten“ – US-Studie fällt vernichtendes Urteil zur Behandlung von „Transkindern“,"Nach Großbritannien, Schweden oder Finnland rücken auch die USA von Pubertätsblockern für Kindern ab, die sich im falschen Geschlecht geboren fühlen. Eine Studie kommt zu einem harten Ergebnis der aktuellen Behandlungspraxis.",https://img.welt.de/img/politik/ausland/mobile256047762/9787932347-ci16x9-w1200-fnov-fpotl-fpi157750653/Protestors-demonstrate-as-Supreme-Court-hears-case-on-bans-to-puberty-blockers.jpg,2025-05-02T06:44:05Z,http://archive.md/20250515171021/https://www.welt.de/politik/ausland/plus256047722/Auf-Anordnung-von-Trump-Agenda-von-Aktivisten-US-Studie-faellt-vernichtendes-Urteil-zur-Behandlung-von-Transkindern.html,"Nach Großbritannien, Schweden oder Finnland rücken auch die USA von Pubertätsblockern für Kindern ab, die sich im falschen Geschlecht geboren fühlen. Eine Studie kommt zu einem harten Ergebnis der ak… [+25 chars]",,de,'Kinder'
https://www.tagesschau.de/wirtschaft/verbraucher/gasspeicher-erdgas-energiebranche-100.html,https://www.tagesschau.de/wirtschaft/verbraucher/gasspeicher-erdgas-energiebranche-100.html,0,www.tagesschau.de,"Erdgas: Teures Gas, leere Speicher","Die Gasspeicher sind so leer wie selten. Staatliche Auflagen schreiben vor, dass die Speicher im Sommer wieder befüllt werden. Doch ausgerechnet dann ist Erdgas inzwischen besonders teuer. Von Ingo Nathusius.",https://images.tagesschau.de/image/02090288-7cb9-4290-a09a-9527fec758c6/AAABld-Y7YQ/AAABkZLhkrw/16x9-1280/gas-172.jpg,2025-05-02T07:13:45Z,https://web.archive.org/web/20250502074140/https://www.tagesschau.de/wirtschaft/verbraucher/gasspeicher-erdgas-energiebranche-100.html,"Stand: 02.05.2025 09:13 Uhr
Die Gasspeicher sind so leer wie selten. Staatliche Auflagen schreiben vor, dass die Speicher im Sommer wieder befüllt werden. Doch ausgerechnet dann ist Erdgas inzwische… [+5058 chars]",,de,'Gas'
https://www.bild.de/sport/fussball/zwischen-pokal-und-3-liga-kaelte-schock-fuer-profis-von-hansa-rostock-6813f4c710132913ef604519,https://www.bild.de/sport/fussball/zwischen-pokal-und-3-liga-kaelte-schock-fuer-profis-von-hansa-rostock-6813f4c710132913ef604519,0,www.bild.de,Zwischen Pokal und 3. Liga - Kälte-Schock für Hansa-Profis,Nach dem Pokalsieg bei FC Schönberg bereitet sich Hansa Rostock intensiv auf die wichtige Drittliga-Auswärtspartie gegen Sandhausen vor.,"https://images.bild.de/6813f4c710132913ef604519/b894c738a6659b0264eb515059f1eb5f,89637231?w=1280",2025-05-02T08:48:12Z,https://web.archive.org/web/20250502101949/https://www.bild.de/sport/fussball/zwischen-pokal-und-3-liga-kaelte-schock-fuer-profis-von-hansa-rostock-6813f4c710132913ef604519,"Im Saisonfinale muss auch der Körper mitspielen! Nach dem Halbfinale des MV-Landespokals ist vor der wichtigen Drittliga-Auswärtspartie in Sandhausen.
Hansa Rostock hat genau 48 Stunden Zeit, um zu … [+1697 chars]",,de,'Kälte'
https://www.zeit.de/familie/2025-05/kinder-luegen-moritz-daum-psychologie-familienrat,https://www.zeit.de/familie/2025-05/kinder-luegen-moritz-daum-psychologie-familienrat,0,www.zeit.de,"Kinder und Lügen: ""Kinder lügen oft aus einer Not heraus""","Wenn Kinder lügen, ist das nicht unbedingt schlimm, sagt der Entwicklungspsychologe Moritz Daum. Eltern sollten aber verstehen, warum ihr Kind nicht die Wahrheit sagt.",https://img.zeit.de/familie/2025-04/kinder-luegen-moritz-daum-psychologie/wide__1300x731,2025-05-02T09:54:06Z,http://archive.md/20250502100056/https://www.zeit.de/familie/2025-05/kinder-luegen-moritz-daum-psychologie-familienrat,"Dieser Artikel ist Teil von ZEIT am Wochenende, Ausgabe 18/2025.
""Ich hab' schon Zähne geputzt"", ""Ich habe Bauchweh"", ""Das Buch ist wirklich ganz toll, Oma"": Kinder lügen aus ganz unterschiedlichen … [+799 chars]",,de,'Kinder'
https://www.zeit.de/wirtschaft/2025-04/luxus-lebensmittel-erdbeere-erewhon-preis-japan,https://www.zeit.de/wirtschaft/2025-04/luxus-lebensmittel-erdbeere-erewhon-preis-japan,0,www.zeit.de,"Luxuslebensmittel: ""Wir behandeln die Erdbeeren wie unsere Kinder""",Eine Erdbeerfarmerin aus Japan exportiert ihre Früchte in die USA – und verkauft sie dort für 20 US-Dollar das Stück. Ist das noch Genuss oder schon pure Dekadenz?,https://img.zeit.de/wirtschaft/2025-04/luxus-erdbeere-japan-usa-bild-2/wide__1300x731,2025-05-02T10:13:01Z,http://archive.md/20250502103510/https://www.zeit.de/wirtschaft/2025-04/luxus-lebensmittel-erdbeere-erewhon-preis-japan,"Dieser Artikel ist Teil von ZEIT am Wochenende, Ausgabe 18/2025.
20 US-Dollar für eine einzige Erdbeere: Die 28-jährige Farmerin Julia Suzuki hat sich gemeinsam mit ihrem Partner Taiki Ito in der ja… [+380 chars]",,de,'Kinder'
https://www.faz.net/aktuell/wirtschaft/blackout-in-spanien-versorgungssicherheit-muss-an-erster-stelle-stehen-110449947.html,https://www.faz.net/aktuell/wirtschaft/blackout-in-spanien-versorgungssicherheit-muss-an-erster-stelle-stehen-110449947.html,0,www.faz.net,Den Blackout verhindern: Lebenselixier Strom,Aus den großflächigen Stromausfällen in Spanien und Portugal kann Deutschland einiges lernen. Allen voran: Die Versorgungssicherheit ist gegenüber der Bezahlbarkeit und der Umweltverträglichkeit zu priorisieren.,https://media0.faz.net/ppmedia/aktuell/wirtschaft/699311913/1.10449952/facebook_teaser_fplus/monteure-erneuern-eine-110-kv.jpg,2025-05-02T10:50:26Z,http://archive.md/20250502125329/https://www.faz.net/aktuell/wirtschaft/blackout-in-spanien-versorgungssicherheit-muss-an-erster-stelle-stehen-110449947.html,"Wie angewiesen die moderne Gesellschaft auf den unablässigen Strom der Elektrizität ist, dürfte vielen Bewohnern Madrids, Lissabons und anderer urbaner Zentren auf der Iberischen Halbinsel erst am Mo… [+570 chars]",,de,'Blackout'
https://www.zeit.de/news/2025-05/02/sieben-verletzte-bei-unfall-kinder-nicht-richtig-gesichert,https://www.zeit.de/news/2025-05/02/sieben-verletzte-bei-unfall-kinder-nicht-richtig-gesichert,0,www.zeit.de,Schwerer Auffahrunfall: Sieben Verletzte bei Unfall – Kinder nicht richtig gesichert,Hier finden Sie Informationen zu dem Thema „Schwerer Auffahrunfall“. Lesen Sie jetzt „Sieben Verletzte bei Unfall – Kinder nicht richtig gesichert“.,https://img.zeit.de/news/2025-05/02/sieben-verletzte-bei-unfall-kinder-nicht-richtig-gesichert-image-group/wide__1300x731,2025-05-02T10:52:49Z,https://web.archive.org/web/20250503033331/https://www.zeit.de/news/2025-05/02/sieben-verletzte-bei-unfall-kinder-nicht-richtig-gesichert,Bei einem Auffahrunfall auf der Autobahn 7 in Schwaben sind sieben Menschen leicht verletzt worden - darunter Kinder im Alter zwischen sechs Monaten und sechs Jahren. Zwei der drei Kinder seien währe… [+1172 chars],,de,'Kinder'
https://www.zeit.de/politik/2025-04/holocaust-ueberlebende-geschichte-nachrichtenpodcast,https://www.zeit.de/politik/2025-04/holocaust-ueberlebende-geschichte-nachrichtenpodcast,0,www.zeit.de,"Holocaustüberlebende: ""Ich bete jeden Tag, dass man mich nicht wieder wegjagt""","Sie waren Kinder, als der Holocaust ihr Leben veränderte. Heute sind sie die letzten Zeitzeugen. Drei Überlebende erzählen über ihr Leben, ihre Angst und ihre Hoffnung.",https://img.zeit.de/politik/2025-04/holocaust-ueberlebende-geschichte-nachrichtenpodcast-bild/wide__1300x731,2025-05-02T11:20:36Z,http://archive.md/20250502112752/https://www.zeit.de/politik/2025-04/holocaust-ueberlebende-geschichte-nachrichtenpodcast,"Janine Webber (l.), 92, Pedro Buchwald (m.), 87, und Hélène Gutkowski (r.), 85, erlebten den Holocaust als Kinder.© (l.) Grey Hutton, (m./r.) Ignacio Coló
Vor 80 Jahren endete der Zweite Weltkrieg i… [+1140 chars]",,de,'Kinder'
https://www.welt.de/wirtschaft/plus256049848/Atomkraft-Deutschland-immer-einsamer-Im-Westen-formiert-sich-eine-neue-Nuklear-Allianz.html,https://www.welt.de/wirtschaft/plus256049848/Atomkraft-Deutschland-immer-einsamer-Im-Westen-formiert-sich-eine-neue-Nuklear-Allianz.html,0,www.welt.de,Deutschland immer einsamer – Im Westen formiert sich eine neue Nuklear-Allianz,"Belgien will seine Energie-Strategie umfassend reformieren und vollendet damit eine 180-Grad-Wende. Das Land versucht dafür ein Atomkraft-Bündnis mit anderen Staaten zu schmieden, deren Energiepolitik sich fundamental vom deutschen Weg unterscheidet.",https://img.welt.de/img/wirtschaft/mobile256052310/1427932867-ci16x9-w1200-fnov-fpotl-fpi157750653/Geese-flying-in-front-of-cooling-towers-of-the-Doel-Nuclear-Power-Station.jpg,2025-05-02T11:52:55Z,https://web.archive.org/web/20250502122942/https://www.welt.de/wirtschaft/plus256049848/Atomkraft-Deutschland-immer-einsamer-Im-Westen-formiert-sich-eine-neue-Nuklear-Allianz.html,"Belgien will seine Energie-Strategie umfassend reformieren und vollendet damit eine 180-Grad-Wende. Das Land versucht dafür ein Atomkraft-Bündnis mit anderen Staaten zu schmieden, deren Energiepoliti… [+50 chars]",,de,'Atomkraft'
https://www.stern.de/wirtschaft/news/gasversorgung--gashaendler-sefe-zahlt-450-millionen-beihilfen-an-bund-zurueck-35688776.html,https://www.stern.de/wirtschaft/news/gasversorgung--gashaendler-sefe-zahlt-450-millionen-beihilfen-an-bund-zurueck-35688776.html,0,www.stern.de,Gasversorgung: Gashändler Sefe zahlt 450 Millionen Beihilfen an Bund zurück,"In der Energiekrise 2022 musste der Gas-Großhändler Sefe mit staatlichen Milliarden am Leben gehalten werden. Auch Sefe ist verpflichtet, Gelder zurückzuzahlen. Jetzt war es wieder so weit.",https://image.stern.de/35688778/t/7R/v1/w1440/r1.7778/-/02--qto2r6p6uov13axs2048jpeg---787ede96899075eb.jpg,2025-05-02T12:50:05Z,https://web.archive.org/web/20250502143612/https://www.stern.de/wirtschaft/news/gasversorgung--gashaendler-sefe-zahlt-450-millionen-beihilfen-an-bund-zurueck-35688776.html,"Kopiere den aktuellen Link
Zur Merkliste hinzufügen
In der Energiekrise 2022 musste der Gas-Großhändler Sefe mit staatlichen Milliarden am Leben gehalten werden. Auch Sefe ist verpflichtet, Gelder … [+1950 chars]",,de,'Gas'
https://www.tagesspiegel.de/wirtschaft/gasversorgung-gashandler-sefe-zahlt-450-millionen-beihilfen-an-bund-zuruck-13629322.html,https://www.tagesspiegel.de/wirtschaft/gasversorgung-gashandler-sefe-zahlt-450-millionen-beihilfen-an-bund-zuruck-13629322.html,0,www.tagesspiegel.de,Gasversorgung: Gashändler Sefe zahlt 450 Millionen Beihilfen an Bund zurück,"In der Energiekrise 2022 musste der Gas-Großhändler Sefe mit staatlichen Milliarden am Leben gehalten werden. Auch Sefe ist verpflichtet, Gelder zurückzuzahlen. Jetzt war es wieder so weit.",https://www.tagesspiegel.de/images/13629316/alternates/BASE_16_9_W1400/1746190278000/firmenschild-sefe.jpeg,2025-05-02T12:51:18Z,https://web.archive.org/web/20250503053153/https://www.tagesspiegel.de/wirtschaft/gasversorgung-gashandler-sefe-zahlt-450-millionen-beihilfen-an-bund-zuruck-13629322.html,"Das im Zuge der Energiekrise verstaatlichte Gashandels-, Gasspeicher- und Transportunternehmen Sefe hat weitere rund 450 Millionen Euro Beihilfen an Deutschland zurückgezahlt. Damit habe man insgesam… [+2467 chars]",,de,'Gas'
https://www.bild.de/leben-wissen/auto/auto-verkaufen-so-bekommen-sie-gebrauchtwagen-verkauf-mehr-geld-6810cfe03e4aff02aa6cd104,https://www.bild.de/leben-wissen/auto/auto-verkaufen-so-bekommen-sie-gebrauchtwagen-verkauf-mehr-geld-6810cfe03e4aff02aa6cd104,0,www.bild.de,Mit 5 Tipps zum besten Preis - So holen Sie beim Autoverkauf mehr Kohle raus,"Autokäufer suchen nach Mängeln und versuchen damit, den Preis zu drücken. Das klappt aber nicht, wenn Sie das Auto in einen Tipp-Topp-Zustand versetzen.","https://images.bild.de/6810cfe03e4aff02aa6cd104/560ae283a4c404042480665e2480ec63,1db12252?w=1280",2025-05-02T14:08:02Z,https://web.archive.org/web/20250502142456/http://www.bild.de/leben-wissen/auto/auto-verkaufen-so-bekommen-sie-gebrauchtwagen-verkauf-mehr-geld-6810cfe03e4aff02aa6cd104,"Das alte Auto hat ausgedient, ein neuer Wagen muss her? Die naheliegendste Finanzspritze für die neue Karre ist ein ordentlicher Verkaufspreis für den Gebrauchten.
Potentielle Käufer suchen nach Män… [+342 chars]",,de,'Kohle'
https://www.brigitte.de/aktuell/david-beckham-feiert-50--geburtstag--ehefrau-victoria-gratuliert-mit-suessem-video-13983564.html,https://www.brigitte.de/aktuell/david-beckham-feiert-50--geburtstag--ehefrau-victoria-gratuliert-mit-suessem-video-13983564.html,0,www.brigitte.de,David Beckham feiert 50. Geburtstag: Ehefrau Victoria gratuliert mit süßem Video,David Beckham wird zu seinem 50. Geburtstag gefeiert. Ehefrau Victoria postet ein Instagram-Video. Auch seine Kinder lassen ihn hochleben.,https://image.brigitte.de/13983566/t/zy/v1/w1440/r1.7778/-/02--ehefrau-victoria-gratuliert-mit-suessem-video---1-1---spoton-article-1095851.jpg,2025-05-02T14:22:00Z,https://web.archive.org/web/20250502161905/https://www.brigitte.de/aktuell/david-beckham-feiert-50--geburtstag--ehefrau-victoria-gratuliert-mit-suessem-video-13983564.html,"David Beckham wird zu seinem 50. Geburtstag gefeiert. Ehefrau Victoria postet ein Instagram-Video. Auch seine Kinder lassen ihn hochleben.
David Beckham feiert am 2. Mai seinen 50. Geburtstag. Mit e… [+2478 chars]",,de,'Kälte'
