index,url,valid,domain,title,description,image,published,archive,content,quote,language,keyword
https://www.stern.de/gesellschaft/regional/sachsen/gesundheit--grippewelle-in-sachsen--infektionszahlen-auf-hohem-niveau-37114086.html,https://www.stern.de/gesellschaft/regional/sachsen/gesundheit--grippewelle-in-sachsen--infektionszahlen-auf-hohem-niveau-37114086.html,0,www.stern.de,Gesundheit: Grippewelle in Sachsen: Infektionszahlen auf hohem Niveau,In Sachsen breiten sich Grippe und RSV weiter aus. Besonders Kleinkinder und ältere Erwachsene sind betroffen. Die aktuellen Infektionszahlen und Entwicklungen im Überblick.,https://image.stern.de/37114088/t/fe/v1/w1440/r1.7778/-/06--fzb3avlgpcv8axs2048jpeg---2ea460c2855d1332.jpg,2026-02-06T14:02:05Z,,"Kopiere den aktuellen Link
Zur Merkliste hinzufügen
In Sachsen breiten sich Grippe und RSV weiter aus. Besonders Kleinkinder und ältere Erwachsene sind betroffen. Die aktuellen Infektionszahlen und… [+1799 chars]",,de,'Grippe'
https://www.zeit.de/news/2026-02/06/wenn-kinder-und-jugendliche-andere-kinder-toeten,https://www.zeit.de/news/2026-02/06/wenn-kinder-und-jugendliche-andere-kinder-toeten,0,www.zeit.de,Gewalt unter Minderjährigen: Wenn Kinder und Jugendliche andere Kinder töten,Hier finden Sie Informationen zu dem Thema „Gewalt unter Minderjährigen“. Lesen Sie jetzt „Wenn Kinder und Jugendliche andere Kinder töten“.,https://img.zeit.de/news/2026-02/06/wenn-kinder-und-jugendliche-andere-kinder-toeten-image-group/wide__1300x731,2026-02-06T14:15:58Z,,"Wenn bei Mord oder Totschlag ein Kind unter Verdacht gerät, ist das Aufsehen groß. Insgesamt ist der Anteil Minderjähriger unter den Tatverdächtigen bei solchen schweren Gewalttaten zwar niedrig. Die… [+2908 chars]",,de,'Kinder'
https://www.zeit.de/news/2026-02/06/letzte-januarwoche-im-schnitt-233-grippefaelle-taeglich,https://www.zeit.de/news/2026-02/06/letzte-januarwoche-im-schnitt-233-grippefaelle-taeglich,0,www.zeit.de,Influenza: Letzte Januarwoche: Im Schnitt 233 Grippefälle täglich,Hier finden Sie Informationen zu dem Thema „Influenza“. Lesen Sie jetzt „Letzte Januarwoche: Im Schnitt 233 Grippefälle täglich“.,https://img.zeit.de/news/2026-02/06/letzte-januarwoche-im-schnitt-233-grippefaelle-taeglich-image-group/wide__1300x731,2026-02-06T14:29:02Z,,"In Thüringen sind in der letzten Januarwoche im Schnitt rund 233 Grippefälle pro Tag gemeldet worden. Insgesamt waren es im Verlauf der Woche 1.633 Neuerkrankungen, wie das Gesundheitsministerium mit… [+1335 chars]",,de,'Grippe'
https://www.nzz.ch/international/keine-versicherungen-oder-hafendienste-mehr-fuer-russische-schiffe-neues-eu-sanktionspaket-zielt-auf-oel-und-gas-ld.1923752,https://www.nzz.ch/international/keine-versicherungen-oder-hafendienste-mehr-fuer-russische-schiffe-neues-eu-sanktionspaket-zielt-auf-oel-und-gas-ld.1923752,0,www.nzz.ch,Keine Versicherungen oder Hafendienste mehr für russische Schiffe: Neues EU-Sanktionspaket zielt auf Öl und Gas,"Die Betreiber von russischen Tankern fälschen gemäss EU-Staaten Dokumente, um den Öl-Preisdeckel zu umgehen. Ein neuer Mechanismus soll dem nun einen Riegel schieben.","https://img.nzz.ch/2026/02/06/d71bc808-b2a0-4ef7-9f40-81e466998f35.jpg?width=1200&height=675&fit=bounds&quality=75&auto=webp&crop=4608,2592,x0,y240&wmark=nzz",2026-02-06T17:15:30Z,,"Die Betreiber von russischen Tankern fälschen gemäss EU-Staaten Dokumente, um den Ölpreisdeckel zu umgehen. Ein neuer Mechanismus soll dem nun einen Riegel schieben.
Dank seiner Schattenflotte verdi… [+3022 chars]",,de,'Gas'
https://www.golem.de/sonstiges/zustimmung/auswahl.html?from=https://www.golem.de/news/jugend-fuehrende-unionspolitiker-fuer-social-media-verbote-fuer-kinder-2602-205129.html&referer=https://t.co/67d05e3f0d,https://www.golem.de/sonstiges/zustimmung/auswahl.html?from=https://www.golem.de/news/jugend-fuehrende-unionspolitiker-fuer-social-media-verbote-fuer-kinder-2602-205129.html&referer=https://t.co/67d05e3f0d,0,www.golem.de,Jugend: Führende Unionspolitiker für Social-Media-Verbote für Kinder,"In der Union wächst der Ruf nach einem Verbot sozialer Medien für jugendliche unter 16. Es sollte ein Mindestalter für die Nutzung geben. (Jugendschutz, Soziales Netz)",,2026-02-06T18:09:02Z,,"Besuchen Sie Golem.de wie gewohnt mit Werbung und Tracking,
 indem Sie der Nutzung aller Cookies zustimmen.
 Details zum Tracking finden Sie im Privacy Center.
Skript wurde nicht geladen. Informat… [+607 chars]",,de,'Kinder'
https://www.stern.de/gesellschaft/regional/sachsen-anhalt/medizinischer-dienst--vom-baby-bis-zum-greis---zahl-der-pflegebeduerftigen-nimmt-zu-37115194.html,https://www.stern.de/gesellschaft/regional/sachsen-anhalt/medizinischer-dienst--vom-baby-bis-zum-greis---zahl-der-pflegebeduerftigen-nimmt-zu-37115194.html,0,www.stern.de,Medizinischer Dienst: Vom Baby bis zum Greis - Zahl der Pflegebedürftigen nimmt zu,Pflegebedarf betrifft in Sachsen-Anhalt nicht nur Senioren: Selbst Babys und Kinder brauchen manchmal spezielle Unterstützung. Wie sehen die neuen Zahlen und Fakten aus?,https://image.stern.de/37115196/t/gI/v1/w1440/r1.7778/-/07--lyrptsqi7ov5axs2048jpeg---f6852e0759290c3a.jpg,2026-02-07T03:00:28Z,,"Kopiere den aktuellen Link
Zur Merkliste hinzufügen
Pflegebedarf betrifft in Sachsen-Anhalt nicht nur Senioren: Selbst Babys und Kinder brauchen manchmal spezielle Unterstützung. Wie sehen die neue… [+4848 chars]",,de,'Kinder'
https://www.stern.de/gesellschaft/regional/hamburg-schleswig-holstein/buergerschaft--cdu-will-kinderaerztliche-u-untersuchungen-zur-pflicht-machen-37115268.html,https://www.stern.de/gesellschaft/regional/hamburg-schleswig-holstein/buergerschaft--cdu-will-kinderaerztliche-u-untersuchungen-zur-pflicht-machen-37115268.html,0,www.stern.de,Bürgerschaft: CDU will kinderärztliche U-Untersuchungen zur Pflicht machen,Sie dienen der Gesundheitsvorsorge und dem präventiven Kinderschutz: die sogenannten U-Untersuchungen. Verbindlich eingeladen wird in Hamburg nur zur U6 und U7. Der CDU reicht das nicht.,https://image.stern.de/37115270/t/89/v1/w1440/r1.7778/-/07--cvzjwtnexov14axs2048jpeg---bad800879867a69b.jpg,2026-02-07T03:30:06Z,,"Kopiere den aktuellen Link
Zur Merkliste hinzufügen
Sie dienen der Gesundheitsvorsorge und dem präventiven Kinderschutz: die sogenannten U-Untersuchungen. Verbindlich eingeladen wird in Hamburg nur… [+1938 chars]",,de,'Kinder'
https://www.zeit.de/news/2026-02/07/immer-mehr-games-beim-kindermedienfestival-goldener-spatz,https://www.zeit.de/news/2026-02/07/immer-mehr-games-beim-kindermedienfestival-goldener-spatz,0,www.zeit.de,"Filme, Serien und Spiele: Immer mehr Games beim Kindermedienfestival ""Goldener Spatz""","Hier finden Sie Informationen zu dem Thema „Filme, Serien und Spiele“. Lesen Sie jetzt „Immer mehr Games beim Kindermedienfestival ""Goldener Spatz""“.",https://img.zeit.de/news/2026-02/07/immer-mehr-games-beim-kindermedienfestival-goldener-spatz-image-group/wide__1300x731,2026-02-07T04:00:06Z,,"Noch bis zum 15. Februar können sich Kinder für die Jury des renommierten Kindermedienfestivals «Goldener Spatz» bewerben. Bei dem Festival dürfen sie Filme und Serie, aber etwa auch Apps und Games f… [+1741 chars]",,de,'Kinder'
https://www.stern.de/gesellschaft/regional/thueringen/filme--serien-und-spiele--immer-mehr-games-beim-kindermedienfestival--goldener-spatz--37115308.html,https://www.stern.de/gesellschaft/regional/thueringen/filme--serien-und-spiele--immer-mehr-games-beim-kindermedienfestival--goldener-spatz--37115308.html,0,www.stern.de,"Filme, Serien und Spiele: Immer mehr Games beim Kindermedienfestival ""Goldener Spatz""","Endspurt für die Bewerbungen zum ""Goldenen Spatzen"": Noch bis zum 15. Februar können Kinder sich für die Jury bewerben. Warum sie gerade auch beim Bereich Gaming gefragt sind.",https://image.stern.de/37115310/t/Np/v1/w1440/r1.7778/-/07--klhamywmfnv14axs2048jpeg---24fcb35c2309e4be.jpg,2026-02-07T04:00:06Z,,"Kopiere den aktuellen Link
Zur Merkliste hinzufügen
Endspurt für die Bewerbungen zum ""Goldenen Spatzen"": Noch bis zum 15. Februar können Kinder sich für die Jury bewerben. Warum sie gerade auch bei… [+1932 chars]",,de,'Kinder'
https://www.welt.de/politik/deutschland/article6986b5067e12c19d015ecb0f/fall-yosef-12-jaehriger-taeter-ist-aus-dem-verkehr-gezogen-reul-mahnt-debatte-ueber-strafmuendigkeit-an.html,https://www.welt.de/politik/deutschland/article6986b5067e12c19d015ecb0f/fall-yosef-12-jaehriger-taeter-ist-aus-dem-verkehr-gezogen-reul-mahnt-debatte-ueber-strafmuendigkeit-an.html,0,www.welt.de,12-jähriger Täter „ist aus dem Verkehr gezogen“ – Reul mahnt Debatte über Strafmündigkeit an,"NRW-Innenminister Herbert Reul hatte sich erst kurz vor dem Fal Yosef für ein Absenken der Strafmündigkeit ausgesprochen. Nach der Verhaftung des mutmaßlich 12-jährigen Täters erwartet er eine Debatte. Die SPD in NRW lehnt es ab, Kinder ins Gefängnis zu steck…",https://img.welt.de/img/masters/mobile160492822/7651629427-ci16x9-w1200/welt-fallback-jpg.jpg,2026-02-07T04:07:15Z,,NRW-Innenminister Herbert Reul hatte sich erst kurz vor dem Fal Yosef für ein Absenken der Strafmündigkeit ausgesprochen. Nach der Verhaftung des mutmaßlich 12-jährigen Täters erwartet er eine Debatt… [+3338 chars],,de,'Kinder'
https://www.stern.de/gesellschaft/regional/mecklenburg-vorpommern/soziales--deutlich-mehr-anrufe-bei-kinderschutzhotline-37115404.html,https://www.stern.de/gesellschaft/regional/mecklenburg-vorpommern/soziales--deutlich-mehr-anrufe-bei-kinderschutzhotline-37115404.html,0,www.stern.de,Soziales: Deutlich mehr Anrufe bei Kinderschutzhotline,Schwerin (mv) - Bei der landesweiten Kinderschutzhotline sind im vergangenen Jahr deutlich mehr Anrufe eingegangen. 2025 waren es rund 1.440 Anrufe und,https://image.stern.de/37115406/t/oW/v1/w1440/r1.7778/-/07--igagvb7fxkv7axs2048jpeg---db039bcd97b46580.jpg,2026-02-07T06:00:05Z,,"Kopiere den aktuellen Link
Zur Merkliste hinzufügen
Die landesweite Kinderschutzhotline gibt es seit vielen Jahren. Dort gingen im vergangenen Jahr mehr Anrufe ein. Auch eine andere Zahl stieg.
Be… [+2214 chars]",,de,'Kinder'
https://www.zeit.de/news/2026-02/07/deutlich-mehr-anrufe-bei-kinderschutzhotline,https://www.zeit.de/news/2026-02/07/deutlich-mehr-anrufe-bei-kinderschutzhotline,0,www.zeit.de,Soziales: Deutlich mehr Anrufe bei Kinderschutzhotline,Hier finden Sie Informationen zu dem Thema „Soziales“. Lesen Sie jetzt „Deutlich mehr Anrufe bei Kinderschutzhotline“.,https://img.zeit.de/news/2026-02/07/deutlich-mehr-anrufe-bei-kinderschutzhotline-image-group/wide__1300x731,2026-02-07T06:00:05Z,,"Bei der landesweiten Kinderschutzhotline sind im vergangenen Jahr deutlich mehr Anrufe eingegangen. 2025 waren es rund 1.440 Anrufe und damit knapp 350 mehr als noch ein Jahr zuvor, wie das Sozialmin… [+2055 chars]",,de,'Kinder'
https://www.spektrum.de/podcast/mama-konkret-warum-ist-mutterschaft-politisch/2308730,https://www.spektrum.de/podcast/mama-konkret-warum-ist-mutterschaft-politisch/2308730,0,www.spektrum.de,Warum ist Mutterschaft politisch?,"Mütter schmieren Brote, messen Fieber, helfen bei den Hausaufgaben, kaufen Kinderschuhe und Geschenke, lesen vor und trösten – manchmal alles an einem Tag. ️",https://static.spektrum.de/fm/912/f1920x1080/GettyImages-1360505311.jpg,2026-02-07T06:12:00Z,,"Ein Podcast von 
Politik prägt Mutterschaft
Wie kann unser Leben gestaltet werden? Welche Gesetze gibt es? Wie sehen die gesellschaftlichen und politischen Rahmenbedingungen aus? Wie ist es um Krip… [+1487 chars]",,de,'Kinder'
https://www.stern.de/panorama/obdachlosigkeit--wie-kann-man-wohnungslosen-helfen---37107426.html,https://www.stern.de/panorama/obdachlosigkeit--wie-kann-man-wohnungslosen-helfen---37107426.html,0,www.stern.de,"Hilfe in der Kälte: Wie kann ich erkennen, ob ein Obdachloser erfriert?",Obdachlosigkeit kann in diesen Tagen und Nächten lebensgefährlich sein: Wie hilft man wohnungslosen Menschen bei eisigen Temparaturen? Eine Hamburger Expertin weiß Rat.,https://image.stern.de/37107464/t/qw/v8/w1440/r1.7778/-/symbolfoto-obdachlosigkeit.jpg,2026-02-08T07:24:00Z,,"Kopiere den aktuellen Link
Zur Merkliste hinzufügen
Obdachlosigkeit kann in diesen Tagen und Nächten lebensgefährlich sein: Wie hilft man wohnungslosen Menschen bei eisigen Temparaturen? Eine Hambu… [+3449 chars]",,de,'Kälte'
https://www.zeit.de/news/2026-02/08/eis-vor-ruegener-lng-terminal-gastanker-muss-weiter-warten,https://www.zeit.de/news/2026-02/08/eis-vor-ruegener-lng-terminal-gastanker-muss-weiter-warten,0,www.zeit.de,Eis auf der Ostsee: Eis vor Rügener LNG-Terminal - Gastanker muss weiter warten,Hier finden Sie Informationen zu dem Thema „Eis auf der Ostsee“. Lesen Sie jetzt „Eis vor Rügener LNG-Terminal - Gastanker muss weiter warten“.,https://img.zeit.de/news/2026-02/08/eis-vor-ruegener-lng-terminal-gastanker-muss-weiter-warten-image-group/wide__1300x731,2026-02-08T12:42:49Z,,"Der Betreiber des Rügener LNG-Terminals rechnet wegen der Eislage erst im Laufe der neuen Woche damit, dass ein schon länger wartender Gastanker das Terminal anlaufen kann. «Für die Ein- und Ausfahrt… [+1886 chars]",,de,'Gas'
https://www.zeit.de/news/2026-02/08/projektcoaches-bewegen-woechentlich-3-000-kinder,https://www.zeit.de/news/2026-02/08/projektcoaches-bewegen-woechentlich-3-000-kinder,0,www.zeit.de,Sportförderung: Projektcoaches bewegen wöchentlich 3.000 Kinder,Hier finden Sie Informationen zu dem Thema „Sportförderung“. Lesen Sie jetzt „Projektcoaches bewegen wöchentlich 3.000 Kinder“.,https://img.zeit.de/news/2026-02/08/projektcoaches-bewegen-woechentlich-3-000-kinder-image-group/wide__1300x731,2026-02-08T15:23:48Z,,"Sie vermitteln Kindern sportliche Fertigkeiten, Teamwork und Fairplay: Sogenannte Bewegungscoaches sollen auch in diesem und im kommenden Jahr beim Nachwuchs Beweglichkeit und Freude am Sport fördern… [+1664 chars]",,de,'Kinder'
https://taz.de/Kriegswinter-in-der-Ukraine/!6148225/,https://taz.de/Kriegswinter-in-der-Ukraine/!6148225/,0,taz.de,"Kriegswinter in der Ukraine: Kälte, Hoffnung und Kultur","Es ist kalt, Russland verschärft seine Angriffe. Fünf Ukrai­ne­r*in­nen haben uns erzählt, wie sie mit kaputter Heizung und fehlendem Strom umgehen.",https://taz.de/picture/8235465/1200/Ukraibe-Russland-Kaelte.jpeg,2026-02-08T17:54:00Z,,"Es ist kalt, Russland verschärft seine Angriffe. Fünf Ukrai­ne­r*in­nen haben uns erzählt, wie sie mit kaputter Heizung und fehlendem Strom umgehen. mehr...",,de,'Kälte'
https://www.zeit.de/news/2026-02/09/neue-woche-beginnt-im-nordosten-mit-glaettegefahr-und-kaelte,https://www.zeit.de/news/2026-02/09/neue-woche-beginnt-im-nordosten-mit-glaettegefahr-und-kaelte,0,www.zeit.de,Nebel im Süden und der Mitte: Neue Woche beginnt im Nordosten mit Glättegefahr und Kälte,Hier finden Sie Informationen zu dem Thema „Nebel im Süden und der Mitte“. Lesen Sie jetzt „Neue Woche beginnt im Nordosten mit Glättegefahr und Kälte“.,https://img.zeit.de/news/2026-02/09/neue-woche-beginnt-im-nordosten-mit-glaettegefahr-und-kaelte-image-group/wide__1300x731,2026-02-09T04:30:05Z,,"Im Nordosten Deutschlands müssen sich die Menschen auch zum Start in die neue Woche gebietsweise auf Glätte einstellen. Es herrsche Dauerfrost, durch gefrierenden Sprühregen oder Schneegriesel könne … [+1366 chars]",,de,'Kälte'
https://www.stern.de/panorama/nebel-im-sueden-und-der-mitte--neue-woche-beginnt-im-nordosten-mit-glaettegefahr-und-kaelte-37118626.html,https://www.stern.de/panorama/nebel-im-sueden-und-der-mitte--neue-woche-beginnt-im-nordosten-mit-glaettegefahr-und-kaelte-37118626.html,0,www.stern.de,Nebel im Süden und der Mitte: Neue Woche beginnt im Nordosten mit Glättegefahr und Kälte,Glatteisgefahr und Nebel bestimmen in Deutschland den Start in die neue Woche. Im Nordosten bleibt es zunächst weiter kalt - im Laufe der Woche sind mildere Temperaturen und Regen angesagt.,https://image.stern.de/37118628/t/mZ/v1/w1440/r1.7778/-/09--p4jupivdhuv3axs2048jpeg---445742016b0fa8ad.jpg,2026-02-09T04:30:05Z,,"Kopiere den aktuellen Link
Zur Merkliste hinzufügen
Glatteisgefahr und Nebel bestimmen in Deutschland den Start in die neue Woche. Im Nordosten bleibt es zunächst weiter kalt - im Laufe der Woche s… [+1571 chars]",,de,'Kälte'
https://www.tagesspiegel.de/gesellschaft/panorama/nebel-im-suden-und-der-mitte-neue-woche-beginnt-im-nordosten-mit-glattegefahr-und-kalte-15231538.html,https://www.tagesspiegel.de/gesellschaft/panorama/nebel-im-suden-und-der-mitte-neue-woche-beginnt-im-nordosten-mit-glattegefahr-und-kalte-15231538.html,0,www.tagesspiegel.de,Nebel im Süden und der Mitte: Neue Woche beginnt im Nordosten mit Glättegefahr und Kälte,Glatteisgefahr und Nebel bestimmen in Deutschland den Start in die neue Woche. Im Nordosten bleibt es zunächst weiter kalt - im Laufe der Woche sind mildere Temperaturen und Regen angesagt.,https://www.tagesspiegel.de/images/15231537/alternates/BASE_16_9_W1400/1770611484000/winter-an-der-ostseekuste.jpeg,2026-02-09T04:31:24Z,,"Im Nordosten Deutschlands müssen sich die Menschen auch zum Start in die neue Woche gebietsweise auf Glätte einstellen. Es herrsche Dauerfrost, durch gefrierenden Sprühregen oder Schneegriesel könne … [+1422 chars]",,de,'Kälte'
https://www.faz.net/aktuell/feuilleton/debatten/macht-uns-das-smartphone-wirklich-duemmer-accg-110833615.html,https://www.faz.net/aktuell/feuilleton/debatten/macht-uns-das-smartphone-wirklich-duemmer-accg-110833615.html,0,www.faz.net,Jugend und Digitalisierung: Macht uns das Smartphone wirklich dümmer?,"Millennials und Leute der Gen Z, die mit dem Handy in der Hand aufwachsen, sind weniger intelligent als ältere Menschen. Das zumindest legen Studien nahe. Wer so argumentiert, übersieht Entscheidendes.",https://media0.faz.net/image/w1200h627/9db6f98caca8/w6144h3210x0y189o/202504/43601.0.947685633/junge-menschen-die-laufend-auf.webp,2026-02-09T07:48:58Z,,"In Platons Phaidros präsentiert der Gott Theuth dem König Thamus die Schrift als Mittel der Weisheit. Thamus aber widerspricht: Die Erfindung, sagt er, werde Vergesslichkeit stiften. Wer sich auf Ges… [+9354 chars]",,de,'ältere Mensch'
https://de.catholicnewsagency.com/news/23191/katholischer-pfarrer-im-gazastreifen-besorgt-um-lage-fur-kinder,https://de.catholicnewsagency.com/news/23191/katholischer-pfarrer-im-gazastreifen-besorgt-um-lage-fur-kinder,0,de.catholicnewsagency.com,Katholischer Pfarrer im Gazastreifen besorgt um Lage für Kinder,"Der Pfarrer der katholischen Pfarrei im Gazastreifen, Pater Gabriel Romanelli, hat sich mit einem dramatischen Appell an das weltweite katholische Hilfswerk „Kirche in Not“ (ACN) gewandt. „Seit Beginn der Waffenruhe im Oktober sind rund 100 Kinder im Gazastre…",https://de.catholicnewsagency.com/image/romanelli_1770561989.jpg?w=1150&jpg,2026-02-09T10:00:00Z,,"München -
 Montag, 9. Februar 2026, 11:00 Uhr.
Der Pfarrer der katholischen Pfarrei im Gazastreifen, Pater Gabriel Romanelli, hat sich mit einem dramatischen Appell an das weltweite katholische Hil… [+2431 chars]",,de,'Kälte'
https://hallespektrum.de/aktuelles/frostwarnung-und-tauwetter-durchwachsenes-winterwetter-in-halle-saale/475257/,https://hallespektrum.de/aktuelles/frostwarnung-und-tauwetter-durchwachsenes-winterwetter-in-halle-saale/475257/,0,hallespektrum.de,Frostwarnung und Tauwetter: Durchwachsenes Winterwetter in Halle,"Über Halle zieht in diesen Tagen ein Wechselspiel aus Nässe und Kälte hinweg, wie es der Februar seit jeher bereithält. Während der Himmel heute und am Mittwoch dicht verhangen bleibt, öffnet er am morgigen Dienstag für kurze Zeit sein Grau und lässt etwas So…",https://hallespektrum.de/wp-content/uploads/2025/12/WETTERSCHMUDDEL.png,2026-02-09T12:10:38Z,,"Über Halle zieht in diesen Tagen ein Wechselspiel aus Nässe und Kälte hinweg, wie es der Februar seit jeher bereithält. Während der Himmel heute und am Mittwoch dicht verhangen bleibt, öffnet er am m… [+672 chars]",,de,'Kälte'
https://www.tagesspiegel.de/sport/als-mutter-zum-ersten-olympia-gold-italien-feiert-francesca-lollobrigida-und-das-progetto-mamma-15233927.html,https://www.tagesspiegel.de/sport/als-mutter-zum-ersten-olympia-gold-italien-feiert-francesca-lollobrigida-und-das-progetto-mamma-15233927.html,0,www.tagesspiegel.de,Als Mutter zum ersten Olympia-Gold: Italien feiert Francesca Lollobrigida und das „Progetto Mamma“,Sie kann Kälte nicht leiden und ihre Großtante war eine Filmdiva. Eisschnellläuferin Lollobrigida ist Italiens Liebling bei diesen Winterspielen – und kämpft für Gleichberechtigung.,https://www.tagesspiegel.de/images/15233881/alternates/BASE_16_9_W1400/1770649323000/womena-s-speed-skating-3000m-milano-cortina-2026-olympic-games-07-02-2026.jpeg,2026-02-09T16:06:36Z,,"Der italienische Wintersport wird seit jeher vom Norden dominiert. Die überwältigende Mehrheit des Olympiateams stammt aus den Regionen in oder am Fuße der Alpen: aus Südtirol, dem Trentino, Venetien… [+6356 chars]",,de,'Kälte'
https://www.zeit.de/news/2026-02/10/kinder-in-gefahr-sehr-emotionale-situationen,https://www.zeit.de/news/2026-02/10/kinder-in-gefahr-sehr-emotionale-situationen,0,www.zeit.de,"Nach dem Fall Noah: Kinder in Gefahr - ""sehr emotionale Situationen""","Hier finden Sie Informationen zu dem Thema „Nach dem Fall Noah“. Lesen Sie jetzt „Kinder in Gefahr - ""sehr emotionale Situationen""“.",https://img.zeit.de/news/2026-02/10/kinder-in-gefahr-sehr-emotionale-situationen-image-group/wide__1300x731,2026-02-10T03:00:12Z,,"An den kleinen Luca erinnert sich Anke Siebert bis heute. Die Feuerwehr rief beim Frankfurter Kinder- und Jugendschutztelefon an, das sieben Tage die Woche besetzt ist, und bat um Hilfe. Lucas Mutter… [+5430 chars]",,de,'Kinder'
https://www.tagesspiegel.de/berlin/teils-spurbar-hohere-kosten-zu-erwarten-in-berlin-und-brandenburg-wird-deutlich-mehr-geheizt-15234657.html,https://www.tagesspiegel.de/berlin/teils-spurbar-hohere-kosten-zu-erwarten-in-berlin-und-brandenburg-wird-deutlich-mehr-geheizt-15234657.html,0,www.tagesspiegel.de,Teils spürbar höhere Kosten zu erwarten: In Berlin und Brandenburg wird deutlich mehr geheizt,Der Januar war vor allem in Nord- und Ostdeutschland ein sehr kalter Monat. Einer Auswertung zufolge wird sich das bei den Heizkosten vieler Verbraucher niederschlagen – vor allem in Brandenburg.,https://www.tagesspiegel.de/images/15234656/alternates/BASE_16_9_W1400/1770696180000/heizkorper-und-heizthermostat.jpeg,2026-02-10T04:03:01Z,,Im teils sehr kalten Januar 2026 ist in Berlin und vor allem in Brandenburg deutlich mehr geheizt worden als in den beiden Vorjahresmonaten. Wie aus einer Auswertung des Energiedienstleisters Techem … [+1800 chars],,de,'Heizkosten'
https://www.focus.de/gesundheit/uebergewicht-verdreifacht-risiko-fuer-schweren-infektionsverlauf/uebergewicht-erhoeht-risiko-fuer-schwere-lungenentzuendung-und-grippe_b4fc5aec-a41c-48da-816f-f98f25e8b3d4.html,https://www.focus.de/gesundheit/uebergewicht-verdreifacht-risiko-fuer-schweren-infektionsverlauf/uebergewicht-erhoeht-risiko-fuer-schwere-lungenentzuendung-und-grippe_b4fc5aec-a41c-48da-816f-f98f25e8b3d4.html,0,www.focus.de,Übergewicht verdreifacht Risiko für schweren Infektionsverlauf/ Übergewicht erhöht Risiko für schwere Lungenentzündung und Grippe,"Übergewichtige landen bei Infektionen deutlich häufiger im Krankenhaus – besonders Menschen mit schwerer Adipositas sind stark gefährdet, schwere oder tödliche Krankheitsverläufe zu erleiden.",https://quadro.burda-forward.de/ctf/ca196e72-b29d-4db6-a131-621ab0ba2db8.631f6b2e-0ee3-452f-aa48-ba8b6922e07f.jpg?im=RegionOfInterestCrop%3D%281200%2C630%29%2CregionOfInterest%3D%281034%2C559%29&hash=a0af4ba9c92629ed68bd69ff8e5e69435c0c376d36edffc7421e316f6ea90143,2026-02-10T05:00:00Z,,"Menschen mit starkem Übergewicht haben ein deutlich erhöhtes Risiko, bei Infektionen einen schweren Krankheitsverlauf bis hin zum Tod zu erleiden. Das geht aus einer Analyse der Gesundheitsdaten von … [+5698 chars]",,de,'Geschlecht'
https://burgenland.orf.at/stories/3341276/,https://burgenland.orf.at/stories/3341276/,0,burgenland.orf.at,Kälte verzögert Arbeiten an A2,Die Südautobahn (A2) bei Pinkafeld ist seit Anfang Dezember nur eingeschränkt befahrbar. Der Grund ist eine Hangrutschung an der Richtungsfahrbahn Graz. Der Damm muss aufwändig stabilisiert werden. Wegen der niedrigen Temperaturen im Jänner dauern die Arbeite…,https://ibs.orf.at/bgl?image=https%3A%2F%2Foekastatic.orf.at%2Fmims%2F2026%2F07%2F67%2Fcrops%2Fw%3D1200%2Ch%3D627%2Cq%3D75%2F2928302_master_1131867_hang2.jpg%3Fs%3Dfd342562843f5d7c2754500c1eccd17738df4606,2026-02-10T05:00:00Z,,Der Damm unter der A2 bei Pinkafeld wird mit Betonpfählen und Ankern aus Metall saniert und stabilisiert. Der betroffenen Abschnitt ist rund 100 Meter lang. Wegen der sehr niedrigen Temperaturen konn… [+1275 chars],,de,'Kälte'
https://www.n-tv.de/wissen/Januar-war-global-der-fuenftwaermste-der-Geschichte-id30344866.html,https://www.n-tv.de/wissen/Januar-war-global-der-fuenftwaermste-der-Geschichte-id30344866.html,0,www.n-tv.de,Trotz extremer Kälte im Norden: Januar war global der fünftwärmste der Geschichte,Schneestürme und Kälte prägen den Januar dieses Jahres- zumindest auf der Nordhalbkugel. Für den Süden ergibt sich ein anderes Bild. Laut dem Klimawandeldienst Copernicus sorgt der Monat weltweit für extreme Wetterverhältnisse.,https://www.n-tv.de/img/30344904/1770705157/Img_16_9/1200/Waldbraende-bei-Sonnenaufgang-in-der-Naehe-von-Lirquen.jpg,2026-02-10T06:35:25Z,,"Trotz extremer Kälte im NordenJanuar war global der fünftwärmste der Geschichte
Chile litt im Januar unter schweren Waldbränden. (Foto: picture alliance/dpa/AP)
Schneestürme und Kälte prägen den Ja… [+2651 chars]",,de,'Kälte'
