index,url,valid,domain,title,description,image,published,archive,content,quote,language,keyword
https://www.morgenpost.de/kultur/article237120365/Weihnachts-Swing-mit-schnarrendem-Mikrofon.html,https://www.morgenpost.de/kultur/article237120365/Weihnachts-Swing-mit-schnarrendem-Mikrofon.html,0,www.morgenpost.de,Philharmonie: Weihnachts-Swing mit schnarrendem Mikrofon,Bandleader Andrej Hermlin und seine beiden Kinder verzauberten mit „Swinging Christmas“ im Kammermusiksaal.,https://img.morgenpost.de/img/kultur/crop237120363/4012607397-w820-cv16_9-q85/ffa55abc-788b-11ed-a20e-f0f27e93c712.jpg,2022-12-10T13:30:22Z,,Mit ihrem Programm Swinging Christmas im Kammermusiksaal holen Andrej Hermlin und seine beiden Kinder alias Swingin Hermlins mitsamt einer exquisit zusammengestellten Swingcombo die Berlinerinnen und… [+2901 chars],,de,'Kinder'
https://www.t-online.de/unterhaltung/stars/id_100095552/pietro-lombardis-schwangere-verlobte-laura-maria-rypa-liegt-im-krankenhaus.html,https://www.t-online.de/unterhaltung/stars/id_100095552/pietro-lombardis-schwangere-verlobte-laura-maria-rypa-liegt-im-krankenhaus.html,0,www.t-online.de,Pietro Lombardis schwangere Verlobte Laura Maria Rypa liegt im Krankenhaus - t-online,"<ol><li>Pietro Lombardis schwangere Verlobte Laura Maria Rypa liegt im Krankenhaus  t-online
</li><li>Pietro Lombardi: Verlobte Laura ist im Krankenhaus | Unterhaltung  BILD
</li><li>""Power-Mami"": Laura Maria Rypa ist ins Krankenhaus gekommen  Promiflash.de…",https://images.t-online.de/2022/12/n7Isq0pQ7pxm/866x346:3134x1763/fit-in/1800x0/pietro-lombardi-seine-verlobte-muss-einige-tage-im-krankenhaus-bleiben.jpg,2022-12-10T14:13:22Z,https://web.archive.org/web/20221210154931/https://www.t-online.de/unterhaltung/stars/id_100095552/pietro-lombardis-schwangere-verlobte-laura-maria-rypa-liegt-im-krankenhaus.html,"Pietro Lombardi sorgt sich um seine Verlobte Laura Maria Rypa. Die schwangere Influencerin musste ins Krankenhaus eingeliefert werden.
Sänger 
Pietro Lombardi teilt in einer Instagram-Story mit, da… [+1436 chars]",,de,'Schwangere'
https://www.welt.de/kultur/plus242548193/Paw-Patrol-Oktonauten-Mecha-Builders-So-machen-sie-Kinder-besser.html,https://www.welt.de/kultur/plus242548193/Paw-Patrol-Oktonauten-Mecha-Builders-So-machen-sie-Kinder-besser.html,0,www.welt.de,Wie Paw Patrol unsere Kinder besser macht,"Serien wie „Paw Patrol“, „Mecha Builders“ oder „Die Oktonauten“ sind Erwachsenen ein Dorn im Auge. Sie wittern Führerkult, Kapitalismuspropaganda, Technikglaube. Doch die Generation, die damit aufwächst, wird die Probleme der Welt besser lösen als ihre Eltern…",https://img.welt.de/img/kultur/mobile233181297/1751350017-ci16x9-w1200-fnov-fpotl-fpi157750653/Kinostart-Paw-Patrol-Der-Kinofilm.jpg,2022-12-10T15:28:34Z,,"nelveklknup Zelpkett nup Beoelelnl- nup Beevetlua-Fnup Buehv lenp enO Vluphletlvelh. Pel pel enpaetetteueu POoeteuteae alpl Pkepe eltutalelek peu Uelheklpknup, vokleup Zelpkett plenQeu eO Vluphletlve… [+6768 chars]",,de,'Kinder'
https://www.n-tv.de/leute/Pietro-Lombardis-Verlobte-liegt-im-Krankenhaus-article23775773.html,https://www.n-tv.de/leute/Pietro-Lombardis-Verlobte-liegt-im-Krankenhaus-article23775773.html,0,www.n-tv.de,"""Dem Kind geht es gut"": Pietro Lombardis Verlobte liegt im Krankenhaus","Müssen sich Fans um Pietro Lombardis schwangere Verlobte sorgen? In einer Instagram-Story verkündet der Sänger, dass Laura Maria Rieper im Krankenhaus liegt. ""Was los ist"", wollen die beiden ihren Followern erst zu einem späteren Zeitpunkt sagen.",https://bilder3.n-tv.de/img/incoming/crop23775802/2911325253-cImg_16_9-w1200/IMG-3408-2-.jpg,2022-12-10T15:50:39Z,,"Müssen sich Fans um Pietro Lombardis schwangere Verlobte sorgen? In einer Instagram-Story verkündet der Sänger, dass Laura Maria Rieper im Krankenhaus liegt. ""Was los ist"", wollen die beiden ihren Fo… [+1927 chars]",,de,'Schwangere'
https://www.n-tv.de/politik/21-58-Tschechien-kritisiert-deutsche-Blockade-beim-EU-Gaspreisdeckel--article23143824.html,https://www.n-tv.de/politik/21-58-Tschechien-kritisiert-deutsche-Blockade-beim-EU-Gaspreisdeckel--article23143824.html,0,www.n-tv.de,Ukraine-Krieg im Liveticker: +++ 21:58 Tschechien kritisiert deutsche Blockade beim EU-Gaspreisdeckel +++,"Berlin, Washington, Br\u00fcssel - \u00fcberall. n-tv berichtet von allen wichtigen Schaupl\u00e4tzen der Innen- und Au\u00dfenpolitik.",https://bilder2.n-tv.de/img/incoming/crop23332537/9041326157-cImg_16_9-w1200/Liveticker1-grau-1-Kopie.jpg,2022-12-10T23:13:00Z,,Der tschechische Energieminister Jozef Sikela hat die Bundesregierung heftig für ihren Widerstand gegen die Einführung eines EU-Gaspreisdeckels kritisiert. Deutschland habe starke Verantwortung für d… [+32469 chars],,de,'Gas'
https://www.freitag.de/autoren/der-freitag/junge-maenner-und-ihre-gesundheit-geraedert-nach-dem-zocken-in-der-nacht,https://www.freitag.de/autoren/der-freitag/junge-maenner-und-ihre-gesundheit-geraedert-nach-dem-zocken-in-der-nacht,0,www.freitag.de,Geschlechterrollen | Junge Männer und ihre Gesundheit: Gerädert nach dem Zocken in der Nacht,"Der fünfte deutsche Männergesundheitsbericht untersucht die körperliche und psychosoziale Situation junger Männer. Manche Ergebnisse sind ermutigend Männer fühlen sich gesünder als Frauen, obwohl diese Eigenwahrnehmung mit der statistisch erfassten Häufigkeit…",https://www.freitag.de/autoren/der-freitag/junge-maenner-und-ihre-gesundheit-geraedert-nach-dem-zocken-in-der-nacht/@@images/social_image,2022-12-11T03:00:00Z,https://web.archive.org/web/20221209023053/https://www.freitag.de/autoren/der-freitag/junge-maenner-und-ihre-gesundheit-geraedert-nach-dem-zocken-in-der-nacht,"Männer fühlen sich gesünder als Frauen, obwohl diese Eigenwahrnehmung mit der statistisch erfassten Häufigkeit von Krankheitsbildern nicht übereinstimmt. In ihrer Selbstfürsorge seien Männer nicht so… [+5772 chars]",,de,'Geschlecht'
https://www.tag24.de/unterhaltung/promis/silvia-wollny/silvia-wollny-immenser-hass-gegen-schwangere-tochter-loredana-die-gebaermaschinen-2687168,https://www.tag24.de/unterhaltung/promis/silvia-wollny/silvia-wollny-immenser-hass-gegen-schwangere-tochter-loredana-die-gebaermaschinen-2687168,0,www.tag24.de,"Silvia Wollny macht immensen Hass gegen schwangere Tochter Loredana Ã¶ffentlich: ""die GebÃ¤rmaschinen"" - TAG24","<ol><li>Silvia Wollny macht immensen Hass gegen schwangere Tochter Loredana Ã¶ffentlich: ""die GebÃ¤rmaschinen""Â Â TAG24
</li><li>Wie hat Lavinia Wollny von ihrer Schwangerschaft erfahren?Â Â Promiflash.de
</li><li>Silvia Wollny verteidigt ihre Kinder gegen Hass-Kâ€¦",https://media.tag24.de/1200x800/k/s/ksbz2qcw8h13tj0hs6vqsv2ce779p89r.jpg,2022-12-11T06:40:00Z,https://web.archive.org/web/20221211080851/https://www.tag24.de/unterhaltung/promis/silvia-wollny/silvia-wollny-immenser-hass-gegen-schwangere-tochter-loredana-die-gebaermaschinen-2687168,"HÃ¼ckelhoven Dass blanker Hass im Netz oftmals nicht zu bremsen scheint, ist kein Geheimnis mehr. Seit der VerkÃ¼ndung ihrer Schwangerschaft muss auch Loredana Wollny (18) erfahren, was es heiÃŸt, aufs â€¦ [+2540 chars]",,de,'Schwangere'
https://www.faz.net/aktuell/wirtschaft/wohnen/immobilienmarkt-in-berlin-haelt-der-preisboom-an-18485407.html,https://www.faz.net/aktuell/wirtschaft/wohnen/immobilienmarkt-in-berlin-haelt-der-preisboom-an-18485407.html,0,www.faz.net,Immobilienmarkt im Umbruch: „In Berlin hält der Preisboom an“,"Steigende Zinsen und Kosten: Christoph Meszelinsky, BNP Paribas Real Estate, erwartet kurzfristige Verkäufe und Rückgänge für ältere Gebäude, aber kaum geringere Preise im Neubau.",https://media0.faz.net/ppmedia/aktuell/wirtschaft/1579716232/1.8511016/facebook_teaser_fplus/wohnhaeuser-in-berlin-im.jpg,2022-12-11T08:46:15Z,https://web.archive.org/web/20221211191302/http://www.faz.net/aktuell/wirtschaft/wohnen/immobilienmarkt-in-berlin-haelt-der-preisboom-an-18485407.html,"Immobilienmarkt im Umbruch: In Berlin hält der Preisboom an
Immobilienmarkt im Umbruch
In Berlin hält der Preisboom an
Von Jan HauserSteigende Zinsen und Kosten: Christoph Meszelinsky, BNP Paribas… [+181 chars]",,de,'Ältere'
https://web.de/magazine/unterhaltung/stars/pietro-lombardi-schwangere-verlobte-laura-maria-krankenhaus-37551356,https://web.de/magazine/unterhaltung/stars/pietro-lombardi-schwangere-verlobte-laura-maria-krankenhaus-37551356,0,web.de,Pietro Lombardi: Schwangere Verlobte Laura Maria ist im Krankenhaus - WEB.DE News,"<ol><li>Pietro Lombardi: Schwangere Verlobte Laura Maria ist im KrankenhausÂ Â WEB.DE News
</li><li>""Dem Kind geht es gut"": Pietro Lombardis Verlobte liegt im Krankenhaus - n-tv.deÂ Â n-tv NACHRICHTEN
</li><li>Pietro Lombardi: Verlobte Laura ist im Krankenhaus â€¦","https://i0.web.de/image/374/37551374,pd=1,f=opengraph/pietro-lombardi.jpg",2022-12-11T09:34:55Z,,<ul><li>Pietro Lombardi und seine Verlobte Laura Maria erwarten derzeit ihr erstes gemeinsames Kind.</li><li>Doch die Influencerin musste jetzt ins Krankenhaus eingeliefert werden.</li><li>Auf Instagâ€¦ [+2819 chars],,de,'Schwangere'
https://www.focus.de/finanzen/news/zusaetzlich-energie-sparen-verbraucher-koennen-mit-gas-und-strompreisbremse-ihre-kosten-halbieren_id_180446755.html,https://www.focus.de/finanzen/news/zusaetzlich-energie-sparen-verbraucher-koennen-mit-gas-und-strompreisbremse-ihre-kosten-halbieren_id_180446755.html,0,www.focus.de,Zusätzlich Energie sparen - Verbraucher können mit Gas- und Strompreisbremse ihre Kosten halbieren,"Millionen Bürger leiden unter hohen Energiekosten. Deshalb will die Bundesregierung Verbraucher 2023 entlasten. Gas und Strom werden billiger. Wie viel das bringt, zeigen neue Berechnungen. Wichtig dabei: Wer zusätzlich Energie spart, profitiert am meisten.",https://p6.focus.de/img/fotos/id_180443432/gasherd.jpg?im=Crop%3D%280%2C243%2C2048%2C1024%29%3BResize%3D%281200%2C627%29&impolicy=perceptual&quality=medium&hash=bd9009db6f7878fd37e23b2652ba3183bb39b21a41c1a75a222b3edc604cc6cf,2022-12-11T10:45:50Z,https://web.archive.org/web/20221211112912/https://www.focus.de/finanzen/news/zusaetzlich-energie-sparen-verbraucher-koennen-mit-gas-und-strompreisbremse-ihre-kosten-halbieren_id_180446755.html,"Millionen Bürger leiden unter hohen Energiekosten. Deshalb will die Bundesregierung Verbraucher 2023 entlasten. Gas und Strom werden billiger. Wie viel das bringt, zeigen neue Berechnungen. Wichtig d… [+3901 chars]",,de,'Gas'
https://www.sueddeutsche.de/muenchen/muenchen-obdachlose-inflation-krise-armut-1.5713345,https://www.sueddeutsche.de/muenchen/muenchen-obdachlose-inflation-krise-armut-1.5713345,0,www.sueddeutsche.de,"Obdachlosigkeit: ""Es herrscht eine richtige Katastrophenstimmung""","Die Krisen der vergangenen Monate sind auch auf Münchens Straßen sichtbar geworden. Es scheint, als gäbe es mehr Obdachlose als je zuvor. Doch ist das so? Erkundungen in einer Schattenwelt.",https://www.sueddeutsche.de/image/sz.1.5713348/1200x675?v=1670759261,2022-12-11T11:47:53Z,https://web.archive.org/web/20221211143554/https://www.sueddeutsche.de/muenchen/muenchen-obdachlose-inflation-krise-armut-1.5713345,"Die Krisen der vergangenen Monate sind auch auf Münchens Straßen sichtbar geworden. Es scheint, als gäbe es mehr Obdachlose als je zuvor. Doch ist das so? Erkundungen in einer Schattenwelt. Es ist be… [+720 chars]",,de,'Obdachlosigkeit'
https://www.n-tv.de/leute/Deshalb-ist-Pietro-Lombardis-Verlobte-in-der-Klinik-article23776484.html,https://www.n-tv.de/leute/Deshalb-ist-Pietro-Lombardis-Verlobte-in-der-Klinik-article23776484.html,0,www.n-tv.de,"""Das FrÃ¼hgeburt-Risiko senken"": Deshalb ist Pietro Lombardis Verlobte in der Klinik","Als bekannt wird, dass Pietro Lombardis schwangere Verlobte im Krankenhaus liegt, machen sich ihre Fans groÃŸe Sorgen. In einer Story erklÃ¤rt Laura Maria Rieper nun den Grund fÃ¼r ihren Klinik-Aufenthalt. Sie mÃ¼sse sich von nun an schonen.",https://bilder2.n-tv.de/img/incoming/crop23776489/9671328703-cImg_16_9-w1200/279379117.jpg,2022-12-11T12:08:21Z,https://web.archive.org/web/20221211154457/https://www.n-tv.de/leute/Deshalb-ist-Pietro-Lombardis-Verlobte-in-der-Klinik-article23776484.html,"Als bekannt wird, dass Pietro Lombardis schwangere Verlobte im Krankenhaus liegt, machen sich ihre Fans groÃŸe Sorgen. In einer Story erklÃ¤rt Laura Maria Rieper nun den Grund fÃ¼r ihren Klinik-Aufenthaâ€¦ [+2540 chars]",,de,'Schwangere'
https://www.diepresse.com/6226108/nehammer-kuendigt-weiteren-energiekostenzuschuss-an,https://www.diepresse.com/6226108/nehammer-kuendigt-weiteren-energiekostenzuschuss-an,0,www.diepresse.com,Nehammer kündigt weiteren Energiekostenzuschuss an,"Um Wettbewerbsnachteile für Unternehmen zu vermeiden, kündigt der Bundeskanzler Maßnahmen für Unternehmen an. Mittel aus dem angekündigten Heizkostenzuschuss werden für den Kampf gegen Obdachlosigkeit reserviert.",https://media.diepresse.com/social_diepresse_nachrichten/images/uploads_1200/0/b/c/6226108/28AE0997-E9EC-4268-8FD6-BD39764F0E53_v0_l.jpg,2022-12-11T12:47:00Z,https://web.archive.org/web/20221212082730/https://www.diepresse.com/6226108/nehammer-kuendigt-weiteren-energiekostenzuschuss-an,"Um Wettbewerbsnachteile für Unternehmen zu vermeiden, kündigt der Bundeskanzler Maßnahmen für Unternehmen an. Mittel aus dem angekündigten Heizkostenzuschuss werden für den Kampf gegen Obdachlosigkei… [+2678 chars]",,de,'Obdachlosigkeit'
https://www.diepresse.com/6226131/neuer-zuschuss-bei-energie-fuer-unternehmer,https://www.diepresse.com/6226131/neuer-zuschuss-bei-energie-fuer-unternehmer,0,www.diepresse.com,Neuer Zuschuss bei Energie für Unternehmer,Nehammer reagiert auf deutsche Gaspreisbremse. Bei Schengen will er weiter zuwarten.,https://media.diepresse.com/social_diepresse_nachrichten/images/uploads_1200/0/d/3/6226131/-HANDOUT--GIPFEL-EU-WESTBALKAN-NEHAMMER_1670771044209932.jpg,2022-12-11T15:04:00Z,https://web.archive.org/web/20221212160327/https://www.diepresse.com/6226131/neuer-zuschuss-bei-energie-fuer-unternehmer,"Nehammer reagiert auf deutsche Gaspreisbremse. Bei Schengen will er weiter zuwarten.
Wien. Bundeskanzler Karl Nehammer kündigt einen weiteren Energiekostenzuschuss für Unternehmen an. Aufgrund des n… [+2226 chars]",,de,'Obdachlosigkeit'
https://www.bild.de/bild-plus/geld/wirtschaft/politik-inland/verband-legt-drei-szenarien-vor-bei-diesen-temperaturen-droht-der-gasmangel-82217374.bild.html,https://www.bild.de/bild-plus/geld/wirtschaft/politik-inland/verband-legt-drei-szenarien-vor-bei-diesen-temperaturen-droht-der-gasmangel-82217374.bild.html,0,www.bild.de,*** BILDplus Inhalt *** Verband legt drei Kälte-Szenarien vor - Bei DIESEN Temperaturen droht uns der Gasmangel,Es gibt drei Szenarien für den Winter. In einem kommen wir sehr schlecht weg.Foto: Axel Heimken/dpa,"https://images.bild.de/6395a53882c17278ce2f0d4b/710c56d849a301ee6ff3d17efda0c178,286ec036?w=1280",2022-12-11T16:09:22Z,https://web.archive.org/web/20221211173418/https://www.bild.de/bild-plus/geld/wirtschaft/politik-inland/verband-legt-drei-szenarien-vor-bei-diesen-temperaturen-droht-der-gasmangel-82217374.bild.html,"Seit dem Beginn von Russlands Angriffskrieg gegen die Ukraine zittert Europa und vor allem Deutschland vor dem Winter. Die Angst vor einer Gas-Mangellage ist groß.
Der Gasspeicher-Verband hat jetzt … [+234 chars]",,de,'Kälte'
https://www.bild.de/bild-plus/unterhaltung/leute/leute/pietro-und-seine-schwangere-laura-angst-vor-fruehgeburt-82219096.bild.html,https://www.bild.de/bild-plus/unterhaltung/leute/leute/pietro-und-seine-schwangere-laura-angst-vor-fruehgeburt-82219096.bild.html,0,www.bild.de,Pietro und seine schwangere Laura - Angst vor FrÃ¼hgeburt,"DSDS-Star Pietro Lombardi (30) weicht nicht vom Krankenbett seiner Verlobten.Â Foto: ğ�—Ÿğ�—”ğ�—¨ğ�—¥ğ�—” ğ�— ğ�—”ğ�—¥ğ�—œğ�—”/Instagram, lauramaria.rpa/Instagram","https://images.bild.de/6395ca7c82c17278ce2f0d8d/1848188031f9d95da4344ebb59861fc3,845020fc?w=1280",2022-12-11T16:37:36Z,https://web.archive.org/web/20221211180406/https://www.bild.de/bild-plus/unterhaltung/leute/leute/pietro-und-seine-schwangere-laura-angst-vor-fruehgeburt-82219096.bild.html,"DSDS-Star Pietro Lombardi (30) ist mÃ¤chtig stolz und mÃ¤chtig in Sorge zugleich. 
Seit Samstag liegt die Verlobte des SÃ¤ngers im Krankenhaus und Pietro weicht ihr nicht von der Seite. Laura Maria Rypâ€¦ [+268 chars]",,de,'Schwangere'
https://www.morgenpost.de/politik/article237128179/gas-speicherstaende-mangellage-wetter.html,https://www.morgenpost.de/politik/article237128179/gas-speicherstaende-mangellage-wetter.html,0,www.morgenpost.de,Energiekrise: Frost in Deutschland: Was heißt das für die Gasversorgung?,"Mit Temperaturen unter dem Gefrierpunkt steigt der Gasverbrauch in Deutschland, die Speicherstände sinken. Wann droht im Winter eine Mangellage?",https://img.morgenpost.de/img/politik/crop237128177/7492609302-w820-cv16_9-q85/1007bdec-7967-11ed-9041-3980e55eddf0.jpg,2022-12-11T21:00:00Z,,"Berlin.  Es ist kalt in Deutschland. Der Dezember hat Schnee und Frost in viele Teile des Landes gebracht, die Temperaturen sind unter dem Gefrierpunkt. Und da werden sie laut dem Deutschem Wetterdie… [+5500 chars]",,de,'Gas'
https://www.nzz.ch/sport/sport-die-schweizer-sportler-des-jahres-heissen-kambundji-und-odermatt-und-federer-tritt-als-ueberraschungsgast-auf-ld.1566300,https://www.nzz.ch/sport/sport-die-schweizer-sportler-des-jahres-heissen-kambundji-und-odermatt-und-federer-tritt-als-ueberraschungsgast-auf-ld.1566300,0,www.nzz.ch,KURZMELDUNGEN - Sport: Die Schweizer Sportler des Jahres heissen Kambundji und Odermatt – und Federer tritt als Überraschungsgast auf,Die wichtigsten Sportmeldungen im Überblick.,"https://img.nzz.ch/2022/12/11/e0da81a9-3722-4adb-a65e-ab825f092f35.jpeg?width=1200&height=675&fit=bound&quality=75&auto=webp&crop=4016,2259,x0,y50&wmark=nzz",2022-12-11T22:20:14Z,http://archive.md/20221212104107/https://www.nzz.ch/sport/sport-die-schweizer-sportler-des-jahres-heissen-kambundji-und-odermatt-und-federer-tritt-als-ueberraschungsgast-auf-ld.1566300,"Allgemeines: Die Schweizer Sportler des Jahres heissen Kambundji und Odermatt und Federer tritt als Überraschungsgast auf
Roger Federer nimmt den Ehrenpreis entgegen.
(sda) Mujinga Kambundji und Ma… [+10584 chars]",,de,'Gas'
https://www.n-tv.de/wirtschaft/Netzagentur-fuerchtet-Kaeltewelle-article23777081.html,https://www.n-tv.de/wirtschaft/Netzagentur-fuerchtet-Kaeltewelle-article23777081.html,0,www.n-tv.de,Gassparen bei Minusgraden: Netzagentur fürchtet Kältewelle,Haushalte und Industrie haben zuletzt zwar schon deutlich weniger Gas verbraucht als im Schnitt der letzten Jahre. Die Einsparziele der Bundesnetzagentur wurden dennoch verfehlt. Behördenchef Müller ist angesichts der Wetteraussichten für die nächsten Tage be…,https://bilder4.n-tv.de/img/incoming/crop23777079/5211324642-cImg_16_9-w1200/imago0195719256h.jpg,2022-12-12T01:33:05Z,,Haushalte und Industrie haben zuletzt zwar schon deutlich weniger Gas verbraucht als im Schnitt der letzten Jahre. Die Einsparziele der Bundesnetzagentur wurden dennoch verfehlt. Behördenchef Müller … [+2103 chars],,de,'Gas'
https://www.tagesschau.de/wirtschaft/verbraucher/bundesnetzagentur-115.html,https://www.tagesschau.de/wirtschaft/verbraucher/bundesnetzagentur-115.html,0,www.tagesschau.de,"Bundesnetzagentur zum Energiesparen: ""Nicht nachlassen""",Die Gasspeicher sind gut gefüllt. Doch die Bundesnetzagentur warnt: Derzeit werde zu wenig gespart. Auch der energiepolitische Sprecher der Unionsfraktion zeigt sich beunruhigt - und fordert einen Energiespar-Appell des Kanzlers.,https://www.tagesschau.de/multimedia/bilder/heizung-thermostat-117~_v-original.jpg,2022-12-12T01:38:36Z,,Die Gasspeicher sind gut gefüllt. Doch die Bundesnetzagentur warnt: Derzeit werde zu wenig gespart. Auch der energiepolitische Sprecher der Unionsfraktion zeigt sich beunruhigt - und fordert einen En… [+2070 chars],,de,'Gasspeicher'
https://www.faz.net/aktuell/wirtschaft/bundesnetzagentur-einsparungen-beim-gasverbrauch-reichen-nicht-aus-18527731.html,https://www.faz.net/aktuell/wirtschaft/bundesnetzagentur-einsparungen-beim-gasverbrauch-reichen-nicht-aus-18527731.html,0,www.faz.net,Bundesnetzagentur: Einsparungen beim Gasverbrauch reichen nicht aus,Deutschland verfehlt das Einsparziel beim Gasverbrauch deutlich. Bundesnetzagentur-Chef Klaus Müller warnt: Eine längere Kältewelle sei riskant.,https://media1.faz.net/ppmedia/aktuell/politik/1198470691/1.8527733/facebook_teaser/flamme-eines-gasherdes.jpg,2022-12-12T01:40:23Z,,"Die Bundesnetzagentur hat die Menschen in Deutschland aufgefordert, mehr Gas zu sparen, als sie es derzeit tun. Aktuell liegen die Einsparungen insgesamt nur noch bei 13 Prozent, sagte der Präsident … [+2368 chars]",,de,'Gas'
https://www.zeit.de/wirtschaft/2022-12/bundesnetzagentur-energiesparen-gas-gasspeicher,https://www.zeit.de/wirtschaft/2022-12/bundesnetzagentur-energiesparen-gas-gasspeicher,0,www.zeit.de,Energieverbrauch: Bundesnetzagentur fordert Deutsche zu mehr Sparsamkeit auf,"Trotz gut gefüllter Gasspeicher ruft die Netzagentur dazu auf, mehr Gas zu sparen. Zugleich erreichen die Entschädigungszahlungen an Stromproduzenten einen Höchststand.",,2022-12-12T03:52:19Z,https://web.archive.org/web/20221212195719/https://www.zeit.de/wirtschaft/2022-12/bundesnetzagentur-energiesparen-gas-gasspeicher,"When browsing with ads:
We collect personal data and also transmit it to third-party providers
 that help us improve and finance our digital content. Some of the information stored on your device, … [+732 chars]",,de,'Gas'
https://www.zeit.de/news/2022-12/12/der-aus-der-kaelte-kommt-wenige-winzer-setzen-auf-eiswein,https://www.zeit.de/news/2022-12/12/der-aus-der-kaelte-kommt-wenige-winzer-setzen-auf-eiswein,0,www.zeit.de,Lebensmittel: Der aus der Kälte kommt: Wenige Winzer setzen auf Eiswein,,,2022-12-12T04:44:52Z,https://web.archive.org/web/20221213034113/https://www.zeit.de/news/2022-12/12/der-aus-der-kaelte-kommt-wenige-winzer-setzen-auf-eiswein,"When browsing with ads:
We collect personal data and also transmit it to third-party providers
 that help us improve and finance our digital content. Some of the information stored on your device, … [+732 chars]",,de,'Kälte'
https://www.welt.de/wirtschaft/article242631681/Bundesnetzagentur-fordert-hoehere-Einsparungen-beim-Gasverbrauch.html,https://www.welt.de/wirtschaft/article242631681/Bundesnetzagentur-fordert-hoehere-Einsparungen-beim-Gasverbrauch.html,0,www.welt.de,Netzagentur-Chef fordert noch höhere Einsparungen beim Gasverbrauch,"Der Präsident der Bundesnetzagentur hat die Deutschen dazu aufgefordert, mehr Gas zu sparen. Derzeit lägen die Einsparungen nur bei 13 Prozent. Nötig seien indes 20 Prozent. Es gelte, den ganzen Winter durchzuhalten.",https://img.welt.de/img/wirtschaft/mobile242631687/5301358487-ci16x9-w1200/Bundesnetzagentur-Klaus-Mueller.jpg,2022-12-12T04:59:07Z,https://web.archive.org/web/20221212053226/https://www.welt.de/wirtschaft/article242631681/Bundesnetzagentur-fordert-hoehere-Einsparungen-beim-Gasverbrauch.html,"Die Bundesnetzagentur hat die Menschen in Deutschland aufgefordert, mehr Gas zu sparen, als sie es derzeit tun. Aktuell liegen die Einsparungen insgesamt nur noch bei 13 Prozent, sagte der Präsident … [+1807 chars]",,de,'Gasspeicher'
https://tirol.orf.at/stories/3185225/,https://tirol.orf.at/stories/3185225/,0,tirol.orf.at,Strom- und Gasverbrauch deutlich gesunken,"Die Tirolerinnen und Tiroler haben heuer im Vergleich zum Oktober 2021 rund 30 Prozent weniger Gas und rund zehn Prozent weniger Strom verbraucht. Grund seien einerseits Energiesparmaßnahmen, andererseits relativ hohe Temperaturen, so die Energiegesellschafte…",https://ibs.orf.at/tir?image=https%3A%2F%2Foekastatic.orf.at%2Fmims%2F2022%2F49%2F27%2Fcrops%2Fw%3D1200%2Ch%3D627%2Cq%3D75%2F1592095_master_583027_1591374_opener_582719_strompreisbremse_start_pba.jpg%3Fs%3Da5c4f4165d95ebde06d059067e2c28180eab1a8a,2022-12-12T05:26:55Z,https://web.archive.org/web/20221212092553/https://tirol.orf.at/stories/3185225/,"Im Oktober haben die Tirolerinnen und Tiroler laut TIGAS rund 30 Prozent Gas im Vergleich zum Vorjahr eingespart, im November dürften es rund 20 Prozent sein, so der technische Geschäftsführer der TI… [+3151 chars]",,de,'Gas'
https://www.tagesspiegel.de/wirtschaft/jeder-beitrag-zahlt-cdu-vizechef-fordert-energiespar-appell-von-bundeskanzler-scholz-9014338.html,https://www.tagesspiegel.de/wirtschaft/jeder-beitrag-zahlt-cdu-vizechef-fordert-energiespar-appell-von-bundeskanzler-scholz-9014338.html,0,www.tagesspiegel.de,„Jeder Beitrag zählt!“: CDU-Vizechef fordert Energiespar-Appell von Bundeskanzler Scholz,"Trotz voller Gasspeicher sei die Gefahr einer Gasmangellage nicht vom Tisch, sagt CDU-Vize Jung. Auch der Chef der Bundesnetzagentur rät zum Energiesparen.",https://www.tagesspiegel.de/wirtschaft/images/energie-im-winter-wird-doppeltes-dilemma/alternates/BASE_16_9_W1400/energie-im-winter-wird-doppeltes-dilemma.jpeg,2022-12-12T06:10:45Z,https://web.archive.org/web/20221212061537/https://www.tagesspiegel.de/wirtschaft/jeder-beitrag-zahlt-cdu-vizechef-fordert-energiespar-appell-von-bundeskanzler-scholz-9014338.html,"Die Bundesnetzagentur hat die Menschen in Deutschland aufgefordert, mehr Gas zu sparen, als sie es derzeit tun. Aktuell liegen die Einsparungen insgesamt nur noch bei 13 Prozent, sagte der Präsident … [+2041 chars]",,de,'Gasspeicher'
