index,url,valid,domain,title,description,image,published,archive,content,quote,language,keyword
https://www.tagesspiegel.de/gesellschaft/panorama/mehr-als-60-tote-befurchtet-boot-mit-vermutlich-101-migranten-vor-kap-verde-verungluckt-10320739.html,https://www.tagesspiegel.de/gesellschaft/panorama/mehr-als-60-tote-befurchtet-boot-mit-vermutlich-101-migranten-vor-kap-verde-verungluckt-10320739.html,0,www.tagesspiegel.de,Mehr als 60 Tote befürchtet: Boot mit vermutlich 101 Migranten vor Kap Verde verunglückt,Dutzende Migranten werden nach einem Bootsunglück vor Kap Verde noch vermisst und gelten als tot. Unter den Überlebenden sind auch Kinder.,https://www.tagesspiegel.de/gesellschaft/panorama/images/imago0239413823hjpg/alternates/BASE_16_9_W1400/imago0239413823hjpg.jpeg,2023-08-16T19:37:25Z,,Nach einem Bootsunglück vor der kapverdischen Küste geht die Internationale Organisation für Migration (IOM) vom Tod von 63 der vermutlich mehr als 100 Migranten an Bord aus. 38 Bootsinsassen seien g… [+1171 chars],,de,'Kinder'
https://www.stern.de/kultur/film/film--nasen-kritik--bernstein-kinder-verteidigen-bradley-cooper-33743114.html,https://www.stern.de/kultur/film/film--nasen-kritik--bernstein-kinder-verteidigen-bradley-cooper-33743114.html,0,www.stern.de,Film: Nasen-Kritik: Bernstein-Kinder verteidigen Bradley Cooper,"Der Schauspieler erntet harsche Kritik an seiner Darstellung des Künstlers im Musikdrama ""Maestro"". Nun nehmen Bernsteins Kinder Bradley Cooper in Schutz.",https://image.stern.de/33743116/t/qa/v1/w1440/r1.7778/-/17--urnnewsmldpacom2009010123081799860740v3w800h600l373t5r2021b1137jpeg---2a1adbfd66d43baf.jpg,2023-08-17T00:11:35Z,,"Der Schauspieler erntet harsche Kritik an seiner Darstellung des Künstlers im Musikdrama ""Maestro"". Nun nehmen Bernsteins Kinder Bradley Cooper in Schutz.
Hollywood-Star Bradley Cooper (48) ist mit … [+2059 chars]",,de,'Kinder'
https://www.welt.de/vermischtes/article246951316/Film-Maestro-Bernstein-Kinder-verteidigen-Bradley-Cooper-nach-Nasen-Kritik.html,https://www.welt.de/vermischtes/article246951316/Film-Maestro-Bernstein-Kinder-verteidigen-Bradley-Cooper-nach-Nasen-Kritik.html,0,www.welt.de,Bernstein-Kinder verteidigen Bradley Cooper nach Nasen-Kritik,Hollywood-Star Bradley Cooper ist mit seiner Darstellung des berühmten Dirigenten und Komponisten Leonard Bernstein (1918-1990) in dem Film „Maestro“ in die Kritik geraten. Nun verteidigen die Kinder des Komponisten Cooper.,https://img.welt.de/img/vermischtes/mobile246951332/5111350327-ci16x9-w1200/Venice-Film-Festival-Lineup.jpg,2023-08-17T00:34:47Z,,"Die Familie des jüdischen Dirigenten und Komponisten Leonard Bernstein hat sich angesichts der Entscheidung Bradley Coopers, in der Rolle Bernsteins in seinem neuen Film Maestro eine Nasenprothese zu… [+1312 chars]",,de,'Kinder'
https://www.zeit.de/politik/ausland/2023-08/ukraine-ueberblick-drohnen-produktion-gastransit-russland,https://www.zeit.de/politik/ausland/2023-08/ukraine-ueberblick-drohnen-produktion-gastransit-russland,0,www.zeit.de,"Ukraine-Überblick: Ukraine produziert mehr Drohnen, lehnt Gespräche über Gastransit ab","Präsident Selenskyj bezeichnet Drohnen als ""Augen und Schutz"" an der Front. Der Energieminister der Ukraine hofft, dass Europa ohne russisches Gas auskommt. Die Nacht",,2023-08-17T03:30:48Z,https://web.archive.org/web/20230817060235/https://www.zeit.de/politik/ausland/2023-08/ukraine-ueberblick-drohnen-produktion-gastransit-russland,"When browsing with ads:
We collect personal data and also transmit it to third-party providers
 that help us improve and finance our digital content. Some of the information stored on your device, … [+821 chars]",,de,'Gas'
https://www.telepolis.de/features/Deutschlands-Gasreserven-und-die-globale-LNG-Krise-Was-der-Winter-bringen-koennte-9247620.html,https://www.telepolis.de/features/Deutschlands-Gasreserven-und-die-globale-LNG-Krise-Was-der-Winter-bringen-koennte-9247620.html,0,www.telepolis.de,Deutschlands Gasreserven und die globale LNG-Krise: Was der Winter bringen könnte,"Deutschland kam ohne Engpässe durch den Winter. Zwar sind die Gasspeicher jetzt gut gefüllt, doch der Markt lässt aufhorchen. Warum Gassparen wieder angesagt sein könnte.",https://heise.cloudimg.io/bound/1200x1200/q85.png-lossy-85.webp-lossy-85.foil1/_www-heise-de_/imgs/18/4/2/8/7/4/1/2/2x-lng-tanker_ho-a6a12fc419b1da77.jpeg,2023-08-17T05:00:00Z,https://web.archive.org/web/20230817215513/https://www.telepolis.de/features/Deutschlands-Gasreserven-und-die-globale-LNG-Krise-Was-der-Winter-bringen-koennte-9247620.html,"Deutschland kam ohne Engpässe durch den Winter. Zwar sind die Gasspeicher jetzt gut gefüllt, doch der Markt lässt aufhorchen. Warum Gassparen wieder angesagt sein könnte.
Bei den derzeitigen Außente… [+5634 chars]",,de,'Gasspeicher'
https://www.zeit.de/news/2023-08/17/verkehrsunfall-nahe-reinbek-verletzte-kinder,https://www.zeit.de/news/2023-08/17/verkehrsunfall-nahe-reinbek-verletzte-kinder,0,www.zeit.de,Stormarn: Verkehrsunfall nahe Reinbek: Verletzte Kinder,,,2023-08-17T05:44:29Z,https://web.archive.org/web/20230820054245/https://www.zeit.de/news/2023-08/17/verkehrsunfall-nahe-reinbek-verletzte-kinder,"When browsing with ads:
We collect personal data and also transmit it to third-party providers
 that help us improve and finance our digital content. Some of the information stored on your device, … [+821 chars]",,de,'Kinder'
https://www.faz.net/aktuell/politik/ukraine-liveticker-ukrainische-energieversorgung-fuer-den-winter-gesichert-faz-19030454.html,https://www.faz.net/aktuell/politik/ukraine-liveticker-ukrainische-energieversorgung-fuer-den-winter-gesichert-faz-19030454.html,0,www.faz.net,Ukraine-Liveblog: London: Energieversorgung der Ukraine für Winter gesichert,Kiew will kein russisches Gas mehr in EU durchleiten +++ Belarus verärgert über Litauens Grenzschließungen +++ Erster Frachter verlässt Hafen von Odessa +++ alle Entwicklungen im Liveblog,https://media0.faz.net/ppmedia/aktuell/politik/1896375567/1.9106366/facebook_teaser/wolodymy-selenskyj-anfang-der.jpg,2023-08-17T06:49:01Z,,"Bewaffnete Männer stürmen ein Schiff. Die Gewehre im Anschlag, betreten sie die Brücke. Maschinen anhalten! Maschinen anhalten!, schreien sie die Besatzung an. Die Männer auf der Brücke verschränken … [+968 chars]",,de,'Gas'
https://www.faz.net/aktuell/politik/ukraine-liveticker-ukrainische-asow-spezialbrigade-ist-wieder-im-einsatz-faz-19030454.html,https://www.faz.net/aktuell/politik/ukraine-liveticker-ukrainische-asow-spezialbrigade-ist-wieder-im-einsatz-faz-19030454.html,0,www.faz.net,Ukraine-Liveblog: Ukrainische Asow-Spezialbrigade ist wieder im Einsatz,Ukrainische Armee rückt südlich von Uroschajne vor +++ London: Energieversorgung der Ukraine für Winter gesichert +++ Kiew will kein russisches Gas mehr in EU durchleiten +++ alle Entwicklungen im Liveblog,https://media0.faz.net/ppmedia/aktuell/politik/1678210865/1.9110452/facebook_teaser/wolodymyr-selenskyj-schuettelt.jpg,2023-08-17T09:27:25Z,,"Wolodymyr Selenskyj schüttelt dem Kommandeur des Asow-Regiments, Denys Prokopenko, am internationalen Flughafen von Istanbul die Hand (Archivbild). Bild: dpa
Ukrainische Armee rückt südlich von Uros… [+164 chars]",,de,'Gas'
https://www.zeit.de/news/2023-08/17/nasen-kritik-bernstein-kinder-verteidigen-bradley-cooper,https://www.zeit.de/news/2023-08/17/nasen-kritik-bernstein-kinder-verteidigen-bradley-cooper,0,www.zeit.de,Musikdrama: Nasen-Kritik: Bernstein-Kinder verteidigen Bradley Cooper,,,2023-08-17T10:17:55Z,https://web.archive.org/web/20230818112829/https://www.zeit.de/news/2023-08/17/nasen-kritik-bernstein-kinder-verteidigen-bradley-cooper,"When browsing with ads:
We collect personal data and also transmit it to third-party providers
 that help us improve and finance our digital content. Some of the information stored on your device, … [+821 chars]",,de,'Kinder'
https://www.bild.de/ratgeber/2023/ratgeber/salmonellen-rufen-symptome-wie-durchfall-hervor-und-wo-sie-vorkommen-85077640.bild.html,https://www.bild.de/ratgeber/2023/ratgeber/salmonellen-rufen-symptome-wie-durchfall-hervor-und-wo-sie-vorkommen-85077640.bild.html,0,www.bild.de,Warnung vor der Infektion mit diesen Bakterien - Salmonellen verursachen Symptome wie Durchfall,"Salmonellen sind Bakterien, die am häufigsten lebensmittelbedingte Infektionen auslösen. Sie sind besonders für Schwangere und immun...Foto: picture alliance/Bildagentur-online/Schoening","https://images.bild.de/64ddf077ede7416279762375/ce5b3f847485c7c05f1404c0977243b0-landscape,b59998e8?w=1280",2023-08-17T10:21:12Z,,"Salmonellen sind Bakterien, die am häufigsten lebensmittelbedingte Infektionen auslösen. Sie sind besonders für Schwangere und immungeschwächte Personen sehr gefährlich. Salmonellen können Bauchkrämp… [+1397 chars]",,de,'Schwangere'
https://www.nzz.ch/international/queer-trans-bi-selbstbestimmungsgesetz-kommt-mit-kleinen-aenderungen-ld.1751954,https://www.nzz.ch/international/queer-trans-bi-selbstbestimmungsgesetz-kommt-mit-kleinen-aenderungen-ld.1751954,0,www.nzz.ch,"Betreiber entscheiden selbst, wen sie in ihre Sauna lassen: Verändertes Selbstbestimmungsgesetz soll am Mittwoch beschlossen werden","Ob biologische Männer in Frauensaunen dürfen, will die deutsche Regierung nicht festlegen. Einen Geschlechtswechsel von Kindern unter vierzehn Jahren können Eltern aber allein bestimmen.","https://img.nzz.ch/2022/08/08/22c336f8-4778-47e5-a163-4ad5664274dd.jpeg?width=1200&height=674&fit=bound&quality=75&auto=webp&crop=7282,4091,x323,y1017&wmark=nzz",2023-08-17T10:34:30Z,https://web.archive.org/web/20230818171900/https://www.nzz.ch/international/queer-trans-bi-selbstbestimmungsgesetz-kommt-mit-kleinen-aenderungen-ld.1751954,"Treibt das Selbstbestimmungsgesetz voran: Familienministerin Lisa Paus von den Grünen (links). 
Ein Saunabetreiber muss keine Transpersonen einlassen, wenn er nicht möchte. Die Vertragsfreiheit blei… [+4965 chars]",,de,'Kinder'
https://www.zeit.de/news/2023-08/17/bauvorhaben-schliesst-luecke-auf-kohle-dampf-licht-radroute,https://www.zeit.de/news/2023-08/17/bauvorhaben-schliesst-luecke-auf-kohle-dampf-licht-radroute,0,www.zeit.de,Energie: Bauvorhaben schließt Lücke auf «Kohle-Dampf-Licht-Radroute»,,,2023-08-17T13:01:27Z,https://web.archive.org/web/20230818110308/https://www.zeit.de/news/2023-08/17/bauvorhaben-schliesst-luecke-auf-kohle-dampf-licht-radroute,"When browsing with ads:
We collect personal data and also transmit it to third-party providers
 that help us improve and finance our digital content. Some of the information stored on your device, … [+821 chars]",,de,'Kohle'
https://www.zeit.de/news/2023-08/17/hochwasserschutz-talsperre-malter-nach-sanierung-wieder-fit,https://www.zeit.de/news/2023-08/17/hochwasserschutz-talsperre-malter-nach-sanierung-wieder-fit,0,www.zeit.de,Umwelt: Hochwasserschutz: Talsperre Malter nach Sanierung wieder fit,,,2023-08-17T14:08:27Z,https://web.archive.org/web/20230818111108/https://www.zeit.de/news/2023-08/17/hochwasserschutz-talsperre-malter-nach-sanierung-wieder-fit,"When browsing with ads:
We collect personal data and also transmit it to third-party providers
 that help us improve and finance our digital content. Some of the information stored on your device, … [+821 chars]",,de,'Sanierung'
https://www.jungewelt.de/artikel/457146.energieversorgung-ende-des-gastransits.html,https://www.jungewelt.de/artikel/457146.energieversorgung-ende-des-gastransits.html,0,www.jungewelt.de,Energieversorgung: Ende des Gastransits,"Mit dem Auslaufen des jetzigen Vertrags will Kiew ab 2025 kein russisches Gas mehr weiterleiten. Besonders betroffen sind Österreich, die Slowakei und Ungarn.",https://www.jungewelt.de/img/1100/184396.jpg,2023-08-17T17:36:53Z,https://web.archive.org/web/20230818151018/https://www.jungewelt.de/artikel/457146.energieversorgung-ende-des-gastransits.html,"Die Ukraine sieht gegenwärtig keine Möglichkeit, ab 2025 weiterhin russisches Erdgas an andere europäische Länder weiterzuleiten. Das geht aus einem Interview mit dem ukrainischen Energieminister Ger… [+3850 chars]",,de,'Gas'
https://www.n-tv.de/politik/Verbaende-fuerchten-Aufweichen-der-Sanierungspflicht-article24333913.html,https://www.n-tv.de/politik/Verbaende-fuerchten-Aufweichen-der-Sanierungspflicht-article24333913.html,0,www.n-tv.de,EU-Gesetz für effiziente Häuser: Verbände fürchten Aufweichen der Sanierungspflicht,"Bundesbauministerin Geywitz lehnt eine ""allgemeine Sanierungspflicht per Gesetz"" ab. Genau das plant die EU jedoch. Sie will Renovierungen erzwingen, um Gebäude ab 2030 energieeffizienter zu machen. Verbände fordern von der deutschen Regierung, an den Plänen …",https://bilder2.n-tv.de/img/incoming/crop24333925/5581322496-cImg_16_9-w1200/19635249.jpg,2023-08-17T19:56:15Z,https://web.archive.org/web/20230818121133/https://www.n-tv.de/politik/Verbaende-fuerchten-Aufweichen-der-Sanierungspflicht-article24333913.html,"Bundesbauministerin Geywitz lehnt eine ""allgemeine Sanierungspflicht per Gesetz"" ab. Genau das plant die EU jedoch. Sie will Renovierungen erzwingen, um Gebäude ab 2030 energieeffizienter zu machen. … [+2540 chars]",,de,'Sanierung'
https://www.morgenpost.de/kolumne/nachtgestalten/article239209017/anjas-weg-auf-die-strasse-und-in-den-tod-psycische-krankheit.html,https://www.morgenpost.de/kolumne/nachtgestalten/article239209017/anjas-weg-auf-die-strasse-und-in-den-tod-psycische-krankheit.html,0,www.morgenpost.de,Nachtgestalten: Anjas Weg auf die Straße und in den Tod,"Wenn Eltern psychisch erkrankt sind, trifft das Kinder besonders. Die Geschichte von Anja und warum sie mit nur 24 Jahren starb.",https://img.morgenpost.de/img/nachtgestalten/crop239209015/2352604992-w820-cv16_9-q85/033ecd90-3829-11ee-91ca-dc26ec0c69b4.jpg,2023-08-18T04:00:00Z,https://web.archive.org/web/20230824085735/https://www.morgenpost.de/kolumne/nachtgestalten/article239209017/anjas-weg-auf-die-strasse-und-in-den-tod-psycische-krankheit.html,"Sehnsucht nach einem Vater hatte sie immer. Ob im Kindergarten oder später in der Schule, die kleine Anja beneidete stets die anderen Jungen und Mädchen. Mütter hatten alle. Väter immerhin fast alle.… [+3619 chars]",,de,'Kinder'
https://www.nzz.ch/wissenschaft/atomkraft-klima-und-russland-braucht-die-welt-kernenergie-ld.1751535,https://www.nzz.ch/wissenschaft/atomkraft-klima-und-russland-braucht-die-welt-kernenergie-ld.1751535,0,www.nzz.ch,"NZZ FORMAT - Atomkraft, Klima und Russland – braucht die Welt Kernenergie?","Um den Klimawandel in Schach zu halten, muss schon in gut zehn Jahren die Stromproduktion weitgehend CO2-frei sein. «NZZ Format» fragt: Braucht es Kernkraft für das Gelingen der Energiewende? Und falls ja, von welchen Ländern sind wir bisher zu sehr abhängig?","https://img.nzz.ch/2023/08/14/dbf72f89-d28c-43e0-9090-e05eb4fb3301.jpeg?width=1200&height=674&fit=bound&quality=75&auto=webp&crop=3435,1930,x0,y359&wmark=nzz",2023-08-18T04:30:00Z,https://web.archive.org/web/20230818062837/https://www.nzz.ch/wissenschaft/atomkraft-klima-und-russland-braucht-die-welt-kernenergie-ld.1751535,"Streamen Sie die Dokumentation hier in voller Länge:
Darum geht es in der Doku
Kathryn Huff vom amerikanischen Energieministerium erzählt uns, dass die Welt die Klimaziele nur erreichen wird, wenn … [+1789 chars]",,de,'Atomkraft'
https://www.tagesspiegel.de/wissen/heute-vor-155-jahren-helium-im-strichcode-der-sonne-10322440.html,https://www.tagesspiegel.de/wissen/heute-vor-155-jahren-helium-im-strichcode-der-sonne-10322440.html,0,www.tagesspiegel.de,Heute vor 155 Jahren: Helium im Strichcode der Sonne,"Am 18. August entdeckte der Astronom Jules Janssen während einer Sonnenfinsternis das Element Helium. Heute könnte das Gas dazu beitragen, die Erde aus einem anderen Blickwinkel zu sehen.",https://www.tagesspiegel.de/images/bilder-des-jahres-2021-news-12-dezember-news-themen-der-woche-kw48-news-bilder-des-tages-chile-totale-sonnenfinsternis/alternates/BASE_16_9_W1400/bilder-des-jahres-2021-news-12-dezember-news-themen-der-woche-kw48-news-bilder-des-tages-chile-totale-sonnenfinsternis.jpeg,2023-08-18T07:41:06Z,https://web.archive.org/web/20230819030135/https://www.tagesspiegel.de/wissen/heute-vor-155-jahren-helium-im-strichcode-der-sonne-10322440.html,"Bei einer Sonnenfinsternis verdunkelt der Mond die Sonne, aber lässt die Korona, ihre äußere Hülle, sichtbar. So geschah es auch am 18. August 1868, heute vor 155 Jahren, in Indien für ein paar kostb… [+3010 chars]",,de,'Gas'
https://www.tagesschau.de/ausland/amerika/bradleycooper-bernstein-jewfacing-100.html,https://www.tagesschau.de/ausland/amerika/bradleycooper-bernstein-jewfacing-100.html,0,www.tagesschau.de,"""Jewfacing""-Vorwurf: Bernsteins Kinder verteidigen Bradley Cooper","Hollywood-Star Bradley Cooper wird für seine Darstellung des Komponisten Leonard Bernstein in ""Maestro"" kritisiert: Er bediene mit einer Nasenprothese jüdische Stereotype. Nun haben Bernsteins Kinder reagiert. Von Nils Dampz.",https://images.tagesschau.de/image/9a412b26-6ec2-4c6a-9afa-ae8f44125d92/AAABigf2XIs/AAABibBxqrQ/16x9-1280/bradleycooper-bernstein-jewfacing-104.jpg,2023-08-18T09:25:01Z,https://web.archive.org/web/20230819205506/https://www.tagesschau.de/ausland/amerika/bradleycooper-bernstein-jewfacing-100.html,"Stand: 18.08.2023 11:25 Uhr
Hollywood-Star Bradley Cooper wird für seine Darstellung des Komponisten Leonard Bernstein in ""Maestro"" kritisiert: Er bediene mit einer Nasenprothese jüdische Stereotype… [+2822 chars]",,de,'Kinder'
https://www.tagesspiegel.de/berlin/bezirke/ressourcen-schonen-in-berlin-lichtenberg-wie-eine-grunanlage-klimafreundlich-saniert-wird-10328455.html,https://www.tagesspiegel.de/berlin/bezirke/ressourcen-schonen-in-berlin-lichtenberg-wie-eine-grunanlage-klimafreundlich-saniert-wird-10328455.html,0,www.tagesspiegel.de,Ressourcen schonen in Berlin-Lichtenberg: Wie eine Grünanlage klimafreundlich saniert wird,"Bei der Sanierung einer Grünanlage gibt sich der Bezirk besonders achtsam: klimaresistente Bäume, Flächenentsiegelung - und sogar bei der Verwendung von Beton wird nachhaltig agiert.",https://www.tagesspiegel.de/images/2023-08-18-112710-61-kustriner-str-google-mapspng/alternates/BASE_16_9_W1400/2023-08-18-112710-61-kuestriner-str---google-mapspng.png,2023-08-18T09:35:06Z,https://web.archive.org/web/20230821160133/https://www.tagesspiegel.de/berlin/bezirke/ressourcen-schonen-in-berlin-lichtenberg-wie-eine-grunanlage-klimafreundlich-saniert-wird-10328455.html,Die Grünanlage in der Küstriner Straße 11-14 in Hohenschönhausen wird neu gestaltet. Im Frühjahr 2024 sollen die Arbeiten abgeschlossen sein. Das Bezirksamt spricht von einer Verbesserung der Aufenth… [+2912 chars],,de,'Sanierung'
https://www.tagesspiegel.de/potsdam/landeshauptstadt/potsdam-spart-an-spielplatzen-nur-jede-dritte-massnahme-wird-umgesetzt-10325215.html,https://www.tagesspiegel.de/potsdam/landeshauptstadt/potsdam-spart-an-spielplatzen-nur-jede-dritte-massnahme-wird-umgesetzt-10325215.html,0,www.tagesspiegel.de,Potsdam spart an Spielplätzen: Nur jede dritte Maßnahme wird umgesetzt,Potsdam wollte mit dem 2021 vorgelegten Spielplatzkonzept endlich den jahrelangen Sanierungsstau aufholen. Doch wegen des Sparhaushalts ist längst nicht genug Geld da.,https://www.tagesspiegel.de/images/spiel-und-gemeinschaftsplatz-in-klein-glienicke/alternates/BASE_16_9_W1400/spiel--und-gemeinschaftsplatz-in-klein-glienicke.jpeg,2023-08-18T11:19:38Z,https://web.archive.org/web/20230818115804/https://www.tagesspiegel.de/potsdam/landeshauptstadt/potsdam-spart-an-spielplatzen-nur-jede-dritte-massnahme-wird-umgesetzt-10325215.html,Potsdam geht auf Sparkurs bei der Sanierung und Neuplanung von Spielplätzen: In diesem und im kommenden Jahr werden nur rund ein Drittel der eigentlich nötigen Mittel für Spielflächen ausgegeben. Das… [+4047 chars],,de,'Sanierung'
https://www.zeit.de/zeit-magazin/familie/2023-08/eltern-partnerschaft-kinder-beziehung-paartherapie,https://www.zeit.de/zeit-magazin/familie/2023-08/eltern-partnerschaft-kinder-beziehung-paartherapie,0,www.zeit.de,"Partnerschaft: ""Elternpaare belastet vor allem die ständige Fremdbestimmung""","Wenn Kinder kommen, geraten Beziehungen leicht in die Krise. Muss das sein? Die Paartherapeutin Miriam Fritz rät zu kleinen Streicheleinheiten – und täglich zwei Fragen.",,2023-08-18T12:34:20Z,https://web.archive.org/web/20230818153814/https://www.zeit.de/zeit-magazin/familie/2023-08/eltern-partnerschaft-kinder-beziehung-paartherapie,"When browsing with ads:
We collect personal data and also transmit it to third-party providers
 that help us improve and finance our digital content. Some of the information stored on your device, … [+821 chars]",,de,'Kinder'
https://www.zeit.de/news/2023-08/18/sanitaeter-befreien-kinder-aus-verriegeltem-auto,https://www.zeit.de/news/2023-08/18/sanitaeter-befreien-kinder-aus-verriegeltem-auto,0,www.zeit.de,Rettungseinsatz: Sanitäter befreien Kinder aus verriegeltem Auto,,,2023-08-18T13:15:38Z,https://web.archive.org/web/20230819093626/https://www.zeit.de/news/2023-08/18/sanitaeter-befreien-kinder-aus-verriegeltem-auto,"When browsing with ads:
We collect personal data and also transmit it to third-party providers
 that help us improve and finance our digital content. Some of the information stored on your device, … [+821 chars]",,de,'Kinder'
https://www.diepresse.com/14426313/glaeubiger-von-gerry-weber-geben-gruenes-licht-fuer-sanierungsplan,https://www.diepresse.com/14426313/glaeubiger-von-gerry-weber-geben-gruenes-licht-fuer-sanierungsplan,0,www.diepresse.com,Gläubiger von Gerry Weber geben grünes Licht für Sanierungsplan,"Vorgesehen ist ein vollständiger Kapitalschnitt, die derzeitigen Aktionäre
der Gerry Weber International AG scheiden damit kompensationslos aus.",https://img.diepresse.com/public/incoming/4txho2-kein-Titel/alternates/DPR_SOCIAL_NACHRICHTEN/%28kein%20Titel%29,2023-08-18T13:36:31Z,https://web.archive.org/web/20230821155821/https://www.diepresse.com/14426313/glaeubiger-von-gerry-weber-geben-gruenes-licht-fuer-sanierungsplan,"Vorgesehen ist ein vollständiger Kapitalschnitt, die derzeitigen Aktionäreder Gerry Weber International AG scheiden damit kompensationslos aus.
Die Gläubiger des deutschen Modeherstellers Gerry Webe… [+2356 chars]",,de,'Sanierung'
https://orf.at/stories/3327960/,https://orf.at/stories/3327960/,0,orf.at,Gas und Wohnen weiter Preistreiber,"Im Juli ist die Inflation mit 7,0 Prozent auf den niedrigsten Wert seit März 2022 gesunken, wie die Statistik Austria am Freitag bekanntgab. Verantwortlich sei der nachlassende Preisdruck bei der Haushaltsenergie, so die Statistik Austria. Die Rasanz der Teue…",https://ibs.orf.at/news?image=https%3A%2F%2Fassets.orf.at%2Fmims%2F2023%2F33%2F65%2Fcrops%2Fw%3D1200%2Ch%3D630%2Cq%3D75%2F1906456_master_715165_inflation_statistik_austria_juli_coe.jpg%3Fs%3D4f4e643f4df3c13d539f798a0e17c4de268b5a2f,2023-08-18T13:51:45Z,,"Die Entspannung im Vergleich zu Juli 2022 zeigte sich insbesondere an den Zapfsäulen und für jene, die mit Heizöl heizen. Diesel und Superbenzin vergünstigten sich jeweils um fast ein Viertel, Heizöl… [+5445 chars]",,de,'Gas'
https://www.wiwo.de/unternehmen/handel/modehaendler-glaeubiger-billigen-sanierung-von-damenmode-konzern-gerry-weber/29340858.html,https://www.wiwo.de/unternehmen/handel/modehaendler-glaeubiger-billigen-sanierung-von-damenmode-konzern-gerry-weber/29340858.html,0,www.wiwo.de,Modehändler: Gläubiger billigen Sanierung von Damenmode-Konzern Gerry Weber,"Nach der Insolvenz will sich Gerry Weber sanieren. Von den 171 Filialen bleiben nur 49 geöffnet. Nun steht auch ein Plan, 150 Millionen Euro Schulden loszuwerden.",https://www.wiwo.de/images/gerry-weber/29340676/3-format11240.jpg,2023-08-18T14:37:45Z,https://web.archive.org/web/20230821155638/https://www.wiwo.de/unternehmen/handel/modehaendler-glaeubiger-billigen-sanierung-von-damenmode-konzern-gerry-weber/29340858.html,Für Nachrichtenseiten wie WirtschaftsWoche Online sind Anzeigen eine wichtige Einnahmequelle. Mit den Werbeerlösen können wir die Arbeit unserer Redaktion bezahlen und Qualitätsartikel kostenfrei ver… [+173 chars],,de,'Sanierung'
https://www.handelsblatt.com/unternehmen/handel-konsumgueter/modehaendler-glaeubiger-billigen-sanierung-von-damenmode-konzern-gerry-weber/29340578.html,https://www.handelsblatt.com/unternehmen/handel-konsumgueter/modehaendler-glaeubiger-billigen-sanierung-von-damenmode-konzern-gerry-weber/29340578.html,0,www.handelsblatt.com,Modehändler: Gläubiger billigen Sanierung von Damenmode-Konzern Gerry Weber,"Nach der Insolvenz will sich Gerry Weber sanieren. Von den 171 Filialen bleiben nur 49 geöffnet. Nun steht auch ein Plan, 150 Millionen Euro Schulden loszuwerden.",https://www.handelsblatt.com/images/gerry-weber/29340676/3-format2003.jpg,2023-08-18T14:37:45Z,,"Gerry Weber122 von 171 eigenen Läden in Deutschland sollen bis Ende September geschlossen werden.
(Foto: dpa)
München Der Weg für eine Entschuldung des angeschlagenen Damenmode-Konzerns Gerry Weber… [+978 chars]",,de,'Sanierung'
