index,url,valid,domain,title,description,image,published,archive,content,quote,language,keyword
https://noe.orf.at/stories/3340581/,https://noe.orf.at/stories/3340581/,0,noe.orf.at,Baumit übt Kritik an Förder-Aus für Sanierung,Der Baukonzern Baumit mit Sitz in Waldegg (Bezirk Wr. Neustadt) konnte 2025 den Umsatz des Vorjahres trotz der angespannten Lage für die Baubranche halten. Bei der Bilanz-Präsentation übte die Geschäftsführung Kritik an der Förderpolitik der Bundesregierung.,https://ibs.orf.at/noe?image=https%3A%2F%2Foekastatic.orf.at%2Fmims%2F2026%2F06%2F33%2Fcrops%2Fw%3D1200%2Ch%3D627%2Cq%3D75%2F2921454_master_1129333_baustellen_20100430_0070_sko.jpg%3Fs%3D303321c9e80e37bf76b7dc48439672101dd3438c,2026-02-04T11:07:25Z,,Mit einem Umsatz von 290 Millionen Euro habe man 2025 das Ergebnis des Vorjahres in etwa halten können trotz einiger Herausforderungen. Der Neubau blieb laut Baumit-Geschäfstführer Georg Bursik deutl… [+1378 chars],,de,'Sanierung'
https://www.tagesschau.de/ausland/amerika/leguane-fallen-von-baeumen-100.html,https://www.tagesschau.de/ausland/amerika/leguane-fallen-von-baeumen-100.html,0,www.tagesschau.de,In Florida fallen Leguane wegen Kälte massenhaft von Bäumen,"Eigentlich gilt Florida als Sonnenstaat der USA. Doch wie im Rest von Nordamerika ist es dort derzeit ungewöhnlich kalt - so kalt, dass massenhaft erstarrte Leguane von den Bäumen fallen.",https://images.tagesschau.de/image/d7b14bd8-656f-4e04-a278-31b778f3bbb9/AAABnCh-ib8/AAABmyZE0EA/16x9-big/leguan-florida-100.jpg?width=1280,2026-02-04T11:51:48Z,,"Stand: 04.02.2026 12:51 Uhr
Eigentlich gilt Florida als Sonnenstaat der USA. Doch wie im Rest von Nordamerika ist es dort derzeit ungewöhnlich kalt - so kalt, dass massenhaft erstarrte Leguane von d… [+2276 chars]",,de,'Kälte'
https://www.kino-zeit.de/film-kritiken-trailer/feuerwerk-am-helllichten-tage-2014,https://www.kino-zeit.de/film-kritiken-trailer/feuerwerk-am-helllichten-tage-2014,0,www.kino-zeit.de,Feuerwerk am helllichten Tage (2014),"Berlinale 2014

 

 
 




 
 Internationale Filmfestspiele Berlin

 
 Black Coal, Thin Ice von Diao Yinan

 
 



Ein Biest von einem Film
„Schwarze Kohle, dünnes Eis“&#8239;—&thinsp;so lautet die Übersetzung des internationalen Titels des chinesischen We…",https://www.kino-zeit.de/sites/default/files/styles/grosse_klickstrecke_940x530_/public/news/bild65593.jpg?itok=LqXdNKEm,2026-02-04T11:58:30Z,,"Schon der Beginn des Films ist eine wahre Freude: Die Kamera folgt einem in bunte Plastikfolie eingewickelten Gegenstand, der auf der Ladefläche eines LKW voller Steinkohle durch die Straßen einer St… [+2164 chars]",,de,'Kohle'
https://www.bild.de/news/inland/wuppertal-650-mio-sanierung-fuer-polizei-69835652d23aaa4b0d2d7eb8,https://www.bild.de/news/inland/wuppertal-650-mio-sanierung-fuer-polizei-69835652d23aaa4b0d2d7eb8,0,www.bild.de,In Wuppertal - 325-Mio.-Sanierung von Polizei-Bruchbude,"Kaputte Leitungen, Legionellen, defekte Aufzüge – die Bereitschaftspolizei arbeitet unter katastrophalen Bedingungen.","https://images.bild.de/69835652d23aaa4b0d2d7eb8/9a3fa7727ba2c7b098bd711e31e3a89c,b4f60ce9?w=1280",2026-02-04T14:53:11Z,,"TTS-Player überspringenArtikel weiterlesenWuppertal Undichte Rohre, geplatzte Abwasserleitungen, Schadstoffe und Legionellen: Die Zustände in einer Polizeiliegenschaft in Wuppertal (NRW) sind katastr… [+3608 chars]",,de,'Sanierung'
https://www.tagesspiegel.de/potsdam/landeshauptstadt/rekordinvestition-35-millionen-euro-fur-die-sanierung-von-potsdams-schlossern-15211577.html,https://www.tagesspiegel.de/potsdam/landeshauptstadt/rekordinvestition-35-millionen-euro-fur-die-sanierung-von-potsdams-schlossern-15211577.html,0,www.tagesspiegel.de,Rekordinvestition: 35 Millionen Euro für die Sanierung von Potsdams Schlössern,"2026 soll ein Rekordjahr bei der Sanierung historischer Gebäude der Schlösserstiftung werden. Ausgaben in Höhe von 35,5 Millionen Euro sind geplant. Hier wird gebaut.",https://www.tagesspiegel.de/images/15219664/alternates/BASE_16_9_W1400/1770217566000/stiftung-preu-ische-schlosser-und-garten.jpeg,2026-02-04T15:18:06Z,,"Nach mehreren Verzögerungen wird in diesem Jahr die Sanierung des Kleinen Schlosses Babelsberg abgeschlossen. Wir werden es außen und innen komplett fertigstellen, die Wohnungen vermieten und den Gas… [+237 chars]",,de,'Sanierung'
https://www.faz.net/aktuell/feuilleton/buecher/sachbuch/das-dritte-geschlecht-ist-keine-neue-erfindung-vielfalt-in-der-menschheitsgeschichte-110826224.html,https://www.faz.net/aktuell/feuilleton/buecher/sachbuch/das-dritte-geschlecht-ist-keine-neue-erfindung-vielfalt-in-der-menschheitsgeschichte-110826224.html,0,www.faz.net,Geschichte der Vielfalt: Das dritte Geschlecht ist keine moderne Erfindung,"Morgane Llanque will historischen Märchen den Boden entziehen. Mit Beispielen aus allen Epochen versucht sie zu zeigen: Europa war kein rein weißer Kulturraum, und gendernonkonforme Menschen gab es immer.",https://media0.faz.net/image/w1200h627/8416afebb7d2/w5568h2909x0y416o/202601/43601.0.1706959408/indigene-die-sich-einem.webp,2026-02-04T19:57:00Z,,"Die Venus vom Hohle Fels soll Frauenhassern das Wasser abgraben. Die über 35.000 Jahre alte Figurine mit großen Brüsten und betonter Vulva, die 2008 bei Ausgrabungen in der Schwäbischen Alb gefunden … [+5554 chars]",,de,'Geschlecht'
https://sz-magazin.sueddeutsche.de/leben-und-gesellschaft/ukraine-krieg-odesa-odessa-alltag-95862,https://sz-magazin.sueddeutsche.de/leben-und-gesellschaft/ukraine-krieg-odesa-odessa-alltag-95862,0,sz-magazin.sueddeutsche.de,"„Ich bin es leid zu hören, wie ›ungebrochen‹ und ›stark‹ wir seien. Wir sind müde“","Wie bestehen die Menschen in der Ukraine ihren Alltag trotz Kälte und Angst? Unsere Autorin hat ihre Freunde in Odesa kontaktiert – und erfahren, wie man ein Handy lädt, ein Kind bekommt, eine Party feiert, ein Theaterstück spielt und eine Glasscherben-Torte …",https://szm-media.sueddeutsche.de/image/szm/5c2c28e200376b26bec064fe33321228/t288l0w2560h1344/1280/image.jpeg,2026-02-05T05:00:00Z,,Nach meinem ärztlichen Dienst im Krankenhaus gehe ich nach Hause. Ende Dezember 2025. Die letzten Lichter des Dresdner Weihnachtsmarktes verlöschen. Meine Tochter schläft längst in ihrem Bett. Es ist… [+298 chars],,de,'Kälte'
https://www.autobild.de/artikel/elektroauto-reichweiten-test-28525637.html,https://www.autobild.de/artikel/elektroauto-reichweiten-test-28525637.html,0,www.autobild.de,Beim Wintertest fahren drei deutsche E-Autos in die Top-5,"Es ist der weltweit härteste Reichweitentest für Elektroautos: der El Prix aus Norwegen – in diesem Winter bei Temperaturen von bis zu minus 32 Grad Celsius. Lesen Sie hier, welche Modelle bei klirrender Kälte am weitesten kommen!",https://i.auto-bild.de/ir_img/4/0/3/8/8/9/9/Reichweiten-Test-Elektroauto-E-Auto-El-Prix-Norwegen-2026-Winter-2869-3310x1860-4b03783c278ba596.jpg?impolicy=og_images,2026-02-05T05:03:00Z,,Der weltweit härteste Praxistest für Elektroautos: der El Prix des norwegischen Automobilclubs NAF. Zweimal jährlich im Januar und im Juli testen die Norweger die Reichweiten neuer Elektromodelle. In… [+2440 chars],,de,'Kälte'
https://www.dw.com/de/k%C3%A4lte-als-kriegswaffe-so-schl%C3%A4gt-der-k%C3%B6rper-alarm/a-75795953,https://www.dw.com/de/k%C3%A4lte-als-kriegswaffe-so-schl%C3%A4gt-der-k%C3%B6rper-alarm/a-75795953,0,www.dw.com,Kälte als Kriegswaffe: So schlägt der Körper Alarm,"Im Angriffskrieg gegen die Ukraine nutzt Russland Kälte als Waffe, in Belarus werden Gefangene durch Kälte gefoltert. Welche schwerwiegenden Folgen Kälte für die Gesundheit hat - und wie wir uns schützen können. Auch im vierten Kriegswinter herrschen eisige T…",https://static.dw.com/image/56494610_6.jpg,2026-02-05T06:12:00Z,,Auch im vierten Kriegswinter herrschen eisige Temperaturen in der Ukraine. Doch Russlands Machthaber Wladimir Putin lässt gezielt die Energie-Infrastruktur des Landes angreifen. Millionen Menschen in… [+7345 chars],,de,'Kälte'
https://www.dw.com/de/ukraine-russland-kyjiw-k%C3%A4lte-heizung-strom-gas-trinkwasser-u-bahn-vitali-klitschko/a-75805730,https://www.dw.com/de/ukraine-russland-kyjiw-k%C3%A4lte-heizung-strom-gas-trinkwasser-u-bahn-vitali-klitschko/a-75805730,0,www.dw.com,Extreme Kälte und keine Heizung: Überlebenskampf in Kyjiw,"Nach russischen Angriffen auf Energieanlagen sind in Kyjiw mehr als 1000 Wohnblöcke seit Wochen ohne Heizung. Auch der Strom fällt oft aus. Was unternehmen die Bewohner der ukrainischen Hauptstadt, um nicht zu erfrieren? Nach dem flächendeckenden Stromausfall…",https://static.dw.com/image/75777936_6.jpg,2026-02-05T06:15:00Z,,Nach dem flächendeckenden Stromausfall am 31. Januar und einem weiteren russischen Luftangriff in der Nacht zum 3. Februar waren 1170 Wohnblöcke in der Hauptstadt der Ukraine ohne Heizung. Gleichzeit… [+6126 chars],,de,'Kälte'
https://www.focus.de/gesundheit/tod-durch-extreme-kaelte-der-perfide-plan-hinter-der-kriegswaffe_06aee4c0-d9bb-4763-8d68-7a2900951cb4.html,https://www.focus.de/gesundheit/tod-durch-extreme-kaelte-der-perfide-plan-hinter-der-kriegswaffe_06aee4c0-d9bb-4763-8d68-7a2900951cb4.html,0,www.focus.de,Tod durch extreme Kälte: Der perfide Plan hinter der Kriegswaffe,"Im Krieg gegen die Ukraine nutzt Russland Kälte als Waffe, in Belarus werden Gefangene so gefoltert. Welche schlimmen Folgen Kälte für die Gesundheit haben kann.",https://quadro.burda-forward.de/ctf/9705b90d-6e1c-4bd7-92ad-5179130ac6b9.2f15740f-80db-4e7c-a5be-36178a5199aa.png?im=RegionOfInterestCrop%3D%281200%2C630%29%2CregionOfInterest%3D%28731%2C246%29&hash=d317b68ae1efbe5b4792181c78839763da01c7a253fe95e800a6cea277ab6c57,2026-02-05T07:06:00Z,,Auch im vierten Kriegswinter herrschen eisige Temperaturen in der Ukraine. Doch Russlands Machthaber Wladimir Putin lässt gezielt die Energie-Infrastruktur des Landes angreifen. Millionen Menschen in… [+6945 chars],,de,'Kälte'
https://www.stern.de/gesellschaft/regional/berlin-brandenburg/schnee--eis--kaelte--zugausfaelle-und-verspaetungen-zwischen-hannover-und-berlin-37108606.html,https://www.stern.de/gesellschaft/regional/berlin-brandenburg/schnee--eis--kaelte--zugausfaelle-und-verspaetungen-zwischen-hannover-und-berlin-37108606.html,0,www.stern.de,"Schnee, Eis, Kälte: Zugausfälle und Verspätungen zwischen Hannover und Berlin","Der Winter mit Eisglätte und Schnee bringt die Bahn in Bedrängnis: Auf der Strecke zwischen Berlin und Hannover fallen Fernzüge aus, außerdem gibt es Verspätungen.",https://image.stern.de/37108608/t/s3/v1/w1440/r1.7778/-/05--ikqah2e7dav4axs2048jpeg---20b0e80aec484aa9.jpg,2026-02-05T07:23:42Z,,"Kopiere den aktuellen Link
Zur Merkliste hinzufügen
Der Winter mit Eisglätte und Schnee bringt die Bahn in Bedrängnis: Auf der Strecke zwischen Berlin und Hannover fallen Fernzüge aus, außerdem gib… [+683 chars]",,de,'Kälte'
https://www.zeit.de/news/2026-02/05/zugausfaelle-und-verspaetungen-zwischen-hannover-und-berlin,https://www.zeit.de/news/2026-02/05/zugausfaelle-und-verspaetungen-zwischen-hannover-und-berlin,0,www.zeit.de,"Schnee, Eis, Kälte: Zugausfälle und Verspätungen zwischen Hannover und Berlin","Hier finden Sie Informationen zu dem Thema „Schnee, Eis, Kälte“. Lesen Sie jetzt „Zugausfälle und Verspätungen zwischen Hannover und Berlin“.",https://img.zeit.de/news/2026-02/05/zugausfaelle-und-verspaetungen-zwischen-hannover-und-berlin-image-group/wide__1300x731,2026-02-05T07:23:42Z,,"Das Winterwetter sorgt zwischen Hannover und Berlin für Zugausfälle und Verspätungen im Fernverkehr der Deutschen Bahn. Das Ausmaß sei allerdings geringer als am Mittwoch, sagte eine Bahnsprecherin. … [+504 chars]",,de,'Kälte'
https://www.tagesspiegel.de/berlin/schnee-eis-kalte-zugausfalle-und-verspatungen-zwischen-hannover-und-berlin-15220826.html,https://www.tagesspiegel.de/berlin/schnee-eis-kalte-zugausfalle-und-verspatungen-zwischen-hannover-und-berlin-15220826.html,0,www.tagesspiegel.de,"Schnee, Eis, Kälte: Zugausfälle und Verspätungen zwischen Hannover und Berlin","Der Winter mit Eisglätte und Schnee bringt die Bahn in Bedrängnis: Auf der Strecke zwischen Berlin und Hannover fallen Fernzüge aus, außerdem gibt es Verspätungen.",https://www.tagesspiegel.de/images/15220825/alternates/BASE_16_9_W1400/1770276297000/wetter-in-deutschland-zugausfall-und-verspatungen.jpeg,2026-02-05T07:24:57Z,,"Das Winterwetter sorgt zwischen Hannover und Berlin für Zugausfälle und Verspätungen im Fernverkehr der Deutschen Bahn. Das Ausmaß sei allerdings geringer als am Mittwoch, sagte eine Bahnsprecherin. … [+558 chars]",,de,'Kälte'
https://www.focus.de/gesundheit/gefrorene-leguane-die-massenhaft-von-baeumen-fallen-koennten-fuer-menschen-zum-gesundheitlichem-problem-werden_38898d45-e071-4ccf-b9ca-bcb316169e05.html,https://www.focus.de/gesundheit/gefrorene-leguane-die-massenhaft-von-baeumen-fallen-koennten-fuer-menschen-zum-gesundheitlichem-problem-werden_38898d45-e071-4ccf-b9ca-bcb316169e05.html,0,www.focus.de,"Gefrorene Leguane, die massenhaft von Bäumen fallen, könnten für Menschen zum gesundheitlichem Problem werden",Grüne Leguane erstarren durch die Kälte in Florida und fallen von Bäumen. Die Behörden warnen: Eine staatliche Behörde warnt nun: Sie können Menschen für Menschen sogar lebensgefährlich werden.,https://quadro.burda-forward.de/ctf/9a413c1d-e49c-411d-b6fb-677c80b49293.e56ff9ee-f13b-4935-a0f8-e48347b86701.jpg?im=RegionOfInterestCrop%3D%281200%2C630%29%2CregionOfInterest%3D%281628%2C844%29&hash=5310445f8ac2451a7e9c29ed6e0bb0d885af50fad9f75d2e8448580b6f05c790,2026-02-05T08:03:00Z,,Im US-Bundesstaat Florida sind die Bewohner aktuell einer Kältewelle ausgesetzt. Das hat auch Auswirkungen auf die Tierwelt: Die Temperaturen haben fatale Folgen für die ansässigen Grünen Leguane. Di… [+2701 chars],,de,'Kälte'
https://www.bild.de/geld/wirtschaft/niedersachsen-eisige-kaelte-stoppt-schifffahrt-6984563011f814aba2551fd8,https://www.bild.de/geld/wirtschaft/niedersachsen-eisige-kaelte-stoppt-schifffahrt-6984563011f814aba2551fd8,0,www.bild.de,Minus-Grade in Niedersachsen - Frost legt Schifffahrt lahm,Mittellandkanal wird gesperrt. Eisbrecher kommen gegen Kälte nicht an. Mehrere Wasserstraßen bereits dicht.,"https://images.bild.de/6984563011f814aba2551fd8/7a71aeebd4e397cfe4ab4ea7eb500b24,bf93fb62?w=1280",2026-02-05T08:56:57Z,,"+++Es geht um Zuteilung eines anderen Fraktionssaals: AfD scheitert mit Klage in Karlsruhe
+++Es geht um Zuteilung eines anderen Fraktionssaals: AfD scheitert mit Klage in Karlsruhe
+++Es geht um Z… [+718 chars]",,de,'Kälte'
https://www.zeit.de/news/2026-02/05/tausende-strom-und-gassperren-in-berlin,https://www.zeit.de/news/2026-02/05/tausende-strom-und-gassperren-in-berlin,0,www.zeit.de,Energie: Tausende Strom- und Gassperren in Berlin,Hier finden Sie Informationen zu dem Thema „Energie“. Lesen Sie jetzt „Tausende Strom- und Gassperren in Berlin“.,https://img.zeit.de/news/2026-02/05/tausende-strom-und-gassperren-in-berlin-image-group/wide__1300x731,2026-02-05T11:33:08Z,,Wegen offener Rechnungen haben Versorger im vergangenen Jahr Tausenden Berliner Haushalten Strom oder Gas abstellen lassen. Das geht aus Antworten der Wirtschaftsverwaltung auf entsprechende parlamen… [+2161 chars],,de,'Gas'
https://www.faz.net/aktuell/feuilleton/medien-und-film/kino/film-ein-kuchen-fuer-den-praesidenten-im-kino-110830991.html,https://www.faz.net/aktuell/feuilleton/medien-und-film/kino/film-ein-kuchen-fuer-den-praesidenten-im-kino-110830991.html,0,www.faz.net,Film aus dem Irak: Der Herr mit dem Zucker führt das Mädchen in ein Sexkino,"Zwei Kinder und der Alltag in der Diktatur: Hasan Hadis Film „Ein Kuchen für den Präsidenten“ erzählt eine Geschichte aus dem Irak unter Saddam Hussein, die mehr als nur historische Bedeutung hat.",https://media0.faz.net/image/w1200h627/e7bf66fe3fbd/w2265h1183x399y45o/022026/1.10830985/saeed-sajad-mohamad-qasem-und.webp,2026-02-05T12:44:00Z,,"Ein einzelner Apfel musste im Irak in den Jahren nach 1990 oft für ein ganzes Mittagessen herhalten. Das Land stand unter Sanktionen durch die Vereinten Nationen, nachdem der Diktator Saddam Hussein … [+5886 chars]",,de,'Kinder'
https://www.zeit.de/news/2026-02/05/strom-und-gaspreise-fuer-neukunden-gesunken,https://www.zeit.de/news/2026-02/05/strom-und-gaspreise-fuer-neukunden-gesunken,0,www.zeit.de,Energiekosten: Strom- und Gaspreise für Neukunden gesunken,Hier finden Sie Informationen zu dem Thema „Energiekosten“. Lesen Sie jetzt „Strom- und Gaspreise für Neukunden gesunken“.,https://img.zeit.de/news/2026-02/05/strom-und-gaspreise-fuer-neukunden-gesunken-image-group/wide__1300x731,2026-02-05T13:28:58Z,,"Wer im Januar einen neuen Liefervertrag für Strom und Gas abgeschlossen hat, zahlt nach Berechnungen der Bundesnetzagentur weniger als im Dezember. Bei den Strompreisen waren dabei vor allem die gesu… [+1341 chars]",,de,'Gas'
https://www.n-tv.de/wirtschaft/Ende-einer-Aera-Braunkohle-Koloss-F60-in-Jaenschwalde-gesprengt-id30328780.html,https://www.n-tv.de/wirtschaft/Ende-einer-Aera-Braunkohle-Koloss-F60-in-Jaenschwalde-gesprengt-id30328780.html,0,www.n-tv.de,Woidke dankt Bergleuten: Ende einer Ära - Braunkohle-Koloss F60 in Jänschwalde gesprengt,Die Förderbrücke F60 gehört zu den größten Industriemaschinen der Welt. Zugleich ist sie ein Wahrzeichen im Lausitzer Kohlerevier. Nach mehr als 45 Jahren Dienst wird sie gesprengt. Auch für den Ministerpräsidenten ein bewegender Moment.,https://www.n-tv.de/img/30327842/1770301710/Img_16_9/1200/Die-gigantische-Foerderbruecke-im-ehemaligen-Tagebau-Jaenschwalde-ist-gesprengt-worden.jpg,2026-02-05T15:00:53Z,,Die Förderbrücke F60 gehört zu den größten Industriemaschinen der Welt. Zugleich ist sie ein Wahrzeichen im Lausitzer Kohlerevier. Nach mehr als 45 Jahren Dienst wird sie gesprengt. Auch für den Mini… [+2780 chars],,de,'Kohle'
https://www.faz.net/aktuell/rhein-main/frankfurt/frankfurt-ist-mit-der-sanierung-seiner-schulen-ueberfordert-200510172.html,https://www.faz.net/aktuell/rhein-main/frankfurt/frankfurt-ist-mit-der-sanierung-seiner-schulen-ueberfordert-200510172.html,0,www.faz.net,Vier Jahre renoviert: Wenn die Sanierung der Schule zu lange dauert,"Am Beispiel der Georg-Büchner-Schule zeigt sich, woran es beim Schulbau in Frankfurt hapert. Die Sanierung ist gelungen, aber der Zeitplan lief völlig aus dem Ruder.  Die Stadt mit dem Verfall ihrer Schulen überfordert.",https://media0.faz.net/image/w1200h627/89a4705f8196/w7494h3915x0y540o/202602/ac1dbe1b-b3d3-4d7e-ab9c-31b7bf271928/frisch-saniert-die-grundstufe.webp,2026-02-05T18:31:36Z,,In einer Fensternische auf dem Flur sitzen zwei Grundschüler und tauschen Pokémon-Karten. Wie gefällt ihnen ihre neue Schule? Gut. Was ist am besten? Die schönen Klassenzimmer. Aber nicht nur die fal… [+6196 chars],,de,'Sanierung'
https://www.zeit.de/news/2026-02/06/glatteis-unwetterwarnung-fuer-berlin-und-teile-brandenburgs,https://www.zeit.de/news/2026-02/06/glatteis-unwetterwarnung-fuer-berlin-und-teile-brandenburgs,0,www.zeit.de,Kälte: Glatteis: Unwetterwarnung für Berlin und Teile Brandenburgs,Hier finden Sie Informationen zu dem Thema „Kälte“. Lesen Sie jetzt „Glatteis: Unwetterwarnung für Berlin und Teile Brandenburgs“.,https://img.zeit.de/news/2026-02/06/glatteis-unwetterwarnung-fuer-berlin-und-teile-brandenburgs-image-group/wide__1300x731,2026-02-06T06:09:06Z,,Wegen Glatteises hat der Deutsche Wetterdienst (DWD) für Berlin und Teile Brandenburgs für den Morgen eine Unwetterwarnung herausgegeben. Es bestehe Gefahr für Leib und Leben durch plötzlich gefriere… [+438 chars],,de,'Kälte'
https://www.zeit.de/news/2026-02/06/zu-viel-gas-seniorin-faehrt-in-werkzeuggeschaeft,https://www.zeit.de/news/2026-02/06/zu-viel-gas-seniorin-faehrt-in-werkzeuggeschaeft,0,www.zeit.de,"Unfälle: ""Zu viel Gas"": Seniorin fährt in Werkzeuggeschäft","Hier finden Sie Informationen zu dem Thema „Unfälle“. Lesen Sie jetzt „""Zu viel Gas"": Seniorin fährt in Werkzeuggeschäft“.",https://img.zeit.de/news/2026-02/06/zu-viel-gas-seniorin-faehrt-in-werkzeuggeschaeft-image-group/wide__1300x731,2026-02-06T07:26:50Z,,"Beim Rückwärtsfahren ist eine 89-Jährige in Rosenheim mit ihrem Auto in ein Werkzeuggeschäft gekracht. Sie habe ersten Erkenntnissen zufolge «zu viel Gas» gegeben, hieß es von der Polizei. Dadurch be… [+293 chars]",,de,'Gas'
https://www.zeit.de/news/2026-02/06/dak-hunderttausende-kinder-als-passivraucher-in-autos,https://www.zeit.de/news/2026-02/06/dak-hunderttausende-kinder-als-passivraucher-in-autos,0,www.zeit.de,Kindergesundheit: DAK: Hunderttausende Kinder als Passivraucher in Autos,Hier finden Sie Informationen zu dem Thema „Kindergesundheit“. Lesen Sie jetzt „DAK: Hunderttausende Kinder als Passivraucher in Autos“.,https://img.zeit.de/news/2026-02/06/dak-hunderttausende-kinder-als-passivraucher-in-autos-image-group/wide__1300x731,2026-02-06T08:36:19Z,,"Mehr als 750.000 Kinder und Jugendliche werden nach Zahlen der Krankenkasse DAK in privaten Autos mit Zigarettenrauch belastet. 10,9 Prozent der Schulkinder sind oft oder sehr oft Tabakrauch im Auto … [+2310 chars]",,de,'Kinder'
https://www.zeit.de/gesundheit/2026-02/grippewelle-influenza-robert-koch-institut-gxe,https://www.zeit.de/gesundheit/2026-02/grippewelle-influenza-robert-koch-institut-gxe,0,www.zeit.de,Robert Koch-Instituts: Zahl der Grippefälle steigt weiter,"Rund 7,4 Millionen Menschen sind laut Robert Koch-Institut in der vergangenen Woche an akuten Atemwegserkrankungen erkrankt. Corona-Fälle sind dagegen deutlich niedriger.",https://img.zeit.de/wissen/2026-02/imago89129311-bild/wide__1300x731,2026-02-06T08:50:37Z,,"In der vergangenen Woche ist die Zahl der Menschen, die an Influenza erkrankt sind, stark gestiegen. Das Robert Koch-Institut geht von rund 8.800 Erkrankungen pro 100.000 Einwohner aus. Hochgerechnet… [+2219 chars]",,de,'Grippe'
https://www.stern.de/panorama/kindergesundheit--dak--hunderttausende-kinder-als-passivraucher-in-autos-37112680.html,https://www.stern.de/panorama/kindergesundheit--dak--hunderttausende-kinder-als-passivraucher-in-autos-37112680.html,0,www.stern.de,Kindergesundheit: DAK: Hunderttausende Kinder als Passivraucher in Autos,"Die Gesundheitsgefahren des Passivrauchens sind bekannt. Eine Befragung zeigt, dass mehr als 750.000 Kinder und Jugendliche Tabakrauch in Autos ausgesetzt sind. Wer daraus Konsequenzen fordert.",https://image.stern.de/37112682/t/K0/v1/w1440/r1.7778/-/06--dsvk7xzlgmv1axs2048jpeg---ae7c1fa4f7e5526c.jpg,2026-02-06T09:35:45Z,,"Kopiere den aktuellen Link
Zur Merkliste hinzufügen
Die Gesundheitsgefahren des Passivrauchens sind bekannt. Eine Befragung zeigt, dass mehr als 750.000 Kinder und Jugendliche Tabakrauch in Autos a… [+2285 chars]",,de,'Schwangere'
https://www.zeit.de/news/2026-02/06/grippewelle-im-norden-nimmt-weiter-an-fahrt-auf,https://www.zeit.de/news/2026-02/06/grippewelle-im-norden-nimmt-weiter-an-fahrt-auf,0,www.zeit.de,Erkältung: Grippewelle im Norden nimmt weiter an Fahrt auf,Hier finden Sie Informationen zu dem Thema „Erkältung“. Lesen Sie jetzt „Grippewelle im Norden nimmt weiter an Fahrt auf“.,https://img.zeit.de/news/2026-02/06/grippewelle-im-norden-nimmt-weiter-an-fahrt-auf-image-group/wide__1300x731,2026-02-06T11:40:08Z,,Die Grippesaison in Norddeutschland ist in vollem Gange die Zahl der registrierten Ansteckungen mit Influenza-Viren hat sich in der Woche ab dem 26. Januar weiter erhöht. Dies meldet das Robert Koch-… [+1739 chars],,de,'Grippe'
https://www.stern.de/gesellschaft/regional/hamburg-schleswig-holstein/erkaeltung--grippewelle-im-norden-nimmt-weiter-an-fahrt-auf-37113332.html,https://www.stern.de/gesellschaft/regional/hamburg-schleswig-holstein/erkaeltung--grippewelle-im-norden-nimmt-weiter-an-fahrt-auf-37113332.html,0,www.stern.de,Erkältung: Grippewelle im Norden nimmt weiter an Fahrt auf,Vor allem Influenza-Viren setzen derzeit viele Menschen in Norddeutschland außer Gefecht. In Mecklenburg-Vorpommern liegt die Zahl der Neuinfektionen auf einem Drei-Jahres-Höchststand.,https://image.stern.de/37113334/t/ew/v1/w1440/r1.7778/-/06--cgplnkpqwzv3axs2048jpeg---8504387288bbc2ad.jpg,2026-02-06T11:40:08Z,,"Kopiere den aktuellen Link
Zur Merkliste hinzufügen
Vor allem Influenza-Viren setzen derzeit viele Menschen in Norddeutschland außer Gefecht. In Mecklenburg-Vorpommern liegt die Zahl der Neuinfekti… [+1939 chars]",,de,'Grippe'
https://www.telepolis.de/article/Warum-das-Bildungsversprechen-bricht-und-was-das-fuer-unsere-Kinder-heisst-11168163.html,https://www.telepolis.de/article/Warum-das-Bildungsversprechen-bricht-und-was-das-fuer-unsere-Kinder-heisst-11168163.html,0,www.telepolis.de,Warum das Bildungsversprechen bricht – und was das für unsere Kinder heißt,"Generation Master, Generation Zweifel: Abschlüsse wachsen, Sicherheit nicht. Und am Horizont steht die KI.",https://heise.cloudimg.io/bound/1200x1200/q85.png-lossy-85.webp-lossy-85.foil1/_www-heise-de_/imgs/18/5/0/2/3/5/1/4/Master_Bildung_1-1864dae1590e3aec.jpg,2026-02-06T12:45:00Z,,"Bild: shutterstock.com
Generation Master, Generation Zweifel: Abschlüsse wachsen, Sicherheit nicht. Und am Horizont steht die KI.
Wer alles richtig macht, sollte nicht fallen. So lautete das unausg… [+5857 chars]",,de,'ältere Mensch'
