index,url,valid,domain,title,description,image,published,archive,content,quote,language,keyword
https://www.zeit.de/politik/ausland/2025-01/russisches-erdgas-ukraine-erdgastransit-europa,https://www.zeit.de/politik/ausland/2025-01/russisches-erdgas-ukraine-erdgastransit-europa,0,www.zeit.de,Russisches Erdgas: Ukraine stoppt Erdgastransit Richtung Europa,Der russische Konzern Gazprom kann sein Gas nicht länger durch die Ukraine pumpen. Das Land hat den Transitvertrag nicht verlängert.,https://img.zeit.de/wirtschaft/2025-01/ukraine-stoppt-erdgastransit-richtung-europa-gazprom-bild-2/wide__1300x731,2025-01-01T06:59:14Z,,"Die Ukraine hat die Durchleitung von russischem Gas in
Richtung Europa wie angekündigt eingestellt, um Russland von
weiteren Einkünften abzuschneiden. Der
Transitvertrag mit Gazprom wurde nicht ve… [+1207 chars]",,de,'Gas'
https://www.faz.net/aktuell/politik/ukraine/ukraine-liveticker-ukraine-stoppt-erdgastransit-richtung-europa-faz-110172806.html,https://www.faz.net/aktuell/politik/ukraine/ukraine-liveticker-ukraine-stoppt-erdgastransit-richtung-europa-faz-110172806.html,0,www.faz.net,Ukraine-Liveblog: Ukraine stoppt Erdgastransit Richtung Europa,Kiew: Erster Abschuss von russischem Hubschrauber mit Marinedrohne +++ Xi versichert Putin seiner Freundschaft +++ Kiew dreht EU-Staaten russisches Gas ab +++ alle Entwicklungen im Liveblog,https://media0.faz.net/ppmedia/aktuell/wirtschaft/1500371756/1.10204670/facebook_teaser/kein-druck-auf-dem-manometer.jpg,2025-01-01T07:25:57Z,,Knapp drei Jahre nach Beginn des russischen Angriffskriegs blockiert die Ukraine nun den Transit von russischem Erdgas durch das eigene Staatsgebiet in mehrere Nachbarstaaten der Vertrag dafür läuft … [+834 chars],,de,'Gas'
https://www.tagesschau.de/ausland/europa/ukraine-erdgas-russland-100.html,https://www.tagesschau.de/ausland/europa/ukraine-erdgas-russland-100.html,0,www.tagesschau.de,Russischer Erdgasexport über die Ukraine gestoppt,"Der Transitvertrag ist ausgelaufen - die Ukraine lässt wie angekündigt ab sofort kein russisches Gas mehr Richtung Westen durchleiten. Der ukrainische Energieminister sieht darin ein ""historisches Ereignis"".",https://images.tagesschau.de/image/c3da70b5-b406-4cea-bfdc-3c7e6c7b68f6/AAABlCDsvLI/AAABkZLhkrw/16x9-1280/ukraine-russland-184.jpg,2025-01-01T08:09:10Z,http://archive.md/20250101141404/http://www.tagesschau.de/ausland/europa/ukraine-erdgas-russland-100.html,"Stand: 01.01.2025 09:09 Uhr
Der Transitvertrag ist ausgelaufen - die Ukraine lässt wie angekündigt ab sofort kein russisches Gas mehr Richtung Westen durchleiten. Der ukrainische Energieminister sie… [+2432 chars]",,de,'Gas'
https://taz.de/-Nachrichten-im-Ukraine-Krieg-/!6059465/,https://taz.de/-Nachrichten-im-Ukraine-Krieg-/!6059465/,0,taz.de,+++ Nachrichten im Ukraine-Krieg +++: Ukraine stoppt Erdgastransit Richtung Europa,Die Durchleitung von russischem Gas durch die Ukraine in Richtung Europa ist seit dem Morgen eingestellt. Russische Drohnenangriffe treffen die Ukraine.,https://taz.de/picture/7439927/1200/37328864-1.jpeg,2025-01-01T08:54:00Z,https://web.archive.org/web/20250101090403/https://taz.de/-Nachrichten-im-Ukraine-Krieg-/!6059465/,Die Durchleitung von russischem Gas durch die Ukraine in Richtung Europa ist seit dem Morgen eingestellt. Russische Drohnenangriffe treffen die Ukraine. mehr...,,de,'Gas'
https://www.stern.de/politik/ausland/ukraine-stellt-russische-gaslieferungen-nach-europa-ein-35347498.html,https://www.stern.de/politik/ausland/ukraine-stellt-russische-gaslieferungen-nach-europa-ein-35347498.html,0,www.stern.de,Transitabkommen abgelaufen: Ukraine stellt russische Gaslieferungen nach Europa ein,"Damit sich Putins Kriegskassen leeren, stoppt die Ukraine den Transit von russischem Gas Richtung Europa. Die Slowakei ist verärgert – und droht mit Konsequenzen.",https://image.stern.de/35347548/t/Cc/v1/w1440/r1.7778/-/gastransit-russland-ukraine.jpg,2025-01-01T09:01:00Z,https://web.archive.org/web/20250101130922/https://www.stern.de/politik/ausland/ukraine-stellt-russische-gaslieferungen-nach-europa-ein-35347498.html,"Kopiere den aktuellen Link
Damit sich Putins Kriegskassen leeren, stoppt die Ukraine den Transit von russischem Gas Richtung Europa. Die Slowakei ist verärgert und droht mit Konsequenzen.
Seit dem … [+3150 chars]",,de,'Gasspeicher'
https://www.stern.de/kultur/-silvester-schlagerbooom---saengerin-nicole-fehlt-bei-silbereisen-show-35347682.html,https://www.stern.de/kultur/-silvester-schlagerbooom---saengerin-nicole-fehlt-bei-silbereisen-show-35347682.html,0,www.stern.de,"""Silvester-Schlagerbooom"": Sängerin Nicole fehlt bei Silbereisen-Show","Bei Florian Silbereisens ""Silvester-Schlagerbooom"" sollte Nicole auf der Bühne stehen. Aufgrund einer Grippe fiel die Sängerin aus.",https://image.stern.de/35347686/t/Ug/v1/w1440/r1.7778/-/01--saengerin-nicole-fehlt-bei-silbereisen-show---16-9---spoton-article-1083324.jpg,2025-01-01T10:15:00Z,,"Kopiere den aktuellen Link
Bei Florian Silbereisens ""Silvester-Schlagerbooom"" sollte Nicole auf der Bühne stehen. Aufgrund einer Grippe fiel die Sängerin aus.
Gemeinsam mit Künstlern aus der Schlag… [+2844 chars]",,de,'Grippe'
https://www.brigitte.de/aktuell/-silvester-schlagerbooom---saengerin-nicole-sagt-live-show-krankheitsbedingt-ab-13926780.html,https://www.brigitte.de/aktuell/-silvester-schlagerbooom---saengerin-nicole-sagt-live-show-krankheitsbedingt-ab-13926780.html,0,www.brigitte.de,"""Silvester-Schlagerbooom"": Sängerin Nicole sagt Live-Show krankheitsbedingt ab","Bei Florian Silbereisens ""Silvester-Schlagerbooom"" sollte Nicole auf der Bühne stehen. Aufgrund einer Grippe fiel die Sängerin aus.",https://image.brigitte.de/13926782/t/9e/v1/w1440/r1.7778/-/01--saengerin-nicole-sagt-live-show-krankheitsbedingt-ab---1-1---spoton-article-1083324.jpg,2025-01-01T10:16:00Z,,"Bei Florian Silbereisens ""Silvester-Schlagerbooom"" sollte Nicole auf der Bühne stehen. Aufgrund einer Grippe fiel die Sängerin aus.
Gemeinsam mit Künstlern aus der Schlagerwelt feierte Florian Silbe… [+2891 chars]",,de,'Grippe'
https://www.bild.de/regional/rheinland-pfalz/stromausfall-im-westerwald-40-000-haushalte-haben-keinen-strom-677509c45d60421cc75042cf,https://www.bild.de/regional/rheinland-pfalz/stromausfall-im-westerwald-40-000-haushalte-haben-keinen-strom-677509c45d60421cc75042cf,0,www.bild.de,Aktuell großflächiger Stromausfall - Blackout im Westerwald,Blackout im Westerwald! Seit 4.45 Uhr herrscht großflächiger Stromausfall.,"https://images.bild.de/677509c45d60421cc75042cf/ed6a24da357d71481bd31e3239cd10a1,c011837b?w=1280",2025-01-01T10:46:18Z,http://archive.md/20250101151956/https://www.bild.de/regional/rheinland-pfalz/stromausfall-im-westerwald-40-000-haushalte-haben-keinen-strom-677509c45d60421cc75042cf,"Westerburg (Rheinland-Pfalz) Blackout im Westerwald! Seit 4.45 Uhr herrscht großflächiger Stromausfall.
Im gesamten oberen Westerwald in Rheinland-Pfalz gebe es derzeit keinen Strom, so die Polizei.… [+1118 chars]",,de,'Blackout'
https://www.zeit.de/familie/2025-01/neujahrsvorsaetze-eltern-familie-kinder-tipps,https://www.zeit.de/familie/2025-01/neujahrsvorsaetze-eltern-familie-kinder-tipps,0,www.zeit.de,Neujahrsvorsätze für Eltern: Diese Vorsätze bringen Eltern 2025 wirklich nach vorne,"Es gibt Tausende Tipps, wie Eltern ihre Kinder gut groß bekommen. Doch nur wenige, wie Eltern diese Zeit auch überstehen. Hier also 25 Neujahrsvorsätze nur für Eltern.",https://img.zeit.de/familie/2024-12/neujahrsvorsaetze-eltern-familie-kinder/wide__1300x731,2025-01-01T13:47:05Z,http://archive.md/20250101141625/https://www.zeit.de/familie/2025-01/neujahrsvorsaetze-eltern-familie-kinder-tipps,"Me-Time-Blocker in den Familienkalender setzen Kaum etwas stresst Eltern mehr als die ständige Fremdbestimmung. Umso wichtiger: sich ab und zu Zeit für sich allein zu nehmen. Und wenn es nur ein, zwe… [+565 chars]",,de,'Kinder'
https://www.faz.net/aktuell/politik/ausland/russischer-lieferstopp-bricht-transnistrien-jetzt-zusammen-110205227.html,https://www.faz.net/aktuell/politik/ausland/russischer-lieferstopp-bricht-transnistrien-jetzt-zusammen-110205227.html,0,www.faz.net,Gas-Lieferstopp in Transnistrien: Bricht Transnistrien jetzt zusammen?,Russland kann kein Gas mehr durch die Ukraine liefern. Für die Republik Moldau könnte das die Chance zur Reintegration einer abtrünnigen Region bieten.,https://media1.faz.net/ppmedia/aktuell/politik/ausland/3874540054/1.10205233/facebook_teaser_fplus/die-prorussischen-machthaber.jpg,2025-01-01T17:52:50Z,http://archive.md/20250101180228/https://www.faz.net/aktuell/politik/ausland/russischer-lieferstopp-bricht-transnistrien-jetzt-zusammen-110205227.html,"Ist der Konflikt um die von der Republik Moldau abtrünnige Region Transnistrien bald Geschichte? Noch ist es nicht so weit, doch könnten sich die Koordinaten des Konflikts in den kommenden Wochen der… [+364 chars]",,de,'Gas'
https://taz.de/Deutschland-unabhaengiger-von-Russland/!6056585/,https://taz.de/Deutschland-unabhaengiger-von-Russland/!6056585/,0,taz.de,Deutschland unabhängiger von Russland: Gas-Transit über die Ukraine ist Geschichte,Russisches Gas kommt nun nicht mehr über das angegriffene Land nach Mitteleuropa. Österreich und die Slowakei waren die letzten Abnehmer.,https://taz.de/picture/7442193/1200/37291524-1.jpeg,2025-01-01T19:10:00Z,,Russisches Gas kommt nun nicht mehr über das angegriffene Land nach Mitteleuropa. Österreich und die Slowakei waren die letzten Abnehmer. mehr...,,de,'Gas'
https://www.zeit.de/news/2025-01/02/arzt-kinder-leiden-bis-heute-unter-corona-jahren,https://www.zeit.de/news/2025-01/02/arzt-kinder-leiden-bis-heute-unter-corona-jahren,0,www.zeit.de,Gesundheit: Arzt: Kinder leiden bis heute unter Corona-Jahren,Hier finden Sie Informationen zu dem Thema „Gesundheit“. Lesen Sie jetzt „Arzt: Kinder leiden bis heute unter Corona-Jahren“.,https://img.zeit.de/news/2025-01/02/arzt-kinder-leiden-bis-heute-unter-corona-jahren-image-group/wide__1300x731,2025-01-02T02:55:36Z,,"Fünf Jahre nach Beginn der Corona-Pandemie spüren die Kinderarztpraxen in Hessen noch immer die negativen Folgen der Corona-Jahre bei Heranwachsenden. «Das Thema treibt uns alle ziemlich um», sagte d… [+1292 chars]",,de,'Kinder'
https://www.stern.de/genuss/trinken/sodastream-reinigen--so-werden-die-flaschen-richtig-sauber-30807224.html,https://www.stern.de/genuss/trinken/sodastream-reinigen--so-werden-die-flaschen-richtig-sauber-30807224.html,0,www.stern.de,Tipps & Tricks: Sodastream reinigen: So werden die Flaschen wieder richtig sauber,"Millionen Haushalte nutzen einen Sodastream, um Leitungswasser mit Kohlensäure zu versetzen. Die Sache hat aber auch einen Haken: Die Flaschen lassen sich nur schwer reinigen.",https://image.stern.de/30807226/t/xD/v6/w1440/r1.7778/-/sodastream-reinigen.jpg,2025-01-02T07:03:00Z,https://web.archive.org/web/20250102145655/https://www.stern.de/genuss/trinken/sodastream-reinigen--so-werden-die-flaschen-richtig-sauber-30807224.html,"Kopiere den aktuellen Link
Millionen Haushalte nutzen einen Sodastream, um Leitungswasser mit Kohlensäure zu versetzen. Die Sache hat aber auch einen Haken: Die Flaschen lassen sich nur schwer reini… [+4981 chars]",,de,'Kohle'
https://www.n-tv.de/leute/Pamela-Reif-hat-es-ordentlich-erwischt-article25462713.html,https://www.n-tv.de/leute/Pamela-Reif-hat-es-ordentlich-erwischt-article25462713.html,0,www.n-tv.de,Krank ins neue Jahr: Pamela Reif hat es ordentlich erwischt,Eigentlich wollte Fitness-Influencerin Pamela Reif das neue Jahr mit einem zünftigen Cardio-Programm begrüßen. Nach Grippe und Lungenentzündung reicht die Luft aber vorerst nur für ihr neues Hobby: die Strukturmalerei.,https://bilder2.n-tv.de/img/incoming/crop25462721/9451324176-cImg_16_9-w1200/458780986.jpg,2025-01-02T09:13:35Z,,Eigentlich wollte Fitness-Influencerin Pamela Reif das neue Jahr mit einem zünftigen Cardio-Programm begrüßen. Nach Grippe und Lungenentzündung reicht die Luft aber vorerst nur für ihr neues Hobby: d… [+1876 chars],,de,'Grippe'
https://www.zeit.de/news/2025-01/02/schuss-auf-kinderzimmer-waehrend-silvesternacht-in-koeln,https://www.zeit.de/news/2025-01/02/schuss-auf-kinderzimmer-waehrend-silvesternacht-in-koeln,0,www.zeit.de,Zwei Kinder im Zimmer: Schuss auf Kinderzimmer während Silvesternacht in Köln,Hier finden Sie Informationen zu dem Thema „Zwei Kinder im Zimmer“. Lesen Sie jetzt „Schuss auf Kinderzimmer während Silvesternacht in Köln“.,https://img.zeit.de/news/2025-01/02/schuss-auf-kinderzimmer-waehrend-silvesternacht-in-koeln-image-group/wide__1300x731,2025-01-02T11:21:11Z,,"In der Silvesternacht ist im Kölner Stadtteil Holweide mindestens ein Schuss auf ein Kinderzimmer abgegeben worden. Darin waren zu dem Zeitpunkt zwei Kinder, wie die Polizei mitteilte. Der Schütze is… [+558 chars]",,de,'Kinder'
https://www.focus.de/earth/report/umweltschutz-und-bekaempfung-des-klimawandels-7-fortschritte-im-jahr-2024-die-hoffnung-machen_id_260586333.html,https://www.focus.de/earth/report/umweltschutz-und-bekaempfung-des-klimawandels-7-fortschritte-im-jahr-2024-die-hoffnung-machen_id_260586333.html,0,www.focus.de,"Kohle-Aus und Sonne-Boom - Sieben bahnbrechende Klima-Trends, die Hoffnung machen","Auch, wenn es angesichts der Ereignisse in diesem Jahr nicht so wirken mag: 2024 lieferte einige Durchbrüche fürs Klima, die Sie vielleicht verpasst haben.Von FOCUS-online-Redakteurin Stefanie Haas",https://p6.focus.de/img/fotos/id_260469794/ns18350291-ngsppamz-andre-dib-21092022-dji-0089-1-.jpg?im=Crop%3D%280%2C577%2C3465%2C1731%29%3BResize%3D%281200%2C627%29&impolicy=perceptual&quality=mediumHigh&hash=a1d0a563bae210518f64d6fd090299693a88b906efaa12862a309f27753dc69f,2025-01-02T12:46:16Z,,"Auch, wenn es angesichts der Ereignisse in diesem Jahr nicht so wirken mag: 2024 lieferte einige Durchbrüche fürs Klima, die Sie vielleicht verpasst haben.Hand aufs Herz: Es ist schwer geworden, den … [+8204 chars]",,de,'Kohle'
https://www.tagesschau.de/wirtschaft/erneuerbare-energien-strom-100.html,https://www.tagesschau.de/wirtschaft/erneuerbare-energien-strom-100.html,0,www.tagesschau.de,2024 so viel Strom aus Erneuerbaren wie noch nie,"Der Strom in Deutschland war 2024 offenbar so sauber wie noch nie: Mehr als 62 Prozent stammten laut Fraunhofer Institut aus Erneuerbaren. Zugleich gab es mehr Stromimporte, um das Minus beim Kohlestrom zu kompensieren.",https://images.tagesschau.de/image/62355e41-5211-4f0d-857c-22b91f60d0a4/AAABlCc7iY0/AAABkZLhkrw/16x9-1280/windrad-142.jpg,2025-01-02T13:53:13Z,http://archive.md/20250102182547/http://www.tagesschau.de/wirtschaft/erneuerbare-energien-strom-100.html,"Stand: 02.01.2025 14:53 Uhr
Der Strom in Deutschland war 2024 offenbar so sauber wie noch nie: Mehr als 62 Prozent stammten laut Fraunhofer Institut aus Erneuerbaren. Zugleich gab es mehr Stromimpor… [+2116 chars]",,de,'Kohle'
https://www.sueddeutsche.de/leben/suessigkeiten-ueberfluss-sternsinger-halloween-weihnachten-li.3167396,https://www.sueddeutsche.de/leben/suessigkeiten-ueberfluss-sternsinger-halloween-weihnachten-li.3167396,0,www.sueddeutsche.de,Rat vom Familientrio: Meine Kinder bekommen viel zu viele Süßigkeiten geschenkt,"Nie bekommen Kinder mehr Süßes geschenkt als in diesen Tagen. Zu Weihnachten sowieso, auch Sternsinger werden gut bedacht. Und von Halloween liegt noch alles voll. Das Familientrio weiß Rat.",https://www.sueddeutsche.de/2025/01/02/5b548d39-528a-40d1-a882-efcd56059fd6.jpeg?q=60&fm=webp&width=1200&rect=0%2C142%2C3000%2C1687,2025-01-02T14:53:52Z,,"2. Januar 2025, 15:53 UhrLesezeit: 3 Min.
Nie bekommen Kinder mehr Süßes geschenkt als in diesen Tagen. Zu Weihnachten sowieso, auch Sternsinger werden gut bedacht. Und von Halloween liegt noch alle… [+773 chars]",,de,'Kinder'
https://www.focus.de/panorama/24-jaehriger-sprengt-sich-in-nrw-mit-selbstgebasteltem-boeller-in-die-luft_id_260604040.html,https://www.focus.de/panorama/24-jaehriger-sprengt-sich-in-nrw-mit-selbstgebasteltem-boeller-in-die-luft_id_260604040.html,0,www.focus.de,Unglück in der Silvesternacht - 24-Jähriger sprengt sich in NRW mit selbstgebasteltem Böller in die Luft,Ein selbstgebastelter Sprengkörper wurde einem 24-Jährigen in NRW zum Verhängnis. Er detonierte wohl mit einem ohrenbetäubenden Knall und tötete den jungen Mann. Kinder mussten den grausamen Vorfall mit ansehen.Von FOCUS-online-Reporter Axel Spilcker,https://p6.focus.de/img/regional/niedersachsen/id_260603068/nach-angaben-des-niedersaechsischen-innenministeriums-gab-es-in-der-silvesternacht-1.527-einsatzlagen..jpg?im=Crop%3D%280%2C116%2C2048%2C1024%29%3BResize%3D%281200%2C627%29&impolicy=perceptual&quality=mediumHigh&hash=25c3b9eb66a64e51a1ad14f396f79a821acf3c017a6d0977109319d2224bb62e,2025-01-02T15:09:05Z,,Ein selbstgebastelter Sprengkörper wurde einem 24-Jährigen in NRW zum Verhängnis. Er detonierte wohl mit einem ohrenbetäubenden Knall und tötete den jungen Mann. Kinder mussten den grausamen Vorfall … [+5059 chars],,de,'Kinder'
https://www.bild.de/sport/fussball/werder-bremen-kinder-fuehren-geschaefte-fort-der-plan-mit-dem-burdenski-erbe-677675667dfaed65509893bf,https://www.bild.de/sport/fussball/werder-bremen-kinder-fuehren-geschaefte-fort-der-plan-mit-dem-burdenski-erbe-677675667dfaed65509893bf,0,www.bild.de,Kinder führen Geschäfte fort - Der Plan mit dem Burdenski-Erbe,"Fabian und Carina Burdenski übernehmen die Leitung von „Burdenski Events & Communications“, um die Visionen ihres verstorbenen Vaters zu verwirklichen.","https://images.bild.de/677675667dfaed65509893bf/5e27333b2079ab6d8ffd2b753bd7bd37,e2f2ca83?w=1280",2025-01-02T15:24:07Z,,"Am Tag nach Papas Tod waren wir sofort im Büro. Alle standen noch unter Schock. Es war emotional ein schwerer Schlag, aber wir haben die Ärmel sofort hochgekrempelt.
Das sagt Fabian Burdenski (33). … [+1989 chars]",,de,'Kinder'
https://www.focus.de/earth/analyse/ueberraschende-daten-deutschlands-strombilanz-fuer-2024-und-ploetzlich-sind-wir-import-meister_id_260603799.html,https://www.focus.de/earth/analyse/ueberraschende-daten-deutschlands-strombilanz-fuer-2024-und-ploetzlich-sind-wir-import-meister_id_260603799.html,0,www.focus.de,Überraschende Daten - Deutschlands Strombilanz für 2024: Und plötzlich sind wir Import-Meister,"Das Ende der Kohle-Ära: Deutschlands Strom ist so sauber wie nie - gleichzeitig erreichen die Strom-Importe aus dem Ausland neue Höchststände. Doch dass muss gar nichts Schlimmes sein, wie neue Daten zeigen. Was die Strombilanz für 2024 sonst noch verrät.Von …",https://p6.focus.de/img/regional/baden-wuerttemberg/id_260601919/solarenergie-boomt-im-land.-die-windkraft-stockt..jpg?im=Crop%3D%280%2C170%2C2048%2C1024%29%3BResize%3D%281200%2C627%29&impolicy=perceptual&quality=mediumHigh&hash=a47c0e924c459e707461af70c7455b7682f5d962fbad0d9fd9bb22dfec12ba0a,2025-01-02T15:27:07Z,,"<ul><li>
Kommentare</li><li>
E-Mail</li><li>
Teilen</li><li>
Mehr</li><li>
Twitter</li><li>
Drucken</li><li>
Feedback</li><li>
Fehler meldenSie haben einen Fehler gefunden?
Bitte markieren S… [+12715 chars]",,de,'Kohle'
https://www.welt.de/gesundheit/article255015590/Corona-Folgen-Eine-Normalisierung-laesst-sich-bis-heute-nicht-feststellen.html,https://www.welt.de/gesundheit/article255015590/Corona-Folgen-Eine-Normalisierung-laesst-sich-bis-heute-nicht-feststellen.html,0,www.welt.de,„Eine Normalisierung lässt sich bis heute nicht feststellen“,"Unter den Folgen der Corona-Politik leiden vor allem Kinder, die in der Pandemie zwischen zehn und 14 Jahre alt waren. Wo Ärzte und Lehrer die größten Defizite sehen – und welche Maßnahmen helfen könnten.",https://img.welt.de/img/gesundheit/mobile255018228/1207935807-ci16x9-w1200/Schulkinder.jpg,2025-01-02T15:37:13Z,https://web.archive.org/web/20250102172854/https://www.welt.de/gesundheit/article255015590/Corona-Folgen-Eine-Normalisierung-laesst-sich-bis-heute-nicht-feststellen.html,"Unter den Folgen der Corona-Politik leiden vor allem Kinder, die in der Pandemie zwischen zehn und 14 Jahre alt waren. Wo Ärzte und Lehrer die größten Defizite sehen und welche Maßnahmen helfen könnt… [+5022 chars]",,de,'Kinder'
https://www.tagesschau.de/ausland/europa/slowakei-fico-ukraine-102.html,https://www.tagesschau.de/ausland/europa/slowakei-fico-ukraine-102.html,0,www.tagesschau.de,Regierungschef der Slowakei droht Kiew im Gasstreit mit Maßnahmen,"Die Slowakei sieht sich besonders betroffen von der Entscheidung der Ukraine, kein russisches Gas mehr weiterzuleiten. Sein Land verliere Geld, sagt Regierungschef Fico und droht etwa, die Hilfe für ukrainische Flüchtlinge einzuschränken.",https://images.tagesschau.de/image/2184afd0-8ad8-4db4-a996-98c031ab9908/AAABlCla6Sc/AAABkZLhkrw/16x9-1280/robert-fico-120.jpg,2025-01-02T23:30:11Z,,"Stand: 03.01.2025 00:30 Uhr
Die Slowakei sieht sich besonders betroffen von der Entscheidung der Ukraine, kein russisches Gas mehr weiterzuleiten. Sein Land verliere Geld, sagt Regierungschef Fico u… [+2005 chars]",,de,'Gas'
https://tirol.orf.at/stories/3287438/,https://tirol.orf.at/stories/3287438/,0,tirol.orf.at,Kinderklinik klärt zu Antibiotika auf,"Die Innsbrucker Kinderklinik setzt auf mehr Information zum Thema Antibiotika. Diese Medikamente können einerseits effizient helfen, aber auch Schaden anrichten und zur Bildung von Bakterien beitragen, die gegen Antibiotika widerstandsfähig sind.",https://ibs.orf.at/tir?image=https%3A%2F%2Foekastatic.orf.at%2Fmims%2F2025%2F01%2F24%2Fcrops%2Fw%3D1200%2Ch%3D627%2Cq%3D75%2F2472762_master_946324_download_3.jpg%3Fs%3Dc7b08697ad637d92111abbfcb12e97fb6bf2efd3,2025-01-03T05:36:43Z,,"Magenprobleme oder Allergien sind zwei mögliche Nebenwirkungen von Antibiotika. Dazu kommt die Gefahr, dass sich Bakterienstämme entwickeln, die gegen Antibiotika resistent sind. Deshalb sollen diese… [+1150 chars]",,de,'Grippe'
https://www.stern.de/digital/technik/smarte-thermostate--mit-diesen-modellen-reduzieren-sie-ihre-heizkosten-31545582.html,https://www.stern.de/digital/technik/smarte-thermostate--mit-diesen-modellen-reduzieren-sie-ihre-heizkosten-31545582.html,0,www.stern.de,Energiekosten senken: Jetzt Heizkosten sparen: Sechs Smart-Thermostate im Vergleich,"Smart-Thermostate versprechen, Heizkosten zu senken. Wie das funktioniert und welches Thermostat für Sie das richtige ist, verrät der Vergleich.",https://image.stern.de/31545584/t/-Q/v4/w1440/r1.7778/-/smart-thermostat.jpg,2025-01-03T08:49:00Z,https://web.archive.org/web/20250104232425/https://www.stern.de/digital/technik/smarte-thermostate--mit-diesen-modellen-reduzieren-sie-ihre-heizkosten-31545582.html,"Kopiere den aktuellen Link
Smart-Thermostate versprechen, Heizkosten zu senken. Wie das funktioniert und welches Thermostat für Sie das richtige ist, verrät der Vergleich.
Wenn in den letzten Jahre… [+14861 chars]",,de,'Heizkosten'
https://help.orf.at/stories/3228306/,https://help.orf.at/stories/3228306/,0,help.orf.at,Viele Anfragen zu Gewährleistung und Heizkosten,Wegen Problemen mit Unternehmen – vor allem im Handel und wegen hoher Heizkostenabrechnungen – haben sich 2024 mehr als 2.000 Konsumentinnen und Konsumenten an die Verbraucherschlichtung Austria gewandt.,https://ibs.orf.at/help?image=https%3A%2F%2Ftubestatic.orf.at%2Fmojo%2F1_4_1%2Fstoryserver%2Ftube%2Fhelp%2Fimages%2Fog-fallback.jpg%3Fs%3D08ad3821b847d4b6b089500656e692c351aad510,2025-01-03T09:30:00Z,,"Das sind deutlich mehr als im Jahr davor, als es mehr als 1.800 Fälle gab. In mehr als 1.000 Fällen wurde im Vorjahr eine einvernehmliche Lösung gefunden, so die Schlichter. Die Schlichtungsstelle bi… [+730 chars]",,de,'Heizkosten'
https://taz.de/Folgen-des-Gas-Transit-Stopps/!6060394/,https://taz.de/Folgen-des-Gas-Transit-Stopps/!6060394/,0,taz.de,Folgen des Gas-Transit-Stopps: Slowakei droht mit Maßnahmen gegen ukrainische Flüchtlinge,"Dass die Ukraine kein russisches Gas mehr durchleitet, erzürnt den slowakischen Regierungschef. Er droht mit verschlechterten Bedingungen für Geflüchtete und mit Stromabschaltungen.",https://taz.de/picture/7444765/1200/37286945-1.jpeg,2025-01-03T10:10:00Z,,"Dass die Ukraine kein russisches Gas mehr durchleitet, erzürnt den slowakischen Regierungschef. Er droht mit verschlechterten Bedingungen für Geflüchtete und mit Stromabschaltungen. mehr...",,de,'Gas'
https://www.welt.de/vermischtes/article255020908/Frauensauna-Primaeres-Geschlechtsmerkmal-ausschlaggebend-Deutscher-Sauna-Bund-empfiehlt-Sichtkontrollen.html,https://www.welt.de/vermischtes/article255020908/Frauensauna-Primaeres-Geschlechtsmerkmal-ausschlaggebend-Deutscher-Sauna-Bund-empfiehlt-Sichtkontrollen.html,0,www.welt.de,„Primäres Geschlechtsmerkmal entscheidend“ – Sauna-Bund empfiehlt Sichtkontrollen in Frauensaunen,Wer darf Eintritt in geschlechtsspezifische Bereiche wie Frauensaunas erhalten? Seit dem Inkrafttreten des Selbstbestimmungsgesetzes herrscht in dieser Frage Unsicherheit. Der Deutsche Sauna-Bund hat nun klare Empfehlungen ausgesprochen.,https://img.welt.de/img/vermischtes/mobile255023690/9267932977-ci16x9-w1200/Mature-woman-in-sauna-low-section.jpg,2025-01-03T10:44:02Z,http://archive.md/20250103123342/https://www.welt.de/vermischtes/article255020908/Frauensauna-Primaeres-Geschlechtsmerkmal-ausschlaggebend-Deutscher-Sauna-Bund-empfiehlt-Sichtkontrollen.html,Wer darf Eintritt in geschlechtsspezifische Bereiche wie Frauensaunas erhalten? Seit dem Inkrafttreten des Selbstbestimmungsgesetzes herrscht in dieser Frage Unsicherheit. Der Deutsche Sauna-Bund hat… [+2004 chars],,de,'Geschlecht'
