index,url,valid,domain,title,description,image,published,archive,content,quote,language,keyword
https://www.handelsblatt.com/unternehmen/energie/gaskonzern-uniper-nimmt-abschied-von-erdgas-und-kohle/29288792.html,https://www.handelsblatt.com/unternehmen/energie/gaskonzern-uniper-nimmt-abschied-von-erdgas-und-kohle/29288792.html,0,www.handelsblatt.com,Gaskonzern: Uniper will acht Milliarden Euro in grüne Transformation investieren,Der durch den Staat gerettete Gashändler legt eine neue Strategie vor. So will Uniper bis 2029 komplett aus der Kohleverstromung aussteigen.,https://www.handelsblatt.com/images/uniper-zentrale-in-duesseldorf/29289018/2-format2003.jpg,2023-08-01T06:21:30Z,,"Düsseldorf Der krisengeschüttelte Konzern Uniper hat eine neue Strategie zur Zukunft des Unternehmens. Bis 2030 will der Konzern acht Milliarden Euro investieren, um die eigenen Geschäftsbereiche nac… [+5050 chars]",,de,'Gas'
https://www.welt.de/wirtschaft/article246672194/Militaerputsch-im-Niger-Die-heikle-Uran-Abhaengigkeit-der-EU.html,https://www.welt.de/wirtschaft/article246672194/Militaerputsch-im-Niger-Die-heikle-Uran-Abhaengigkeit-der-EU.html,0,www.welt.de,Freiheit durch Atomkraft? Fall Niger zeigt die heikle Uran-Abhängigkeit der EU,"Wegen seines Urans ist kein Land auf der Welt für die Versorgung der europäischen Kernkraftwerke wichtiger als der Niger. Doch nun sorgt der militärische Putsch für Unruhen. Sollte die Produktion längere Zeit zum Erliegen kommen, steht die EU vor einer prekär…",https://img.welt.de/img/wirtschaft/mobile246674018/8261359787-ci16x9-w1200/Satellite-Image-of-Arlit-Uranium-Mine-Arlit-Niger.jpg,2023-08-01T08:37:49Z,https://web.archive.org/web/20230801090622/https://www.welt.de/wirtschaft/article246672194/Militaerputsch-im-Niger-Die-heikle-Uran-Abhaengigkeit-der-EU.html,"Vor wenigen Wochen noch schien alles gut. Wenigstens so gut, wie es das Unternehmen im Niger erwarten konnte in einem Land, das mal mehr, mal weniger stabil ist. Es gibt immer wieder Proteste und Dro… [+4235 chars]",,de,'Atomkraft'
https://www.n-tv.de/wirtschaft/Uniper-kehrt-Kohle-und-Erdgas-den-Ruecken-article24297758.html,https://www.n-tv.de/wirtschaft/Uniper-kehrt-Kohle-und-Erdgas-den-Ruecken-article24297758.html,0,www.n-tv.de,Klimaneutral bis 2040: Uniper kehrt Kohle und Erdgas den Rücken,Bislang basiert das Geschäftsmodell von Uniper vorrangig auf Erdgas. Doch damit soll schon bald Schluss sein. Nach der Rückkehr in die schwarzen Zahlen will der krisengeschüttelte Konzern acht Milliarden Euro in klimafreundlichere Technik investieren.,https://bilder1.n-tv.de/img/incoming/crop24285364/7341328127-cImg_16_9-w1200/fd4760619a012d02dcd06b4c50222d72.jpg,2023-08-01T08:51:39Z,,Bislang basiert das Geschäftsmodell von Uniper vorrangig auf Erdgas. Doch damit soll schon bald Schluss sein. Nach der Rückkehr in die schwarzen Zahlen will der krisengeschüttelte Konzern acht Millia… [+2057 chars],,de,'Gasspeicher'
https://www.wiwo.de/unternehmen/industrie/covestro-chef-die-frage-ist-doch-wofuer-das-geld-ausgegeben-wird-/29290750.html,https://www.wiwo.de/unternehmen/industrie/covestro-chef-die-frage-ist-doch-wofuer-das-geld-ausgegeben-wird-/29290750.html,0,www.wiwo.de,"Covestro-Chef: „Die Frage ist doch, wofür das Geld ausgegeben wird“","Covestro-CEO Markus Steilemann drängt die Ampelkoalition zu mehr Unterstützung. Er erklärt, warum er trotz allem noch Hoffnung für die deutsche Chemieindustrie hat – und warnt vor einer neuen Abhängigkeit bei Öl und Gas.",https://www.wiwo.de/images/covestro-corrosion-protection/29290930/2-format11240.jpg,2023-08-01T13:56:37Z,https://web.archive.org/web/20230801145205/https://www.wiwo.de/unternehmen/industrie/covestro-chef-die-frage-ist-doch-wofuer-das-geld-ausgegeben-wird-/29290750.html,"WirtschaftsWoche: Herr Steilemann, die deutsche Wirtschaft lahmt, die Chemieindustrie in Deutschland geht den Bach runter. Sie haben die Risiken selbst beschrieben: hohe Energiekosten und Steuern, sc… [+6500 chars]",,de,'Gas'
https://www.bild.de/ratgeber/gesundheit/gesundheit/grippe-erkennen-und-behandeln-symptome-und-ursachen-im-ueberblick-84822934.bild.html,https://www.bild.de/ratgeber/gesundheit/gesundheit/grippe-erkennen-und-behandeln-symptome-und-ursachen-im-ueberblick-84822934.bild.html,0,www.bild.de,"Symptome, Ursachen, Behandlung - Grippe: Alles, was Sie wissen müssen","Die Symptome einer Grippe ähneln oft der einer Erkältung. Wie man sie erkennt und am besten behandelt, lesen Sie hier.","https://images.bild.de/64c0db6c3d0fd24c12015eb9/f6b39163c6c0ae21bc61888c7beb4cbb,3099b369?w=1280",2023-08-02T07:51:44Z,,"Fieber, Appetitlosigkeit und Schüttelfrost können Anzeichen einer Erkältung sein. Oder einer Grippe!
Der spürbare Unterschied zwischen beiden 
Krankheiten liegt in der Schwere und Dauer der Symptom… [+8665 chars]",,de,'ältere Mensch'
https://www.zeit.de/gesellschaft/zeitgeschehen/2023-08/wohnungslosigkeit-statistisches-bundesamt-obdachlosigkeit,https://www.zeit.de/gesellschaft/zeitgeschehen/2023-08/wohnungslosigkeit-statistisches-bundesamt-obdachlosigkeit,0,www.zeit.de,Obdachlosigkeit in Deutschland: Deutlich mehr Wohnungslose in Unterkünften untergebracht,"Das Statistische Bundesamt hat einen deutlichen Zuwachs an wohnungslosen Menschen registriert, die in Hilfseinrichtungen untergebracht sind. Dafür gibt es mehrere Gründe.",,2023-08-02T14:25:22Z,https://web.archive.org/web/20230802151705/https://www.zeit.de/gesellschaft/zeitgeschehen/2023-08/wohnungslosigkeit-statistisches-bundesamt-obdachlosigkeit,"When browsing with ads:
We collect personal data and also transmit it to third-party providers
 that help us improve and finance our digital content. Some of the information stored on your device, … [+821 chars]",,de,'Obdachlosigkeit'
https://www.zeit.de/news/2023-08/02/deo-gas-als-wasserstoffspeicher-kreislaufsystem-entwicklung,https://www.zeit.de/news/2023-08/02/deo-gas-als-wasserstoffspeicher-kreislaufsystem-entwicklung,0,www.zeit.de,Energie: Deo-Gas als Wasserstoffspeicher: Kreislaufsystem Entwicklung,,,2023-08-02T14:52:38Z,https://web.archive.org/web/20230806155307/https://www.zeit.de/news/2023-08/02/deo-gas-als-wasserstoffspeicher-kreislaufsystem-entwicklung,"When browsing with ads:
We collect personal data and also transmit it to third-party providers
 that help us improve and finance our digital content. Some of the information stored on your device, … [+821 chars]",,de,'Gas'
https://www.morgenpost.de/ratgeber/article239087345/australien-grippewelle-grippe-kinder-europa-warnung.html,https://www.morgenpost.de/ratgeber/article239087345/australien-grippewelle-grippe-kinder-europa-warnung.html,0,www.morgenpost.de,Krankheitswelle: Grippewelle in Australien trifft Kinder: Warnung für Europa?,In diesem Winter schlägt die Grippe in Australien voll zu. Kinder sind besonders hart betroffen. Was die Europäer jetzt lernen können.,https://img.morgenpost.de/img/ratgeber/crop239087343/2602606886-w820-cv16_9-q85/0114f976-3113-11ee-a953-c0a8ad1719fa.jpg,2023-08-02T15:26:52Z,,"Sydney. Selbst nach der Pandemie hatte Australien es mit geschickten Maßnahmen geschafft, extreme Grippewellen zu vermeiden. Doch in diesem Winter schlägt die Grippe auf der Südhalbkugel voll zu. Bes… [+5146 chars]",,de,'Kinder'
https://www.faz.net/aktuell/wirtschaft/geplatzte-atomkraft-mission-von-einem-der-auszog-einen-reaktor-zu-bauen-19065710.html,https://www.faz.net/aktuell/wirtschaft/geplatzte-atomkraft-mission-von-einem-der-auszog-einen-reaktor-zu-bauen-19065710.html,0,www.faz.net,"Geplatzte Atomkraft-Mission: Von einem der auszog, einen Reaktor zu bauen",Joachim Specht wollte in Finnland ein neues Atomkraftwerk bauen. Mit russischer Technik. Das konnte nicht gut gehen. Wie die großen Pläne des Deutschen zu Schiedsgerichtsverfahren im Norden verkamen.,https://media0.faz.net/ppmedia/aktuell/3967681263/1.9065840/facebook_teaser_fplus/so-sah-die-reaktorbaustelle.jpg,2023-08-02T15:57:21Z,https://web.archive.org/web/20230802162356/https://www.faz.net/aktuell/wirtschaft/geplatzte-atomkraft-mission-von-einem-der-auszog-einen-reaktor-zu-bauen-19065710.html,"Klar, Joachim Specht hatte sich das alles anders vorgestellt. Vor drei Jahren zog er nach Finnland, um ein neues Atomkraftwerk zu bauen. Deutschland hatte für die Dienste des zuvor bei Siemens, Frama… [+656 chars]",,de,'Atomkraft'
https://www.globenewswire.com/news-release/2023/08/02/2717141/0/de/Blue-Diamond-Resorts-k%C3%BCndigt-aufregende-Upgrades-f%C3%BCr-Diamond-Club-und-Star-Class-Kategorien-an.html,https://www.globenewswire.com/news-release/2023/08/02/2717141/0/de/Blue-Diamond-Resorts-k%C3%BCndigt-aufregende-Upgrades-f%C3%BCr-Diamond-Club-und-Star-Class-Kategorien-an.html,0,www.globenewswire.com,Blue Diamond Resorts kündigt aufregende Upgrades für Diamond Club™- und Star Class™-Kategorien an,"TORONTO, Aug. 02, 2023 (GLOBE NEWSWIRE) -- Blue Diamond Resorts, ein renommiertes All-Inclusive-Resort-Unternehmen, das für seine maßgeschneiderten Gastgewerbemarken und außergewöhnlichen Gästeerlebnisse bekannt ist, freut sich, wesentliche Upgrades seiner au…",https://ml.globenewswire.com/Resource/Download/b461c6be-0881-4f70-8ae1-186ff8b494fd,2023-08-02T16:10:00Z,,"TORONTO, Aug. 02, 2023 (GLOBE NEWSWIRE) -- Blue Diamond Resorts, ein renommiertes All-Inclusive-Resort-Unternehmen, das für seine maßgeschneiderten Gastgewerbemarken und außergewöhnlichen Gästeerlebn… [+6068 chars]",,de,'Gas'
https://www.diepresse.com/13666879/wenn-beide-berufstaetig-sind-ist-niemand-mehr-da,https://www.diepresse.com/13666879/wenn-beide-berufstaetig-sind-ist-niemand-mehr-da,0,www.diepresse.com,"„Wenn beide berufstätig sind, ist niemand mehr da“ [premium]","Rosa Ecker (FPÖ) wünscht sich Abgeltung für jene, die ihre Kinder zu Hause betreuen. Natascha Taslimi (Nebö) will hingegen flexiblere Betreuungsangebote – auch am Land.",https://img.diepresse.com/public/incoming/g8k12k-Rosa-Ecker-FP%C3%96-vs.-Natascha-Taslimi/alternates/DPR_SOCIAL_NACHRICHTEN_PAID/Rosa%20Ecker%20%28FP%C3%96%29%20vs.%20Natascha%20Taslimi%20,2023-08-02T16:11:05Z,,"Rosa Ecker (FPÖ) wünscht sich Abgeltung für jene, die ihre Kinder zu Hause betreuen. Natascha Taslimi (Nebö) will hingegen flexiblere Betreuungsangebote auch am Land.
Die Presse: Was ist das aktuell… [+1433 chars]",,de,'Kinder'
https://www.stern.de/lifestyle/leute/kanada--premier-justin-trudeau-und-seine-ehefrau-trennen-sich-33704690.html,https://www.stern.de/lifestyle/leute/kanada--premier-justin-trudeau-und-seine-ehefrau-trennen-sich-33704690.html,0,www.stern.de,Erklärung auf Instagram: Nach 18 Jahren Ehe: Kanadas Premier Justin Trudeau und Ehefrau Sophie Grégoire trennen sich,"Fast zwei Jahrzehnte war Kanadas Regierungschef Justin Trudeau mit der Mutter seiner drei Kinder zusammen. Nun geben der Premier und Sophie Grégoire ""nach vielen tiefen und schwierigen Gesprächen"" ihre Trennung bekannt.",https://image.stern.de/33704692/t/sV/v2/w1440/r1.7778/-/justin-trudeau-und-sophie-gr%C3%A9goire.jpg,2023-08-02T17:27:00Z,,"Fast zwei Jahrzehnte war Kanadas Regierungschef Justin Trudeau mit der Mutter seiner drei Kinder zusammen. Nun geben der Premier und Sophie Grégoire ""nach vielen tiefen und schwierigen Gesprächen"" ih… [+1473 chars]",,de,'Kinder'
https://www.focus.de/panorama/welt/verschwoerungstheoretikerin-zerstueckelte-ihre-kinder-ihre-geister-sagen-mir-du-hast-nichts-falsch-gemacht-mama_id_200747934.html,https://www.focus.de/panorama/welt/verschwoerungstheoretikerin-zerstueckelte-ihre-kinder-ihre-geister-sagen-mir-du-hast-nichts-falsch-gemacht-mama_id_200747934.html,0,www.focus.de,"Verschwörungstheoretikerin zerstückelte ihre Kinder - „Ihre Geister sagen mir, du hast nichts falsch gemacht, Mama“",Eine 50-jährige Mutter aus dem amerikanischen Idaho ist wegen Mordes an ihren beiden Kindern schuldig gesprochen worden. Sie wurde zu lebenslanger Haft ohne Möglichkeit auf Bewährung verurteilt.,https://p6.focus.de/img/fotos/id_200747935/imago0300736395h.jpg?im=Crop%3D%280%2C519%2C1350%2C675%29%3BResize%3D%281200%2C627%29&impolicy=perceptual&quality=mediumHigh&hash=23fcbd8488c992682c7567b0b2acb235589b2d922484ca71a4bfb2dc696b02ca,2023-08-02T17:28:03Z,,Eine 50-jährige Mutter aus dem amerikanischen Idaho ist wegen Mordes an ihren beiden Kindern schuldig gesprochen worden. Sie wurde zu lebenslanger Haft ohne Möglichkeit auf Bewährung verurteilt.Nachd… [+2125 chars],,de,'Kinder'
https://www.welt.de/vermischtes/prominente/article246709966/Nach-18-Jahren-Kanadas-Premierminister-Trudeau-verkuendet-Ehe-Aus.html,https://www.welt.de/vermischtes/prominente/article246709966/Nach-18-Jahren-Kanadas-Premierminister-Trudeau-verkuendet-Ehe-Aus.html,0,www.welt.de,Kanadas Premierminister Trudeau verkündet Ehe-Aus,"Sie galten als ein Traumpaar in der internationalen Politik: Kanadas Premierminister Justin Trudeau und seine Frau Sophie Grégoire-Trudeau, eine ehemalige Fernsehmoderatorin. Nach 18 Jahren Ehe und drei Kindern verkündete Trudeau auf Instagram das Ehe-Aus.",https://img.welt.de/img/bildergalerien/mobile246709964/5461358467-ci16x9-w1200/Kanadas-Premierminister-Trudeau-und-Ehefrau-Sophie.jpg,2023-08-02T17:34:39Z,,"Der kanadische Premierminister Justin Trudeau hat sich nach 18 Jahren Ehe von seiner Frau getrennt. Sophie und ich möchten Euch mitteilen, dass wir uns nach vielen tiefen und schwierigen Gesprächen e… [+868 chars]",,de,'Kinder'
https://www.faz.net/aktuell/feuilleton/familie/eltern-kolumne-schlaflos/sommerferien-plus-wenn-die-eigenen-kinder-mit-anderen-wegfahren-19075238.html,https://www.faz.net/aktuell/feuilleton/familie/eltern-kolumne-schlaflos/sommerferien-plus-wenn-die-eigenen-kinder-mit-anderen-wegfahren-19075238.html,0,www.faz.net,Sommerferien Plus: Wenn die eigenen Kinder mit anderen Wegfahren,Eine schwierige Abwägungsfrage für unsere Autorin: Kann sie die Söhne mit anderen Familien in den Urlaub schicken? Erleben sie etwas Unvergleichliches oder sollen sie nur eine Lücke füllen? Und wer gibt den Eltern die Zeit zurück?,https://media0.faz.net/ppmedia/aktuell/2667974344/1.9071100/facebook_teaser_fplus/gutes-quartier-mit-pool-aber.jpg,2023-08-02T17:55:13Z,http://archive.md/20230803094100/https://www.faz.net/aktuell/feuilleton/familie/eltern-kolumne-schlaflos/sommerferien-plus-wenn-die-eigenen-kinder-mit-anderen-wegfahren-19075238.html,"Mein ultimativer persönlicher Gegner in Erziehungsangelegenheiten hat sich in den Wochen vor den hessischen Sommerferien gezeigt: Die Frage, ob einer unserer Söhne Malik oder Amir mit einem Freund in… [+553 chars]",,de,'Kinder'
https://www.stern.de/gesellschaft/regional/nordrhein-westfalen/bonner-landgericht--als-16-jaehriger-ausgegeben--haft-fuer-kindesmissbrauch-33704634.html,https://www.stern.de/gesellschaft/regional/nordrhein-westfalen/bonner-landgericht--als-16-jaehriger-ausgegeben--haft-fuer-kindesmissbrauch-33704634.html,0,www.stern.de,Bonner Landgericht: Als 16-Jähriger ausgegeben: Haft für Kindesmissbrauch,Wegen Missbrauchs von Kindern über Onlineplattformen sowie Verbreitung von Kinderpornografie ist ein Einzelhandelskaufmann am Mittwoch vom Bonner Landgericht zu fünf Jahren und drei Monaten Haft verurteilt worden. Die Staatsanwaltschaft hatte 45 Sexualstrafta…,https://image.stern.de/33704636/t/Ok/v2/w1440/r1.7778/-/02--urnnewsmldpacom2009010123080299668325v3w800h600l624t484r1819b1421jpeg---662f2bd25ef4eda1.jpg,2023-08-02T17:55:47Z,,Wegen Missbrauchs von Kindern über Onlineplattformen sowie Verbreitung von Kinderpornografie ist ein Einzelhandelskaufmann am Mittwoch vom Bonner Landgericht zu fünf Jahren und drei Monaten Haft veru… [+1753 chars],,de,'Kinder'
https://www.n-tv.de/politik/Kanadas-Premierminister-Trudeau-gibt-Trennung-bekannt-article24301560.html,https://www.n-tv.de/politik/Kanadas-Premierminister-Trudeau-gibt-Trennung-bekannt-article24301560.html,0,www.n-tv.de,Nach 18 Jahren Ehe: Kanadas Premierminister Trudeau gibt Trennung bekannt,Justin Trudeau und seine Ehefrau kannten sich aus Kindertagen und waren sich 2003 auf einem Wohltätigkeitsball wieder begegnet. Zwei Jahre später folgte die Hochzeit. Das Paar bekam drei gemeinsame Kinder. Auf Instagram gibt der kanadische Premierminister jet…,https://bilder1.n-tv.de/img/incoming/crop24301552/721132477-cImg_16_9-w1200/407220034.jpg,2023-08-02T17:58:43Z,,Justin Trudeau und seine Ehefrau kannten sich aus Kindertagen und waren sich 2003 auf einem Wohltätigkeitsball wieder begegnet. Zwei Jahre später folgte die Hochzeit. Das Paar bekam drei gemeinsame K… [+1196 chars],,de,'Kinder'
https://www.morgenpost.de/politik/ausland/article239094795/Bericht-Knapp-170-000-Menschen-in-London-wohnungslos.html,https://www.morgenpost.de/politik/ausland/article239094795/Bericht-Knapp-170-000-Menschen-in-London-wohnungslos.html,0,www.morgenpost.de,Großbritannien: Bericht: Knapp 170.000 Menschen in London wohnungslos,Etwa jeder 50. Londoner hat kein Zuhause - unter den Wohnungslosen sind Zehntausende Kinder. Gemeinden fordern deshalb eine Erhöhung des Wohngeldes und mehr sozialen Wohnungsbau.,https://img.morgenpost.de/img/ausland/crop239094793/4122606621-w820-cv16_9-q85/Wohnungslos-in-London.jpg,2023-08-03T02:45:15Z,,"London. In London sind fast 170.000 Menschen wohnungslos. Das geht aus einem Bericht der Dachorganisation der lokalen Bezirksverwaltungen (Local Councils) in der britischen Hauptstadt hervor, der heu… [+1322 chars]",,de,'Kinder'
https://www.stern.de/politik/ausland/grossbritannien--bericht--knapp-170-000-menschen-in-london-wohnungslos-33705250.html,https://www.stern.de/politik/ausland/grossbritannien--bericht--knapp-170-000-menschen-in-london-wohnungslos-33705250.html,0,www.stern.de,Großbritannien: Bericht: Knapp 170.000 Menschen in London wohnungslos,Etwa jeder 50. Londoner hat kein Zuhause - unter den Wohnungslosen sind Zehntausende Kinder. Gemeinden fordern deshalb eine Erhöhung des Wohngeldes und mehr sozialen Wohnungsbau.,https://image.stern.de/33705252/t/lD/v1/w1440/r1.7778/-/03--urnnewsmldpacom2009010123080399674069v3w800h600l640t485r1920b1455jpeg---0e2a459492a7fe14.jpg,2023-08-03T02:45:15Z,https://web.archive.org/web/20230803032224/https://www.stern.de/politik/ausland/grossbritannien--bericht--knapp-170-000-menschen-in-london-wohnungslos-33705250.html,"Etwa jeder 50. Londoner hat kein Zuhause - unter den Wohnungslosen sind Zehntausende Kinder. Gemeinden fordern deshalb eine Erhöhung des Wohngeldes und mehr sozialen Wohnungsbau.
In London sind fast… [+1380 chars]",,de,'Obdachlosigkeit'
https://www.focus.de/panorama/welt/mehr-als-die-haelfte-seien-kinder-bericht-knapp-170-000-menschen-in-london-wohnungslos_id_200782302.html,https://www.focus.de/panorama/welt/mehr-als-die-haelfte-seien-kinder-bericht-knapp-170-000-menschen-in-london-wohnungslos_id_200782302.html,0,www.focus.de,Gut die Hälfte seien Kinder - Bericht: Knapp 170.000 Menschen in London wohnungslos,"In London sind fast 170.000 Menschen wohnungslos. Das geht aus einem Bericht der Dachorganisation der lokalen Bezirksverwaltungen (Local Councils) in der britischen Hauptstadt hervor, der am Donnerstag veröffentlicht wurde.",https://p6.focus.de/img/regional/bayern/id_198824991/ein-obdachloser-mann-schiebt-einen-einkaufswagen-ueber-eine-fussgaengerstrasse-in-berlin..jpg?im=Crop%3D%280%2C169%2C2048%2C1024%29%3BResize%3D%281200%2C627%29&impolicy=perceptual&quality=mediumHigh&hash=25e3f74effc9b1fabdec2ef4bb260cc3260e2bcf1c34af115dfa23a469a573a5,2023-08-03T02:57:41Z,https://web.archive.org/web/20230803033749/https://www.focus.de/panorama/welt/mehr-als-die-haelfte-seien-kinder-bericht-knapp-170-000-menschen-in-london-wohnungslos_id_200782302.html,"In London sind fast 170.000 Menschen wohnungslos. Das geht aus einem Bericht der Dachorganisation der lokalen Bezirksverwaltungen (Local Councils) in der britischen Hauptstadt hervor, der am Donnerst… [+1204 chars]",,de,'Kinder'
https://www.diepresse.com/13769037/knapp-170000-menschen-in-london-sind-wohnungslos,https://www.diepresse.com/13769037/knapp-170000-menschen-in-london-sind-wohnungslos,0,www.diepresse.com,Knapp 170.000 Menschen in London sind wohnungslos,"Ein Bericht der lokalen Bezirksverwaltung berechnet: Ungefähr jeder 50. der ca. 8,8 Millionen Einwohner Londons ist obdachlos, darunter mehr als 80.000 Kinder.",https://img.diepresse.com/public/incoming/jegzzo-TOPSHOT-BRITAIN-POLITICS-SOCIETY-HOMELESS/alternates/DPR_SOCIAL_NACHRICHTEN/TOPSHOT-BRITAIN-POLITICS-SOCIETY-HOMELESS,2023-08-03T04:37:14Z,https://web.archive.org/web/20230803094602/https://www.diepresse.com/13769037/knapp-170000-menschen-in-london-sind-wohnungslos,"Ein Bericht der lokalen Bezirksverwaltung berechnet: Ungefähr jeder 50. der ca. 8,8 Millionen Einwohner Londons ist obdachlos, darunter mehr als 80.000 Kinder.
In London sind fast 170.000 Menschen w… [+1362 chars]",,de,'Obdachlosigkeit'
https://www.handelsblatt.com/politik/deutschland/erdgasspeicher-so-steht-es-um-die-gasversorgung-im-naechsten-winter/29264598.html,https://www.handelsblatt.com/politik/deutschland/erdgasspeicher-so-steht-es-um-die-gasversorgung-im-naechsten-winter/29264598.html,0,www.handelsblatt.com,Erdgasspeicher: Unwägbarkeiten bleiben: So steht es um die Gasversorgung im nächsten Winter,Im vergangenen Jahr hat die Versorgungskrise in Europa vielen Menschen zugesetzt. Die Aussichten für den kommenden Winter sind besser. Entwarnung will aber kein Experte geben.,https://www.handelsblatt.com/images/gasspeicher-in-sachsen-anhalt/29276430/3-format2003.jpg,2023-08-03T08:58:20Z,http://archive.md/20230803101013/https://www.handelsblatt.com/politik/deutschland/erdgasspeicher-so-steht-es-um-die-gasversorgung-im-naechsten-winter/29264598.html,"Gasspeicher in Sachsen-AnhaltDie deutschen Gasspeicher sind gut gefüllt.
(Foto: dpa)
Berlin Drohender Gasmangel, niedrige Speicherstände und Rekordpreise: 2022 war geprägt vom Energieschock. Davon … [+1126 chars]",,de,'Gasspeicher'
https://taz.de/Mini-Akw-Plaene-in-den-USA/!5952141/,https://taz.de/Mini-Akw-Plaene-in-den-USA/!5952141/,0,taz.de,"Mini-Akw-Pläne in den USA: Kleiner, aber immer noch Atom","Die USA wollen viele Kohle- durch Atomkraftwerke ersetzen. Die Regierung hofft, dass neue Modelle weniger Probleme machen als die alten Meiler.",https://taz.de/picture/6428860/948/33333793-1.jpeg,2023-08-04T12:10:00Z,https://web.archive.org/web/20230804150615/https://taz.de/Mini-Akw-Plaene-in-den-USA/!5952141/,"Die USA wollen viele Kohle- durch Atomkraftwerke ersetzen. Die Regierung hofft, dass neue Modelle weniger Probleme machen als die alten Meiler.
Das Kraftwerk Naughton soll geschlossen und durch eine… [+3895 chars]",,de,'Atomkraft'
https://www.morgenpost.de/politik/article238987157/politik-news-blog-aktuell-medikamente-engpass-lauternach-kinderaerzte.html,https://www.morgenpost.de/politik/article238987157/politik-news-blog-aktuell-medikamente-engpass-lauternach-kinderaerzte.html,0,www.morgenpost.de,Politik-News im Überblick: Bayerns Hilferuf: Im Winter droht Arzneimittel-Knappheit,"Bei Arzneimitteln drohen Lieferengpässe, insbesondere im Winter. Kinderärzte warnen, Bayern ruft nach dem Bund. Mehr dazu im News-Blog.",https://img.morgenpost.de/img/inland/crop239103035/4602608749-w820-cv16_9-q85/Apotheke.jpg,2023-08-04T14:11:00Z,https://web.archive.org/web/20230804160013/https://www.morgenpost.de/politik/article238987157/politik-news-blog-aktuell-medikamente-engpass-lauternach-kinderaerzte.html,<ul><li>Medikamente könnten bei kommenden Infektionswellen knapp werden. Kinderärzte alarmiert </li><li>Paus will künftig auf eine einheitliche Qualität von Kindertagesstätten setzen</li><li>Bundesre… [+27817 chars],,de,'Kinder'
https://www.tagesspiegel.de/politik/vier-milliarden-euro-fur-kitas-lander-wollen-vor-allem-mehr-personal-einstellen-10265890.html,https://www.tagesspiegel.de/politik/vier-milliarden-euro-fur-kitas-lander-wollen-vor-allem-mehr-personal-einstellen-10265890.html,0,www.tagesspiegel.de,Vier Milliarden Euro für Kitas: Länder wollen vor allem mehr Personal einstellen,"Die Qualität der Kinderbetreuung in Deutschland soll verbessert werden. Das funktioniert am besten, wenn mehr Erzieherinnen und Erzieher eingestellt werden.",https://www.tagesspiegel.de/images/pre-school-teacher-helping-girl-putting-on-rainwear-in-kindergarten/alternates/BASE_16_9_W1400/pre-school-teacher-helping-girl-putting-on-rainwear-in-kindergarten.jpeg,2023-08-04T14:11:53Z,,Die Länder wollen das vom Bund zur Verfügung gestellte Geld für eine bessere Qualität der Kinderbetreuung vor allem in Personal stecken. Wie Bundesfamilienministerin Lisa Paus (Grüne) am Freitag in B… [+3700 chars],,de,'Kinder'
https://taz.de/Krise-der-Kinderbetreuung/!5952401/,https://taz.de/Krise-der-Kinderbetreuung/!5952401/,0,taz.de,Krise der Kinderbetreuung: Deutschlands Kita-Versagen,Etwa 57 Prozent der Eltern sind mit Schließungen in Kitas konfrontiert. Der Deutsche Kitaverband fordert mehr Flexibilität für Träger.,https://taz.de/picture/6432425/948/32985706-1.jpeg,2023-08-04T14:31:00Z,,"Etwa 57 Prozent der Eltern sind mit Schließungen in Kitas konfrontiert. Der Deutsche Kitaverband fordert mehr Flexibilität für Träger.
Vielleicht sind humanoide Roboter wie Nao eine Lösung gegen Per… [+3732 chars]",,de,'Kinder'
https://taz.de/Streit-um-Kindergrundsicherung/!5948149/,https://taz.de/Streit-um-Kindergrundsicherung/!5948149/,0,taz.de,Streit um Kindergrundsicherung: Arme sichern unsere Zukunft,Im Streit über die Kindergrundsicherung werden Vorurteile gegen Arbeitslose geschürt. Dabei brauchen wir wegen der Demografie kinderreiche Familien.,https://taz.de/picture/6430615/948/33335221-1.jpeg,2023-08-04T15:06:00Z,,"Im Streit über die Kindergrundsicherung werden Vorurteile gegen Arbeitslose geschürt. Dabei brauchen wir wegen der Demografie kinderreiche Familien.
Es geht um eine Zukunft, in der es kein soziales … [+5665 chars]",,de,'Kinder'
