index,url,valid,domain,title,description,image,published,archive,content,quote,language,keyword
https://www.faz.net/aktuell/rhein-main/region-und-hessen/weinlese-an-der-bergstrasse-18402081.html,https://www.faz.net/aktuell/rhein-main/region-und-hessen/weinlese-an-der-bergstrasse-18402081.html,0,www.faz.net,Weinlese an der Bergstraße,"Trotz Dürresommer und verregnetem Herbst freuen sich die Bergsträsser Winzer über einen guten Jahrgang 2022 – und über ihre Weinkönigin. Nur wenige Trauben hängen noch an den Reben, in der Hoffnung auf einen diesjährigen Eiswein.",https://media0.faz.net/ppmedia/aktuell/3927555043/1.8402076/facebook_teaser/steile-sache-bei-der-arbeit-im.jpg,2022-10-23T10:50:25Z,https://web.archive.org/web/20221023105142/http://www.faz.net/aktuell/rhein-main/region-und-hessen/weinlese-an-der-bergstrasse-18402081.html,"Auch in Deutschlands kleinstem Weinanbaugebiet ist die Lese abgeschlossen. Doch ein paar Trauben hängen noch. Denn die Winzer von der Hessischen Bergstraße hoffen darauf, dass es in den nächsten Woch… [+2371 chars]",,de,'Weinlese'
https://www.faz.net/aktuell/rhein-main/weinernte-im-rheingau-fast-beendet-18379052.html,https://www.faz.net/aktuell/rhein-main/weinernte-im-rheingau-fast-beendet-18379052.html,0,www.faz.net,"Weinernte: Wenige Öchsle, viel Geschmeck",Die Weinlese im Rheingau ist nahezu abgeschlossen. Hinter den Winzern liegt ein außergewöhnliches Weinjahr. Doch Mostgewicht ist nicht alles.,https://media0.faz.net/ppmedia/aktuell/3443619414/1.8379136/facebook_teaser/werden-schon-verarbeitet-die.jpg,2022-10-11T13:37:10Z,https://web.archive.org/web/20221011133907/http://www.faz.net/aktuell/rhein-main/weinernte-im-rheingau-fast-beendet-18379052.html,"Die Weinlese im Rheingau ist vorbei. Fast, denn einige Winzer hoffen noch auf edelsüße Spezialitäten. Sie müssen geduldig sein und auf den Botrytispilz warten, damit die erwünschte Konzentration in d… [+3411 chars]",,de,'Weinlese'
https://noe.orf.at/stories/3177777/,https://noe.orf.at/stories/3177777/,0,noe.orf.at,"Weinlese: Mehr Maschine, weniger Mensch",Mit der Weinlese verbindet man das händische Abschneiden der Trauben. Wegen des Arbeitskräftemangels änderte sich dieses Bild jedoch in den vergangenen Jahren. Mittlerweile wird die Hälfte der heimischen Reben mit der Maschine gelesen.,https://ibs.orf.at/noe?image=https%3A%2F%2Foekastatic.orf.at%2Fmims%2F2022%2F43%2F93%2Fcrops%2Fw%3D1200%2Ch%3D627%2Cq%3D75%2F1537902_master_560893_machine-gcec890395_1920.jpg%3Fs%3D1e132a40a5d1a04c75fd4bff11a70eb7879450fe,2022-10-17T03:15:59Z,https://web.archive.org/web/20221017035018/https://noe.orf.at/stories/3177777/,"Die diesjährige Weinlese neigt sich dem Ende zu und auch heuer wurde ein großer Anteil der Trauben maschinell gelesen. Johann Grassl, Leiter des Referats Weinbau der Landwirtschaftkammer Niederösterr… [+3157 chars]",,de,'Weinlese'
https://www.tagesspiegel.de/berlin/bezirke/mit-dem-transporter-ins-kriegsgebiet-drei-pankower-freunde-retten-tiere-in-der-ukraine-8778712.html,https://www.tagesspiegel.de/berlin/bezirke/mit-dem-transporter-ins-kriegsgebiet-drei-pankower-freunde-retten-tiere-in-der-ukraine-8778712.html,0,www.tagesspiegel.de,Mit dem Transporter ins Kriegsgebiet: Drei Pankower Freunde retten Tiere in der Ukraine,"Das kleine Team macht sich regelmäßig auf den Weg, um zurückgelassene Katzen und Hunde zu versorgen. Manche von ihnen dürfen mit nach Deutschland.",https://www.tagesspiegel.de/images/ukrainejpg4/alternates/BASE_16_9_W1400/ukrainejpg.jpeg,2022-10-20T14:51:24Z,https://web.archive.org/web/20221020162104/https://www.tagesspiegel.de/berlin/bezirke/mit-dem-transporter-ins-kriegsgebiet-drei-pankower-freunde-retten-tiere-in-der-ukraine-8778712.html,"Am 2. November soll es wieder losgehen Richtung Ukraine. Dann werden Sabrina Jörns, Michaela Lawrenz und Mario Schlöricke zwei Transporter mit Tierfutter, Boxen und anderen Hilfsmitteln beladen und s… [+4820 chars]",,de,'Weinlese'
https://www.tagesspiegel.de/berlin/bezirke/stadtepartnerschaft-zu-kriegszeiten-berlin-hat-bald-einen-charkiw-park-8773873.html,https://www.tagesspiegel.de/berlin/bezirke/stadtepartnerschaft-zu-kriegszeiten-berlin-hat-bald-einen-charkiw-park-8773873.html,0,www.tagesspiegel.de,Städtepartnerschaft zu Kriegszeiten: Berlin hat bald einen Charkiw-Park,"Der Ukraine-Krieg und Berlin und mehr bezirkliche Newsletter-Themen, donnerstags aus Pankow, Steglitz-Zehlendorf und Friedrichshain-Kreuzberg. Vorschau hier.",https://www.tagesspiegel.de/berlin/bezirke/images/imago0050592054hjpg/alternates/BASE_16_9_W1400/imago0050592054hjpg.jpeg,2022-10-19T18:44:17Z,https://web.archive.org/web/20221019200924/https://www.tagesspiegel.de/berlin/bezirke/stadtepartnerschaft-zu-kriegszeiten-berlin-hat-bald-einen-charkiw-park-8773873.html,"Unsere Newsletter aus den Berliner Bezirken wurden berlinweit inzwischen rund 268.000 Mal abonniert. Am Donnerstag senden wir aus Steglitz-Zehlendorf, Friedrichshain-Kreuzberg und Pankow. Unsere News… [+3845 chars]",,de,'Weinlese'
https://www.tagesspiegel.de/berlin/bezirke/mit-musik-und-diskussion-forderung-nach-sicheren-berliner-schulwegen-wird-lauter-8744383.html,https://www.tagesspiegel.de/berlin/bezirke/mit-musik-und-diskussion-forderung-nach-sicheren-berliner-schulwegen-wird-lauter-8744383.html,0,www.tagesspiegel.de,Mit Musik und Diskussion: Forderung nach sicheren Berliner Schulwegen wird lauter,"Verkehr, Schule und mehr bezirkliche Newsletter-Themen, donnerstags aus Pankow, Steglitz-Zehlendorf und Friedrichshain-Kreuzberg. Vorschau hier.",https://www.tagesspiegel.de/potsdam/images/heprodimagesfotos93120220823sicher21113120220822145338937jpg/alternates/BASE_16_9_W1400/heprodimagesfotos93120220823sicher21113120220822145338937jpg.jpeg,2022-10-12T19:17:36Z,https://web.archive.org/web/20221012194952/https://www.tagesspiegel.de/berlin/bezirke/mit-musik-und-diskussion-forderung-nach-sicheren-berliner-schulwegen-wird-lauter-8744383.html,"Unsere Newsletter aus den Berliner Bezirken wurden berlinweit inzwischen rund 268.000 Mal abonniert. Am Donnerstag senden wir aus Steglitz-Zehlendorf, Friedrichshain-Kreuzberg und Pankow. Unsere News… [+3838 chars]",,de,'Weinlese'
https://www.morgenpost.de/vermischtes/article236740333/allerseelen-feiertag-unterschied-allerheiligen.html,https://www.morgenpost.de/vermischtes/article236740333/allerseelen-feiertag-unterschied-allerheiligen.html,0,www.morgenpost.de,Christentum: Allerheiligen und Allerseelen: Feiertage und ihre Bedeutung,"Nach Allerheiligen am 1. November folgt Allerseelen am 2. November. Lesen Sie hier, welche Unterschiede und Bräuche die Tage haben.",https://img.morgenpost.de/img/frontpage/crop236741445/9722606385-w820-cv16_9-q85/epd-01AAB0007DE937C0.jpg,2022-10-24T10:10:05Z,https://web.archive.org/web/20221024110333/https://www.morgenpost.de/vermischtes/article236740333/allerseelen-feiertag-unterschied-allerheiligen.html,Berlin. <ul><li>Allerheiligen sind zusammen mit Allerseelen wichtige Feiertage für alle Christinnen und Christen</li><li>Werden sie bundesweit gefeiert? Und was ist der Unterschied zwischen dem 1. un… [+7287 chars],,de,'Weinlese'
https://ooe.orf.at/stories/3177802/,https://ooe.orf.at/stories/3177802/,0,ooe.orf.at,Karl Hauk im Lentos Kunstmuseum Linz,"Das Lentos Kunstmuseum setzt heuer einen Schwerpunkt auf weibliche Kunst, ohne jedoch auf die Männer zu vergessen. Ab Freitag ist dem 1974 verstorbenen Wahl-Linzer Karl Hauk eine Ausstellung gewidmet.",https://ibs.orf.at/ooe?image=https%3A%2F%2Foekastatic.orf.at%2Fmims%2F2022%2F42%2F64%2Fcrops%2Fw%3D1200%2Ch%3D627%2Cq%3D75%2F1534472_master_559464_001_khauk_lentos_vio7269.jpg%3Fs%3D7ee71cab4370a4240aa305bda141b767008042ff,2022-10-13T10:30:00Z,https://web.archive.org/web/20221013104817/https://ooe.orf.at/stories/3177802/,"Das Mosaik Vier Jahreszeiten auf der Uhr der Linzer Tabakfabrik dürfte wohl vielen bekannt sein. 1934 und damit zwischen Erstem und Zweitem Weltkrieg gefertigt, steht die Arbeit für Karl Hauks künstl… [+748 chars]",,de,'Weinlese'
https://www.stern.de/kultur/tv/jan-boehmermann-lueftet-die-dunklen-geheimnisse-unseres-geliebten-weins-32818468.html,https://www.stern.de/kultur/tv/jan-boehmermann-lueftet-die-dunklen-geheimnisse-unseres-geliebten-weins-32818468.html,0,www.stern.de,ZDF Magazin Royale: #ohrenkneiferschorle: Jan Böhmermann lüftet die dunklen Geheimnisse unseres geliebten Weins,"Jan Böhmermann ist bekannt für freche Sprüche und steile Thesen. In der neuen Ausgabe von ""ZDF Magazin Royale"" nimmt er sich mal wieder ein sensibles Thema vor: unseren heiß geliebten Wein.",https://image.stern.de/32818470/t/WY/v3/w1440/r1.7778/-/jan-boehmermann.jpg,2022-10-15T11:35:00Z,https://web.archive.org/web/20221015114253/https://www.stern.de/kultur/tv/jan-boehmermann-lueftet-die-dunklen-geheimnisse-unseres-geliebten-weins-32818468.html,"""Heute wird etwas beschimpft, das in dieser Form noch nie beschimpft wurde."" Mit diesen Worten startet Moderator und Entertainer Jan Böhmermann in die jüngste Folge seiner Late-Night-Satire-Show ""ZDF… [+5347 chars]",,de,'Weinlese'
https://www.faz.net/aktuell/rhein-main/ruhesitz-fuer-frueheren-landesvater-18367755.html,https://www.faz.net/aktuell/rhein-main/ruhesitz-fuer-frueheren-landesvater-18367755.html,0,www.faz.net,Ruhebank für früheren Landesvater,Jedes Jahr lesen Prominente auf dem Landrats-Weinberg bei Heppenheim Roten Riesling. Dieses Mal gab es einen besonderen Abschied.,https://media0.faz.net/ppmedia/aktuell/710647143/1.8367752/facebook_teaser/zur-probe-der-ehemalige.jpg,2022-10-06T14:28:57Z,https://web.archive.org/web/20221006150830/https://www.faz.net/aktuell/rhein-main/ruhesitz-fuer-frueheren-landesvater-18367755.html,"Hessens früherer Ministerpräsident Volker Bouffier kommt gerne an die Bergstraße. Jetzt hat er einen weiteren Grund, ausgedehnte Spaziergänge durch die Weinberge zu machen, denn in Heppenheim hat er … [+3149 chars]",,de,'Weinlese'
https://www.tagesspiegel.de/wirtschaft/mehr-ertrag-als-2021-weinernte-in-deutschland-fallt-besser-aus-als-erwartet-8793730.html,https://www.tagesspiegel.de/wirtschaft/mehr-ertrag-als-2021-weinernte-in-deutschland-fallt-besser-aus-als-erwartet-8793730.html,0,www.tagesspiegel.de,Mehr Ertrag als 2021: Weinernte in Deutschland fällt besser aus als erwartet,Die Weinlese in Deutschlands Anbaugebieten hat mehr Ertrag geliefert als vergangenes Jahr. Durch das Extremwetter gab es jedoch regional Unterschiede.,https://www.tagesspiegel.de/wirtschaft/images/weinlese-weitgehend-abgeschlossen/alternates/BASE_16_9_W1400/weinlese-weitgehend-abgeschlossen.jpeg,2022-10-25T05:27:47Z,https://web.archive.org/web/20221025053218/https://www.tagesspiegel.de/wirtschaft/mehr-ertrag-als-2021-weinernte-in-deutschland-fallt-besser-aus-als-erwartet-8793730.html,Nach ergiebigen Regenfällen im September ist die Weinernte in diesem Jahr besser ausgefallen als zum Auftakt der Lese erwartet. Das Deutsche Weininstitut (DWI) erwartet nach einer Schätzung vom Diens… [+2124 chars],,de,'Weinlese'
https://www.stern.de/gesellschaft/regional/sachsen/meissen--traubenernte-besser-als-erwartet--weinlese-im-elbtal--32788654.html,https://www.stern.de/gesellschaft/regional/sachsen/meissen--traubenernte-besser-als-erwartet--weinlese-im-elbtal--32788654.html,0,www.stern.de,Meißen: Traubenernte besser als erwartet: Weinlese im Elbtal,Meißen/Radebeul (sn) - Die Weinlese im sächsischen Elbtal zwischen Pirna und Diesbar-Seußlitz steht vor dem Abschluss. Der Großteil der Weingüter sei,https://image.stern.de/32788656/t/TU/v1/w1440/r1.7778/-/06--urnnewsmldpacom200901012210069923527v4w800h600l993t289r1886b1400jpeg---da73cfc9cdfa1bc1.jpg,2022-10-06T04:23:01Z,https://web.archive.org/web/20221006045255/https://www.stern.de/gesellschaft/regional/sachsen/meissen--traubenernte-besser-als-erwartet--weinlese-im-elbtal--32788654.html,"Sachsen zählt zu Deutschlands kleinsten Weinanbaugebieten. Die meisten Güter sind Anfang Oktober wegen der Nässe schon mit der Lese durch.
Die Weinlese im sächsischen Elbtal zwischen Pirna und Diesb… [+2745 chars]",,de,'Weinlese'
https://www.jungewelt.de/artikel/437569.50-jahre-radikalenerlass-bis-heute-hingehalten.html,https://www.jungewelt.de/artikel/437569.50-jahre-radikalenerlass-bis-heute-hingehalten.html,0,www.jungewelt.de,50 Jahre »Radikalenerlass«: Bis heute hingehalten,In Baden-Württemberg erinnerte eine Kundgebung in Sichtweite des Landtags an die Linkenverfolgung in der alten BRD. Betroffene bekräftigen die Forderung nach Rehabilitation und Entschädigung für Berufsverbote.,https://www.jungewelt.de/img/1100/173094.jpg,2022-10-27T17:36:44Z,https://web.archive.org/web/20221027175507/http://www.jungewelt.de/artikel/437569.50-jahre-radikalenerlass-bis-heute-hingehalten.html,"Lang ists her, dass Massen auf die Straße gingen und gegen die antikommunistischen Berufsverbote der BRD protestierten. Doch bis heute engagieren sich Menschen für Rehabilitierung und fordern Entschä… [+3319 chars]",,de,'Weinlese'
https://www.stern.de/wirtschaft/news/agrar--weinlese-in-deutschland-zum-groessten-teil-beendet-32815794.html,https://www.stern.de/wirtschaft/news/agrar--weinlese-in-deutschland-zum-groessten-teil-beendet-32815794.html,0,www.stern.de,Agrar: Weinlese in Deutschland zum größten Teil beendet,Nach monatelanger Dürre erreichten manche Beeren nur 70 Prozent ihres gewohnten Umfangs. Insgesamt aber trotzten die Reben dem heißen Sommer. Und die Weinlese war meist in ungewöhnlich kurzer Zeit abgeschlossen.,https://image.stern.de/32815796/t/cY/v1/w1440/r1.7778/-/14--urnnewsmldpacom2009010122101499126984v3w800h600l253t135r2029b1547jpeg---48867cd482f3d7d3.jpg,2022-10-14T10:33:32Z,https://web.archive.org/web/20221014104044/https://www.stern.de/wirtschaft/news/agrar--weinlese-in-deutschland-zum-groessten-teil-beendet-32815794.html,Nach monatelanger Dürre erreichten manche Beeren nur 70 Prozent ihres gewohnten Umfangs. Insgesamt aber trotzten die Reben dem heißen Sommer. Und die Weinlese war meist in ungewöhnlich kurzer Zeit ab… [+2917 chars],,de,'Weinlese'
https://www.faz.net/aktuell/rhein-main/newsletter-hauptwache/heute-in-rhein-main-vergangenheit-die-nicht-vergeht-18380260.html,https://www.faz.net/aktuell/rhein-main/newsletter-hauptwache/heute-in-rhein-main-vergangenheit-die-nicht-vergeht-18380260.html,0,www.faz.net,"Heute in Rhein-Main: Vergangenheit, die nicht vergeht",Unweit der Messe wird am Mittwoch in Frankfurt eine Bombe gesprengt. 20.000 Anwohner sind betroffen. Der Verkehr in der Stadt ist allerdings auch ohne Bombe eine Katastrophe. Die F.A.Z.-Hauptwache blickt auf die Themen des Tages.,https://media0.faz.net/ppmedia/aktuell/1891826172/1.8380286/facebook_teaser/am-mittwoch-muss-in-frankfurt.jpg,2022-10-11T18:43:00Z,https://web.archive.org/web/20221011190127/http://www.faz.net/aktuell/rhein-main/newsletter-hauptwache/heute-in-rhein-main-vergangenheit-die-nicht-vergeht-18380260.html,"Guten Abend,77 Jahre ist der Zweite Weltkrieg nun her, aber manchmal ragt er in einer beklemmenden Weise in die Gegenwart hinein. Am Mittwoch muss in Frankfurt unweit der Messe, am Katharinenkreisel,… [+3166 chars]",,de,'Weinlese'
https://versicherungswirtschaft-heute.de/maerkte-und-vertrieb/2022-10-04/branchenpuls-der-woche-nachhaltige-landwirtschaft-wahlen-in-niedersachsen/,https://versicherungswirtschaft-heute.de/maerkte-und-vertrieb/2022-10-04/branchenpuls-der-woche-nachhaltige-landwirtschaft-wahlen-in-niedersachsen/,0,versicherungswirtschaft-heute.de,"Branchenpuls der Woche: Nachhaltige Landwirtschaft, Wahlen in Niedersachsen","Wir schreiben Anfang Oktober und damit Herbst. Mit Ausnahme der Weinlese haben die Landwirte also einen Großteil ihrer Ernte eingefahren. Wie es allerdings um die nachhaltige Landwirtschaft bestellt ist, will der Landwirtschaftstag der LVM klären.
Der Beitrag…",https://versicherungswirtschaft-heute.de/wp-60d20-content/uploads/2021/02/OpenClipart-Vectors-auf-Pixabay.png,2022-10-03T22:00:00Z,,"Startseite » Märkte &amp; Vertrieb » Branchenpuls der Woche: Nachhaltige Landwirtschaft, Wahlen in Niedersachsen
Was lässt den Puls der Branche höher schlagen? Quelle: OpenClipart-Vectors auf Pixaba… [+402 chars]",,de,'Weinlese'
https://www.faz.net/aktuell/rhein-main/automaten-mit-blumensaat-statt-kaugummi-18416293.html,https://www.faz.net/aktuell/rhein-main/automaten-mit-blumensaat-statt-kaugummi-18416293.html,0,www.faz.net,Automaten mit Blumensaat statt Kaugummi,"Geisenheim stellt zwei Automaten für eine bienenfreundliche Stadt auf. Wer Geld einwirft, erhält Blumensamen zum Einpflanzen, wovon wiederum Bienen profitieren sollen.",https://media0.faz.net/ppmedia/aktuell/3043508455/1.8416288/facebook_teaser/umfunktioniert-statt-kaugummis.jpg,2022-10-27T11:50:46Z,https://web.archive.org/web/20221026213555/https://www.faz.net/aktuell/rhein-main/automaten-mit-blumensaat-statt-kaugummi-18416293.html,"Als Kaugummiautomaten kennt sie jeder, als Bienenfutterspender sind sie neu. Die Ortsbeiräte der beiden Geisenheimer Ortsteile Marienthal und Talstadt haben jeweils einen umgebauten Kaugummiautomaten… [+930 chars]",,de,'Aussaat'
https://www.wiwo.de/politik/ausland/wahlen-usa-midterms-enges-rennen-um-die-zukunft-der-usa-/28772684.html,https://www.wiwo.de/politik/ausland/wahlen-usa-midterms-enges-rennen-um-die-zukunft-der-usa-/28772684.html,0,www.wiwo.de,Wahlen: „Midterms“: Enges Rennen um die Zukunft der USA,"Es sind die wichtigsten US-Wahlen einer Generation - mit dieser Formel beschwören US-Politiker zwar immer ihr Volk, aber dieses Mal könnte es stimmen. Die Stimmung ist aufgeheizt.",https://www.wiwo.de/images/midterms/28772682/1-format11240.jpg,2022-10-27T10:26:39Z,https://web.archive.org/web/20221027094323/http://www.wiwo.de/politik/ausland/wahlen-usa-midterms-enges-rennen-um-die-zukunft-der-usa-/28772684.html,"Es sind die wichtigsten Wahlen einer Generation - mit dieser Formel beschwören US-Politiker zwar immer ihr Volk, aber dieses Mal deutet vieles darauf hin, dass es stimmt. Die Stimmung in den Vereinig… [+5929 chars]",,de,'Aussaat'
https://www.stern.de/politik/ausland/wahlen---midterms---enges-rennen-um-die-zukunft-der-usa--32854984.html,https://www.stern.de/politik/ausland/wahlen---midterms---enges-rennen-um-die-zukunft-der-usa--32854984.html,0,www.stern.de,"Wahlen: ""Midterms"": Enges Rennen um die Zukunft der USA",Kann Joe Biden die zweite Hälfte seiner Amtszeit durchregieren? Die Chancen für ihn stehen nicht gut. Am 8. November entscheiden die Menschen in den USA neu.,https://image.stern.de/32854986/t/9m/v2/w1440/r1.7778/-/27--urnnewsmldpacom2009010122102799280711v3w800h600l640t302r1920b912jpeg---fe3b1782d1715d60.jpg,2022-10-27T09:08:41Z,https://web.archive.org/web/20221027091806/https://www.stern.de/politik/ausland/wahlen---midterms---enges-rennen-um-die-zukunft-der-usa--32854984.html,"Kann Joe Biden die zweite Hälfte seiner Amtszeit durchregieren? Die Chancen für ihn stehen nicht gut. Am 8. November entscheiden die Menschen in den USA neu.
Es sind die wichtigsten Wahlen einer Gen… [+5671 chars]",,de,'Aussaat'
https://www.stern.de/politik/ausland/---midterms---enges-rennen-um-die-zukunft-der-usa--32854984.html,https://www.stern.de/politik/ausland/---midterms---enges-rennen-um-die-zukunft-der-usa--32854984.html,0,www.stern.de,"""Midterms"": Enges Rennen um die Zukunft der USA",Kann Joe Biden die zweite Hälfte seiner Amtszeit durchregieren? Die Chancen für ihn stehen nicht gut. Am 8. November entscheiden die Menschen in den USA neu.,https://image.stern.de/32854986/t/ch/v1/w1440/r1.7778/-/27--urnnewsmldpacom2009010122102799280711v3w800h600l640t302r1920b912jpeg---fe3b1782d1715d60.jpg,2022-10-27T08:31:35Z,https://web.archive.org/web/20221027084246/https://www.stern.de/politik/ausland/---midterms---enges-rennen-um-die-zukunft-der-usa--32854984.html,"Kann Joe Biden die zweite Hälfte seiner Amtszeit durchregieren? Die Chancen für ihn stehen nicht gut. Am 8. November entscheiden die Menschen in den USA neu.
Es sind die wichtigsten Wahlen einer Gen… [+5671 chars]",,de,'Aussaat'
https://www.morgenpost.de/politik/ausland/article236766715/Midterms-Enges-Rennen-um-die-Zukunft-der-USA.html,https://www.morgenpost.de/politik/ausland/article236766715/Midterms-Enges-Rennen-um-die-Zukunft-der-USA.html,0,www.morgenpost.de,«Midterms»: Enges Rennen um die Zukunft der USA,Kann Joe Biden die zweite Hälfte seiner Amtszeit durchregieren? Die Chancen für ihn stehen nicht gut. Am 8. November entscheiden die Menschen in den USA neu.,https://img.morgenpost.de/img/ausland/crop236766713/7072602707-w820-cv16_9-q85/Midterms.jpg,2022-10-27T08:31:35Z,https://web.archive.org/web/20221027091305/https://www.morgenpost.de/politik/ausland/article236766715/Midterms-Enges-Rennen-um-die-Zukunft-der-USA.html,"Washington. Es sind die wichtigsten Wahlen einer Generation - mit dieser Formel beschwören US-Politiker zwar immer ihr Volk, aber dieses Mal deutet vieles darauf hin, dass es stimmt. Die Stimmung in … [+5505 chars]",,de,'Aussaat'
https://orf.at/stories/3288712/,https://orf.at/stories/3288712/,0,orf.at,Amazonas-Abholzung gegenüber Vorjahr um 50 Prozent gestiegen,,https://orf.at/mojo/1_4_1/storyserver//news/common/images/og-fallback-news.png,2022-10-08T12:28:24Z,https://web.archive.org/web/20221008130601/https://orf.at/stories/3288712/,Mit einem Waldverlust von 1.455 Quadratkilometern in Brasiliens Amazonas-Region stellt der gerade abgelaufene September einen Rekord auf: Seitdem das staatliche Klimainstitut INPE die Messreihe mit d… [+1268 chars],,de,'Aussaat'
https://www.bild.de/regional/ruhrgebiet/ruhrgebiet-aktuell/so-schoen-ist-die-landwirtschaft-280000-folgen-agrar-influencerin-marie-81526276.bild.html,https://www.bild.de/regional/ruhrgebiet/ruhrgebiet-aktuell/so-schoen-ist-die-landwirtschaft-280000-folgen-agrar-influencerin-marie-81526276.bild.html,0,www.bild.de,So schön ist die Landwirtschaft - 280 000 folgen Agrar-Influencerin Marie,Sie ist das schöne Gesicht der Landwirtschaft. Marie Hoffmann (25) aus Lippetal in NRW hat als Agrar-Influencerin fast 280 000 Follower.,"https://images.bild.de/633d7c6e109bbc17507c79fd/a831df2291d2cd86bcb56e6e1d714767,9fe1bb51?w=1280",2022-10-05T15:12:21Z,https://web.archive.org/web/20221005170912/https://www.bild.de/regional/ruhrgebiet/ruhrgebiet-aktuell/so-schoen-ist-die-landwirtschaft-280000-folgen-agrar-influencerin-marie-81526276.bild.html,Lippetal (NRW) Wie kann Getreide sparsam ausgesät werden? Was ist der beste Schutz gegen Keime und Bakterien in Viehställen? Wie funktioniert computergesteuerte Präzisionslandwirtschaft? Oder welches… [+3247 chars],,de,'Aussaat'
https://www.n-tv.de/panorama/Es-ist-wieder-zu-viel-Salz-in-der-Oder-article23684874.html,https://www.n-tv.de/panorama/Es-ist-wieder-zu-viel-Salz-in-der-Oder-article23684874.html,0,www.n-tv.de,Wie beim Fischsterben im Sommer: Es ist wieder zu viel Salz in der Oder,"Im August wird tonnenweise toter Fisch an das Flussufer der Oder gespült. Experten gehen davon aus, dass ein zu hoher Salzgehalt einer der Gründe für das Massensterben ist. Seitdem wird der Fluss genaustens kontrolliert. Die aktuelle Messung gibt jedoch wiede…",https://bilder4.n-tv.de/img/incoming/crop23684879/8521321765-cImg_16_9-w1200/316520129.jpg,2022-10-30T15:21:19Z,,"Im August wird tonnenweise toter Fisch an das Flussufer der Oder gespült. Experten gehen davon aus, dass ein zu hoher Salzgehalt einer der Gründe für das Massensterben ist. Seitdem wird der Fluss gen… [+2719 chars]",,de,'Niedrigwasser'
https://taz.de/Erneute-Alarmzeichen-in-der-Oder/!5888624/,https://taz.de/Erneute-Alarmzeichen-in-der-Oder/!5888624/,0,taz.de,Erneute Alarmzeichen in der Oder: Wieder zu viel Salz im Wasser,"Nach dem Fischsterben in dem Grenzfluss im August blieb unklar, woher genau die tödliche Substanz stammte. Fängt jetzt alles wieder von vorn an?",https://taz.de/picture/5881067/948/311262647-1.jpg,2022-10-30T14:46:00Z,,"Nach dem Fischsterben in dem Grenzfluss im August blieb unklar, woher genau die tödliche Substanz stammte. Fängt jetzt alles wieder von vorn an?
Hohe Salzwerte in der Oder? Beim letzten Mal gab es b… [+3600 chars]",,de,'Niedrigwasser'
https://www.morgenpost.de/berlin/article236785479/Ministerium-Erhoehter-Salzgehalt-in-Oder-beobachtet.html,https://www.morgenpost.de/berlin/article236785479/Ministerium-Erhoehter-Salzgehalt-in-Oder-beobachtet.html,0,www.morgenpost.de,Grenzfluss: Ministerium: Erhöhter Salzgehalt in Oder beobachtet,In der Oder ist ein erhöhter Salzgehalt festgestellt worden. Das bestätigte am Samstag das Umweltministerium in Potsdam mit Verweis auf Erkenntnisse des Landesamtes für Umwelt. Zuvor berichtete „Zeit online“.,https://img.morgenpost.de/img/berlin/crop236785477/6202601114-w820-cv16_9-q85/Fischsterben-in-Oder.jpg,2022-10-29T15:16:02Z,https://web.archive.org/web/20221029180833/https://www.morgenpost.de/berlin/article236785479/Ministerium-Erhoehter-Salzgehalt-in-Oder-beobachtet.html,Potsdam (dpa/bb). In der Oder ist ein erhöhter Salzgehalt festgestellt worden. Das bestätigte am Samstag das Umweltministerium in Potsdam mit Verweis auf Erkenntnisse des Landesamtes für Umwelt. Zuvo… [+2602 chars],,de,'Niedrigwasser'
https://www.zeit.de/news/2022-10/29/teilweise-noch-immer-niedrigwasser-in-thueringer-fluessen,https://www.zeit.de/news/2022-10/29/teilweise-noch-immer-niedrigwasser-in-thueringer-fluessen,0,www.zeit.de,Umwelt: Teilweise noch immer Niedrigwasser in Thüringer Flüssen,,,2022-10-29T13:58:45Z,https://web.archive.org/web/20221029142118/https://www.zeit.de/news/2022-10/29/teilweise-noch-immer-niedrigwasser-in-thueringer-fluessen,"When browsing with ads:
We collect personal data and also transmit it to third-party providers
 that help us improve and finance our digital content. Some of the information stored on your device, … [+732 chars]",,de,'Niedrigwasser'
